Ano;Turno;Município;Número;Candidato;Zona;Seção;Seções Agregadas;Votos;Local de Votação;Endereço Local de Votação;Bairro;
2024;1;FORTALEZA;50333;ADÃO FERNANDES;1;911;;1;ESCOLA MUNICIPAL ODNILRA CRUZ MOREIRA;AVENIDA DAS ADENANTERAS 800;CIDADE 2000;
2024;1;FORTALEZA;50333;ADÃO FERNANDES;2;85;;1;EEFM JOSE DE ALENCAR;RUA VENEZA, 84;MESSEJANA;
2024;1;FORTALEZA;50333;ADÃO FERNANDES;2;123;;1;EEFM JOSE DE ALENCAR;RUA VENEZA, 84;MESSEJANA;
2024;1;FORTALEZA;50333;ADÃO FERNANDES;2;545;;1;COLÉGIO SERAFICO NOSSA SENHORA DO BRASIL;AVENIDA FREI CIRILO 4454;MESSEJANA;
2024;1;FORTALEZA;50333;ADÃO FERNANDES;2;696;;1;SECRETARIA DA EDUCACAO - CAMBEBA;AVENIDA MINISTRO JOSE AMERICO, SN;CAMBEBA;
2024;1;FORTALEZA;50333;ADÃO FERNANDES;2;726;;1;EMEIF ANGELICA GURGEL;RUA DOUTOR PERGENTINO MAIA, 375;MESSEJANA;
2024;1;FORTALEZA;50333;ADÃO FERNANDES;2;750;;1;EMEIF GUIOMAR DA SILVA ALMEIDA;RUA PEROLINA DE MORAIS, 449;PAUPINA;
2024;1;FORTALEZA;50333;ADÃO FERNANDES;3;177;;1;SESC;RUA CLARINDO DE QUEIROZ, 1740;CENTRO;
2024;1;FORTALEZA;50333;ADÃO FERNANDES;3;224;;1;FACULDADE ARI DE SÁ;AV. HERÁCLITO GRAÇA, 826;CENTRO;
2024;1;FORTALEZA;50333;ADÃO FERNANDES;3;248;252;1;COLÉGIO ARI DE SÁ - PRÉ-VESTIBULAR - SEDE DUQUE DE CAXIAS;AV. DUQUE DE CAXIAS, 519;CENTRO;
2024;1;FORTALEZA;50333;ADÃO FERNANDES;3;423;;1;FACULDADE ARI DE SÁ;AV. HERÁCLITO GRAÇA, 826;CENTRO;
2024;1;FORTALEZA;50333;ADÃO FERNANDES;3;430;;1;FACULDADE ARI DE SÁ;AV. HERÁCLITO GRAÇA, 826;CENTRO;
2024;1;FORTALEZA;50333;ADÃO FERNANDES;80;146;;1;COLÉGIO MONSENHOR JOVINIANO BARRETO - INFANTIL;RUA FREI VIDAL, 1680;TAUAPE;
2024;1;FORTALEZA;50333;ADÃO FERNANDES;80;169;;1;COLÉGIO MONSENHOR JOVINIANO BARRETO;RUA FREI VIDAL 1621;TAUAPE;
2024;1;FORTALEZA;50333;ADÃO FERNANDES;80;319;;1;COLÉGIO SANTO INACIO;AVENIDA DESEMBARGADOR MOREIRA 2355;DIONISIO TORRES;
2024;1;FORTALEZA;50333;ADÃO FERNANDES;80;363;;1;INSTITUTO DE EDUCAÇÃO DO CEARÁ;RUA GRACILIANO RAMOS, 52;FÁTIMA;
2024;1;FORTALEZA;50333;ADÃO FERNANDES;82;124;;1;EEFM SALES CAMPOS;RUA JACINTO MATOS, 730;JACARECANGA;
2024;1;FORTALEZA;50333;ADÃO FERNANDES;82;240;;1;EEFM GOVERNADOR FLÁVIO MARCÍLIO;AV. PASTEUR, 575;PIRAMBU;
2024;1;FORTALEZA;50333;ADÃO FERNANDES;82;654;;1;COLÉGIO MANUEL DA SILVA - CARLITO PAMPLONA;AV. FRANCISCO SÁ, 4001;CARLITO PAMPLONA;
2024;1;FORTALEZA;50333;ADÃO FERNANDES;82;692;;1;CENTRO EDUCACIONAL SÃO MATEUS;AV. SARGENTO HERMÍNIO SAMPAIO, 2440;MONTE CASTELO;
2024;1;FORTALEZA;50333;ADÃO FERNANDES;83;99;;2;EEM  MARIANO MARTINS;AVENIDA SENADOR FERNANDES TÁVORA 1445;HENRIQUE JORGE;
2024;1;FORTALEZA;50333;ADÃO FERNANDES;83;522;;1;CENTRO DE FORMAÇÃO E DESENV. PARA PROFISSIONAIS DA EDUCAÇÃO - FORMACE;RUA PORTO VELHO, 401;JOÃO XXIII;
2024;1;FORTALEZA;50333;ADÃO FERNANDES;83;731;;1;EEMTI ANTONIETA SIQUEIRA;RUA GUARANI 04;HENRIQUE JORGE;
2024;1;FORTALEZA;50333;ADÃO FERNANDES;83;737;;1;EEMTI ANTONIETA SIQUEIRA;RUA GUARANI 04;HENRIQUE JORGE;
2024;1;FORTALEZA;50333;ADÃO FERNANDES;83;767;;1;CENTRO EDUCACIONAL BRASILEIRINHO;AVENIDA SENADOR FERNANDES TÁVORA, 1717;HENRIQUE JORGE;
2024;1;FORTALEZA;50333;ADÃO FERNANDES;83;788;;1;COLÉGIO DA POLÍCIA MILITAR DO CEARÁ GENERAL EDGARD FACÓ;AVENIDA MISTER HULL,  S/N - KM 1;ANTÔNIO BEZERRA;
2024;1;FORTALEZA;50333;ADÃO FERNANDES;83;793;;1;ESCOLA MUNICIPAL ADROALDO TEIXEIRA CASTELO;RUA ALAGOAS 2267;PICI;
2024;1;FORTALEZA;50333;ADÃO FERNANDES;85;185;;1;EEFM JOSE LEOPOLDINO DA SILVA FILHO - UV4;RUA QUATROCENTOS E QUARENTA E OITO, 1, 2A ETAPA;CONJUNTO CEARÁ I;
2024;1;FORTALEZA;50333;ADÃO FERNANDES;93;74;;1;EM JONATHAN DA ROCHA ALCOFORADO;RUA MARIA GOMES DE SÁ,1030 ARACAPÉ;MONDUBIM;
2024;1;FORTALEZA;50333;ADÃO FERNANDES;93;161;;1;CUCA JOSÉ WALTER;RUA 69, S/N;PREFEITO JOSÉ WALTER;
2024;1;FORTALEZA;50333;ADÃO FERNANDES;93;250;;1;ESCOLA MUNICIPAL ARI DE SA CAVALCANTE (JOSÉ WALTER);AV. H, 430 III ETAPA;PREFEITO JOSÉ WALTER;
2024;1;FORTALEZA;50333;ADÃO FERNANDES;93;305;;1;ESCOLA SANTANA;RUA 10, 1305;MONDUBIM;
2024;1;FORTALEZA;50333;ADÃO FERNANDES;94;190;;1;EM CASTELO DE CASTRO;RUA 43 1531;VILA VELHA;
2024;1;FORTALEZA;50333;ADÃO FERNANDES;94;196;;1;EEFM DONA HILZA DIOGO DE OLIVEIRA;AV. DOM ALOÍSIO LORSCHEIDER, 1040 - VILA VELHA;VILA VELHA;
2024;1;FORTALEZA;50333;ADÃO FERNANDES;94;198;;1;EEFM DONA HILZA DIOGO DE OLIVEIRA;AV. DOM ALOÍSIO LORSCHEIDER, 1040 - VILA VELHA;VILA VELHA;
2024;1;FORTALEZA;50333;ADÃO FERNANDES;94;200;;1;EEFM DONA HILZA DIOGO DE OLIVEIRA;AV. DOM ALOÍSIO LORSCHEIDER, 1040 - VILA VELHA;VILA VELHA;
2024;1;FORTALEZA;50333;ADÃO FERNANDES;94;201;;3;EMTI DEPUTADO ROBERTO MESQUITA;R. BETA,  SN;VILA VELHA;
2024;1;FORTALEZA;50333;ADÃO FERNANDES;94;202;;1;EMTI DEPUTADO ROBERTO MESQUITA;R. BETA,  SN;VILA VELHA;
2024;1;FORTALEZA;50333;ADÃO FERNANDES;94;203;;2;EMTI DEPUTADO ROBERTO MESQUITA;R. BETA,  SN;VILA VELHA;
2024;1;FORTALEZA;50333;ADÃO FERNANDES;94;205;;2;EMTI DEPUTADO ROBERTO MESQUITA;R. BETA,  SN;VILA VELHA;
2024;1;FORTALEZA;50333;ADÃO FERNANDES;94;206;;1;EMTI DEPUTADO ROBERTO MESQUITA;R. BETA,  SN;VILA VELHA;
2024;1;FORTALEZA;50333;ADÃO FERNANDES;94;207;;3;EMTI DEPUTADO ROBERTO MESQUITA;R. BETA,  SN;VILA VELHA;
2024;1;FORTALEZA;50333;ADÃO FERNANDES;94;322;;1;COLEGIO SALOME BASTOS;RUA DESEMBARGADOR HERMES PARAHYBA 1120;VILA VELHA;
2024;1;FORTALEZA;50333;ADÃO FERNANDES;94;327;;1;COLEGIO SALOME BASTOS;RUA DESEMBARGADOR HERMES PARAHYBA 1120;VILA VELHA;
2024;1;FORTALEZA;50333;ADÃO FERNANDES;94;330;;1;EM ANTONIO CORREIA LIMA;RUA HERMES PARAYBA, 934;VILA VELHA;
2024;1;FORTALEZA;50333;ADÃO FERNANDES;94;441;;1;EM ANTONIO CORREIA LIMA;RUA HERMES PARAYBA, 934;VILA VELHA;
2024;1;FORTALEZA;50333;ADÃO FERNANDES;94;483;;1;EMEIEF PROF JOSE PARSIFAL BARROSO;AV MAJOR ASSIS 1076;VILA VELHA;
2024;1;FORTALEZA;50333;ADÃO FERNANDES;94;700;;2;EMTI DEPUTADO ROBERTO MESQUITA;R. BETA,  SN;VILA VELHA;
2024;1;FORTALEZA;50333;ADÃO FERNANDES;94;759;;1;EMEIF HERONDINA LIMA CAVALCANTE;AV. AMBIENTALISTA ARY THIERS, 310;VILA VELHA;
2024;1;FORTALEZA;50333;ADÃO FERNANDES;94;780;;2;EMTI DEPUTADO ROBERTO MESQUITA;R. BETA,  SN;VILA VELHA;
2024;1;FORTALEZA;50333;ADÃO FERNANDES;94;798;;1;EM ANTONIO CORREIA LIMA;RUA HERMES PARAYBA, 934;VILA VELHA;
2024;1;FORTALEZA;50333;ADÃO FERNANDES;94;806;;3;COLÉGIO CIENTISTA;RUA 31, 330 - CONJUNTO POLAR;VILA VELHA;
2024;1;FORTALEZA;50333;ADÃO FERNANDES;94;821;;1;EMEIF HERONDINA LIMA CAVALCANTE;AV. AMBIENTALISTA ARY THIERS, 310;VILA VELHA;
2024;1;FORTALEZA;50333;ADÃO FERNANDES;94;824;;1;COLÉGIO CIENTISTA;RUA 31, 330 - CONJUNTO POLAR;VILA VELHA;
2024;1;FORTALEZA;50333;ADÃO FERNANDES;94;831;;2;EMTI DEPUTADO ROBERTO MESQUITA;R. BETA,  SN;VILA VELHA;
2024;1;FORTALEZA;50333;ADÃO FERNANDES;94;841;;1;EMEIF LORHAN MARQUES MEDEIROS;RUA CREUZA ROCHA, 255;JARDIM GUANABARA;
2024;1;FORTALEZA;50333;ADÃO FERNANDES;94;899;;1;EEMTI MONSENHOR DOURADO;AVENIDA SARGENTO HERMÍNIO SAMPAIO 4600;PADRE ANDRADE;
2024;1;FORTALEZA;50333;ADÃO FERNANDES;94;910;;1;EM CASTELO DE CASTRO;RUA 43 1531;VILA VELHA;
2024;1;FORTALEZA;50333;ADÃO FERNANDES;94;913;;1;EMEIF HERONDINA LIMA CAVALCANTE;AV. AMBIENTALISTA ARY THIERS, 310;VILA VELHA;
2024;1;FORTALEZA;50333;ADÃO FERNANDES;94;916;;1;COLEGIO SALOME BASTOS;RUA DESEMBARGADOR HERMES PARAHYBA 1120;VILA VELHA;
2024;1;FORTALEZA;50333;ADÃO FERNANDES;94;925;;2;COLÉGIO DOM QUINTINO;RUA CECIL SALGADO, 53;JARDIM GUANABARA;
2024;1;FORTALEZA;50333;ADÃO FERNANDES;94;927;;1;COLÉGIO EVOLUIR;RUA CÂNDIDO MAIA,109;ANTÔNIO BEZERRA;
2024;1;FORTALEZA;50333;ADÃO FERNANDES;94;929;;1;EMEIF FRANCISCO EDILSON PINHEIRO;RUA N, 35;VILA VELHA;
2024;1;FORTALEZA;50333;ADÃO FERNANDES;95;118;;1;EMEIEF MARIA HELENICE CAVALCANTE LEITE MARTINS;RUA MAIZA, S/N;CONJUNTO PALMEIRAS;
2024;1;FORTALEZA;50333;ADÃO FERNANDES;95;120;;1;EMEIEF MARIA HELENICE CAVALCANTE LEITE MARTINS;RUA MAIZA, S/N;CONJUNTO PALMEIRAS;
2024;1;FORTALEZA;50333;ADÃO FERNANDES;95;132;;1;EM PROFESSOR FRANCISCO DE MELO JABORANDI;AV. GOVERNADOR LEONEL BRIZOLA, 198;JANGURUSSU;
2024;1;FORTALEZA;50333;ADÃO FERNANDES;95;152;;1;EEFM ALMIRANTE TAMANDARÉ;RUA DO MANDACARU, 1048 CJ ALMIRANTE TAMANDARÉ;JANGURUSSU;
2024;1;FORTALEZA;50333;ADÃO FERNANDES;95;185;;1;DNIT;RODOVIA BR-116, KM 06;CAJAZEIRAS;
2024;1;FORTALEZA;50333;ADÃO FERNANDES;112;498;;1;COLEGIO MASTER SUL;RUA BENJAMIM MOURA, 631;CIDADE DOS FUNCIONÁRIOS;
2024;1;FORTALEZA;50333;ADÃO FERNANDES;112;499;;1;COLEGIO MASTER SUL;RUA BENJAMIM MOURA, 631;CIDADE DOS FUNCIONÁRIOS;
2024;1;FORTALEZA;50333;ADÃO FERNANDES;112;558;;1;INSTITUTO DE ASSISTÊNCIA E PROTEÇÃO SOCIAL - IAPS;RUA BARRA NOVA, N 1.000, CONJ. TANCREDO NEVES;JARDIM DAS OLIVEIRAS;
2024;1;FORTALEZA;50333;ADÃO FERNANDES;113;112;;1;COLÉGIO CHRISTUS BENFICA;RUA LUIS DE MIRANDA, 536;BENFICA;
2024;1;FORTALEZA;50333;ADÃO FERNANDES;113;158;;1;COLÉGIO MEDALHA MILAGROSA;RUA PADRE JOÃO PIAMARTA,  415;BOM FUTURO;
2024;1;FORTALEZA;50333;ADÃO FERNANDES;113;414;;1;COLÉGIO ART E MANHA;RUA SÃO MATEUS, 1020;VILA UNIÃO;
2024;1;FORTALEZA;50333;ADÃO FERNANDES;113;427;425, 428, 426;1;ESCOLA MUNICIPAL VICENTE FIALHO;RUA IRMA BAZET, 193;MONTESE;
2024;1;FORTALEZA;50333;ADÃO FERNANDES;114;71;;1;COLÉGIO INACIO COSTA;QUADRA L 303 CONJUNTO CASTELO BRANCO;PRESIDENTE KENNEDY;
2024;1;FORTALEZA;50333;ADÃO FERNANDES;114;116;;1;EMTI NOSSA SENHORA DE FÁTIMA (ANTIGA APOSTÓLICA/SEMINÁRIO);RUA SÍLVIO ROMERO 370;ÁLVARO WEYNE;
2024;1;FORTALEZA;50333;ADÃO FERNANDES;114;173;;1;COLÉGIO MANUEL DA SILVA (ÁLVARO WEYNE);RUA SÃO BERNARDO 181;ÁLVARO WEYNE;
2024;1;FORTALEZA;50333;ADÃO FERNANDES;114;197;;1;EM GABRIEL CAVALCANTE;QUADRA F 167 CONJUNTO CASTELO BRANCO;PRESIDENTE KENNEDY;
2024;1;FORTALEZA;50333;ADÃO FERNANDES;114;231;;1;EM DOM ANTONIO BATISTA DE FRAGOSO;AVENIDA FRANCISCO SÁ 7945;BARRA DO CEARÁ;
2024;1;FORTALEZA;50333;ADÃO FERNANDES;114;249;;1;CENTRO DE EDUCAÇÃO COMPLEMENTAR (CEDCE) - ANTIGO SESI;AVENIDA FRANCISCO SÁ 6623;BARRA DO CEARÁ;
2024;1;FORTALEZA;50333;ADÃO FERNANDES;114;250;;2;CENTRO DE EDUCAÇÃO COMPLEMENTAR (CEDCE) - ANTIGO SESI;AVENIDA FRANCISCO SÁ 6623;BARRA DO CEARÁ;
2024;1;FORTALEZA;50333;ADÃO FERNANDES;114;339;;1;EMTI ALDEMIR MARTINS;AV. FRANCISCO SÁ, 7460;BARRA DO CEARÁ;
2024;1;FORTALEZA;50333;ADÃO FERNANDES;115;340;;1;SESI - PARANGABA;AVENIDA JOÃO PESSOA, 6754;PARANGABA;
2024;1;FORTALEZA;50333;ADÃO FERNANDES;115;394;;1;COLEGIO JIM WILLSON;AV. AUGUSTO DOS ANJOS, 1915;VILA PERI;
2024;1;FORTALEZA;50333;ADÃO FERNANDES;115;405;;1;EEFM PROFESSOR MARIO SCHENBERG;RUA AMERICO ROCHA LIMA 835;MANOEL SÁTIRO;
2024;1;FORTALEZA;50333;ADÃO FERNANDES;116;27;;1;EM IRMA ROCHA;RUA EMILIO DE MENEZES 2515;GRANJA PORTUGAL;
2024;1;FORTALEZA;50333;ADÃO FERNANDES;116;162;;1;EM SEBASTIAO DE ABREU;RUA GERALDO BARBOSA 1065;BOM JARDIM;
2024;1;FORTALEZA;50333;ADÃO FERNANDES;116;300;;1;CRAS GRANJA PORTUGAL;RUA HUMBERTO LOMEU 1130;GRANJA PORTUGAL;
2024;1;FORTALEZA;50333;ADÃO FERNANDES;116;398;;1;COMPLEXO SOCIAL MAIS INFÂNCIA MARIA DE LOURDES MOREIRA LEITE LIMA;RUA ARAGUAIANA, 77;JOÃO XXIII;
2024;1;FORTALEZA;50333;ADÃO FERNANDES;116;448;;1;EM XV DE OUTUBRO - TEMPORÁRIO;RUA GUARANI, 2030;BONSUCESSO;
2024;1;FORTALEZA;50333;ADÃO FERNANDES;116;467;;1;CRAS GRANJA PORTUGAL;RUA HUMBERTO LOMEU 1130;GRANJA PORTUGAL;
2024;1;FORTALEZA;50333;ADÃO FERNANDES;116;498;;1;EM JOAO MENDES DE ANDRADE;RUA B, 1366;BOM JARDIM;
2024;1;FORTALEZA;50333;ADÃO FERNANDES;117;261;;1;EEFM PAULO ELPIDIO;RUA PROF MANOEL DE CASTRO 1202;SIQUEIRA;
2024;1;FORTALEZA;50333;ADÃO FERNANDES;117;270;;1;ESCOLA MUNICIPAL HERBERT DE SOUSA;RUA URUCUTUBA 1599;BOM JARDIM;
2024;1;FORTALEZA;50333;ADÃO FERNANDES;117;281;;1;EEFM PAULO ELPIDIO;RUA PROF MANOEL DE CASTRO 1202;SIQUEIRA;
2024;1;FORTALEZA;50333;ADÃO FERNANDES;117;467;490;1;COLÉGIO CEARENSE TOTAL;AVENIDA D, 85;CONJUNTO ESPERANÇA;
2024;1;FORTALEZA;50333;ADÃO FERNANDES;118;16;;1;EM SANTA TEREZINHA;RUA AFONSO LOPES, 1095;PARQUE DOIS IRMÃOS;
2024;1;FORTALEZA;50333;ADÃO FERNANDES;118;220;;1;EEMTI INTEGRADA 2 DE MAIO;AVENIDA DA SAUDADE, S/N;PASSARÉ;
2024;1;FORTALEZA;50333;ADÃO FERNANDES;118;523;;1;EM MARCOS VALENTIM PEREIRA DE SOUSA;RUA FREIRE ALEMÃO,91;SERRINHA;
TOTAL;;;;;;;;114;
