Ano;Turno;Município;Número;Candidato;Zona;Seção;Seções Agregadas;Votos;Local de Votação;Endereço Local de Votação;Bairro;
2024;1;FORTALEZA;22722;ALISSON SILVESTRE;1;35;;1;UNINTA - FACULDADE UNINTA FORTALEZA;RUA VILEBALDO AGUIAR,133;COCÓ;
2024;1;FORTALEZA;22722;ALISSON SILVESTRE;1;143;;1;ESCOLA ESTADUAL ARQUITETO ROGERIO FROES;AVENIDA DAS GRAVIOLAS 1000;CIDADE 2000;
2024;1;FORTALEZA;22722;ALISSON SILVESTRE;1;342;;1;ESCOLA DE GASTRONOMIA SOCIAL IVENS DIAS BRANCO;RUA MANUEL DIAS BRANCO,80;CAIS DO PORTO;
2024;1;FORTALEZA;22722;ALISSON SILVESTRE;1;397;;1;ESCOLA MUNICIPAL SAO VICENTE DE PAULO;AVENIDA ZEZE DIOGO 1247;CAIS DO PORTO;
2024;1;FORTALEZA;22722;ALISSON SILVESTRE;1;400;;1;ESCOLA MUNICIPAL SAO VICENTE DE PAULO;AVENIDA ZEZE DIOGO 1247;CAIS DO PORTO;
2024;1;FORTALEZA;22722;ALISSON SILVESTRE;1;401;;1;ESCOLA MUNICIPAL PROF. GODOFREDO DE CASTRO FILHO;AVENIDA JOSÉ SABÓIA  905;CAIS DO PORTO;
2024;1;FORTALEZA;22722;ALISSON SILVESTRE;1;476;;1;ESCOLA MIGUEL FIALHO - ANTIGO PADRE JOSÉ NILSON ;RUA CORONEL MANUEL JESUÍNO 225;MUCURIPE;
2024;1;FORTALEZA;22722;ALISSON SILVESTRE;1;478;;1;ESCOLA MIGUEL FIALHO - ANTIGO PADRE JOSÉ NILSON ;RUA CORONEL MANUEL JESUÍNO 225;MUCURIPE;
2024;1;FORTALEZA;22722;ALISSON SILVESTRE;1;482;;1;COLEGIO FARIAS BRITO - PRÉ UNIVERSITARIO - JULIO ABREU;AVENIDA JULIO ABREU, 284;VARJOTA;
2024;1;FORTALEZA;22722;ALISSON SILVESTRE;1;486;;1;COLEGIO ANTARES - OCELO PINHEIRO;RUA PROFESSOR OCELO PINHEIRO 101;PAPICU;
2024;1;FORTALEZA;22722;ALISSON SILVESTRE;1;554;;1;ESCOLA MUNICIPAL JOSE RAMOS TORRES DE MELO;AVENIDA DA ABOLIÇÃO 3984;MUCURIPE;
2024;1;FORTALEZA;22722;ALISSON SILVESTRE;1;613;;1;ESCOLA ESTADUAL MURILO BORGES;RUA DO ENTARDECER 90;VICENTE PINZON;
2024;1;FORTALEZA;22722;ALISSON SILVESTRE;1;616;;1;ESCOLA PROFISSIONAL MARIA ANGELA DA SILVEIRA BORGES;RUA PINTOR ANTONIO BANDEIRA, S/N;VICENTE PINZON;
2024;1;FORTALEZA;22722;ALISSON SILVESTRE;1;650;;1;ESCOLA ESTADUAL MARIA JOSE MEDEIROS;RUA DESEMBARGADOR LAURO NOGUEIRA 1240;PAPICU;
2024;1;FORTALEZA;22722;ALISSON SILVESTRE;1;665;;1;FANOR - FACULDADE NORDESTE;AVENIDA SANTOS DUMONT 7800;DE LOURDES;
2024;1;FORTALEZA;22722;ALISSON SILVESTRE;1;670;;2;UNINTA - FACULDADE UNINTA FORTALEZA;RUA VILEBALDO AGUIAR,133;COCÓ;
2024;1;FORTALEZA;22722;ALISSON SILVESTRE;1;697;;1;FACULDADE FARIAS BRITO - CASTRO MONTE;RUA CASTRO MONTE 1364;VARJOTA;
2024;1;FORTALEZA;22722;ALISSON SILVESTRE;1;795;;1;ESCOLA MUNICIPAL PROF BELARMINA CAMPOS;RUA MANOEL RODRIGUES MONTEIRO, 840;VICENTE PINZON;
2024;1;FORTALEZA;22722;ALISSON SILVESTRE;1;797;;1;CRECHE RACHEL GUIMARÃES MARTINS BARBOSA;VIA DE PEDRESTE LESTE OESTE 01;CAIS DO PORTO;
2024;1;FORTALEZA;22722;ALISSON SILVESTRE;1;799;;1;ESCOLA ESTADUAL ARQUITETO ROGERIO FROES;AVENIDA DAS GRAVIOLAS 1000;CIDADE 2000;
2024;1;FORTALEZA;22722;ALISSON SILVESTRE;1;826;;1;ESCOLA MUNICIPAL DOM ALOISIO LORSCHEIDER;RUA JULIO SILVA, 450;PRAIA DO FUTURO II;
2024;1;FORTALEZA;22722;ALISSON SILVESTRE;1;846;;1;CRECHE RACHEL GUIMARÃES MARTINS BARBOSA;VIA DE PEDRESTE LESTE OESTE 01;CAIS DO PORTO;
2024;1;FORTALEZA;22722;ALISSON SILVESTRE;1;855;;1;ESCOLA MUNICIPAL FREI TITO DE ALENCAR LIMA;AVENIDA DIOGUINHO 5927;VICENTE PINZON;
2024;1;FORTALEZA;22722;ALISSON SILVESTRE;1;861;;2;ESCOLA MUNICIPAL ODNILRA CRUZ MOREIRA;AVENIDA DAS ADENANTERAS 800;CIDADE 2000;
2024;1;FORTALEZA;22722;ALISSON SILVESTRE;1;863;;1;FANOR - FACULDADE NORDESTE;AVENIDA SANTOS DUMONT 7800;DE LOURDES;
2024;1;FORTALEZA;22722;ALISSON SILVESTRE;1;888;;1;ESCOLA MUNICIPAL ODNILRA CRUZ MOREIRA;AVENIDA DAS ADENANTERAS 800;CIDADE 2000;
2024;1;FORTALEZA;22722;ALISSON SILVESTRE;1;904;;2;COLEGIO ARI DE SA - MONSENHOR CATAO;RUA MONSENHOR CATAO, 1655;ALDEOTA;
2024;1;FORTALEZA;22722;ALISSON SILVESTRE;1;921;;1;EEFM - HELENITA MOTA;RUA AMANCIO FILOMENO,720;CAIS DO PORTO;
2024;1;FORTALEZA;22722;ALISSON SILVESTRE;1;922;;1;ESCOLA MUNICIPAL PROF BELARMINA CAMPOS;RUA MANOEL RODRIGUES MONTEIRO, 840;VICENTE PINZON;
2024;1;FORTALEZA;22722;ALISSON SILVESTRE;1;923;;1;CRECHE RACHEL GUIMARÃES MARTINS BARBOSA;VIA DE PEDRESTE LESTE OESTE 01;CAIS DO PORTO;
2024;1;FORTALEZA;22722;ALISSON SILVESTRE;1;929;;1;COLEGIO ESPACO ABERTO - BENTO ALBUQUERQUE;RUA BENTO ALBUQUERQUE 1671;PAPICU;
2024;1;FORTALEZA;22722;ALISSON SILVESTRE;2;56;;1;EM PROFª FERNANDA MARIA DE ALENCAR COLARES;AV PROF. ARTHUR DE CARVALHO, 1540;LAGOA REDONDA;
2024;1;FORTALEZA;22722;ALISSON SILVESTRE;2;86;;1;EEFM JOSE DE ALENCAR;RUA VENEZA, 84;MESSEJANA;
2024;1;FORTALEZA;22722;ALISSON SILVESTRE;2;110;;1;EMEIF DEMOCRITO ROCHA;RUA PADRE PEDRO DE ALENCAR, 2012;MESSEJANA;
2024;1;FORTALEZA;22722;ALISSON SILVESTRE;2;126;;1;EM PROFª TELINA BARBOSA DA  COSTA;RUA PERGENTINO MAIA, 811;MESSEJANA;
2024;1;FORTALEZA;22722;ALISSON SILVESTRE;2;127;;1;EM PROFª TELINA BARBOSA DA  COSTA;RUA PERGENTINO MAIA, 811;MESSEJANA;
2024;1;FORTALEZA;22722;ALISSON SILVESTRE;2;133;;1;EEM DEPUTADO PAULO BENEVIDES;RUA ANGELICA GURGEL, 186;MESSEJANA;
2024;1;FORTALEZA;22722;ALISSON SILVESTRE;2;142;;1;EM JOSEFA BARROS DE ALENCAR;RUA DOUTOR JOAQUIM BENTO 590;MESSEJANA;
2024;1;FORTALEZA;22722;ALISSON SILVESTRE;2;160;;1;INSTITUTO FREI JOAO PEDRO DE SEXTO;AVENIDA FREI CIRILO, 4241;MESSEJANA;
2024;1;FORTALEZA;22722;ALISSON SILVESTRE;2;168;;1;PATRONATO PADRE LUIZ BARBOSA MOREIRA;RUA CEL GUILHERME ALENCAR, 121;MESSEJANA;
2024;1;FORTALEZA;22722;ALISSON SILVESTRE;2;403;;1;EEM DEPUTADO PAULO BENEVIDES;RUA ANGELICA GURGEL, 186;MESSEJANA;
2024;1;FORTALEZA;22722;ALISSON SILVESTRE;2;407;;1;EEM LICEU DE MESSEJANA;AVENIDA WASHINGTON SOARES 7702;MESSEJANA;
2024;1;FORTALEZA;22722;ALISSON SILVESTRE;2;425;;1;EEM DEPUTADO PAULO BENEVIDES;RUA ANGELICA GURGEL, 186;MESSEJANA;
2024;1;FORTALEZA;22722;ALISSON SILVESTRE;2;462;;1;EEFM JOSE DE ALENCAR;RUA VENEZA, 84;MESSEJANA;
2024;1;FORTALEZA;22722;ALISSON SILVESTRE;2;486;;1;CMES ANISIO TEIXEIRA;TRAVESSA DO GUARANI, 355;PAUPINA;
2024;1;FORTALEZA;22722;ALISSON SILVESTRE;2;492;;1;SECRETARIA DA EDUCACAO - CAMBEBA;AVENIDA MINISTRO JOSE AMERICO, SN;CAMBEBA;
2024;1;FORTALEZA;22722;ALISSON SILVESTRE;2;539;;1;EEFM JOSE DE ALENCAR;RUA VENEZA, 84;MESSEJANA;
2024;1;FORTALEZA;22722;ALISSON SILVESTRE;2;652;;2;PATRONATO PADRE LUIZ BARBOSA MOREIRA;RUA CEL GUILHERME ALENCAR, 121;MESSEJANA;
2024;1;FORTALEZA;22722;ALISSON SILVESTRE;2;654;;1;CMES ANISIO TEIXEIRA;TRAVESSA DO GUARANI, 355;PAUPINA;
2024;1;FORTALEZA;22722;ALISSON SILVESTRE;2;676;;1;CMES ANISIO TEIXEIRA;TRAVESSA DO GUARANI, 355;PAUPINA;
2024;1;FORTALEZA;22722;ALISSON SILVESTRE;2;704;;1;CMES ANISIO TEIXEIRA;TRAVESSA DO GUARANI, 355;PAUPINA;
2024;1;FORTALEZA;22722;ALISSON SILVESTRE;2;723;;1;EMEIF GUIOMAR DA SILVA ALMEIDA;RUA PEROLINA DE MORAIS, 449;PAUPINA;
2024;1;FORTALEZA;22722;ALISSON SILVESTRE;2;726;;1;EMEIF ANGELICA GURGEL;RUA DOUTOR PERGENTINO MAIA, 375;MESSEJANA;
2024;1;FORTALEZA;22722;ALISSON SILVESTRE;2;731;;1;EEFM GOV LUIZ DE GONZAGA FONSECA MOTA;RUA SANTA ROSA, 407;COAÇU;
2024;1;FORTALEZA;22722;ALISSON SILVESTRE;2;734;;1;EEFM JOSE DE ALENCAR;RUA VENEZA, 84;MESSEJANA;
2024;1;FORTALEZA;22722;ALISSON SILVESTRE;2;736;;1;EM PROFª TELINA BARBOSA DA  COSTA;RUA PERGENTINO MAIA, 811;MESSEJANA;
2024;1;FORTALEZA;22722;ALISSON SILVESTRE;2;755;;1;FACULDADE ATENEU DO CEARÁ;AV. COLETOR ANTONIO GADELHA, 621;MESSEJANA;
2024;1;FORTALEZA;22722;ALISSON SILVESTRE;2;778;;1;EM PROFª TELINA BARBOSA DA  COSTA;RUA PERGENTINO MAIA, 811;MESSEJANA;
2024;1;FORTALEZA;22722;ALISSON SILVESTRE;2;784;;1;COLÉGIO CHRISTUS SUL;AV. ENG. LEAL LIMA VERDE, 2265;JOSÉ DE ALENCAR;
2024;1;FORTALEZA;22722;ALISSON SILVESTRE;2;794;;1;FACULDADE ATENEU DO CEARÁ;AV. COLETOR ANTONIO GADELHA, 621;MESSEJANA;
2024;1;FORTALEZA;22722;ALISSON SILVESTRE;2;800;;1;FACULDADE ATENEU DO CEARÁ;AV. COLETOR ANTONIO GADELHA, 621;MESSEJANA;
2024;1;FORTALEZA;22722;ALISSON SILVESTRE;2;802;;1;PATRONATO PADRE LUIZ BARBOSA MOREIRA;RUA CEL GUILHERME ALENCAR, 121;MESSEJANA;
2024;1;FORTALEZA;22722;ALISSON SILVESTRE;2;810;;1;ESCOLA MUNICIPAL ISABEL FERREIRA;RUA ISABEL FERREIRA, 1000 - CONJ. CURIÓ;LAGOA REDONDA;
2024;1;FORTALEZA;22722;ALISSON SILVESTRE;2;820;;1;ETI MARIA ODETE DA SILVA COLARES;RUA CEL JOÃO DE OLIVEIRA, 687;MESSEJANA;
2024;1;FORTALEZA;22722;ALISSON SILVESTRE;2;831;;1;COLÉGIO CHRISTUS SUL;AV. ENG. LEAL LIMA VERDE, 2265;JOSÉ DE ALENCAR;
2024;1;FORTALEZA;22722;ALISSON SILVESTRE;3;1;;1;COLÉGIO TIRADENTES VESTIBULARES;RUA PEDRO I, 1106;CENTRO;
2024;1;FORTALEZA;22722;ALISSON SILVESTRE;3;3;;1;COLÉGIO TIRADENTES VESTIBULARES;RUA PEDRO I, 1106;CENTRO;
2024;1;FORTALEZA;22722;ALISSON SILVESTRE;3;6;29, 202;1;SENAI - UNIDADE JACARECANGA;AV. PADRE IBIAPINA, 1280;JACARECANGA;
2024;1;FORTALEZA;22722;ALISSON SILVESTRE;3;9;;1;COLÉGIO TIRADENTES VESTIBULARES;RUA PEDRO I, 1106;CENTRO;
2024;1;FORTALEZA;22722;ALISSON SILVESTRE;3;116;26;1;SENAI - UNIDADE JACARECANGA;AV. PADRE IBIAPINA, 1280;JACARECANGA;
2024;1;FORTALEZA;22722;ALISSON SILVESTRE;3;124;;1;COLÉGIO ESTADUAL LICEU DO CEARÁ;PRAÇA GUSTAVO BARROSO, 01;JACARECANGA;
2024;1;FORTALEZA;22722;ALISSON SILVESTRE;3;177;;1;SESC;RUA CLARINDO DE QUEIROZ, 1740;CENTRO;
2024;1;FORTALEZA;22722;ALISSON SILVESTRE;3;188;;1;COLÉGIO MILITAR DO CORPO DE BOMBEIROS;RUA ADRIANO MARTINS, 436;JACARECANGA;
2024;1;FORTALEZA;22722;ALISSON SILVESTRE;3;225;;1;FACULDADE ARI DE SÁ;AV. HERÁCLITO GRAÇA, 826;CENTRO;
2024;1;FORTALEZA;22722;ALISSON SILVESTRE;3;239;218;1;COLÉGIO ESTADUAL JUSTINIANO DE SERPA;AV. SANTOS DUMONT, 56;CENTRO;
2024;1;FORTALEZA;22722;ALISSON SILVESTRE;3;289;294;1;COLÉGIO ESTADUAL JUSTINIANO DE SERPA;AV. SANTOS DUMONT, 56;CENTRO;
2024;1;FORTALEZA;22722;ALISSON SILVESTRE;3;290;293;1;COLÉGIO ESTADUAL JUSTINIANO DE SERPA;AV. SANTOS DUMONT, 56;CENTRO;
2024;1;FORTALEZA;22722;ALISSON SILVESTRE;3;304;262, 311;1;EEMTI VISCONDE DO RIO BRANCO;AV. DOM MANUEL, 1803;CENTRO;
2024;1;FORTALEZA;22722;ALISSON SILVESTRE;3;382;;1;UNICHRISTUS ALDEOTA;RUA VISCONDE DE MAUÁ, 1940;ALDEOTA;
2024;1;FORTALEZA;22722;ALISSON SILVESTRE;3;397;;1;RECEITA FEDERAL (SUPER. DE ADM. DO MIN. DA ECON. NO CEARÁ);RUA BARÃO DE ARACATI, 909;ALDEOTA;
2024;1;FORTALEZA;22722;ALISSON SILVESTRE;3;428;;1;FACULDADE ARI DE SÁ;AV. HERÁCLITO GRAÇA, 826;CENTRO;
2024;1;FORTALEZA;22722;ALISSON SILVESTRE;3;448;;1;EEFM SANTA LUZIA;RUA JOÃO CORDEIRO, 711;PRAIA DE IRACEMA;
2024;1;FORTALEZA;22722;ALISSON SILVESTRE;3;450;;1;EEFM SANTA LUZIA;RUA JOÃO CORDEIRO, 711;PRAIA DE IRACEMA;
2024;1;FORTALEZA;22722;ALISSON SILVESTRE;3;499;;1;IDEAL CLUBE;AV. MONSENHOR TABOSA,  1381;MEIRELES;
2024;1;FORTALEZA;22722;ALISSON SILVESTRE;3;501;;1;IDEAL CLUBE;AV. MONSENHOR TABOSA,  1381;MEIRELES;
2024;1;FORTALEZA;22722;ALISSON SILVESTRE;3;511;517;1;CENTRO DE PASTORAL MARIA, MÃE DA IGREJA;RUA RODRIGUES JÚNIOR, 300;CENTRO;
2024;1;FORTALEZA;22722;ALISSON SILVESTRE;3;525;;1;COLÉGIO ANTARES (PRAIA DE IRACEMA);RUA HISTORIADOR GUARINO ALVES, 95;PRAIA DE IRACEMA;
2024;1;FORTALEZA;22722;ALISSON SILVESTRE;3;533;;1;UNICHRISTUS ALDEOTA;RUA VISCONDE DE MAUÁ, 1940;ALDEOTA;
2024;1;FORTALEZA;22722;ALISSON SILVESTRE;3;559;;1;IEP - INST. DE EDUCAÇÃO PORTAL - UNIDADE FORTALEZA;AV. PADRE IBIAPINA, 1243;CENTRO;
2024;1;FORTALEZA;22722;ALISSON SILVESTRE;3;563;;1;INSTITUTO CEARENSE DE EDUCAÇÃO DE SURDOS - ICES;AV. RUI BARBOSA, 1970;ALDEOTA;
2024;1;FORTALEZA;22722;ALISSON SILVESTRE;3;576;;1;UNICHRISTUS ALDEOTA;RUA VISCONDE DE MAUÁ, 1940;ALDEOTA;
2024;1;FORTALEZA;22722;ALISSON SILVESTRE;3;582;;1;ESCOLA DE SAÚDE PÚBLICA DO CEARÁ;AV. ANTÔNIO JUSTA, 3161;MEIRELES;
2024;1;FORTALEZA;22722;ALISSON SILVESTRE;3;586;;1;ESCOLA DE SAÚDE PÚBLICA DO CEARÁ;AV. ANTÔNIO JUSTA, 3161;MEIRELES;
2024;1;FORTALEZA;22722;ALISSON SILVESTRE;3;595;;1;COLÉGIO ANTARES (RUA BARBOSA DE FREITAS);RUA BARBOSA DE FREITAS, 2058;ALDEOTA;
2024;1;FORTALEZA;22722;ALISSON SILVESTRE;3;604;;1;COLÉGIO SANTA CECÍLIA;AV. SENADOR VIRGÍLIO TÁVORA, 2000;ALDEOTA;
2024;1;FORTALEZA;22722;ALISSON SILVESTRE;3;623;;1;COLÉGIO BATISTA - SANTOS DUMONT;RUA DESEMBARGADOR LEITE ALBUQUERQUE, 1056;ALDEOTA;
2024;1;FORTALEZA;22722;ALISSON SILVESTRE;3;626;;1;COLÉGIO BATISTA - SANTOS DUMONT;RUA DESEMBARGADOR LEITE ALBUQUERQUE, 1056;ALDEOTA;
2024;1;FORTALEZA;22722;ALISSON SILVESTRE;80;118;;1;EEM YOLANDA QUEIROZ;AV. GAL. MURILO BORGES, 864;ALTO DA BALANÇA;
2024;1;FORTALEZA;22722;ALISSON SILVESTRE;80;134;;1;EEFM JOAQUIM ANTÔNIO ALBANO;RUA JULIO SIQUEIRA 390;DIONISIO TORRES;
2024;1;FORTALEZA;22722;ALISSON SILVESTRE;80;162;;1;AABB - ASSOCIAÇÃO ATLÉTICA BANCO DO BRASIL;AV BARAO DE STUDART, 2917;DIONISIO TORRES;
2024;1;FORTALEZA;22722;ALISSON SILVESTRE;80;173;;2;CENTRO EDUC. DA JUV. PE. JOÃO PIAMARTA - AGUANAMBI;AV. AGUANAMBI, 2479;FÁTIMA;
2024;1;FORTALEZA;22722;ALISSON SILVESTRE;80;198;;1;EEFM PROFª  MARIA CONCEICÃO PORFÍRIO TELES;RUA MONTE CRISTO, 177;AEROLÂNDIA;
2024;1;FORTALEZA;22722;ALISSON SILVESTRE;80;199;;1;EEFM PROFª  MARIA CONCEICÃO PORFÍRIO TELES;RUA MONTE CRISTO, 177;AEROLÂNDIA;
2024;1;FORTALEZA;22722;ALISSON SILVESTRE;80;214;;1;EM PROFESSORA EDITH BRAGA;RUA CAPITAO VASCONCELOS 1061;ALTO DA BALANÇA;
2024;1;FORTALEZA;22722;ALISSON SILVESTRE;80;221;;1;EM PROFESSORA EDITH BRAGA;RUA CAPITAO VASCONCELOS 1061;ALTO DA BALANÇA;
2024;1;FORTALEZA;22722;ALISSON SILVESTRE;80;229;;1;EMEIF PROFª ANTONIETA CALS;RUA MONSENHOR SALAZAR 1480;TAUAPE;
2024;1;FORTALEZA;22722;ALISSON SILVESTRE;80;234;;2;EMEIF PROFª ANTONIETA CALS;RUA MONSENHOR SALAZAR 1480;TAUAPE;
2024;1;FORTALEZA;22722;ALISSON SILVESTRE;80;237;;1;EEFM NOEL HUGNEN OLIVEIRA PAIVA;RUA MONSENHOR SALAZAR 279;TAUAPE;
2024;1;FORTALEZA;22722;ALISSON SILVESTRE;80;246;;1;EEFM NOEL HUGNEN OLIVEIRA PAIVA;RUA MONSENHOR SALAZAR 279;TAUAPE;
2024;1;FORTALEZA;22722;ALISSON SILVESTRE;80;255;;2;SALÃO PAROQUIAL SÃO JOAO DO TAUAPE;RUA MONSENHOR SALAZAR, 279;TAUAPE;
2024;1;FORTALEZA;22722;ALISSON SILVESTRE;80;274;;1;ESCOLA MUNICIPAL HAROLDO JORGE BRAUN VIEIRA;AV LAURO VIEIRA CHAVES, 2001;VILA UNIÃO;
2024;1;FORTALEZA;22722;ALISSON SILVESTRE;80;277;;1;ESCOLA MUNICIPAL HAROLDO JORGE BRAUN VIEIRA;AV LAURO VIEIRA CHAVES, 2001;VILA UNIÃO;
2024;1;FORTALEZA;22722;ALISSON SILVESTRE;80;278;;1;EEF GAL.  MANUEL CORDEIRO NETO;RUA JORGE ACURCIO, 900;VILA UNIÃO;
2024;1;FORTALEZA;22722;ALISSON SILVESTRE;80;312;;2;COLÉGIO CHRISTUS - DIONÍSIO TORRES;RUA ISRAEL BEZERRA 630;DIONISIO TORRES;
2024;1;FORTALEZA;22722;ALISSON SILVESTRE;80;313;;1;COLÉGIO CHRISTUS - DIONÍSIO TORRES;RUA ISRAEL BEZERRA 630;DIONISIO TORRES;
2024;1;FORTALEZA;22722;ALISSON SILVESTRE;80;393;;1;EEM GOV. ADAUTO BEZERRA;RUA MONSENHOR LIBERATO, 1850;FÁTIMA;
2024;1;FORTALEZA;22722;ALISSON SILVESTRE;80;397;;1;EEM GOV. ADAUTO BEZERRA;RUA MONSENHOR LIBERATO, 1850;FÁTIMA;
2024;1;FORTALEZA;22722;ALISSON SILVESTRE;80;410;;1;EEFM PROFª  MARIA CONCEICÃO PORFÍRIO TELES;RUA MONTE CRISTO, 177;AEROLÂNDIA;
2024;1;FORTALEZA;22722;ALISSON SILVESTRE;80;415;;1;COLÉGIO SANTO INACIO;AVENIDA DESEMBARGADOR MOREIRA 2355;DIONISIO TORRES;
2024;1;FORTALEZA;22722;ALISSON SILVESTRE;80;423;;1;COLÉGIO ANTARES FÁTIMA (VILA UNIÃO);RUA ALBERTO MONTEZUMA, 235;VILA UNIÃO;
2024;1;FORTALEZA;22722;ALISSON SILVESTRE;80;432;;1;EEFM PROFª  MARIA CONCEICÃO PORFÍRIO TELES;RUA MONTE CRISTO, 177;AEROLÂNDIA;
2024;1;FORTALEZA;22722;ALISSON SILVESTRE;82;32;;1;SECRETARIA DE DESENVOLVIMENTO AGRÁRIO DO ESTADO DO CEARÁ;AV. BEZERRA DE MENEZES, 1620;SÃO GERARDO;
2024;1;FORTALEZA;22722;ALISSON SILVESTRE;82;64;;1;COLÉGIO MENINO JESUS DE PRAGA;RUA ANA FACÓ, 140;CARLITO PAMPLONA;
2024;1;FORTALEZA;22722;ALISSON SILVESTRE;82;68;;1;COLÉGIO MANUEL DA SILVA - CARLITO PAMPLONA;AV. FRANCISCO SÁ, 4001;CARLITO PAMPLONA;
2024;1;FORTALEZA;22722;ALISSON SILVESTRE;82;86;;1;ESCOLA MUNICIPAL SEBASTIANA ALDIGUERI;AV. DOUTOR THEBERGE, 448;CRISTO REDENTOR;
2024;1;FORTALEZA;22722;ALISSON SILVESTRE;82;92;;2;ESCOLA MUNICIPAL PROFESSOR MARTINZ DE AGUIAR - EI/EF;RUA BERNARDO PORTO, 490;MONTE CASTELO;
2024;1;FORTALEZA;22722;ALISSON SILVESTRE;82;103;;1;EEFM LIONS JANGADA - EEMTI;RUA CAMÉLIA, 352;CRISTO REDENTOR;
2024;1;FORTALEZA;22722;ALISSON SILVESTRE;82;107;;1;CENTRO DE CIDADANIA GOV. VIRGÍLIO TÁVORA - CCDH;AV. MONSENHOR HELIO CAMPOS, 178;CRISTO REDENTOR;
2024;1;FORTALEZA;22722;ALISSON SILVESTRE;82;109;;1;ESCOLA MUNICIPAL SANTA TEREZA - EI/EF;RUA MONSENHOR HÉLIO CAMPOS, 90;CRISTO REDENTOR;
2024;1;FORTALEZA;22722;ALISSON SILVESTRE;82;127;;1;EEFM SALES CAMPOS;RUA JACINTO MATOS, 730;JACARECANGA;
2024;1;FORTALEZA;22722;ALISSON SILVESTRE;82;130;;1;POSTO DE SAÚDE CARLOS RIBEIRO;RUA JACINTO MATOS, 944;JACARECANGA;
2024;1;FORTALEZA;22722;ALISSON SILVESTRE;82;192;;1;CENTRO EDUCACIONAL SÃO MATEUS;AV. SARGENTO HERMÍNIO SAMPAIO, 2440;MONTE CASTELO;
2024;1;FORTALEZA;22722;ALISSON SILVESTRE;82;198;;1;ESCOLA MUNICIPAL FAUSTINO DE ALBUQUERQUE - EI/EF;RUA AMARO CAVALCANTE, 221;MONTE CASTELO;
2024;1;FORTALEZA;22722;ALISSON SILVESTRE;82;203;;1;EEFM CLÁUDIO MARTINS;RUA DEMÓCRITO ROCHA, 400;MONTE CASTELO;
2024;1;FORTALEZA;22722;ALISSON SILVESTRE;82;213;;1;INSTITUTO MATER AMABILIS;RUA PADRE ANCHIETA, 438;MONTE CASTELO;
2024;1;FORTALEZA;22722;ALISSON SILVESTRE;82;225;;1;CENTRO EDUCACIONAL MOEMA TÁVORA;RUA MARCÍLIO DIAS, 485;PIRAMBU;
2024;1;FORTALEZA;22722;ALISSON SILVESTRE;82;231;;1;COLÉGIO UNIVERSO MENINO JESUS;RUA DOM QUINTINO, 934;JACARECANGA;
2024;1;FORTALEZA;22722;ALISSON SILVESTRE;82;239;;1;EEFM GOVERNADOR FLÁVIO MARCÍLIO;AV. PASTEUR, 575;PIRAMBU;
2024;1;FORTALEZA;22722;ALISSON SILVESTRE;82;241;;1;EEFM GOVERNADOR FLÁVIO MARCÍLIO;AV. PASTEUR, 575;PIRAMBU;
2024;1;FORTALEZA;22722;ALISSON SILVESTRE;82;255;;1;CEJA PAULO FREIRE;RUA OLAVO BILAC, 1300;SÃO GERARDO;
2024;1;FORTALEZA;22722;ALISSON SILVESTRE;82;361;;1;COLÉGIO MASTER - BEZERRA DE MENEZES;AV. BEZERRA DE MENEZES, 1802;SÃO GERARDO;
2024;1;FORTALEZA;22722;ALISSON SILVESTRE;82;368;;1;ESCOLA MUNICIPAL GUSTAVO BARROSO - EI/EF;RUA ERETIDES MARTINS, 26;SÃO GERARDO;
2024;1;FORTALEZA;22722;ALISSON SILVESTRE;82;384;703;1;COLÉGIO MENINO JESUS DE PRAGA;RUA ANA FACÓ, 140;CARLITO PAMPLONA;
2024;1;FORTALEZA;22722;ALISSON SILVESTRE;82;389;;1;EEFM GOVERNADOR FLÁVIO MARCÍLIO;AV. PASTEUR, 575;PIRAMBU;
2024;1;FORTALEZA;22722;ALISSON SILVESTRE;82;403;;1;ESCOLA MUNICIPAL LENIRA JUREMA DE MAGALHÃES - EI/EF;RUA TEÓFILO GURGEL, 111;MONTE CASTELO;
2024;1;FORTALEZA;22722;ALISSON SILVESTRE;82;410;;1;COLÉGIO MANUEL DA SILVA - CARLITO PAMPLONA;AV. FRANCISCO SÁ, 4001;CARLITO PAMPLONA;
2024;1;FORTALEZA;22722;ALISSON SILVESTRE;82;514;;1;ESCOLA MUNICIPAL SANTA TEREZA - EI/EF;RUA MONSENHOR HÉLIO CAMPOS, 90;CRISTO REDENTOR;
2024;1;FORTALEZA;22722;ALISSON SILVESTRE;82;546;;1;ESCOLA MUNICIPAL SANTA TEREZA - EI/EF;RUA MONSENHOR HÉLIO CAMPOS, 90;CRISTO REDENTOR;
2024;1;FORTALEZA;22722;ALISSON SILVESTRE;82;567;;1;ESCOLA MUNICIPAL PATATIVA DO ASSARÉ - EI/EF;RUA IRINEU DE SOUZA, 197;ÁLVARO WEYNE;
2024;1;FORTALEZA;22722;ALISSON SILVESTRE;82;579;;1;ESCOLA MUNICIPAL LENIRA JUREMA DE MAGALHÃES - EI/EF;RUA TEÓFILO GURGEL, 111;MONTE CASTELO;
2024;1;FORTALEZA;22722;ALISSON SILVESTRE;82;608;;1;POSTO DE SAÚDE GUIOMAR ARRUDA;RUA COSTA MATOS, 6;PIRAMBU;
2024;1;FORTALEZA;22722;ALISSON SILVESTRE;82;611;;1;INSTITUTO MATER AMABILIS;RUA PADRE ANCHIETA, 438;MONTE CASTELO;
2024;1;FORTALEZA;22722;ALISSON SILVESTRE;82;618;;1;POSTO DE SAÚDE CARLOS RIBEIRO;RUA JACINTO MATOS, 944;JACARECANGA;
2024;1;FORTALEZA;22722;ALISSON SILVESTRE;82;622;;1;CEJA  MONSENHOR HÉLIO CAMPOS;AV. MONSENHOR HÉLIO CAMPOS, 251;CRISTO REDENTOR;
2024;1;FORTALEZA;22722;ALISSON SILVESTRE;82;627;;1;COLÉGIO MASTER - BEZERRA DE MENEZES;AV. BEZERRA DE MENEZES, 1802;SÃO GERARDO;
2024;1;FORTALEZA;22722;ALISSON SILVESTRE;82;660;;1;ESCOLA MUNICIPAL TERTULIANO CAMBRAIA - EI/EF;RUA MONSENHOR ROSA, 946;CARLITO PAMPLONA;
2024;1;FORTALEZA;22722;ALISSON SILVESTRE;82;666;;1;COLÉGIO MANUEL DA SILVA - CARLITO PAMPLONA;AV. FRANCISCO SÁ, 4001;CARLITO PAMPLONA;
2024;1;FORTALEZA;22722;ALISSON SILVESTRE;82;688;;1;EEFM JOSÉ VALDO RIBEIRO RAMOS - EEMTI;RUA PEDRO AMÉRICO, 100;CARLITO PAMPLONA;
2024;1;FORTALEZA;22722;ALISSON SILVESTRE;82;693;;1;ESCOLA MUNICIPAL SANTA TEREZA - EI/EF;RUA MONSENHOR HÉLIO CAMPOS, 90;CRISTO REDENTOR;
2024;1;FORTALEZA;22722;ALISSON SILVESTRE;83;18;;1;ESCOLA MUNICIPAL DOM JOSÉ TUPINAMBA DA FROTA;RUA VIRIATO RIBEIRO 1031;BELA VISTA;
2024;1;FORTALEZA;22722;ALISSON SILVESTRE;83;20;;1;ESCOLA MUNICIPAL DOM JOSÉ TUPINAMBA DA FROTA;RUA VIRIATO RIBEIRO 1031;BELA VISTA;
2024;1;FORTALEZA;22722;ALISSON SILVESTRE;83;25;;2;ESCOLA MUNICIPAL NILSON HOLANDA;RUA VIRIATO RIBEIRO 1355;BELA VISTA;
2024;1;FORTALEZA;22722;ALISSON SILVESTRE;83;53;;2;ESCOLA MUNICIPAL PAULO SARASATE;RUA PEDRO MUNIZ 250;DEMOCRITO ROCHA;
2024;1;FORTALEZA;22722;ALISSON SILVESTRE;83;57;;2;EEMTI SENADOR FERNANDES TÁVORA;RUA GOIÁS 141;BELA VISTA;
2024;1;FORTALEZA;22722;ALISSON SILVESTRE;83;58;;1;EEMTI SENADOR FERNANDES TÁVORA;RUA GOIÁS 141;BELA VISTA;
2024;1;FORTALEZA;22722;ALISSON SILVESTRE;83;68;;1;EEFM JOAQUIM ALVES;RUA ESTADO DO RIO 955;DEMOCRITO ROCHA;
2024;1;FORTALEZA;22722;ALISSON SILVESTRE;83;96;;1;EEM  MARIANO MARTINS;AVENIDA SENADOR FERNANDES TÁVORA 1445;HENRIQUE JORGE;
2024;1;FORTALEZA;22722;ALISSON SILVESTRE;83;98;;1;EEM  MARIANO MARTINS;AVENIDA SENADOR FERNANDES TÁVORA 1445;HENRIQUE JORGE;
2024;1;FORTALEZA;22722;ALISSON SILVESTRE;83;99;;1;EEM  MARIANO MARTINS;AVENIDA SENADOR FERNANDES TÁVORA 1445;HENRIQUE JORGE;
2024;1;FORTALEZA;22722;ALISSON SILVESTRE;83;101;;2;EEM  MARIANO MARTINS;AVENIDA SENADOR FERNANDES TÁVORA 1445;HENRIQUE JORGE;
2024;1;FORTALEZA;22722;ALISSON SILVESTRE;83;122;;1;EEEP JÚLIA GIFFONI;RUA CORONEL MATOS DOURADO 1349;PICI;
2024;1;FORTALEZA;22722;ALISSON SILVESTRE;83;127;;2;EEMTI ANTONIETA SIQUEIRA;RUA GUARANI 04;HENRIQUE JORGE;
2024;1;FORTALEZA;22722;ALISSON SILVESTRE;83;128;;3;EEMTI ANTONIETA SIQUEIRA;RUA GUARANI 04;HENRIQUE JORGE;
2024;1;FORTALEZA;22722;ALISSON SILVESTRE;83;130;;1;ESCOLA MUNICIPAL PRESIDENTE KENNEDY;AV. LINEU MACHADO 811;JÓQUEI CLUBE;
2024;1;FORTALEZA;22722;ALISSON SILVESTRE;83;134;;2;ESCOLA MUNICIPAL PRESIDENTE KENNEDY;AV. LINEU MACHADO 811;JÓQUEI CLUBE;
2024;1;FORTALEZA;22722;ALISSON SILVESTRE;83;156;;1;CENTRO DE FORMAÇÃO E DESENV. PARA PROFISSIONAIS DA EDUCAÇÃO - FORMACE;RUA PORTO VELHO, 401;JOÃO XXIII;
2024;1;FORTALEZA;22722;ALISSON SILVESTRE;83;166;;1;EEFM HERACLITO DE CASTRO E SILVA;RUA SILVEIRA FILHO, 808;JÓQUEI CLUBE;
2024;1;FORTALEZA;22722;ALISSON SILVESTRE;83;170;;1;EEFM HERACLITO DE CASTRO E SILVA;RUA SILVEIRA FILHO, 808;JÓQUEI CLUBE;
2024;1;FORTALEZA;22722;ALISSON SILVESTRE;83;173;;1;ESCOLA PEQUENO PRINCIPE;RUA SILVEIRA FILHO, 825;JÓQUEI CLUBE;
2024;1;FORTALEZA;22722;ALISSON SILVESTRE;83;320;;1;ESCOLA MUNICIPAL JOSÉ BONIFÁCIO DE SOUSA;RUA PERNAMBUCO 600;DEMOCRITO ROCHA;
2024;1;FORTALEZA;22722;ALISSON SILVESTRE;83;429;;1;EEMTI ESTADO DO AMAZONAS;RUA MONSENHOR FURTADO 2327;BELA VISTA;
2024;1;FORTALEZA;22722;ALISSON SILVESTRE;83;493;;1;COLÉGIO LUCÊ;RUA CUIABA 155;JÓQUEI CLUBE;
2024;1;FORTALEZA;22722;ALISSON SILVESTRE;83;543;;1;ESCOLA MUNICIPAL JOSÉ BONIFÁCIO DE SOUSA;RUA PERNAMBUCO 600;DEMOCRITO ROCHA;
2024;1;FORTALEZA;22722;ALISSON SILVESTRE;83;565;;2;CENTRO DE FORMAÇÃO E DESENV. PARA PROFISSIONAIS DA EDUCAÇÃO - FORMACE;RUA PORTO VELHO, 401;JOÃO XXIII;
2024;1;FORTALEZA;22722;ALISSON SILVESTRE;83;570;;3;EEMTI ANTONIETA SIQUEIRA;RUA GUARANI 04;HENRIQUE JORGE;
2024;1;FORTALEZA;22722;ALISSON SILVESTRE;83;586;;1;ESCOLA MUNICIPAL JOSÉ SOBREIRA DE AMORIM;RUA ESTRADA DO PICI 1083;HENRIQUE JORGE;
2024;1;FORTALEZA;22722;ALISSON SILVESTRE;83;593;;1;ESCOLA MUNICIPAL ADROALDO TEIXEIRA CASTELO;RUA ALAGOAS 2267;PICI;
2024;1;FORTALEZA;22722;ALISSON SILVESTRE;83;598;795;1;CENTRO UNIVERSITÁRIO ESTÁCIO - CAMPUS PARANGABA;AVENIDA SENADOR FERNANDES TÁVORA, 137;JÓQUEI CLUBE;
2024;1;FORTALEZA;22722;ALISSON SILVESTRE;83;601;;1;EEMTI ANTONIETA SIQUEIRA;RUA GUARANI 04;HENRIQUE JORGE;
2024;1;FORTALEZA;22722;ALISSON SILVESTRE;83;603;;1;ESCOLA MUNICIPAL SANTA MARIA;RUA CUIABÁ 1465;HENRIQUE JORGE;
2024;1;FORTALEZA;22722;ALISSON SILVESTRE;83;608;;1;ESCOLA MUNICIPAL PROFESSORA MARIA LIDUÍNA CORREA LEITE;RUA FERNÃO MAGALHÃES, 120;PICI;
2024;1;FORTALEZA;22722;ALISSON SILVESTRE;83;609;;1;EEEP JÚLIA GIFFONI;RUA CORONEL MATOS DOURADO 1349;PICI;
2024;1;FORTALEZA;22722;ALISSON SILVESTRE;83;651;;1;EEFM JOSÉ WALDEMAR DE ALCÂNTARA E SILVA;RUA MACEIÓ, 627;DOM LUSTOSA;
2024;1;FORTALEZA;22722;ALISSON SILVESTRE;83;654;;2;EEMTI PROFESSOR PAULO FREIRE;AVENIDA SENADOR FERNANDES TÁVORA 1936;HENRIQUE JORGE;
2024;1;FORTALEZA;22722;ALISSON SILVESTRE;83;658;;1;EEMTI PROFESSOR PAULO FREIRE;AVENIDA SENADOR FERNANDES TÁVORA 1936;HENRIQUE JORGE;
2024;1;FORTALEZA;22722;ALISSON SILVESTRE;83;660;;1;EEMTI PROFESSOR PAULO FREIRE;AVENIDA SENADOR FERNANDES TÁVORA 1936;HENRIQUE JORGE;
2024;1;FORTALEZA;22722;ALISSON SILVESTRE;83;679;;1;ESCOLA MUNICIPAL DONA DAGMAR GENTIL;RUA VITORIA 1750;HENRIQUE JORGE;
2024;1;FORTALEZA;22722;ALISSON SILVESTRE;83;697;;2;CENTRO EDUCACIONAL BRASILEIRINHO;AVENIDA SENADOR FERNANDES TÁVORA, 1717;HENRIQUE JORGE;
2024;1;FORTALEZA;22722;ALISSON SILVESTRE;83;698;;2;EEMTI ANTONIETA SIQUEIRA;RUA GUARANI 04;HENRIQUE JORGE;
2024;1;FORTALEZA;22722;ALISSON SILVESTRE;83;699;;2;ESCOLA MUNICIPAL PROFESSORA MARIA LIDUÍNA CORREA LEITE;RUA FERNÃO MAGALHÃES, 120;PICI;
2024;1;FORTALEZA;22722;ALISSON SILVESTRE;83;707;;3;EEMTI ANTONIETA SIQUEIRA;RUA GUARANI 04;HENRIQUE JORGE;
2024;1;FORTALEZA;22722;ALISSON SILVESTRE;83;714;;3;COLÉGIO LUNA RANGEL;RUA EURICO MEDINA, 959;HENRIQUE JORGE;
2024;1;FORTALEZA;22722;ALISSON SILVESTRE;83;718;;1;ESCOLA MUNICIPAL PROFESSORA MARIA LIDUÍNA CORREA LEITE;RUA FERNÃO MAGALHÃES, 120;PICI;
2024;1;FORTALEZA;22722;ALISSON SILVESTRE;83;719;;1;EEMTI ANTONIETA SIQUEIRA;RUA GUARANI 04;HENRIQUE JORGE;
2024;1;FORTALEZA;22722;ALISSON SILVESTRE;83;720;;1;EEMTI SENADOR FERNANDES TÁVORA;RUA GOIÁS 141;BELA VISTA;
2024;1;FORTALEZA;22722;ALISSON SILVESTRE;83;727;;2;EEMTI SENADOR FERNANDES TÁVORA;RUA GOIÁS 141;BELA VISTA;
2024;1;FORTALEZA;22722;ALISSON SILVESTRE;83;728;;1;COLÉGIO PROFESSORA JEMINA GÓIS;RUA GUANABARA, 627;DEMOCRITO ROCHA;
2024;1;FORTALEZA;22722;ALISSON SILVESTRE;83;730;;1;COLÉGIO ELITE;AVENIDA JOÃO PESSOA, 6302;MONTESE;
2024;1;FORTALEZA;22722;ALISSON SILVESTRE;83;732;;1;COLÉGIO LUNA RANGEL;RUA EURICO MEDINA, 959;HENRIQUE JORGE;
2024;1;FORTALEZA;22722;ALISSON SILVESTRE;83;734;;2;EEEP JÚLIA GIFFONI;RUA CORONEL MATOS DOURADO 1349;PICI;
