Ano;Turno;Município;Número;Candidato;Zona;Seção;Seções Agregadas;Votos;Local de Votação;Endereço Local de Votação;Bairro;
2024;1;FORTALEZA;10120;ANDRÉ WILLAME;1;394;;1;CIES AIDA SANTOS;AVENIDA TRAJANO DE MEDEIROS  813;VICENTE PINZON;
2024;1;FORTALEZA;10120;ANDRÉ WILLAME;2;132;;1;EEM DEPUTADO PAULO BENEVIDES;RUA ANGELICA GURGEL, 186;MESSEJANA;
2024;1;FORTALEZA;10120;ANDRÉ WILLAME;82;71;;1;COLÉGIO MANUEL DA SILVA - CARLITO PAMPLONA;AV. FRANCISCO SÁ, 4001;CARLITO PAMPLONA;
2024;1;FORTALEZA;10120;ANDRÉ WILLAME;82;103;;1;EEFM LIONS JANGADA - EEMTI;RUA CAMÉLIA, 352;CRISTO REDENTOR;
2024;1;FORTALEZA;10120;ANDRÉ WILLAME;82;188;;1;EEFM CLÁUDIO MARTINS;RUA DEMÓCRITO ROCHA, 400;MONTE CASTELO;
2024;1;FORTALEZA;10120;ANDRÉ WILLAME;82;389;;1;EEFM GOVERNADOR FLÁVIO MARCÍLIO;AV. PASTEUR, 575;PIRAMBU;
2024;1;FORTALEZA;10120;ANDRÉ WILLAME;82;625;;1;EEFM CLÁUDIO MARTINS;RUA DEMÓCRITO ROCHA, 400;MONTE CASTELO;
2024;1;FORTALEZA;10120;ANDRÉ WILLAME;82;683;;1;EEFM JOSÉ VALDO RIBEIRO RAMOS - EEMTI;RUA PEDRO AMÉRICO, 100;CARLITO PAMPLONA;
2024;1;FORTALEZA;10120;ANDRÉ WILLAME;94;10;;1;EEMTI MARIA JOSÉ SANTOS FERREIRA GOMES;RUA DONA LUCIA PINHEIRO, 93;QUINTINO CUNHA;
2024;1;FORTALEZA;10120;ANDRÉ WILLAME;94;68;;1;CEI JOAQUIM NOGUEIRA;R. SAO VICENTE DE PAULO, 72-126;ANTÔNIO BEZERRA;
2024;1;FORTALEZA;10120;ANDRÉ WILLAME;94;195;;1;EEFM DONA HILZA DIOGO DE OLIVEIRA;AV. DOM ALOÍSIO LORSCHEIDER, 1040 - VILA VELHA;VILA VELHA;
2024;1;FORTALEZA;10120;ANDRÉ WILLAME;94;199;;1;EEFM DONA HILZA DIOGO DE OLIVEIRA;AV. DOM ALOÍSIO LORSCHEIDER, 1040 - VILA VELHA;VILA VELHA;
2024;1;FORTALEZA;10120;ANDRÉ WILLAME;94;217;;1;IGREJA DE SÃO JOSÉ;R. GEN. ALÍPIO DOS SANTOS, 375;QUINTINO CUNHA;
2024;1;FORTALEZA;10120;ANDRÉ WILLAME;94;336;;1;CMES PROF JOSE REBOUCAS MACAMBIRA;RUA CARIÚS 200;JARDIM GUANABARA;
2024;1;FORTALEZA;10120;ANDRÉ WILLAME;94;371;;1;EEFM DEP FCO DE ALMEIDA MONTE;AV. CORONEL CARVALHO 2400;JARDIM IRACEMA;
2024;1;FORTALEZA;10120;ANDRÉ WILLAME;94;455;;1;CMES PROF JOSE REBOUCAS MACAMBIRA;RUA CARIÚS 200;JARDIM GUANABARA;
2024;1;FORTALEZA;10120;ANDRÉ WILLAME;94;483;;1;EMEIEF PROF JOSE PARSIFAL BARROSO;AV MAJOR ASSIS 1076;VILA VELHA;
2024;1;FORTALEZA;10120;ANDRÉ WILLAME;94;552;;1;CEJA - EUDES VERAS;AV. DEMÉTRIO MENEZES, 130;ANTÔNIO BEZERRA;
2024;1;FORTALEZA;10120;ANDRÉ WILLAME;94;649;;1;EMEIEF PROF JOSE PARSIFAL BARROSO;AV MAJOR ASSIS 1076;VILA VELHA;
2024;1;FORTALEZA;10120;ANDRÉ WILLAME;94;721;;1;EEFM DEP FCO DE ALMEIDA MONTE;AV. CORONEL CARVALHO 2400;JARDIM IRACEMA;
2024;1;FORTALEZA;10120;ANDRÉ WILLAME;94;823;;1;COLEGIO SALOME BASTOS;RUA DESEMBARGADOR HERMES PARAHYBA 1120;VILA VELHA;
2024;1;FORTALEZA;10120;ANDRÉ WILLAME;94;842;;1;COLÉGIO INDEPENDÊNCIA;AV. DA INDEPENDÊNCIA, 1362;QUINTINO CUNHA;
2024;1;FORTALEZA;10120;ANDRÉ WILLAME;94;852;;1;EEFM DONA HILZA DIOGO DE OLIVEIRA;AV. DOM ALOÍSIO LORSCHEIDER, 1040 - VILA VELHA;VILA VELHA;
2024;1;FORTALEZA;10120;ANDRÉ WILLAME;94;853;;1;EM ANTONIO CORREIA LIMA;RUA HERMES PARAYBA, 934;VILA VELHA;
2024;1;FORTALEZA;10120;ANDRÉ WILLAME;94;922;;1;EMEIEF PROF DENIZARD MACEDO DE ALCÂNTARA;RUA MATOSO FILHO 450;QUINTINO CUNHA;
2024;1;FORTALEZA;10120;ANDRÉ WILLAME;95;169;;1;EEMTI POETA OTACILIO COLARES;RUA JORGE DA VEIGA, 265;PARQUE SANTA MARIA;
2024;1;FORTALEZA;10120;ANDRÉ WILLAME;95;274;;1;EMEIF PROFESSORA OLINDINA CARVALHO DE MORAIS;RUA 5, 581 (CJ JOÃO PAULO II);BARROSO;
2024;1;FORTALEZA;10120;ANDRÉ WILLAME;112;388;;1;EEFM DOM ANTONIO DE ALMEIDA LUSTOSA;RUA ADOLFO MOREIRA DE CARVALHO, S/N;EDSON QUEIROZ;
2024;1;FORTALEZA;10120;ANDRÉ WILLAME;112;558;;1;INSTITUTO DE ASSISTÊNCIA E PROTEÇÃO SOCIAL - IAPS;RUA BARRA NOVA, N 1.000, CONJ. TANCREDO NEVES;JARDIM DAS OLIVEIRAS;
2024;1;FORTALEZA;10120;ANDRÉ WILLAME;113;210;;1;COLÉGIO DEOCLÉCIO FERRO;RUA MINERVINO DE CASTRO, 987;RODOLFO TEÓFILO;
2024;1;FORTALEZA;10120;ANDRÉ WILLAME;113;214;;1;COLÉGIO DEOCLÉCIO FERRO;RUA MINERVINO DE CASTRO, 987;RODOLFO TEÓFILO;
2024;1;FORTALEZA;10120;ANDRÉ WILLAME;113;297;;1;COLÉGIO MEDALHA MILAGROSA;RUA PADRE JOÃO PIAMARTA,  415;BOM FUTURO;
2024;1;FORTALEZA;10120;ANDRÉ WILLAME;113;299;;1;EEFM ESTADO DO PARANÁ;RUA ALBERTO MAGNO, 123;JARDIM AMÉRICA;
2024;1;FORTALEZA;10120;ANDRÉ WILLAME;113;304;;1;COLÉGIO MEDALHA MILAGROSA;RUA PADRE JOÃO PIAMARTA,  415;BOM FUTURO;
2024;1;FORTALEZA;10120;ANDRÉ WILLAME;114;11;;2;EM JESUS CRISTO - CEI ANEXO;RUA ALBERTO FERREIRA 564;JARDIM IRACEMA;
2024;1;FORTALEZA;10120;ANDRÉ WILLAME;114;12;;1;EM JESUS CRISTO - CEI ANEXO;RUA ALBERTO FERREIRA 564;JARDIM IRACEMA;
2024;1;FORTALEZA;10120;ANDRÉ WILLAME;114;13;;2;EM JESUS CRISTO - CEI ANEXO;RUA ALBERTO FERREIRA 564;JARDIM IRACEMA;
2024;1;FORTALEZA;10120;ANDRÉ WILLAME;114;16;;1;EM JESUS CRISTO - CEI ANEXO;RUA ALBERTO FERREIRA 564;JARDIM IRACEMA;
2024;1;FORTALEZA;10120;ANDRÉ WILLAME;114;46;;1;EM CASIMIRO JOSÉ LIMA FILHO;AVENIDA FRANCISCO SÁ 6449;BARRA DO CEARÁ;
2024;1;FORTALEZA;10120;ANDRÉ WILLAME;114;67;;1;EM DOM HELDER CAMARA;RUA FREI ODILON 623 B;ÁLVARO WEYNE;
2024;1;FORTALEZA;10120;ANDRÉ WILLAME;114;85;;1;CUCA BARRA DO CEARÁ;AV. PRES. CASTELO BRANCO, 6417;BARRA DO CEARÁ;
2024;1;FORTALEZA;10120;ANDRÉ WILLAME;114;86;;2;CUCA BARRA DO CEARÁ;AV. PRES. CASTELO BRANCO, 6417;BARRA DO CEARÁ;
2024;1;FORTALEZA;10120;ANDRÉ WILLAME;114;88;;2;CUCA BARRA DO CEARÁ;AV. PRES. CASTELO BRANCO, 6417;BARRA DO CEARÁ;
2024;1;FORTALEZA;10120;ANDRÉ WILLAME;114;89;;1;CUCA BARRA DO CEARÁ;AV. PRES. CASTELO BRANCO, 6417;BARRA DO CEARÁ;
2024;1;FORTALEZA;10120;ANDRÉ WILLAME;114;90;;1;CUCA BARRA DO CEARÁ;AV. PRES. CASTELO BRANCO, 6417;BARRA DO CEARÁ;
2024;1;FORTALEZA;10120;ANDRÉ WILLAME;114;93;;1;CUCA BARRA DO CEARÁ;AV. PRES. CASTELO BRANCO, 6417;BARRA DO CEARÁ;
2024;1;FORTALEZA;10120;ANDRÉ WILLAME;114;94;;1;CUCA BARRA DO CEARÁ;AV. PRES. CASTELO BRANCO, 6417;BARRA DO CEARÁ;
2024;1;FORTALEZA;10120;ANDRÉ WILLAME;114;95;;1;CUCA BARRA DO CEARÁ;AV. PRES. CASTELO BRANCO, 6417;BARRA DO CEARÁ;
2024;1;FORTALEZA;10120;ANDRÉ WILLAME;114;102;;1;EM RAIMUNDO DE SOUSA MANGUEIRA;RUA ALBERTO FERREIRA 624;JARDIM IRACEMA;
2024;1;FORTALEZA;10120;ANDRÉ WILLAME;114;131;;1;EEFM ESTADO DE ALAGOAS;AVENIDA PRESIDENTE CASTELO BRANCO, 5244;BARRA DO CEARÁ;
2024;1;FORTALEZA;10120;ANDRÉ WILLAME;114;136;;1;EM JOSÉ DE ALENCAR;RUA ALBERTO FERREIRA 248;JARDIM IRACEMA;
2024;1;FORTALEZA;10120;ANDRÉ WILLAME;114;141;;1;EM JOSÉ DE ALENCAR;RUA ALBERTO FERREIRA 248;JARDIM IRACEMA;
2024;1;FORTALEZA;10120;ANDRÉ WILLAME;114;142;;1;EM JOSÉ DE ALENCAR;RUA ALBERTO FERREIRA 248;JARDIM IRACEMA;
2024;1;FORTALEZA;10120;ANDRÉ WILLAME;114;144;;1;EM JESUS CRISTO;RUA ALBERTO FERREIRA, 564;JARDIM IRACEMA;
2024;1;FORTALEZA;10120;ANDRÉ WILLAME;114;207;;1;EM FRANCISCO SILVA CAVALCANTE;RUA CONSELHEIRO LAFAYETTE 205;FLORESTA;
2024;1;FORTALEZA;10120;ANDRÉ WILLAME;114;208;;1;EM FRANCISCO SILVA CAVALCANTE;RUA CONSELHEIRO LAFAYETTE 205;FLORESTA;
2024;1;FORTALEZA;10120;ANDRÉ WILLAME;114;209;;1;EM FRANCISCO SILVA CAVALCANTE;RUA CONSELHEIRO LAFAYETTE 205;FLORESTA;
2024;1;FORTALEZA;10120;ANDRÉ WILLAME;114;210;;1;EM FRANCISCO SILVA CAVALCANTE;RUA CONSELHEIRO LAFAYETTE 205;FLORESTA;
2024;1;FORTALEZA;10120;ANDRÉ WILLAME;114;211;;2;EM FRANCISCO SILVA CAVALCANTE;RUA CONSELHEIRO LAFAYETTE 205;FLORESTA;
2024;1;FORTALEZA;10120;ANDRÉ WILLAME;114;212;;1;EM FRANCISCO SILVA CAVALCANTE;RUA CONSELHEIRO LAFAYETTE 205;FLORESTA;
2024;1;FORTALEZA;10120;ANDRÉ WILLAME;114;238;;1;CENTRO DE EDUCAÇÃO COMPLEMENTAR (CEDCE) - ANTIGO SESI;AVENIDA FRANCISCO SÁ 6623;BARRA DO CEARÁ;
2024;1;FORTALEZA;10120;ANDRÉ WILLAME;114;240;;1;CENTRO DE EDUCAÇÃO COMPLEMENTAR (CEDCE) - ANTIGO SESI;AVENIDA FRANCISCO SÁ 6623;BARRA DO CEARÁ;
2024;1;FORTALEZA;10120;ANDRÉ WILLAME;114;279;;1;EM MARIA DALVA SEVERINO MARREIRO;RUA RIO PARAGUAI 782;JARDIM IRACEMA;
2024;1;FORTALEZA;10120;ANDRÉ WILLAME;114;287;;2;EM JESUS CRISTO;RUA ALBERTO FERREIRA, 564;JARDIM IRACEMA;
2024;1;FORTALEZA;10120;ANDRÉ WILLAME;114;290;;1;EM JESUS CRISTO;RUA ALBERTO FERREIRA, 564;JARDIM IRACEMA;
2024;1;FORTALEZA;10120;ANDRÉ WILLAME;114;311;;1;EM JESUS CRISTO;RUA ALBERTO FERREIRA, 564;JARDIM IRACEMA;
2024;1;FORTALEZA;10120;ANDRÉ WILLAME;114;317;;1;EM JESUS CRISTO;RUA ALBERTO FERREIRA, 564;JARDIM IRACEMA;
2024;1;FORTALEZA;10120;ANDRÉ WILLAME;114;347;;2;EM DOIS DE DEZEMBRO;RUA ARAKEN, 860;BARRA DO CEARÁ;
2024;1;FORTALEZA;10120;ANDRÉ WILLAME;114;358;;1;CAPELA NOSSA SENHORA DE FÁTIMA;RUA RIO ARAGUAIA 1669;JARDIM IRACEMA;
2024;1;FORTALEZA;10120;ANDRÉ WILLAME;115;190;;1;EEMTI MARIA THOMÁSIA;RUA POLONIA, 369;PARANGABA;
2024;1;FORTALEZA;10120;ANDRÉ WILLAME;115;381;;1;EEMTI GENERAL EUDORO CORREA;RUA JULIO BRAGA 101;PARANGABA;
2024;1;FORTALEZA;10120;ANDRÉ WILLAME;115;416;;1;COLEGIO GURI  SENIOR;RUA CONEGO DE CASTRO 1780;PARANGABA;
2024;1;FORTALEZA;10120;ANDRÉ WILLAME;115;420;;1;CEJA - PROFº MOREIRA CAMPOS;RUA JULIO BRAGA, 101 B;PARANGABA;
2024;1;FORTALEZA;10120;ANDRÉ WILLAME;115;463;;1;EM HENRIQUETA GALENO;RUA MAJOR MONTENEGRO 917;MANOEL SÁTIRO;
2024;1;FORTALEZA;10120;ANDRÉ WILLAME;115;477;;1;EEFM PROF. HERMENEGILDO FIRMEZA;RUA GABRIEL FIUZA 360;VILA PERI;
2024;1;FORTALEZA;10120;ANDRÉ WILLAME;115;484;;1;COLÉGIO LOURENÇO FILHO - PARANGABA;RUA CÔNEGO DE CASTRO 700;PARANGABA;
2024;1;FORTALEZA;10120;ANDRÉ WILLAME;116;26;;1;EM IRMA ROCHA;RUA EMILIO DE MENEZES 2515;GRANJA PORTUGAL;
2024;1;FORTALEZA;10120;ANDRÉ WILLAME;116;461;;1;COLEGIO LIMA NOGUEIRA;RUA JULIO BRAGA, 1117;JOÃO XXIII;
2024;1;FORTALEZA;10120;ANDRÉ WILLAME;118;432;;1;EM MARIA DE CARVALHO MARTINS;AVENIDA DOUTOR SILAS MUNGUBA, 4300;SERRINHA;
TOTAL;;;;;;;;86;
