Ano;Turno;Município;Número;Candidato;Zona;Seção;Seções Agregadas;Votos;Local de Votação;Endereço Local de Votação;Bairro;
2024;1;FORTALEZA;44500;BARBOSINHA DOS RODOVIÁRIOS;1;40;;1;COLEGIO ANTARES - SANTOS DUMONT;AVENIDA SANTOS DUMONT 3777;ALDEOTA;
2024;1;FORTALEZA;44500;BARBOSINHA DOS RODOVIÁRIOS;1;389;;1;ESCOLA ESTADUAL DEPUTADO MANOEL RODRIGUES;RUA OLIVEIRA FILHO, 1576;VICENTE PINZON;
2024;1;FORTALEZA;44500;BARBOSINHA DOS RODOVIÁRIOS;1;400;;1;ESCOLA MUNICIPAL SAO VICENTE DE PAULO;AVENIDA ZEZE DIOGO 1247;CAIS DO PORTO;
2024;1;FORTALEZA;44500;BARBOSINHA DOS RODOVIÁRIOS;1;478;;1;ESCOLA MIGUEL FIALHO - ANTIGO PADRE JOSÉ NILSON ;RUA CORONEL MANUEL JESUÍNO 225;MUCURIPE;
2024;1;FORTALEZA;44500;BARBOSINHA DOS RODOVIÁRIOS;1;505;;1;UNINTA - FACULDADE UNINTA FORTALEZA;RUA VILEBALDO AGUIAR,133;COCÓ;
2024;1;FORTALEZA;44500;BARBOSINHA DOS RODOVIÁRIOS;1;567;;1;ESCOLA MUNICIPAL COLONIA Z-8;RUA MANOEL JESUINO,370;VARJOTA;
2024;1;FORTALEZA;44500;BARBOSINHA DOS RODOVIÁRIOS;1;632;;1;ESCOLA ESTADUAL ARQUITETO ROGERIO FROES;AVENIDA DAS GRAVIOLAS 1000;CIDADE 2000;
2024;1;FORTALEZA;44500;BARBOSINHA DOS RODOVIÁRIOS;1;807;;1;ESCOLA ESTADUAL MURILO BORGES;RUA DO ENTARDECER 90;VICENTE PINZON;
2024;1;FORTALEZA;44500;BARBOSINHA DOS RODOVIÁRIOS;1;865;;1;ESCOLA MUNICIPAL FREI TITO DE ALENCAR LIMA;AVENIDA DIOGUINHO 5927;VICENTE PINZON;
2024;1;FORTALEZA;44500;BARBOSINHA DOS RODOVIÁRIOS;2;1;;1;EEM DEPUTADO PAULO BENEVIDES;RUA ANGELICA GURGEL, 186;MESSEJANA;
2024;1;FORTALEZA;44500;BARBOSINHA DOS RODOVIÁRIOS;2;75;;1;EEEP JOSE DE BARCELOS;RUA ANGELICA GURGEL 362;MESSEJANA;
2024;1;FORTALEZA;44500;BARBOSINHA DOS RODOVIÁRIOS;2;81;;1;EEEP COMENDADOR MIGUEL GURGEL;RUA JOSE BAIMA, S/N;GUAJERU;
2024;1;FORTALEZA;44500;BARBOSINHA DOS RODOVIÁRIOS;2;90;;1;CLUBE DA CAIXA;AVENIDA FREI CIRILO 4700;MESSEJANA;
2024;1;FORTALEZA;44500;BARBOSINHA DOS RODOVIÁRIOS;2;129;;1;EEM DEPUTADO PAULO BENEVIDES;RUA ANGELICA GURGEL, 186;MESSEJANA;
2024;1;FORTALEZA;44500;BARBOSINHA DOS RODOVIÁRIOS;2;154;;1;EMEIF ANGELICA GURGEL;RUA DOUTOR PERGENTINO MAIA, 375;MESSEJANA;
2024;1;FORTALEZA;44500;BARBOSINHA DOS RODOVIÁRIOS;2;156;;1;EMEIF MOREIRA DA ROCHA;AV ODILON GUIMARAES, 3860;LAGOA REDONDA;
2024;1;FORTALEZA;44500;BARBOSINHA DOS RODOVIÁRIOS;2;164;;1;COLÉGIO PAIVA ANDRADE;RUA INÁCIO MOREIRA, 133;MESSEJANA;
2024;1;FORTALEZA;44500;BARBOSINHA DOS RODOVIÁRIOS;2;425;;1;EEM DEPUTADO PAULO BENEVIDES;RUA ANGELICA GURGEL, 186;MESSEJANA;
2024;1;FORTALEZA;44500;BARBOSINHA DOS RODOVIÁRIOS;2;428;;1;COLÉGIO SERAFICO NOSSA SENHORA DO BRASIL;AVENIDA FREI CIRILO 4454;MESSEJANA;
2024;1;FORTALEZA;44500;BARBOSINHA DOS RODOVIÁRIOS;2;484;;1;COLÉGIO SERAFICO NOSSA SENHORA DO BRASIL;AVENIDA FREI CIRILO 4454;MESSEJANA;
2024;1;FORTALEZA;44500;BARBOSINHA DOS RODOVIÁRIOS;2;501;;1;CLUBE DA CAIXA;AVENIDA FREI CIRILO 4700;MESSEJANA;
2024;1;FORTALEZA;44500;BARBOSINHA DOS RODOVIÁRIOS;2;533;;1;EMEIF DEMOCRITO ROCHA;RUA PADRE PEDRO DE ALENCAR, 2012;MESSEJANA;
2024;1;FORTALEZA;44500;BARBOSINHA DOS RODOVIÁRIOS;2;552;;1;EM PROFª FERNANDA MARIA DE ALENCAR COLARES;AV PROF. ARTHUR DE CARVALHO, 1540;LAGOA REDONDA;
2024;1;FORTALEZA;44500;BARBOSINHA DOS RODOVIÁRIOS;2;554;;1;CMES PROFª TEREZINHA FERREIRA PARENTE;RUA NELSON COELHO, 209;LAGOA REDONDA;
2024;1;FORTALEZA;44500;BARBOSINHA DOS RODOVIÁRIOS;2;639;;1;EEM DEPUTADO PAULO BENEVIDES;RUA ANGELICA GURGEL, 186;MESSEJANA;
2024;1;FORTALEZA;44500;BARBOSINHA DOS RODOVIÁRIOS;2;641;;1;CMES PROFª TEREZINHA FERREIRA PARENTE;RUA NELSON COELHO, 209;LAGOA REDONDA;
2024;1;FORTALEZA;44500;BARBOSINHA DOS RODOVIÁRIOS;2;733;;2;COLÉGIO PAIVA ANDRADE;RUA INÁCIO MOREIRA, 133;MESSEJANA;
2024;1;FORTALEZA;44500;BARBOSINHA DOS RODOVIÁRIOS;2;761;;2;EM PROFª TELINA BARBOSA DA  COSTA;RUA PERGENTINO MAIA, 811;MESSEJANA;
2024;1;FORTALEZA;44500;BARBOSINHA DOS RODOVIÁRIOS;2;763;;1;CMES PROFª TEREZINHA FERREIRA PARENTE;RUA NELSON COELHO, 209;LAGOA REDONDA;
2024;1;FORTALEZA;44500;BARBOSINHA DOS RODOVIÁRIOS;2;817;;1;EM CÔNEGO FRANCISCO PEREIRA DA SILVA;RUA LUÍS FRANCISCO XAVIER, 256;PAUPINA;
2024;1;FORTALEZA;44500;BARBOSINHA DOS RODOVIÁRIOS;3;116;26;2;SENAI - UNIDADE JACARECANGA;AV. PADRE IBIAPINA, 1280;JACARECANGA;
2024;1;FORTALEZA;44500;BARBOSINHA DOS RODOVIÁRIOS;3;125;;1;COLÉGIO ESTADUAL LICEU DO CEARÁ;PRAÇA GUSTAVO BARROSO, 01;JACARECANGA;
2024;1;FORTALEZA;44500;BARBOSINHA DOS RODOVIÁRIOS;3;150;;1;COLÉGIO MILITAR DO CORPO DE BOMBEIROS;RUA ADRIANO MARTINS, 436;JACARECANGA;
2024;1;FORTALEZA;44500;BARBOSINHA DOS RODOVIÁRIOS;3;177;;1;SESC;RUA CLARINDO DE QUEIROZ, 1740;CENTRO;
2024;1;FORTALEZA;44500;BARBOSINHA DOS RODOVIÁRIOS;3;217;520;1;FAC. CATÓLICA DE FORTALEZA (SEMINÁRIO DA PRAINHA);RUA TENENTE BENÉVOLO, 201;CENTRO;
2024;1;FORTALEZA;44500;BARBOSINHA DOS RODOVIÁRIOS;3;391;;1;CÍRCULO MILITAR DE FORTALEZA;RUA CANUTO DE AGUIAR, 425;MEIRELES;
2024;1;FORTALEZA;44500;BARBOSINHA DOS RODOVIÁRIOS;3;392;;1;CÍRCULO MILITAR DE FORTALEZA;RUA CANUTO DE AGUIAR, 425;MEIRELES;
2024;1;FORTALEZA;44500;BARBOSINHA DOS RODOVIÁRIOS;3;447;;1;EEFM SANTA LUZIA;RUA JOÃO CORDEIRO, 711;PRAIA DE IRACEMA;
2024;1;FORTALEZA;44500;BARBOSINHA DOS RODOVIÁRIOS;3;454;;1;EEFM PARÓQUIA DA PAZ;RUA VISCONDE DE MAUÁ, 905/A;MEIRELES;
2024;1;FORTALEZA;44500;BARBOSINHA DOS RODOVIÁRIOS;3;525;;1;COLÉGIO ANTARES (PRAIA DE IRACEMA);RUA HISTORIADOR GUARINO ALVES, 95;PRAIA DE IRACEMA;
2024;1;FORTALEZA;44500;BARBOSINHA DOS RODOVIÁRIOS;3;587;;1;ESCOLA DE SAÚDE PÚBLICA DO CEARÁ;AV. ANTÔNIO JUSTA, 3161;MEIRELES;
2024;1;FORTALEZA;44500;BARBOSINHA DOS RODOVIÁRIOS;80;158;;1;EEFM CEL PROF JOSÉ AURÉLIO CÂMARA;RUA JORGE ACURCIO, 655;VILA UNIÃO;
2024;1;FORTALEZA;44500;BARBOSINHA DOS RODOVIÁRIOS;80;168;;2;COLÉGIO MONSENHOR JOVINIANO BARRETO;RUA FREI VIDAL 1621;TAUAPE;
2024;1;FORTALEZA;44500;BARBOSINHA DOS RODOVIÁRIOS;80;169;;2;COLÉGIO MONSENHOR JOVINIANO BARRETO;RUA FREI VIDAL 1621;TAUAPE;
2024;1;FORTALEZA;44500;BARBOSINHA DOS RODOVIÁRIOS;80;171;;1;COLÉGIO MONSENHOR JOVINIANO BARRETO;RUA FREI VIDAL 1621;TAUAPE;
2024;1;FORTALEZA;44500;BARBOSINHA DOS RODOVIÁRIOS;80;238;;1;EEFM NOEL HUGNEN OLIVEIRA PAIVA;RUA MONSENHOR SALAZAR 279;TAUAPE;
2024;1;FORTALEZA;44500;BARBOSINHA DOS RODOVIÁRIOS;80;258;259;2;SALÃO PAROQUIAL SÃO JOAO DO TAUAPE;RUA MONSENHOR SALAZAR, 279;TAUAPE;
2024;1;FORTALEZA;44500;BARBOSINHA DOS RODOVIÁRIOS;80;278;;1;EEF GAL.  MANUEL CORDEIRO NETO;RUA JORGE ACURCIO, 900;VILA UNIÃO;
2024;1;FORTALEZA;44500;BARBOSINHA DOS RODOVIÁRIOS;80;315;;1;COLÉGIO SANTO INACIO;AVENIDA DESEMBARGADOR MOREIRA 2355;DIONISIO TORRES;
2024;1;FORTALEZA;44500;BARBOSINHA DOS RODOVIÁRIOS;80;346;;1;COLÉGIO SALESIANO DOM BOSCO;AV ANTONIO SALES 116;JOAQUIM TÁVORA;
2024;1;FORTALEZA;44500;BARBOSINHA DOS RODOVIÁRIOS;80;351;;1;COLÉGIO SALESIANO DOM BOSCO;AV ANTONIO SALES 116;JOAQUIM TÁVORA;
2024;1;FORTALEZA;44500;BARBOSINHA DOS RODOVIÁRIOS;80;416;;1;EEM GOV. ADAUTO BEZERRA;RUA MONSENHOR LIBERATO, 1850;FÁTIMA;
2024;1;FORTALEZA;44500;BARBOSINHA DOS RODOVIÁRIOS;82;32;;1;SECRETARIA DE DESENVOLVIMENTO AGRÁRIO DO ESTADO DO CEARÁ;AV. BEZERRA DE MENEZES, 1620;SÃO GERARDO;
2024;1;FORTALEZA;44500;BARBOSINHA DOS RODOVIÁRIOS;82;85;;1;ESCOLA MUNICIPAL SEBASTIANA ALDIGUERI;AV. DOUTOR THEBERGE, 448;CRISTO REDENTOR;
2024;1;FORTALEZA;44500;BARBOSINHA DOS RODOVIÁRIOS;82;92;;1;ESCOLA MUNICIPAL PROFESSOR MARTINZ DE AGUIAR - EI/EF;RUA BERNARDO PORTO, 490;MONTE CASTELO;
2024;1;FORTALEZA;44500;BARBOSINHA DOS RODOVIÁRIOS;82;107;;1;CENTRO DE CIDADANIA GOV. VIRGÍLIO TÁVORA - CCDH;AV. MONSENHOR HELIO CAMPOS, 178;CRISTO REDENTOR;
2024;1;FORTALEZA;44500;BARBOSINHA DOS RODOVIÁRIOS;82;184;;1;ESCOLA MUNICIPAL GUSTAVO BARROSO - EI/EF;RUA ERETIDES MARTINS, 26;SÃO GERARDO;
2024;1;FORTALEZA;44500;BARBOSINHA DOS RODOVIÁRIOS;82;207;;1;ESCOLA MUNICIPAL PROFESSOR MARTINZ DE AGUIAR - EI/EF;RUA BERNARDO PORTO, 490;MONTE CASTELO;
2024;1;FORTALEZA;44500;BARBOSINHA DOS RODOVIÁRIOS;82;208;;1;INSTITUTO MATER AMABILIS;RUA PADRE ANCHIETA, 438;MONTE CASTELO;
2024;1;FORTALEZA;44500;BARBOSINHA DOS RODOVIÁRIOS;82;209;;2;INSTITUTO MATER AMABILIS;RUA PADRE ANCHIETA, 438;MONTE CASTELO;
2024;1;FORTALEZA;44500;BARBOSINHA DOS RODOVIÁRIOS;82;213;;1;INSTITUTO MATER AMABILIS;RUA PADRE ANCHIETA, 438;MONTE CASTELO;
2024;1;FORTALEZA;44500;BARBOSINHA DOS RODOVIÁRIOS;82;223;;1;EEFM CLÁUDIO MARTINS;RUA DEMÓCRITO ROCHA, 400;MONTE CASTELO;
2024;1;FORTALEZA;44500;BARBOSINHA DOS RODOVIÁRIOS;82;239;;1;EEFM GOVERNADOR FLÁVIO MARCÍLIO;AV. PASTEUR, 575;PIRAMBU;
2024;1;FORTALEZA;44500;BARBOSINHA DOS RODOVIÁRIOS;82;257;;1;CEJA PAULO FREIRE;RUA OLAVO BILAC, 1300;SÃO GERARDO;
2024;1;FORTALEZA;44500;BARBOSINHA DOS RODOVIÁRIOS;82;361;;1;COLÉGIO MASTER - BEZERRA DE MENEZES;AV. BEZERRA DE MENEZES, 1802;SÃO GERARDO;
2024;1;FORTALEZA;44500;BARBOSINHA DOS RODOVIÁRIOS;82;382;;1;COLÉGIO MENINO JESUS DE PRAGA;RUA ANA FACÓ, 140;CARLITO PAMPLONA;
2024;1;FORTALEZA;44500;BARBOSINHA DOS RODOVIÁRIOS;82;388;;1;CEJA  MONSENHOR HÉLIO CAMPOS;AV. MONSENHOR HÉLIO CAMPOS, 251;CRISTO REDENTOR;
2024;1;FORTALEZA;44500;BARBOSINHA DOS RODOVIÁRIOS;82;404;;1;EEFM CLÁUDIO MARTINS;RUA DEMÓCRITO ROCHA, 400;MONTE CASTELO;
2024;1;FORTALEZA;44500;BARBOSINHA DOS RODOVIÁRIOS;82;445;;1;CENTRO EDUCACIONAL SÃO MATEUS;AV. SARGENTO HERMÍNIO SAMPAIO, 2440;MONTE CASTELO;
2024;1;FORTALEZA;44500;BARBOSINHA DOS RODOVIÁRIOS;82;462;;1;ESCOLA MUNICIPAL PROFESSOR MARTINZ DE AGUIAR - EI/EF;RUA BERNARDO PORTO, 490;MONTE CASTELO;
2024;1;FORTALEZA;44500;BARBOSINHA DOS RODOVIÁRIOS;82;471;;1;CEJA PAULO FREIRE;RUA OLAVO BILAC, 1300;SÃO GERARDO;
2024;1;FORTALEZA;44500;BARBOSINHA DOS RODOVIÁRIOS;82;546;;1;ESCOLA MUNICIPAL SANTA TEREZA - EI/EF;RUA MONSENHOR HÉLIO CAMPOS, 90;CRISTO REDENTOR;
2024;1;FORTALEZA;44500;BARBOSINHA DOS RODOVIÁRIOS;82;547;;1;EMEIEF HONÓRIO BEZERRA;RUA CAPITÃO NESTOR GÓIS, 400;ELLERY;
2024;1;FORTALEZA;44500;BARBOSINHA DOS RODOVIÁRIOS;82;593;;1;COLÉGIO PROF. F. EURÍDICE;RUA NATURALISTA FEIJÓ, 736;MONTE CASTELO;
2024;1;FORTALEZA;44500;BARBOSINHA DOS RODOVIÁRIOS;82;611;;2;INSTITUTO MATER AMABILIS;RUA PADRE ANCHIETA, 438;MONTE CASTELO;
2024;1;FORTALEZA;44500;BARBOSINHA DOS RODOVIÁRIOS;82;614;;1;COLÉGIO PROF. F. EURÍDICE;RUA NATURALISTA FEIJÓ, 736;MONTE CASTELO;
2024;1;FORTALEZA;44500;BARBOSINHA DOS RODOVIÁRIOS;82;618;;1;POSTO DE SAÚDE CARLOS RIBEIRO;RUA JACINTO MATOS, 944;JACARECANGA;
2024;1;FORTALEZA;44500;BARBOSINHA DOS RODOVIÁRIOS;82;620;;1;CENTRO EDUCACIONAL SÃO MATEUS;AV. SARGENTO HERMÍNIO SAMPAIO, 2440;MONTE CASTELO;
2024;1;FORTALEZA;44500;BARBOSINHA DOS RODOVIÁRIOS;82;671;;1;ESCOLA MUNICIPAL ANTONIO MENDES - EI/EF;RUA DONA MENDINA, 682;CRISTO REDENTOR;
2024;1;FORTALEZA;44500;BARBOSINHA DOS RODOVIÁRIOS;82;686;;1;EEFM JOSÉ VALDO RIBEIRO RAMOS - EEMTI;RUA PEDRO AMÉRICO, 100;CARLITO PAMPLONA;
2024;1;FORTALEZA;44500;BARBOSINHA DOS RODOVIÁRIOS;83;3;;1;COLÉGIO DA POLÍCIA MILITAR DO CEARÁ GENERAL EDGARD FACÓ;AVENIDA MISTER HULL,  S/N - KM 1;ANTÔNIO BEZERRA;
2024;1;FORTALEZA;44500;BARBOSINHA DOS RODOVIÁRIOS;83;27;;1;ESCOLA MUNICIPAL NILSON HOLANDA;RUA VIRIATO RIBEIRO 1355;BELA VISTA;
2024;1;FORTALEZA;44500;BARBOSINHA DOS RODOVIÁRIOS;83;65;;1;EEFM JOAQUIM ALVES;RUA ESTADO DO RIO 955;DEMOCRITO ROCHA;
2024;1;FORTALEZA;44500;BARBOSINHA DOS RODOVIÁRIOS;83;67;;1;EEFM JOAQUIM ALVES;RUA ESTADO DO RIO 955;DEMOCRITO ROCHA;
2024;1;FORTALEZA;44500;BARBOSINHA DOS RODOVIÁRIOS;83;90;;2;EEM  MARIANO MARTINS;AVENIDA SENADOR FERNANDES TÁVORA 1445;HENRIQUE JORGE;
2024;1;FORTALEZA;44500;BARBOSINHA DOS RODOVIÁRIOS;83;96;;1;EEM  MARIANO MARTINS;AVENIDA SENADOR FERNANDES TÁVORA 1445;HENRIQUE JORGE;
2024;1;FORTALEZA;44500;BARBOSINHA DOS RODOVIÁRIOS;83;118;790;1;ESCOLA MUNICIPAL MURILO SERPA;RUA MONSENHOR HIPOLITO BRASIL 1400;DOM LUSTOSA;
2024;1;FORTALEZA;44500;BARBOSINHA DOS RODOVIÁRIOS;83;124;;1;EEMTI ANTONIETA SIQUEIRA;RUA GUARANI 04;HENRIQUE JORGE;
2024;1;FORTALEZA;44500;BARBOSINHA DOS RODOVIÁRIOS;83;128;;2;EEMTI ANTONIETA SIQUEIRA;RUA GUARANI 04;HENRIQUE JORGE;
2024;1;FORTALEZA;44500;BARBOSINHA DOS RODOVIÁRIOS;83;165;;1;EEFM HERACLITO DE CASTRO E SILVA;RUA SILVEIRA FILHO, 808;JÓQUEI CLUBE;
2024;1;FORTALEZA;44500;BARBOSINHA DOS RODOVIÁRIOS;83;169;;1;EEFM HERACLITO DE CASTRO E SILVA;RUA SILVEIRA FILHO, 808;JÓQUEI CLUBE;
2024;1;FORTALEZA;44500;BARBOSINHA DOS RODOVIÁRIOS;83;171;;1;EEFM HERACLITO DE CASTRO E SILVA;RUA SILVEIRA FILHO, 808;JÓQUEI CLUBE;
2024;1;FORTALEZA;44500;BARBOSINHA DOS RODOVIÁRIOS;83;231;;1;ESCOLA MUNICIPAL JOSÉ BATISTA DE OLIVEIRA;RUA GOIÁS 620;PANAMERICANO;
2024;1;FORTALEZA;44500;BARBOSINHA DOS RODOVIÁRIOS;83;232;;1;ESCOLA MUNICIPAL JOSÉ BATISTA DE OLIVEIRA;RUA GOIÁS 620;PANAMERICANO;
2024;1;FORTALEZA;44500;BARBOSINHA DOS RODOVIÁRIOS;83;234;;1;ESCOLA MUNICIPAL JOSÉ BATISTA DE OLIVEIRA;RUA GOIÁS 620;PANAMERICANO;
2024;1;FORTALEZA;44500;BARBOSINHA DOS RODOVIÁRIOS;83;237;;1;ESCOLA MUNICIPAL JOSÉ BATISTA DE OLIVEIRA;RUA GOIÁS 620;PANAMERICANO;
2024;1;FORTALEZA;44500;BARBOSINHA DOS RODOVIÁRIOS;83;238;;1;ESCOLA MUNICIPAL JOSÉ BATISTA DE OLIVEIRA;RUA GOIÁS 620;PANAMERICANO;
2024;1;FORTALEZA;44500;BARBOSINHA DOS RODOVIÁRIOS;83;239;;1;ESCOLA MUNICIPAL JOSÉ BATISTA DE OLIVEIRA;RUA GOIÁS 620;PANAMERICANO;
2024;1;FORTALEZA;44500;BARBOSINHA DOS RODOVIÁRIOS;83;246;;1;EEFM ANISIO TEIXEIRA;RUA RIO GRANDE DO SUL 680;PANAMERICANO;
2024;1;FORTALEZA;44500;BARBOSINHA DOS RODOVIÁRIOS;83;250;;1;EEFM ANISIO TEIXEIRA;RUA RIO GRANDE DO SUL 680;PANAMERICANO;
2024;1;FORTALEZA;44500;BARBOSINHA DOS RODOVIÁRIOS;83;320;;2;ESCOLA MUNICIPAL JOSÉ BONIFÁCIO DE SOUSA;RUA PERNAMBUCO 600;DEMOCRITO ROCHA;
2024;1;FORTALEZA;44500;BARBOSINHA DOS RODOVIÁRIOS;83;415;;1;COLEGIO CHRISTUS;AV. ENG. HUMBERTO MONTE, 1355;BELA VISTA;
2024;1;FORTALEZA;44500;BARBOSINHA DOS RODOVIÁRIOS;83;416;;2;EEMTI ESTADO DO AMAZONAS;RUA MONSENHOR FURTADO 2327;BELA VISTA;
2024;1;FORTALEZA;44500;BARBOSINHA DOS RODOVIÁRIOS;83;428;;1;EEMTI ESTADO DO AMAZONAS;RUA MONSENHOR FURTADO 2327;BELA VISTA;
2024;1;FORTALEZA;44500;BARBOSINHA DOS RODOVIÁRIOS;83;429;;2;EEMTI ESTADO DO AMAZONAS;RUA MONSENHOR FURTADO 2327;BELA VISTA;
2024;1;FORTALEZA;44500;BARBOSINHA DOS RODOVIÁRIOS;83;463;;2;ESCOLA MUNICIPAL JOSÉ BATISTA DE OLIVEIRA;RUA GOIÁS 620;PANAMERICANO;
2024;1;FORTALEZA;44500;BARBOSINHA DOS RODOVIÁRIOS;83;493;;1;COLÉGIO LUCÊ;RUA CUIABA 155;JÓQUEI CLUBE;
2024;1;FORTALEZA;44500;BARBOSINHA DOS RODOVIÁRIOS;83;502;;1;ESCOLA MUNICIPAL JOSÉ BONIFÁCIO DE SOUSA;RUA PERNAMBUCO 600;DEMOCRITO ROCHA;
2024;1;FORTALEZA;44500;BARBOSINHA DOS RODOVIÁRIOS;83;522;;2;CENTRO DE FORMAÇÃO E DESENV. PARA PROFISSIONAIS DA EDUCAÇÃO - FORMACE;RUA PORTO VELHO, 401;JOÃO XXIII;
2024;1;FORTALEZA;44500;BARBOSINHA DOS RODOVIÁRIOS;83;542;;1;ESCOLA MUNICIPAL JOSÉ BONIFÁCIO DE SOUSA;RUA PERNAMBUCO 600;DEMOCRITO ROCHA;
2024;1;FORTALEZA;44500;BARBOSINHA DOS RODOVIÁRIOS;83;552;;1;ESCOLA MUNICIPAL JOSÉ BATISTA DE OLIVEIRA;RUA GOIÁS 620;PANAMERICANO;
2024;1;FORTALEZA;44500;BARBOSINHA DOS RODOVIÁRIOS;83;591;;2;CENTRO EDUCACIONAL SÃO SEBASTIÃO;RUA GUANABARA 1003;DEMOCRITO ROCHA;
2024;1;FORTALEZA;44500;BARBOSINHA DOS RODOVIÁRIOS;83;601;;1;EEMTI ANTONIETA SIQUEIRA;RUA GUARANI 04;HENRIQUE JORGE;
2024;1;FORTALEZA;44500;BARBOSINHA DOS RODOVIÁRIOS;83;603;;1;ESCOLA MUNICIPAL SANTA MARIA;RUA CUIABÁ 1465;HENRIQUE JORGE;
2024;1;FORTALEZA;44500;BARBOSINHA DOS RODOVIÁRIOS;83;680;;1;ESCOLA MUNICIPAL DONA DAGMAR GENTIL;RUA VITORIA 1750;HENRIQUE JORGE;
2024;1;FORTALEZA;44500;BARBOSINHA DOS RODOVIÁRIOS;83;689;;1;ESCOLA MUNICIPAL ADROALDO TEIXEIRA CASTELO;RUA ALAGOAS 2267;PICI;
2024;1;FORTALEZA;44500;BARBOSINHA DOS RODOVIÁRIOS;83;693;;1;EDUCANDARIO FELIPE DOS SANTOS;RUA TERESINA 313;HENRIQUE JORGE;
2024;1;FORTALEZA;44500;BARBOSINHA DOS RODOVIÁRIOS;83;701;;1;COLÉGIO LUCÊ;RUA CUIABA 155;JÓQUEI CLUBE;
2024;1;FORTALEZA;44500;BARBOSINHA DOS RODOVIÁRIOS;83;702;;4;EEEP JÚLIA GIFFONI;RUA CORONEL MATOS DOURADO 1349;PICI;
2024;1;FORTALEZA;44500;BARBOSINHA DOS RODOVIÁRIOS;83;722;;2;EEEP JÚLIA GIFFONI;RUA CORONEL MATOS DOURADO 1349;PICI;
2024;1;FORTALEZA;44500;BARBOSINHA DOS RODOVIÁRIOS;83;731;;1;EEMTI ANTONIETA SIQUEIRA;RUA GUARANI 04;HENRIQUE JORGE;
2024;1;FORTALEZA;44500;BARBOSINHA DOS RODOVIÁRIOS;83;735;;1;COLEGIO CHRISTUS;AV. ENG. HUMBERTO MONTE, 1355;BELA VISTA;
2024;1;FORTALEZA;44500;BARBOSINHA DOS RODOVIÁRIOS;83;737;;1;EEMTI ANTONIETA SIQUEIRA;RUA GUARANI 04;HENRIQUE JORGE;
2024;1;FORTALEZA;44500;BARBOSINHA DOS RODOVIÁRIOS;83;740;;1;EEEP JÚLIA GIFFONI;RUA CORONEL MATOS DOURADO 1349;PICI;
2024;1;FORTALEZA;44500;BARBOSINHA DOS RODOVIÁRIOS;83;767;;1;CENTRO EDUCACIONAL BRASILEIRINHO;AVENIDA SENADOR FERNANDES TÁVORA, 1717;HENRIQUE JORGE;
2024;1;FORTALEZA;44500;BARBOSINHA DOS RODOVIÁRIOS;83;774;;1;ESCOLA ESPAÇO VIVÊNCIA;RUA MONSENHOR HIPÓLITO BRASIL, 1367;DOM LUSTOSA;
2024;1;FORTALEZA;44500;BARBOSINHA DOS RODOVIÁRIOS;83;777;;1;COLÉGIO DA POLÍCIA MILITAR DO CEARÁ GENERAL EDGARD FACÓ;AVENIDA MISTER HULL,  S/N - KM 1;ANTÔNIO BEZERRA;
2024;1;FORTALEZA;44500;BARBOSINHA DOS RODOVIÁRIOS;83;781;;1;ESCOLA MUNICIPAL MURILO SERPA;RUA MONSENHOR HIPOLITO BRASIL 1400;DOM LUSTOSA;
2024;1;FORTALEZA;44500;BARBOSINHA DOS RODOVIÁRIOS;83;783;;2;CENTRO DE FORMAÇÃO E DESENV. PARA PROFISSIONAIS DA EDUCAÇÃO - FORMACE;RUA PORTO VELHO, 401;JOÃO XXIII;
2024;1;FORTALEZA;44500;BARBOSINHA DOS RODOVIÁRIOS;83;786;;2;CENTRO DE FORMAÇÃO E DESENV. PARA PROFISSIONAIS DA EDUCAÇÃO - FORMACE;RUA PORTO VELHO, 401;JOÃO XXIII;
2024;1;FORTALEZA;44500;BARBOSINHA DOS RODOVIÁRIOS;83;789;;1;CENTRO DE FORMAÇÃO E DESENV. PARA PROFISSIONAIS DA EDUCAÇÃO - FORMACE;RUA PORTO VELHO, 401;JOÃO XXIII;
2024;1;FORTALEZA;44500;BARBOSINHA DOS RODOVIÁRIOS;85;98;;1;COLÉGIO AFONSO ANDRADE;RUA CEL MATOS DOURADO, 168;ANTÔNIO BEZERRA;
2024;1;FORTALEZA;44500;BARBOSINHA DOS RODOVIÁRIOS;85;99;;1;COLÉGIO AFONSO ANDRADE;RUA CEL MATOS DOURADO, 168;ANTÔNIO BEZERRA;
2024;1;FORTALEZA;44500;BARBOSINHA DOS RODOVIÁRIOS;85;107;;1;CEJA ADELINO DE ALCANTARA FILHO - UV-6;RUA SEISCENTOS E DOZE, 100, 1A ETAPA;CONJUNTO CEARÁ I;
2024;1;FORTALEZA;44500;BARBOSINHA DOS RODOVIÁRIOS;85;112;;1;CEJA ADELINO DE ALCANTARA FILHO - UV-6;RUA SEISCENTOS E DOZE, 100, 1A ETAPA;CONJUNTO CEARÁ I;
2024;1;FORTALEZA;44500;BARBOSINHA DOS RODOVIÁRIOS;85;132;;1;COLÉGIO LUÍZA TÁVORA;RUA 1050, N 171, 4 ETAPA;CONJUNTO CEARÁ I;
2024;1;FORTALEZA;44500;BARBOSINHA DOS RODOVIÁRIOS;85;138;;1;COLÉGIO LUÍZA TÁVORA;RUA 1050, N 171, 4 ETAPA;CONJUNTO CEARÁ I;
2024;1;FORTALEZA;44500;BARBOSINHA DOS RODOVIÁRIOS;85;146;;1;EEEP PROFESSOR CESAR CAMPELO;RUA 717, N.164, 3 ETAPA;CONJUNTO CEARÁ I;
2024;1;FORTALEZA;44500;BARBOSINHA DOS RODOVIÁRIOS;85;174;;1;EEFM MARIO HUGO CIDRAK DO VALE;RUA DR. PERIGUARI, 547;ANTÔNIO BEZERRA;
2024;1;FORTALEZA;44500;BARBOSINHA DOS RODOVIÁRIOS;85;193;;1;EMEIF IRMÃ MARIA EVANETE;AV D, 1015 2 ETAPA;CONJUNTO CEARÁ I;
2024;1;FORTALEZA;44500;BARBOSINHA DOS RODOVIÁRIOS;85;219;;1;EEFM MARIA ANTONIETA NUNES - UV 9;RUA 916 SN 4 ETAPA;CONJUNTO CEARÁ I;
2024;1;FORTALEZA;44500;BARBOSINHA DOS RODOVIÁRIOS;85;221;;1;EEFM MARIA ANTONIETA NUNES - UV 9;RUA 916 SN 4 ETAPA;CONJUNTO CEARÁ I;
2024;1;FORTALEZA;44500;BARBOSINHA DOS RODOVIÁRIOS;85;225;;1;EEM LICEU DO CONJUNTO CEARA;RUA 1139 A, 10 4 ETAPA;CONJUNTO CEARÁ I;
2024;1;FORTALEZA;44500;BARBOSINHA DOS RODOVIÁRIOS;85;241;;1;EEM PROF JOSE MARIA CAMPOS DE OLIVEIRA - UV 8;RUA 820 S/N - 3 ETAPA;CONJUNTO CEARÁ I;
2024;1;FORTALEZA;44500;BARBOSINHA DOS RODOVIÁRIOS;85;249;;1;EEM PROF JOSE MARIA CAMPOS DE OLIVEIRA - UV 8;RUA 820 S/N - 3 ETAPA;CONJUNTO CEARÁ I;
2024;1;FORTALEZA;44500;BARBOSINHA DOS RODOVIÁRIOS;85;254;;1;EEF PATRONATO DA SAGRADA FAMILIA;RUA MARTINS NETO 379;ANTÔNIO BEZERRA;
2024;1;FORTALEZA;44500;BARBOSINHA DOS RODOVIÁRIOS;85;277;;1;EEFM PROF PLACIDO ADERALDO CASTELO - UV 7B;RUA SETECENTOS E VINTE E UM, 100, 3A ETAPA;CONJUNTO CEARÁ I;
2024;1;FORTALEZA;44500;BARBOSINHA DOS RODOVIÁRIOS;85;281;;1;EEFM PROF PLACIDO ADERALDO CASTELO - UV 7B;RUA SETECENTOS E VINTE E UM, 100, 3A ETAPA;CONJUNTO CEARÁ I;
2024;1;FORTALEZA;44500;BARBOSINHA DOS RODOVIÁRIOS;85;313;;1;ESCOLA MUNICIPAL DEP MURILO AGUIAR;RUA 24 DE OUTUBRO 655;GENIBAÚ;
2024;1;FORTALEZA;44500;BARBOSINHA DOS RODOVIÁRIOS;85;325;;1;EEFM DR UBIRAJARA INDIO DO CEARA - UV-7A;RUA SETECENTOS E CINQUENTA E UM, 192, 3A ETAPA;CONJUNTO CEARÁ I;
2024;1;FORTALEZA;44500;BARBOSINHA DOS RODOVIÁRIOS;85;326;;1;EEFM DR UBIRAJARA INDIO DO CEARA - UV-7A;RUA SETECENTOS E CINQUENTA E UM, 192, 3A ETAPA;CONJUNTO CEARÁ I;
2024;1;FORTALEZA;44500;BARBOSINHA DOS RODOVIÁRIOS;85;338;;1;ESCOLA MUNICIPAL DEP JOAO FREDERICO FERREIRA GOMES;RUA JOSE MENDONCA 1160;GENIBAÚ;
2024;1;FORTALEZA;44500;BARBOSINHA DOS RODOVIÁRIOS;85;348;;1;EMTI PROF PRISCO BEZERRA;AVENIDA F , 174;CONJUNTO CEARÁ I;
2024;1;FORTALEZA;44500;BARBOSINHA DOS RODOVIÁRIOS;85;357;;1;EEFM AYRTON SENNA DA SILVA;RUA MANAUS, 855;DOM LUSTOSA;
2024;1;FORTALEZA;44500;BARBOSINHA DOS RODOVIÁRIOS;85;362;;2;EEFM AYRTON SENNA DA SILVA;RUA MANAUS, 855;DOM LUSTOSA;
2024;1;FORTALEZA;44500;BARBOSINHA DOS RODOVIÁRIOS;85;365;;1;EEFM AYRTON SENNA DA SILVA;RUA MANAUS, 855;DOM LUSTOSA;
2024;1;FORTALEZA;44500;BARBOSINHA DOS RODOVIÁRIOS;85;373;;2;EEFM DOUTOR GENTIL BARREIRA;RUA 202-D, S/N - CONJUNTO CEARÁ I;CONJUNTO CEARÁ I;
2024;1;FORTALEZA;44500;BARBOSINHA DOS RODOVIÁRIOS;85;378;;1;ESCOLA PE JOSE ARIMATEIA DINIZ;RUA OITOCENTOS E DEZ, S/N, 3A ETAPA (AO LADO DA UPA);CONJUNTO CEARÁ I;
2024;1;FORTALEZA;44500;BARBOSINHA DOS RODOVIÁRIOS;85;381;;1;EEM PROF JOSE MARIA CAMPOS DE OLIVEIRA - UV 8;RUA 820 S/N - 3 ETAPA;CONJUNTO CEARÁ I;
2024;1;FORTALEZA;44500;BARBOSINHA DOS RODOVIÁRIOS;85;382;;1;EEFM PROF PLACIDO ADERALDO CASTELO - UV 7B;RUA SETECENTOS E VINTE E UM, 100, 3A ETAPA;CONJUNTO CEARÁ I;
2024;1;FORTALEZA;44500;BARBOSINHA DOS RODOVIÁRIOS;85;391;;1;CENTRO DE EDUCAÇÃO INFANTIL MURILO AGUIAR;RUA 24 DE OUTUBRO N 1063;GENIBAÚ;
2024;1;FORTALEZA;44500;BARBOSINHA DOS RODOVIÁRIOS;85;394;;1;CENTRO DE EDUCAÇÃO INFANTIL MURILO AGUIAR;RUA 24 DE OUTUBRO N 1063;GENIBAÚ;
2024;1;FORTALEZA;44500;BARBOSINHA DOS RODOVIÁRIOS;93;73;;1;EM JONATHAN DA ROCHA ALCOFORADO;RUA MARIA GOMES DE SÁ,1030 ARACAPÉ;MONDUBIM;
2024;1;FORTALEZA;44500;BARBOSINHA DOS RODOVIÁRIOS;93;92;;1;EM MINHA VIDA MEUS AMORES;AVENIDA D, 380 - II ETAPA;PREFEITO JOSÉ WALTER;
2024;1;FORTALEZA;44500;BARBOSINHA DOS RODOVIÁRIOS;93;111;;4;EM OSMIRIO DE OLIVEIRA BARRETO;RUA 10, S/N (CJ SITIO DO CÓRREGO);MONDUBIM;
2024;1;FORTALEZA;44500;BARBOSINHA DOS RODOVIÁRIOS;93;114;;1;CEI MARIA HERCILIA EVANGELISTA;RUA 3, 300 - PARQUE SANTANA;MONDUBIM;
2024;1;FORTALEZA;44500;BARBOSINHA DOS RODOVIÁRIOS;93;117;;1;ESCOLA SANTANA;RUA 10, 1305;MONDUBIM;
2024;1;FORTALEZA;44500;BARBOSINHA DOS RODOVIÁRIOS;93;123;;1;EEFM DEPUTADO JOACI PEREIRA;RUA PROFESSOR PEDRO JORGE, 830;PLANALTO AYRTON SENNA;
2024;1;FORTALEZA;44500;BARBOSINHA DOS RODOVIÁRIOS;93;176;;1;EEFM ESTADO DO MARANHAO;RUA CARLOS PIMENTA,506;MONDUBIM;
2024;1;FORTALEZA;44500;BARBOSINHA DOS RODOVIÁRIOS;93;177;;1;EEFM ESTADO DO MARANHAO;RUA CARLOS PIMENTA,506;MONDUBIM;
2024;1;FORTALEZA;44500;BARBOSINHA DOS RODOVIÁRIOS;93;196;;1;EM ADALBERTO STUDART FILHO;RUA DO CAMPO, 25;PLANALTO AYRTON SENNA;
2024;1;FORTALEZA;44500;BARBOSINHA DOS RODOVIÁRIOS;93;204;;1;LICEU ESTADUAL DOMINGOS BRASILEIRO;RUA PLANALTINA, S/N;PLANALTO AYRTON SENNA;
2024;1;FORTALEZA;44500;BARBOSINHA DOS RODOVIÁRIOS;93;220;;1;EEFM POLIVALENTE MODELO DE FORTALEZA;AV A (ARAQUÉM AGUIAR), 482 - I ETAPA;PREFEITO JOSÉ WALTER;
2024;1;FORTALEZA;44500;BARBOSINHA DOS RODOVIÁRIOS;93;249;;1;ESCOLA MUNICIPAL ARI DE SA CAVALCANTE (JOSÉ WALTER);AV. H, 430 III ETAPA;PREFEITO JOSÉ WALTER;
2024;1;FORTALEZA;44500;BARBOSINHA DOS RODOVIÁRIOS;93;258;;2;EM FRANCISCO NUNES CAVALCANTE;RUA POETA MÁRIO LINHARES, 561;PREFEITO JOSÉ WALTER;
2024;1;FORTALEZA;44500;BARBOSINHA DOS RODOVIÁRIOS;93;260;;1;EM OSMIRIO DE OLIVEIRA BARRETO;RUA 10, S/N (CJ SITIO DO CÓRREGO);MONDUBIM;
2024;1;FORTALEZA;44500;BARBOSINHA DOS RODOVIÁRIOS;93;265;;1;COLEGIO VEGA;AVENIDA C, 160;PREFEITO JOSÉ WALTER;
2024;1;FORTALEZA;44500;BARBOSINHA DOS RODOVIÁRIOS;93;281;;1;EM PROFESSORA IRENE DE SOUZA PEREIRA;RUA PARQUE UMARI, 100;PLANALTO AYRTON SENNA;
2024;1;FORTALEZA;44500;BARBOSINHA DOS RODOVIÁRIOS;93;291;;1;EM FRANCISCO NUNES CAVALCANTE;RUA POETA MÁRIO LINHARES, 561;PREFEITO JOSÉ WALTER;
2024;1;FORTALEZA;44500;BARBOSINHA DOS RODOVIÁRIOS;93;295;;1;ESCOLA MUNICIPAL ARI DE SA CAVALCANTE (JOSÉ WALTER);AV. H, 430 III ETAPA;PREFEITO JOSÉ WALTER;
2024;1;FORTALEZA;44500;BARBOSINHA DOS RODOVIÁRIOS;94;4;;3;CENTRO COMUNITARIO CONJUNTO SAO FRANCISCO;RUA ILHA DO BOTE 367;QUINTINO CUNHA;
2024;1;FORTALEZA;44500;BARBOSINHA DOS RODOVIÁRIOS;94;6;;3;CENTRO COMUNITARIO CONJUNTO SAO FRANCISCO;RUA ILHA DO BOTE 367;QUINTINO CUNHA;
2024;1;FORTALEZA;44500;BARBOSINHA DOS RODOVIÁRIOS;94;7;;1;EEMTI MARIA JOSÉ SANTOS FERREIRA GOMES;RUA DONA LUCIA PINHEIRO, 93;QUINTINO CUNHA;
2024;1;FORTALEZA;44500;BARBOSINHA DOS RODOVIÁRIOS;94;8;;2;CEI SÃO CARLOS;RUA DOS PESCADORES,188;QUINTINO CUNHA;
2024;1;FORTALEZA;44500;BARBOSINHA DOS RODOVIÁRIOS;94;24;;1;EEF JESUS, MARIA E JOSE;RUA DA MANGUEIRA 134;QUINTINO CUNHA;
2024;1;FORTALEZA;44500;BARBOSINHA DOS RODOVIÁRIOS;94;25;;1;EEF JESUS, MARIA E JOSE;RUA DA MANGUEIRA 134;QUINTINO CUNHA;
2024;1;FORTALEZA;44500;BARBOSINHA DOS RODOVIÁRIOS;94;28;;1;EEMTI MARIA JOSÉ SANTOS FERREIRA GOMES;RUA DONA LUCIA PINHEIRO, 93;QUINTINO CUNHA;
2024;1;FORTALEZA;44500;BARBOSINHA DOS RODOVIÁRIOS;94;30;;1;EEFM JOSE BEZERRA DE MENEZES (POLIVALENTE);RUA ANARIO BRAGA SN;ANTÔNIO BEZERRA;
2024;1;FORTALEZA;44500;BARBOSINHA DOS RODOVIÁRIOS;94;31;;2;EEFM JOSE BEZERRA DE MENEZES (POLIVALENTE);RUA ANARIO BRAGA SN;ANTÔNIO BEZERRA;
2024;1;FORTALEZA;44500;BARBOSINHA DOS RODOVIÁRIOS;94;32;;1;EM PADRE JOSEFINO CABRAL;AV SARGENTO HERMINIO SAMPAIO 5598;ANTÔNIO BEZERRA;
2024;1;FORTALEZA;44500;BARBOSINHA DOS RODOVIÁRIOS;94;33;;1;EM PADRE JOSEFINO CABRAL;AV SARGENTO HERMINIO SAMPAIO 5598;ANTÔNIO BEZERRA;
2024;1;FORTALEZA;44500;BARBOSINHA DOS RODOVIÁRIOS;94;34;;1;EM PADRE JOSEFINO CABRAL;AV SARGENTO HERMINIO SAMPAIO 5598;ANTÔNIO BEZERRA;
2024;1;FORTALEZA;44500;BARBOSINHA DOS RODOVIÁRIOS;94;35;;1;EMTI JOSÉ CARLOS DE OLIVEIRA NETO;R. SAO VICENTE DE PAULO, 170;ANTÔNIO BEZERRA;
