2024;1;FORTALEZA;44500;BARBOSINHA DOS RODOVIÁRIOS;117;406;;1;EEFM SÃO FRANCISCO DE ASSIS;RUA SÃO FELIPE, 564;CANINDEZINHO;
2024;1;FORTALEZA;44500;BARBOSINHA DOS RODOVIÁRIOS;117;423;;1;EEEP DARCY RIBEIRO;RUA CONEGO DE CASTRO, S/N;CONJUNTO ESPERANÇA;
2024;1;FORTALEZA;44500;BARBOSINHA DOS RODOVIÁRIOS;117;428;;1;EMEIF MARIA BEZERRA QUEVEDO;RUA 103, 28 - CJ. NOVO MONDUBIM;MANOEL SÁTIRO;
2024;1;FORTALEZA;44500;BARBOSINHA DOS RODOVIÁRIOS;117;446;;3;ESCOLA MUNICIPAL PROF JOSE CÍRIO PEREIRA FILHO;RUA QUARTZO ROSA, 100;SIQUEIRA;
2024;1;FORTALEZA;44500;BARBOSINHA DOS RODOVIÁRIOS;117;451;;1;EM PADRE ANTONIO MONTEIRO DA CRUZ;RUA DE PEDESTRE XIII, 25 - JARDIM FLUMINENSE II;CANINDEZINHO;
2024;1;FORTALEZA;44500;BARBOSINHA DOS RODOVIÁRIOS;117;455;;1;ESCOLA MUNICIPAL PROF JOSE CÍRIO PEREIRA FILHO;RUA QUARTZO ROSA, 100;SIQUEIRA;
2024;1;FORTALEZA;44500;BARBOSINHA DOS RODOVIÁRIOS;117;457;;1;CEI FRANCISCA DE ABREU LIMA;RUA C -  ESQUINA COM A RUA LUIZ MONTENEGRO, S/N;SIQUEIRA;
2024;1;FORTALEZA;44500;BARBOSINHA DOS RODOVIÁRIOS;117;467;490;1;COLÉGIO CEARENSE TOTAL;AVENIDA D, 85;CONJUNTO ESPERANÇA;
2024;1;FORTALEZA;44500;BARBOSINHA DOS RODOVIÁRIOS;117;472;;1;EM FLORIVAL ALVES SERAINE;RUA ITATIAIA, 1000;CANINDEZINHO;
2024;1;FORTALEZA;44500;BARBOSINHA DOS RODOVIÁRIOS;117;473;;1;EM JOSE MARIA MOREIRA CAMPOS;RUA FRANCISCO ALMEIDA, 525 CJ. APOLO XI;PARQUE PRESIDENTE VARGAS;
2024;1;FORTALEZA;44500;BARBOSINHA DOS RODOVIÁRIOS;117;474;491;2;EMTI PROFESSOR AGERSON TABOSA PINTO;RUA WILCA ALBUQUERQUE, S/N;SIQUEIRA;
2024;1;FORTALEZA;44500;BARBOSINHA DOS RODOVIÁRIOS;117;478;;1;ESCOLA MUNICIPAL JORNALISTA DEMÓCRITO DUMMAR;RUA EUCLIDES PAULINO BARROSO, 2505;CANINDEZINHO;
2024;1;FORTALEZA;44500;BARBOSINHA DOS RODOVIÁRIOS;117;487;;1;COLÉGIO CASTRO ALVES;RUA TULIPA NEGRA, 2319;PARQUE PRESIDENTE VARGAS;
2024;1;FORTALEZA;44500;BARBOSINHA DOS RODOVIÁRIOS;118;13;;1;EM SANTA TEREZINHA;RUA AFONSO LOPES, 1095;PARQUE DOIS IRMÃOS;
2024;1;FORTALEZA;44500;BARBOSINHA DOS RODOVIÁRIOS;118;16;;1;EM SANTA TEREZINHA;RUA AFONSO LOPES, 1095;PARQUE DOIS IRMÃOS;
2024;1;FORTALEZA;44500;BARBOSINHA DOS RODOVIÁRIOS;118;56;;1;COLEGIO CONEXÃO SABER;RUA DOUTOR PEDRO SAMPAIO, 550;PASSARÉ;
2024;1;FORTALEZA;44500;BARBOSINHA DOS RODOVIÁRIOS;118;119;;1;COLÉGIO LIRA COUTINHO;RUA BELOS PORTOS, 447;PASSARÉ;
2024;1;FORTALEZA;44500;BARBOSINHA DOS RODOVIÁRIOS;118;137;;1;EM ZAIRA MONTEIRO GONDIM;RUA PEDRO AGUIAR, 315;ITAPERI;
2024;1;FORTALEZA;44500;BARBOSINHA DOS RODOVIÁRIOS;118;139;;1;EM ZAIRA MONTEIRO GONDIM;RUA PEDRO AGUIAR, 315;ITAPERI;
2024;1;FORTALEZA;44500;BARBOSINHA DOS RODOVIÁRIOS;118;213;;1;EEMTI INTEGRADA 2 DE MAIO;AVENIDA DA SAUDADE, S/N;PASSARÉ;
2024;1;FORTALEZA;44500;BARBOSINHA DOS RODOVIÁRIOS;118;294;;1;EM RAIMUNDO DE MOURA MATOS;AVENIDA DOIS DE MAIO, 1300;PASSARÉ;
2024;1;FORTALEZA;44500;BARBOSINHA DOS RODOVIÁRIOS;118;298;;1;COLÉGIO MARIA ESTER I;RUA ANTONIO TEIXEIRA LEITE, 248;SERRINHA;
2024;1;FORTALEZA;44500;BARBOSINHA DOS RODOVIÁRIOS;118;321;;1;ESCOLA EVANGELICA MONTE SINAI;RUA BRUNO VALENTE, 847;SERRINHA;
2024;1;FORTALEZA;44500;BARBOSINHA DOS RODOVIÁRIOS;118;325;;1;EEFM PROFESSOR JADER MOREIRA DE CARVALHO;RUA PROFESSORA HELOISA FERREIRA LIMA, 420;SERRINHA;
2024;1;FORTALEZA;44500;BARBOSINHA DOS RODOVIÁRIOS;118;332;;1;COLEGIO EXODUS;RUA DOUTOR EDUARDO DIAS, 156;PASSARÉ;
2024;1;FORTALEZA;44500;BARBOSINHA DOS RODOVIÁRIOS;118;359;;1;EEFM PROFESSOR JADER MOREIRA DE CARVALHO;RUA PROFESSORA HELOISA FERREIRA LIMA, 420;SERRINHA;
2024;1;FORTALEZA;44500;BARBOSINHA DOS RODOVIÁRIOS;118;381;;1;EM DELMA HERMÍNIA DA SILVA PEREIRA;AVENIDA PRESIDENTE COSTA E SILVA, 5606;PASSARÉ;
2024;1;FORTALEZA;44500;BARBOSINHA DOS RODOVIÁRIOS;118;432;;1;EM MARIA DE CARVALHO MARTINS;AVENIDA DOUTOR SILAS MUNGUBA, 4300;SERRINHA;
2024;1;FORTALEZA;44500;BARBOSINHA DOS RODOVIÁRIOS;118;444;;1;EM MARIA DE CARVALHO MARTINS;AVENIDA DOUTOR SILAS MUNGUBA, 4300;SERRINHA;
2024;1;FORTALEZA;44500;BARBOSINHA DOS RODOVIÁRIOS;118;476;;1;COLEGIO MARIA ESTER II;RUA F (CONJUNTO MIRASSOL), 158;PARQUE DOIS IRMÃOS;
2024;1;FORTALEZA;44500;BARBOSINHA DOS RODOVIÁRIOS;118;480;;1;EM PAULO SERGIO DE SOUSA LIRA;RUA ITABORAÍ, 264;PASSARÉ;
2024;1;FORTALEZA;44500;BARBOSINHA DOS RODOVIÁRIOS;118;513;;2;EM PAULO SERGIO DE SOUSA LIRA;RUA ITABORAÍ, 264;PASSARÉ;
2024;1;FORTALEZA;44500;BARBOSINHA DOS RODOVIÁRIOS;118;544;;1;EMEF ODILON GONZAGA BRAVEZA;AV. ALBERTO CRAVEIRO, 1480 C;BOA VISTA-CASTELÃO;
2024;1;FORTALEZA;44500;BARBOSINHA DOS RODOVIÁRIOS;118;546;;1;EMEF ODILON GONZAGA BRAVEZA;AV. ALBERTO CRAVEIRO, 1480 C;BOA VISTA-CASTELÃO;
2024;1;FORTALEZA;44500;BARBOSINHA DOS RODOVIÁRIOS;118;549;;1;EMEF ODILON GONZAGA BRAVEZA;AV. ALBERTO CRAVEIRO, 1480 C;BOA VISTA-CASTELÃO;
2024;1;FORTALEZA;44500;BARBOSINHA DOS RODOVIÁRIOS;118;550;;1;EM PROFESSOR JACINTO BOTELHO;RUA DR. RODRIGO CODES SANDOVAL, 374;MONDUBIM;
2024;1;FORTALEZA;44500;BARBOSINHA DOS RODOVIÁRIOS;118;566;;1;EEFM PROFESSORA MARIA GONCALVES;RUA N S DO MONTE CARMELO S/N;BOA VISTA-CASTELÃO;
2024;1;FORTALEZA;44500;BARBOSINHA DOS RODOVIÁRIOS;118;571;;1;EEFM PROFESSORA MARIA GONCALVES;RUA N S DO MONTE CARMELO S/N;BOA VISTA-CASTELÃO;
2024;1;FORTALEZA;44500;BARBOSINHA DOS RODOVIÁRIOS;118;585;;1;EEFM ANTÔNIO DIAS MACEDO;AV PEDRO DANTAS 340;DIAS MACEDO;
2024;1;FORTALEZA;44500;BARBOSINHA DOS RODOVIÁRIOS;118;605;;1;EM CASIMIRO MONTENEGRO;AV. BERNARDO MANUEL, 11360;MONDUBIM;
2024;1;FORTALEZA;44500;BARBOSINHA DOS RODOVIÁRIOS;118;612;;1;EM CASIMIRO MONTENEGRO;AV. BERNARDO MANUEL, 11360;MONDUBIM;
2024;1;FORTALEZA;44500;BARBOSINHA DOS RODOVIÁRIOS;118;614;;1;EM MARCOS VALENTIM PEREIRA DE SOUSA;RUA FREIRE ALEMÃO,91;SERRINHA;
2024;1;FORTALEZA;44500;BARBOSINHA DOS RODOVIÁRIOS;118;628;;1;COLÉGIO CONECTIVO;RUA GENERAL ONOFRE, 445;MONDUBIM;
2024;1;FORTALEZA;44500;BARBOSINHA DOS RODOVIÁRIOS;118;637;;1;EM DELMA HERMÍNIA DA SILVA PEREIRA;AVENIDA PRESIDENTE COSTA E SILVA, 5606;PASSARÉ;
2024;1;FORTALEZA;44500;BARBOSINHA DOS RODOVIÁRIOS;118;645;;1;COLÉGIO SAGRADA FAMÍLIA;RUA MADRE ELISA BALDO, 331;SERRINHA;
2024;1;FORTALEZA;44500;BARBOSINHA DOS RODOVIÁRIOS;118;652;;1;COLÉGIO SAGRADA FAMÍLIA;RUA MADRE ELISA BALDO, 331;SERRINHA;
TOTAL;;;;;;;;1230;
