2024;1;FORTALEZA;44500;BARBOSINHA DOS RODOVIÁRIOS;95;202;;1;EM TRISTÃO DE ALENCAR;RUA JOSE NOGUEIRA, 69;PEDRAS;
2024;1;FORTALEZA;44500;BARBOSINHA DOS RODOVIÁRIOS;95;205;;1;EEEP MÁRIO ALENCAR;RUA VERDE 44, 97 (CJ. SÍTIO SÃO JOÃO);JANGURUSSU;
2024;1;FORTALEZA;44500;BARBOSINHA DOS RODOVIÁRIOS;95;217;;1;EMEIEF BARBARA DE ALENCAR;RUA CAPITAO PORFIRIO, 544;PARQUE SANTA MARIA;
2024;1;FORTALEZA;44500;BARBOSINHA DOS RODOVIÁRIOS;95;224;;1;EM FRANCISCA ORIA SERPA;RUA JORGE FIGUEIREDO, 3652;PEDRAS;
2024;1;FORTALEZA;44500;BARBOSINHA DOS RODOVIÁRIOS;95;225;;1;EM FRANCISCA ORIA SERPA;RUA JORGE FIGUEIREDO, 3652;PEDRAS;
2024;1;FORTALEZA;44500;BARBOSINHA DOS RODOVIÁRIOS;95;236;;1;CEI MARIA DO SOCORRO FERREIRA VIRINO;RUA VALPARAÍSO, 339;CONJUNTO PALMEIRAS;
2024;1;FORTALEZA;44500;BARBOSINHA DOS RODOVIÁRIOS;95;251;;1;EMEIEF OTAVIO DE FARIAS;RUA JOAO FERREIRA, S/N;BARROSO;
2024;1;FORTALEZA;44500;BARBOSINHA DOS RODOVIÁRIOS;95;264;;1;EEFM PROFESSOR  ALOYSIO BARROS LEAL;RUA 10,  LOT. PRQ.VERDE 28 (CJ JOAO PAULO II);BARROSO;
2024;1;FORTALEZA;44500;BARBOSINHA DOS RODOVIÁRIOS;95;285;;2;EM PROFESSORA MARIA ANTONÉZIA MEIRELES E SÁ;RUA CORONEL VIRGÍLIO TÁVORA, 1340;BARROSO;
2024;1;FORTALEZA;44500;BARBOSINHA DOS RODOVIÁRIOS;95;292;;1;EMEIEF MARTHA DOS MARTINS COELHO GUILHERME;RUA 313, 243, CONJUNTO SÃO CRISTÓVÃO;JANGURUSSU;
2024;1;FORTALEZA;44500;BARBOSINHA DOS RODOVIÁRIOS;95;311;;1;EM PROFESSORA MARIA DO SOCORRO FERREIRA VIRINO;RUA MODESTA, 44;CONJUNTO PALMEIRAS;
2024;1;FORTALEZA;44500;BARBOSINHA DOS RODOVIÁRIOS;95;315;;1;EM PROFESSORA MARIA DO SOCORRO FERREIRA VIRINO;RUA MODESTA, 44;CONJUNTO PALMEIRAS;
2024;1;FORTALEZA;44500;BARBOSINHA DOS RODOVIÁRIOS;95;323;;1;EM PROFESSORA MARIA ANTONÉZIA MEIRELES E SÁ;RUA CORONEL VIRGÍLIO TÁVORA, 1340;BARROSO;
2024;1;FORTALEZA;44500;BARBOSINHA DOS RODOVIÁRIOS;95;327;;1;EEFM PROFESSOR  ALOYSIO BARROS LEAL;RUA 10,  LOT. PRQ.VERDE 28 (CJ JOAO PAULO II);BARROSO;
2024;1;FORTALEZA;44500;BARBOSINHA DOS RODOVIÁRIOS;95;328;;1;EMEIEF LIONS CLUBE FORTALEZA FÁTIMA;TRAVESSA LIONS CLUBE, 141;JANGURUSSU;
2024;1;FORTALEZA;44500;BARBOSINHA DOS RODOVIÁRIOS;95;330;;1;EEFM PADRE MARCELINO CHAMPAGNAT;RUA DAURA, 120;BARROSO;
2024;1;FORTALEZA;44500;BARBOSINHA DOS RODOVIÁRIOS;95;349;;1;CUCA JANGURUSSU;AV. GOVERNADOR LEONEL BRIZOLA, S/N;JANGURUSSU;
2024;1;FORTALEZA;44500;BARBOSINHA DOS RODOVIÁRIOS;112;7;;1;COLÉGIO NOVO HORIZONTE;RUA BEIJA FLOR, 25;JARDIM DAS OLIVEIRAS;
2024;1;FORTALEZA;44500;BARBOSINHA DOS RODOVIÁRIOS;112;10;;1;COLÉGIO NOVO HORIZONTE;RUA BEIJA FLOR, 25;JARDIM DAS OLIVEIRAS;
2024;1;FORTALEZA;44500;BARBOSINHA DOS RODOVIÁRIOS;112;74;;2;ESCOLA ESTADUAL DE EDUCAÇÃO PROFISSIONAL JAIME ALENCAR DE OLIVEIRA;AV ROGACIANO LEITE, 2285;ENGENHEIRO LUCIANO CAVALCANTE;
2024;1;FORTALEZA;44500;BARBOSINHA DOS RODOVIÁRIOS;112;143;;1;EEFM D. LUIZA TÁVORA - PRÓ MORAR;RUA FREI CANECA, 379;JARDIM DAS OLIVEIRAS;
2024;1;FORTALEZA;44500;BARBOSINHA DOS RODOVIÁRIOS;112;163;;1;EM JOHNSON;RUA DRA. SOCORRO AZEVEDO, 461;ENGENHEIRO LUCIANO CAVALCANTE;
2024;1;FORTALEZA;44500;BARBOSINHA DOS RODOVIÁRIOS;112;276;;1;EEMTI MIRIAN PORTO MOTA;RUA DAS CASTANHOLAS, S/N;JARDIM DAS OLIVEIRAS;
2024;1;FORTALEZA;44500;BARBOSINHA DOS RODOVIÁRIOS;112;376;;1;FUNCAP;AV. OLIVEIRA PAIVA, 941;CIDADE DOS FUNCIONÁRIOS;
2024;1;FORTALEZA;44500;BARBOSINHA DOS RODOVIÁRIOS;112;377;;1;FUNCAP;AV. OLIVEIRA PAIVA, 941;CIDADE DOS FUNCIONÁRIOS;
2024;1;FORTALEZA;44500;BARBOSINHA DOS RODOVIÁRIOS;112;419;;1;COLEGIO ARI DE SA CAVALCANTE WS;AV WASHINGTON SOARES, 3737;EDSON QUEIROZ;
2024;1;FORTALEZA;44500;BARBOSINHA DOS RODOVIÁRIOS;112;442;;1;UNIVERSIDADE DE FORTALEZA - UNIFOR;AVENIDA WASHINGTON SOARES, 1321;EDSON QUEIROZ;
2024;1;FORTALEZA;44500;BARBOSINHA DOS RODOVIÁRIOS;112;454;;1;UNIVERSIDADE DE FORTALEZA - UNIFOR;AVENIDA WASHINGTON SOARES, 1321;EDSON QUEIROZ;
2024;1;FORTALEZA;44500;BARBOSINHA DOS RODOVIÁRIOS;112;455;;1;UNIVERSIDADE DE FORTALEZA - UNIFOR;AVENIDA WASHINGTON SOARES, 1321;EDSON QUEIROZ;
2024;1;FORTALEZA;44500;BARBOSINHA DOS RODOVIÁRIOS;112;456;;1;UNIVERSIDADE DE FORTALEZA - UNIFOR;AVENIDA WASHINGTON SOARES, 1321;EDSON QUEIROZ;
2024;1;FORTALEZA;44500;BARBOSINHA DOS RODOVIÁRIOS;113;2;1;1;FACULDADE DE ARQUITETURA E URBANISMO DA UFC;AV. DA UNIVERSIDADE, 2890;BENFICA;
2024;1;FORTALEZA;44500;BARBOSINHA DOS RODOVIÁRIOS;113;19;;1;IFCE - INST FEDERAL DE CIÊNCIA E TECNOLOGIA (CEFET);AV. 13 DE MAIO, 2081;BENFICA;
2024;1;FORTALEZA;44500;BARBOSINHA DOS RODOVIÁRIOS;113;40;39, 41;1;COLÉGIO FARIAS BRITO PRÉ - VESTIBULAR;AV. BARÃO DO RIO BRANCO, 2424;JOSÉ BONIFÁCIO;
2024;1;FORTALEZA;44500;BARBOSINHA DOS RODOVIÁRIOS;113;83;;1;ESCOLA MUNICIPAL PROF. FILGUEIRAS LIMA;AV. DOS EXPEDICIONÁRIOS, 3910;JARDIM AMÉRICA;
2024;1;FORTALEZA;44500;BARBOSINHA DOS RODOVIÁRIOS;113;112;;1;COLÉGIO CHRISTUS BENFICA;RUA LUIS DE MIRANDA, 536;BENFICA;
2024;1;FORTALEZA;44500;BARBOSINHA DOS RODOVIÁRIOS;113;116;;3;COLÉGIO CHRISTUS BENFICA;RUA LUIS DE MIRANDA, 536;BENFICA;
2024;1;FORTALEZA;44500;BARBOSINHA DOS RODOVIÁRIOS;113;159;;1;COLÉGIO MEDALHA MILAGROSA;RUA PADRE JOÃO PIAMARTA,  415;BOM FUTURO;
2024;1;FORTALEZA;44500;BARBOSINHA DOS RODOVIÁRIOS;113;174;176;1;FEAAC - UFC;AV. DA UNIVERSIDADE, 2431;BENFICA;
2024;1;FORTALEZA;44500;BARBOSINHA DOS RODOVIÁRIOS;113;194;;1;FACULDADE DE PSICOLOGIA DA UFC;AV. DA UNIVERSIDADE, 2762;BENFICA;
2024;1;FORTALEZA;44500;BARBOSINHA DOS RODOVIÁRIOS;113;201;;1;COLÉGIO CHRISTUS PRÉ - UNIVERSITÁRIO;RUA CRUZ SALDANHA, 614;PARQUELÂNDIA;
2024;1;FORTALEZA;44500;BARBOSINHA DOS RODOVIÁRIOS;113;220;;1;COLÉGIO MANUELITO AZEVEDO;RUA TIRADENTES, 483;RODOLFO TEÓFILO;
2024;1;FORTALEZA;44500;BARBOSINHA DOS RODOVIÁRIOS;113;221;;1;COLÉGIO MANUELITO AZEVEDO;RUA TIRADENTES, 483;RODOLFO TEÓFILO;
2024;1;FORTALEZA;44500;BARBOSINHA DOS RODOVIÁRIOS;113;243;;1;EEFM FÉLIX DE AZEVEDO;RUA MONSENHOR FURTADO, 757;RODOLFO TEÓFILO;
2024;1;FORTALEZA;44500;BARBOSINHA DOS RODOVIÁRIOS;113;259;;1;EEF MONSENHOR LINHARES;RUA PROF. LINO ENCARNAÇÃO, 1130;AMADEU FURTADO;
2024;1;FORTALEZA;44500;BARBOSINHA DOS RODOVIÁRIOS;113;280;;1;COLÉGIO CHRISTUS PRÉ - UNIVERSITÁRIO;RUA CRUZ SALDANHA, 614;PARQUELÂNDIA;
2024;1;FORTALEZA;44500;BARBOSINHA DOS RODOVIÁRIOS;113;313;;1;ESC. PROFISSIONAL PE. JOÃO PIAMARTA;RUA PADRE JOÃO PIAMARTA, 161;BOM FUTURO;
2024;1;FORTALEZA;44500;BARBOSINHA DOS RODOVIÁRIOS;113;374;;1;COLÉGIO NOSSA SENHORA APARECIDA;RUA AQUILES BORIS, 342;MONTESE;
2024;1;FORTALEZA;44500;BARBOSINHA DOS RODOVIÁRIOS;113;376;;1;COLÉGIO NOSSA SENHORA APARECIDA;RUA AQUILES BORIS, 342;MONTESE;
2024;1;FORTALEZA;44500;BARBOSINHA DOS RODOVIÁRIOS;113;394;;1;IMPARH;AV JOAO PESSOA, 5.609;MONTESE;
2024;1;FORTALEZA;44500;BARBOSINHA DOS RODOVIÁRIOS;113;440;;1;COLEGIO CWD-MAXIMUS;RUA DOM LINO, 301;PARQUELÂNDIA;
2024;1;FORTALEZA;44500;BARBOSINHA DOS RODOVIÁRIOS;114;14;;1;EM JESUS CRISTO - CEI ANEXO;RUA ALBERTO FERREIRA 564;JARDIM IRACEMA;
2024;1;FORTALEZA;44500;BARBOSINHA DOS RODOVIÁRIOS;114;15;;1;EM JESUS CRISTO - CEI ANEXO;RUA ALBERTO FERREIRA 564;JARDIM IRACEMA;
2024;1;FORTALEZA;44500;BARBOSINHA DOS RODOVIÁRIOS;114;16;;2;EM JESUS CRISTO - CEI ANEXO;RUA ALBERTO FERREIRA 564;JARDIM IRACEMA;
2024;1;FORTALEZA;44500;BARBOSINHA DOS RODOVIÁRIOS;114;19;;1;SENAI - CENTRO DE FORMAÇÃO PROFISSIONAL;AVENIDA FRANCISCO SÁ 7221;BARRA DO CEARÁ;
2024;1;FORTALEZA;44500;BARBOSINHA DOS RODOVIÁRIOS;114;20;;1;SENAI - CENTRO DE FORMAÇÃO PROFISSIONAL;AVENIDA FRANCISCO SÁ 7221;BARRA DO CEARÁ;
2024;1;FORTALEZA;44500;BARBOSINHA DOS RODOVIÁRIOS;114;40;;1;EM FRANCISCO SILVA CAVALCANTE;RUA CONSELHEIRO LAFAYETTE 205;FLORESTA;
2024;1;FORTALEZA;44500;BARBOSINHA DOS RODOVIÁRIOS;114;41;;1;EM CASIMIRO JOSÉ LIMA FILHO;AVENIDA FRANCISCO SÁ 6449;BARRA DO CEARÁ;
2024;1;FORTALEZA;44500;BARBOSINHA DOS RODOVIÁRIOS;114;42;;1;EM CASIMIRO JOSÉ LIMA FILHO;AVENIDA FRANCISCO SÁ 6449;BARRA DO CEARÁ;
2024;1;FORTALEZA;44500;BARBOSINHA DOS RODOVIÁRIOS;114;47;;1;EM CASIMIRO JOSÉ LIMA FILHO;AVENIDA FRANCISCO SÁ 6449;BARRA DO CEARÁ;
2024;1;FORTALEZA;44500;BARBOSINHA DOS RODOVIÁRIOS;114;49;;1;EM CASIMIRO JOSÉ LIMA FILHO;AVENIDA FRANCISCO SÁ 6449;BARRA DO CEARÁ;
2024;1;FORTALEZA;44500;BARBOSINHA DOS RODOVIÁRIOS;114;67;;1;EM DOM HELDER CAMARA;RUA FREI ODILON 623 B;ÁLVARO WEYNE;
2024;1;FORTALEZA;44500;BARBOSINHA DOS RODOVIÁRIOS;114;87;;1;CUCA BARRA DO CEARÁ;AV. PRES. CASTELO BRANCO, 6417;BARRA DO CEARÁ;
2024;1;FORTALEZA;44500;BARBOSINHA DOS RODOVIÁRIOS;114;93;;1;CUCA BARRA DO CEARÁ;AV. PRES. CASTELO BRANCO, 6417;BARRA DO CEARÁ;
2024;1;FORTALEZA;44500;BARBOSINHA DOS RODOVIÁRIOS;114;94;;2;CUCA BARRA DO CEARÁ;AV. PRES. CASTELO BRANCO, 6417;BARRA DO CEARÁ;
2024;1;FORTALEZA;44500;BARBOSINHA DOS RODOVIÁRIOS;114;95;;1;CUCA BARRA DO CEARÁ;AV. PRES. CASTELO BRANCO, 6417;BARRA DO CEARÁ;
2024;1;FORTALEZA;44500;BARBOSINHA DOS RODOVIÁRIOS;114;96;;1;EM RAIMUNDO DE SOUSA MANGUEIRA;RUA ALBERTO FERREIRA 624;JARDIM IRACEMA;
2024;1;FORTALEZA;44500;BARBOSINHA DOS RODOVIÁRIOS;114;97;;1;EM RAIMUNDO DE SOUSA MANGUEIRA;RUA ALBERTO FERREIRA 624;JARDIM IRACEMA;
2024;1;FORTALEZA;44500;BARBOSINHA DOS RODOVIÁRIOS;114;98;;1;EM RAIMUNDO DE SOUSA MANGUEIRA;RUA ALBERTO FERREIRA 624;JARDIM IRACEMA;
2024;1;FORTALEZA;44500;BARBOSINHA DOS RODOVIÁRIOS;114;99;;1;EM RAIMUNDO DE SOUSA MANGUEIRA;RUA ALBERTO FERREIRA 624;JARDIM IRACEMA;
2024;1;FORTALEZA;44500;BARBOSINHA DOS RODOVIÁRIOS;114;102;;2;EM RAIMUNDO DE SOUSA MANGUEIRA;RUA ALBERTO FERREIRA 624;JARDIM IRACEMA;
2024;1;FORTALEZA;44500;BARBOSINHA DOS RODOVIÁRIOS;114;119;;1;EMTI NOSSA SENHORA DE FÁTIMA (ANTIGA APOSTÓLICA/SEMINÁRIO);RUA SÍLVIO ROMERO 370;ÁLVARO WEYNE;
2024;1;FORTALEZA;44500;BARBOSINHA DOS RODOVIÁRIOS;114;125;;2;EM  RACHEL DE QUEIROZ;AVENIDA PRESIDENTE CASTELO BRANCO 5010;BARRA DO CEARÁ;
2024;1;FORTALEZA;44500;BARBOSINHA DOS RODOVIÁRIOS;114;129;;2;EEFM ESTADO DE ALAGOAS;AVENIDA PRESIDENTE CASTELO BRANCO, 5244;BARRA DO CEARÁ;
2024;1;FORTALEZA;44500;BARBOSINHA DOS RODOVIÁRIOS;114;138;;2;EM JOSÉ DE ALENCAR;RUA ALBERTO FERREIRA 248;JARDIM IRACEMA;
2024;1;FORTALEZA;44500;BARBOSINHA DOS RODOVIÁRIOS;114;139;;1;EM JOSÉ DE ALENCAR;RUA ALBERTO FERREIRA 248;JARDIM IRACEMA;
2024;1;FORTALEZA;44500;BARBOSINHA DOS RODOVIÁRIOS;114;140;;1;EM JOSÉ DE ALENCAR;RUA ALBERTO FERREIRA 248;JARDIM IRACEMA;
2024;1;FORTALEZA;44500;BARBOSINHA DOS RODOVIÁRIOS;114;141;;1;EM JOSÉ DE ALENCAR;RUA ALBERTO FERREIRA 248;JARDIM IRACEMA;
2024;1;FORTALEZA;44500;BARBOSINHA DOS RODOVIÁRIOS;114;142;;1;EM JOSÉ DE ALENCAR;RUA ALBERTO FERREIRA 248;JARDIM IRACEMA;
2024;1;FORTALEZA;44500;BARBOSINHA DOS RODOVIÁRIOS;114;143;;2;EM JESUS CRISTO;RUA ALBERTO FERREIRA, 564;JARDIM IRACEMA;
2024;1;FORTALEZA;44500;BARBOSINHA DOS RODOVIÁRIOS;114;144;;1;EM JESUS CRISTO;RUA ALBERTO FERREIRA, 564;JARDIM IRACEMA;
2024;1;FORTALEZA;44500;BARBOSINHA DOS RODOVIÁRIOS;114;148;;1;EEMTI PROFESSORA BALBINA JUCA ALBUQUERQUE;AVENIDA MAJOR ASSIS 346;JARDIM IRACEMA;
2024;1;FORTALEZA;44500;BARBOSINHA DOS RODOVIÁRIOS;114;176;;1;EEFM SÃO JOSÉ DOS ARPOADORES;RUA FRANCISCO CALAÇA 90;CRISTO REDENTOR;
2024;1;FORTALEZA;44500;BARBOSINHA DOS RODOVIÁRIOS;114;184;;1;EEMTI WALDEMAR FALCÃO;RUA ANTONIO JOAQUIM DE CARVALHO 19;ÁLVARO WEYNE;
2024;1;FORTALEZA;44500;BARBOSINHA DOS RODOVIÁRIOS;114;198;;1;EM GABRIEL CAVALCANTE;QUADRA F 167 CONJUNTO CASTELO BRANCO;PRESIDENTE KENNEDY;
2024;1;FORTALEZA;44500;BARBOSINHA DOS RODOVIÁRIOS;114;205;;1;EM DOM HELDER CAMARA;RUA FREI ODILON 623 B;ÁLVARO WEYNE;
2024;1;FORTALEZA;44500;BARBOSINHA DOS RODOVIÁRIOS;114;207;;1;EM FRANCISCO SILVA CAVALCANTE;RUA CONSELHEIRO LAFAYETTE 205;FLORESTA;
2024;1;FORTALEZA;44500;BARBOSINHA DOS RODOVIÁRIOS;114;210;;2;EM FRANCISCO SILVA CAVALCANTE;RUA CONSELHEIRO LAFAYETTE 205;FLORESTA;
2024;1;FORTALEZA;44500;BARBOSINHA DOS RODOVIÁRIOS;114;223;;1;INSTITUTO EDUCACIONAL PRESIDENTE MEDICI;RUA CÉSAR CORREIA 973;FLORESTA;
2024;1;FORTALEZA;44500;BARBOSINHA DOS RODOVIÁRIOS;114;231;;1;EM DOM ANTONIO BATISTA DE FRAGOSO;AVENIDA FRANCISCO SÁ 7945;BARRA DO CEARÁ;
2024;1;FORTALEZA;44500;BARBOSINHA DOS RODOVIÁRIOS;114;239;;1;CENTRO DE EDUCAÇÃO COMPLEMENTAR (CEDCE) - ANTIGO SESI;AVENIDA FRANCISCO SÁ 6623;BARRA DO CEARÁ;
2024;1;FORTALEZA;44500;BARBOSINHA DOS RODOVIÁRIOS;114;242;;2;CENTRO DE EDUCAÇÃO COMPLEMENTAR (CEDCE) - ANTIGO SESI;AVENIDA FRANCISCO SÁ 6623;BARRA DO CEARÁ;
2024;1;FORTALEZA;44500;BARBOSINHA DOS RODOVIÁRIOS;114;244;;1;CENTRO DE EDUCAÇÃO COMPLEMENTAR (CEDCE) - ANTIGO SESI;AVENIDA FRANCISCO SÁ 6623;BARRA DO CEARÁ;
2024;1;FORTALEZA;44500;BARBOSINHA DOS RODOVIÁRIOS;114;247;;1;CENTRO DE EDUCAÇÃO COMPLEMENTAR (CEDCE) - ANTIGO SESI;AVENIDA FRANCISCO SÁ 6623;BARRA DO CEARÁ;
2024;1;FORTALEZA;44500;BARBOSINHA DOS RODOVIÁRIOS;114;253;;2;CENTRO DE REFERÊNCIA DE ASSISTÊNCIA SOCIAL DO PRES. KENNEDY - CRAS;QUADRA F S/N CONJUNTO CASTELO BRANCO;PRESIDENTE KENNEDY;
2024;1;FORTALEZA;44500;BARBOSINHA DOS RODOVIÁRIOS;114;277;;2;EEMTI PROFESSORA BALBINA JUCA ALBUQUERQUE;AVENIDA MAJOR ASSIS 346;JARDIM IRACEMA;
2024;1;FORTALEZA;44500;BARBOSINHA DOS RODOVIÁRIOS;114;279;;1;EM MARIA DALVA SEVERINO MARREIRO;RUA RIO PARAGUAI 782;JARDIM IRACEMA;
2024;1;FORTALEZA;44500;BARBOSINHA DOS RODOVIÁRIOS;114;287;;1;EM JESUS CRISTO;RUA ALBERTO FERREIRA, 564;JARDIM IRACEMA;
2024;1;FORTALEZA;44500;BARBOSINHA DOS RODOVIÁRIOS;114;290;;1;EM JESUS CRISTO;RUA ALBERTO FERREIRA, 564;JARDIM IRACEMA;
2024;1;FORTALEZA;44500;BARBOSINHA DOS RODOVIÁRIOS;114;302;;1;EM FRANCISCO DOMINGOS DA SILVA;AVENIDA PRESIDENTE CASTELO BRANCO 4707;BARRA DO CEARÁ;
2024;1;FORTALEZA;44500;BARBOSINHA DOS RODOVIÁRIOS;114;304;;1;EMTI ALDEMIR MARTINS;AV. FRANCISCO SÁ, 7460;BARRA DO CEARÁ;
2024;1;FORTALEZA;44500;BARBOSINHA DOS RODOVIÁRIOS;114;305;;1;EM JESUS CRISTO;RUA ALBERTO FERREIRA, 564;JARDIM IRACEMA;
2024;1;FORTALEZA;44500;BARBOSINHA DOS RODOVIÁRIOS;114;307;;1;EMTI ALDEMIR MARTINS;AV. FRANCISCO SÁ, 7460;BARRA DO CEARÁ;
2024;1;FORTALEZA;44500;BARBOSINHA DOS RODOVIÁRIOS;114;308;;3;EM MARIA DALVA SEVERINO MARREIRO;RUA RIO PARAGUAI 782;JARDIM IRACEMA;
2024;1;FORTALEZA;44500;BARBOSINHA DOS RODOVIÁRIOS;114;310;;1;COLÉGIO MANUEL DA SILVA (ÁLVARO WEYNE);RUA SÃO BERNARDO 181;ÁLVARO WEYNE;
2024;1;FORTALEZA;44500;BARBOSINHA DOS RODOVIÁRIOS;114;311;;1;EM JESUS CRISTO;RUA ALBERTO FERREIRA, 564;JARDIM IRACEMA;
2024;1;FORTALEZA;44500;BARBOSINHA DOS RODOVIÁRIOS;114;326;;1;EM DOM HELDER CAMARA;RUA FREI ODILON 623 B;ÁLVARO WEYNE;
2024;1;FORTALEZA;44500;BARBOSINHA DOS RODOVIÁRIOS;114;327;;1;EEEP PAULO PETROLA;RUA SAUDÁRIA, S/N - GOIABEIRAS;BARRA DO CEARÁ;
2024;1;FORTALEZA;44500;BARBOSINHA DOS RODOVIÁRIOS;114;334;;4;EM MARIA DALVA SEVERINO MARREIRO;RUA RIO PARAGUAI 782;JARDIM IRACEMA;
2024;1;FORTALEZA;44500;BARBOSINHA DOS RODOVIÁRIOS;114;335;;1;EM DOIS DE DEZEMBRO;RUA ARAKEN, 860;BARRA DO CEARÁ;
2024;1;FORTALEZA;44500;BARBOSINHA DOS RODOVIÁRIOS;114;338;;2;EM 11 DE AGOSTO (ALOJAMENTO PROVISÓRIO);RUA ERETIDES DE ALENCAR, S/N, EM FRENTE AO N. 1623;JARDIM IRACEMA;
2024;1;FORTALEZA;44500;BARBOSINHA DOS RODOVIÁRIOS;114;342;;1;EM MARIA DALVA SEVERINO MARREIRO;RUA RIO PARAGUAI 782;JARDIM IRACEMA;
2024;1;FORTALEZA;44500;BARBOSINHA DOS RODOVIÁRIOS;114;345;;1;EM AGOSTINHO MOREIRA E SILVA;RUA PERI, 20;BARRA DO CEARÁ;
2024;1;FORTALEZA;44500;BARBOSINHA DOS RODOVIÁRIOS;114;351;;3;EM 11 DE AGOSTO (ALOJAMENTO PROVISÓRIO);RUA ERETIDES DE ALENCAR, S/N, EM FRENTE AO N. 1623;JARDIM IRACEMA;
2024;1;FORTALEZA;44500;BARBOSINHA DOS RODOVIÁRIOS;114;355;;1;EM AGOSTINHO MOREIRA E SILVA;RUA PERI, 20;BARRA DO CEARÁ;
2024;1;FORTALEZA;44500;BARBOSINHA DOS RODOVIÁRIOS;114;363;;2;CAPELA NOSSA SENHORA DE FÁTIMA;RUA RIO ARAGUAIA 1669;JARDIM IRACEMA;
2024;1;FORTALEZA;44500;BARBOSINHA DOS RODOVIÁRIOS;115;105;;1;COLEGIO NOSSA SENHORA DO CARMO;RUA ELVIRA PINHO, 400;MONTESE;
2024;1;FORTALEZA;44500;BARBOSINHA DOS RODOVIÁRIOS;115;108;;1;COLEGIO NOSSA SENHORA DO CARMO;RUA ELVIRA PINHO, 400;MONTESE;
2024;1;FORTALEZA;44500;BARBOSINHA DOS RODOVIÁRIOS;115;114;;1;COLEGIO NOSSA SENHORA DO CARMO;RUA ELVIRA PINHO, 400;MONTESE;
2024;1;FORTALEZA;44500;BARBOSINHA DOS RODOVIÁRIOS;115;120;;1;DETRAN;AV GODOFREDO MACIEL, 2900;MARAPONGA;
2024;1;FORTALEZA;44500;BARBOSINHA DOS RODOVIÁRIOS;115;122;;1;COLÉGIO UNIVERSO DO SABER;RUA 10 - NR 70 (CJ CAMPO DOS INGLESES - MARAPONGA);JARDIM CEARENSE;
2024;1;FORTALEZA;44500;BARBOSINHA DOS RODOVIÁRIOS;115;128;264;1;LAR FABIANO DE CRISTO;RUA CEL. JAIME ROLEMBERG, 100;MONDUBIM;
2024;1;FORTALEZA;44500;BARBOSINHA DOS RODOVIÁRIOS;115;135;;1;COLÉGIO INVICTUS;RUA ARARIBÓIA, 192;PARANGABA;
2024;1;FORTALEZA;44500;BARBOSINHA DOS RODOVIÁRIOS;115;163;;1;EEMTI JOAO MATTOS;RUA ALMIRANTE RUBIM, 1014;MONTESE;
2024;1;FORTALEZA;44500;BARBOSINHA DOS RODOVIÁRIOS;115;192;;2;EEMTI MARIA THOMÁSIA;RUA POLONIA, 369;PARANGABA;
2024;1;FORTALEZA;44500;BARBOSINHA DOS RODOVIÁRIOS;115;255;;1;FACULDADE UNINASSAU - PARANGABA;RUA GERMANO FRANCK, 567;PARANGABA;
2024;1;FORTALEZA;44500;BARBOSINHA DOS RODOVIÁRIOS;115;303;;1;UNIVERSIDADE ESTADUAL DO CEARA - UECE;AV DR. SILAS MUNGUBA, 1700;ITAPERI;
2024;1;FORTALEZA;44500;BARBOSINHA DOS RODOVIÁRIOS;115;337;;1;SESI - PARANGABA;AVENIDA JOÃO PESSOA, 6754;PARANGABA;
2024;1;FORTALEZA;44500;BARBOSINHA DOS RODOVIÁRIOS;115;427;;1;CENTRO DE EDUCAÇÃO PEDAGÓGICO EÇA DE QUEIROZ;RUA DOM XISTO ALBANO 611;VILA PERI;
2024;1;FORTALEZA;44500;BARBOSINHA DOS RODOVIÁRIOS;115;431;;1;CENTRO DE EDUCAÇÃO PEDAGÓGICO EÇA DE QUEIROZ;RUA DOM XISTO ALBANO 611;VILA PERI;
2024;1;FORTALEZA;44500;BARBOSINHA DOS RODOVIÁRIOS;115;444;;1;EM MARIA VIVIANE BENEVIDES GOUVEIA;RUA CREUZA ROQUE 247;MANOEL SÁTIRO;
2024;1;FORTALEZA;44500;BARBOSINHA DOS RODOVIÁRIOS;115;465;;1;EM HENRIQUETA GALENO;RUA MAJOR MONTENEGRO 917;MANOEL SÁTIRO;
2024;1;FORTALEZA;44500;BARBOSINHA DOS RODOVIÁRIOS;115;478;;1;EEFM PROF. HERMENEGILDO FIRMEZA;RUA GABRIEL FIUZA 360;VILA PERI;
2024;1;FORTALEZA;44500;BARBOSINHA DOS RODOVIÁRIOS;115;482;;1;COLEGIO GURI  SENIOR;RUA CONEGO DE CASTRO 1780;PARANGABA;
2024;1;FORTALEZA;44500;BARBOSINHA DOS RODOVIÁRIOS;116;38;;1;EM PROF ANTONIA MARIA DE LIMA;RUA SARGENTO JOAO PINHEIRO 2601;GRANJA LISBOA;
2024;1;FORTALEZA;44500;BARBOSINHA DOS RODOVIÁRIOS;116;39;;1;EM PROF ANTONIA MARIA DE LIMA;RUA SARGENTO JOAO PINHEIRO 2601;GRANJA LISBOA;
2024;1;FORTALEZA;44500;BARBOSINHA DOS RODOVIÁRIOS;116;43;;1;EM SANTOS DUMONT;RUA GERALDO BARBOSA 240;BOM JARDIM;
2024;1;FORTALEZA;44500;BARBOSINHA DOS RODOVIÁRIOS;116;75;;1;EM IRMA ROCHA;RUA EMILIO DE MENEZES 2515;GRANJA PORTUGAL;
2024;1;FORTALEZA;44500;BARBOSINHA DOS RODOVIÁRIOS;116;79;;1;EM CONCEICAO MOURAO;RUA DUAS NACOES 550;GRANJA PORTUGAL;
2024;1;FORTALEZA;44500;BARBOSINHA DOS RODOVIÁRIOS;116;81;;1;EM CONCEICAO MOURAO;RUA DUAS NACOES 550;GRANJA PORTUGAL;
2024;1;FORTALEZA;44500;BARBOSINHA DOS RODOVIÁRIOS;116;88;;1;EM CREUSA DO CARMO ROCHA;RUA DUAS NACOES 1055;GRANJA PORTUGAL;
2024;1;FORTALEZA;44500;BARBOSINHA DOS RODOVIÁRIOS;116;90;;1;EM CREUSA DO CARMO ROCHA;RUA DUAS NACOES 1055;GRANJA PORTUGAL;
2024;1;FORTALEZA;44500;BARBOSINHA DOS RODOVIÁRIOS;116;119;;1;EEFM PROF JOCIE CAMINHA DE MENEZES;RUA ITU 120;GRANJA PORTUGAL;
2024;1;FORTALEZA;44500;BARBOSINHA DOS RODOVIÁRIOS;116;154;;1;EM SEBASTIAO DE ABREU;RUA GERALDO BARBOSA 1065;BOM JARDIM;
2024;1;FORTALEZA;44500;BARBOSINHA DOS RODOVIÁRIOS;116;206;;1;EM SANTA ISABEL;RUA RAIMUNDO PINHEIRO 798;BOM JARDIM;
2024;1;FORTALEZA;44500;BARBOSINHA DOS RODOVIÁRIOS;116;208;;1;EM ULYSSES GUIMARAES;RUA TENENTE FRANCISCO PAIVA 1350;GRANJA LISBOA;
2024;1;FORTALEZA;44500;BARBOSINHA DOS RODOVIÁRIOS;116;209;;1;POSTO DE SAUDE DR JURANDIR PICANCO;RUA DUAS NACOES 605;GRANJA PORTUGAL;
2024;1;FORTALEZA;44500;BARBOSINHA DOS RODOVIÁRIOS;116;212;;2;POSTO DE SAUDE DR JURANDIR PICANCO;RUA DUAS NACOES 605;GRANJA PORTUGAL;
2024;1;FORTALEZA;44500;BARBOSINHA DOS RODOVIÁRIOS;116;214;;1;PROJETO ABC BOM JARDIM;RUA TRES CORACOES 762;GRANJA LISBOA;
2024;1;FORTALEZA;44500;BARBOSINHA DOS RODOVIÁRIOS;116;284;;1;CENTRO CULTURAL BOM JARDIM;RUA TRES CORACOES 400;GRANJA LISBOA;
2024;1;FORTALEZA;44500;BARBOSINHA DOS RODOVIÁRIOS;116;327;;1;EEEP ICARO DE SOUSA MOREIRA - LICEU DO BOM JARDIM;RUA JOSE MARTINS, 2246;GRANJA LISBOA;
2024;1;FORTALEZA;44500;BARBOSINHA DOS RODOVIÁRIOS;116;334;;1;CENTRO EDUCACIONAL HORA DE APRENDER;RUA VITAL BRASIL 2533;GRANJA PORTUGAL;
2024;1;FORTALEZA;44500;BARBOSINHA DOS RODOVIÁRIOS;116;340;;1;EM ULYSSES GUIMARAES;RUA TENENTE FRANCISCO PAIVA 1350;GRANJA LISBOA;
2024;1;FORTALEZA;44500;BARBOSINHA DOS RODOVIÁRIOS;116;347;;1;EM SANTA ISABEL;RUA RAIMUNDO PINHEIRO 798;BOM JARDIM;
2024;1;FORTALEZA;44500;BARBOSINHA DOS RODOVIÁRIOS;116;353;;2;EEEP ICARO DE SOUSA MOREIRA - LICEU DO BOM JARDIM;RUA JOSE MARTINS, 2246;GRANJA LISBOA;
2024;1;FORTALEZA;44500;BARBOSINHA DOS RODOVIÁRIOS;116;360;;1;EM DOM LUSTOSA;RUA GERALDO BARBOSA 3901;GRANJA LISBOA;
2024;1;FORTALEZA;44500;BARBOSINHA DOS RODOVIÁRIOS;116;395;;1;EM PROF LUIS RECAMONDE CAPELO;RUA MARIA QUINTELA 901;BONSUCESSO;
2024;1;FORTALEZA;44500;BARBOSINHA DOS RODOVIÁRIOS;116;396;;1;EM PROF LUIS RECAMONDE CAPELO;RUA MARIA QUINTELA 901;BONSUCESSO;
2024;1;FORTALEZA;44500;BARBOSINHA DOS RODOVIÁRIOS;116;406;;1;EM JOAO PAULO I;RUA LUIZ DE CASTRO 254;BONSUCESSO;
2024;1;FORTALEZA;44500;BARBOSINHA DOS RODOVIÁRIOS;116;417;;1;EM MARIA DO SOCORRO ALVES CARNEIRO;RUA LUIS VIEIRA 1020;BONSUCESSO;
2024;1;FORTALEZA;44500;BARBOSINHA DOS RODOVIÁRIOS;116;426;506;1;EM RAIMUNDO MOREIRA SENA;RUA G, 93, CJ. NOVA RESIDENCIA;BOM JARDIM;
2024;1;FORTALEZA;44500;BARBOSINHA DOS RODOVIÁRIOS;116;440;;1;CEI XV DE OUTUBRO;RUA MENINO JESUS DE PRAGA, 192;BONSUCESSO;
2024;1;FORTALEZA;44500;BARBOSINHA DOS RODOVIÁRIOS;116;448;;1;EM XV DE OUTUBRO - TEMPORÁRIO;RUA GUARANI, 2030;BONSUCESSO;
2024;1;FORTALEZA;44500;BARBOSINHA DOS RODOVIÁRIOS;116;461;;1;COLEGIO LIMA NOGUEIRA;RUA JULIO BRAGA, 1117;JOÃO XXIII;
2024;1;FORTALEZA;44500;BARBOSINHA DOS RODOVIÁRIOS;116;462;;1;COLEGIO LIMA NOGUEIRA;RUA JULIO BRAGA, 1117;JOÃO XXIII;
2024;1;FORTALEZA;44500;BARBOSINHA DOS RODOVIÁRIOS;116;469;;2;CENTRO CULTURAL BOM JARDIM;RUA TRES CORACOES 400;GRANJA LISBOA;
2024;1;FORTALEZA;44500;BARBOSINHA DOS RODOVIÁRIOS;116;491;;1;EM REITOR ANTONIO MARTINS FILHO;RUA TEODORO DE CASTRO 1175;GRANJA PORTUGAL;
2024;1;FORTALEZA;44500;BARBOSINHA DOS RODOVIÁRIOS;116;494;;1;EM JOSE CARLOS MATOS;RUA ITAJAI 802;GRANJA PORTUGAL;
2024;1;FORTALEZA;44500;BARBOSINHA DOS RODOVIÁRIOS;117;140;;1;COLÉGIO VIDA VIVA;RUA JOSÉ MARIA, 100;SIQUEIRA;
2024;1;FORTALEZA;44500;BARBOSINHA DOS RODOVIÁRIOS;117;149;;1;CUCA MONDUBIM;RUA PROFESSOR GLAUCO LOBO S/N;NOVO MONDUBIM;
2024;1;FORTALEZA;44500;BARBOSINHA DOS RODOVIÁRIOS;117;164;;1;EEFM JULIA ALVES PESSOA;RUA SÃO FRANCISCO SN;BOM JARDIM;
2024;1;FORTALEZA;44500;BARBOSINHA DOS RODOVIÁRIOS;117;165;;3;EEFM JULIA ALVES PESSOA;RUA SÃO FRANCISCO SN;BOM JARDIM;
2024;1;FORTALEZA;44500;BARBOSINHA DOS RODOVIÁRIOS;117;168;;2;EEFM JULIA ALVES PESSOA;RUA SÃO FRANCISCO SN;BOM JARDIM;
2024;1;FORTALEZA;44500;BARBOSINHA DOS RODOVIÁRIOS;117;171;;1;EEFM JULIA ALVES PESSOA;RUA SÃO FRANCISCO SN;BOM JARDIM;
2024;1;FORTALEZA;44500;BARBOSINHA DOS RODOVIÁRIOS;117;176;;1;COLÉGIO LUMEN;RUA SÃO FRANCISCO DO JARDIM, 396;BOM JARDIM;
2024;1;FORTALEZA;44500;BARBOSINHA DOS RODOVIÁRIOS;117;182;;1;EEFM IRAPUAN CAVALCANTE PINHEIRO;AV E 305;CONJUNTO ESPERANÇA;
2024;1;FORTALEZA;44500;BARBOSINHA DOS RODOVIÁRIOS;117;203;;1;COLÉGIO CASTRO ALVES;RUA TULIPA NEGRA, 2319;PARQUE PRESIDENTE VARGAS;
2024;1;FORTALEZA;44500;BARBOSINHA DOS RODOVIÁRIOS;117;204;;1;EMTI PROFESSORA MARIA JOSÉ FERREIRA GOMES;RUA CÔNEGO DE CASTRO, 8617;PARQUE PRESIDENTE VARGAS;
2024;1;FORTALEZA;44500;BARBOSINHA DOS RODOVIÁRIOS;117;208;;1;EEFM PROFA ADALGISA BONFIM SOARES;AV. DO CANAL, S/N, ESQUINA COM RUA 103 - CONJUNTO ESPERANÇA;CONJUNTO ESPERANÇA;
2024;1;FORTALEZA;44500;BARBOSINHA DOS RODOVIÁRIOS;117;209;;1;EEFM PROFA ADALGISA BONFIM SOARES;AV. DO CANAL, S/N, ESQUINA COM RUA 103 - CONJUNTO ESPERANÇA;CONJUNTO ESPERANÇA;
2024;1;FORTALEZA;44500;BARBOSINHA DOS RODOVIÁRIOS;117;213;;1;EEFM PROFA ADALGISA BONFIM SOARES;AV. DO CANAL, S/N, ESQUINA COM RUA 103 - CONJUNTO ESPERANÇA;CONJUNTO ESPERANÇA;
2024;1;FORTALEZA;44500;BARBOSINHA DOS RODOVIÁRIOS;117;215;;1;EEFM PROFA ADALGISA BONFIM SOARES;AV. DO CANAL, S/N, ESQUINA COM RUA 103 - CONJUNTO ESPERANÇA;CONJUNTO ESPERANÇA;
2024;1;FORTALEZA;44500;BARBOSINHA DOS RODOVIÁRIOS;117;216;;1;EEFM PROFA ADELIA BRASIL FEIJO;AV CONTORNO SUL, 1540;CONJUNTO ESPERANÇA;
2024;1;FORTALEZA;44500;BARBOSINHA DOS RODOVIÁRIOS;117;223;;1;EEFM SENADOR OSIRES PONTES;RUA DIVINA 150;SIQUEIRA;
2024;1;FORTALEZA;44500;BARBOSINHA DOS RODOVIÁRIOS;117;227;;1;EEFM SENADOR OSIRES PONTES;RUA DIVINA 150;SIQUEIRA;
2024;1;FORTALEZA;44500;BARBOSINHA DOS RODOVIÁRIOS;117;246;;1;ESCOLA MUNICIPAL MARIETA GUEDES MARTINS;RUA JOSE GUEDES MARTINS 4701;PARQUE SANTA ROSA;
2024;1;FORTALEZA;44500;BARBOSINHA DOS RODOVIÁRIOS;117;256;;1;EMTI PROFESSOR AGERSON TABOSA PINTO;RUA WILCA ALBUQUERQUE, S/N;SIQUEIRA;
2024;1;FORTALEZA;44500;BARBOSINHA DOS RODOVIÁRIOS;117;261;;1;EEFM PAULO ELPIDIO;RUA PROF MANOEL DE CASTRO 1202;SIQUEIRA;
2024;1;FORTALEZA;44500;BARBOSINHA DOS RODOVIÁRIOS;117;271;;1;EM FLORIVAL ALVES SERAINE;RUA ITATIAIA, 1000;CANINDEZINHO;
2024;1;FORTALEZA;44500;BARBOSINHA DOS RODOVIÁRIOS;117;281;;1;EEFM PAULO ELPIDIO;RUA PROF MANOEL DE CASTRO 1202;SIQUEIRA;
2024;1;FORTALEZA;44500;BARBOSINHA DOS RODOVIÁRIOS;117;348;;1;EM NARCISO PESSOA DE ARAÚJO;AV. OSÓRIO DE PAIVA, 4841;CANINDEZINHO;
2024;1;FORTALEZA;44500;BARBOSINHA DOS RODOVIÁRIOS;117;352;;1;COLÉGIO CASTRO ALVES;RUA TULIPA NEGRA, 2319;PARQUE PRESIDENTE VARGAS;
2024;1;FORTALEZA;44500;BARBOSINHA DOS RODOVIÁRIOS;117;375;;1;ESCOLA MUNICIPAL HERBERT DE SOUSA;RUA URUCUTUBA 1599;BOM JARDIM;
2024;1;FORTALEZA;44500;BARBOSINHA DOS RODOVIÁRIOS;117;386;;1;EEFM IRAPUAN CAVALCANTE PINHEIRO;AV E 305;CONJUNTO ESPERANÇA;
2024;1;FORTALEZA;44500;BARBOSINHA DOS RODOVIÁRIOS;117;391;;1;EM JOSE MARIA MOREIRA CAMPOS;RUA FRANCISCO ALMEIDA, 525 CJ. APOLO XI;PARQUE PRESIDENTE VARGAS;
2024;1;FORTALEZA;44500;BARBOSINHA DOS RODOVIÁRIOS;117;394;;1;EM FLORIVAL ALVES SERAINE;RUA ITATIAIA, 1000;CANINDEZINHO;
2024;1;FORTALEZA;44500;BARBOSINHA DOS RODOVIÁRIOS;117;399;;1;EMEIF MARIA BEZERRA QUEVEDO;RUA 103, 28 - CJ. NOVO MONDUBIM;MANOEL SÁTIRO;
