Ano;Turno;Município;Número;Candidato;Zona;Seção;Seções Agregadas;Votos;Local de Votação;Endereço Local de Votação;Bairro;
2024;1;FORTALEZA;10222;BETH ABREU;1;136;;1;ESCOLA ESTADUAL ARQUITETO ROGERIO FROES;AVENIDA DAS GRAVIOLAS 1000;CIDADE 2000;
2024;1;FORTALEZA;10222;BETH ABREU;1;473;;1;ESCOLA MIGUEL FIALHO - ANTIGO PADRE JOSÉ NILSON ;RUA CORONEL MANUEL JESUÍNO 225;MUCURIPE;
2024;1;FORTALEZA;10222;BETH ABREU;1;668;;1;ESCOLA ESTADUAL MURILO BORGES;RUA DO ENTARDECER 90;VICENTE PINZON;
2024;1;FORTALEZA;10222;BETH ABREU;1;670;;1;UNINTA - FACULDADE UNINTA FORTALEZA;RUA VILEBALDO AGUIAR,133;COCÓ;
2024;1;FORTALEZA;10222;BETH ABREU;1;743;;1;ESCOLA PROFISSIONAL MARIA ANGELA DA SILVEIRA BORGES;RUA PINTOR ANTONIO BANDEIRA, S/N;VICENTE PINZON;
2024;1;FORTALEZA;10222;BETH ABREU;1;780;;1;COLEGIO ANTARES - OCELO PINHEIRO;RUA PROFESSOR OCELO PINHEIRO 101;PAPICU;
2024;1;FORTALEZA;10222;BETH ABREU;1;819;;1;ESCOLA MUNICIPAL ODNILRA CRUZ MOREIRA;AVENIDA DAS ADENANTERAS 800;CIDADE 2000;
2024;1;FORTALEZA;10222;BETH ABREU;1;906;;2;UNINTA - FACULDADE UNINTA FORTALEZA;RUA VILEBALDO AGUIAR,133;COCÓ;
2024;1;FORTALEZA;10222;BETH ABREU;2;88;;1;CLUBE DA CAIXA;AVENIDA FREI CIRILO 4700;MESSEJANA;
2024;1;FORTALEZA;10222;BETH ABREU;2;94;;1;CLUBE DA CAIXA;AVENIDA FREI CIRILO 4700;MESSEJANA;
2024;1;FORTALEZA;10222;BETH ABREU;2;109;;1;EMEIF DEMOCRITO ROCHA;RUA PADRE PEDRO DE ALENCAR, 2012;MESSEJANA;
2024;1;FORTALEZA;10222;BETH ABREU;2;110;;1;EMEIF DEMOCRITO ROCHA;RUA PADRE PEDRO DE ALENCAR, 2012;MESSEJANA;
2024;1;FORTALEZA;10222;BETH ABREU;2;112;;1;EMEIF DEMOCRITO ROCHA;RUA PADRE PEDRO DE ALENCAR, 2012;MESSEJANA;
2024;1;FORTALEZA;10222;BETH ABREU;2;121;;1;EEFM JOSE DE ALENCAR;RUA VENEZA, 84;MESSEJANA;
2024;1;FORTALEZA;10222;BETH ABREU;2;133;;1;EEM DEPUTADO PAULO BENEVIDES;RUA ANGELICA GURGEL, 186;MESSEJANA;
2024;1;FORTALEZA;10222;BETH ABREU;2;150;;1;EMEIF ANGELICA GURGEL;RUA DOUTOR PERGENTINO MAIA, 375;MESSEJANA;
2024;1;FORTALEZA;10222;BETH ABREU;2;154;;1;EMEIF ANGELICA GURGEL;RUA DOUTOR PERGENTINO MAIA, 375;MESSEJANA;
2024;1;FORTALEZA;10222;BETH ABREU;2;167;;1;PATRONATO PADRE LUIZ BARBOSA MOREIRA;RUA CEL GUILHERME ALENCAR, 121;MESSEJANA;
2024;1;FORTALEZA;10222;BETH ABREU;2;173;;1;PAROQUIA NOSSA SENHORA DA CONCEICAO;RUA JOAQUIM BEZERRA 255;MESSEJANA;
2024;1;FORTALEZA;10222;BETH ABREU;2;483;;1;EMEIF ANGELICA GURGEL;RUA DOUTOR PERGENTINO MAIA, 375;MESSEJANA;
2024;1;FORTALEZA;10222;BETH ABREU;2;659;;1;SECRETARIA DA EDUCACAO - CAMBEBA;AVENIDA MINISTRO JOSE AMERICO, SN;CAMBEBA;
2024;1;FORTALEZA;10222;BETH ABREU;2;674;;1;EMEIF DEMOCRITO ROCHA;RUA PADRE PEDRO DE ALENCAR, 2012;MESSEJANA;
2024;1;FORTALEZA;10222;BETH ABREU;2;676;;2;CMES ANISIO TEIXEIRA;TRAVESSA DO GUARANI, 355;PAUPINA;
2024;1;FORTALEZA;10222;BETH ABREU;2;731;;1;EEFM GOV LUIZ DE GONZAGA FONSECA MOTA;RUA SANTA ROSA, 407;COAÇU;
2024;1;FORTALEZA;10222;BETH ABREU;2;736;;1;EM PROFª TELINA BARBOSA DA  COSTA;RUA PERGENTINO MAIA, 811;MESSEJANA;
2024;1;FORTALEZA;10222;BETH ABREU;2;759;;1;SECRETARIA DA EDUCACAO - CAMBEBA;AVENIDA MINISTRO JOSE AMERICO, SN;CAMBEBA;
2024;1;FORTALEZA;10222;BETH ABREU;2;763;;1;CMES PROFª TEREZINHA FERREIRA PARENTE;RUA NELSON COELHO, 209;LAGOA REDONDA;
2024;1;FORTALEZA;10222;BETH ABREU;2;789;;1;COLÉGIO PAIVA ANDRADE;RUA INÁCIO MOREIRA, 133;MESSEJANA;
2024;1;FORTALEZA;10222;BETH ABREU;2;793;;1;EMEIF GUIOMAR DA SILVA ALMEIDA;RUA PEROLINA DE MORAIS, 449;PAUPINA;
2024;1;FORTALEZA;10222;BETH ABREU;2;805;;1;CLUBE DA CAIXA;AVENIDA FREI CIRILO 4700;MESSEJANA;
2024;1;FORTALEZA;10222;BETH ABREU;2;811;;1;ESCOLA MUNICIPAL ISABEL FERREIRA;RUA ISABEL FERREIRA, 1000 - CONJ. CURIÓ;LAGOA REDONDA;
2024;1;FORTALEZA;10222;BETH ABREU;2;813;;1;ESCOLA MUNICIPAL ISABEL FERREIRA;RUA ISABEL FERREIRA, 1000 - CONJ. CURIÓ;LAGOA REDONDA;
2024;1;FORTALEZA;10222;BETH ABREU;2;824;;1;SECRETARIA DA EDUCACAO - CAMBEBA;AVENIDA MINISTRO JOSE AMERICO, SN;CAMBEBA;
2024;1;FORTALEZA;10222;BETH ABREU;3;5;28;2;SENAI - UNIDADE JACARECANGA;AV. PADRE IBIAPINA, 1280;JACARECANGA;
2024;1;FORTALEZA;10222;BETH ABREU;3;134;;1;COLÉGIO ESTADUAL LICEU DO CEARÁ;PRAÇA GUSTAVO BARROSO, 01;JACARECANGA;
2024;1;FORTALEZA;10222;BETH ABREU;3;152;;1;EM MOURA BRASIL / EF;RUA PADRE MORORÓ, 189;MOURA BRASIL;
2024;1;FORTALEZA;10222;BETH ABREU;3;188;;1;COLÉGIO MILITAR DO CORPO DE BOMBEIROS;RUA ADRIANO MARTINS, 436;JACARECANGA;
2024;1;FORTALEZA;10222;BETH ABREU;3;212;213;1;COLÉGIO ARI DE SÁ - PRÉ-VESTIBULAR - SEDE DUQUE DE CAXIAS;AV. DUQUE DE CAXIAS, 519;CENTRO;
2024;1;FORTALEZA;10222;BETH ABREU;3;266;267;1;COLÉGIO ARI DE SÁ - PRÉ-VESTIBULAR - SEDE DUQUE DE CAXIAS;AV. DUQUE DE CAXIAS, 519;CENTRO;
2024;1;FORTALEZA;10222;BETH ABREU;3;268;269;1;COLÉGIO ARI DE SÁ - PRÉ-VESTIBULAR - SEDE DUQUE DE CAXIAS;AV. DUQUE DE CAXIAS, 519;CENTRO;
2024;1;FORTALEZA;10222;BETH ABREU;3;446;;1;EEFM SANTA LUZIA;RUA JOÃO CORDEIRO, 711;PRAIA DE IRACEMA;
2024;1;FORTALEZA;10222;BETH ABREU;3;553;;1;COLÉGIO MILITAR DO CORPO DE BOMBEIROS;RUA ADRIANO MARTINS, 436;JACARECANGA;
2024;1;FORTALEZA;10222;BETH ABREU;3;573;;1;INSTITUTO CEARENSE DE EDUCAÇÃO DE SURDOS - ICES;AV. RUI BARBOSA, 1970;ALDEOTA;
2024;1;FORTALEZA;10222;BETH ABREU;3;599;;1;COLÉGIO SANTA CECÍLIA;AV. SENADOR VIRGÍLIO TÁVORA, 2000;ALDEOTA;
2024;1;FORTALEZA;10222;BETH ABREU;80;125;;1;EEFM ESTADO DO PARÁ;RUA DJALMA PETIT 589;ALTO DA BALANÇA;
2024;1;FORTALEZA;10222;BETH ABREU;80;130;;1;EM PROFESSORA EDITH BRAGA;RUA CAPITAO VASCONCELOS 1061;ALTO DA BALANÇA;
2024;1;FORTALEZA;10222;BETH ABREU;80;185;;1;COLÉGIO NOSSA SENHORA DAS GRAÇAS;RUA MONSENHOR OTÁVIO DE CASTRO, 535;FÁTIMA;
2024;1;FORTALEZA;10222;BETH ABREU;80;217;;2;EM PROFESSORA EDITH BRAGA;RUA CAPITAO VASCONCELOS 1061;ALTO DA BALANÇA;
2024;1;FORTALEZA;10222;BETH ABREU;80;218;;1;EM PROFESSORA EDITH BRAGA;RUA CAPITAO VASCONCELOS 1061;ALTO DA BALANÇA;
2024;1;FORTALEZA;10222;BETH ABREU;80;220;;1;EM PROFESSORA EDITH BRAGA;RUA CAPITAO VASCONCELOS 1061;ALTO DA BALANÇA;
2024;1;FORTALEZA;10222;BETH ABREU;80;248;;1;EMEIF PROFª ANTONIETA CALS;RUA MONSENHOR SALAZAR 1480;TAUAPE;
2024;1;FORTALEZA;10222;BETH ABREU;80;291;;1;ESCOLA MUNICIPAL PAPA JOÃO XXIII;AV TREZE DE ABRIL, 545;VILA UNIÃO;
2024;1;FORTALEZA;10222;BETH ABREU;80;339;;1;COLÉGIO ANTARES IRMÃ MARIA (ANTIGO IRMÃ MARIA MONTENEGRO);RUA PINHO PESSOA 681;JOAQUIM TÁVORA;
2024;1;FORTALEZA;10222;BETH ABREU;80;364;;1;INSTITUTO DE EDUCAÇÃO DO CEARÁ;RUA GRACILIANO RAMOS, 52;FÁTIMA;
2024;1;FORTALEZA;10222;BETH ABREU;82;193;;1;CENTRO EDUCACIONAL SÃO MATEUS;AV. SARGENTO HERMÍNIO SAMPAIO, 2440;MONTE CASTELO;
2024;1;FORTALEZA;10222;BETH ABREU;82;410;;1;COLÉGIO MANUEL DA SILVA - CARLITO PAMPLONA;AV. FRANCISCO SÁ, 4001;CARLITO PAMPLONA;
2024;1;FORTALEZA;10222;BETH ABREU;82;583;;1;ASSOCIACAO DE CANTADORES DO NORDESTE;RUA COELHO FONSECA, 195;ÁLVARO WEYNE;
2024;1;FORTALEZA;10222;BETH ABREU;82;679;;1;EEFM JOSÉ VALDO RIBEIRO RAMOS - EEMTI;RUA PEDRO AMÉRICO, 100;CARLITO PAMPLONA;
2024;1;FORTALEZA;10222;BETH ABREU;83;34;;1;EEMTI ESTADO DO AMAZONAS;RUA MONSENHOR FURTADO 2327;BELA VISTA;
2024;1;FORTALEZA;10222;BETH ABREU;83;88;;1;ESCOLA MUNICIPAL SANTA MARIA;RUA CUIABÁ 1465;HENRIQUE JORGE;
2024;1;FORTALEZA;10222;BETH ABREU;83;248;;1;EEFM ANISIO TEIXEIRA;RUA RIO GRANDE DO SUL 680;PANAMERICANO;
2024;1;FORTALEZA;10222;BETH ABREU;83;251;;1;EEFM ANISIO TEIXEIRA;RUA RIO GRANDE DO SUL 680;PANAMERICANO;
2024;1;FORTALEZA;10222;BETH ABREU;83;589;;1;ESCOLA MUNICIPAL JOSÉ SOBREIRA DE AMORIM;RUA ESTRADA DO PICI 1083;HENRIQUE JORGE;
2024;1;FORTALEZA;10222;BETH ABREU;83;649;;1;CENTRO DE FORMAÇÃO E DESENV. PARA PROFISSIONAIS DA EDUCAÇÃO - FORMACE;RUA PORTO VELHO, 401;JOÃO XXIII;
2024;1;FORTALEZA;10222;BETH ABREU;83;723;;1;COLEGIO CHRISTUS;AV. ENG. HUMBERTO MONTE, 1355;BELA VISTA;
2024;1;FORTALEZA;10222;BETH ABREU;83;789;;1;CENTRO DE FORMAÇÃO E DESENV. PARA PROFISSIONAIS DA EDUCAÇÃO - FORMACE;RUA PORTO VELHO, 401;JOÃO XXIII;
2024;1;FORTALEZA;10222;BETH ABREU;85;188;;1;EEFM JOSE LEOPOLDINO DA SILVA FILHO - UV4;RUA QUATROCENTOS E QUARENTA E OITO, 1, 2A ETAPA;CONJUNTO CEARÁ I;
2024;1;FORTALEZA;10222;BETH ABREU;85;220;;1;EEFM MARIA ANTONIETA NUNES - UV 9;RUA 916 SN 4 ETAPA;CONJUNTO CEARÁ I;
2024;1;FORTALEZA;10222;BETH ABREU;85;230;;1;EEM LICEU DO CONJUNTO CEARA;RUA 1139 A, 10 4 ETAPA;CONJUNTO CEARÁ I;
2024;1;FORTALEZA;10222;BETH ABREU;93;120;;1;EEFM DEPUTADO JOACI PEREIRA;RUA PROFESSOR PEDRO JORGE, 830;PLANALTO AYRTON SENNA;
2024;1;FORTALEZA;10222;BETH ABREU;93;134;;1;COLEGIO VEGA;AVENIDA C, 160;PREFEITO JOSÉ WALTER;
2024;1;FORTALEZA;10222;BETH ABREU;93;185;;1;EM MARIA ZELIA CORREIA DE SOUSA;RUA ANTONIO PEREIRA,1495;PLANALTO AYRTON SENNA;
2024;1;FORTALEZA;10222;BETH ABREU;93;186;;1;EM MARIA ZELIA CORREIA DE SOUSA;RUA ANTONIO PEREIRA,1495;PLANALTO AYRTON SENNA;
2024;1;FORTALEZA;10222;BETH ABREU;93;198;;1;LICEU ESTADUAL DOMINGOS BRASILEIRO;RUA PLANALTINA, S/N;PLANALTO AYRTON SENNA;
2024;1;FORTALEZA;10222;BETH ABREU;93;202;;1;LICEU ESTADUAL DOMINGOS BRASILEIRO;RUA PLANALTINA, S/N;PLANALTO AYRTON SENNA;
2024;1;FORTALEZA;10222;BETH ABREU;93;241;;1;EM ROGACIANO LEITE;RUA 45, S/N - III ETAPA;PREFEITO JOSÉ WALTER;
2024;1;FORTALEZA;10222;BETH ABREU;93;286;;1;EEFM DEPUTADO JOACI PEREIRA;RUA PROFESSOR PEDRO JORGE, 830;PLANALTO AYRTON SENNA;
2024;1;FORTALEZA;10222;BETH ABREU;94;364;365;1;EEFM DEP FCO DE ALMEIDA MONTE;AV. CORONEL CARVALHO 2400;JARDIM IRACEMA;
2024;1;FORTALEZA;10222;BETH ABREU;94;430;;1;EM CASTELO DE CASTRO;RUA 43 1531;VILA VELHA;
2024;1;FORTALEZA;10222;BETH ABREU;94;774;;2;ASSOC DOS MORADORES DO CONJ DOS BANCARIOS;RUA 27 1630;VILA VELHA;
2024;1;FORTALEZA;10222;BETH ABREU;94;848;;1;COLÉGIO EVOLUIR;RUA CÂNDIDO MAIA,109;ANTÔNIO BEZERRA;
2024;1;FORTALEZA;10222;BETH ABREU;95;140;;1;EMTI PROFESSOR ANTONIO GIRAO BARROSO;RUA VERDE 37, S/N (CJ SITIO SAO JOAO);JANGURUSSU;
2024;1;FORTALEZA;10222;BETH ABREU;95;154;;1;EM PROFESSORA MARIA ANTONÉZIA MEIRELES E SÁ;RUA CORONEL VIRGÍLIO TÁVORA, 1340;BARROSO;
2024;1;FORTALEZA;10222;BETH ABREU;95;189;;1;DNIT;RODOVIA BR-116, KM 06;CAJAZEIRAS;
2024;1;FORTALEZA;10222;BETH ABREU;95;250;;1;EMEIEF OTAVIO DE FARIAS;RUA JOAO FERREIRA, S/N;BARROSO;
2024;1;FORTALEZA;10222;BETH ABREU;95;257;;1;EEFM PROFESSOR  ALOYSIO BARROS LEAL;RUA 10,  LOT. PRQ.VERDE 28 (CJ JOAO PAULO II);BARROSO;
2024;1;FORTALEZA;10222;BETH ABREU;95;264;;1;EEFM PROFESSOR  ALOYSIO BARROS LEAL;RUA 10,  LOT. PRQ.VERDE 28 (CJ JOAO PAULO II);BARROSO;
2024;1;FORTALEZA;10222;BETH ABREU;95;265;;1;EEFM PROF. PAULO AYRTON ARAUJO;BR 116 KM 05, AO LADO DA EMPRESA GUANABARA;CAJAZEIRAS;
2024;1;FORTALEZA;10222;BETH ABREU;95;277;;1;EMEIF JOSE MOREIRA LEITAO;RUA HONORINO MAIA, 467;PARQUE SANTA MARIA;
2024;1;FORTALEZA;10222;BETH ABREU;95;279;;1;EMEIF JOSE MOREIRA LEITAO;RUA HONORINO MAIA, 467;PARQUE SANTA MARIA;
2024;1;FORTALEZA;10222;BETH ABREU;95;281;;1;EMEIF JOSE MOREIRA LEITAO;RUA HONORINO MAIA, 467;PARQUE SANTA MARIA;
2024;1;FORTALEZA;10222;BETH ABREU;95;298;;1;UAPS JOSE BARROS DE ALENCAR;RUA JOSE NOGUEIRA, 180;PEDRAS;
2024;1;FORTALEZA;10222;BETH ABREU;95;327;;1;EEFM PROFESSOR  ALOYSIO BARROS LEAL;RUA 10,  LOT. PRQ.VERDE 28 (CJ JOAO PAULO II);BARROSO;
2024;1;FORTALEZA;10222;BETH ABREU;95;328;;1;EMEIEF LIONS CLUBE FORTALEZA FÁTIMA;TRAVESSA LIONS CLUBE, 141;JANGURUSSU;
2024;1;FORTALEZA;10222;BETH ABREU;95;338;;1;EEFM PROFESSOR  ALOYSIO BARROS LEAL;RUA 10,  LOT. PRQ.VERDE 28 (CJ JOAO PAULO II);BARROSO;
2024;1;FORTALEZA;10222;BETH ABREU;112;42;;1;CENTRO DE EDUCAÇÃO INFANTIL(CEI) MARIA DE LOURDES RIBEIRO JEREISSATI;RUA 1, 930 - CONJ. TANCREDO NEVES;JARDIM DAS OLIVEIRAS;
2024;1;FORTALEZA;10222;BETH ABREU;112;43;;1;CENTRO DE EDUCAÇÃO INFANTIL(CEI) MARIA DE LOURDES RIBEIRO JEREISSATI;RUA 1, 930 - CONJ. TANCREDO NEVES;JARDIM DAS OLIVEIRAS;
2024;1;FORTALEZA;10222;BETH ABREU;112;97;;2;EM ISMAEL PORDEUS;RUA DES FAUSTINO ALBUQUERQUE, 511;JARDIM DAS OLIVEIRAS;
2024;1;FORTALEZA;10222;BETH ABREU;112;99;;1;EM ISMAEL PORDEUS;RUA DES FAUSTINO ALBUQUERQUE, 511;JARDIM DAS OLIVEIRAS;
2024;1;FORTALEZA;10222;BETH ABREU;112;100;;1;EM ISMAEL PORDEUS;RUA DES FAUSTINO ALBUQUERQUE, 511;JARDIM DAS OLIVEIRAS;
2024;1;FORTALEZA;10222;BETH ABREU;112;141;;1;EEFM D. LUIZA TÁVORA - PRÓ MORAR;RUA FREI CANECA, 379;JARDIM DAS OLIVEIRAS;
2024;1;FORTALEZA;10222;BETH ABREU;112;165;;1;EM JOHNSON;RUA DRA. SOCORRO AZEVEDO, 461;ENGENHEIRO LUCIANO CAVALCANTE;
2024;1;FORTALEZA;10222;BETH ABREU;112;284;;2;COLÉGIO ÁGAPE;AV HERMINIO DE CASTRO, 140;PARQUE MANIBURA;
2024;1;FORTALEZA;10222;BETH ABREU;112;291;;1;COLÉGIO DÁULIA BRINGEL;RUA TRAJANO ALVES DE AGUIAR, 55;CIDADE DOS FUNCIONÁRIOS;
2024;1;FORTALEZA;10222;BETH ABREU;112;306;;1;EEMTI MIRIAN PORTO MOTA;RUA DAS CASTANHOLAS, S/N;JARDIM DAS OLIVEIRAS;
2024;1;FORTALEZA;10222;BETH ABREU;112;319;;1;IGREJA DA GLÓRIA;AV OLIVEIRA PAIVA, 905;CIDADE DOS FUNCIONÁRIOS;
2024;1;FORTALEZA;10222;BETH ABREU;112;332;;1;IGREJA DA GLÓRIA;AV OLIVEIRA PAIVA, 905;CIDADE DOS FUNCIONÁRIOS;
2024;1;FORTALEZA;10222;BETH ABREU;112;349;;1;IGREJA DA GLÓRIA;AV OLIVEIRA PAIVA, 905;CIDADE DOS FUNCIONÁRIOS;
2024;1;FORTALEZA;10222;BETH ABREU;112;353;;1;ESCOLA ESTADUAL DE EDUCAÇÃO PROFISSIONAL JAIME ALENCAR DE OLIVEIRA;AV ROGACIANO LEITE, 2285;ENGENHEIRO LUCIANO CAVALCANTE;
2024;1;FORTALEZA;10222;BETH ABREU;112;362;;1;CENTRO UNIVERSITARIO ESTACIO DO CEARA VIA CORPVS;RUA ELISEU UCHÔA BECO, 600;GUARARAPES;
2024;1;FORTALEZA;10222;BETH ABREU;112;376;;2;FUNCAP;AV. OLIVEIRA PAIVA, 941;CIDADE DOS FUNCIONÁRIOS;
2024;1;FORTALEZA;10222;BETH ABREU;112;378;;1;FUNCAP;AV. OLIVEIRA PAIVA, 941;CIDADE DOS FUNCIONÁRIOS;
2024;1;FORTALEZA;10222;BETH ABREU;112;379;;1;ESCOLA SOCIOEDUCATIVA;AV. OLIVEIRA PAIVA, 941;CIDADE DOS FUNCIONÁRIOS;
2024;1;FORTALEZA;10222;BETH ABREU;112;404;;1;COLEGIO ARI DE SA CAVALCANTE WS;AV WASHINGTON SOARES, 3737;EDSON QUEIROZ;
2024;1;FORTALEZA;10222;BETH ABREU;112;415;;1;COLEGIO ARI DE SA CAVALCANTE WS;AV WASHINGTON SOARES, 3737;EDSON QUEIROZ;
2024;1;FORTALEZA;10222;BETH ABREU;112;482;;1;EM PROFª ALDACI BARBOSA;RUA OLEGARIO MEMORIA, 1257;SAPIRANGA-COITÉ;
2024;1;FORTALEZA;10222;BETH ABREU;112;485;;1;EM PROFª ALDACI BARBOSA;RUA OLEGARIO MEMORIA, 1257;SAPIRANGA-COITÉ;
2024;1;FORTALEZA;10222;BETH ABREU;112;495;;1;COLEGIO MASTER SUL;RUA BENJAMIM MOURA, 631;CIDADE DOS FUNCIONÁRIOS;
2024;1;FORTALEZA;10222;BETH ABREU;112;497;;1;COLEGIO MASTER SUL;RUA BENJAMIM MOURA, 631;CIDADE DOS FUNCIONÁRIOS;
2024;1;FORTALEZA;10222;BETH ABREU;112;499;;1;COLEGIO MASTER SUL;RUA BENJAMIM MOURA, 631;CIDADE DOS FUNCIONÁRIOS;
2024;1;FORTALEZA;10222;BETH ABREU;112;551;;1;CENTRO UNIVERSITÁRIO 7 DE SETEMBRO - UNI 7 (FA7);AV. ALMIRANTE MAXIMINIANO DA FONSECA, 1395;ENGENHEIRO LUCIANO CAVALCANTE;
2024;1;FORTALEZA;10222;BETH ABREU;112;552;;1;COLÉGIO DÁULIA BRINGEL;RUA TRAJANO ALVES DE AGUIAR, 55;CIDADE DOS FUNCIONÁRIOS;
2024;1;FORTALEZA;10222;BETH ABREU;113;20;;1;IFCE - INST FEDERAL DE CIÊNCIA E TECNOLOGIA (CEFET);AV. 13 DE MAIO, 2081;BENFICA;
2024;1;FORTALEZA;10222;BETH ABREU;113;42;43, 44;1;COLÉGIO FARIAS BRITO PRÉ - VESTIBULAR;AV. BARÃO DO RIO BRANCO, 2424;JOSÉ BONIFÁCIO;
2024;1;FORTALEZA;10222;BETH ABREU;113;74;;2;COLÉGIO LOURENÇO FILHO;RUA BARÃO DO RIO BRANCO, 2101;CENTRO;
2024;1;FORTALEZA;10222;BETH ABREU;113;111;;1;COLÉGIO CHRISTUS BENFICA;RUA LUIS DE MIRANDA, 536;BENFICA;
2024;1;FORTALEZA;10222;BETH ABREU;113;112;;1;COLÉGIO CHRISTUS BENFICA;RUA LUIS DE MIRANDA, 536;BENFICA;
2024;1;FORTALEZA;10222;BETH ABREU;113;136;;1;EMEIF DOM MANUEL DA SILVA GOMES;RUA SAMUEL UCHÔA, 550;BOM FUTURO;
2024;1;FORTALEZA;10222;BETH ABREU;113;153;;1;COLÉGIO MEDALHA MILAGROSA;RUA PADRE JOÃO PIAMARTA,  415;BOM FUTURO;
2024;1;FORTALEZA;10222;BETH ABREU;113;162;;1;EMEIF MOZART PINTO;RUA JORGE DUMMAR, 2078;JARDIM AMÉRICA;
2024;1;FORTALEZA;10222;BETH ABREU;113;193;;1;FACULDADE DE PSICOLOGIA DA UFC;AV. DA UNIVERSIDADE, 2762;BENFICA;
2024;1;FORTALEZA;10222;BETH ABREU;113;198;;1;EEFM DR.CÉSAR CALS;AV. DOMINGOS OLIMPIO, 1800;FARIAS BRITO;
2024;1;FORTALEZA;10222;BETH ABREU;113;204;;1;COLÉGIO CHRISTUS PRÉ - UNIVERSITÁRIO;RUA CRUZ SALDANHA, 614;PARQUELÂNDIA;
2024;1;FORTALEZA;10222;BETH ABREU;113;208;;1;COLÉGIO CHRISTUS PRÉ - UNIVERSITÁRIO;RUA CRUZ SALDANHA, 614;PARQUELÂNDIA;
2024;1;FORTALEZA;10222;BETH ABREU;113;231;;1;CEI FRANCISCO EURIVÁ MATIAS;RUA FREI MARCELINO, S/N;RODOLFO TEÓFILO;
2024;1;FORTALEZA;10222;BETH ABREU;113;235;;1;EEFM ANTONIO SALES - PARQUELÂNDIA;RUA PROF. ANACLETO, 630;PARQUELÂNDIA;
2024;1;FORTALEZA;10222;BETH ABREU;113;237;;1;EEFM ANTONIO SALES - PARQUELÂNDIA;RUA PROF. ANACLETO, 630;PARQUELÂNDIA;
2024;1;FORTALEZA;10222;BETH ABREU;113;240;;2;EEFM ANTONIO SALES - PARQUELÂNDIA;RUA PROF. ANACLETO, 630;PARQUELÂNDIA;
2024;1;FORTALEZA;10222;BETH ABREU;113;249;;1;EEFM SANTO AFONSO;RUA GAL. BERNARDO FIGUEIREDO, 2670;PARQUELÂNDIA;
2024;1;FORTALEZA;10222;BETH ABREU;113;261;;1;EEF MONSENHOR LINHARES;RUA PROF. LINO ENCARNAÇÃO, 1130;AMADEU FURTADO;
2024;1;FORTALEZA;10222;BETH ABREU;113;280;;1;COLÉGIO CHRISTUS PRÉ - UNIVERSITÁRIO;RUA CRUZ SALDANHA, 614;PARQUELÂNDIA;
2024;1;FORTALEZA;10222;BETH ABREU;113;303;;1;COLÉGIO GUSTAVO BRAGA;AV. JOÃO PESSOA, 4650/80;DAMAS;
2024;1;FORTALEZA;10222;BETH ABREU;113;353;;1;COLÉGIO AGNUS;RUA TEODORICO BARROSO, 827;MONTESE;
2024;1;FORTALEZA;10222;BETH ABREU;113;379;;1;COLÉGIO NOSSA SENHORA APARECIDA;RUA AQUILES BORIS, 342;MONTESE;
2024;1;FORTALEZA;10222;BETH ABREU;113;445;;2;IFCE - INST FEDERAL DE CIÊNCIA E TECNOLOGIA (CEFET);AV. 13 DE MAIO, 2081;BENFICA;
2024;1;FORTALEZA;10222;BETH ABREU;114;1;;1;COLÉGIO MANUEL DA SILVA (ÁLVARO WEYNE);RUA SÃO BERNARDO 181;ÁLVARO WEYNE;
2024;1;FORTALEZA;10222;BETH ABREU;114;6;;1;COLÉGIO MANUEL DA SILVA (ÁLVARO WEYNE);RUA SÃO BERNARDO 181;ÁLVARO WEYNE;
2024;1;FORTALEZA;10222;BETH ABREU;114;9;;1;COLÉGIO MANUEL DA SILVA (ÁLVARO WEYNE);RUA SÃO BERNARDO 181;ÁLVARO WEYNE;
2024;1;FORTALEZA;10222;BETH ABREU;114;10;;1;COLÉGIO MANUEL DA SILVA (ÁLVARO WEYNE);RUA SÃO BERNARDO 181;ÁLVARO WEYNE;
2024;1;FORTALEZA;10222;BETH ABREU;114;99;;1;EM RAIMUNDO DE SOUSA MANGUEIRA;RUA ALBERTO FERREIRA 624;JARDIM IRACEMA;
2024;1;FORTALEZA;10222;BETH ABREU;114;116;;1;EMTI NOSSA SENHORA DE FÁTIMA (ANTIGA APOSTÓLICA/SEMINÁRIO);RUA SÍLVIO ROMERO 370;ÁLVARO WEYNE;
2024;1;FORTALEZA;10222;BETH ABREU;114;121;;1;EMTI NOSSA SENHORA DE FÁTIMA (ANTIGA APOSTÓLICA/SEMINÁRIO);RUA SÍLVIO ROMERO 370;ÁLVARO WEYNE;
2024;1;FORTALEZA;10222;BETH ABREU;114;142;;1;EM JOSÉ DE ALENCAR;RUA ALBERTO FERREIRA 248;JARDIM IRACEMA;
2024;1;FORTALEZA;10222;BETH ABREU;114;173;;1;COLÉGIO MANUEL DA SILVA (ÁLVARO WEYNE);RUA SÃO BERNARDO 181;ÁLVARO WEYNE;
2024;1;FORTALEZA;10222;BETH ABREU;114;188;;1;EM JADER DE FIGUEIREDO CORREIA;RUA TOCANDIRA 61;BARRA DO CEARÁ;
2024;1;FORTALEZA;10222;BETH ABREU;114;277;;1;EEMTI PROFESSORA BALBINA JUCA ALBUQUERQUE;AVENIDA MAJOR ASSIS 346;JARDIM IRACEMA;
2024;1;FORTALEZA;10222;BETH ABREU;115;128;264;1;LAR FABIANO DE CRISTO;RUA CEL. JAIME ROLEMBERG, 100;MONDUBIM;
2024;1;FORTALEZA;10222;BETH ABREU;115;175;;1;EM PROF. JOSE VALDIVINO DE CARVALHO;RUA GUARA, S/N;PARANGABA;
2024;1;FORTALEZA;10222;BETH ABREU;115;190;;1;EEMTI MARIA THOMÁSIA;RUA POLONIA, 369;PARANGABA;
2024;1;FORTALEZA;10222;BETH ABREU;115;194;;1;EEMTI MARIA THOMÁSIA;RUA POLONIA, 369;PARANGABA;
2024;1;FORTALEZA;10222;BETH ABREU;115;226;;1;EM WALDEMAR BARROSO;RUA CÔNEGO LIMA SUCUPIRA,  1651;SERRINHA;
2024;1;FORTALEZA;10222;BETH ABREU;115;365;;1;EM CATULO DA PAIXAO CEARENSE;RUA LEAO DO NORTE 300;VILA PERI;
2024;1;FORTALEZA;10222;BETH ABREU;115;366;;2;EM CATULO DA PAIXAO CEARENSE;RUA LEAO DO NORTE 300;VILA PERI;
2024;1;FORTALEZA;10222;BETH ABREU;115;367;;1;EM CATULO DA PAIXAO CEARENSE;RUA LEAO DO NORTE 300;VILA PERI;
2024;1;FORTALEZA;10222;BETH ABREU;115;403;;1;EEFM PROFESSOR MARIO SCHENBERG;RUA AMERICO ROCHA LIMA 835;MANOEL SÁTIRO;
2024;1;FORTALEZA;10222;BETH ABREU;115;405;;1;EEFM PROFESSOR MARIO SCHENBERG;RUA AMERICO ROCHA LIMA 835;MANOEL SÁTIRO;
2024;1;FORTALEZA;10222;BETH ABREU;115;443;;1;EM MARIA VIVIANE BENEVIDES GOUVEIA;RUA CREUZA ROQUE 247;MANOEL SÁTIRO;
2024;1;FORTALEZA;10222;BETH ABREU;115;446;;1;EM MARIA VIVIANE BENEVIDES GOUVEIA;RUA CREUZA ROQUE 247;MANOEL SÁTIRO;
2024;1;FORTALEZA;10222;BETH ABREU;115;454;;1;EM HENRIQUETA GALENO;RUA MAJOR MONTENEGRO 917;MANOEL SÁTIRO;
2024;1;FORTALEZA;10222;BETH ABREU;115;458;;1;EM HENRIQUETA GALENO;RUA MAJOR MONTENEGRO 917;MANOEL SÁTIRO;
2024;1;FORTALEZA;10222;BETH ABREU;115;488;;1;COLEGIO GURI  SENIOR;RUA CONEGO DE CASTRO 1780;PARANGABA;
2024;1;FORTALEZA;10222;BETH ABREU;116;154;;1;EM SEBASTIAO DE ABREU;RUA GERALDO BARBOSA 1065;BOM JARDIM;
2024;1;FORTALEZA;10222;BETH ABREU;116;188;;1;EM EDUCADOR PAULO FREIRE;RUA CORONEL FABRICIANO 452;GRANJA PORTUGAL;
2024;1;FORTALEZA;10222;BETH ABREU;116;275;;1;EM EDUCADOR PAULO FREIRE;RUA CORONEL FABRICIANO 452;GRANJA PORTUGAL;
2024;1;FORTALEZA;10222;BETH ABREU;116;384;;1;EM FRANCISCA FERNANDES MAGALHAES;RUA OLIVEIRA SOBRINHO, 1031;BONSUCESSO;
2024;1;FORTALEZA;10222;BETH ABREU;116;389;;1;EM FRANCISCA FERNANDES MAGALHAES;RUA OLIVEIRA SOBRINHO, 1031;BONSUCESSO;
2024;1;FORTALEZA;10222;BETH ABREU;116;392;;1;EM FRANCISCA FERNANDES MAGALHAES;RUA OLIVEIRA SOBRINHO, 1031;BONSUCESSO;
2024;1;FORTALEZA;10222;BETH ABREU;116;393;;1;EM PROF LUIS RECAMONDE CAPELO;RUA MARIA QUINTELA 901;BONSUCESSO;
2024;1;FORTALEZA;10222;BETH ABREU;116;463;;1;COLEGIO LIMA NOGUEIRA;RUA JULIO BRAGA, 1117;JOÃO XXIII;
2024;1;FORTALEZA;10222;BETH ABREU;117;179;;1;COLÉGIO VENCER;RUA JARDIM PARUARA, 1108;SIQUEIRA;
2024;1;FORTALEZA;10222;BETH ABREU;117;256;;1;EMTI PROFESSOR AGERSON TABOSA PINTO;RUA WILCA ALBUQUERQUE, S/N;SIQUEIRA;
2024;1;FORTALEZA;10222;BETH ABREU;117;382;;1;PROJETO ALIANÇA COM CRISTO;RUA WALDEMAR PAES BRAGANÇA 1208;BOM JARDIM;
2024;1;FORTALEZA;10222;BETH ABREU;118;16;;1;EM SANTA TEREZINHA;RUA AFONSO LOPES, 1095;PARQUE DOIS IRMÃOS;
2024;1;FORTALEZA;10222;BETH ABREU;118;56;;1;COLEGIO CONEXÃO SABER;RUA DOUTOR PEDRO SAMPAIO, 550;PASSARÉ;
2024;1;FORTALEZA;10222;BETH ABREU;118;116;;1;COLÉGIO MULTIVERSO (ANTIGO COLÉGIO TELES);AV. JUSCELINO KUBITSCHECK, 3653;PASSARÉ;
2024;1;FORTALEZA;10222;BETH ABREU;118;264;;1;EEFM PROFESSOR JADER MOREIRA DE CARVALHO;RUA PROFESSORA HELOISA FERREIRA LIMA, 420;SERRINHA;
2024;1;FORTALEZA;10222;BETH ABREU;118;306;;1;COLEGIO EXODUS;RUA DOUTOR EDUARDO DIAS, 156;PASSARÉ;
2024;1;FORTALEZA;10222;BETH ABREU;118;317;;1;EM FRANCISCO ANDRADE TEOFILO GIRAO;RUA UNIDOS VENCEREMOS, 2040;PASSARÉ;
2024;1;FORTALEZA;10222;BETH ABREU;118;388;;1;EEFM PROFESSOR JADER MOREIRA DE CARVALHO;RUA PROFESSORA HELOISA FERREIRA LIMA, 420;SERRINHA;
2024;1;FORTALEZA;10222;BETH ABREU;118;408;;1;EM FRANCISCO ANDRADE TEOFILO GIRAO;RUA UNIDOS VENCEREMOS, 2040;PASSARÉ;
2024;1;FORTALEZA;10222;BETH ABREU;118;459;;1;COLÉGIO MULTIVERSO (ANTIGO COLÉGIO TELES);AV. JUSCELINO KUBITSCHECK, 3653;PASSARÉ;
2024;1;FORTALEZA;10222;BETH ABREU;118;524;;1;COLÉGIO LIRA COUTINHO;RUA BELOS PORTOS, 447;PASSARÉ;
2024;1;FORTALEZA;10222;BETH ABREU;118;574;;1;EEFM PROFESSORA MARIA GONCALVES;RUA N S DO MONTE CARMELO S/N;BOA VISTA-CASTELÃO;
2024;1;FORTALEZA;10222;BETH ABREU;118;577;;1;EEFM ANTÔNIO DIAS MACEDO;AV PEDRO DANTAS 340;DIAS MACEDO;
2024;1;FORTALEZA;10222;BETH ABREU;118;584;;1;EEFM ANTÔNIO DIAS MACEDO;AV PEDRO DANTAS 340;DIAS MACEDO;
2024;1;FORTALEZA;10222;BETH ABREU;118;591;;1;EEMTI PADRE GUILHERME WAESSEN;RUA BOA VENTURA 916;DIAS MACEDO;
2024;1;FORTALEZA;10222;BETH ABREU;118;597;;2;EMEF PROFESSOR JOAO HIPPÓLYTO DE AZEVEDO E SÁ;RUA 03 N. 88 RESIDENCIAL NAPOLEAO VIANA;DIAS MACEDO;
2024;1;FORTALEZA;10222;BETH ABREU;118;598;;2;EMEF PROFESSOR JOAO HIPPÓLYTO DE AZEVEDO E SÁ;RUA 03 N. 88 RESIDENCIAL NAPOLEAO VIANA;DIAS MACEDO;
2024;1;FORTALEZA;10222;BETH ABREU;118;600;;1;EMEF PROFESSOR JOAO HIPPÓLYTO DE AZEVEDO E SÁ;RUA 03 N. 88 RESIDENCIAL NAPOLEAO VIANA;DIAS MACEDO;
2024;1;FORTALEZA;10222;BETH ABREU;118;609;;1;EM CASIMIRO MONTENEGRO;AV. BERNARDO MANUEL, 11360;MONDUBIM;
2024;1;FORTALEZA;10222;BETH ABREU;118;660;;1;COLÉGIO SÃO LUCAS;RUA JOSÉ DA FRANCA CABRAL, 748;BOA VISTA-CASTELÃO;
2024;1;FORTALEZA;10222;BETH ABREU;118;672;;1;COLÉGIO SÃO LUCAS;RUA JOSÉ DA FRANCA CABRAL, 748;BOA VISTA-CASTELÃO;
TOTAL;;;;;;;;216;
