Ano;Turno;Município;Número;Candidato;Zona;Seção;Seções Agregadas;Votos;Local de Votação;Endereço Local de Votação;Bairro;
2024;1;FORTALEZA;20013;BRUNA DAMASCENO;1;662;;1;CIES AIDA SANTOS;AVENIDA TRAJANO DE MEDEIROS  813;VICENTE PINZON;
2024;1;FORTALEZA;20013;BRUNA DAMASCENO;1;704;;1;FANOR - FACULDADE NORDESTE;AVENIDA SANTOS DUMONT 7800;DE LOURDES;
2024;1;FORTALEZA;20013;BRUNA DAMASCENO;1;752;;1;EMTI VEREADOR ALBERTO GOMES DE QUEIROZ;AV. ZEZÉ DIOGO, 782;CAIS DO PORTO;
2024;1;FORTALEZA;20013;BRUNA DAMASCENO;1;831;;1;CRECHE RACHEL GUIMARÃES MARTINS BARBOSA;VIA DE PEDRESTE LESTE OESTE 01;CAIS DO PORTO;
2024;1;FORTALEZA;20013;BRUNA DAMASCENO;1;836;;1;ESCOLA MUNICIPAL FREI TITO DE ALENCAR LIMA;AVENIDA DIOGUINHO 5927;VICENTE PINZON;
2024;1;FORTALEZA;20013;BRUNA DAMASCENO;1;914;;1;ESCOLA MUNICIPAL FREI TITO DE ALENCAR LIMA;AVENIDA DIOGUINHO 5927;VICENTE PINZON;
2024;1;FORTALEZA;20013;BRUNA DAMASCENO;1;915;;1;FANOR - FACULDADE NORDESTE;AVENIDA SANTOS DUMONT 7800;DE LOURDES;
2024;1;FORTALEZA;20013;BRUNA DAMASCENO;1;938;;1;ESCOLA ESTADUAL DEPUTADO MANOEL RODRIGUES;RUA OLIVEIRA FILHO, 1576;VICENTE PINZON;
2024;1;FORTALEZA;20013;BRUNA DAMASCENO;2;699;;1;COLÉGIO SERAFICO NOSSA SENHORA DO BRASIL;AVENIDA FREI CIRILO 4454;MESSEJANA;
2024;1;FORTALEZA;20013;BRUNA DAMASCENO;2;731;;1;EEFM GOV LUIZ DE GONZAGA FONSECA MOTA;RUA SANTA ROSA, 407;COAÇU;
2024;1;FORTALEZA;20013;BRUNA DAMASCENO;2;809;;1;SECRETARIA DA EDUCACAO - CAMBEBA;AVENIDA MINISTRO JOSE AMERICO, SN;CAMBEBA;
2024;1;FORTALEZA;20013;BRUNA DAMASCENO;3;117;27;1;SENAI - UNIDADE JACARECANGA;AV. PADRE IBIAPINA, 1280;JACARECANGA;
2024;1;FORTALEZA;20013;BRUNA DAMASCENO;3;242;243;1;COLÉGIO ARI DE SÁ - PRÉ-VESTIBULAR - SEDE DUQUE DE CAXIAS;AV. DUQUE DE CAXIAS, 519;CENTRO;
2024;1;FORTALEZA;20013;BRUNA DAMASCENO;3;271;226;1;FAC. CATÓLICA DE FORTALEZA (SEMINÁRIO DA PRAINHA);RUA TENENTE BENÉVOLO, 201;CENTRO;
2024;1;FORTALEZA;20013;BRUNA DAMASCENO;3;477;;1;COLÉGIO CHRISTUS (AV. BARÃO DE STUDART);RUA JOÃO CARVALHO, 630;ALDEOTA;
2024;1;FORTALEZA;20013;BRUNA DAMASCENO;3;580;;1;ESCOLA DE SAÚDE PÚBLICA DO CEARÁ;AV. ANTÔNIO JUSTA, 3161;MEIRELES;
2024;1;FORTALEZA;20013;BRUNA DAMASCENO;3;642;;1;NÁUTICO ATLÉTICO CEARENSE;AV. DA ABOLIÇÃO, 2727;MEIRELES;
2024;1;FORTALEZA;20013;BRUNA DAMASCENO;80;175;;1;CENTRO EDUC. DA JUV. PE. JOÃO PIAMARTA - AGUANAMBI;AV. AGUANAMBI, 2479;FÁTIMA;
2024;1;FORTALEZA;20013;BRUNA DAMASCENO;80;196;;1;COLÉGIO SANTO TOMÁZ DE AQUINO;RUA MÁRIO MAMEDE, 750;FÁTIMA;
2024;1;FORTALEZA;20013;BRUNA DAMASCENO;80;325;;1;COLÉGIO SANTO INACIO;AVENIDA DESEMBARGADOR MOREIRA 2355;DIONISIO TORRES;
2024;1;FORTALEZA;20013;BRUNA DAMASCENO;80;334;;1;COLÉGIO ANTARES IRMÃ MARIA (ANTIGO IRMÃ MARIA MONTENEGRO);RUA PINHO PESSOA 681;JOAQUIM TÁVORA;
2024;1;FORTALEZA;20013;BRUNA DAMASCENO;80;354;;1;COLÉGIO SALESIANO DOM BOSCO;AV ANTONIO SALES 116;JOAQUIM TÁVORA;
2024;1;FORTALEZA;20013;BRUNA DAMASCENO;80;398;;1;EEM GOV. ADAUTO BEZERRA;RUA MONSENHOR LIBERATO, 1850;FÁTIMA;
2024;1;FORTALEZA;20013;BRUNA DAMASCENO;80;436;443;1;ESCOLA VILA;RUA DOM SEBASTIAO LEME, 819;FÁTIMA;
2024;1;FORTALEZA;20013;BRUNA DAMASCENO;82;106;;1;CENTRO DE CIDADANIA GOV. VIRGÍLIO TÁVORA - CCDH;AV. MONSENHOR HELIO CAMPOS, 178;CRISTO REDENTOR;
2024;1;FORTALEZA;20013;BRUNA DAMASCENO;82;107;;1;CENTRO DE CIDADANIA GOV. VIRGÍLIO TÁVORA - CCDH;AV. MONSENHOR HELIO CAMPOS, 178;CRISTO REDENTOR;
2024;1;FORTALEZA;20013;BRUNA DAMASCENO;82;117;;1;CENTRO DE CIDADANIA GOV. VIRGÍLIO TÁVORA - CCDH;AV. MONSENHOR HELIO CAMPOS, 178;CRISTO REDENTOR;
2024;1;FORTALEZA;20013;BRUNA DAMASCENO;82;181;;1;EEFM CLÁUDIO MARTINS;RUA DEMÓCRITO ROCHA, 400;MONTE CASTELO;
2024;1;FORTALEZA;20013;BRUNA DAMASCENO;82;194;;1;CENTRO EDUCACIONAL SÃO MATEUS;AV. SARGENTO HERMÍNIO SAMPAIO, 2440;MONTE CASTELO;
2024;1;FORTALEZA;20013;BRUNA DAMASCENO;82;350;;1;ESCOLA MUNICIPAL GUSTAVO BARROSO - EI/EF;RUA ERETIDES MARTINS, 26;SÃO GERARDO;
2024;1;FORTALEZA;20013;BRUNA DAMASCENO;82;528;;1;EMEIEF VIRGÍLIO TÁVORA;AV. MONSENHOR HÉLIO CAMPOS, 144;CRISTO REDENTOR;
2024;1;FORTALEZA;20013;BRUNA DAMASCENO;82;545;;1;EMEIEF VIRGÍLIO TÁVORA;AV. MONSENHOR HÉLIO CAMPOS, 144;CRISTO REDENTOR;
2024;1;FORTALEZA;20013;BRUNA DAMASCENO;82;645;;1;EEFM LIONS JANGADA - EEMTI;RUA CAMÉLIA, 352;CRISTO REDENTOR;
2024;1;FORTALEZA;20013;BRUNA DAMASCENO;82;649;;1;CEJA  MONSENHOR HÉLIO CAMPOS;AV. MONSENHOR HÉLIO CAMPOS, 251;CRISTO REDENTOR;
2024;1;FORTALEZA;20013;BRUNA DAMASCENO;82;668;;1;ESCOLA MUNICIPAL ANTONIO MENDES - EI/EF;RUA DONA MENDINA, 682;CRISTO REDENTOR;
2024;1;FORTALEZA;20013;BRUNA DAMASCENO;82;679;;1;EEFM JOSÉ VALDO RIBEIRO RAMOS - EEMTI;RUA PEDRO AMÉRICO, 100;CARLITO PAMPLONA;
2024;1;FORTALEZA;20013;BRUNA DAMASCENO;82;682;;1;EEFM JOSÉ VALDO RIBEIRO RAMOS - EEMTI;RUA PEDRO AMÉRICO, 100;CARLITO PAMPLONA;
2024;1;FORTALEZA;20013;BRUNA DAMASCENO;82;695;;1;ESCOLA MUNICIPAL LENIRA JUREMA DE MAGALHÃES - EI/EF;RUA TEÓFILO GURGEL, 111;MONTE CASTELO;
2024;1;FORTALEZA;20013;BRUNA DAMASCENO;83;324;;1;ESCOLA MUNICIPAL JOSÉ BONIFÁCIO DE SOUSA;RUA PERNAMBUCO 600;DEMOCRITO ROCHA;
2024;1;FORTALEZA;20013;BRUNA DAMASCENO;83;438;;1;ESCOLA MUNICIPAL DE TEMPO INTEGRAL PROFESSOR JOSE JULIO DA PONTE;RUA MARIO DE ANDRADE, S/N;BELA VISTA;
2024;1;FORTALEZA;20013;BRUNA DAMASCENO;83;441;;1;ESCOLA PEQUENO PRINCIPE;RUA SILVEIRA FILHO, 825;JÓQUEI CLUBE;
2024;1;FORTALEZA;20013;BRUNA DAMASCENO;83;547;;1;CENTRO DE FORMAÇÃO E DESENV. PARA PROFISSIONAIS DA EDUCAÇÃO - FORMACE;RUA PORTO VELHO, 401;JOÃO XXIII;
2024;1;FORTALEZA;20013;BRUNA DAMASCENO;83;633;;1;COLEGIO CHRISTUS;AV. ENG. HUMBERTO MONTE, 1355;BELA VISTA;
2024;1;FORTALEZA;20013;BRUNA DAMASCENO;83;705;;1;ESCOLA PEQUENO PRINCIPE;RUA SILVEIRA FILHO, 825;JÓQUEI CLUBE;
2024;1;FORTALEZA;20013;BRUNA DAMASCENO;83;762;;1;EEFM JOAQUIM ALVES;RUA ESTADO DO RIO 955;DEMOCRITO ROCHA;
2024;1;FORTALEZA;20013;BRUNA DAMASCENO;83;765;;1;ESCOLA MUNICIPAL MURILO SERPA;RUA MONSENHOR HIPOLITO BRASIL 1400;DOM LUSTOSA;
2024;1;FORTALEZA;20013;BRUNA DAMASCENO;83;775;;1;EEMTI PROFESSOR PAULO FREIRE;AVENIDA SENADOR FERNANDES TÁVORA 1936;HENRIQUE JORGE;
2024;1;FORTALEZA;20013;BRUNA DAMASCENO;85;234;;1;EEFM DOUTOR GENTIL BARREIRA;RUA 202-D, S/N - CONJUNTO CEARÁ I;CONJUNTO CEARÁ I;
2024;1;FORTALEZA;20013;BRUNA DAMASCENO;93;150;;1;EEEP PROFESSOR OTAVIO TERCEIRO DE FARIAS;AVENIDA C, 435;PREFEITO JOSÉ WALTER;
2024;1;FORTALEZA;20013;BRUNA DAMASCENO;93;158;;1;CUCA JOSÉ WALTER;RUA 69, S/N;PREFEITO JOSÉ WALTER;
2024;1;FORTALEZA;20013;BRUNA DAMASCENO;94;476;;1;EEM LICEU VILA VELHA;AV. L, 840;VILA VELHA;
2024;1;FORTALEZA;20013;BRUNA DAMASCENO;94;625;;1;COLÉGIO DOM FELIPE;AV INDEPENDÊNCIA. 1652;QUINTINO CUNHA;
2024;1;FORTALEZA;20013;BRUNA DAMASCENO;94;737;;1;EMEIF HERONDINA LIMA CAVALCANTE;AV. AMBIENTALISTA ARY THIERS, 310;VILA VELHA;
2024;1;FORTALEZA;20013;BRUNA DAMASCENO;94;859;;1;EMEIF LORHAN MARQUES MEDEIROS;RUA CREUZA ROCHA, 255;JARDIM GUANABARA;
2024;1;FORTALEZA;20013;BRUNA DAMASCENO;94;877;881;1;CEI PROFESSOR CLODOALDO PINTO;RUA BANVARTH BEZERRA 100;PADRE ANDRADE;
2024;1;FORTALEZA;20013;BRUNA DAMASCENO;94;887;;1;EEMTI MONSENHOR DOURADO;AVENIDA SARGENTO HERMÍNIO SAMPAIO 4600;PADRE ANDRADE;
2024;1;FORTALEZA;20013;BRUNA DAMASCENO;94;890;;1;EEMTI MONSENHOR DOURADO;AVENIDA SARGENTO HERMÍNIO SAMPAIO 4600;PADRE ANDRADE;
2024;1;FORTALEZA;20013;BRUNA DAMASCENO;94;916;;1;COLEGIO SALOME BASTOS;RUA DESEMBARGADOR HERMES PARAHYBA 1120;VILA VELHA;
2024;1;FORTALEZA;20013;BRUNA DAMASCENO;94;939;;1;COLÉGIO UNIVERSO;RUA JOAQUIM ALBANO, N 100;PADRE ANDRADE;
2024;1;FORTALEZA;20013;BRUNA DAMASCENO;95;105;;1;EEFM DOUTORA ALDACI BARBOSA;RUA VALPARAISO, 155;CONJUNTO PALMEIRAS;
2024;1;FORTALEZA;20013;BRUNA DAMASCENO;95;113;;1;EMEIF JOAO GERMANO DA PONTE NETO;RUA MAIZA, 549;CONJUNTO PALMEIRAS;
2024;1;FORTALEZA;20013;BRUNA DAMASCENO;95;114;;1;EMEIF JOAO GERMANO DA PONTE NETO;RUA MAIZA, 549;CONJUNTO PALMEIRAS;
2024;1;FORTALEZA;20013;BRUNA DAMASCENO;95;147;;1;CEI CESAR CALS DE OLIVEIRA NETO;RUA CAMPINENSE, 54;CONJUNTO PALMEIRAS;
2024;1;FORTALEZA;20013;BRUNA DAMASCENO;95;152;;1;EEFM ALMIRANTE TAMANDARÉ;RUA DO MANDACARU, 1048 CJ ALMIRANTE TAMANDARÉ;JANGURUSSU;
2024;1;FORTALEZA;20013;BRUNA DAMASCENO;95;164;;1;EM PROFESSORA MARIA DO SOCORRO FERREIRA VIRINO;RUA MODESTA, 44;CONJUNTO PALMEIRAS;
2024;1;FORTALEZA;20013;BRUNA DAMASCENO;112;20;;1;EM MARIA DE LOURDES RIBEIRO JEREISSATI;RUA REINO UNIDO, 115;JARDIM DAS OLIVEIRAS;
2024;1;FORTALEZA;20013;BRUNA DAMASCENO;112;32;;1;COLÉGIO ANTARES - SEDE WASHINGTON SOARES;RUA CAETANO XIMENES ARAGÃO,110 - ACESSO PELA RUA ARMANDO DALL'OLIO;ENGENHEIRO LUCIANO CAVALCANTE;
2024;1;FORTALEZA;20013;BRUNA DAMASCENO;112;76;;1;ESCOLA ESTADUAL DE EDUCAÇÃO PROFISSIONAL JAIME ALENCAR DE OLIVEIRA;AV ROGACIANO LEITE, 2285;ENGENHEIRO LUCIANO CAVALCANTE;
2024;1;FORTALEZA;20013;BRUNA DAMASCENO;112;97;;1;EM ISMAEL PORDEUS;RUA DES FAUSTINO ALBUQUERQUE, 511;JARDIM DAS OLIVEIRAS;
2024;1;FORTALEZA;20013;BRUNA DAMASCENO;112;274;;1;EEMTI MIRIAN PORTO MOTA;RUA DAS CASTANHOLAS, S/N;JARDIM DAS OLIVEIRAS;
2024;1;FORTALEZA;20013;BRUNA DAMASCENO;112;359;;3;CENTRO UNIVERSITARIO ESTACIO DO CEARA VIA CORPVS;RUA ELISEU UCHÔA BECO, 600;GUARARAPES;
2024;1;FORTALEZA;20013;BRUNA DAMASCENO;112;462;;1;UNIVERSIDADE DE FORTALEZA - UNIFOR;AVENIDA WASHINGTON SOARES, 1321;EDSON QUEIROZ;
2024;1;FORTALEZA;20013;BRUNA DAMASCENO;112;472;;1;EM IRMA SIMAS;RUA JOSE SOBREIRA, 608;SAPIRANGA-COITÉ;
2024;1;FORTALEZA;20013;BRUNA DAMASCENO;112;552;;2;COLÉGIO DÁULIA BRINGEL;RUA TRAJANO ALVES DE AGUIAR, 55;CIDADE DOS FUNCIONÁRIOS;
2024;1;FORTALEZA;20013;BRUNA DAMASCENO;113;57;;1;COLÉGIO FARIAS BRITO;RUA SENADOR POMPEU, 2607;JOSÉ BONIFÁCIO;
2024;1;FORTALEZA;20013;BRUNA DAMASCENO;113;247;;1;EEFM SANTO AFONSO;RUA GAL. BERNARDO FIGUEIREDO, 2670;PARQUELÂNDIA;
2024;1;FORTALEZA;20013;BRUNA DAMASCENO;113;249;;1;EEFM SANTO AFONSO;RUA GAL. BERNARDO FIGUEIREDO, 2670;PARQUELÂNDIA;
2024;1;FORTALEZA;20013;BRUNA DAMASCENO;113;258;;1;EEF MONSENHOR LINHARES;RUA PROF. LINO ENCARNAÇÃO, 1130;AMADEU FURTADO;
2024;1;FORTALEZA;20013;BRUNA DAMASCENO;113;270;;1;FACULDADE DE ENFERMAGEM DA UFC;RUA ALEXANDRE BARAÚNA, 1115;RODOLFO TEÓFILO;
2024;1;FORTALEZA;20013;BRUNA DAMASCENO;113;279;;1;COLÉGIO JUVENAL DE CARVALHO;AV. JOÃO PESSOA, 4279;DAMAS;
2024;1;FORTALEZA;20013;BRUNA DAMASCENO;113;284;;1;COLÉGIO FARIAS BRITO;RUA SENADOR POMPEU, 2607;JOSÉ BONIFÁCIO;
2024;1;FORTALEZA;20013;BRUNA DAMASCENO;113;316;;1;EEFM SANTO AFONSO;RUA GAL. BERNARDO FIGUEIREDO, 2670;PARQUELÂNDIA;
2024;1;FORTALEZA;20013;BRUNA DAMASCENO;113;337;;1;COLEGIO GRÃO SABER ( ANTIGO TOPO GIGIO);RUA PROFESSOR LINO DA ENCARNACAO, 490;PARQUELÂNDIA;
2024;1;FORTALEZA;20013;BRUNA DAMASCENO;113;347;;1;SECRETARIA EXECUTIVA REGIONAL III - FORTALEZA;AV JOVITA FEITOSA 3090;PARQUELÂNDIA;
2024;1;FORTALEZA;20013;BRUNA DAMASCENO;113;382;;1;CRECHE ESPACO E VIDA;RUA PEDRO DE QUEIROZ, 532;PARQUELÂNDIA;
2024;1;FORTALEZA;20013;BRUNA DAMASCENO;113;390;;2;IMPARH;AV JOAO PESSOA, 5.609;MONTESE;
2024;1;FORTALEZA;20013;BRUNA DAMASCENO;113;403;;1;COLEGIO CWD-MAXIMUS;RUA DOM LINO, 301;PARQUELÂNDIA;
2024;1;FORTALEZA;20013;BRUNA DAMASCENO;113;406;;1;COLEGIO CWD-MAXIMUS;RUA DOM LINO, 301;PARQUELÂNDIA;
2024;1;FORTALEZA;20013;BRUNA DAMASCENO;113;445;;2;IFCE - INST FEDERAL DE CIÊNCIA E TECNOLOGIA (CEFET);AV. 13 DE MAIO, 2081;BENFICA;
2024;1;FORTALEZA;20013;BRUNA DAMASCENO;114;12;;1;EM JESUS CRISTO - CEI ANEXO;RUA ALBERTO FERREIRA 564;JARDIM IRACEMA;
2024;1;FORTALEZA;20013;BRUNA DAMASCENO;114;121;;1;EMTI NOSSA SENHORA DE FÁTIMA (ANTIGA APOSTÓLICA/SEMINÁRIO);RUA SÍLVIO ROMERO 370;ÁLVARO WEYNE;
2024;1;FORTALEZA;20013;BRUNA DAMASCENO;114;180;;1;EEFM SÃO JOSÉ DOS ARPOADORES;RUA FRANCISCO CALAÇA 90;CRISTO REDENTOR;
2024;1;FORTALEZA;20013;BRUNA DAMASCENO;114;225;;1;INSTITUTO EDUCACIONAL PRESIDENTE MEDICI;RUA CÉSAR CORREIA 973;FLORESTA;
2024;1;FORTALEZA;20013;BRUNA DAMASCENO;114;236;;1;CAPELA NOSSA SENHORA DE FÁTIMA;RUA RIO ARAGUAIA 1669;JARDIM IRACEMA;
2024;1;FORTALEZA;20013;BRUNA DAMASCENO;114;257;;1;EEFM ESTADO DE ALAGOAS;AVENIDA PRESIDENTE CASTELO BRANCO, 5244;BARRA DO CEARÁ;
2024;1;FORTALEZA;20013;BRUNA DAMASCENO;114;285;;1;EEMTI PROFESSORA BALBINA JUCA ALBUQUERQUE;AVENIDA MAJOR ASSIS 346;JARDIM IRACEMA;
2024;1;FORTALEZA;20013;BRUNA DAMASCENO;114;291;;1;EEEP PAULO PETROLA;RUA SAUDÁRIA, S/N - GOIABEIRAS;BARRA DO CEARÁ;
2024;1;FORTALEZA;20013;BRUNA DAMASCENO;114;299;;1;EM DOM HELDER CAMARA;RUA FREI ODILON 623 B;ÁLVARO WEYNE;
2024;1;FORTALEZA;20013;BRUNA DAMASCENO;114;317;;1;EM JESUS CRISTO;RUA ALBERTO FERREIRA, 564;JARDIM IRACEMA;
2024;1;FORTALEZA;20013;BRUNA DAMASCENO;114;326;;1;EM DOM HELDER CAMARA;RUA FREI ODILON 623 B;ÁLVARO WEYNE;
2024;1;FORTALEZA;20013;BRUNA DAMASCENO;114;346;;1;EMTI ALDEMIR MARTINS;AV. FRANCISCO SÁ, 7460;BARRA DO CEARÁ;
2024;1;FORTALEZA;20013;BRUNA DAMASCENO;114;347;;1;EM DOIS DE DEZEMBRO;RUA ARAKEN, 860;BARRA DO CEARÁ;
2024;1;FORTALEZA;20013;BRUNA DAMASCENO;115;23;;1;EEM  PROFESSORA DIVA CABRAL;RUA HOLANDA, 701;MARAPONGA;
2024;1;FORTALEZA;20013;BRUNA DAMASCENO;115;42;;1;UNIVERSIDADE ESTADUAL DO CEARA - UECE;AV DR. SILAS MUNGUBA, 1700;ITAPERI;
2024;1;FORTALEZA;20013;BRUNA DAMASCENO;115;98;;1;EMTI CAROLINO SUCUPIRA;RUA MUNDICA PAULA, 670;PARANGABA;
2024;1;FORTALEZA;20013;BRUNA DAMASCENO;115;130;;1;COLEGIO PROVECTO;RUA SUIÇA, 76;MARAPONGA;
2024;1;FORTALEZA;20013;BRUNA DAMASCENO;115;225;;1;EM WALDEMAR BARROSO;RUA CÔNEGO LIMA SUCUPIRA,  1651;SERRINHA;
2024;1;FORTALEZA;20013;BRUNA DAMASCENO;115;252;;1;FACULDADE UNINASSAU - PARANGABA;RUA GERMANO FRANCK, 567;PARANGABA;
2024;1;FORTALEZA;20013;BRUNA DAMASCENO;115;253;;1;FACULDADE UNINASSAU - PARANGABA;RUA GERMANO FRANCK, 567;PARANGABA;
2024;1;FORTALEZA;20013;BRUNA DAMASCENO;115;265;;1;ESCOLA MARISTA SAGRADO CORAÇÃO;RUA VIDAL DE NEGREIROS, 550;JARDIM CEARENSE;
2024;1;FORTALEZA;20013;BRUNA DAMASCENO;115;289;;1;UNIVERSIDADE ESTADUAL DO CEARA - UECE;AV DR. SILAS MUNGUBA, 1700;ITAPERI;
2024;1;FORTALEZA;20013;BRUNA DAMASCENO;115;343;350, 361, 355;1;EEEP JOAQUIM MOREIRA DE SOUSA;RUA CAIO PRADO 02;PARANGABA;
2024;1;FORTALEZA;20013;BRUNA DAMASCENO;115;405;;1;EEFM PROFESSOR MARIO SCHENBERG;RUA AMERICO ROCHA LIMA 835;MANOEL SÁTIRO;
2024;1;FORTALEZA;20013;BRUNA DAMASCENO;115;416;;1;COLEGIO GURI  SENIOR;RUA CONEGO DE CASTRO 1780;PARANGABA;
2024;1;FORTALEZA;20013;BRUNA DAMASCENO;115;418;;1;CEJA - PROFº MOREIRA CAMPOS;RUA JULIO BRAGA, 101 B;PARANGABA;
2024;1;FORTALEZA;20013;BRUNA DAMASCENO;115;445;;1;EM MARIA VIVIANE BENEVIDES GOUVEIA;RUA CREUZA ROQUE 247;MANOEL SÁTIRO;
2024;1;FORTALEZA;20013;BRUNA DAMASCENO;115;451;;1;EM HENRIQUETA GALENO;RUA MAJOR MONTENEGRO 917;MANOEL SÁTIRO;
2024;1;FORTALEZA;20013;BRUNA DAMASCENO;115;455;;1;EM HENRIQUETA GALENO;RUA MAJOR MONTENEGRO 917;MANOEL SÁTIRO;
2024;1;FORTALEZA;20013;BRUNA DAMASCENO;115;488;;1;COLEGIO GURI  SENIOR;RUA CONEGO DE CASTRO 1780;PARANGABA;
2024;1;FORTALEZA;20013;BRUNA DAMASCENO;118;419;;1;EM DOUTOR ABDENAGO DA ROCHA LIMA;RUA 114, 75 (CJ TUPAN MIRIM);PARQUE DOIS IRMÃOS;
2024;1;FORTALEZA;20013;BRUNA DAMASCENO;118;589;;1;EEMTI PADRE GUILHERME WAESSEN;RUA BOA VENTURA 916;DIAS MACEDO;
2024;1;FORTALEZA;20013;BRUNA DAMASCENO;118;593;;1;EEMTI PADRE GUILHERME WAESSEN;RUA BOA VENTURA 916;DIAS MACEDO;
2024;1;FORTALEZA;20013;BRUNA DAMASCENO;118;648;;1;EEMTI PADRE GUILHERME WAESSEN;RUA BOA VENTURA 916;DIAS MACEDO;
TOTAL;;;;;;;;128;
