Ano;Turno;Município;Número;Candidato;Zona;Seção;Seções Agregadas;Votos;Local de Votação;Endereço Local de Votação;Bairro;
2024;1;FORTALEZA;40111;EDILSON TOMAZ;1;340;;1;ESCOLA ESTADUAL MAESTRO ELIAZAR DE CARVALHO;RUA FRANCISCO ALVES PEREIRA  349;CAIS DO PORTO;
2024;1;FORTALEZA;40111;EDILSON TOMAZ;1;401;;1;ESCOLA MUNICIPAL PROF. GODOFREDO DE CASTRO FILHO;AVENIDA JOSÉ SABÓIA  905;CAIS DO PORTO;
2024;1;FORTALEZA;40111;EDILSON TOMAZ;1;731;;1;ESCOLA MUNICIPAL PROF. GODOFREDO DE CASTRO FILHO;AVENIDA JOSÉ SABÓIA  905;CAIS DO PORTO;
2024;1;FORTALEZA;40111;EDILSON TOMAZ;1;749;;1;ESCOLA MUNICIPAL PROF. GODOFREDO DE CASTRO FILHO;AVENIDA JOSÉ SABÓIA  905;CAIS DO PORTO;
2024;1;FORTALEZA;40111;EDILSON TOMAZ;1;795;;1;ESCOLA MUNICIPAL PROF BELARMINA CAMPOS;RUA MANOEL RODRIGUES MONTEIRO, 840;VICENTE PINZON;
2024;1;FORTALEZA;40111;EDILSON TOMAZ;1;846;;1;CRECHE RACHEL GUIMARÃES MARTINS BARBOSA;VIA DE PEDRESTE LESTE OESTE 01;CAIS DO PORTO;
2024;1;FORTALEZA;40111;EDILSON TOMAZ;1;886;;2;CRECHE RACHEL GUIMARÃES MARTINS BARBOSA;VIA DE PEDRESTE LESTE OESTE 01;CAIS DO PORTO;
2024;1;FORTALEZA;40111;EDILSON TOMAZ;2;83;;1;EEEP COMENDADOR MIGUEL GURGEL;RUA JOSE BAIMA, S/N;GUAJERU;
2024;1;FORTALEZA;40111;EDILSON TOMAZ;2;129;;1;EEM DEPUTADO PAULO BENEVIDES;RUA ANGELICA GURGEL, 186;MESSEJANA;
2024;1;FORTALEZA;40111;EDILSON TOMAZ;2;173;;1;PAROQUIA NOSSA SENHORA DA CONCEICAO;RUA JOAQUIM BEZERRA 255;MESSEJANA;
2024;1;FORTALEZA;40111;EDILSON TOMAZ;2;460;;1;EM PROFª FERNANDA MARIA DE ALENCAR COLARES;AV PROF. ARTHUR DE CARVALHO, 1540;LAGOA REDONDA;
2024;1;FORTALEZA;40111;EDILSON TOMAZ;2;673;;1;EEM DEPUTADO PAULO BENEVIDES;RUA ANGELICA GURGEL, 186;MESSEJANA;
2024;1;FORTALEZA;40111;EDILSON TOMAZ;2;696;;1;SECRETARIA DA EDUCACAO - CAMBEBA;AVENIDA MINISTRO JOSE AMERICO, SN;CAMBEBA;
2024;1;FORTALEZA;40111;EDILSON TOMAZ;2;773;;1;CMES ANISIO TEIXEIRA;TRAVESSA DO GUARANI, 355;PAUPINA;
2024;1;FORTALEZA;40111;EDILSON TOMAZ;2;826;;1;FACULDADE ATENEU DO CEARÁ;AV. COLETOR ANTONIO GADELHA, 621;MESSEJANA;
2024;1;FORTALEZA;40111;EDILSON TOMAZ;3;253;258;1;COLÉGIO ARI DE SÁ - PRÉ-VESTIBULAR - SEDE DUQUE DE CAXIAS;AV. DUQUE DE CAXIAS, 519;CENTRO;
2024;1;FORTALEZA;40111;EDILSON TOMAZ;3;416;;1;UNICHRISTUS ALDEOTA;RUA VISCONDE DE MAUÁ, 1940;ALDEOTA;
2024;1;FORTALEZA;40111;EDILSON TOMAZ;82;57;;1;ESCOLA MUNICIPAL NOSSA SENHORA DO PERPÉTUO SOCORRO - EF;RUA CÔNSUL GOUVEIA, 57;ÁLVARO WEYNE;
2024;1;FORTALEZA;40111;EDILSON TOMAZ;82;190;;1;EEFM CLÁUDIO MARTINS;RUA DEMÓCRITO ROCHA, 400;MONTE CASTELO;
2024;1;FORTALEZA;40111;EDILSON TOMAZ;82;236;;1;CENTRO EDUCACIONAL DOM HÉLIO CAMPOS;RUA SÃO RAIMUNDO, 199;PIRAMBU;
2024;1;FORTALEZA;40111;EDILSON TOMAZ;82;477;;1;EEFM CLÁUDIO MARTINS;RUA DEMÓCRITO ROCHA, 400;MONTE CASTELO;
2024;1;FORTALEZA;40111;EDILSON TOMAZ;82;622;;1;CEJA  MONSENHOR HÉLIO CAMPOS;AV. MONSENHOR HÉLIO CAMPOS, 251;CRISTO REDENTOR;
2024;1;FORTALEZA;40111;EDILSON TOMAZ;82;671;;1;ESCOLA MUNICIPAL ANTONIO MENDES - EI/EF;RUA DONA MENDINA, 682;CRISTO REDENTOR;
2024;1;FORTALEZA;40111;EDILSON TOMAZ;83;18;;1;ESCOLA MUNICIPAL DOM JOSÉ TUPINAMBA DA FROTA;RUA VIRIATO RIBEIRO 1031;BELA VISTA;
2024;1;FORTALEZA;40111;EDILSON TOMAZ;83;438;;1;ESCOLA MUNICIPAL DE TEMPO INTEGRAL PROFESSOR JOSE JULIO DA PONTE;RUA MARIO DE ANDRADE, S/N;BELA VISTA;
2024;1;FORTALEZA;40111;EDILSON TOMAZ;83;534;;1;COLEGIO CHRISTUS;AV. ENG. HUMBERTO MONTE, 1355;BELA VISTA;
2024;1;FORTALEZA;40111;EDILSON TOMAZ;83;724;;1;EDUCANDARIO FELIPE DOS SANTOS;RUA TERESINA 313;HENRIQUE JORGE;
2024;1;FORTALEZA;40111;EDILSON TOMAZ;83;787;;1;ESCOLA MUNICIPAL ADROALDO TEIXEIRA CASTELO;RUA ALAGOAS 2267;PICI;
2024;1;FORTALEZA;40111;EDILSON TOMAZ;85;139;;1;COLÉGIO LUÍZA TÁVORA;RUA 1050, N 171, 4 ETAPA;CONJUNTO CEARÁ I;
2024;1;FORTALEZA;40111;EDILSON TOMAZ;85;287;;1;EMEIF GERARDO MILTON DE SA;RUA VALE COSTA S/N;ANTÔNIO BEZERRA;
2024;1;FORTALEZA;40111;EDILSON TOMAZ;85;313;;1;ESCOLA MUNICIPAL DEP MURILO AGUIAR;RUA 24 DE OUTUBRO 655;GENIBAÚ;
2024;1;FORTALEZA;40111;EDILSON TOMAZ;85;318;;1;ESCOLA MUNICIPAL DEP MURILO AGUIAR;RUA 24 DE OUTUBRO 655;GENIBAÚ;
2024;1;FORTALEZA;40111;EDILSON TOMAZ;93;220;;1;EEFM POLIVALENTE MODELO DE FORTALEZA;AV A (ARAQUÉM AGUIAR), 482 - I ETAPA;PREFEITO JOSÉ WALTER;
2024;1;FORTALEZA;40111;EDILSON TOMAZ;93;224;;1;EEFM POLIVALENTE MODELO DE FORTALEZA;AV A (ARAQUÉM AGUIAR), 482 - I ETAPA;PREFEITO JOSÉ WALTER;
2024;1;FORTALEZA;40111;EDILSON TOMAZ;93;225;;1;EEFM POLIVALENTE MODELO DE FORTALEZA;AV A (ARAQUÉM AGUIAR), 482 - I ETAPA;PREFEITO JOSÉ WALTER;
2024;1;FORTALEZA;40111;EDILSON TOMAZ;93;227;;1;EEFM POLIVALENTE MODELO DE FORTALEZA;AV A (ARAQUÉM AGUIAR), 482 - I ETAPA;PREFEITO JOSÉ WALTER;
2024;1;FORTALEZA;40111;EDILSON TOMAZ;93;291;;1;EM FRANCISCO NUNES CAVALCANTE;RUA POETA MÁRIO LINHARES, 561;PREFEITO JOSÉ WALTER;
2024;1;FORTALEZA;40111;EDILSON TOMAZ;94;10;;1;EEMTI MARIA JOSÉ SANTOS FERREIRA GOMES;RUA DONA LUCIA PINHEIRO, 93;QUINTINO CUNHA;
2024;1;FORTALEZA;40111;EDILSON TOMAZ;94;26;;1;EEF JESUS, MARIA E JOSE;RUA DA MANGUEIRA 134;QUINTINO CUNHA;
2024;1;FORTALEZA;40111;EDILSON TOMAZ;94;27;;1;EEMTI MARIA JOSÉ SANTOS FERREIRA GOMES;RUA DONA LUCIA PINHEIRO, 93;QUINTINO CUNHA;
2024;1;FORTALEZA;40111;EDILSON TOMAZ;94;69;;1;COLÉGIO EVOLUIR;RUA CÂNDIDO MAIA,109;ANTÔNIO BEZERRA;
2024;1;FORTALEZA;40111;EDILSON TOMAZ;94;368;369;1;EEFM DEP FCO DE ALMEIDA MONTE;AV. CORONEL CARVALHO 2400;JARDIM IRACEMA;
2024;1;FORTALEZA;40111;EDILSON TOMAZ;94;383;;1;EMEF QUINTINO CUNHA;RUA MARIA CLARA 1263;VILA VELHA;
2024;1;FORTALEZA;40111;EDILSON TOMAZ;94;412;;1;COLÉGIO INDEPENDÊNCIA;AV. DA INDEPENDÊNCIA, 1362;QUINTINO CUNHA;
2024;1;FORTALEZA;40111;EDILSON TOMAZ;94;527;;1;EEFM DOM HELDER CAMARA;RUA ROSINHA SAMPAIO 1157;VILA VELHA;
2024;1;FORTALEZA;40111;EDILSON TOMAZ;94;574;;1;EEMTI MARIA JOSÉ SANTOS FERREIRA GOMES;RUA DONA LUCIA PINHEIRO, 93;QUINTINO CUNHA;
2024;1;FORTALEZA;40111;EDILSON TOMAZ;94;842;;1;COLÉGIO INDEPENDÊNCIA;AV. DA INDEPENDÊNCIA, 1362;QUINTINO CUNHA;
2024;1;FORTALEZA;40111;EDILSON TOMAZ;94;843;;1;COLEGIO DOM FELIPE - JUNIOR;RUA FRANCISCO MENDES DE OLIVEIRA, 183;QUINTINO CUNHA;
2024;1;FORTALEZA;40111;EDILSON TOMAZ;94;910;;1;EM CASTELO DE CASTRO;RUA 43 1531;VILA VELHA;
2024;1;FORTALEZA;40111;EDILSON TOMAZ;95;83;;1;EEFM PADRE MARCELINO CHAMPAGNAT;RUA DAURA, 120;BARROSO;
2024;1;FORTALEZA;40111;EDILSON TOMAZ;95;84;;1;EEFM PADRE MARCELINO CHAMPAGNAT;RUA DAURA, 120;BARROSO;
2024;1;FORTALEZA;40111;EDILSON TOMAZ;95;88;;1;EEFM PADRE MARCELINO CHAMPAGNAT;RUA DAURA, 120;BARROSO;
2024;1;FORTALEZA;40111;EDILSON TOMAZ;95;90;;1;EEFM PADRE MARCELINO CHAMPAGNAT;RUA DAURA, 120;BARROSO;
2024;1;FORTALEZA;40111;EDILSON TOMAZ;95;179;;1;DNIT;RODOVIA BR-116, KM 06;CAJAZEIRAS;
2024;1;FORTALEZA;40111;EDILSON TOMAZ;95;180;;1;DNIT;RODOVIA BR-116, KM 06;CAJAZEIRAS;
2024;1;FORTALEZA;40111;EDILSON TOMAZ;95;226;;1;EM FRANCISCA ORIA SERPA;RUA JORGE FIGUEIREDO, 3652;PEDRAS;
2024;1;FORTALEZA;40111;EDILSON TOMAZ;95;242;;1;EMEIEF TAÍS MARIA BEZERRA NOGUEIRA;AV. GOVERNADOR LEONEL BRIZOLA, 710;JANGURUSSU;
2024;1;FORTALEZA;40111;EDILSON TOMAZ;95;317;;1;EEFM PROF. PAULO AYRTON ARAUJO;BR 116 KM 05, AO LADO DA EMPRESA GUANABARA;CAJAZEIRAS;
2024;1;FORTALEZA;40111;EDILSON TOMAZ;112;284;;1;COLÉGIO ÁGAPE;AV HERMINIO DE CASTRO, 140;PARQUE MANIBURA;
2024;1;FORTALEZA;40111;EDILSON TOMAZ;112;352;;1;COLÉGIO ÁGAPE;AV HERMINIO DE CASTRO, 140;PARQUE MANIBURA;
2024;1;FORTALEZA;40111;EDILSON TOMAZ;112;547;;1;COLEGIO MASTER SUL;RUA BENJAMIM MOURA, 631;CIDADE DOS FUNCIONÁRIOS;
2024;1;FORTALEZA;40111;EDILSON TOMAZ;113;177;;1;COLÉGIO SÃO MATEUS;RUA JUSTINIANO DE SERPA, 748;FARIAS BRITO;
2024;1;FORTALEZA;40111;EDILSON TOMAZ;113;264;;1;ESC. MUNICIPAL ANTONIO SALES RODOLFO TEÓFILO;RUA TAVARES IRACEMA, 675;RODOLFO TEÓFILO;
2024;1;FORTALEZA;40111;EDILSON TOMAZ;113;265;;1;ESC. MUNICIPAL ANTONIO SALES RODOLFO TEÓFILO;RUA TAVARES IRACEMA, 675;RODOLFO TEÓFILO;
2024;1;FORTALEZA;40111;EDILSON TOMAZ;113;420;;1;EEFM MARECHAL HUMBERTO DE ALENCAR C. BRANCO;RUA ALVARO FERNANDES, 913;MONTESE;
2024;1;FORTALEZA;40111;EDILSON TOMAZ;114;7;;1;COLÉGIO MANUEL DA SILVA (ÁLVARO WEYNE);RUA SÃO BERNARDO 181;ÁLVARO WEYNE;
2024;1;FORTALEZA;40111;EDILSON TOMAZ;114;286;;1;EEFM ESTADO DE ALAGOAS;AVENIDA PRESIDENTE CASTELO BRANCO, 5244;BARRA DO CEARÁ;
2024;1;FORTALEZA;40111;EDILSON TOMAZ;114;358;;2;CAPELA NOSSA SENHORA DE FÁTIMA;RUA RIO ARAGUAIA 1669;JARDIM IRACEMA;
2024;1;FORTALEZA;40111;EDILSON TOMAZ;115;25;;1;EEM  PROFESSORA DIVA CABRAL;RUA HOLANDA, 701;MARAPONGA;
2024;1;FORTALEZA;40111;EDILSON TOMAZ;115;44;;1;UNIVERSIDADE ESTADUAL DO CEARA - UECE;AV DR. SILAS MUNGUBA, 1700;ITAPERI;
2024;1;FORTALEZA;40111;EDILSON TOMAZ;115;49;;1;UNIVERSIDADE ESTADUAL DO CEARA - UECE;AV DR. SILAS MUNGUBA, 1700;ITAPERI;
2024;1;FORTALEZA;40111;EDILSON TOMAZ;115;59;;1;UNIVERSIDADE ESTADUAL DO CEARA - UECE;AV DR. SILAS MUNGUBA, 1700;ITAPERI;
2024;1;FORTALEZA;40111;EDILSON TOMAZ;115;118;;1;DETRAN;AV GODOFREDO MACIEL, 2900;MARAPONGA;
2024;1;FORTALEZA;40111;EDILSON TOMAZ;115;125;;1;COLÉGIO UNIVERSO DO SABER;RUA 10 - NR 70 (CJ CAMPO DOS INGLESES - MARAPONGA);JARDIM CEARENSE;
2024;1;FORTALEZA;40111;EDILSON TOMAZ;115;418;;1;CEJA - PROFº MOREIRA CAMPOS;RUA JULIO BRAGA, 101 B;PARANGABA;
2024;1;FORTALEZA;40111;EDILSON TOMAZ;115;421;;1;CEJA - PROFº MOREIRA CAMPOS;RUA JULIO BRAGA, 101 B;PARANGABA;
2024;1;FORTALEZA;40111;EDILSON TOMAZ;116;40;;1;EM PROF ANTONIA MARIA DE LIMA;RUA SARGENTO JOAO PINHEIRO 2601;GRANJA LISBOA;
2024;1;FORTALEZA;40111;EDILSON TOMAZ;116;51;;1;EM SANTOS DUMONT;RUA GERALDO BARBOSA 240;BOM JARDIM;
2024;1;FORTALEZA;40111;EDILSON TOMAZ;116;204;;1;EM RACHEL VIANA MARTINS;RUA TUCUNDUBA 2703;GRANJA LISBOA;
2024;1;FORTALEZA;40111;EDILSON TOMAZ;116;289;;1;EM RACHEL VIANA MARTINS;RUA TUCUNDUBA 2703;GRANJA LISBOA;
2024;1;FORTALEZA;40111;EDILSON TOMAZ;116;369;;1;EM MANOEL MALVEIRA MAIA;RUA MANUEL GALDINO 2890;BOM JARDIM;
2024;1;FORTALEZA;40111;EDILSON TOMAZ;116;416;;1;EM MARIA DO SOCORRO ALVES CARNEIRO;RUA LUIS VIEIRA 1020;BONSUCESSO;
2024;1;FORTALEZA;40111;EDILSON TOMAZ;116;476;;1;EM MANOEL MALVEIRA MAIA;RUA MANUEL GALDINO 2890;BOM JARDIM;
2024;1;FORTALEZA;40111;EDILSON TOMAZ;117;235;;1;EM FLORIVAL ALVES SERAINE;RUA ITATIAIA, 1000;CANINDEZINHO;
2024;1;FORTALEZA;40111;EDILSON TOMAZ;117;376;;1;EMEIF MARIA BEZERRA QUEVEDO;RUA 103, 28 - CJ. NOVO MONDUBIM;MANOEL SÁTIRO;
2024;1;FORTALEZA;40111;EDILSON TOMAZ;117;485;;1;CENTRO CULTURAL CANINDEZINHO;AV. OSÓRIO DE PAIVA, 6297;CANINDEZINHO;
2024;1;FORTALEZA;40111;EDILSON TOMAZ;118;46;;1;EMTI REITOR ROBERTO CLÁUDIO FROTA BEZERRA;AVENIDA 1, S/N;PARQUE DOIS IRMÃOS;
2024;1;FORTALEZA;40111;EDILSON TOMAZ;118;119;;1;COLÉGIO LIRA COUTINHO;RUA BELOS PORTOS, 447;PASSARÉ;
2024;1;FORTALEZA;40111;EDILSON TOMAZ;118;221;;1;EEMTI INTEGRADA 2 DE MAIO;AVENIDA DA SAUDADE, S/N;PASSARÉ;
2024;1;FORTALEZA;40111;EDILSON TOMAZ;118;384;;1;EM FRANCISCO ANDRADE TEOFILO GIRAO;RUA UNIDOS VENCEREMOS, 2040;PASSARÉ;
2024;1;FORTALEZA;40111;EDILSON TOMAZ;118;552;;1;EM PROFESSOR JACINTO BOTELHO;RUA DR. RODRIGO CODES SANDOVAL, 374;MONDUBIM;
2024;1;FORTALEZA;40111;EDILSON TOMAZ;118;554;;1;EM PROFESSOR JACINTO BOTELHO;RUA DR. RODRIGO CODES SANDOVAL, 374;MONDUBIM;
2024;1;FORTALEZA;40111;EDILSON TOMAZ;118;572;;1;EEFM PROFESSORA MARIA GONCALVES;RUA N S DO MONTE CARMELO S/N;BOA VISTA-CASTELÃO;
2024;1;FORTALEZA;40111;EDILSON TOMAZ;118;575;;1;EEFM PROFESSORA MARIA GONCALVES;RUA N S DO MONTE CARMELO S/N;BOA VISTA-CASTELÃO;
2024;1;FORTALEZA;40111;EDILSON TOMAZ;118;586;;4;UAPS LUIZA TAVORA;TRAVESSA SAO JOSE, 940;MONDUBIM;
2024;1;FORTALEZA;40111;EDILSON TOMAZ;118;587;;4;UAPS LUIZA TAVORA;TRAVESSA SAO JOSE, 940;MONDUBIM;
2024;1;FORTALEZA;40111;EDILSON TOMAZ;118;588;;1;UAPS LUIZA TAVORA;TRAVESSA SAO JOSE, 940;MONDUBIM;
2024;1;FORTALEZA;40111;EDILSON TOMAZ;118;602;;5;EM CASIMIRO MONTENEGRO;AV. BERNARDO MANUEL, 11360;MONDUBIM;
2024;1;FORTALEZA;40111;EDILSON TOMAZ;118;603;;4;EM CASIMIRO MONTENEGRO;AV. BERNARDO MANUEL, 11360;MONDUBIM;
2024;1;FORTALEZA;40111;EDILSON TOMAZ;118;604;;3;EM CASIMIRO MONTENEGRO;AV. BERNARDO MANUEL, 11360;MONDUBIM;
2024;1;FORTALEZA;40111;EDILSON TOMAZ;118;605;;6;EM CASIMIRO MONTENEGRO;AV. BERNARDO MANUEL, 11360;MONDUBIM;
2024;1;FORTALEZA;40111;EDILSON TOMAZ;118;606;;5;EM CASIMIRO MONTENEGRO;AV. BERNARDO MANUEL, 11360;MONDUBIM;
2024;1;FORTALEZA;40111;EDILSON TOMAZ;118;607;;4;EM CASIMIRO MONTENEGRO;AV. BERNARDO MANUEL, 11360;MONDUBIM;
2024;1;FORTALEZA;40111;EDILSON TOMAZ;118;608;;7;EM CASIMIRO MONTENEGRO;AV. BERNARDO MANUEL, 11360;MONDUBIM;
2024;1;FORTALEZA;40111;EDILSON TOMAZ;118;609;;4;EM CASIMIRO MONTENEGRO;AV. BERNARDO MANUEL, 11360;MONDUBIM;
2024;1;FORTALEZA;40111;EDILSON TOMAZ;118;610;;1;EM CASIMIRO MONTENEGRO;AV. BERNARDO MANUEL, 11360;MONDUBIM;
2024;1;FORTALEZA;40111;EDILSON TOMAZ;118;611;;2;EM CASIMIRO MONTENEGRO;AV. BERNARDO MANUEL, 11360;MONDUBIM;
2024;1;FORTALEZA;40111;EDILSON TOMAZ;118;612;;3;EM CASIMIRO MONTENEGRO;AV. BERNARDO MANUEL, 11360;MONDUBIM;
2024;1;FORTALEZA;40111;EDILSON TOMAZ;118;613;;3;EM CASIMIRO MONTENEGRO;AV. BERNARDO MANUEL, 11360;MONDUBIM;
2024;1;FORTALEZA;40111;EDILSON TOMAZ;118;628;;1;COLÉGIO CONECTIVO;RUA GENERAL ONOFRE, 445;MONDUBIM;
2024;1;FORTALEZA;40111;EDILSON TOMAZ;118;629;;2;COLEGIO CONEXÃO SABER;RUA DOUTOR PEDRO SAMPAIO, 550;PASSARÉ;
2024;1;FORTALEZA;40111;EDILSON TOMAZ;118;636;;1;EM DOUTOR ABDENAGO DA ROCHA LIMA;RUA 114, 75 (CJ TUPAN MIRIM);PARQUE DOIS IRMÃOS;
2024;1;FORTALEZA;40111;EDILSON TOMAZ;118;639;;1;COLÉGIO MAJESTIC;RUA CASTRO MEIRELES, 325;MONDUBIM;
TOTAL;;;;;;;;157;
