Ano;Turno;Município;Número;Candidato;Zona;Seção;Seções Agregadas;Votos;Local de Votação;Endereço Local de Votação;Bairro;
2024;1;FORTALEZA;22012;FABIANO BRAGA;1;397;;1;ESCOLA MUNICIPAL SAO VICENTE DE PAULO;AVENIDA ZEZE DIOGO 1247;CAIS DO PORTO;
2024;1;FORTALEZA;22012;FABIANO BRAGA;1;472;;1;ESCOLA MIGUEL FIALHO - ANTIGO PADRE JOSÉ NILSON ;RUA CORONEL MANUEL JESUÍNO 225;MUCURIPE;
2024;1;FORTALEZA;22012;FABIANO BRAGA;1;587;;1;EEFM - HELENITA MOTA;RUA AMANCIO FILOMENO,720;CAIS DO PORTO;
2024;1;FORTALEZA;22012;FABIANO BRAGA;1;592;;1;ESCOLA ESTADUAL MATIAS BECK;RUA  PROFESSORA AIDA BALAIO 38;MUCURIPE;
2024;1;FORTALEZA;22012;FABIANO BRAGA;1;694;;1;ESCOLA MUNICIPAL FREI TITO DE ALENCAR LIMA;AVENIDA DIOGUINHO 5927;VICENTE PINZON;
2024;1;FORTALEZA;22012;FABIANO BRAGA;1;857;;1;ESCOLA MUNICIPAL CONSUELO AMORA;AV. DOS JANGADEIROS, 577;MUCURIPE;
2024;1;FORTALEZA;22012;FABIANO BRAGA;1;891;;1;FANOR - FACULDADE NORDESTE;AVENIDA SANTOS DUMONT 7800;DE LOURDES;
2024;1;FORTALEZA;22012;FABIANO BRAGA;2;82;;1;EEEP COMENDADOR MIGUEL GURGEL;RUA JOSE BAIMA, S/N;GUAJERU;
2024;1;FORTALEZA;22012;FABIANO BRAGA;2;84;;1;EEEP COMENDADOR MIGUEL GURGEL;RUA JOSE BAIMA, S/N;GUAJERU;
2024;1;FORTALEZA;22012;FABIANO BRAGA;2;87;;1;CLUBE DA CAIXA;AVENIDA FREI CIRILO 4700;MESSEJANA;
2024;1;FORTALEZA;22012;FABIANO BRAGA;2;92;;1;CLUBE DA CAIXA;AVENIDA FREI CIRILO 4700;MESSEJANA;
2024;1;FORTALEZA;22012;FABIANO BRAGA;2;96;;1;EM PROFª FERNANDA MARIA DE ALENCAR COLARES;AV PROF. ARTHUR DE CARVALHO, 1540;LAGOA REDONDA;
2024;1;FORTALEZA;22012;FABIANO BRAGA;2;138;;1;EEM LICEU DE MESSEJANA;AVENIDA WASHINGTON SOARES 7702;MESSEJANA;
2024;1;FORTALEZA;22012;FABIANO BRAGA;2;396;;1;EEEP COMENDADOR MIGUEL GURGEL;RUA JOSE BAIMA, S/N;GUAJERU;
2024;1;FORTALEZA;22012;FABIANO BRAGA;2;429;;1;EEM LICEU DE MESSEJANA;AVENIDA WASHINGTON SOARES 7702;MESSEJANA;
2024;1;FORTALEZA;22012;FABIANO BRAGA;2;447;;2;EEEP COMENDADOR MIGUEL GURGEL;RUA JOSE BAIMA, S/N;GUAJERU;
2024;1;FORTALEZA;22012;FABIANO BRAGA;2;472;;1;EEEP COMENDADOR MIGUEL GURGEL;RUA JOSE BAIMA, S/N;GUAJERU;
2024;1;FORTALEZA;22012;FABIANO BRAGA;2;800;;1;FACULDADE ATENEU DO CEARÁ;AV. COLETOR ANTONIO GADELHA, 621;MESSEJANA;
2024;1;FORTALEZA;22012;FABIANO BRAGA;2;805;;1;CLUBE DA CAIXA;AVENIDA FREI CIRILO 4700;MESSEJANA;
2024;1;FORTALEZA;22012;FABIANO BRAGA;2;826;;1;FACULDADE ATENEU DO CEARÁ;AV. COLETOR ANTONIO GADELHA, 621;MESSEJANA;
2024;1;FORTALEZA;22012;FABIANO BRAGA;2;831;;1;COLÉGIO CHRISTUS SUL;AV. ENG. LEAL LIMA VERDE, 2265;JOSÉ DE ALENCAR;
2024;1;FORTALEZA;22012;FABIANO BRAGA;3;133;;1;COLÉGIO ESTADUAL LICEU DO CEARÁ;PRAÇA GUSTAVO BARROSO, 01;JACARECANGA;
2024;1;FORTALEZA;22012;FABIANO BRAGA;3;231;;1;EEFM CLÓVIS BEVILAQUA;AV. DOM MANUEL, 511;CENTRO;
2024;1;FORTALEZA;22012;FABIANO BRAGA;3;283;;1;EM SÃO RAFAEL;RUA DOS TABAJARAS, 244;PRAIA DE IRACEMA;
2024;1;FORTALEZA;22012;FABIANO BRAGA;3;298;;1;ACADEMIA DO PROFESSOR DARCY RIBEIRO;RUA DONA LEOPOLDINA, 907;CENTRO;
2024;1;FORTALEZA;22012;FABIANO BRAGA;3;304;262, 311;1;EEMTI VISCONDE DO RIO BRANCO;AV. DOM MANUEL, 1803;CENTRO;
2024;1;FORTALEZA;22012;FABIANO BRAGA;3;412;;1;COLÉGIO DARWIN;RUA ILDEFONSO ALBANO, 1030;ALDEOTA;
2024;1;FORTALEZA;22012;FABIANO BRAGA;3;427;;1;FACULDADE ARI DE SÁ;AV. HERÁCLITO GRAÇA, 826;CENTRO;
2024;1;FORTALEZA;22012;FABIANO BRAGA;3;428;;1;FACULDADE ARI DE SÁ;AV. HERÁCLITO GRAÇA, 826;CENTRO;
2024;1;FORTALEZA;22012;FABIANO BRAGA;3;445;;1;EEFM SANTA LUZIA;RUA JOÃO CORDEIRO, 711;PRAIA DE IRACEMA;
2024;1;FORTALEZA;22012;FABIANO BRAGA;3;506;510;1;CENTRO DE PASTORAL MARIA, MÃE DA IGREJA;RUA RODRIGUES JÚNIOR, 300;CENTRO;
2024;1;FORTALEZA;22012;FABIANO BRAGA;3;593;;1;COLÉGIO ANTARES (RUA BARBOSA DE FREITAS);RUA BARBOSA DE FREITAS, 2058;ALDEOTA;
2024;1;FORTALEZA;22012;FABIANO BRAGA;3;603;;1;COLÉGIO SANTA CECÍLIA;AV. SENADOR VIRGÍLIO TÁVORA, 2000;ALDEOTA;
2024;1;FORTALEZA;22012;FABIANO BRAGA;80;129;;1;EEFM ESTADO DO PARÁ;RUA DJALMA PETIT 589;ALTO DA BALANÇA;
2024;1;FORTALEZA;22012;FABIANO BRAGA;80;131;;2;EM PROFESSORA EDITH BRAGA;RUA CAPITAO VASCONCELOS 1061;ALTO DA BALANÇA;
2024;1;FORTALEZA;22012;FABIANO BRAGA;80;133;;1;EM PROFESSORA EDITH BRAGA;RUA CAPITAO VASCONCELOS 1061;ALTO DA BALANÇA;
2024;1;FORTALEZA;22012;FABIANO BRAGA;80;198;;1;EEFM PROFª  MARIA CONCEICÃO PORFÍRIO TELES;RUA MONTE CRISTO, 177;AEROLÂNDIA;
2024;1;FORTALEZA;22012;FABIANO BRAGA;80;208;;1;EEF CIRCULISTA BOM JESUS;RUA JOSE BUSON 101;ALTO DA BALANÇA;
2024;1;FORTALEZA;22012;FABIANO BRAGA;80;216;;1;EM PROFESSORA EDITH BRAGA;RUA CAPITAO VASCONCELOS 1061;ALTO DA BALANÇA;
2024;1;FORTALEZA;22012;FABIANO BRAGA;80;219;;1;EM PROFESSORA EDITH BRAGA;RUA CAPITAO VASCONCELOS 1061;ALTO DA BALANÇA;
2024;1;FORTALEZA;22012;FABIANO BRAGA;80;223;;1;EEFM PADRE ROCHA;RUA CEL ALVES TEIXEIRA 525;JOAQUIM TÁVORA;
2024;1;FORTALEZA;22012;FABIANO BRAGA;80;227;;1;EEFM PADRE ROCHA;RUA CEL ALVES TEIXEIRA 525;JOAQUIM TÁVORA;
2024;1;FORTALEZA;22012;FABIANO BRAGA;80;228;;1;EEFM PADRE ROCHA;RUA CEL ALVES TEIXEIRA 525;JOAQUIM TÁVORA;
2024;1;FORTALEZA;22012;FABIANO BRAGA;80;262;;1;EMEIF ALMERINDA DE ALBUQUERQUE;RUA ANA GONCALVES 1105;TAUAPE;
2024;1;FORTALEZA;22012;FABIANO BRAGA;80;351;;2;COLÉGIO SALESIANO DOM BOSCO;AV ANTONIO SALES 116;JOAQUIM TÁVORA;
2024;1;FORTALEZA;22012;FABIANO BRAGA;80;378;;1;COLÉGIO SHALON;RUA TIBÚRCIO FROTA, 1530 COM OSVALDO CRUZ;TAUAPE;
2024;1;FORTALEZA;22012;FABIANO BRAGA;80;379;;1;COLÉGIO SHALON;RUA TIBÚRCIO FROTA, 1530 COM OSVALDO CRUZ;TAUAPE;
2024;1;FORTALEZA;22012;FABIANO BRAGA;80;402;;2;COLÉGIO MAURO BEZERRA;RUA BRIGADEIRO VILELA, 221;AEROLÂNDIA;
2024;1;FORTALEZA;22012;FABIANO BRAGA;80;404;;1;COLÉGIO MAURO BEZERRA;RUA BRIGADEIRO VILELA, 221;AEROLÂNDIA;
2024;1;FORTALEZA;22012;FABIANO BRAGA;80;405;;2;COLÉGIO MAURO BEZERRA;RUA BRIGADEIRO VILELA, 221;AEROLÂNDIA;
2024;1;FORTALEZA;22012;FABIANO BRAGA;80;408;;2;FACULDADE MAURÍCIO DE NASSAU;AVENIDA VISCONDE DO RIO BRANCO, 2078;JOSÉ BONIFÁCIO;
2024;1;FORTALEZA;22012;FABIANO BRAGA;80;435;;1;AABB - ASSOCIAÇÃO ATLÉTICA BANCO DO BRASIL;AV BARAO DE STUDART, 2917;DIONISIO TORRES;
2024;1;FORTALEZA;22012;FABIANO BRAGA;80;441;;1;COLÉGIO ANTARES FÁTIMA (VILA UNIÃO);RUA ALBERTO MONTEZUMA, 235;VILA UNIÃO;
2024;1;FORTALEZA;22012;FABIANO BRAGA;82;67;;1;EMEIEF CRISTO REDENTOR;AV. PASTEUR, 372;CRISTO REDENTOR;
2024;1;FORTALEZA;22012;FABIANO BRAGA;82;69;;1;COLÉGIO MANUEL DA SILVA - CARLITO PAMPLONA;AV. FRANCISCO SÁ, 4001;CARLITO PAMPLONA;
2024;1;FORTALEZA;22012;FABIANO BRAGA;82;117;;1;CENTRO DE CIDADANIA GOV. VIRGÍLIO TÁVORA - CCDH;AV. MONSENHOR HELIO CAMPOS, 178;CRISTO REDENTOR;
2024;1;FORTALEZA;22012;FABIANO BRAGA;82;196;;1;ESCOLA MUNICIPAL PROFESSOR MARTINZ DE AGUIAR - EI/EF;RUA BERNARDO PORTO, 490;MONTE CASTELO;
2024;1;FORTALEZA;22012;FABIANO BRAGA;82;198;;1;ESCOLA MUNICIPAL FAUSTINO DE ALBUQUERQUE - EI/EF;RUA AMARO CAVALCANTE, 221;MONTE CASTELO;
2024;1;FORTALEZA;22012;FABIANO BRAGA;82;229;;1;ESCOLA MUNICIPAL TERTULIANO CAMBRAIA - EI/EF;RUA MONSENHOR ROSA, 946;CARLITO PAMPLONA;
2024;1;FORTALEZA;22012;FABIANO BRAGA;82;232;;1;EEFM GOVERNADOR FLÁVIO MARCÍLIO;AV. PASTEUR, 575;PIRAMBU;
2024;1;FORTALEZA;22012;FABIANO BRAGA;82;371;;1;EMEIEF HONÓRIO BEZERRA;RUA CAPITÃO NESTOR GÓIS, 400;ELLERY;
2024;1;FORTALEZA;22012;FABIANO BRAGA;82;373;;1;EMEIEF HONÓRIO BEZERRA;RUA CAPITÃO NESTOR GÓIS, 400;ELLERY;
2024;1;FORTALEZA;22012;FABIANO BRAGA;82;401;;1;EMEIEF CRISTO REDENTOR;AV. PASTEUR, 372;CRISTO REDENTOR;
2024;1;FORTALEZA;22012;FABIANO BRAGA;82;403;;1;ESCOLA MUNICIPAL LENIRA JUREMA DE MAGALHÃES - EI/EF;RUA TEÓFILO GURGEL, 111;MONTE CASTELO;
2024;1;FORTALEZA;22012;FABIANO BRAGA;82;409;;1;CENTRO EDUCACIONAL SÃO MATEUS;AV. SARGENTO HERMÍNIO SAMPAIO, 2440;MONTE CASTELO;
2024;1;FORTALEZA;22012;FABIANO BRAGA;82;436;;1;INSTITUTO MATER AMABILIS;RUA PADRE ANCHIETA, 438;MONTE CASTELO;
2024;1;FORTALEZA;22012;FABIANO BRAGA;82;445;;1;CENTRO EDUCACIONAL SÃO MATEUS;AV. SARGENTO HERMÍNIO SAMPAIO, 2440;MONTE CASTELO;
2024;1;FORTALEZA;22012;FABIANO BRAGA;82;465;;1;COLÉGIO MASTER - BEZERRA DE MENEZES;AV. BEZERRA DE MENEZES, 1802;SÃO GERARDO;
2024;1;FORTALEZA;22012;FABIANO BRAGA;82;498;;1;COLÉGIO UNIVERSO MENINO JESUS;RUA DOM QUINTINO, 934;JACARECANGA;
2024;1;FORTALEZA;22012;FABIANO BRAGA;82;547;;2;EMEIEF HONÓRIO BEZERRA;RUA CAPITÃO NESTOR GÓIS, 400;ELLERY;
2024;1;FORTALEZA;22012;FABIANO BRAGA;82;550;;1;CENTRO EDUCACIONAL DOM HÉLIO CAMPOS;RUA SÃO RAIMUNDO, 199;PIRAMBU;
2024;1;FORTALEZA;22012;FABIANO BRAGA;82;567;;1;ESCOLA MUNICIPAL PATATIVA DO ASSARÉ - EI/EF;RUA IRINEU DE SOUZA, 197;ÁLVARO WEYNE;
2024;1;FORTALEZA;22012;FABIANO BRAGA;82;619;;1;COLÉGIO MASTER - BEZERRA DE MENEZES;AV. BEZERRA DE MENEZES, 1802;SÃO GERARDO;
2024;1;FORTALEZA;22012;FABIANO BRAGA;82;625;;1;EEFM CLÁUDIO MARTINS;RUA DEMÓCRITO ROCHA, 400;MONTE CASTELO;
2024;1;FORTALEZA;22012;FABIANO BRAGA;82;627;;2;COLÉGIO MASTER - BEZERRA DE MENEZES;AV. BEZERRA DE MENEZES, 1802;SÃO GERARDO;
2024;1;FORTALEZA;22012;FABIANO BRAGA;82;675;;1;ESCOLA MUNICIPAL ALDEIDES REGIS - EI/EF;RUA IRINEU DE SOUSA, 197;ÁLVARO WEYNE;
2024;1;FORTALEZA;22012;FABIANO BRAGA;82;689;;2;EEFM JOSÉ VALDO RIBEIRO RAMOS - EEMTI;RUA PEDRO AMÉRICO, 100;CARLITO PAMPLONA;
2024;1;FORTALEZA;22012;FABIANO BRAGA;83;2;;1;COLÉGIO DA POLÍCIA MILITAR DO CEARÁ GENERAL EDGARD FACÓ;AVENIDA MISTER HULL,  S/N - KM 1;ANTÔNIO BEZERRA;
2024;1;FORTALEZA;22012;FABIANO BRAGA;83;30;;1;ESCOLA MUNICIPAL DE TEMPO INTEGRAL PROFESSOR JOSE JULIO DA PONTE;RUA MARIO DE ANDRADE, S/N;BELA VISTA;
2024;1;FORTALEZA;22012;FABIANO BRAGA;83;31;;1;COLEGIO CHRISTUS;AV. ENG. HUMBERTO MONTE, 1355;BELA VISTA;
2024;1;FORTALEZA;22012;FABIANO BRAGA;83;62;;1;EEMTI SENADOR FERNANDES TÁVORA;RUA GOIÁS 141;BELA VISTA;
2024;1;FORTALEZA;22012;FABIANO BRAGA;83;99;;1;EEM  MARIANO MARTINS;AVENIDA SENADOR FERNANDES TÁVORA 1445;HENRIQUE JORGE;
2024;1;FORTALEZA;22012;FABIANO BRAGA;83;100;;1;EEM  MARIANO MARTINS;AVENIDA SENADOR FERNANDES TÁVORA 1445;HENRIQUE JORGE;
2024;1;FORTALEZA;22012;FABIANO BRAGA;83;165;;1;EEFM HERACLITO DE CASTRO E SILVA;RUA SILVEIRA FILHO, 808;JÓQUEI CLUBE;
2024;1;FORTALEZA;22012;FABIANO BRAGA;83;240;;1;COLEGIO CHRISTUS;AV. ENG. HUMBERTO MONTE, 1355;BELA VISTA;
2024;1;FORTALEZA;22012;FABIANO BRAGA;83;415;;1;COLEGIO CHRISTUS;AV. ENG. HUMBERTO MONTE, 1355;BELA VISTA;
2024;1;FORTALEZA;22012;FABIANO BRAGA;83;534;;1;COLEGIO CHRISTUS;AV. ENG. HUMBERTO MONTE, 1355;BELA VISTA;
2024;1;FORTALEZA;22012;FABIANO BRAGA;83;568;;1;COLEGIO CHRISTUS;AV. ENG. HUMBERTO MONTE, 1355;BELA VISTA;
2024;1;FORTALEZA;22012;FABIANO BRAGA;83;638;;1;ESCOLA MUNICIPAL ADROALDO TEIXEIRA CASTELO;RUA ALAGOAS 2267;PICI;
2024;1;FORTALEZA;22012;FABIANO BRAGA;83;681;;2;ESCOLA MUNICIPAL DONA DAGMAR GENTIL;RUA VITORIA 1750;HENRIQUE JORGE;
2024;1;FORTALEZA;22012;FABIANO BRAGA;83;683;;1;ESCOLA MUNICIPAL DONA DAGMAR GENTIL;RUA VITORIA 1750;HENRIQUE JORGE;
2024;1;FORTALEZA;22012;FABIANO BRAGA;83;698;;1;EEMTI ANTONIETA SIQUEIRA;RUA GUARANI 04;HENRIQUE JORGE;
2024;1;FORTALEZA;22012;FABIANO BRAGA;83;713;;1;EEEP JÚLIA GIFFONI;RUA CORONEL MATOS DOURADO 1349;PICI;
2024;1;FORTALEZA;22012;FABIANO BRAGA;83;736;;1;EEMTI SENADOR FERNANDES TÁVORA;RUA GOIÁS 141;BELA VISTA;
2024;1;FORTALEZA;22012;FABIANO BRAGA;83;761;;1;ESCOLA MUNICIPAL ADROALDO TEIXEIRA CASTELO;RUA ALAGOAS 2267;PICI;
2024;1;FORTALEZA;22012;FABIANO BRAGA;83;767;;1;CENTRO EDUCACIONAL BRASILEIRINHO;AVENIDA SENADOR FERNANDES TÁVORA, 1717;HENRIQUE JORGE;
2024;1;FORTALEZA;22012;FABIANO BRAGA;83;774;;1;ESCOLA ESPAÇO VIVÊNCIA;RUA MONSENHOR HIPÓLITO BRASIL, 1367;DOM LUSTOSA;
2024;1;FORTALEZA;22012;FABIANO BRAGA;83;784;;1;ESCOLA MUNICIPAL JOSÉ NAURI BRAGA;RUA PROFESSORA LILIA ABREU, 231;BELA VISTA;
2024;1;FORTALEZA;22012;FABIANO BRAGA;83;787;;1;ESCOLA MUNICIPAL ADROALDO TEIXEIRA CASTELO;RUA ALAGOAS 2267;PICI;
2024;1;FORTALEZA;22012;FABIANO BRAGA;85;106;;2;CEJA ADELINO DE ALCANTARA FILHO - UV-6;RUA SEISCENTOS E DOZE, 100, 1A ETAPA;CONJUNTO CEARÁ I;
2024;1;FORTALEZA;22012;FABIANO BRAGA;85;144;;1;EEEP PROFESSOR CESAR CAMPELO;RUA 717, N.164, 3 ETAPA;CONJUNTO CEARÁ I;
2024;1;FORTALEZA;22012;FABIANO BRAGA;85;145;;1;EEEP PROFESSOR CESAR CAMPELO;RUA 717, N.164, 3 ETAPA;CONJUNTO CEARÁ I;
2024;1;FORTALEZA;22012;FABIANO BRAGA;85;150;;2;EEF GOVERNADOR FAUSTINO ALBUQUERQUE - UV1;RUA 143 N 155 - 1 ETAPA;CONJUNTO CEARÁ I;
2024;1;FORTALEZA;22012;FABIANO BRAGA;85;165;;1;EM BERGSON GURJÃO FARIAS;AVENIDA SENADOR FERNANDES TÁVORA, 2500;AUTRAN NUNES;
2024;1;FORTALEZA;22012;FABIANO BRAGA;85;174;;2;EEFM MARIO HUGO CIDRAK DO VALE;RUA DR. PERIGUARI, 547;ANTÔNIO BEZERRA;
2024;1;FORTALEZA;22012;FABIANO BRAGA;85;210;;1;ESCOLA MUNICIPAL PROF AMERICO BARREIRA;RUA RICARDO PONTES 529;GENIBAÚ;
2024;1;FORTALEZA;22012;FABIANO BRAGA;85;234;;1;EEFM DOUTOR GENTIL BARREIRA;RUA 202-D, S/N - CONJUNTO CEARÁ I;CONJUNTO CEARÁ I;
2024;1;FORTALEZA;22012;FABIANO BRAGA;85;256;;1;EEF PATRONATO DA SAGRADA FAMILIA;RUA MARTINS NETO 379;ANTÔNIO BEZERRA;
2024;1;FORTALEZA;22012;FABIANO BRAGA;85;260;;1;EMEIF DOLORES ALCANTARA;RUA CARDEAL ARCOVERDE S/N;AUTRAN NUNES;
2024;1;FORTALEZA;22012;FABIANO BRAGA;85;301;;1;EEFM ANTONIO BEZERRA;RUA PADRE PERDIGAO SAMPAIO 780;ANTÔNIO BEZERRA;
2024;1;FORTALEZA;22012;FABIANO BRAGA;85;326;;1;EEFM DR UBIRAJARA INDIO DO CEARA - UV-7A;RUA SETECENTOS E CINQUENTA E UM, 192, 3A ETAPA;CONJUNTO CEARÁ I;
2024;1;FORTALEZA;22012;FABIANO BRAGA;85;371;;1;EEEP PROFESSOR CESAR CAMPELO;RUA 717, N.164, 3 ETAPA;CONJUNTO CEARÁ I;
2024;1;FORTALEZA;22012;FABIANO BRAGA;85;373;;1;EEFM DOUTOR GENTIL BARREIRA;RUA 202-D, S/N - CONJUNTO CEARÁ I;CONJUNTO CEARÁ I;
2024;1;FORTALEZA;22012;FABIANO BRAGA;85;383;;1;EEFM PROF. EDMILSON GUIMARAES DE ALMEIDA UV 10;RUA 1074 S/N (PROX. HOSPITAL), 4 ETAPA;CONJUNTO CEARÁ I;
2024;1;FORTALEZA;22012;FABIANO BRAGA;85;387;;1;EEFM DR UBIRAJARA INDIO DO CEARA - UV-7A;RUA SETECENTOS E CINQUENTA E UM, 192, 3A ETAPA;CONJUNTO CEARÁ I;
2024;1;FORTALEZA;22012;FABIANO BRAGA;85;388;;1;EEFM MARIA ANTONIETA NUNES - UV 9;RUA 916 SN 4 ETAPA;CONJUNTO CEARÁ I;
2024;1;FORTALEZA;22012;FABIANO BRAGA;85;390;;1;EEFM PROF. EDMILSON GUIMARAES DE ALMEIDA UV 10;RUA 1074 S/N (PROX. HOSPITAL), 4 ETAPA;CONJUNTO CEARÁ I;
2024;1;FORTALEZA;22012;FABIANO BRAGA;93;75;;1;EM JONATHAN DA ROCHA ALCOFORADO;RUA MARIA GOMES DE SÁ,1030 ARACAPÉ;MONDUBIM;
2024;1;FORTALEZA;22012;FABIANO BRAGA;93;80;;2;EM RACHEL DE QUEIROZ;AVENIDA C, S/N - II ETAPA;PREFEITO JOSÉ WALTER;
2024;1;FORTALEZA;22012;FABIANO BRAGA;93;81;;2;EM RACHEL DE QUEIROZ;AVENIDA C, S/N - II ETAPA;PREFEITO JOSÉ WALTER;
2024;1;FORTALEZA;22012;FABIANO BRAGA;93;90;;1;EM MINHA VIDA MEUS AMORES;AVENIDA D, 380 - II ETAPA;PREFEITO JOSÉ WALTER;
2024;1;FORTALEZA;22012;FABIANO BRAGA;93;104;;1;ESCOLA MUNICIPAL ARI DE SA CAVALCANTE (JOSÉ WALTER);AV. H, 430 III ETAPA;PREFEITO JOSÉ WALTER;
2024;1;FORTALEZA;22012;FABIANO BRAGA;93;112;;1;EM OSMIRIO DE OLIVEIRA BARRETO;RUA 10, S/N (CJ SITIO DO CÓRREGO);MONDUBIM;
2024;1;FORTALEZA;22012;FABIANO BRAGA;93;117;;1;ESCOLA SANTANA;RUA 10, 1305;MONDUBIM;
2024;1;FORTALEZA;22012;FABIANO BRAGA;93;129;;1;COLEGIO 21 EDUCAR;AV JOAO DE ARAUJO LIMA, 1240 - II ETAPA;PREFEITO JOSÉ WALTER;
2024;1;FORTALEZA;22012;FABIANO BRAGA;93;131;;1;COLEGIO 21 EDUCAR;AV JOAO DE ARAUJO LIMA, 1240 - II ETAPA;PREFEITO JOSÉ WALTER;
2024;1;FORTALEZA;22012;FABIANO BRAGA;93;132;;1;COLEGIO 21 EDUCAR;AV JOAO DE ARAUJO LIMA, 1240 - II ETAPA;PREFEITO JOSÉ WALTER;
2024;1;FORTALEZA;22012;FABIANO BRAGA;93;137;;1;COLEGIO VEGA;AVENIDA C, 160;PREFEITO JOSÉ WALTER;
2024;1;FORTALEZA;22012;FABIANO BRAGA;93;148;;1;EEEP PROFESSOR ONELIO PORTO;AVENIDA E, 471 - II ETAPA;PREFEITO JOSÉ WALTER;
2024;1;FORTALEZA;22012;FABIANO BRAGA;93;160;;1;CUCA JOSÉ WALTER;RUA 69, S/N;PREFEITO JOSÉ WALTER;
2024;1;FORTALEZA;22012;FABIANO BRAGA;93;161;;1;CUCA JOSÉ WALTER;RUA 69, S/N;PREFEITO JOSÉ WALTER;
2024;1;FORTALEZA;22012;FABIANO BRAGA;93;166;;1;EM JOAO HILDO DE CARVALHO FURTADO;RUA MIGUEL ARAGÃO, S/N ARACAPÉ;MONDUBIM;
2024;1;FORTALEZA;22012;FABIANO BRAGA;93;174;;1;EEFM ESTADO DO MARANHAO;RUA CARLOS PIMENTA,506;MONDUBIM;
2024;1;FORTALEZA;22012;FABIANO BRAGA;93;175;;1;EEFM ESTADO DO MARANHAO;RUA CARLOS PIMENTA,506;MONDUBIM;
2024;1;FORTALEZA;22012;FABIANO BRAGA;93;179;;1;EEFM ESTADO DO MARANHAO;RUA CARLOS PIMENTA,506;MONDUBIM;
2024;1;FORTALEZA;22012;FABIANO BRAGA;93;200;;1;LICEU ESTADUAL DOMINGOS BRASILEIRO;RUA PLANALTINA, S/N;PLANALTO AYRTON SENNA;
2024;1;FORTALEZA;22012;FABIANO BRAGA;93;211;;1;CEI RACHEL DE QUEIROZ;RUA 41, S/N - II ETAPA;PREFEITO JOSÉ WALTER;
2024;1;FORTALEZA;22012;FABIANO BRAGA;93;213;;1;CEJA - CENTRO DE EDUCAÇÃO DE JOVENS E ADULTOS;AV. L, S/N - II ETAPA;PREFEITO JOSÉ WALTER;
2024;1;FORTALEZA;22012;FABIANO BRAGA;93;235;;1;EEEP PROFESSOR OTAVIO TERCEIRO DE FARIAS;AVENIDA C, 435;PREFEITO JOSÉ WALTER;
2024;1;FORTALEZA;22012;FABIANO BRAGA;93;280;;1;EM ADALBERTO STUDART FILHO;RUA DO CAMPO, 25;PLANALTO AYRTON SENNA;
2024;1;FORTALEZA;22012;FABIANO BRAGA;93;284;;1;COLEGIO 21 EDUCAR;AV JOAO DE ARAUJO LIMA, 1240 - II ETAPA;PREFEITO JOSÉ WALTER;
2024;1;FORTALEZA;22012;FABIANO BRAGA;93;295;;1;ESCOLA MUNICIPAL ARI DE SA CAVALCANTE (JOSÉ WALTER);AV. H, 430 III ETAPA;PREFEITO JOSÉ WALTER;
2024;1;FORTALEZA;22012;FABIANO BRAGA;93;305;;1;ESCOLA SANTANA;RUA 10, 1305;MONDUBIM;
2024;1;FORTALEZA;22012;FABIANO BRAGA;93;308;;1;CUCA JOSÉ WALTER;RUA 69, S/N;PREFEITO JOSÉ WALTER;
2024;1;FORTALEZA;22012;FABIANO BRAGA;94;322;;1;COLEGIO SALOME BASTOS;RUA DESEMBARGADOR HERMES PARAHYBA 1120;VILA VELHA;
2024;1;FORTALEZA;22012;FABIANO BRAGA;94;378;;1;EM MANOEL RODRIGUES;RUA MARIA CLARA 1237;VILA VELHA;
2024;1;FORTALEZA;22012;FABIANO BRAGA;94;773;;1;IGREJA DE SÃO JOSÉ;R. GEN. ALÍPIO DOS SANTOS, 375;QUINTINO CUNHA;
2024;1;FORTALEZA;22012;FABIANO BRAGA;94;784;;1;EEFM DEP FCO DE ALMEIDA MONTE;AV. CORONEL CARVALHO 2400;JARDIM IRACEMA;
2024;1;FORTALEZA;22012;FABIANO BRAGA;94;820;;1;EMTI JOSÉ CARLOS DE OLIVEIRA NETO;R. SAO VICENTE DE PAULO, 170;ANTÔNIO BEZERRA;
2024;1;FORTALEZA;22012;FABIANO BRAGA;94;830;;1;COLÉGIO DOM FELIPE;AV INDEPENDÊNCIA. 1652;QUINTINO CUNHA;
2024;1;FORTALEZA;22012;FABIANO BRAGA;94;839;;1;COLEGIO JULIA FIALHO;RUA JOSE ACIOLY 73;ANTÔNIO BEZERRA;
2024;1;FORTALEZA;22012;FABIANO BRAGA;94;889;;1;EEMTI MONSENHOR DOURADO;AVENIDA SARGENTO HERMÍNIO SAMPAIO 4600;PADRE ANDRADE;
2024;1;FORTALEZA;22012;FABIANO BRAGA;94;928;;1;COLÉGIO DOM QUINTINO;RUA CECIL SALGADO, 53;JARDIM GUANABARA;
2024;1;FORTALEZA;22012;FABIANO BRAGA;95;91;;1;EEFM PADRE MARCELINO CHAMPAGNAT;RUA DAURA, 120;BARROSO;
2024;1;FORTALEZA;22012;FABIANO BRAGA;95;93;;1;EEFM PADRE MARCELINO CHAMPAGNAT;RUA DAURA, 120;BARROSO;
2024;1;FORTALEZA;22012;FABIANO BRAGA;95;94;;1;EEFM PADRE MARCELINO CHAMPAGNAT;RUA DAURA, 120;BARROSO;
2024;1;FORTALEZA;22012;FABIANO BRAGA;95;210;;1;EEFM ALMIRANTE TAMANDARÉ;RUA DO MANDACARU, 1048 CJ ALMIRANTE TAMANDARÉ;JANGURUSSU;
2024;1;FORTALEZA;22012;FABIANO BRAGA;95;225;;1;EM FRANCISCA ORIA SERPA;RUA JORGE FIGUEIREDO, 3652;PEDRAS;
2024;1;FORTALEZA;22012;FABIANO BRAGA;95;271;;1;EM SINÓ PINHEIRO;RUA 14, 151 (CJ JOAO PAULO II);BARROSO;
2024;1;FORTALEZA;22012;FABIANO BRAGA;95;285;;1;EM PROFESSORA MARIA ANTONÉZIA MEIRELES E SÁ;RUA CORONEL VIRGÍLIO TÁVORA, 1340;BARROSO;
2024;1;FORTALEZA;22012;FABIANO BRAGA;112;74;;1;ESCOLA ESTADUAL DE EDUCAÇÃO PROFISSIONAL JAIME ALENCAR DE OLIVEIRA;AV ROGACIANO LEITE, 2285;ENGENHEIRO LUCIANO CAVALCANTE;
2024;1;FORTALEZA;22012;FABIANO BRAGA;112;144;;2;EEFM D. LUIZA TÁVORA - PRÓ MORAR;RUA FREI CANECA, 379;JARDIM DAS OLIVEIRAS;
2024;1;FORTALEZA;22012;FABIANO BRAGA;112;165;;1;EM JOHNSON;RUA DRA. SOCORRO AZEVEDO, 461;ENGENHEIRO LUCIANO CAVALCANTE;
2024;1;FORTALEZA;22012;FABIANO BRAGA;112;177;;1;COLÉGIO TIRADENTES;AV OLIVEIRA PAIVA, 223;CIDADE DOS FUNCIONÁRIOS;
2024;1;FORTALEZA;22012;FABIANO BRAGA;112;271;;1;EEMTI MIRIAN PORTO MOTA;RUA DAS CASTANHOLAS, S/N;JARDIM DAS OLIVEIRAS;
2024;1;FORTALEZA;22012;FABIANO BRAGA;112;439;;1;COLEGIO ARI DE SA CAVALCANTE WS;AV WASHINGTON SOARES, 3737;EDSON QUEIROZ;
2024;1;FORTALEZA;22012;FABIANO BRAGA;112;530;;1;INSTITUTO DE ASSISTÊNCIA E PROTEÇÃO SOCIAL - IAPS;RUA BARRA NOVA, N 1.000, CONJ. TANCREDO NEVES;JARDIM DAS OLIVEIRAS;
2024;1;FORTALEZA;22012;FABIANO BRAGA;112;549;;1;COLÉGIO NOVA DIMENSÃO;AV. EDILSON BRASIL SOARES, 1599;EDSON QUEIROZ;
2024;1;FORTALEZA;22012;FABIANO BRAGA;112;551;;1;CENTRO UNIVERSITÁRIO 7 DE SETEMBRO - UNI 7 (FA7);AV. ALMIRANTE MAXIMINIANO DA FONSECA, 1395;ENGENHEIRO LUCIANO CAVALCANTE;
2024;1;FORTALEZA;22012;FABIANO BRAGA;113;40;39, 41;1;COLÉGIO FARIAS BRITO PRÉ - VESTIBULAR;AV. BARÃO DO RIO BRANCO, 2424;JOSÉ BONIFÁCIO;
2024;1;FORTALEZA;22012;FABIANO BRAGA;113;57;;1;COLÉGIO FARIAS BRITO;RUA SENADOR POMPEU, 2607;JOSÉ BONIFÁCIO;
2024;1;FORTALEZA;22012;FABIANO BRAGA;113;86;;2;ESCOLA MUNICIPAL PROF. FILGUEIRAS LIMA;AV. DOS EXPEDICIONÁRIOS, 3910;JARDIM AMÉRICA;
2024;1;FORTALEZA;22012;FABIANO BRAGA;113;87;;1;ESCOLA MUNICIPAL PROF. FILGUEIRAS LIMA;AV. DOS EXPEDICIONÁRIOS, 3910;JARDIM AMÉRICA;
2024;1;FORTALEZA;22012;FABIANO BRAGA;113;107;;1;COLÉGIO CHRISTUS BENFICA;RUA LUIS DE MIRANDA, 536;BENFICA;
2024;1;FORTALEZA;22012;FABIANO BRAGA;113;115;;1;COLÉGIO CHRISTUS BENFICA;RUA LUIS DE MIRANDA, 536;BENFICA;
2024;1;FORTALEZA;22012;FABIANO BRAGA;113;138;;1;EEFM ESTADO DO PARANÁ;RUA ALBERTO MAGNO, 123;JARDIM AMÉRICA;
2024;1;FORTALEZA;22012;FABIANO BRAGA;113;199;;1;EEFM DR.CÉSAR CALS;AV. DOMINGOS OLIMPIO, 1800;FARIAS BRITO;
2024;1;FORTALEZA;22012;FABIANO BRAGA;113;202;;2;COLÉGIO CHRISTUS PRÉ - UNIVERSITÁRIO;RUA CRUZ SALDANHA, 614;PARQUELÂNDIA;
2024;1;FORTALEZA;22012;FABIANO BRAGA;113;220;;2;COLÉGIO MANUELITO AZEVEDO;RUA TIRADENTES, 483;RODOLFO TEÓFILO;
2024;1;FORTALEZA;22012;FABIANO BRAGA;113;222;;1;COLÉGIO MANUELITO AZEVEDO;RUA TIRADENTES, 483;RODOLFO TEÓFILO;
2024;1;FORTALEZA;22012;FABIANO BRAGA;113;225;;1;COLÉGIO MANUELITO AZEVEDO;RUA TIRADENTES, 483;RODOLFO TEÓFILO;
2024;1;FORTALEZA;22012;FABIANO BRAGA;113;226;;1;COLÉGIO MANUELITO AZEVEDO;RUA TIRADENTES, 483;RODOLFO TEÓFILO;
2024;1;FORTALEZA;22012;FABIANO BRAGA;113;227;;1;COLÉGIO MANUELITO AZEVEDO;RUA TIRADENTES, 483;RODOLFO TEÓFILO;
2024;1;FORTALEZA;22012;FABIANO BRAGA;113;230;;1;CEI FRANCISCO EURIVÁ MATIAS;RUA FREI MARCELINO, S/N;RODOLFO TEÓFILO;
2024;1;FORTALEZA;22012;FABIANO BRAGA;113;232;;1;EEFM ANTONIO SALES - PARQUELÂNDIA;RUA PROF. ANACLETO, 630;PARQUELÂNDIA;
2024;1;FORTALEZA;22012;FABIANO BRAGA;113;239;;1;EEFM ANTONIO SALES - PARQUELÂNDIA;RUA PROF. ANACLETO, 630;PARQUELÂNDIA;
2024;1;FORTALEZA;22012;FABIANO BRAGA;113;240;;2;EEFM ANTONIO SALES - PARQUELÂNDIA;RUA PROF. ANACLETO, 630;PARQUELÂNDIA;
2024;1;FORTALEZA;22012;FABIANO BRAGA;113;246;;1;EEFM FÉLIX DE AZEVEDO;RUA MONSENHOR FURTADO, 757;RODOLFO TEÓFILO;
2024;1;FORTALEZA;22012;FABIANO BRAGA;113;280;;1;COLÉGIO CHRISTUS PRÉ - UNIVERSITÁRIO;RUA CRUZ SALDANHA, 614;PARQUELÂNDIA;
2024;1;FORTALEZA;22012;FABIANO BRAGA;113;302;;2;ESC. MUNICIPAL ANTONIO SALES RODOLFO TEÓFILO;RUA TAVARES IRACEMA, 675;RODOLFO TEÓFILO;
2024;1;FORTALEZA;22012;FABIANO BRAGA;113;308;;1;COLÉGIO GUSTAVO BRAGA;AV. JOÃO PESSOA, 4650/80;DAMAS;
2024;1;FORTALEZA;22012;FABIANO BRAGA;113;340;;1;ESCOLA ESTADUAL DE EDUCAÇÃO PROFISSIONAL JOAQUIM NOGUEIRA;RUA MOREIRA DE SOUSA, 327;PARQUELÂNDIA;
2024;1;FORTALEZA;22012;FABIANO BRAGA;113;372;;1;COLÉGIO ESTADUAL PRESIDENTE HUMBERTO CASTELO BRANCO;RUA IRMA BAZET, 210;MONTESE;
2024;1;FORTALEZA;22012;FABIANO BRAGA;113;401;;1;COLEGIO CWD-MAXIMUS;RUA DOM LINO, 301;PARQUELÂNDIA;
2024;1;FORTALEZA;22012;FABIANO BRAGA;113;405;;1;COLEGIO CWD-MAXIMUS;RUA DOM LINO, 301;PARQUELÂNDIA;
2024;1;FORTALEZA;22012;FABIANO BRAGA;113;409;;1;COLÉGIO ART E MANHA;RUA SÃO MATEUS, 1020;VILA UNIÃO;
2024;1;FORTALEZA;22012;FABIANO BRAGA;113;410;;1;COLÉGIO ART E MANHA;RUA SÃO MATEUS, 1020;VILA UNIÃO;
2024;1;FORTALEZA;22012;FABIANO BRAGA;113;414;;1;COLÉGIO ART E MANHA;RUA SÃO MATEUS, 1020;VILA UNIÃO;
2024;1;FORTALEZA;22012;FABIANO BRAGA;114;104;;1;COLÉGIO SANTA ISABEL;AVENIDA BEZERRA DE MENEZES 2840;PRESIDENTE KENNEDY;
2024;1;FORTALEZA;22012;FABIANO BRAGA;114;145;;1;EEMTI PROFESSORA BALBINA JUCA ALBUQUERQUE;AVENIDA MAJOR ASSIS 346;JARDIM IRACEMA;
2024;1;FORTALEZA;22012;FABIANO BRAGA;114;184;;1;EEMTI WALDEMAR FALCÃO;RUA ANTONIO JOAQUIM DE CARVALHO 19;ÁLVARO WEYNE;
2024;1;FORTALEZA;22012;FABIANO BRAGA;114;205;;1;EM DOM HELDER CAMARA;RUA FREI ODILON 623 B;ÁLVARO WEYNE;
2024;1;FORTALEZA;22012;FABIANO BRAGA;114;221;;1;INSTITUTO EDUCACIONAL PRESIDENTE MEDICI;RUA CÉSAR CORREIA 973;FLORESTA;
2024;1;FORTALEZA;22012;FABIANO BRAGA;114;229;;1;EM DOM ANTONIO BATISTA DE FRAGOSO;AVENIDA FRANCISCO SÁ 7945;BARRA DO CEARÁ;
2024;1;FORTALEZA;22012;FABIANO BRAGA;114;275;;1;EM DOIS DE DEZEMBRO;RUA ARAKEN, 860;BARRA DO CEARÁ;
2024;1;FORTALEZA;22012;FABIANO BRAGA;114;298;;1;COLÉGIO MANUEL DA SILVA (ÁLVARO WEYNE);RUA SÃO BERNARDO 181;ÁLVARO WEYNE;
2024;1;FORTALEZA;22012;FABIANO BRAGA;115;26;;1;EEM  PROFESSORA DIVA CABRAL;RUA HOLANDA, 701;MARAPONGA;
2024;1;FORTALEZA;22012;FABIANO BRAGA;115;27;;2;EEM  PROFESSORA DIVA CABRAL;RUA HOLANDA, 701;MARAPONGA;
2024;1;FORTALEZA;22012;FABIANO BRAGA;115;48;;1;UNIVERSIDADE ESTADUAL DO CEARA - UECE;AV DR. SILAS MUNGUBA, 1700;ITAPERI;
2024;1;FORTALEZA;22012;FABIANO BRAGA;115;49;;1;UNIVERSIDADE ESTADUAL DO CEARA - UECE;AV DR. SILAS MUNGUBA, 1700;ITAPERI;
2024;1;FORTALEZA;22012;FABIANO BRAGA;115;55;;1;UNIVERSIDADE ESTADUAL DO CEARA - UECE;AV DR. SILAS MUNGUBA, 1700;ITAPERI;
2024;1;FORTALEZA;22012;FABIANO BRAGA;115;114;;1;COLEGIO NOSSA SENHORA DO CARMO;RUA ELVIRA PINHO, 400;MONTESE;
2024;1;FORTALEZA;22012;FABIANO BRAGA;115;120;;2;DETRAN;AV GODOFREDO MACIEL, 2900;MARAPONGA;
2024;1;FORTALEZA;22012;FABIANO BRAGA;115;122;;1;COLÉGIO UNIVERSO DO SABER;RUA 10 - NR 70 (CJ CAMPO DOS INGLESES - MARAPONGA);JARDIM CEARENSE;
2024;1;FORTALEZA;22012;FABIANO BRAGA;115;123;;1;COLÉGIO UNIVERSO DO SABER;RUA 10 - NR 70 (CJ CAMPO DOS INGLESES - MARAPONGA);JARDIM CEARENSE;
2024;1;FORTALEZA;22012;FABIANO BRAGA;115;135;;1;COLÉGIO INVICTUS;RUA ARARIBÓIA, 192;PARANGABA;
2024;1;FORTALEZA;22012;FABIANO BRAGA;115;136;;1;COLÉGIO INVICTUS;RUA ARARIBÓIA, 192;PARANGABA;
2024;1;FORTALEZA;22012;FABIANO BRAGA;115;199;;2;COLÉGIO INVICTUS;RUA ARARIBÓIA, 192;PARANGABA;
2024;1;FORTALEZA;22012;FABIANO BRAGA;115;200;;2;COLÉGIO INVICTUS;RUA ARARIBÓIA, 192;PARANGABA;
