Ano;Turno;Município;Número;Candidato;Zona;Seção;Seções Agregadas;Votos;Local de Votação;Endereço Local de Votação;Bairro;
2024;1;FORTALEZA;11186;FLAVIANA ABREU;3;272;277;1;FAC. CATÓLICA DE FORTALEZA (SEMINÁRIO DA PRAINHA);RUA TENENTE BENÉVOLO, 201;CENTRO;
2024;1;FORTALEZA;11186;FLAVIANA ABREU;3;631;;1;COLÉGIO BATISTA - SANTOS DUMONT;RUA DESEMBARGADOR LEITE ALBUQUERQUE, 1056;ALDEOTA;
2024;1;FORTALEZA;11186;FLAVIANA ABREU;80;273;;1;ESCOLA MUNICIPAL HAROLDO JORGE BRAUN VIEIRA;AV LAURO VIEIRA CHAVES, 2001;VILA UNIÃO;
2024;1;FORTALEZA;11186;FLAVIANA ABREU;80;317;;1;COLÉGIO SANTO INACIO;AVENIDA DESEMBARGADOR MOREIRA 2355;DIONISIO TORRES;
2024;1;FORTALEZA;11186;FLAVIANA ABREU;82;66;;1;EMEIEF CRISTO REDENTOR;AV. PASTEUR, 372;CRISTO REDENTOR;
2024;1;FORTALEZA;11186;FLAVIANA ABREU;82;85;;1;ESCOLA MUNICIPAL SEBASTIANA ALDIGUERI;AV. DOUTOR THEBERGE, 448;CRISTO REDENTOR;
2024;1;FORTALEZA;11186;FLAVIANA ABREU;82;104;;2;EEFM LIONS JANGADA - EEMTI;RUA CAMÉLIA, 352;CRISTO REDENTOR;
2024;1;FORTALEZA;11186;FLAVIANA ABREU;82;115;;1;CENTRO DE CIDADANIA GOV. VIRGÍLIO TÁVORA - CCDH;AV. MONSENHOR HELIO CAMPOS, 178;CRISTO REDENTOR;
2024;1;FORTALEZA;11186;FLAVIANA ABREU;82;117;;1;CENTRO DE CIDADANIA GOV. VIRGÍLIO TÁVORA - CCDH;AV. MONSENHOR HELIO CAMPOS, 178;CRISTO REDENTOR;
2024;1;FORTALEZA;11186;FLAVIANA ABREU;82;119;;1;CENTRO DE CIDADANIA GOV. VIRGÍLIO TÁVORA - CCDH;AV. MONSENHOR HELIO CAMPOS, 178;CRISTO REDENTOR;
2024;1;FORTALEZA;11186;FLAVIANA ABREU;82;243;;1;EEFM GOVERNADOR FLÁVIO MARCÍLIO;AV. PASTEUR, 575;PIRAMBU;
2024;1;FORTALEZA;11186;FLAVIANA ABREU;82;513;;1;EMEIEF VIRGÍLIO TÁVORA;AV. MONSENHOR HÉLIO CAMPOS, 144;CRISTO REDENTOR;
2024;1;FORTALEZA;11186;FLAVIANA ABREU;82;528;;1;EMEIEF VIRGÍLIO TÁVORA;AV. MONSENHOR HÉLIO CAMPOS, 144;CRISTO REDENTOR;
2024;1;FORTALEZA;11186;FLAVIANA ABREU;82;551;;1;EEFM LIONS JANGADA - EEMTI;RUA CAMÉLIA, 352;CRISTO REDENTOR;
2024;1;FORTALEZA;11186;FLAVIANA ABREU;82;571;;1;CEJA  MONSENHOR HÉLIO CAMPOS;AV. MONSENHOR HÉLIO CAMPOS, 251;CRISTO REDENTOR;
2024;1;FORTALEZA;11186;FLAVIANA ABREU;82;622;;2;CEJA  MONSENHOR HÉLIO CAMPOS;AV. MONSENHOR HÉLIO CAMPOS, 251;CRISTO REDENTOR;
2024;1;FORTALEZA;11186;FLAVIANA ABREU;82;623;;1;ESCOLA MUNICIPAL SANTA TEREZA - EI/EF;RUA MONSENHOR HÉLIO CAMPOS, 90;CRISTO REDENTOR;
2024;1;FORTALEZA;11186;FLAVIANA ABREU;82;633;;1;EMEIEF CRISTO REDENTOR;AV. PASTEUR, 372;CRISTO REDENTOR;
2024;1;FORTALEZA;11186;FLAVIANA ABREU;82;649;;3;CEJA  MONSENHOR HÉLIO CAMPOS;AV. MONSENHOR HÉLIO CAMPOS, 251;CRISTO REDENTOR;
2024;1;FORTALEZA;11186;FLAVIANA ABREU;82;650;;1;ESCOLA MUNICIPAL SEBASTIANA ALDIGUERI;AV. DOUTOR THEBERGE, 448;CRISTO REDENTOR;
2024;1;FORTALEZA;11186;FLAVIANA ABREU;82;667;;1;ESCOLA MUNICIPAL ANTONIO MENDES - EI/EF;RUA DONA MENDINA, 682;CRISTO REDENTOR;
2024;1;FORTALEZA;11186;FLAVIANA ABREU;82;670;;1;ESCOLA MUNICIPAL ANTONIO MENDES - EI/EF;RUA DONA MENDINA, 682;CRISTO REDENTOR;
2024;1;FORTALEZA;11186;FLAVIANA ABREU;83;765;;1;ESCOLA MUNICIPAL MURILO SERPA;RUA MONSENHOR HIPOLITO BRASIL 1400;DOM LUSTOSA;
2024;1;FORTALEZA;11186;FLAVIANA ABREU;93;102;;2;ESCOLA MUNICIPAL ARI DE SA CAVALCANTE (JOSÉ WALTER);AV. H, 430 III ETAPA;PREFEITO JOSÉ WALTER;
2024;1;FORTALEZA;11186;FLAVIANA ABREU;93;119;;1;EEFM DEPUTADO JOACI PEREIRA;RUA PROFESSOR PEDRO JORGE, 830;PLANALTO AYRTON SENNA;
2024;1;FORTALEZA;11186;FLAVIANA ABREU;93;123;;1;EEFM DEPUTADO JOACI PEREIRA;RUA PROFESSOR PEDRO JORGE, 830;PLANALTO AYRTON SENNA;
2024;1;FORTALEZA;11186;FLAVIANA ABREU;93;207;;1;LICEU ESTADUAL DOMINGOS BRASILEIRO;RUA PLANALTINA, S/N;PLANALTO AYRTON SENNA;
2024;1;FORTALEZA;11186;FLAVIANA ABREU;93;208;;1;LICEU ESTADUAL DOMINGOS BRASILEIRO;RUA PLANALTINA, S/N;PLANALTO AYRTON SENNA;
2024;1;FORTALEZA;11186;FLAVIANA ABREU;93;251;;1;ESCOLA MUNICIPAL ARI DE SA CAVALCANTE (JOSÉ WALTER);AV. H, 430 III ETAPA;PREFEITO JOSÉ WALTER;
2024;1;FORTALEZA;11186;FLAVIANA ABREU;93;252;;1;ESCOLA MUNICIPAL ARI DE SA CAVALCANTE (JOSÉ WALTER);AV. H, 430 III ETAPA;PREFEITO JOSÉ WALTER;
2024;1;FORTALEZA;11186;FLAVIANA ABREU;93;253;;1;ESCOLA MUNICIPAL ARI DE SA CAVALCANTE (JOSÉ WALTER);AV. H, 430 III ETAPA;PREFEITO JOSÉ WALTER;
2024;1;FORTALEZA;11186;FLAVIANA ABREU;93;271;;1;LICEU ESTADUAL DOMINGOS BRASILEIRO;RUA PLANALTINA, S/N;PLANALTO AYRTON SENNA;
2024;1;FORTALEZA;11186;FLAVIANA ABREU;94;12;;1;EEMTI MARIA JOSÉ SANTOS FERREIRA GOMES;RUA DONA LUCIA PINHEIRO, 93;QUINTINO CUNHA;
2024;1;FORTALEZA;11186;FLAVIANA ABREU;94;35;;1;EMTI JOSÉ CARLOS DE OLIVEIRA NETO;R. SAO VICENTE DE PAULO, 170;ANTÔNIO BEZERRA;
2024;1;FORTALEZA;11186;FLAVIANA ABREU;94;786;;1;IGREJA DE SÃO JOSÉ;R. GEN. ALÍPIO DOS SANTOS, 375;QUINTINO CUNHA;
2024;1;FORTALEZA;11186;FLAVIANA ABREU;94;824;;1;COLÉGIO CIENTISTA;RUA 31, 330 - CONJUNTO POLAR;VILA VELHA;
2024;1;FORTALEZA;11186;FLAVIANA ABREU;94;831;;1;EMTI DEPUTADO ROBERTO MESQUITA;R. BETA,  SN;VILA VELHA;
2024;1;FORTALEZA;11186;FLAVIANA ABREU;94;853;;1;EM ANTONIO CORREIA LIMA;RUA HERMES PARAYBA, 934;VILA VELHA;
2024;1;FORTALEZA;11186;FLAVIANA ABREU;94;854;;1;EMEIF FRANCISCO EDILSON PINHEIRO;RUA N, 35;VILA VELHA;
2024;1;FORTALEZA;11186;FLAVIANA ABREU;94;912;;1;COLÉGIO CIENTISTA;RUA 31, 330 - CONJUNTO POLAR;VILA VELHA;
2024;1;FORTALEZA;11186;FLAVIANA ABREU;94;917;;1;EMEIF FRANCISCO EDILSON PINHEIRO;RUA N, 35;VILA VELHA;
2024;1;FORTALEZA;11186;FLAVIANA ABREU;94;933;;1;CEI MARIA MARIZA MENDES DE CARVALHO;RUA RAIMUNDO CUNHA 1174;VILA VELHA;
2024;1;FORTALEZA;11186;FLAVIANA ABREU;112;179;;1;COLÉGIO TIRADENTES;AV OLIVEIRA PAIVA, 223;CIDADE DOS FUNCIONÁRIOS;
2024;1;FORTALEZA;11186;FLAVIANA ABREU;112;551;;1;CENTRO UNIVERSITÁRIO 7 DE SETEMBRO - UNI 7 (FA7);AV. ALMIRANTE MAXIMINIANO DA FONSECA, 1395;ENGENHEIRO LUCIANO CAVALCANTE;
2024;1;FORTALEZA;11186;FLAVIANA ABREU;113;399;;1;COLEGIO CWD-MAXIMUS;RUA DOM LINO, 301;PARQUELÂNDIA;
2024;1;FORTALEZA;11186;FLAVIANA ABREU;114;51;;1;EM FRANCISCO DOMINGOS DA SILVA;AVENIDA PRESIDENTE CASTELO BRANCO 4707;BARRA DO CEARÁ;
2024;1;FORTALEZA;11186;FLAVIANA ABREU;114;94;;1;CUCA BARRA DO CEARÁ;AV. PRES. CASTELO BRANCO, 6417;BARRA DO CEARÁ;
2024;1;FORTALEZA;11186;FLAVIANA ABREU;114;129;;1;EEFM ESTADO DE ALAGOAS;AVENIDA PRESIDENTE CASTELO BRANCO, 5244;BARRA DO CEARÁ;
2024;1;FORTALEZA;11186;FLAVIANA ABREU;114;177;;1;EEFM SÃO JOSÉ DOS ARPOADORES;RUA FRANCISCO CALAÇA 90;CRISTO REDENTOR;
2024;1;FORTALEZA;11186;FLAVIANA ABREU;114;186;;1;EM JADER DE FIGUEIREDO CORREIA;RUA TOCANDIRA 61;BARRA DO CEARÁ;
2024;1;FORTALEZA;11186;FLAVIANA ABREU;114;187;;1;EM JADER DE FIGUEIREDO CORREIA;RUA TOCANDIRA 61;BARRA DO CEARÁ;
2024;1;FORTALEZA;11186;FLAVIANA ABREU;114;223;;1;INSTITUTO EDUCACIONAL PRESIDENTE MEDICI;RUA CÉSAR CORREIA 973;FLORESTA;
2024;1;FORTALEZA;11186;FLAVIANA ABREU;114;251;;1;CENTRO DE EDUCAÇÃO COMPLEMENTAR (CEDCE) - ANTIGO SESI;AVENIDA FRANCISCO SÁ 6623;BARRA DO CEARÁ;
2024;1;FORTALEZA;11186;FLAVIANA ABREU;114;283;;1;EEEP PAULO PETROLA;RUA SAUDÁRIA, S/N - GOIABEIRAS;BARRA DO CEARÁ;
2024;1;FORTALEZA;11186;FLAVIANA ABREU;114;297;;1;EEFM ESTADO DE ALAGOAS;AVENIDA PRESIDENTE CASTELO BRANCO, 5244;BARRA DO CEARÁ;
2024;1;FORTALEZA;11186;FLAVIANA ABREU;114;302;;1;EM FRANCISCO DOMINGOS DA SILVA;AVENIDA PRESIDENTE CASTELO BRANCO 4707;BARRA DO CEARÁ;
2024;1;FORTALEZA;11186;FLAVIANA ABREU;114;313;;1;EMTI ALDEMIR MARTINS;AV. FRANCISCO SÁ, 7460;BARRA DO CEARÁ;
2024;1;FORTALEZA;11186;FLAVIANA ABREU;114;337;;1;INSTITUTO EDUCACIONAL HUMANISTA;RUA CAUBI, 478;BARRA DO CEARÁ;
2024;1;FORTALEZA;11186;FLAVIANA ABREU;115;132;;1;COLEGIO PROVECTO;RUA SUIÇA, 76;MARAPONGA;
2024;1;FORTALEZA;11186;FLAVIANA ABREU;116;384;;1;EM FRANCISCA FERNANDES MAGALHAES;RUA OLIVEIRA SOBRINHO, 1031;BONSUCESSO;
2024;1;FORTALEZA;11186;FLAVIANA ABREU;116;499;;1;EM RAIMUNDO MOREIRA SENA;RUA G, 93, CJ. NOVA RESIDENCIA;BOM JARDIM;
2024;1;FORTALEZA;11186;FLAVIANA ABREU;117;225;;1;EEFM SENADOR OSIRES PONTES;RUA DIVINA 150;SIQUEIRA;
2024;1;FORTALEZA;11186;FLAVIANA ABREU;118;55;;1;COLEGIO CONEXÃO SABER;RUA DOUTOR PEDRO SAMPAIO, 550;PASSARÉ;
2024;1;FORTALEZA;11186;FLAVIANA ABREU;118;213;;1;EEMTI INTEGRADA 2 DE MAIO;AVENIDA DA SAUDADE, S/N;PASSARÉ;
2024;1;FORTALEZA;11186;FLAVIANA ABREU;118;214;;1;EEMTI INTEGRADA 2 DE MAIO;AVENIDA DA SAUDADE, S/N;PASSARÉ;
2024;1;FORTALEZA;11186;FLAVIANA ABREU;118;216;;1;EEMTI INTEGRADA 2 DE MAIO;AVENIDA DA SAUDADE, S/N;PASSARÉ;
2024;1;FORTALEZA;11186;FLAVIANA ABREU;118;219;;1;EEMTI INTEGRADA 2 DE MAIO;AVENIDA DA SAUDADE, S/N;PASSARÉ;
2024;1;FORTALEZA;11186;FLAVIANA ABREU;118;319;;1;EM RAIMUNDO DE MOURA MATOS;AVENIDA DOIS DE MAIO, 1300;PASSARÉ;
2024;1;FORTALEZA;11186;FLAVIANA ABREU;118;420;;2;EM PROFESSORA MARIA JOSÉ MACÁRIO COELHO;AVENIDA PASSARÉ, 530;PASSARÉ;
2024;1;FORTALEZA;11186;FLAVIANA ABREU;118;470;;1;EM PROFESSORA MARIA JOSÉ MACÁRIO COELHO;AVENIDA PASSARÉ, 530;PASSARÉ;
2024;1;FORTALEZA;11186;FLAVIANA ABREU;118;615;;1;EM PROFESSORA MARIA JOSÉ MACÁRIO COELHO;AVENIDA PASSARÉ, 530;PASSARÉ;
TOTAL;;;;;;;;77;
