Ano;Turno;Município;Número;Candidato;Zona;Seção;Seções Agregadas;Votos;Local de Votação;Endereço Local de Votação;Bairro;
2024;1;FORTALEZA;20789;GABY TROPICAL;1;622;;1;EEFM - HELENITA MOTA;RUA AMANCIO FILOMENO,720;CAIS DO PORTO;
2024;1;FORTALEZA;20789;GABY TROPICAL;2;812;;1;EM PROF CLODOMIR TEOFILO GIRAO;TRAVESSA RUTILO, 108;MESSEJANA;
2024;1;FORTALEZA;20789;GABY TROPICAL;3;33;;1;SESC;RUA CLARINDO DE QUEIROZ, 1740;CENTRO;
2024;1;FORTALEZA;20789;GABY TROPICAL;3;111;;1;COLÉGIO ESTADUAL LICEU DO CEARÁ;PRAÇA GUSTAVO BARROSO, 01;JACARECANGA;
2024;1;FORTALEZA;20789;GABY TROPICAL;80;235;;1;EEFM NOEL HUGNEN OLIVEIRA PAIVA;RUA MONSENHOR SALAZAR 279;TAUAPE;
2024;1;FORTALEZA;20789;GABY TROPICAL;80;247;;1;EMEIF PROFª ANTONIETA CALS;RUA MONSENHOR SALAZAR 1480;TAUAPE;
2024;1;FORTALEZA;20789;GABY TROPICAL;80;376;;1;CENTRO DE DESENVOLVIMENTO SOCIAL SEMEANDO (ANTIGO EURICO BERGSTEN);RUA CRUZ ABREU 204;TAUAPE;
2024;1;FORTALEZA;20789;GABY TROPICAL;93;71;;2;EM JONATHAN DA ROCHA ALCOFORADO;RUA MARIA GOMES DE SÁ,1030 ARACAPÉ;MONDUBIM;
2024;1;FORTALEZA;20789;GABY TROPICAL;93;72;;1;EM JONATHAN DA ROCHA ALCOFORADO;RUA MARIA GOMES DE SÁ,1030 ARACAPÉ;MONDUBIM;
2024;1;FORTALEZA;20789;GABY TROPICAL;93;74;;2;EM JONATHAN DA ROCHA ALCOFORADO;RUA MARIA GOMES DE SÁ,1030 ARACAPÉ;MONDUBIM;
2024;1;FORTALEZA;20789;GABY TROPICAL;93;76;;1;EM JONATHAN DA ROCHA ALCOFORADO;RUA MARIA GOMES DE SÁ,1030 ARACAPÉ;MONDUBIM;
2024;1;FORTALEZA;20789;GABY TROPICAL;93;77;;1;EM JONATHAN DA ROCHA ALCOFORADO;RUA MARIA GOMES DE SÁ,1030 ARACAPÉ;MONDUBIM;
2024;1;FORTALEZA;20789;GABY TROPICAL;93;154;;1;EM NELSON MANDELA;AV. C, 435;PREFEITO JOSÉ WALTER;
2024;1;FORTALEZA;20789;GABY TROPICAL;93;178;;1;EEFM ESTADO DO MARANHAO;RUA CARLOS PIMENTA,506;MONDUBIM;
2024;1;FORTALEZA;20789;GABY TROPICAL;93;270;;2;EM JONATHAN DA ROCHA ALCOFORADO;RUA MARIA GOMES DE SÁ,1030 ARACAPÉ;MONDUBIM;
2024;1;FORTALEZA;20789;GABY TROPICAL;93;277;;1;CENTRO DE INCLUSÃO TECNOLÓGICA E SOCIAL - CITS JOSÉ WALTER;AV. K, 330, SEGUNDA ETAPA;PREFEITO JOSÉ WALTER;
2024;1;FORTALEZA;20789;GABY TROPICAL;93;283;;2;EM JONATHAN DA ROCHA ALCOFORADO;RUA MARIA GOMES DE SÁ,1030 ARACAPÉ;MONDUBIM;
2024;1;FORTALEZA;20789;GABY TROPICAL;93;295;;1;ESCOLA MUNICIPAL ARI DE SA CAVALCANTE (JOSÉ WALTER);AV. H, 430 III ETAPA;PREFEITO JOSÉ WALTER;
2024;1;FORTALEZA;20789;GABY TROPICAL;94;191;;1;EEFM DONA HILZA DIOGO DE OLIVEIRA;AV. DOM ALOÍSIO LORSCHEIDER, 1040 - VILA VELHA;VILA VELHA;
2024;1;FORTALEZA;20789;GABY TROPICAL;94;789;;1;EM ANTONIO CORREIA LIMA;RUA HERMES PARAYBA, 934;VILA VELHA;
2024;1;FORTALEZA;20789;GABY TROPICAL;94;793;;1;EM ANTONIO CORREIA LIMA;RUA HERMES PARAYBA, 934;VILA VELHA;
2024;1;FORTALEZA;20789;GABY TROPICAL;95;249;;1;EMEIEF OTAVIO DE FARIAS;RUA JOAO FERREIRA, S/N;BARROSO;
2024;1;FORTALEZA;20789;GABY TROPICAL;95;272;;1;EM SINÓ PINHEIRO;RUA 14, 151 (CJ JOAO PAULO II);BARROSO;
2024;1;FORTALEZA;20789;GABY TROPICAL;112;376;;1;FUNCAP;AV. OLIVEIRA PAIVA, 941;CIDADE DOS FUNCIONÁRIOS;
2024;1;FORTALEZA;20789;GABY TROPICAL;112;551;;1;CENTRO UNIVERSITÁRIO 7 DE SETEMBRO - UNI 7 (FA7);AV. ALMIRANTE MAXIMINIANO DA FONSECA, 1395;ENGENHEIRO LUCIANO CAVALCANTE;
2024;1;FORTALEZA;20789;GABY TROPICAL;113;338;;1;COLEGIO GRÃO SABER ( ANTIGO TOPO GIGIO);RUA PROFESSOR LINO DA ENCARNACAO, 490;PARQUELÂNDIA;
2024;1;FORTALEZA;20789;GABY TROPICAL;113;386;;1;ASSOCIAÇÃO DE PAIS E AMIGOS DO DEFICIENTE AUDITIVO - APADA;AV. BEZERRA DE MENEZES, 549;SÃO GERARDO;
2024;1;FORTALEZA;20789;GABY TROPICAL;114;311;;1;EM JESUS CRISTO;RUA ALBERTO FERREIRA, 564;JARDIM IRACEMA;
2024;1;FORTALEZA;20789;GABY TROPICAL;114;353;;1;EMTI ALDEMIR MARTINS;AV. FRANCISCO SÁ, 7460;BARRA DO CEARÁ;
2024;1;FORTALEZA;20789;GABY TROPICAL;115;403;;1;EEFM PROFESSOR MARIO SCHENBERG;RUA AMERICO ROCHA LIMA 835;MANOEL SÁTIRO;
2024;1;FORTALEZA;20789;GABY TROPICAL;115;439;;1;EM RAIMUNDO SOARES DE SOUSA;RUA COSTA FREIRE 550;VILA PERI;
2024;1;FORTALEZA;20789;GABY TROPICAL;115;446;;1;EM MARIA VIVIANE BENEVIDES GOUVEIA;RUA CREUZA ROQUE 247;MANOEL SÁTIRO;
2024;1;FORTALEZA;20789;GABY TROPICAL;115;457;;1;EM HENRIQUETA GALENO;RUA MAJOR MONTENEGRO 917;MANOEL SÁTIRO;
2024;1;FORTALEZA;20789;GABY TROPICAL;116;302;;1;EM CRESCER E APRENDER;RUA EDSON MARTINS, 642;BOM JARDIM;
2024;1;FORTALEZA;20789;GABY TROPICAL;116;305;;1;EM EDUCADOR PAULO FREIRE;RUA CORONEL FABRICIANO 452;GRANJA PORTUGAL;
2024;1;FORTALEZA;20789;GABY TROPICAL;117;153;;1;COLEGIO SANTA HELENA;AV CONTORNO NORTE 819;CONJUNTO ESPERANÇA;
2024;1;FORTALEZA;20789;GABY TROPICAL;117;156;;1;EEEP DARCY RIBEIRO;RUA CONEGO DE CASTRO, S/N;CONJUNTO ESPERANÇA;
2024;1;FORTALEZA;20789;GABY TROPICAL;117;166;;1;EEFM JULIA ALVES PESSOA;RUA SÃO FRANCISCO SN;BOM JARDIM;
2024;1;FORTALEZA;20789;GABY TROPICAL;117;167;;1;EEFM JULIA ALVES PESSOA;RUA SÃO FRANCISCO SN;BOM JARDIM;
2024;1;FORTALEZA;20789;GABY TROPICAL;117;202;;1;COLÉGIO CASTRO ALVES;RUA TULIPA NEGRA, 2319;PARQUE PRESIDENTE VARGAS;
2024;1;FORTALEZA;20789;GABY TROPICAL;117;258;;1;CEI FRANCISCA DE ABREU LIMA;RUA C -  ESQUINA COM A RUA LUIZ MONTENEGRO, S/N;SIQUEIRA;
2024;1;FORTALEZA;20789;GABY TROPICAL;117;289;;1;EM PADRE ANTONIO MONTEIRO DA CRUZ;RUA DE PEDESTRE XIII, 25 - JARDIM FLUMINENSE II;CANINDEZINHO;
2024;1;FORTALEZA;20789;GABY TROPICAL;117;370;;1;EMTI PROFESSORA MARIA JOSÉ FERREIRA GOMES;RUA CÔNEGO DE CASTRO, 8617;PARQUE PRESIDENTE VARGAS;
2024;1;FORTALEZA;20789;GABY TROPICAL;117;417;;1;COLÉGIO VIDA VIVA;RUA JOSÉ MARIA, 100;SIQUEIRA;
2024;1;FORTALEZA;20789;GABY TROPICAL;117;428;;1;EMEIF MARIA BEZERRA QUEVEDO;RUA 103, 28 - CJ. NOVO MONDUBIM;MANOEL SÁTIRO;
2024;1;FORTALEZA;20789;GABY TROPICAL;117;442;;2;EM JOSE MARIA MOREIRA CAMPOS;RUA FRANCISCO ALMEIDA, 525 CJ. APOLO XI;PARQUE PRESIDENTE VARGAS;
2024;1;FORTALEZA;20789;GABY TROPICAL;118;563;;1;COLÉGIO CONECTIVO;RUA GENERAL ONOFRE, 445;MONDUBIM;
2024;1;FORTALEZA;20789;GABY TROPICAL;118;666;;1;EM PAULO SERGIO DE SOUSA LIRA;RUA ITABORAÍ, 264;PASSARÉ;
TOTAL;;;;;;;;53;
