Ano;Turno;Município;Número;Candidato;Zona;Seção;Seções Agregadas;Votos;Local de Votação;Endereço Local de Votação;Bairro;
2024;1;FORTALEZA;15666;JAIR DO POSTO;1;395;;1;CIES AIDA SANTOS;AVENIDA TRAJANO DE MEDEIROS  813;VICENTE PINZON;
2024;1;FORTALEZA;15666;JAIR DO POSTO;1;471;;1;ESCOLA ESTADUAL MARIA JOSE MEDEIROS;RUA DESEMBARGADOR LAURO NOGUEIRA 1240;PAPICU;
2024;1;FORTALEZA;15666;JAIR DO POSTO;1;526;;1;ESCOLA MUNICIPAL COLONIA Z-8;RUA MANOEL JESUINO,370;VARJOTA;
2024;1;FORTALEZA;15666;JAIR DO POSTO;1;589;;1;ESCOLA PROFISSIONAL MARIA ANGELA DA SILVEIRA BORGES;RUA PINTOR ANTONIO BANDEIRA, S/N;VICENTE PINZON;
2024;1;FORTALEZA;15666;JAIR DO POSTO;1;619;;1;UNINTA - FACULDADE UNINTA FORTALEZA;RUA VILEBALDO AGUIAR,133;COCÓ;
2024;1;FORTALEZA;15666;JAIR DO POSTO;1;685;;1;ESCOLA MUNICIPAL PROF BELARMINA CAMPOS;RUA MANOEL RODRIGUES MONTEIRO, 840;VICENTE PINZON;
2024;1;FORTALEZA;15666;JAIR DO POSTO;1;717;;1;CIES AIDA SANTOS;AVENIDA TRAJANO DE MEDEIROS  813;VICENTE PINZON;
2024;1;FORTALEZA;15666;JAIR DO POSTO;1;763;;1;ESCOLA MUNICIPAL FREI TITO DE ALENCAR LIMA;AVENIDA DIOGUINHO 5927;VICENTE PINZON;
2024;1;FORTALEZA;15666;JAIR DO POSTO;1;770;;1;ESCOLA ESTADUAL ARQUITETO ROGERIO FROES;AVENIDA DAS GRAVIOLAS 1000;CIDADE 2000;
2024;1;FORTALEZA;15666;JAIR DO POSTO;1;827;;1;ESCOLA MUNICIPAL PROF BELARMINA CAMPOS;RUA MANOEL RODRIGUES MONTEIRO, 840;VICENTE PINZON;
2024;1;FORTALEZA;15666;JAIR DO POSTO;1;874;;1;ESCOLA PROFISSIONAL MARIA ANGELA DA SILVEIRA BORGES;RUA PINTOR ANTONIO BANDEIRA, S/N;VICENTE PINZON;
2024;1;FORTALEZA;15666;JAIR DO POSTO;1;882;;3;COLEGIO ARI DE SA - MONSENHOR CATAO;RUA MONSENHOR CATAO, 1655;ALDEOTA;
2024;1;FORTALEZA;15666;JAIR DO POSTO;1;924;;1;UNINTA - FACULDADE UNINTA FORTALEZA;RUA VILEBALDO AGUIAR,133;COCÓ;
2024;1;FORTALEZA;15666;JAIR DO POSTO;2;120;;1;EEEP COMENDADOR MIGUEL GURGEL;RUA JOSE BAIMA, S/N;GUAJERU;
2024;1;FORTALEZA;15666;JAIR DO POSTO;2;127;;1;EM PROFª TELINA BARBOSA DA  COSTA;RUA PERGENTINO MAIA, 811;MESSEJANA;
2024;1;FORTALEZA;15666;JAIR DO POSTO;2;160;;1;INSTITUTO FREI JOAO PEDRO DE SEXTO;AVENIDA FREI CIRILO, 4241;MESSEJANA;
2024;1;FORTALEZA;15666;JAIR DO POSTO;2;172;;2;PAROQUIA NOSSA SENHORA DA CONCEICAO;RUA JOAQUIM BEZERRA 255;MESSEJANA;
2024;1;FORTALEZA;15666;JAIR DO POSTO;2;390;;1;EEEP JOSE DE BARCELOS;RUA ANGELICA GURGEL 362;MESSEJANA;
2024;1;FORTALEZA;15666;JAIR DO POSTO;2;417;;1;EEEP COMENDADOR MIGUEL GURGEL;RUA JOSE BAIMA, S/N;GUAJERU;
2024;1;FORTALEZA;15666;JAIR DO POSTO;2;418;;1;EEFM JOSE DE ALENCAR;RUA VENEZA, 84;MESSEJANA;
2024;1;FORTALEZA;15666;JAIR DO POSTO;2;419;;1;EMEIF MOREIRA DA ROCHA;AV ODILON GUIMARAES, 3860;LAGOA REDONDA;
2024;1;FORTALEZA;15666;JAIR DO POSTO;2;435;;1;EEFM JOSE DE ALENCAR;RUA VENEZA, 84;MESSEJANA;
2024;1;FORTALEZA;15666;JAIR DO POSTO;2;490;;1;EEFM JOSE DE ALENCAR;RUA VENEZA, 84;MESSEJANA;
2024;1;FORTALEZA;15666;JAIR DO POSTO;2;539;;1;EEFM JOSE DE ALENCAR;RUA VENEZA, 84;MESSEJANA;
2024;1;FORTALEZA;15666;JAIR DO POSTO;2;552;;1;EM PROFª FERNANDA MARIA DE ALENCAR COLARES;AV PROF. ARTHUR DE CARVALHO, 1540;LAGOA REDONDA;
2024;1;FORTALEZA;15666;JAIR DO POSTO;2;641;;1;CMES PROFª TEREZINHA FERREIRA PARENTE;RUA NELSON COELHO, 209;LAGOA REDONDA;
2024;1;FORTALEZA;15666;JAIR DO POSTO;2;666;;1;EM PROFª FERNANDA MARIA DE ALENCAR COLARES;AV PROF. ARTHUR DE CARVALHO, 1540;LAGOA REDONDA;
2024;1;FORTALEZA;15666;JAIR DO POSTO;2;669;;1;EEFM JOSE DE ALENCAR;RUA VENEZA, 84;MESSEJANA;
2024;1;FORTALEZA;15666;JAIR DO POSTO;2;670;;1;CMES PROFª TEREZINHA FERREIRA PARENTE;RUA NELSON COELHO, 209;LAGOA REDONDA;
2024;1;FORTALEZA;15666;JAIR DO POSTO;2;680;;1;EM PROFª FERNANDA MARIA DE ALENCAR COLARES;AV PROF. ARTHUR DE CARVALHO, 1540;LAGOA REDONDA;
2024;1;FORTALEZA;15666;JAIR DO POSTO;2;686;;1;CMES PROFª TEREZINHA FERREIRA PARENTE;RUA NELSON COELHO, 209;LAGOA REDONDA;
2024;1;FORTALEZA;15666;JAIR DO POSTO;2;694;;1;CMES PROFª TEREZINHA FERREIRA PARENTE;RUA NELSON COELHO, 209;LAGOA REDONDA;
2024;1;FORTALEZA;15666;JAIR DO POSTO;2;696;;2;SECRETARIA DA EDUCACAO - CAMBEBA;AVENIDA MINISTRO JOSE AMERICO, SN;CAMBEBA;
2024;1;FORTALEZA;15666;JAIR DO POSTO;2;700;;1;COLÉGIO SERAFICO NOSSA SENHORA DO BRASIL;AVENIDA FREI CIRILO 4454;MESSEJANA;
2024;1;FORTALEZA;15666;JAIR DO POSTO;2;715;;1;CMES PROFª TEREZINHA FERREIRA PARENTE;RUA NELSON COELHO, 209;LAGOA REDONDA;
2024;1;FORTALEZA;15666;JAIR DO POSTO;2;716;;1;EEFM GOV LUIZ DE GONZAGA FONSECA MOTA;RUA SANTA ROSA, 407;COAÇU;
2024;1;FORTALEZA;15666;JAIR DO POSTO;2;729;;1;SECRETARIA DA EDUCACAO - CAMBEBA;AVENIDA MINISTRO JOSE AMERICO, SN;CAMBEBA;
2024;1;FORTALEZA;15666;JAIR DO POSTO;2;732;;2;CMES PROFª TEREZINHA FERREIRA PARENTE;RUA NELSON COELHO, 209;LAGOA REDONDA;
2024;1;FORTALEZA;15666;JAIR DO POSTO;2;755;;1;FACULDADE ATENEU DO CEARÁ;AV. COLETOR ANTONIO GADELHA, 621;MESSEJANA;
2024;1;FORTALEZA;15666;JAIR DO POSTO;2;763;;1;CMES PROFª TEREZINHA FERREIRA PARENTE;RUA NELSON COELHO, 209;LAGOA REDONDA;
2024;1;FORTALEZA;15666;JAIR DO POSTO;2;764;;1;EMEIF DEMOCRITO ROCHA;RUA PADRE PEDRO DE ALENCAR, 2012;MESSEJANA;
2024;1;FORTALEZA;15666;JAIR DO POSTO;2;776;;1;EM PROFª FERNANDA MARIA DE ALENCAR COLARES;AV PROF. ARTHUR DE CARVALHO, 1540;LAGOA REDONDA;
2024;1;FORTALEZA;15666;JAIR DO POSTO;2;782;;1;EM PROF CLODOMIR TEOFILO GIRAO;TRAVESSA RUTILO, 108;MESSEJANA;
2024;1;FORTALEZA;15666;JAIR DO POSTO;2;784;;1;COLÉGIO CHRISTUS SUL;AV. ENG. LEAL LIMA VERDE, 2265;JOSÉ DE ALENCAR;
2024;1;FORTALEZA;15666;JAIR DO POSTO;2;792;;2;ESCOLA MUNICIPAL ISABEL FERREIRA;RUA ISABEL FERREIRA, 1000 - CONJ. CURIÓ;LAGOA REDONDA;
2024;1;FORTALEZA;15666;JAIR DO POSTO;2;806;;1;ESCOLA MUNICIPAL ISABEL FERREIRA;RUA ISABEL FERREIRA, 1000 - CONJ. CURIÓ;LAGOA REDONDA;
2024;1;FORTALEZA;15666;JAIR DO POSTO;2;809;;2;SECRETARIA DA EDUCACAO - CAMBEBA;AVENIDA MINISTRO JOSE AMERICO, SN;CAMBEBA;
2024;1;FORTALEZA;15666;JAIR DO POSTO;2;816;;1;FACULDADE ATENEU DO CEARÁ;AV. COLETOR ANTONIO GADELHA, 621;MESSEJANA;
2024;1;FORTALEZA;15666;JAIR DO POSTO;2;826;;1;FACULDADE ATENEU DO CEARÁ;AV. COLETOR ANTONIO GADELHA, 621;MESSEJANA;
2024;1;FORTALEZA;15666;JAIR DO POSTO;2;828;;1;ESCOLA MUNICIPAL ISABEL FERREIRA;RUA ISABEL FERREIRA, 1000 - CONJ. CURIÓ;LAGOA REDONDA;
2024;1;FORTALEZA;15666;JAIR DO POSTO;2;831;;2;COLÉGIO CHRISTUS SUL;AV. ENG. LEAL LIMA VERDE, 2265;JOSÉ DE ALENCAR;
2024;1;FORTALEZA;15666;JAIR DO POSTO;3;31;;1;SESC;RUA CLARINDO DE QUEIROZ, 1740;CENTRO;
2024;1;FORTALEZA;15666;JAIR DO POSTO;3;117;27;1;SENAI - UNIDADE JACARECANGA;AV. PADRE IBIAPINA, 1280;JACARECANGA;
2024;1;FORTALEZA;15666;JAIR DO POSTO;3;240;295;1;COLÉGIO ESTADUAL JUSTINIANO DE SERPA;AV. SANTOS DUMONT, 56;CENTRO;
2024;1;FORTALEZA;15666;JAIR DO POSTO;3;290;293;1;COLÉGIO ESTADUAL JUSTINIANO DE SERPA;AV. SANTOS DUMONT, 56;CENTRO;
2024;1;FORTALEZA;15666;JAIR DO POSTO;3;403;;1;COLÉGIO CHRISTUS (AV. BARÃO DE STUDART);RUA JOÃO CARVALHO, 630;ALDEOTA;
2024;1;FORTALEZA;15666;JAIR DO POSTO;3;426;;1;FACULDADE ARI DE SÁ;AV. HERÁCLITO GRAÇA, 826;CENTRO;
2024;1;FORTALEZA;15666;JAIR DO POSTO;3;481;;1;COLÉGIO ANTARES (PRAIA DE IRACEMA);RUA HISTORIADOR GUARINO ALVES, 95;PRAIA DE IRACEMA;
2024;1;FORTALEZA;15666;JAIR DO POSTO;3;540;;1;FACULDADE ARI DE SÁ;AV. HERÁCLITO GRAÇA, 826;CENTRO;
2024;1;FORTALEZA;15666;JAIR DO POSTO;3;565;;1;EM JOSÉ DIAS MACEDO;RUA NUNES VALENTE, 809;MEIRELES;
2024;1;FORTALEZA;15666;JAIR DO POSTO;3;582;;1;ESCOLA DE SAÚDE PÚBLICA DO CEARÁ;AV. ANTÔNIO JUSTA, 3161;MEIRELES;
2024;1;FORTALEZA;15666;JAIR DO POSTO;80;114;;1;EEM YOLANDA QUEIROZ;AV. GAL. MURILO BORGES, 864;ALTO DA BALANÇA;
2024;1;FORTALEZA;15666;JAIR DO POSTO;80;121;;1;EEFM ESTADO DO PARÁ;RUA DJALMA PETIT 589;ALTO DA BALANÇA;
2024;1;FORTALEZA;15666;JAIR DO POSTO;80;122;;2;EEFM ESTADO DO PARÁ;RUA DJALMA PETIT 589;ALTO DA BALANÇA;
2024;1;FORTALEZA;15666;JAIR DO POSTO;80;124;;1;EEFM ESTADO DO PARÁ;RUA DJALMA PETIT 589;ALTO DA BALANÇA;
2024;1;FORTALEZA;15666;JAIR DO POSTO;80;125;;1;EEFM ESTADO DO PARÁ;RUA DJALMA PETIT 589;ALTO DA BALANÇA;
2024;1;FORTALEZA;15666;JAIR DO POSTO;80;127;;2;EEFM ESTADO DO PARÁ;RUA DJALMA PETIT 589;ALTO DA BALANÇA;
2024;1;FORTALEZA;15666;JAIR DO POSTO;80;143;;1;COLÉGIO MONSENHOR JOVINIANO BARRETO - INFANTIL;RUA FREI VIDAL, 1680;TAUAPE;
2024;1;FORTALEZA;15666;JAIR DO POSTO;80;144;;1;COLÉGIO MONSENHOR JOVINIANO BARRETO - INFANTIL;RUA FREI VIDAL, 1680;TAUAPE;
2024;1;FORTALEZA;15666;JAIR DO POSTO;80;163;;1;AABB - ASSOCIAÇÃO ATLÉTICA BANCO DO BRASIL;AV BARAO DE STUDART, 2917;DIONISIO TORRES;
2024;1;FORTALEZA;15666;JAIR DO POSTO;80;166;;1;COLÉGIO MONSENHOR JOVINIANO BARRETO;RUA FREI VIDAL 1621;TAUAPE;
2024;1;FORTALEZA;15666;JAIR DO POSTO;80;172;;1;COLÉGIO MONSENHOR JOVINIANO BARRETO - INFANTIL;RUA FREI VIDAL, 1680;TAUAPE;
2024;1;FORTALEZA;15666;JAIR DO POSTO;80;197;;1;EEFM PROFª  MARIA CONCEICÃO PORFÍRIO TELES;RUA MONTE CRISTO, 177;AEROLÂNDIA;
2024;1;FORTALEZA;15666;JAIR DO POSTO;80;204;;1;UAPS CESAR CALS DE OLIVEIRA;RUA CAPITÃO ARAGÃO 555;ALTO DA BALANÇA;
2024;1;FORTALEZA;15666;JAIR DO POSTO;80;222;;1;EEFM PADRE ROCHA;RUA CEL ALVES TEIXEIRA 525;JOAQUIM TÁVORA;
2024;1;FORTALEZA;15666;JAIR DO POSTO;80;224;;1;EEFM PADRE ROCHA;RUA CEL ALVES TEIXEIRA 525;JOAQUIM TÁVORA;
2024;1;FORTALEZA;15666;JAIR DO POSTO;80;231;;2;EMEIF PROFª ANTONIETA CALS;RUA MONSENHOR SALAZAR 1480;TAUAPE;
2024;1;FORTALEZA;15666;JAIR DO POSTO;80;235;;1;EEFM NOEL HUGNEN OLIVEIRA PAIVA;RUA MONSENHOR SALAZAR 279;TAUAPE;
2024;1;FORTALEZA;15666;JAIR DO POSTO;80;256;257;1;SALÃO PAROQUIAL SÃO JOAO DO TAUAPE;RUA MONSENHOR SALAZAR, 279;TAUAPE;
2024;1;FORTALEZA;15666;JAIR DO POSTO;80;269;;1;FACULDADE MAURÍCIO DE NASSAU;AVENIDA VISCONDE DO RIO BRANCO, 2078;JOSÉ BONIFÁCIO;
2024;1;FORTALEZA;15666;JAIR DO POSTO;80;291;;1;ESCOLA MUNICIPAL PAPA JOÃO XXIII;AV TREZE DE ABRIL, 545;VILA UNIÃO;
2024;1;FORTALEZA;15666;JAIR DO POSTO;80;299;;1;IGREJA MATRIZ DA AEROLÂNDIA - PARÓQUIA N. SRA DO SAGRADO CORAÇÃO;RUA ASPIRANTE MENDES, 540;AEROLÂNDIA;
2024;1;FORTALEZA;15666;JAIR DO POSTO;80;305;;1;ASSEMBLÉIA LEGISLATIVA - UNIVERSIDADE DO PARLAMENTO CEARENSE;RUA BARBOSA DE FREITAS, 2674;DIONISIO TORRES;
2024;1;FORTALEZA;15666;JAIR DO POSTO;80;319;;1;COLÉGIO SANTO INACIO;AVENIDA DESEMBARGADOR MOREIRA 2355;DIONISIO TORRES;
2024;1;FORTALEZA;15666;JAIR DO POSTO;80;321;;1;COLÉGIO SANTO INACIO;AVENIDA DESEMBARGADOR MOREIRA 2355;DIONISIO TORRES;
2024;1;FORTALEZA;15666;JAIR DO POSTO;80;328;;1;COLÉGIO ANTARES IRMÃ MARIA (ANTIGO IRMÃ MARIA MONTENEGRO);RUA PINHO PESSOA 681;JOAQUIM TÁVORA;
2024;1;FORTALEZA;15666;JAIR DO POSTO;80;330;;1;COLÉGIO ANTARES IRMÃ MARIA (ANTIGO IRMÃ MARIA MONTENEGRO);RUA PINHO PESSOA 681;JOAQUIM TÁVORA;
2024;1;FORTALEZA;15666;JAIR DO POSTO;80;334;;1;COLÉGIO ANTARES IRMÃ MARIA (ANTIGO IRMÃ MARIA MONTENEGRO);RUA PINHO PESSOA 681;JOAQUIM TÁVORA;
2024;1;FORTALEZA;15666;JAIR DO POSTO;80;348;;1;COLÉGIO SALESIANO DOM BOSCO;AV ANTONIO SALES 116;JOAQUIM TÁVORA;
2024;1;FORTALEZA;15666;JAIR DO POSTO;80;356;;2;EMEIF ALMERINDA DE ALBUQUERQUE;RUA ANA GONCALVES 1105;TAUAPE;
2024;1;FORTALEZA;15666;JAIR DO POSTO;80;360;;1;EMEIF ALMERINDA DE ALBUQUERQUE;RUA ANA GONCALVES 1105;TAUAPE;
2024;1;FORTALEZA;15666;JAIR DO POSTO;80;376;;1;CENTRO DE DESENVOLVIMENTO SOCIAL SEMEANDO (ANTIGO EURICO BERGSTEN);RUA CRUZ ABREU 204;TAUAPE;
2024;1;FORTALEZA;15666;JAIR DO POSTO;80;392;;1;EEM GOV. ADAUTO BEZERRA;RUA MONSENHOR LIBERATO, 1850;FÁTIMA;
2024;1;FORTALEZA;15666;JAIR DO POSTO;80;411;;2;SALÃO PAROQUIAL SÃO JOAO DO TAUAPE;RUA MONSENHOR SALAZAR, 279;TAUAPE;
2024;1;FORTALEZA;15666;JAIR DO POSTO;80;428;;1;EMEIF ALMERINDA DE ALBUQUERQUE;RUA ANA GONCALVES 1105;TAUAPE;
2024;1;FORTALEZA;15666;JAIR DO POSTO;80;438;;1;IGREJA MATRIZ DA AEROLÂNDIA - PARÓQUIA N. SRA DO SAGRADO CORAÇÃO;RUA ASPIRANTE MENDES, 540;AEROLÂNDIA;
2024;1;FORTALEZA;15666;JAIR DO POSTO;82;185;;1;ESCOLA MUNICIPAL LENIRA JUREMA DE MAGALHÃES - EI/EF;RUA TEÓFILO GURGEL, 111;MONTE CASTELO;
2024;1;FORTALEZA;15666;JAIR DO POSTO;82;475;;1;CEJA PAULO FREIRE;RUA OLAVO BILAC, 1300;SÃO GERARDO;
2024;1;FORTALEZA;15666;JAIR DO POSTO;82;676;;1;ESCOLA MUNICIPAL ALDEIDES REGIS - EI/EF;RUA IRINEU DE SOUSA, 197;ÁLVARO WEYNE;
2024;1;FORTALEZA;15666;JAIR DO POSTO;83;88;;1;ESCOLA MUNICIPAL SANTA MARIA;RUA CUIABÁ 1465;HENRIQUE JORGE;
2024;1;FORTALEZA;15666;JAIR DO POSTO;83;94;;1;EEM  MARIANO MARTINS;AVENIDA SENADOR FERNANDES TÁVORA 1445;HENRIQUE JORGE;
2024;1;FORTALEZA;15666;JAIR DO POSTO;83;98;;1;EEM  MARIANO MARTINS;AVENIDA SENADOR FERNANDES TÁVORA 1445;HENRIQUE JORGE;
2024;1;FORTALEZA;15666;JAIR DO POSTO;83;123;;2;EEEP JÚLIA GIFFONI;RUA CORONEL MATOS DOURADO 1349;PICI;
2024;1;FORTALEZA;15666;JAIR DO POSTO;83;234;;2;ESCOLA MUNICIPAL JOSÉ BATISTA DE OLIVEIRA;RUA GOIÁS 620;PANAMERICANO;
2024;1;FORTALEZA;15666;JAIR DO POSTO;83;419;;1;CENTRO EDUCACIONAL SÃO SEBASTIÃO;RUA GUANABARA 1003;DEMOCRITO ROCHA;
2024;1;FORTALEZA;15666;JAIR DO POSTO;83;463;;1;ESCOLA MUNICIPAL JOSÉ BATISTA DE OLIVEIRA;RUA GOIÁS 620;PANAMERICANO;
2024;1;FORTALEZA;15666;JAIR DO POSTO;83;502;;1;ESCOLA MUNICIPAL JOSÉ BONIFÁCIO DE SOUSA;RUA PERNAMBUCO 600;DEMOCRITO ROCHA;
2024;1;FORTALEZA;15666;JAIR DO POSTO;83;611;;1;ESCOLA MUNICIPAL PAULO SARASATE;RUA PEDRO MUNIZ 250;DEMOCRITO ROCHA;
2024;1;FORTALEZA;15666;JAIR DO POSTO;83;687;;1;EEEP JÚLIA GIFFONI;RUA CORONEL MATOS DOURADO 1349;PICI;
2024;1;FORTALEZA;15666;JAIR DO POSTO;83;702;;1;EEEP JÚLIA GIFFONI;RUA CORONEL MATOS DOURADO 1349;PICI;
2024;1;FORTALEZA;15666;JAIR DO POSTO;83;707;;1;EEMTI ANTONIETA SIQUEIRA;RUA GUARANI 04;HENRIQUE JORGE;
2024;1;FORTALEZA;15666;JAIR DO POSTO;83;710;;1;ESCOLA MUNICIPAL ADROALDO TEIXEIRA CASTELO;RUA ALAGOAS 2267;PICI;
2024;1;FORTALEZA;15666;JAIR DO POSTO;83;722;;1;EEEP JÚLIA GIFFONI;RUA CORONEL MATOS DOURADO 1349;PICI;
2024;1;FORTALEZA;15666;JAIR DO POSTO;83;734;;1;EEEP JÚLIA GIFFONI;RUA CORONEL MATOS DOURADO 1349;PICI;
2024;1;FORTALEZA;15666;JAIR DO POSTO;83;772;;2;EEMTI PROFESSOR PAULO FREIRE;AVENIDA SENADOR FERNANDES TÁVORA 1936;HENRIQUE JORGE;
2024;1;FORTALEZA;15666;JAIR DO POSTO;85;201;;1;EMEIF EDILSON BRASIL SOAREZ - UV 3;RUA 303D, N 67, 2 ETAPA;CONJUNTO CEARÁ I;
2024;1;FORTALEZA;15666;JAIR DO POSTO;85;205;;1;ESCOLA MUNICIPAL PROF AMERICO BARREIRA;RUA RICARDO PONTES 529;GENIBAÚ;
2024;1;FORTALEZA;15666;JAIR DO POSTO;85;206;;1;ESCOLA MUNICIPAL PROF AMERICO BARREIRA;RUA RICARDO PONTES 529;GENIBAÚ;
2024;1;FORTALEZA;15666;JAIR DO POSTO;85;223;;2;EEFM MARIA ANTONIETA NUNES - UV 9;RUA 916 SN 4 ETAPA;CONJUNTO CEARÁ I;
2024;1;FORTALEZA;15666;JAIR DO POSTO;85;282;;1;EEFM PROF. EDMILSON GUIMARAES DE ALMEIDA UV 10;RUA 1074 S/N (PROX. HOSPITAL), 4 ETAPA;CONJUNTO CEARÁ I;
2024;1;FORTALEZA;15666;JAIR DO POSTO;85;362;;1;EEFM AYRTON SENNA DA SILVA;RUA MANAUS, 855;DOM LUSTOSA;
2024;1;FORTALEZA;15666;JAIR DO POSTO;85;388;;1;EEFM MARIA ANTONIETA NUNES - UV 9;RUA 916 SN 4 ETAPA;CONJUNTO CEARÁ I;
2024;1;FORTALEZA;15666;JAIR DO POSTO;93;74;;1;EM JONATHAN DA ROCHA ALCOFORADO;RUA MARIA GOMES DE SÁ,1030 ARACAPÉ;MONDUBIM;
2024;1;FORTALEZA;15666;JAIR DO POSTO;93;85;;1;EM RACHEL DE QUEIROZ;AVENIDA C, S/N - II ETAPA;PREFEITO JOSÉ WALTER;
2024;1;FORTALEZA;15666;JAIR DO POSTO;93;87;;1;EM RACHEL DE QUEIROZ;AVENIDA C, S/N - II ETAPA;PREFEITO JOSÉ WALTER;
2024;1;FORTALEZA;15666;JAIR DO POSTO;93;95;;1;CEI ROGACIANO LEITE;AVENIDA J, 1488 - III ETAPA;PREFEITO JOSÉ WALTER;
2024;1;FORTALEZA;15666;JAIR DO POSTO;93;105;;1;EM OSMIRIO DE OLIVEIRA BARRETO;RUA 10, S/N (CJ SITIO DO CÓRREGO);MONDUBIM;
2024;1;FORTALEZA;15666;JAIR DO POSTO;93;193;;1;EM MARIA ZELIA CORREIA DE SOUSA;RUA ANTONIO PEREIRA,1495;PLANALTO AYRTON SENNA;
2024;1;FORTALEZA;15666;JAIR DO POSTO;93;228;;1;EEEP PROFESSOR OTAVIO TERCEIRO DE FARIAS;AVENIDA C, 435;PREFEITO JOSÉ WALTER;
2024;1;FORTALEZA;15666;JAIR DO POSTO;93;258;;1;EM FRANCISCO NUNES CAVALCANTE;RUA POETA MÁRIO LINHARES, 561;PREFEITO JOSÉ WALTER;
2024;1;FORTALEZA;15666;JAIR DO POSTO;94;200;;1;EEFM DONA HILZA DIOGO DE OLIVEIRA;AV. DOM ALOÍSIO LORSCHEIDER, 1040 - VILA VELHA;VILA VELHA;
2024;1;FORTALEZA;15666;JAIR DO POSTO;94;203;;1;EMTI DEPUTADO ROBERTO MESQUITA;R. BETA,  SN;VILA VELHA;
2024;1;FORTALEZA;15666;JAIR DO POSTO;94;205;;1;EMTI DEPUTADO ROBERTO MESQUITA;R. BETA,  SN;VILA VELHA;
2024;1;FORTALEZA;15666;JAIR DO POSTO;94;326;;1;COLEGIO SALOME BASTOS;RUA DESEMBARGADOR HERMES PARAHYBA 1120;VILA VELHA;
2024;1;FORTALEZA;15666;JAIR DO POSTO;94;721;;1;EEFM DEP FCO DE ALMEIDA MONTE;AV. CORONEL CARVALHO 2400;JARDIM IRACEMA;
2024;1;FORTALEZA;15666;JAIR DO POSTO;94;774;;1;ASSOC DOS MORADORES DO CONJ DOS BANCARIOS;RUA 27 1630;VILA VELHA;
2024;1;FORTALEZA;15666;JAIR DO POSTO;94;806;;1;COLÉGIO CIENTISTA;RUA 31, 330 - CONJUNTO POLAR;VILA VELHA;
2024;1;FORTALEZA;15666;JAIR DO POSTO;94;814;;1;EMTI DEPUTADO ROBERTO MESQUITA;R. BETA,  SN;VILA VELHA;
2024;1;FORTALEZA;15666;JAIR DO POSTO;94;815;;1;COLÉGIO CÍCERO NOGUEIRA (CCN);RUA PARAMBU, 668;VILA VELHA;
2024;1;FORTALEZA;15666;JAIR DO POSTO;94;817;;1;EMEIF FRANCISCO EDILSON PINHEIRO;RUA N, 35;VILA VELHA;
2024;1;FORTALEZA;15666;JAIR DO POSTO;94;824;;1;COLÉGIO CIENTISTA;RUA 31, 330 - CONJUNTO POLAR;VILA VELHA;
2024;1;FORTALEZA;15666;JAIR DO POSTO;94;826;;1;EMEIF HERONDINA LIMA CAVALCANTE;AV. AMBIENTALISTA ARY THIERS, 310;VILA VELHA;
2024;1;FORTALEZA;15666;JAIR DO POSTO;94;851;;1;ASSOC DOS MORADORES DO CONJ DOS BANCARIOS;RUA 27 1630;VILA VELHA;
2024;1;FORTALEZA;15666;JAIR DO POSTO;94;893;;1;EEMTI MONSENHOR DOURADO;AVENIDA SARGENTO HERMÍNIO SAMPAIO 4600;PADRE ANDRADE;
2024;1;FORTALEZA;15666;JAIR DO POSTO;94;904;;1;COLEGIO DOM FELIPE - JUNIOR;RUA FRANCISCO MENDES DE OLIVEIRA, 183;QUINTINO CUNHA;
2024;1;FORTALEZA;15666;JAIR DO POSTO;94;930;;1;EMTI DEPUTADO ROBERTO MESQUITA;R. BETA,  SN;VILA VELHA;
2024;1;FORTALEZA;15666;JAIR DO POSTO;94;932;;1;COLÉGIO DOM FELIPE;AV INDEPENDÊNCIA. 1652;QUINTINO CUNHA;
2024;1;FORTALEZA;15666;JAIR DO POSTO;95;96;;1;EEFM DOUTORA ALDACI BARBOSA;RUA VALPARAISO, 155;CONJUNTO PALMEIRAS;
2024;1;FORTALEZA;15666;JAIR DO POSTO;95;97;;1;EEFM DOUTORA ALDACI BARBOSA;RUA VALPARAISO, 155;CONJUNTO PALMEIRAS;
2024;1;FORTALEZA;15666;JAIR DO POSTO;95;126;;1;EMEIEF LIONS CLUBE FORTALEZA FÁTIMA;TRAVESSA LIONS CLUBE, 141;JANGURUSSU;
2024;1;FORTALEZA;15666;JAIR DO POSTO;95;127;;1;EM PROFESSOR FRANCISCO DE MELO JABORANDI;AV. GOVERNADOR LEONEL BRIZOLA, 198;JANGURUSSU;
2024;1;FORTALEZA;15666;JAIR DO POSTO;95;130;;1;EM PROFESSOR FRANCISCO DE MELO JABORANDI;AV. GOVERNADOR LEONEL BRIZOLA, 198;JANGURUSSU;
2024;1;FORTALEZA;15666;JAIR DO POSTO;95;181;;1;DNIT;RODOVIA BR-116, KM 06;CAJAZEIRAS;
2024;1;FORTALEZA;15666;JAIR DO POSTO;95;184;;1;DNIT;RODOVIA BR-116, KM 06;CAJAZEIRAS;
2024;1;FORTALEZA;15666;JAIR DO POSTO;95;187;;1;DNIT;RODOVIA BR-116, KM 06;CAJAZEIRAS;
2024;1;FORTALEZA;15666;JAIR DO POSTO;95;196;;1;EM TRISTÃO DE ALENCAR;RUA JOSE NOGUEIRA, 69;PEDRAS;
2024;1;FORTALEZA;15666;JAIR DO POSTO;95;197;;1;EM TRISTÃO DE ALENCAR;RUA JOSE NOGUEIRA, 69;PEDRAS;
2024;1;FORTALEZA;15666;JAIR DO POSTO;95;198;;1;EM TRISTÃO DE ALENCAR;RUA JOSE NOGUEIRA, 69;PEDRAS;
2024;1;FORTALEZA;15666;JAIR DO POSTO;95;199;;1;EM TRISTÃO DE ALENCAR;RUA JOSE NOGUEIRA, 69;PEDRAS;
2024;1;FORTALEZA;15666;JAIR DO POSTO;95;201;;1;EM TRISTÃO DE ALENCAR;RUA JOSE NOGUEIRA, 69;PEDRAS;
2024;1;FORTALEZA;15666;JAIR DO POSTO;95;203;;2;EEEP MÁRIO ALENCAR;RUA VERDE 44, 97 (CJ. SÍTIO SÃO JOÃO);JANGURUSSU;
2024;1;FORTALEZA;15666;JAIR DO POSTO;95;208;;1;EEFM ALMIRANTE TAMANDARÉ;RUA DO MANDACARU, 1048 CJ ALMIRANTE TAMANDARÉ;JANGURUSSU;
2024;1;FORTALEZA;15666;JAIR DO POSTO;95;212;;1;EMEIEF CÉSAR CALS DE OLIVEIRA NETO;RUA OLIMPIO RIBEIRO, 20;CONJUNTO PALMEIRAS;
2024;1;FORTALEZA;15666;JAIR DO POSTO;95;237;;1;EMEIEF TAÍS MARIA BEZERRA NOGUEIRA;AV. GOVERNADOR LEONEL BRIZOLA, 710;JANGURUSSU;
2024;1;FORTALEZA;15666;JAIR DO POSTO;95;242;;1;EMEIEF TAÍS MARIA BEZERRA NOGUEIRA;AV. GOVERNADOR LEONEL BRIZOLA, 710;JANGURUSSU;
2024;1;FORTALEZA;15666;JAIR DO POSTO;95;247;;1;CITS - CENTRO DE INCLUSÃO TECNOLÓGICA E SOCIAL;RUA L, 20, CONJUNTO JOÃO PAULO II;JANGURUSSU;
2024;1;FORTALEZA;15666;JAIR DO POSTO;95;267;;1;EEFM PROF. PAULO AYRTON ARAUJO;BR 116 KM 05, AO LADO DA EMPRESA GUANABARA;CAJAZEIRAS;
2024;1;FORTALEZA;15666;JAIR DO POSTO;95;270;;1;EM SINÓ PINHEIRO;RUA 14, 151 (CJ JOAO PAULO II);BARROSO;
2024;1;FORTALEZA;15666;JAIR DO POSTO;95;272;;1;EM SINÓ PINHEIRO;RUA 14, 151 (CJ JOAO PAULO II);BARROSO;
2024;1;FORTALEZA;15666;JAIR DO POSTO;95;287;;1;EM PROFESSORA MARIA ANTONÉZIA MEIRELES E SÁ;RUA CORONEL VIRGÍLIO TÁVORA, 1340;BARROSO;
2024;1;FORTALEZA;15666;JAIR DO POSTO;95;293;;1;EMEIEF MARTHA DOS MARTINS COELHO GUILHERME;RUA 313, 243, CONJUNTO SÃO CRISTÓVÃO;JANGURUSSU;
2024;1;FORTALEZA;15666;JAIR DO POSTO;95;297;;1;UAPS JOSE BARROS DE ALENCAR;RUA JOSE NOGUEIRA, 180;PEDRAS;
2024;1;FORTALEZA;15666;JAIR DO POSTO;95;306;;1;CEI CESAR CALS DE OLIVEIRA NETO;RUA CAMPINENSE, 54;CONJUNTO PALMEIRAS;
2024;1;FORTALEZA;15666;JAIR DO POSTO;95;312;;2;CEI CESAR CALS DE OLIVEIRA NETO;RUA CAMPINENSE, 54;CONJUNTO PALMEIRAS;
2024;1;FORTALEZA;15666;JAIR DO POSTO;95;321;;1;EEFM ALMIRANTE TAMANDARÉ;RUA DO MANDACARU, 1048 CJ ALMIRANTE TAMANDARÉ;JANGURUSSU;
2024;1;FORTALEZA;15666;JAIR DO POSTO;95;329;;1;UAPS JOSE BARROS DE ALENCAR;RUA JOSE NOGUEIRA, 180;PEDRAS;
2024;1;FORTALEZA;15666;JAIR DO POSTO;95;343;;1;CUCA JANGURUSSU;AV. GOVERNADOR LEONEL BRIZOLA, S/N;JANGURUSSU;
2024;1;FORTALEZA;15666;JAIR DO POSTO;95;351;;1;EMEIEF MARIA HELENICE CAVALCANTE LEITE MARTINS;RUA MAIZA, S/N;CONJUNTO PALMEIRAS;
2024;1;FORTALEZA;15666;JAIR DO POSTO;95;357;;1;CEI PROFESSOR JOSE TEODORO SOARES;RUA COLETORA CENTRAL II, S/N;ANCURI;
2024;1;FORTALEZA;15666;JAIR DO POSTO;95;366;;1;EM PROFESSOR FRANCISCO DE MELO JABORANDI;AV. GOVERNADOR LEONEL BRIZOLA, 198;JANGURUSSU;
2024;1;FORTALEZA;15666;JAIR DO POSTO;112;7;;3;COLÉGIO NOVO HORIZONTE;RUA BEIJA FLOR, 25;JARDIM DAS OLIVEIRAS;
2024;1;FORTALEZA;15666;JAIR DO POSTO;112;9;;2;COLÉGIO NOVO HORIZONTE;RUA BEIJA FLOR, 25;JARDIM DAS OLIVEIRAS;
2024;1;FORTALEZA;15666;JAIR DO POSTO;112;10;;4;COLÉGIO NOVO HORIZONTE;RUA BEIJA FLOR, 25;JARDIM DAS OLIVEIRAS;
2024;1;FORTALEZA;15666;JAIR DO POSTO;112;11;;3;COLÉGIO NOVO HORIZONTE;RUA BEIJA FLOR, 25;JARDIM DAS OLIVEIRAS;
2024;1;FORTALEZA;15666;JAIR DO POSTO;112;12;;5;COLÉGIO NOVO HORIZONTE;RUA BEIJA FLOR, 25;JARDIM DAS OLIVEIRAS;
2024;1;FORTALEZA;15666;JAIR DO POSTO;112;18;;4;EM MARIA DE LOURDES RIBEIRO JEREISSATI;RUA REINO UNIDO, 115;JARDIM DAS OLIVEIRAS;
2024;1;FORTALEZA;15666;JAIR DO POSTO;112;20;;2;EM MARIA DE LOURDES RIBEIRO JEREISSATI;RUA REINO UNIDO, 115;JARDIM DAS OLIVEIRAS;
2024;1;FORTALEZA;15666;JAIR DO POSTO;112;21;;3;EM MARIA DE LOURDES RIBEIRO JEREISSATI;RUA REINO UNIDO, 115;JARDIM DAS OLIVEIRAS;
2024;1;FORTALEZA;15666;JAIR DO POSTO;112;22;;2;EM MARIA DE LOURDES RIBEIRO JEREISSATI;RUA REINO UNIDO, 115;JARDIM DAS OLIVEIRAS;
2024;1;FORTALEZA;15666;JAIR DO POSTO;112;28;;4;COLÉGIO DÁULIA BRINGEL;RUA TRAJANO ALVES DE AGUIAR, 55;CIDADE DOS FUNCIONÁRIOS;
2024;1;FORTALEZA;15666;JAIR DO POSTO;112;30;;1;COLÉGIO ANTARES - SEDE WASHINGTON SOARES;RUA CAETANO XIMENES ARAGÃO,110 - ACESSO PELA RUA ARMANDO DALL'OLIO;ENGENHEIRO LUCIANO CAVALCANTE;
2024;1;FORTALEZA;15666;JAIR DO POSTO;112;32;;2;COLÉGIO ANTARES - SEDE WASHINGTON SOARES;RUA CAETANO XIMENES ARAGÃO,110 - ACESSO PELA RUA ARMANDO DALL'OLIO;ENGENHEIRO LUCIANO CAVALCANTE;
2024;1;FORTALEZA;15666;JAIR DO POSTO;112;40;;1;CENTRO DE EDUCAÇÃO INFANTIL(CEI) MARIA DE LOURDES RIBEIRO JEREISSATI;RUA 1, 930 - CONJ. TANCREDO NEVES;JARDIM DAS OLIVEIRAS;
2024;1;FORTALEZA;15666;JAIR DO POSTO;112;41;;5;CENTRO DE EDUCAÇÃO INFANTIL(CEI) MARIA DE LOURDES RIBEIRO JEREISSATI;RUA 1, 930 - CONJ. TANCREDO NEVES;JARDIM DAS OLIVEIRAS;
2024;1;FORTALEZA;15666;JAIR DO POSTO;112;42;;2;CENTRO DE EDUCAÇÃO INFANTIL(CEI) MARIA DE LOURDES RIBEIRO JEREISSATI;RUA 1, 930 - CONJ. TANCREDO NEVES;JARDIM DAS OLIVEIRAS;
2024;1;FORTALEZA;15666;JAIR DO POSTO;112;43;;4;CENTRO DE EDUCAÇÃO INFANTIL(CEI) MARIA DE LOURDES RIBEIRO JEREISSATI;RUA 1, 930 - CONJ. TANCREDO NEVES;JARDIM DAS OLIVEIRAS;
2024;1;FORTALEZA;15666;JAIR DO POSTO;112;44;;7;CENTRO DE EDUCAÇÃO INFANTIL(CEI) MARIA DE LOURDES RIBEIRO JEREISSATI;RUA 1, 930 - CONJ. TANCREDO NEVES;JARDIM DAS OLIVEIRAS;
2024;1;FORTALEZA;15666;JAIR DO POSTO;112;45;;5;CENTRO DE EDUCAÇÃO INFANTIL(CEI) MARIA DE LOURDES RIBEIRO JEREISSATI;RUA 1, 930 - CONJ. TANCREDO NEVES;JARDIM DAS OLIVEIRAS;
2024;1;FORTALEZA;15666;JAIR DO POSTO;112;47;;2;EM MARIA DE LOURDES RIBEIRO JEREISSATI;RUA REINO UNIDO, 115;JARDIM DAS OLIVEIRAS;
2024;1;FORTALEZA;15666;JAIR DO POSTO;112;48;;1;EM MARIA DE LOURDES RIBEIRO JEREISSATI;RUA REINO UNIDO, 115;JARDIM DAS OLIVEIRAS;
2024;1;FORTALEZA;15666;JAIR DO POSTO;112;49;;2;EM MARIA DE LOURDES RIBEIRO JEREISSATI;RUA REINO UNIDO, 115;JARDIM DAS OLIVEIRAS;
2024;1;FORTALEZA;15666;JAIR DO POSTO;112;50;;5;EM MARIA DE LOURDES RIBEIRO JEREISSATI;RUA REINO UNIDO, 115;JARDIM DAS OLIVEIRAS;
2024;1;FORTALEZA;15666;JAIR DO POSTO;112;51;;1;EM MARIA DE LOURDES RIBEIRO JEREISSATI;RUA REINO UNIDO, 115;JARDIM DAS OLIVEIRAS;
2024;1;FORTALEZA;15666;JAIR DO POSTO;112;74;;12;ESCOLA ESTADUAL DE EDUCAÇÃO PROFISSIONAL JAIME ALENCAR DE OLIVEIRA;AV ROGACIANO LEITE, 2285;ENGENHEIRO LUCIANO CAVALCANTE;
2024;1;FORTALEZA;15666;JAIR DO POSTO;112;75;;11;ESCOLA ESTADUAL DE EDUCAÇÃO PROFISSIONAL JAIME ALENCAR DE OLIVEIRA;AV ROGACIANO LEITE, 2285;ENGENHEIRO LUCIANO CAVALCANTE;
2024;1;FORTALEZA;15666;JAIR DO POSTO;112;76;;16;ESCOLA ESTADUAL DE EDUCAÇÃO PROFISSIONAL JAIME ALENCAR DE OLIVEIRA;AV ROGACIANO LEITE, 2285;ENGENHEIRO LUCIANO CAVALCANTE;
2024;1;FORTALEZA;15666;JAIR DO POSTO;112;95;;18;EM ISMAEL PORDEUS;RUA DES FAUSTINO ALBUQUERQUE, 511;JARDIM DAS OLIVEIRAS;
2024;1;FORTALEZA;15666;JAIR DO POSTO;112;96;;20;EM ISMAEL PORDEUS;RUA DES FAUSTINO ALBUQUERQUE, 511;JARDIM DAS OLIVEIRAS;
2024;1;FORTALEZA;15666;JAIR DO POSTO;112;97;;17;EM ISMAEL PORDEUS;RUA DES FAUSTINO ALBUQUERQUE, 511;JARDIM DAS OLIVEIRAS;
2024;1;FORTALEZA;15666;JAIR DO POSTO;112;98;;12;EM ISMAEL PORDEUS;RUA DES FAUSTINO ALBUQUERQUE, 511;JARDIM DAS OLIVEIRAS;
2024;1;FORTALEZA;15666;JAIR DO POSTO;112;99;;19;EM ISMAEL PORDEUS;RUA DES FAUSTINO ALBUQUERQUE, 511;JARDIM DAS OLIVEIRAS;
2024;1;FORTALEZA;15666;JAIR DO POSTO;112;100;;20;EM ISMAEL PORDEUS;RUA DES FAUSTINO ALBUQUERQUE, 511;JARDIM DAS OLIVEIRAS;
