Ano;Turno;Município;Número;Candidato;Zona;Seção;Seções Agregadas;Votos;Local de Votação;Endereço Local de Votação;Bairro;
2024;1;FORTALEZA;55171;JOSÉ LUIS;1;546;;1;CIES AIDA SANTOS;AVENIDA TRAJANO DE MEDEIROS  813;VICENTE PINZON;
2024;1;FORTALEZA;55171;JOSÉ LUIS;1;671;;1;FANOR - FACULDADE NORDESTE;AVENIDA SANTOS DUMONT 7800;DE LOURDES;
2024;1;FORTALEZA;55171;JOSÉ LUIS;1;881;;2;FANOR - FACULDADE NORDESTE;AVENIDA SANTOS DUMONT 7800;DE LOURDES;
2024;1;FORTALEZA;55171;JOSÉ LUIS;2;179;;1;COLÉGIO SERAFICO NOSSA SENHORA DO BRASIL;AVENIDA FREI CIRILO 4454;MESSEJANA;
2024;1;FORTALEZA;55171;JOSÉ LUIS;3;1;;1;COLÉGIO TIRADENTES VESTIBULARES;RUA PEDRO I, 1106;CENTRO;
2024;1;FORTALEZA;55171;JOSÉ LUIS;3;2;;2;COLÉGIO TIRADENTES VESTIBULARES;RUA PEDRO I, 1106;CENTRO;
2024;1;FORTALEZA;55171;JOSÉ LUIS;3;3;;2;COLÉGIO TIRADENTES VESTIBULARES;RUA PEDRO I, 1106;CENTRO;
2024;1;FORTALEZA;55171;JOSÉ LUIS;3;4;;1;COLÉGIO TIRADENTES VESTIBULARES;RUA PEDRO I, 1106;CENTRO;
2024;1;FORTALEZA;55171;JOSÉ LUIS;3;6;29, 202;2;SENAI - UNIDADE JACARECANGA;AV. PADRE IBIAPINA, 1280;JACARECANGA;
2024;1;FORTALEZA;55171;JOSÉ LUIS;3;10;;3;COLÉGIO TIRADENTES VESTIBULARES;RUA PEDRO I, 1106;CENTRO;
2024;1;FORTALEZA;55171;JOSÉ LUIS;3;11;;2;COLÉGIO TIRADENTES VESTIBULARES;RUA PEDRO I, 1106;CENTRO;
2024;1;FORTALEZA;55171;JOSÉ LUIS;3;12;;3;COLÉGIO TIRADENTES VESTIBULARES;RUA PEDRO I, 1106;CENTRO;
2024;1;FORTALEZA;55171;JOSÉ LUIS;3;21;23;2;COLÉGIO 7 DE SETEMBRO (SEDE NGS);AV. DO IMPERADOR, 1330;CENTRO;
2024;1;FORTALEZA;55171;JOSÉ LUIS;3;31;;2;SESC;RUA CLARINDO DE QUEIROZ, 1740;CENTRO;
2024;1;FORTALEZA;55171;JOSÉ LUIS;3;110;;1;COLÉGIO ESTADUAL LICEU DO CEARÁ;PRAÇA GUSTAVO BARROSO, 01;JACARECANGA;
2024;1;FORTALEZA;55171;JOSÉ LUIS;3;113;;1;COLÉGIO ESTADUAL LICEU DO CEARÁ;PRAÇA GUSTAVO BARROSO, 01;JACARECANGA;
2024;1;FORTALEZA;55171;JOSÉ LUIS;3;119;170;1;SENAI - UNIDADE JACARECANGA;AV. PADRE IBIAPINA, 1280;JACARECANGA;
2024;1;FORTALEZA;55171;JOSÉ LUIS;3;122;;1;COLÉGIO ESTADUAL LICEU DO CEARÁ;PRAÇA GUSTAVO BARROSO, 01;JACARECANGA;
2024;1;FORTALEZA;55171;JOSÉ LUIS;3;124;;1;COLÉGIO ESTADUAL LICEU DO CEARÁ;PRAÇA GUSTAVO BARROSO, 01;JACARECANGA;
2024;1;FORTALEZA;55171;JOSÉ LUIS;3;127;;2;COLÉGIO ESTADUAL LICEU DO CEARÁ;PRAÇA GUSTAVO BARROSO, 01;JACARECANGA;
2024;1;FORTALEZA;55171;JOSÉ LUIS;3;129;;2;COLÉGIO ESTADUAL LICEU DO CEARÁ;PRAÇA GUSTAVO BARROSO, 01;JACARECANGA;
2024;1;FORTALEZA;55171;JOSÉ LUIS;3;131;;1;COLÉGIO ESTADUAL LICEU DO CEARÁ;PRAÇA GUSTAVO BARROSO, 01;JACARECANGA;
2024;1;FORTALEZA;55171;JOSÉ LUIS;3;132;;1;COLÉGIO ESTADUAL LICEU DO CEARÁ;PRAÇA GUSTAVO BARROSO, 01;JACARECANGA;
2024;1;FORTALEZA;55171;JOSÉ LUIS;3;151;;1;IEP - INST. DE EDUCAÇÃO PORTAL - UNIDADE FORTALEZA;AV. PADRE IBIAPINA, 1243;CENTRO;
2024;1;FORTALEZA;55171;JOSÉ LUIS;3;152;;1;EM MOURA BRASIL / EF;RUA PADRE MORORÓ, 189;MOURA BRASIL;
2024;1;FORTALEZA;55171;JOSÉ LUIS;3;155;;1;EM MOURA BRASIL / EF;RUA PADRE MORORÓ, 189;MOURA BRASIL;
2024;1;FORTALEZA;55171;JOSÉ LUIS;3;180;;1;IEP - INST. DE EDUCAÇÃO PORTAL - UNIDADE FORTALEZA;AV. PADRE IBIAPINA, 1243;CENTRO;
2024;1;FORTALEZA;55171;JOSÉ LUIS;3;196;;1;IEP - INST. DE EDUCAÇÃO PORTAL - UNIDADE FORTALEZA;AV. PADRE IBIAPINA, 1243;CENTRO;
2024;1;FORTALEZA;55171;JOSÉ LUIS;3;219;220;1;FAC. ESTÁCIO - UNIDADE CENTRO (ANTIGO COLÉGIO CEARENSE);AV. DUQUE DE CAXIAS, 101;CENTRO;
2024;1;FORTALEZA;55171;JOSÉ LUIS;3;400;;1;COLÉGIO CHRISTUS (AV. BARÃO DE STUDART);RUA JOÃO CARVALHO, 630;ALDEOTA;
2024;1;FORTALEZA;55171;JOSÉ LUIS;3;450;;1;EEFM SANTA LUZIA;RUA JOÃO CORDEIRO, 711;PRAIA DE IRACEMA;
2024;1;FORTALEZA;55171;JOSÉ LUIS;3;567;;1;EEFM CLÓVIS BEVILAQUA;AV. DOM MANUEL, 511;CENTRO;
2024;1;FORTALEZA;55171;JOSÉ LUIS;80;182;;1;COLÉGIO NOSSA SENHORA DAS GRAÇAS;RUA MONSENHOR OTÁVIO DE CASTRO, 535;FÁTIMA;
2024;1;FORTALEZA;55171;JOSÉ LUIS;80;256;257;1;SALÃO PAROQUIAL SÃO JOAO DO TAUAPE;RUA MONSENHOR SALAZAR, 279;TAUAPE;
2024;1;FORTALEZA;55171;JOSÉ LUIS;80;301;;1;ASSEMBLÉIA LEGISLATIVA - UNIVERSIDADE DO PARLAMENTO CEARENSE;RUA BARBOSA DE FREITAS, 2674;DIONISIO TORRES;
2024;1;FORTALEZA;55171;JOSÉ LUIS;80;398;;1;EEM GOV. ADAUTO BEZERRA;RUA MONSENHOR LIBERATO, 1850;FÁTIMA;
2024;1;FORTALEZA;55171;JOSÉ LUIS;82;125;;1;EEFM SALES CAMPOS;RUA JACINTO MATOS, 730;JACARECANGA;
2024;1;FORTALEZA;55171;JOSÉ LUIS;82;239;;1;EEFM GOVERNADOR FLÁVIO MARCÍLIO;AV. PASTEUR, 575;PIRAMBU;
2024;1;FORTALEZA;55171;JOSÉ LUIS;82;673;;1;ESCOLA MUNICIPAL ANTONIO MENDES - EI/EF;RUA DONA MENDINA, 682;CRISTO REDENTOR;
2024;1;FORTALEZA;55171;JOSÉ LUIS;83;62;;1;EEMTI SENADOR FERNANDES TÁVORA;RUA GOIÁS 141;BELA VISTA;
2024;1;FORTALEZA;55171;JOSÉ LUIS;83;98;;1;EEM  MARIANO MARTINS;AVENIDA SENADOR FERNANDES TÁVORA 1445;HENRIQUE JORGE;
2024;1;FORTALEZA;55171;JOSÉ LUIS;85;384;;1;EMEIF MANOEL CAETANO DE SOUZA;RUA SANTA LUCIA 170;GENIBAÚ;
2024;1;FORTALEZA;55171;JOSÉ LUIS;94;841;;1;EMEIF LORHAN MARQUES MEDEIROS;RUA CREUZA ROCHA, 255;JARDIM GUANABARA;
2024;1;FORTALEZA;55171;JOSÉ LUIS;95;104;;1;EEFM DOUTORA ALDACI BARBOSA;RUA VALPARAISO, 155;CONJUNTO PALMEIRAS;
2024;1;FORTALEZA;55171;JOSÉ LUIS;112;146;;1;EEFM D. LUIZA TÁVORA - PRÓ MORAR;RUA FREI CANECA, 379;JARDIM DAS OLIVEIRAS;
2024;1;FORTALEZA;55171;JOSÉ LUIS;112;404;;1;COLEGIO ARI DE SA CAVALCANTE WS;AV WASHINGTON SOARES, 3737;EDSON QUEIROZ;
2024;1;FORTALEZA;55171;JOSÉ LUIS;113;78;;1;COLÉGIO LOURENÇO FILHO;RUA BARÃO DO RIO BRANCO, 2101;CENTRO;
2024;1;FORTALEZA;55171;JOSÉ LUIS;113;79;;1;COLÉGIO LOURENÇO FILHO;RUA BARÃO DO RIO BRANCO, 2101;CENTRO;
2024;1;FORTALEZA;55171;JOSÉ LUIS;113;108;;1;COLÉGIO CHRISTUS BENFICA;RUA LUIS DE MIRANDA, 536;BENFICA;
2024;1;FORTALEZA;55171;JOSÉ LUIS;113;109;;1;COLÉGIO CHRISTUS BENFICA;RUA LUIS DE MIRANDA, 536;BENFICA;
2024;1;FORTALEZA;55171;JOSÉ LUIS;113;110;;1;COLÉGIO CHRISTUS BENFICA;RUA LUIS DE MIRANDA, 536;BENFICA;
2024;1;FORTALEZA;55171;JOSÉ LUIS;113;117;118;1;EEFM FREI LAURO SCHWARTE;RUA ANTÔNIO POMPEU, 2005;CENTRO;
2024;1;FORTALEZA;55171;JOSÉ LUIS;113;122;121;1;EEFM FREI LAURO SCHWARTE;RUA ANTÔNIO POMPEU, 2005;CENTRO;
2024;1;FORTALEZA;55171;JOSÉ LUIS;113;367;;1;COLÉGIO ESTADUAL PRESIDENTE HUMBERTO CASTELO BRANCO;RUA IRMA BAZET, 210;MONTESE;
2024;1;FORTALEZA;55171;JOSÉ LUIS;113;374;;1;COLÉGIO NOSSA SENHORA APARECIDA;RUA AQUILES BORIS, 342;MONTESE;
2024;1;FORTALEZA;55171;JOSÉ LUIS;114;210;;1;EM FRANCISCO SILVA CAVALCANTE;RUA CONSELHEIRO LAFAYETTE 205;FLORESTA;
2024;1;FORTALEZA;55171;JOSÉ LUIS;114;241;;1;CENTRO DE EDUCAÇÃO COMPLEMENTAR (CEDCE) - ANTIGO SESI;AVENIDA FRANCISCO SÁ 6623;BARRA DO CEARÁ;
2024;1;FORTALEZA;55171;JOSÉ LUIS;114;247;;1;CENTRO DE EDUCAÇÃO COMPLEMENTAR (CEDCE) - ANTIGO SESI;AVENIDA FRANCISCO SÁ 6623;BARRA DO CEARÁ;
2024;1;FORTALEZA;55171;JOSÉ LUIS;114;274;;1;EM  RACHEL DE QUEIROZ;AVENIDA PRESIDENTE CASTELO BRANCO 5010;BARRA DO CEARÁ;
2024;1;FORTALEZA;55171;JOSÉ LUIS;114;310;;1;COLÉGIO MANUEL DA SILVA (ÁLVARO WEYNE);RUA SÃO BERNARDO 181;ÁLVARO WEYNE;
2024;1;FORTALEZA;55171;JOSÉ LUIS;115;368;;1;EM CATULO DA PAIXAO CEARENSE;RUA LEAO DO NORTE 300;VILA PERI;
2024;1;FORTALEZA;55171;JOSÉ LUIS;115;404;;1;EEFM PROFESSOR MARIO SCHENBERG;RUA AMERICO ROCHA LIMA 835;MANOEL SÁTIRO;
2024;1;FORTALEZA;55171;JOSÉ LUIS;115;469;;1;EEFM PROF. HERMENEGILDO FIRMEZA;RUA GABRIEL FIUZA 360;VILA PERI;
2024;1;FORTALEZA;55171;JOSÉ LUIS;115;473;;1;EEFM PROF. HERMENEGILDO FIRMEZA;RUA GABRIEL FIUZA 360;VILA PERI;
2024;1;FORTALEZA;55171;JOSÉ LUIS;115;475;;1;EEFM PROF. HERMENEGILDO FIRMEZA;RUA GABRIEL FIUZA 360;VILA PERI;
2024;1;FORTALEZA;55171;JOSÉ LUIS;115;477;;1;EEFM PROF. HERMENEGILDO FIRMEZA;RUA GABRIEL FIUZA 360;VILA PERI;
2024;1;FORTALEZA;55171;JOSÉ LUIS;117;165;;1;EEFM JULIA ALVES PESSOA;RUA SÃO FRANCISCO SN;BOM JARDIM;
2024;1;FORTALEZA;55171;JOSÉ LUIS;117;195;;1;EEFM IRMAO URBANO GONZALEZ RODRIGUEZ;RUA CONEGO DE CASTRO, 4055;PARQUE SÃO JOSÉ;
2024;1;FORTALEZA;55171;JOSÉ LUIS;117;284;;1;CEI FRANCISCA DE ABREU LIMA;RUA C -  ESQUINA COM A RUA LUIZ MONTENEGRO, S/N;SIQUEIRA;
2024;1;FORTALEZA;55171;JOSÉ LUIS;118;293;;1;EM FRANCISCO ANDRADE TEOFILO GIRAO;RUA UNIDOS VENCEREMOS, 2040;PASSARÉ;
2024;1;FORTALEZA;55171;JOSÉ LUIS;118;408;;1;EM FRANCISCO ANDRADE TEOFILO GIRAO;RUA UNIDOS VENCEREMOS, 2040;PASSARÉ;
TOTAL;;;;;;;;84;
