Ano;Turno;Município;Número;Candidato;Zona;Seção;Seções Agregadas;Votos;Local de Votação;Endereço Local de Votação;Bairro;
2024;1;FORTALEZA;36234;JOÃO MOTA;1;84;;1;FACULDADE FARIAS BRITO - CASTRO MONTE;RUA CASTRO MONTE 1364;VARJOTA;
2024;1;FORTALEZA;36234;JOÃO MOTA;1;139;;1;ESCOLA ESTADUAL ARQUITETO ROGERIO FROES;AVENIDA DAS GRAVIOLAS 1000;CIDADE 2000;
2024;1;FORTALEZA;36234;JOÃO MOTA;1;382;;1;ESCOLA PROFISSIONAL MARIA ANGELA DA SILVEIRA BORGES;RUA PINTOR ANTONIO BANDEIRA, S/N;VICENTE PINZON;
2024;1;FORTALEZA;36234;JOÃO MOTA;1;391;;1;CIES AIDA SANTOS;AVENIDA TRAJANO DE MEDEIROS  813;VICENTE PINZON;
2024;1;FORTALEZA;36234;JOÃO MOTA;1;393;;1;CIES AIDA SANTOS;AVENIDA TRAJANO DE MEDEIROS  813;VICENTE PINZON;
2024;1;FORTALEZA;36234;JOÃO MOTA;1;520;;1;ESCOLA ESTADUAL DRAGAO DO MAR;RUA UMARI S/N;MUCURIPE;
2024;1;FORTALEZA;36234;JOÃO MOTA;1;586;;1;ESCOLA MUNICIPAL DOM ALOISIO LORSCHEIDER;RUA JULIO SILVA, 450;PRAIA DO FUTURO II;
2024;1;FORTALEZA;36234;JOÃO MOTA;1;668;;2;ESCOLA ESTADUAL MURILO BORGES;RUA DO ENTARDECER 90;VICENTE PINZON;
2024;1;FORTALEZA;36234;JOÃO MOTA;1;680;;1;FANOR - FACULDADE NORDESTE;AVENIDA SANTOS DUMONT 7800;DE LOURDES;
2024;1;FORTALEZA;36234;JOÃO MOTA;1;685;;1;ESCOLA MUNICIPAL PROF BELARMINA CAMPOS;RUA MANOEL RODRIGUES MONTEIRO, 840;VICENTE PINZON;
2024;1;FORTALEZA;36234;JOÃO MOTA;1;717;;1;CIES AIDA SANTOS;AVENIDA TRAJANO DE MEDEIROS  813;VICENTE PINZON;
2024;1;FORTALEZA;36234;JOÃO MOTA;1;754;;1;ESCOLA MUNICIPAL FREI TITO DE ALENCAR LIMA;AVENIDA DIOGUINHO 5927;VICENTE PINZON;
2024;1;FORTALEZA;36234;JOÃO MOTA;1;763;;1;ESCOLA MUNICIPAL FREI TITO DE ALENCAR LIMA;AVENIDA DIOGUINHO 5927;VICENTE PINZON;
2024;1;FORTALEZA;36234;JOÃO MOTA;1;796;;1;ESCOLA PROFISSIONAL MARIA ANGELA DA SILVEIRA BORGES;RUA PINTOR ANTONIO BANDEIRA, S/N;VICENTE PINZON;
2024;1;FORTALEZA;36234;JOÃO MOTA;1;802;;1;FANOR - FACULDADE NORDESTE;AVENIDA SANTOS DUMONT 7800;DE LOURDES;
2024;1;FORTALEZA;36234;JOÃO MOTA;1;809;;1;COLEGIO ESPACO ABERTO - BENTO ALBUQUERQUE;RUA BENTO ALBUQUERQUE 1671;PAPICU;
2024;1;FORTALEZA;36234;JOÃO MOTA;1;820;;1;ESCOLA PROFISSIONAL MARIA ANGELA DA SILVEIRA BORGES;RUA PINTOR ANTONIO BANDEIRA, S/N;VICENTE PINZON;
2024;1;FORTALEZA;36234;JOÃO MOTA;1;826;;1;ESCOLA MUNICIPAL DOM ALOISIO LORSCHEIDER;RUA JULIO SILVA, 450;PRAIA DO FUTURO II;
2024;1;FORTALEZA;36234;JOÃO MOTA;1;828;;1;ESCOLA MUNICIPAL CONSUELO AMORA;AV. DOS JANGADEIROS, 577;MUCURIPE;
2024;1;FORTALEZA;36234;JOÃO MOTA;1;839;;1;COLEGIO ESPACO ABERTO - BENTO ALBUQUERQUE;RUA BENTO ALBUQUERQUE 1671;PAPICU;
2024;1;FORTALEZA;36234;JOÃO MOTA;1;866;;1;ESCOLA ESTADUAL DEPUTADO MANOEL RODRIGUES;RUA OLIVEIRA FILHO, 1576;VICENTE PINZON;
2024;1;FORTALEZA;36234;JOÃO MOTA;1;873;;1;ESCOLA MUNICIPAL FREI TITO DE ALENCAR LIMA;AVENIDA DIOGUINHO 5927;VICENTE PINZON;
2024;1;FORTALEZA;36234;JOÃO MOTA;1;884;;1;COLEGIO ANTARES - OCELO PINHEIRO;RUA PROFESSOR OCELO PINHEIRO 101;PAPICU;
2024;1;FORTALEZA;36234;JOÃO MOTA;1;922;;2;ESCOLA MUNICIPAL PROF BELARMINA CAMPOS;RUA MANOEL RODRIGUES MONTEIRO, 840;VICENTE PINZON;
2024;1;FORTALEZA;36234;JOÃO MOTA;1;936;;2;COLÉGIO KENNEDY;AVENIDA ENGENHEIRO SANTANA JÚNIOR,58;PAPICU;
2024;1;FORTALEZA;36234;JOÃO MOTA;2;78;;1;EEEP COMENDADOR MIGUEL GURGEL;RUA JOSE BAIMA, S/N;GUAJERU;
2024;1;FORTALEZA;36234;JOÃO MOTA;2;92;;1;CLUBE DA CAIXA;AVENIDA FREI CIRILO 4700;MESSEJANA;
2024;1;FORTALEZA;36234;JOÃO MOTA;2;93;;1;CLUBE DA CAIXA;AVENIDA FREI CIRILO 4700;MESSEJANA;
2024;1;FORTALEZA;36234;JOÃO MOTA;2;94;;1;CLUBE DA CAIXA;AVENIDA FREI CIRILO 4700;MESSEJANA;
2024;1;FORTALEZA;36234;JOÃO MOTA;2;148;;1;EMEIF ANGELICA GURGEL;RUA DOUTOR PERGENTINO MAIA, 375;MESSEJANA;
2024;1;FORTALEZA;36234;JOÃO MOTA;2;156;;1;EMEIF MOREIRA DA ROCHA;AV ODILON GUIMARAES, 3860;LAGOA REDONDA;
2024;1;FORTALEZA;36234;JOÃO MOTA;2;177;;1;COLÉGIO SERAFICO NOSSA SENHORA DO BRASIL;AVENIDA FREI CIRILO 4454;MESSEJANA;
2024;1;FORTALEZA;36234;JOÃO MOTA;2;178;;1;COLÉGIO SERAFICO NOSSA SENHORA DO BRASIL;AVENIDA FREI CIRILO 4454;MESSEJANA;
2024;1;FORTALEZA;36234;JOÃO MOTA;2;400;;1;CLUBE DA CAIXA;AVENIDA FREI CIRILO 4700;MESSEJANA;
2024;1;FORTALEZA;36234;JOÃO MOTA;2;700;;1;COLÉGIO SERAFICO NOSSA SENHORA DO BRASIL;AVENIDA FREI CIRILO 4454;MESSEJANA;
2024;1;FORTALEZA;36234;JOÃO MOTA;2;704;;1;CMES ANISIO TEIXEIRA;TRAVESSA DO GUARANI, 355;PAUPINA;
2024;1;FORTALEZA;36234;JOÃO MOTA;2;715;;1;CMES PROFª TEREZINHA FERREIRA PARENTE;RUA NELSON COELHO, 209;LAGOA REDONDA;
2024;1;FORTALEZA;36234;JOÃO MOTA;2;716;;1;EEFM GOV LUIZ DE GONZAGA FONSECA MOTA;RUA SANTA ROSA, 407;COAÇU;
2024;1;FORTALEZA;36234;JOÃO MOTA;2;732;;2;CMES PROFª TEREZINHA FERREIRA PARENTE;RUA NELSON COELHO, 209;LAGOA REDONDA;
2024;1;FORTALEZA;36234;JOÃO MOTA;2;746;;2;EMEIF ANGELICA GURGEL;RUA DOUTOR PERGENTINO MAIA, 375;MESSEJANA;
2024;1;FORTALEZA;36234;JOÃO MOTA;2;750;;1;EMEIF GUIOMAR DA SILVA ALMEIDA;RUA PEROLINA DE MORAIS, 449;PAUPINA;
2024;1;FORTALEZA;36234;JOÃO MOTA;2;772;;1;EEFM JOSE DE ALENCAR;RUA VENEZA, 84;MESSEJANA;
2024;1;FORTALEZA;36234;JOÃO MOTA;2;779;;1;COLÉGIO CHRISTUS SUL;AV. ENG. LEAL LIMA VERDE, 2265;JOSÉ DE ALENCAR;
2024;1;FORTALEZA;36234;JOÃO MOTA;2;789;;1;COLÉGIO PAIVA ANDRADE;RUA INÁCIO MOREIRA, 133;MESSEJANA;
2024;1;FORTALEZA;36234;JOÃO MOTA;2;800;;1;FACULDADE ATENEU DO CEARÁ;AV. COLETOR ANTONIO GADELHA, 621;MESSEJANA;
2024;1;FORTALEZA;36234;JOÃO MOTA;2;804;;1;EEM DEPUTADO PAULO BENEVIDES;RUA ANGELICA GURGEL, 186;MESSEJANA;
2024;1;FORTALEZA;36234;JOÃO MOTA;2;806;;1;ESCOLA MUNICIPAL ISABEL FERREIRA;RUA ISABEL FERREIRA, 1000 - CONJ. CURIÓ;LAGOA REDONDA;
2024;1;FORTALEZA;36234;JOÃO MOTA;2;807;;1;ESCOLA MUNICIPAL ISABEL FERREIRA;RUA ISABEL FERREIRA, 1000 - CONJ. CURIÓ;LAGOA REDONDA;
2024;1;FORTALEZA;36234;JOÃO MOTA;2;811;;1;ESCOLA MUNICIPAL ISABEL FERREIRA;RUA ISABEL FERREIRA, 1000 - CONJ. CURIÓ;LAGOA REDONDA;
2024;1;FORTALEZA;36234;JOÃO MOTA;2;813;;2;ESCOLA MUNICIPAL ISABEL FERREIRA;RUA ISABEL FERREIRA, 1000 - CONJ. CURIÓ;LAGOA REDONDA;
2024;1;FORTALEZA;36234;JOÃO MOTA;2;816;;1;FACULDADE ATENEU DO CEARÁ;AV. COLETOR ANTONIO GADELHA, 621;MESSEJANA;
2024;1;FORTALEZA;36234;JOÃO MOTA;2;819;;1;ESCOLA MUNICIPAL ISABEL FERREIRA;RUA ISABEL FERREIRA, 1000 - CONJ. CURIÓ;LAGOA REDONDA;
2024;1;FORTALEZA;36234;JOÃO MOTA;2;828;;1;ESCOLA MUNICIPAL ISABEL FERREIRA;RUA ISABEL FERREIRA, 1000 - CONJ. CURIÓ;LAGOA REDONDA;
2024;1;FORTALEZA;36234;JOÃO MOTA;2;830;;1;EM CÔNEGO FRANCISCO PEREIRA DA SILVA;RUA LUÍS FRANCISCO XAVIER, 256;PAUPINA;
2024;1;FORTALEZA;36234;JOÃO MOTA;3;31;;1;SESC;RUA CLARINDO DE QUEIROZ, 1740;CENTRO;
2024;1;FORTALEZA;36234;JOÃO MOTA;3;33;;1;SESC;RUA CLARINDO DE QUEIROZ, 1740;CENTRO;
2024;1;FORTALEZA;36234;JOÃO MOTA;3;116;26;1;SENAI - UNIDADE JACARECANGA;AV. PADRE IBIAPINA, 1280;JACARECANGA;
2024;1;FORTALEZA;36234;JOÃO MOTA;3;154;;1;EM MOURA BRASIL / EF;RUA PADRE MORORÓ, 189;MOURA BRASIL;
2024;1;FORTALEZA;36234;JOÃO MOTA;3;155;;1;EM MOURA BRASIL / EF;RUA PADRE MORORÓ, 189;MOURA BRASIL;
2024;1;FORTALEZA;36234;JOÃO MOTA;3;207;208, 209;1;EM ALBA FROTA;AV. DOM MANUEL, 914;CENTRO;
2024;1;FORTALEZA;36234;JOÃO MOTA;3;210;211, 256;1;EM ALBA FROTA;AV. DOM MANUEL, 914;CENTRO;
2024;1;FORTALEZA;36234;JOÃO MOTA;3;224;;1;FACULDADE ARI DE SÁ;AV. HERÁCLITO GRAÇA, 826;CENTRO;
2024;1;FORTALEZA;36234;JOÃO MOTA;3;426;;1;FACULDADE ARI DE SÁ;AV. HERÁCLITO GRAÇA, 826;CENTRO;
2024;1;FORTALEZA;36234;JOÃO MOTA;3;437;;1;COLÉGIO CHRISTUS (AV. BARÃO DE STUDART);RUA JOÃO CARVALHO, 630;ALDEOTA;
2024;1;FORTALEZA;36234;JOÃO MOTA;3;452;;1;COLÉGIO DARWIN;RUA ILDEFONSO ALBANO, 1030;ALDEOTA;
2024;1;FORTALEZA;36234;JOÃO MOTA;3;458;;1;COLÉGIO DARWIN;RUA ILDEFONSO ALBANO, 1030;ALDEOTA;
2024;1;FORTALEZA;36234;JOÃO MOTA;3;504;;1;IDEAL CLUBE;AV. MONSENHOR TABOSA,  1381;MEIRELES;
2024;1;FORTALEZA;36234;JOÃO MOTA;3;536;;1;EEFM SANTA LUZIA;RUA JOÃO CORDEIRO, 711;PRAIA DE IRACEMA;
2024;1;FORTALEZA;36234;JOÃO MOTA;3;598;;1;COLÉGIO SANTA CECÍLIA;AV. SENADOR VIRGÍLIO TÁVORA, 2000;ALDEOTA;
2024;1;FORTALEZA;36234;JOÃO MOTA;3;601;;1;COLÉGIO SANTA CECÍLIA;AV. SENADOR VIRGÍLIO TÁVORA, 2000;ALDEOTA;
2024;1;FORTALEZA;36234;JOÃO MOTA;80;131;;1;EM PROFESSORA EDITH BRAGA;RUA CAPITAO VASCONCELOS 1061;ALTO DA BALANÇA;
2024;1;FORTALEZA;36234;JOÃO MOTA;80;196;;1;COLÉGIO SANTO TOMÁZ DE AQUINO;RUA MÁRIO MAMEDE, 750;FÁTIMA;
2024;1;FORTALEZA;36234;JOÃO MOTA;80;198;;1;EEFM PROFª  MARIA CONCEICÃO PORFÍRIO TELES;RUA MONTE CRISTO, 177;AEROLÂNDIA;
2024;1;FORTALEZA;36234;JOÃO MOTA;80;213;;1;EM PROFESSORA EDITH BRAGA;RUA CAPITAO VASCONCELOS 1061;ALTO DA BALANÇA;
2024;1;FORTALEZA;36234;JOÃO MOTA;80;236;;1;EEFM NOEL HUGNEN OLIVEIRA PAIVA;RUA MONSENHOR SALAZAR 279;TAUAPE;
2024;1;FORTALEZA;36234;JOÃO MOTA;80;239;;1;EEFM NOEL HUGNEN OLIVEIRA PAIVA;RUA MONSENHOR SALAZAR 279;TAUAPE;
2024;1;FORTALEZA;36234;JOÃO MOTA;80;245;;1;EEFM NOEL HUGNEN OLIVEIRA PAIVA;RUA MONSENHOR SALAZAR 279;TAUAPE;
2024;1;FORTALEZA;36234;JOÃO MOTA;80;344;;2;COLÉGIO SALESIANO DOM BOSCO;AV ANTONIO SALES 116;JOAQUIM TÁVORA;
2024;1;FORTALEZA;36234;JOÃO MOTA;80;355;;1;EMEIF ALMERINDA DE ALBUQUERQUE;RUA ANA GONCALVES 1105;TAUAPE;
2024;1;FORTALEZA;36234;JOÃO MOTA;80;414;;1;COLÉGIO ANTARES FÁTIMA (VILA UNIÃO);RUA ALBERTO MONTEZUMA, 235;VILA UNIÃO;
2024;1;FORTALEZA;36234;JOÃO MOTA;80;417;;1;ESCOLA MUNICIPAL HAROLDO JORGE BRAUN VIEIRA;AV LAURO VIEIRA CHAVES, 2001;VILA UNIÃO;
2024;1;FORTALEZA;36234;JOÃO MOTA;80;422;;1;FACULDADE MAURÍCIO DE NASSAU;AVENIDA VISCONDE DO RIO BRANCO, 2078;JOSÉ BONIFÁCIO;
2024;1;FORTALEZA;36234;JOÃO MOTA;80;438;;1;IGREJA MATRIZ DA AEROLÂNDIA - PARÓQUIA N. SRA DO SAGRADO CORAÇÃO;RUA ASPIRANTE MENDES, 540;AEROLÂNDIA;
2024;1;FORTALEZA;36234;JOÃO MOTA;82;33;;1;SECRETARIA DE DESENVOLVIMENTO AGRÁRIO DO ESTADO DO CEARÁ;AV. BEZERRA DE MENEZES, 1620;SÃO GERARDO;
2024;1;FORTALEZA;36234;JOÃO MOTA;82;61;;1;ESCOLA MUNICIPAL NOSSA SENHORA DO PERPÉTUO SOCORRO - EF;RUA CÔNSUL GOUVEIA, 57;ÁLVARO WEYNE;
2024;1;FORTALEZA;36234;JOÃO MOTA;82;63;;1;ESCOLA MUNICIPAL NOSSA SENHORA DO PERPÉTUO SOCORRO - EF;RUA CÔNSUL GOUVEIA, 57;ÁLVARO WEYNE;
2024;1;FORTALEZA;36234;JOÃO MOTA;82;73;;1;COLÉGIO MANUEL DA SILVA - CARLITO PAMPLONA;AV. FRANCISCO SÁ, 4001;CARLITO PAMPLONA;
2024;1;FORTALEZA;36234;JOÃO MOTA;82;112;;1;CEJA  MONSENHOR HÉLIO CAMPOS;AV. MONSENHOR HÉLIO CAMPOS, 251;CRISTO REDENTOR;
2024;1;FORTALEZA;36234;JOÃO MOTA;82;125;;1;EEFM SALES CAMPOS;RUA JACINTO MATOS, 730;JACARECANGA;
2024;1;FORTALEZA;36234;JOÃO MOTA;82;181;;1;EEFM CLÁUDIO MARTINS;RUA DEMÓCRITO ROCHA, 400;MONTE CASTELO;
2024;1;FORTALEZA;36234;JOÃO MOTA;82;195;;1;CENTRO EDUCACIONAL SÃO MATEUS;AV. SARGENTO HERMÍNIO SAMPAIO, 2440;MONTE CASTELO;
2024;1;FORTALEZA;36234;JOÃO MOTA;82;209;;1;INSTITUTO MATER AMABILIS;RUA PADRE ANCHIETA, 438;MONTE CASTELO;
2024;1;FORTALEZA;36234;JOÃO MOTA;82;212;;1;INSTITUTO MATER AMABILIS;RUA PADRE ANCHIETA, 438;MONTE CASTELO;
2024;1;FORTALEZA;36234;JOÃO MOTA;82;250;;1;ESCOLA MUNICIPAL HILBERTO SILVA - EI/EF;AV. PRESIDENTE CASTELO BRANCO, 2973;PIRAMBU;
2024;1;FORTALEZA;36234;JOÃO MOTA;82;251;;1;ESCOLA MUNICIPAL HILBERTO SILVA - EI/EF;AV. PRESIDENTE CASTELO BRANCO, 2973;PIRAMBU;
2024;1;FORTALEZA;36234;JOÃO MOTA;82;257;;1;CEJA PAULO FREIRE;RUA OLAVO BILAC, 1300;SÃO GERARDO;
2024;1;FORTALEZA;36234;JOÃO MOTA;82;371;;1;EMEIEF HONÓRIO BEZERRA;RUA CAPITÃO NESTOR GÓIS, 400;ELLERY;
2024;1;FORTALEZA;36234;JOÃO MOTA;82;395;;1;ESCOLA MUNICIPAL TERTULIANO CAMBRAIA - EI/EF;RUA MONSENHOR ROSA, 946;CARLITO PAMPLONA;
2024;1;FORTALEZA;36234;JOÃO MOTA;82;398;;1;ESCOLA MUNICIPAL SEBASTIANA ALDIGUERI;AV. DOUTOR THEBERGE, 448;CRISTO REDENTOR;
2024;1;FORTALEZA;36234;JOÃO MOTA;82;401;;1;EMEIEF CRISTO REDENTOR;AV. PASTEUR, 372;CRISTO REDENTOR;
2024;1;FORTALEZA;36234;JOÃO MOTA;82;448;;1;ESCOLA MUNICIPAL HILBERTO SILVA - EI/EF;AV. PRESIDENTE CASTELO BRANCO, 2973;PIRAMBU;
2024;1;FORTALEZA;36234;JOÃO MOTA;82;503;;1;CENTRO EDUCACIONAL DOM HÉLIO CAMPOS;RUA SÃO RAIMUNDO, 199;PIRAMBU;
2024;1;FORTALEZA;36234;JOÃO MOTA;82;540;;1;CEJA PAULO FREIRE;RUA OLAVO BILAC, 1300;SÃO GERARDO;
2024;1;FORTALEZA;36234;JOÃO MOTA;82;546;;1;ESCOLA MUNICIPAL SANTA TEREZA - EI/EF;RUA MONSENHOR HÉLIO CAMPOS, 90;CRISTO REDENTOR;
2024;1;FORTALEZA;36234;JOÃO MOTA;82;577;;1;COLÉGIO MASTER - BEZERRA DE MENEZES;AV. BEZERRA DE MENEZES, 1802;SÃO GERARDO;
2024;1;FORTALEZA;36234;JOÃO MOTA;82;619;;1;COLÉGIO MASTER - BEZERRA DE MENEZES;AV. BEZERRA DE MENEZES, 1802;SÃO GERARDO;
2024;1;FORTALEZA;36234;JOÃO MOTA;82;620;;1;CENTRO EDUCACIONAL SÃO MATEUS;AV. SARGENTO HERMÍNIO SAMPAIO, 2440;MONTE CASTELO;
2024;1;FORTALEZA;36234;JOÃO MOTA;82;624;;1;ESCOLA MUNICIPAL TERTULIANO CAMBRAIA - EI/EF;RUA MONSENHOR ROSA, 946;CARLITO PAMPLONA;
2024;1;FORTALEZA;36234;JOÃO MOTA;82;629;;1;ESCOLA MUNICIPAL SANTA TEREZA - EI/EF;RUA MONSENHOR HÉLIO CAMPOS, 90;CRISTO REDENTOR;
2024;1;FORTALEZA;36234;JOÃO MOTA;82;639;;1;FEDERAÇÃO DO MOVIMENTO COMUNITÁRIO DO PIRAMBU - FEMOCOPI;AV. PRES. CASTELO BRANCO, 2709;CARLITO PAMPLONA;
2024;1;FORTALEZA;36234;JOÃO MOTA;82;654;;1;COLÉGIO MANUEL DA SILVA - CARLITO PAMPLONA;AV. FRANCISCO SÁ, 4001;CARLITO PAMPLONA;
2024;1;FORTALEZA;36234;JOÃO MOTA;82;666;;1;COLÉGIO MANUEL DA SILVA - CARLITO PAMPLONA;AV. FRANCISCO SÁ, 4001;CARLITO PAMPLONA;
2024;1;FORTALEZA;36234;JOÃO MOTA;82;692;;1;CENTRO EDUCACIONAL SÃO MATEUS;AV. SARGENTO HERMÍNIO SAMPAIO, 2440;MONTE CASTELO;
2024;1;FORTALEZA;36234;JOÃO MOTA;83;18;;1;ESCOLA MUNICIPAL DOM JOSÉ TUPINAMBA DA FROTA;RUA VIRIATO RIBEIRO 1031;BELA VISTA;
2024;1;FORTALEZA;36234;JOÃO MOTA;83;26;;2;ESCOLA MUNICIPAL NILSON HOLANDA;RUA VIRIATO RIBEIRO 1355;BELA VISTA;
2024;1;FORTALEZA;36234;JOÃO MOTA;83;30;;1;ESCOLA MUNICIPAL DE TEMPO INTEGRAL PROFESSOR JOSE JULIO DA PONTE;RUA MARIO DE ANDRADE, S/N;BELA VISTA;
2024;1;FORTALEZA;36234;JOÃO MOTA;83;32;;1;EEMTI ESTADO DO AMAZONAS;RUA MONSENHOR FURTADO 2327;BELA VISTA;
2024;1;FORTALEZA;36234;JOÃO MOTA;83;92;;1;ESCOLA MUNICIPAL SANTA MARIA;RUA CUIABÁ 1465;HENRIQUE JORGE;
2024;1;FORTALEZA;36234;JOÃO MOTA;83;118;790;1;ESCOLA MUNICIPAL MURILO SERPA;RUA MONSENHOR HIPOLITO BRASIL 1400;DOM LUSTOSA;
2024;1;FORTALEZA;36234;JOÃO MOTA;83;125;;1;EEMTI ANTONIETA SIQUEIRA;RUA GUARANI 04;HENRIQUE JORGE;
2024;1;FORTALEZA;36234;JOÃO MOTA;83;133;;1;ESCOLA MUNICIPAL PRESIDENTE KENNEDY;AV. LINEU MACHADO 811;JÓQUEI CLUBE;
2024;1;FORTALEZA;36234;JOÃO MOTA;83;164;;1;EEFM HERACLITO DE CASTRO E SILVA;RUA SILVEIRA FILHO, 808;JÓQUEI CLUBE;
2024;1;FORTALEZA;36234;JOÃO MOTA;83;288;;1;COLÉGIO ELITE;AVENIDA JOÃO PESSOA, 6302;MONTESE;
2024;1;FORTALEZA;36234;JOÃO MOTA;83;321;;2;ESCOLA MUNICIPAL JOSÉ BONIFÁCIO DE SOUSA;RUA PERNAMBUCO 600;DEMOCRITO ROCHA;
2024;1;FORTALEZA;36234;JOÃO MOTA;83;416;;1;EEMTI ESTADO DO AMAZONAS;RUA MONSENHOR FURTADO 2327;BELA VISTA;
2024;1;FORTALEZA;36234;JOÃO MOTA;83;428;;1;EEMTI ESTADO DO AMAZONAS;RUA MONSENHOR FURTADO 2327;BELA VISTA;
2024;1;FORTALEZA;36234;JOÃO MOTA;83;657;;1;EEFM JOSÉ WALDEMAR DE ALCÂNTARA E SILVA;RUA MACEIÓ, 627;DOM LUSTOSA;
2024;1;FORTALEZA;36234;JOÃO MOTA;83;705;;1;ESCOLA PEQUENO PRINCIPE;RUA SILVEIRA FILHO, 825;JÓQUEI CLUBE;
2024;1;FORTALEZA;36234;JOÃO MOTA;83;706;;1;CENTRO DE FORMAÇÃO E DESENV. PARA PROFISSIONAIS DA EDUCAÇÃO - FORMACE;RUA PORTO VELHO, 401;JOÃO XXIII;
2024;1;FORTALEZA;36234;JOÃO MOTA;83;711;;1;COLÉGIO PROFESSORA JEMINA GÓIS;RUA GUANABARA, 627;DEMOCRITO ROCHA;
2024;1;FORTALEZA;36234;JOÃO MOTA;83;715;;1;ESCOLA MUNICIPAL PRESIDENTE KENNEDY;AV. LINEU MACHADO 811;JÓQUEI CLUBE;
2024;1;FORTALEZA;36234;JOÃO MOTA;83;723;;1;COLEGIO CHRISTUS;AV. ENG. HUMBERTO MONTE, 1355;BELA VISTA;
2024;1;FORTALEZA;36234;JOÃO MOTA;83;727;;1;EEMTI SENADOR FERNANDES TÁVORA;RUA GOIÁS 141;BELA VISTA;
2024;1;FORTALEZA;36234;JOÃO MOTA;83;757;;1;CENTRO DE FORMAÇÃO E DESENV. PARA PROFISSIONAIS DA EDUCAÇÃO - FORMACE;RUA PORTO VELHO, 401;JOÃO XXIII;
2024;1;FORTALEZA;36234;JOÃO MOTA;83;760;;1;COLÉGIO DA POLÍCIA MILITAR DO CEARÁ GENERAL EDGARD FACÓ;AVENIDA MISTER HULL,  S/N - KM 1;ANTÔNIO BEZERRA;
2024;1;FORTALEZA;36234;JOÃO MOTA;83;762;;1;EEFM JOAQUIM ALVES;RUA ESTADO DO RIO 955;DEMOCRITO ROCHA;
2024;1;FORTALEZA;36234;JOÃO MOTA;83;763;;1;ESCOLA MUNICIPAL MURILO SERPA;RUA MONSENHOR HIPOLITO BRASIL 1400;DOM LUSTOSA;
2024;1;FORTALEZA;36234;JOÃO MOTA;83;765;;1;ESCOLA MUNICIPAL MURILO SERPA;RUA MONSENHOR HIPOLITO BRASIL 1400;DOM LUSTOSA;
2024;1;FORTALEZA;36234;JOÃO MOTA;83;792;;1;COLÉGIO LUCÊ;RUA CUIABA 155;JÓQUEI CLUBE;
2024;1;FORTALEZA;36234;JOÃO MOTA;85;102;;1;ESCOLA MARIA ÍRIS DE PAULA AMARAL;RUA TOMÁS CAVALCANTE, 460;AUTRAN NUNES;
2024;1;FORTALEZA;36234;JOÃO MOTA;85;128;;1;EMEIF AUTRAN NUNES;RUA PROFESSOR VIRGILIO MORAIS SN;AUTRAN NUNES;
2024;1;FORTALEZA;36234;JOÃO MOTA;85;138;;2;COLÉGIO LUÍZA TÁVORA;RUA 1050, N 171, 4 ETAPA;CONJUNTO CEARÁ I;
2024;1;FORTALEZA;36234;JOÃO MOTA;85;142;;1;EEEP PROFESSOR CESAR CAMPELO;RUA 717, N.164, 3 ETAPA;CONJUNTO CEARÁ I;
2024;1;FORTALEZA;36234;JOÃO MOTA;85;156;;1;EEF GOVERNADOR FAUSTINO ALBUQUERQUE - UV1;RUA 143 N 155 - 1 ETAPA;CONJUNTO CEARÁ I;
2024;1;FORTALEZA;36234;JOÃO MOTA;85;165;;1;EM BERGSON GURJÃO FARIAS;AVENIDA SENADOR FERNANDES TÁVORA, 2500;AUTRAN NUNES;
2024;1;FORTALEZA;36234;JOÃO MOTA;85;182;;1;EMTI MARIA DA HORA;RUA RAIMUNDO RIBEIRO, S/N;AUTRAN NUNES;
2024;1;FORTALEZA;36234;JOÃO MOTA;85;183;;2;EMTI MARIA DA HORA;RUA RAIMUNDO RIBEIRO, S/N;AUTRAN NUNES;
2024;1;FORTALEZA;36234;JOÃO MOTA;85;226;;2;EEM LICEU DO CONJUNTO CEARA;RUA 1139 A, 10 4 ETAPA;CONJUNTO CEARÁ I;
2024;1;FORTALEZA;36234;JOÃO MOTA;85;250;;1;ESCOLA PE JOSE ARIMATEIA DINIZ;RUA OITOCENTOS E DEZ, S/N, 3A ETAPA (AO LADO DA UPA);CONJUNTO CEARÁ I;
2024;1;FORTALEZA;36234;JOÃO MOTA;85;252;;1;EEF PATRONATO DA SAGRADA FAMILIA;RUA MARTINS NETO 379;ANTÔNIO BEZERRA;
2024;1;FORTALEZA;36234;JOÃO MOTA;85;260;;1;EMEIF DOLORES ALCANTARA;RUA CARDEAL ARCOVERDE S/N;AUTRAN NUNES;
2024;1;FORTALEZA;36234;JOÃO MOTA;85;271;;1;EEFM PROF PLACIDO ADERALDO CASTELO - UV 7B;RUA SETECENTOS E VINTE E UM, 100, 3A ETAPA;CONJUNTO CEARÁ I;
2024;1;FORTALEZA;36234;JOÃO MOTA;85;288;;1;EMEIF GERARDO MILTON DE SA;RUA VALE COSTA S/N;ANTÔNIO BEZERRA;
2024;1;FORTALEZA;36234;JOÃO MOTA;85;301;;1;EEFM ANTONIO BEZERRA;RUA PADRE PERDIGAO SAMPAIO 780;ANTÔNIO BEZERRA;
2024;1;FORTALEZA;36234;JOÃO MOTA;85;305;;1;EEFM ANTONIO BEZERRA;RUA PADRE PERDIGAO SAMPAIO 780;ANTÔNIO BEZERRA;
2024;1;FORTALEZA;36234;JOÃO MOTA;85;316;;1;ESCOLA MUNICIPAL DEP MURILO AGUIAR;RUA 24 DE OUTUBRO 655;GENIBAÚ;
2024;1;FORTALEZA;36234;JOÃO MOTA;85;331;;1;COLÉGIO ESSENCIAL;RUA PEDRO MELO, 1005;ANTÔNIO BEZERRA;
2024;1;FORTALEZA;36234;JOÃO MOTA;85;336;;1;EMEIF MANOEL CAETANO DE SOUZA;RUA SANTA LUCIA 170;GENIBAÚ;
2024;1;FORTALEZA;36234;JOÃO MOTA;85;357;;1;EEFM AYRTON SENNA DA SILVA;RUA MANAUS, 855;DOM LUSTOSA;
2024;1;FORTALEZA;36234;JOÃO MOTA;85;361;;1;EEFM AYRTON SENNA DA SILVA;RUA MANAUS, 855;DOM LUSTOSA;
2024;1;FORTALEZA;36234;JOÃO MOTA;93;76;;1;EM JONATHAN DA ROCHA ALCOFORADO;RUA MARIA GOMES DE SÁ,1030 ARACAPÉ;MONDUBIM;
2024;1;FORTALEZA;36234;JOÃO MOTA;93;95;;1;CEI ROGACIANO LEITE;AVENIDA J, 1488 - III ETAPA;PREFEITO JOSÉ WALTER;
2024;1;FORTALEZA;36234;JOÃO MOTA;93;99;302;1;CUCA JOSÉ WALTER;RUA 69, S/N;PREFEITO JOSÉ WALTER;
2024;1;FORTALEZA;36234;JOÃO MOTA;93;111;;1;EM OSMIRIO DE OLIVEIRA BARRETO;RUA 10, S/N (CJ SITIO DO CÓRREGO);MONDUBIM;
2024;1;FORTALEZA;36234;JOÃO MOTA;93;147;;1;EEEP PROFESSOR ONELIO PORTO;AVENIDA E, 471 - II ETAPA;PREFEITO JOSÉ WALTER;
2024;1;FORTALEZA;36234;JOÃO MOTA;93;182;;1;EEFM ESTADO DO MARANHAO;RUA CARLOS PIMENTA,506;MONDUBIM;
2024;1;FORTALEZA;36234;JOÃO MOTA;93;197;;1;EM ADALBERTO STUDART FILHO;RUA DO CAMPO, 25;PLANALTO AYRTON SENNA;
2024;1;FORTALEZA;36234;JOÃO MOTA;93;203;;1;LICEU ESTADUAL DOMINGOS BRASILEIRO;RUA PLANALTINA, S/N;PLANALTO AYRTON SENNA;
2024;1;FORTALEZA;36234;JOÃO MOTA;93;223;;1;EEFM POLIVALENTE MODELO DE FORTALEZA;AV A (ARAQUÉM AGUIAR), 482 - I ETAPA;PREFEITO JOSÉ WALTER;
2024;1;FORTALEZA;36234;JOÃO MOTA;93;231;;1;EEEP PROFESSOR OTAVIO TERCEIRO DE FARIAS;AVENIDA C, 435;PREFEITO JOSÉ WALTER;
2024;1;FORTALEZA;36234;JOÃO MOTA;93;233;;1;EEEP PROFESSOR OTAVIO TERCEIRO DE FARIAS;AVENIDA C, 435;PREFEITO JOSÉ WALTER;
2024;1;FORTALEZA;36234;JOÃO MOTA;93;254;;1;EM FRANCISCO NUNES CAVALCANTE;RUA POETA MÁRIO LINHARES, 561;PREFEITO JOSÉ WALTER;
2024;1;FORTALEZA;36234;JOÃO MOTA;93;255;;1;EM FRANCISCO NUNES CAVALCANTE;RUA POETA MÁRIO LINHARES, 561;PREFEITO JOSÉ WALTER;
2024;1;FORTALEZA;36234;JOÃO MOTA;93;264;;1;LICEU ESTADUAL DOMINGOS BRASILEIRO;RUA PLANALTINA, S/N;PLANALTO AYRTON SENNA;
2024;1;FORTALEZA;36234;JOÃO MOTA;93;277;;1;CENTRO DE INCLUSÃO TECNOLÓGICA E SOCIAL - CITS JOSÉ WALTER;AV. K, 330, SEGUNDA ETAPA;PREFEITO JOSÉ WALTER;
2024;1;FORTALEZA;36234;JOÃO MOTA;93;294;;1;CEI MARIA LETICIA MOTA MOREIRA;RUA 15, S/N, RESIDENCIAL CIDADE JARDIM II;PREFEITO JOSÉ WALTER;
2024;1;FORTALEZA;36234;JOÃO MOTA;93;307;;1;CEI MARIA LETICIA MOTA MOREIRA;RUA 15, S/N, RESIDENCIAL CIDADE JARDIM II;PREFEITO JOSÉ WALTER;
2024;1;FORTALEZA;36234;JOÃO MOTA;93;308;;1;CUCA JOSÉ WALTER;RUA 69, S/N;PREFEITO JOSÉ WALTER;
2024;1;FORTALEZA;36234;JOÃO MOTA;94;10;;1;EEMTI MARIA JOSÉ SANTOS FERREIRA GOMES;RUA DONA LUCIA PINHEIRO, 93;QUINTINO CUNHA;
2024;1;FORTALEZA;36234;JOÃO MOTA;94;67;;1;CEI JOAQUIM NOGUEIRA;R. SAO VICENTE DE PAULO, 72-126;ANTÔNIO BEZERRA;
2024;1;FORTALEZA;36234;JOÃO MOTA;94;649;;1;EMEIEF PROF JOSE PARSIFAL BARROSO;AV MAJOR ASSIS 1076;VILA VELHA;
2024;1;FORTALEZA;36234;JOÃO MOTA;94;758;;1;EEMTI MARIA JOSÉ SANTOS FERREIRA GOMES;RUA DONA LUCIA PINHEIRO, 93;QUINTINO CUNHA;
2024;1;FORTALEZA;36234;JOÃO MOTA;94;812;;1;IGREJA DE SÃO JOSÉ;R. GEN. ALÍPIO DOS SANTOS, 375;QUINTINO CUNHA;
2024;1;FORTALEZA;36234;JOÃO MOTA;94;837;;1;COLÉGIO DOM FELIPE;AV INDEPENDÊNCIA. 1652;QUINTINO CUNHA;
2024;1;FORTALEZA;36234;JOÃO MOTA;94;859;;1;EMEIF LORHAN MARQUES MEDEIROS;RUA CREUZA ROCHA, 255;JARDIM GUANABARA;
2024;1;FORTALEZA;36234;JOÃO MOTA;94;897;;1;EEMTI MONSENHOR DOURADO;AVENIDA SARGENTO HERMÍNIO SAMPAIO 4600;PADRE ANDRADE;
2024;1;FORTALEZA;36234;JOÃO MOTA;94;907;;1;EM ANTONIO CORREIA LIMA;RUA HERMES PARAYBA, 934;VILA VELHA;
2024;1;FORTALEZA;36234;JOÃO MOTA;94;915;;1;CEI MARIA MARIZA MENDES DE CARVALHO;RUA RAIMUNDO CUNHA 1174;VILA VELHA;
2024;1;FORTALEZA;36234;JOÃO MOTA;94;942;;1;COLÉGIO UNIVERSO;RUA JOAQUIM ALBANO, N 100;PADRE ANDRADE;
2024;1;FORTALEZA;36234;JOÃO MOTA;95;85;;1;EEFM PADRE MARCELINO CHAMPAGNAT;RUA DAURA, 120;BARROSO;
2024;1;FORTALEZA;36234;JOÃO MOTA;95;87;;1;EEFM PADRE MARCELINO CHAMPAGNAT;RUA DAURA, 120;BARROSO;
2024;1;FORTALEZA;36234;JOÃO MOTA;95;89;;1;EEFM PADRE MARCELINO CHAMPAGNAT;RUA DAURA, 120;BARROSO;
2024;1;FORTALEZA;36234;JOÃO MOTA;95;101;;1;EEFM DOUTORA ALDACI BARBOSA;RUA VALPARAISO, 155;CONJUNTO PALMEIRAS;
2024;1;FORTALEZA;36234;JOÃO MOTA;95;106;;1;EEFM DOUTORA ALDACI BARBOSA;RUA VALPARAISO, 155;CONJUNTO PALMEIRAS;
2024;1;FORTALEZA;36234;JOÃO MOTA;95;116;;1;EMEIEF PROFESSORA BERNADETE ORIÁ DE OLIVEIRA;RUA DR. CODES SANDOVAL 796;CONJUNTO PALMEIRAS;
2024;1;FORTALEZA;36234;JOÃO MOTA;95;119;;1;EMEIEF MARIA HELENICE CAVALCANTE LEITE MARTINS;RUA MAIZA, S/N;CONJUNTO PALMEIRAS;
2024;1;FORTALEZA;36234;JOÃO MOTA;95;128;;1;EM PROFESSOR FRANCISCO DE MELO JABORANDI;AV. GOVERNADOR LEONEL BRIZOLA, 198;JANGURUSSU;
2024;1;FORTALEZA;36234;JOÃO MOTA;95;131;;1;EM PROFESSOR FRANCISCO DE MELO JABORANDI;AV. GOVERNADOR LEONEL BRIZOLA, 198;JANGURUSSU;
2024;1;FORTALEZA;36234;JOÃO MOTA;95;144;;1;EMTI PROFESSOR ANTONIO GIRAO BARROSO;RUA VERDE 37, S/N (CJ SITIO SAO JOAO);JANGURUSSU;
2024;1;FORTALEZA;36234;JOÃO MOTA;95;171;;1;EEMTI POETA OTACILIO COLARES;RUA JORGE DA VEIGA, 265;PARQUE SANTA MARIA;
2024;1;FORTALEZA;36234;JOÃO MOTA;95;183;;1;DNIT;RODOVIA BR-116, KM 06;CAJAZEIRAS;
2024;1;FORTALEZA;36234;JOÃO MOTA;95;226;;1;EM FRANCISCA ORIA SERPA;RUA JORGE FIGUEIREDO, 3652;PEDRAS;
2024;1;FORTALEZA;36234;JOÃO MOTA;95;228;;1;CENTRO DE CIDADANIA DOS DIREITOS HUMANOS-CCDH (EVANDRO AYRES DE MOURA);AV. CASTELO DE CASTRO, 2842;CONJUNTO PALMEIRAS;
2024;1;FORTALEZA;36234;JOÃO MOTA;95;231;;1;CENTRO DE CIDADANIA DOS DIREITOS HUMANOS-CCDH (EVANDRO AYRES DE MOURA);AV. CASTELO DE CASTRO, 2842;CONJUNTO PALMEIRAS;
2024;1;FORTALEZA;36234;JOÃO MOTA;95;233;;1;CEI MARIA DO SOCORRO FERREIRA VIRINO;RUA VALPARAÍSO, 339;CONJUNTO PALMEIRAS;
2024;1;FORTALEZA;36234;JOÃO MOTA;95;237;;1;EMEIEF TAÍS MARIA BEZERRA NOGUEIRA;AV. GOVERNADOR LEONEL BRIZOLA, 710;JANGURUSSU;
2024;1;FORTALEZA;36234;JOÃO MOTA;95;243;;2;EMEIEF TAÍS MARIA BEZERRA NOGUEIRA;AV. GOVERNADOR LEONEL BRIZOLA, 710;JANGURUSSU;
2024;1;FORTALEZA;36234;JOÃO MOTA;95;248;;1;CITS - CENTRO DE INCLUSÃO TECNOLÓGICA E SOCIAL;RUA L, 20, CONJUNTO JOÃO PAULO II;JANGURUSSU;
2024;1;FORTALEZA;36234;JOÃO MOTA;95;253;;1;EMEIEF OTAVIO DE FARIAS;RUA JOAO FERREIRA, S/N;BARROSO;
2024;1;FORTALEZA;36234;JOÃO MOTA;95;262;;1;EEFM PROFESSOR  ALOYSIO BARROS LEAL;RUA 10,  LOT. PRQ.VERDE 28 (CJ JOAO PAULO II);BARROSO;
2024;1;FORTALEZA;36234;JOÃO MOTA;95;264;;1;EEFM PROFESSOR  ALOYSIO BARROS LEAL;RUA 10,  LOT. PRQ.VERDE 28 (CJ JOAO PAULO II);BARROSO;
2024;1;FORTALEZA;36234;JOÃO MOTA;95;269;;1;EM SINÓ PINHEIRO;RUA 14, 151 (CJ JOAO PAULO II);BARROSO;
2024;1;FORTALEZA;36234;JOÃO MOTA;95;270;;1;EM SINÓ PINHEIRO;RUA 14, 151 (CJ JOAO PAULO II);BARROSO;
2024;1;FORTALEZA;36234;JOÃO MOTA;95;272;;2;EM SINÓ PINHEIRO;RUA 14, 151 (CJ JOAO PAULO II);BARROSO;
2024;1;FORTALEZA;36234;JOÃO MOTA;95;273;;2;EMEIF PROFESSORA OLINDINA CARVALHO DE MORAIS;RUA 5, 581 (CJ JOÃO PAULO II);BARROSO;
2024;1;FORTALEZA;36234;JOÃO MOTA;95;274;;1;EMEIF PROFESSORA OLINDINA CARVALHO DE MORAIS;RUA 5, 581 (CJ JOÃO PAULO II);BARROSO;
2024;1;FORTALEZA;36234;JOÃO MOTA;95;283;;1;EM PROFESSORA MARIA ANTONÉZIA MEIRELES E SÁ;RUA CORONEL VIRGÍLIO TÁVORA, 1340;BARROSO;
2024;1;FORTALEZA;36234;JOÃO MOTA;95;284;;1;EM PROFESSORA MARIA ANTONÉZIA MEIRELES E SÁ;RUA CORONEL VIRGÍLIO TÁVORA, 1340;BARROSO;
2024;1;FORTALEZA;36234;JOÃO MOTA;95;290;;1;EMEIEF MARTHA DOS MARTINS COELHO GUILHERME;RUA 313, 243, CONJUNTO SÃO CRISTÓVÃO;JANGURUSSU;
2024;1;FORTALEZA;36234;JOÃO MOTA;95;310;;1;EMEIF MARIA DE JESUS ORIÁ ALENCAR;RUA VERDE QUARENTA E TRÊS, S/N, CONJUNTO SÍTIO SÃO JOÃO;JANGURUSSU;
