Ano;Turno;Município;Número;Candidato;Zona;Seção;Seções Agregadas;Votos;Local de Votação;Endereço Local de Votação;Bairro;
2024;1;FORTALEZA;36001;KATIANA WEYNE;1;33;;1;UNINTA - FACULDADE UNINTA FORTALEZA;RUA VILEBALDO AGUIAR,133;COCÓ;
2024;1;FORTALEZA;36001;KATIANA WEYNE;1;34;;1;UNINTA - FACULDADE UNINTA FORTALEZA;RUA VILEBALDO AGUIAR,133;COCÓ;
2024;1;FORTALEZA;36001;KATIANA WEYNE;1;143;;1;ESCOLA ESTADUAL ARQUITETO ROGERIO FROES;AVENIDA DAS GRAVIOLAS 1000;CIDADE 2000;
2024;1;FORTALEZA;36001;KATIANA WEYNE;1;145;;1;ESCOLA ESTADUAL ARQUITETO ROGERIO FROES;AVENIDA DAS GRAVIOLAS 1000;CIDADE 2000;
2024;1;FORTALEZA;36001;KATIANA WEYNE;1;726;;1;COLEGIO ESPACO ABERTO - BENTO ALBUQUERQUE;RUA BENTO ALBUQUERQUE 1671;PAPICU;
2024;1;FORTALEZA;36001;KATIANA WEYNE;1;845;;1;COLEGIO ANTARES - SANTOS DUMONT;AVENIDA SANTOS DUMONT 3777;ALDEOTA;
2024;1;FORTALEZA;36001;KATIANA WEYNE;1;879;;1;COLEGIO ANTARES - SANTOS DUMONT;AVENIDA SANTOS DUMONT 3777;ALDEOTA;
2024;1;FORTALEZA;36001;KATIANA WEYNE;1;896;;2;FANOR - FACULDADE NORDESTE;AVENIDA SANTOS DUMONT 7800;DE LOURDES;
2024;1;FORTALEZA;36001;KATIANA WEYNE;1;941;;1;COLEGIO ARI DE SA - MONSENHOR CATAO;RUA MONSENHOR CATAO, 1655;ALDEOTA;
2024;1;FORTALEZA;36001;KATIANA WEYNE;2;525;;2;EM PROFª FERNANDA MARIA DE ALENCAR COLARES;AV PROF. ARTHUR DE CARVALHO, 1540;LAGOA REDONDA;
2024;1;FORTALEZA;36001;KATIANA WEYNE;2;729;;1;SECRETARIA DA EDUCACAO - CAMBEBA;AVENIDA MINISTRO JOSE AMERICO, SN;CAMBEBA;
2024;1;FORTALEZA;36001;KATIANA WEYNE;2;759;;1;SECRETARIA DA EDUCACAO - CAMBEBA;AVENIDA MINISTRO JOSE AMERICO, SN;CAMBEBA;
2024;1;FORTALEZA;36001;KATIANA WEYNE;2;801;;1;EEFM IRACEMA;RUA EGIDIO DE OLIVEIRA, 250;JOSÉ DE ALENCAR;
2024;1;FORTALEZA;36001;KATIANA WEYNE;2;818;;1;COLÉGIO CHRISTUS SUL;AV. ENG. LEAL LIMA VERDE, 2265;JOSÉ DE ALENCAR;
2024;1;FORTALEZA;36001;KATIANA WEYNE;2;824;;1;SECRETARIA DA EDUCACAO - CAMBEBA;AVENIDA MINISTRO JOSE AMERICO, SN;CAMBEBA;
2024;1;FORTALEZA;36001;KATIANA WEYNE;3;234;235;1;FAC. ESTÁCIO - UNIDADE CENTRO (ANTIGO COLÉGIO CEARENSE);AV. DUQUE DE CAXIAS, 101;CENTRO;
2024;1;FORTALEZA;36001;KATIANA WEYNE;3;237;292;1;COLÉGIO ESTADUAL JUSTINIANO DE SERPA;AV. SANTOS DUMONT, 56;CENTRO;
2024;1;FORTALEZA;36001;KATIANA WEYNE;3;394;;1;RECEITA FEDERAL (SUPER. DE ADM. DO MIN. DA ECON. NO CEARÁ);RUA BARÃO DE ARACATI, 909;ALDEOTA;
2024;1;FORTALEZA;36001;KATIANA WEYNE;3;397;;1;RECEITA FEDERAL (SUPER. DE ADM. DO MIN. DA ECON. NO CEARÁ);RUA BARÃO DE ARACATI, 909;ALDEOTA;
2024;1;FORTALEZA;36001;KATIANA WEYNE;3;398;;1;COLÉGIO CHRISTUS (AV. BARÃO DE STUDART);RUA JOÃO CARVALHO, 630;ALDEOTA;
2024;1;FORTALEZA;36001;KATIANA WEYNE;3;399;;1;COLÉGIO CHRISTUS (AV. BARÃO DE STUDART);RUA JOÃO CARVALHO, 630;ALDEOTA;
2024;1;FORTALEZA;36001;KATIANA WEYNE;3;411;;1;COLÉGIO DARWIN;RUA ILDEFONSO ALBANO, 1030;ALDEOTA;
2024;1;FORTALEZA;36001;KATIANA WEYNE;3;437;;1;COLÉGIO CHRISTUS (AV. BARÃO DE STUDART);RUA JOÃO CARVALHO, 630;ALDEOTA;
2024;1;FORTALEZA;36001;KATIANA WEYNE;3;452;;1;COLÉGIO DARWIN;RUA ILDEFONSO ALBANO, 1030;ALDEOTA;
2024;1;FORTALEZA;36001;KATIANA WEYNE;3;458;;1;COLÉGIO DARWIN;RUA ILDEFONSO ALBANO, 1030;ALDEOTA;
2024;1;FORTALEZA;36001;KATIANA WEYNE;3;565;;1;EM JOSÉ DIAS MACEDO;RUA NUNES VALENTE, 809;MEIRELES;
2024;1;FORTALEZA;36001;KATIANA WEYNE;3;602;;1;COLÉGIO SANTA CECÍLIA;AV. SENADOR VIRGÍLIO TÁVORA, 2000;ALDEOTA;
2024;1;FORTALEZA;36001;KATIANA WEYNE;3;635;;1;NÁUTICO ATLÉTICO CEARENSE;AV. DA ABOLIÇÃO, 2727;MEIRELES;
2024;1;FORTALEZA;36001;KATIANA WEYNE;80;119;;1;EEFM ESTADO DO PARÁ;RUA DJALMA PETIT 589;ALTO DA BALANÇA;
2024;1;FORTALEZA;36001;KATIANA WEYNE;80;123;;1;EEFM ESTADO DO PARÁ;RUA DJALMA PETIT 589;ALTO DA BALANÇA;
2024;1;FORTALEZA;36001;KATIANA WEYNE;80;126;;1;EEFM ESTADO DO PARÁ;RUA DJALMA PETIT 589;ALTO DA BALANÇA;
2024;1;FORTALEZA;36001;KATIANA WEYNE;80;131;;1;EM PROFESSORA EDITH BRAGA;RUA CAPITAO VASCONCELOS 1061;ALTO DA BALANÇA;
2024;1;FORTALEZA;36001;KATIANA WEYNE;80;153;;1;EEFM CEL PROF JOSÉ AURÉLIO CÂMARA;RUA JORGE ACURCIO, 655;VILA UNIÃO;
2024;1;FORTALEZA;36001;KATIANA WEYNE;80;175;;1;CENTRO EDUC. DA JUV. PE. JOÃO PIAMARTA - AGUANAMBI;AV. AGUANAMBI, 2479;FÁTIMA;
2024;1;FORTALEZA;36001;KATIANA WEYNE;80;184;;1;COLÉGIO NOSSA SENHORA DAS GRAÇAS;RUA MONSENHOR OTÁVIO DE CASTRO, 535;FÁTIMA;
2024;1;FORTALEZA;36001;KATIANA WEYNE;80;185;;2;COLÉGIO NOSSA SENHORA DAS GRAÇAS;RUA MONSENHOR OTÁVIO DE CASTRO, 535;FÁTIMA;
2024;1;FORTALEZA;36001;KATIANA WEYNE;80;191;;1;COLÉGIO NOSSA SENHORA DAS GRAÇAS;RUA MONSENHOR OTÁVIO DE CASTRO, 535;FÁTIMA;
2024;1;FORTALEZA;36001;KATIANA WEYNE;80;202;;1;UAPS CESAR CALS DE OLIVEIRA;RUA CAPITÃO ARAGÃO 555;ALTO DA BALANÇA;
2024;1;FORTALEZA;36001;KATIANA WEYNE;80;212;;1;EM PROFESSORA EDITH BRAGA;RUA CAPITAO VASCONCELOS 1061;ALTO DA BALANÇA;
2024;1;FORTALEZA;36001;KATIANA WEYNE;80;300;;1;ASSEMBLÉIA LEGISLATIVA - UNIVERSIDADE DO PARLAMENTO CEARENSE;RUA BARBOSA DE FREITAS, 2674;DIONISIO TORRES;
2024;1;FORTALEZA;36001;KATIANA WEYNE;80;349;;1;COLÉGIO SALESIANO DOM BOSCO;AV ANTONIO SALES 116;JOAQUIM TÁVORA;
2024;1;FORTALEZA;36001;KATIANA WEYNE;80;358;;1;EMEIF ALMERINDA DE ALBUQUERQUE;RUA ANA GONCALVES 1105;TAUAPE;
2024;1;FORTALEZA;36001;KATIANA WEYNE;80;368;;1;INSTITUTO DE EDUCAÇÃO DO CEARÁ;RUA GRACILIANO RAMOS, 52;FÁTIMA;
2024;1;FORTALEZA;36001;KATIANA WEYNE;80;394;;1;EEM GOV. ADAUTO BEZERRA;RUA MONSENHOR LIBERATO, 1850;FÁTIMA;
2024;1;FORTALEZA;36001;KATIANA WEYNE;80;398;;1;EEM GOV. ADAUTO BEZERRA;RUA MONSENHOR LIBERATO, 1850;FÁTIMA;
2024;1;FORTALEZA;36001;KATIANA WEYNE;80;420;;1;COLÉGIO SANTO TOMÁZ DE AQUINO;RUA MÁRIO MAMEDE, 750;FÁTIMA;
2024;1;FORTALEZA;36001;KATIANA WEYNE;80;423;;1;COLÉGIO ANTARES FÁTIMA (VILA UNIÃO);RUA ALBERTO MONTEZUMA, 235;VILA UNIÃO;
2024;1;FORTALEZA;36001;KATIANA WEYNE;80;424;;1;FACULDADE MAURÍCIO DE NASSAU;AVENIDA VISCONDE DO RIO BRANCO, 2078;JOSÉ BONIFÁCIO;
2024;1;FORTALEZA;36001;KATIANA WEYNE;80;425;;1;ASSEMBLÉIA LEGISLATIVA - UNIVERSIDADE DO PARLAMENTO CEARENSE;RUA BARBOSA DE FREITAS, 2674;DIONISIO TORRES;
2024;1;FORTALEZA;36001;KATIANA WEYNE;80;431;;1;COLÉGIO MONSENHOR JOVINIANO BARRETO - INFANTIL;RUA FREI VIDAL, 1680;TAUAPE;
2024;1;FORTALEZA;36001;KATIANA WEYNE;82;29;;1;SECRETARIA DE DESENVOLVIMENTO AGRÁRIO DO ESTADO DO CEARÁ;AV. BEZERRA DE MENEZES, 1620;SÃO GERARDO;
2024;1;FORTALEZA;36001;KATIANA WEYNE;82;33;;1;SECRETARIA DE DESENVOLVIMENTO AGRÁRIO DO ESTADO DO CEARÁ;AV. BEZERRA DE MENEZES, 1620;SÃO GERARDO;
2024;1;FORTALEZA;36001;KATIANA WEYNE;83;129;;1;ESCOLA MUNICIPAL PRESIDENTE KENNEDY;AV. LINEU MACHADO 811;JÓQUEI CLUBE;
2024;1;FORTALEZA;36001;KATIANA WEYNE;83;165;;1;EEFM HERACLITO DE CASTRO E SILVA;RUA SILVEIRA FILHO, 808;JÓQUEI CLUBE;
2024;1;FORTALEZA;36001;KATIANA WEYNE;83;169;;1;EEFM HERACLITO DE CASTRO E SILVA;RUA SILVEIRA FILHO, 808;JÓQUEI CLUBE;
2024;1;FORTALEZA;36001;KATIANA WEYNE;83;475;;1;ESCOLA MUNICIPAL JOSÉ BATISTA DE OLIVEIRA;RUA GOIÁS 620;PANAMERICANO;
2024;1;FORTALEZA;36001;KATIANA WEYNE;83;570;;1;EEMTI ANTONIETA SIQUEIRA;RUA GUARANI 04;HENRIQUE JORGE;
2024;1;FORTALEZA;36001;KATIANA WEYNE;83;623;;1;ESCOLA MUNICIPAL JOSÉ BATISTA DE OLIVEIRA;RUA GOIÁS 620;PANAMERICANO;
2024;1;FORTALEZA;36001;KATIANA WEYNE;83;688;;1;EEMTI ESTADO DO AMAZONAS;RUA MONSENHOR FURTADO 2327;BELA VISTA;
2024;1;FORTALEZA;36001;KATIANA WEYNE;83;755;;1;CENTRO DE FORMAÇÃO E DESENV. PARA PROFISSIONAIS DA EDUCAÇÃO - FORMACE;RUA PORTO VELHO, 401;JOÃO XXIII;
2024;1;FORTALEZA;36001;KATIANA WEYNE;83;757;;1;CENTRO DE FORMAÇÃO E DESENV. PARA PROFISSIONAIS DA EDUCAÇÃO - FORMACE;RUA PORTO VELHO, 401;JOÃO XXIII;
2024;1;FORTALEZA;36001;KATIANA WEYNE;83;785;;1;CENTRO DE FORMAÇÃO E DESENV. PARA PROFISSIONAIS DA EDUCAÇÃO - FORMACE;RUA PORTO VELHO, 401;JOÃO XXIII;
2024;1;FORTALEZA;36001;KATIANA WEYNE;85;126;;1;EMEIF AUTRAN NUNES;RUA PROFESSOR VIRGILIO MORAIS SN;AUTRAN NUNES;
2024;1;FORTALEZA;36001;KATIANA WEYNE;85;128;;1;EMEIF AUTRAN NUNES;RUA PROFESSOR VIRGILIO MORAIS SN;AUTRAN NUNES;
2024;1;FORTALEZA;36001;KATIANA WEYNE;85;130;;2;EMEIF AUTRAN NUNES;RUA PROFESSOR VIRGILIO MORAIS SN;AUTRAN NUNES;
2024;1;FORTALEZA;36001;KATIANA WEYNE;85;131;;1;EMEIF AUTRAN NUNES;RUA PROFESSOR VIRGILIO MORAIS SN;AUTRAN NUNES;
2024;1;FORTALEZA;36001;KATIANA WEYNE;93;86;;1;EM RACHEL DE QUEIROZ;AVENIDA C, S/N - II ETAPA;PREFEITO JOSÉ WALTER;
2024;1;FORTALEZA;36001;KATIANA WEYNE;93;138;;1;COLEGIO VEGA;AVENIDA C, 160;PREFEITO JOSÉ WALTER;
2024;1;FORTALEZA;36001;KATIANA WEYNE;93;158;;1;CUCA JOSÉ WALTER;RUA 69, S/N;PREFEITO JOSÉ WALTER;
2024;1;FORTALEZA;36001;KATIANA WEYNE;93;269;;1;CENTRO DE INCLUSÃO TECNOLÓGICA E SOCIAL - CITS JOSÉ WALTER;AV. K, 330, SEGUNDA ETAPA;PREFEITO JOSÉ WALTER;
2024;1;FORTALEZA;36001;KATIANA WEYNE;93;315;;1;EM JOAO HILDO DE CARVALHO FURTADO;RUA MIGUEL ARAGÃO, S/N ARACAPÉ;MONDUBIM;
2024;1;FORTALEZA;36001;KATIANA WEYNE;94;45;;1;EEFM JOSE BEZERRA DE MENEZES (POLIVALENTE);RUA ANARIO BRAGA SN;ANTÔNIO BEZERRA;
2024;1;FORTALEZA;36001;KATIANA WEYNE;94;688;;1;CEJA - EUDES VERAS;AV. DEMÉTRIO MENEZES, 130;ANTÔNIO BEZERRA;
2024;1;FORTALEZA;36001;KATIANA WEYNE;94;776;;1;IGREJA DE SÃO JOSÉ;R. GEN. ALÍPIO DOS SANTOS, 375;QUINTINO CUNHA;
2024;1;FORTALEZA;36001;KATIANA WEYNE;94;902;;1;EM ANTONIO CORREIA LIMA;RUA HERMES PARAYBA, 934;VILA VELHA;
2024;1;FORTALEZA;36001;KATIANA WEYNE;95;88;;3;EEFM PADRE MARCELINO CHAMPAGNAT;RUA DAURA, 120;BARROSO;
2024;1;FORTALEZA;36001;KATIANA WEYNE;95;91;;1;EEFM PADRE MARCELINO CHAMPAGNAT;RUA DAURA, 120;BARROSO;
2024;1;FORTALEZA;36001;KATIANA WEYNE;95;199;;1;EM TRISTÃO DE ALENCAR;RUA JOSE NOGUEIRA, 69;PEDRAS;
2024;1;FORTALEZA;36001;KATIANA WEYNE;95;235;;1;CEI MARIA DO SOCORRO FERREIRA VIRINO;RUA VALPARAÍSO, 339;CONJUNTO PALMEIRAS;
2024;1;FORTALEZA;36001;KATIANA WEYNE;95;276;;2;EMEIF PROFESSORA OLINDINA CARVALHO DE MORAIS;RUA 5, 581 (CJ JOÃO PAULO II);BARROSO;
2024;1;FORTALEZA;36001;KATIANA WEYNE;95;322;;1;EMEIEF OTAVIO DE FARIAS;RUA JOAO FERREIRA, S/N;BARROSO;
2024;1;FORTALEZA;36001;KATIANA WEYNE;95;327;;1;EEFM PROFESSOR  ALOYSIO BARROS LEAL;RUA 10,  LOT. PRQ.VERDE 28 (CJ JOAO PAULO II);BARROSO;
2024;1;FORTALEZA;36001;KATIANA WEYNE;112;347;;1;EM PROF. LUIS COSTA;RUA JAIME LEONEL, 156;ENGENHEIRO LUCIANO CAVALCANTE;
2024;1;FORTALEZA;36001;KATIANA WEYNE;112;406;;1;COLEGIO ARI DE SA CAVALCANTE WS;AV WASHINGTON SOARES, 3737;EDSON QUEIROZ;
2024;1;FORTALEZA;36001;KATIANA WEYNE;112;454;;1;UNIVERSIDADE DE FORTALEZA - UNIFOR;AVENIDA WASHINGTON SOARES, 1321;EDSON QUEIROZ;
2024;1;FORTALEZA;36001;KATIANA WEYNE;112;478;;1;EM IRMA SIMAS;RUA JOSE SOBREIRA, 608;SAPIRANGA-COITÉ;
2024;1;FORTALEZA;36001;KATIANA WEYNE;112;480;;1;EM IRMA SIMAS;RUA JOSE SOBREIRA, 608;SAPIRANGA-COITÉ;
2024;1;FORTALEZA;36001;KATIANA WEYNE;112;483;;1;EM PROFª ALDACI BARBOSA;RUA OLEGARIO MEMORIA, 1257;SAPIRANGA-COITÉ;
2024;1;FORTALEZA;36001;KATIANA WEYNE;113;2;1;1;FACULDADE DE ARQUITETURA E URBANISMO DA UFC;AV. DA UNIVERSIDADE, 2890;BENFICA;
2024;1;FORTALEZA;36001;KATIANA WEYNE;113;8;7;1;FACULDADE DE ARQUITETURA E URBANISMO DA UFC;AV. DA UNIVERSIDADE, 2890;BENFICA;
2024;1;FORTALEZA;36001;KATIANA WEYNE;113;23;;1;IFCE - INST FEDERAL DE CIÊNCIA E TECNOLOGIA (CEFET);AV. 13 DE MAIO, 2081;BENFICA;
2024;1;FORTALEZA;36001;KATIANA WEYNE;113;24;;1;IFCE - INST FEDERAL DE CIÊNCIA E TECNOLOGIA (CEFET);AV. 13 DE MAIO, 2081;BENFICA;
2024;1;FORTALEZA;36001;KATIANA WEYNE;113;53;;1;COLÉGIO FARIAS BRITO;RUA SENADOR POMPEU, 2607;JOSÉ BONIFÁCIO;
2024;1;FORTALEZA;36001;KATIANA WEYNE;113;54;;1;COLÉGIO FARIAS BRITO;RUA SENADOR POMPEU, 2607;JOSÉ BONIFÁCIO;
2024;1;FORTALEZA;36001;KATIANA WEYNE;113;55;;1;COLÉGIO FARIAS BRITO;RUA SENADOR POMPEU, 2607;JOSÉ BONIFÁCIO;
2024;1;FORTALEZA;36001;KATIANA WEYNE;113;128;;1;EEFM FIGUEIREDO CORREIA;RUA MARECHAL DEODORO, 733;BENFICA;
2024;1;FORTALEZA;36001;KATIANA WEYNE;113;129;;1;EEFM FIGUEIREDO CORREIA;RUA MARECHAL DEODORO, 733;BENFICA;
2024;1;FORTALEZA;36001;KATIANA WEYNE;113;130;;1;EEFM FIGUEIREDO CORREIA;RUA MARECHAL DEODORO, 733;BENFICA;
2024;1;FORTALEZA;36001;KATIANA WEYNE;113;210;;1;COLÉGIO DEOCLÉCIO FERRO;RUA MINERVINO DE CASTRO, 987;RODOLFO TEÓFILO;
2024;1;FORTALEZA;36001;KATIANA WEYNE;113;254;;1;EEFM SANTO AFONSO;RUA GAL. BERNARDO FIGUEIREDO, 2670;PARQUELÂNDIA;
2024;1;FORTALEZA;36001;KATIANA WEYNE;113;279;;1;COLÉGIO JUVENAL DE CARVALHO;AV. JOÃO PESSOA, 4279;DAMAS;
2024;1;FORTALEZA;36001;KATIANA WEYNE;113;342;;1;ESCOLA ESTADUAL DE EDUCAÇÃO PROFISSIONAL JOAQUIM NOGUEIRA;RUA MOREIRA DE SOUSA, 327;PARQUELÂNDIA;
2024;1;FORTALEZA;36001;KATIANA WEYNE;113;350;;1;SECRETARIA EXECUTIVA REGIONAL III - FORTALEZA;AV JOVITA FEITOSA 3090;PARQUELÂNDIA;
2024;1;FORTALEZA;36001;KATIANA WEYNE;113;374;;1;COLÉGIO NOSSA SENHORA APARECIDA;RUA AQUILES BORIS, 342;MONTESE;
2024;1;FORTALEZA;36001;KATIANA WEYNE;113;381;;1;CRECHE ESPACO E VIDA;RUA PEDRO DE QUEIROZ, 532;PARQUELÂNDIA;
2024;1;FORTALEZA;36001;KATIANA WEYNE;115;255;;1;FACULDADE UNINASSAU - PARANGABA;RUA GERMANO FRANCK, 567;PARANGABA;
2024;1;FORTALEZA;36001;KATIANA WEYNE;115;282;;1;EM CLÁUDIO MARTINS;RUA BARÃO DE CANINDÉ, S/N;PARANGABA;
2024;1;FORTALEZA;36001;KATIANA WEYNE;115;377;;1;EEMTI GENERAL EUDORO CORREA;RUA JULIO BRAGA 101;PARANGABA;
2024;1;FORTALEZA;36001;KATIANA WEYNE;115;385;;1;EEMTI GENERAL EUDORO CORREA;RUA JULIO BRAGA 101;PARANGABA;
2024;1;FORTALEZA;36001;KATIANA WEYNE;115;401;;2;EEFM PROFESSOR MARIO SCHENBERG;RUA AMERICO ROCHA LIMA 835;MANOEL SÁTIRO;
2024;1;FORTALEZA;36001;KATIANA WEYNE;115;409;;1;EEFM PROFESSOR MARIO SCHENBERG;RUA AMERICO ROCHA LIMA 835;MANOEL SÁTIRO;
2024;1;FORTALEZA;36001;KATIANA WEYNE;115;415;;1;COLEGIO GURI  SENIOR;RUA CONEGO DE CASTRO 1780;PARANGABA;
2024;1;FORTALEZA;36001;KATIANA WEYNE;116;392;;1;EM FRANCISCA FERNANDES MAGALHAES;RUA OLIVEIRA SOBRINHO, 1031;BONSUCESSO;
2024;1;FORTALEZA;36001;KATIANA WEYNE;116;412;;1;EM JOAO PAULO I;RUA LUIZ DE CASTRO 254;BONSUCESSO;
2024;1;FORTALEZA;36001;KATIANA WEYNE;116;427;;1;EEF SAO JOSE DO PICI DAS PEDREIRAS;RUA MANUEL ANTONIO LEITE 250;BONSUCESSO;
2024;1;FORTALEZA;36001;KATIANA WEYNE;116;440;;1;CEI XV DE OUTUBRO;RUA MENINO JESUS DE PRAGA, 192;BONSUCESSO;
2024;1;FORTALEZA;36001;KATIANA WEYNE;116;443;;1;EM XV DE OUTUBRO - TEMPORÁRIO;RUA GUARANI, 2030;BONSUCESSO;
2024;1;FORTALEZA;36001;KATIANA WEYNE;116;444;;1;EM XV DE OUTUBRO - TEMPORÁRIO;RUA GUARANI, 2030;BONSUCESSO;
2024;1;FORTALEZA;36001;KATIANA WEYNE;116;458;;1;COLEGIO LIMA NOGUEIRA;RUA JULIO BRAGA, 1117;JOÃO XXIII;
2024;1;FORTALEZA;36001;KATIANA WEYNE;116;459;;1;COLEGIO LIMA NOGUEIRA;RUA JULIO BRAGA, 1117;JOÃO XXIII;
2024;1;FORTALEZA;36001;KATIANA WEYNE;116;461;;1;COLEGIO LIMA NOGUEIRA;RUA JULIO BRAGA, 1117;JOÃO XXIII;
2024;1;FORTALEZA;36001;KATIANA WEYNE;116;462;;1;COLEGIO LIMA NOGUEIRA;RUA JULIO BRAGA, 1117;JOÃO XXIII;
2024;1;FORTALEZA;36001;KATIANA WEYNE;117;197;;2;COLÉGIO CASTRO ALVES;RUA TULIPA NEGRA, 2319;PARQUE PRESIDENTE VARGAS;
2024;1;FORTALEZA;36001;KATIANA WEYNE;117;201;;1;COLÉGIO CASTRO ALVES;RUA TULIPA NEGRA, 2319;PARQUE PRESIDENTE VARGAS;
2024;1;FORTALEZA;36001;KATIANA WEYNE;117;275;;1;COLÉGIO CASTRO ALVES;RUA TULIPA NEGRA, 2319;PARQUE PRESIDENTE VARGAS;
2024;1;FORTALEZA;36001;KATIANA WEYNE;117;277;;1;COLEGIO SANTA HELENA;AV CONTORNO NORTE 819;CONJUNTO ESPERANÇA;
2024;1;FORTALEZA;36001;KATIANA WEYNE;117;301;;1;EEF JOSE AYRTON TEIXEIRA;RUA ALFREDO MAMEDE SN;MANOEL SÁTIRO;
2024;1;FORTALEZA;36001;KATIANA WEYNE;117;401;;1;COLEGIO SANTA HELENA;AV CONTORNO NORTE 819;CONJUNTO ESPERANÇA;
2024;1;FORTALEZA;36001;KATIANA WEYNE;117;479;;1;ESCOLA MUNICIPAL PROF JOSE CÍRIO PEREIRA FILHO;RUA QUARTZO ROSA, 100;SIQUEIRA;
2024;1;FORTALEZA;36001;KATIANA WEYNE;118;321;;2;ESCOLA EVANGELICA MONTE SINAI;RUA BRUNO VALENTE, 847;SERRINHA;
2024;1;FORTALEZA;36001;KATIANA WEYNE;118;511;;1;COLEGIO MARIA ESTER II;RUA F (CONJUNTO MIRASSOL), 158;PARQUE DOIS IRMÃOS;
2024;1;FORTALEZA;36001;KATIANA WEYNE;118;554;;1;EM PROFESSOR JACINTO BOTELHO;RUA DR. RODRIGO CODES SANDOVAL, 374;MONDUBIM;
2024;1;FORTALEZA;36001;KATIANA WEYNE;118;576;;1;EEFM ANTÔNIO DIAS MACEDO;AV PEDRO DANTAS 340;DIAS MACEDO;
2024;1;FORTALEZA;36001;KATIANA WEYNE;118;659;;1;COLÉGIO SAGRADA FAMÍLIA;RUA MADRE ELISA BALDO, 331;SERRINHA;
2024;1;FORTALEZA;36001;KATIANA WEYNE;118;667;;1;EM PROFESSORA MARIA STELLA COCHRANE SANTIAGO;RUA ANTONIO FARIAS, 121;BOA VISTA-CASTELÃO;
TOTAL;;;;;;;;145;
