Ano;Turno;Município;Número;Candidato;Zona;Seção;Seções Agregadas;Votos;Local de Votação;Endereço Local de Votação;Bairro;
2024;1;FORTALEZA;36304;KÁTIA CILENE;1;35;;1;UNINTA - FACULDADE UNINTA FORTALEZA;RUA VILEBALDO AGUIAR,133;COCÓ;
2024;1;FORTALEZA;36304;KÁTIA CILENE;2;658;;1;CMES PROFª TEREZINHA FERREIRA PARENTE;RUA NELSON COELHO, 209;LAGOA REDONDA;
2024;1;FORTALEZA;36304;KÁTIA CILENE;2;809;;1;SECRETARIA DA EDUCACAO - CAMBEBA;AVENIDA MINISTRO JOSE AMERICO, SN;CAMBEBA;
2024;1;FORTALEZA;36304;KÁTIA CILENE;2;810;;1;ESCOLA MUNICIPAL ISABEL FERREIRA;RUA ISABEL FERREIRA, 1000 - CONJ. CURIÓ;LAGOA REDONDA;
2024;1;FORTALEZA;36304;KÁTIA CILENE;3;214;215;1;COLÉGIO ARI DE SÁ - PRÉ-VESTIBULAR - SEDE DUQUE DE CAXIAS;AV. DUQUE DE CAXIAS, 519;CENTRO;
2024;1;FORTALEZA;36304;KÁTIA CILENE;3;289;294;1;COLÉGIO ESTADUAL JUSTINIANO DE SERPA;AV. SANTOS DUMONT, 56;CENTRO;
2024;1;FORTALEZA;36304;KÁTIA CILENE;3;290;293;1;COLÉGIO ESTADUAL JUSTINIANO DE SERPA;AV. SANTOS DUMONT, 56;CENTRO;
2024;1;FORTALEZA;36304;KÁTIA CILENE;80;347;;1;COLÉGIO SALESIANO DOM BOSCO;AV ANTONIO SALES 116;JOAQUIM TÁVORA;
2024;1;FORTALEZA;36304;KÁTIA CILENE;80;349;;1;COLÉGIO SALESIANO DOM BOSCO;AV ANTONIO SALES 116;JOAQUIM TÁVORA;
2024;1;FORTALEZA;36304;KÁTIA CILENE;80;392;;1;EEM GOV. ADAUTO BEZERRA;RUA MONSENHOR LIBERATO, 1850;FÁTIMA;
2024;1;FORTALEZA;36304;KÁTIA CILENE;82;503;;1;CENTRO EDUCACIONAL DOM HÉLIO CAMPOS;RUA SÃO RAIMUNDO, 199;PIRAMBU;
2024;1;FORTALEZA;36304;KÁTIA CILENE;83;502;;1;ESCOLA MUNICIPAL JOSÉ BONIFÁCIO DE SOUSA;RUA PERNAMBUCO 600;DEMOCRITO ROCHA;
2024;1;FORTALEZA;36304;KÁTIA CILENE;83;548;;1;ESCOLA MUNICIPAL JOSÉ BONIFÁCIO DE SOUSA;RUA PERNAMBUCO 600;DEMOCRITO ROCHA;
2024;1;FORTALEZA;36304;KÁTIA CILENE;85;205;;1;ESCOLA MUNICIPAL PROF AMERICO BARREIRA;RUA RICARDO PONTES 529;GENIBAÚ;
2024;1;FORTALEZA;36304;KÁTIA CILENE;85;381;;1;EEM PROF JOSE MARIA CAMPOS DE OLIVEIRA - UV 8;RUA 820 S/N - 3 ETAPA;CONJUNTO CEARÁ I;
2024;1;FORTALEZA;36304;KÁTIA CILENE;93;84;;1;EM RACHEL DE QUEIROZ;AVENIDA C, S/N - II ETAPA;PREFEITO JOSÉ WALTER;
2024;1;FORTALEZA;36304;KÁTIA CILENE;93;90;;3;EM MINHA VIDA MEUS AMORES;AVENIDA D, 380 - II ETAPA;PREFEITO JOSÉ WALTER;
2024;1;FORTALEZA;36304;KÁTIA CILENE;93;92;;1;EM MINHA VIDA MEUS AMORES;AVENIDA D, 380 - II ETAPA;PREFEITO JOSÉ WALTER;
2024;1;FORTALEZA;36304;KÁTIA CILENE;93;118;;1;EEFM DEPUTADO JOACI PEREIRA;RUA PROFESSOR PEDRO JORGE, 830;PLANALTO AYRTON SENNA;
2024;1;FORTALEZA;36304;KÁTIA CILENE;93;131;;1;COLEGIO 21 EDUCAR;AV JOAO DE ARAUJO LIMA, 1240 - II ETAPA;PREFEITO JOSÉ WALTER;
2024;1;FORTALEZA;36304;KÁTIA CILENE;93;153;;1;EM NELSON MANDELA;AV. C, 435;PREFEITO JOSÉ WALTER;
2024;1;FORTALEZA;36304;KÁTIA CILENE;93;157;;1;CUCA JOSÉ WALTER;RUA 69, S/N;PREFEITO JOSÉ WALTER;
2024;1;FORTALEZA;36304;KÁTIA CILENE;93;209;;1;CEI RACHEL DE QUEIROZ;RUA 41, S/N - II ETAPA;PREFEITO JOSÉ WALTER;
2024;1;FORTALEZA;36304;KÁTIA CILENE;93;212;;1;CEI RACHEL DE QUEIROZ;RUA 41, S/N - II ETAPA;PREFEITO JOSÉ WALTER;
2024;1;FORTALEZA;36304;KÁTIA CILENE;93;228;;1;EEEP PROFESSOR OTAVIO TERCEIRO DE FARIAS;AVENIDA C, 435;PREFEITO JOSÉ WALTER;
2024;1;FORTALEZA;36304;KÁTIA CILENE;93;231;;1;EEEP PROFESSOR OTAVIO TERCEIRO DE FARIAS;AVENIDA C, 435;PREFEITO JOSÉ WALTER;
2024;1;FORTALEZA;36304;KÁTIA CILENE;93;237;;1;EM ROGACIANO LEITE;RUA 45, S/N - III ETAPA;PREFEITO JOSÉ WALTER;
2024;1;FORTALEZA;36304;KÁTIA CILENE;93;249;;1;ESCOLA MUNICIPAL ARI DE SA CAVALCANTE (JOSÉ WALTER);AV. H, 430 III ETAPA;PREFEITO JOSÉ WALTER;
2024;1;FORTALEZA;36304;KÁTIA CILENE;93;252;;1;ESCOLA MUNICIPAL ARI DE SA CAVALCANTE (JOSÉ WALTER);AV. H, 430 III ETAPA;PREFEITO JOSÉ WALTER;
2024;1;FORTALEZA;36304;KÁTIA CILENE;93;254;;1;EM FRANCISCO NUNES CAVALCANTE;RUA POETA MÁRIO LINHARES, 561;PREFEITO JOSÉ WALTER;
2024;1;FORTALEZA;36304;KÁTIA CILENE;93;308;;1;CUCA JOSÉ WALTER;RUA 69, S/N;PREFEITO JOSÉ WALTER;
2024;1;FORTALEZA;36304;KÁTIA CILENE;94;493;;1;ASSOC DOS MORADORES DO CONJ DOS BANCARIOS;RUA 27 1630;VILA VELHA;
2024;1;FORTALEZA;36304;KÁTIA CILENE;94;814;;1;EMTI DEPUTADO ROBERTO MESQUITA;R. BETA,  SN;VILA VELHA;
2024;1;FORTALEZA;36304;KÁTIA CILENE;94;889;;1;EEMTI MONSENHOR DOURADO;AVENIDA SARGENTO HERMÍNIO SAMPAIO 4600;PADRE ANDRADE;
2024;1;FORTALEZA;36304;KÁTIA CILENE;95;203;;1;EEEP MÁRIO ALENCAR;RUA VERDE 44, 97 (CJ. SÍTIO SÃO JOÃO);JANGURUSSU;
2024;1;FORTALEZA;36304;KÁTIA CILENE;95;304;;1;EMEIF JORNALISTA JOSÉ BLANCHARD GIRÃO DA SILVA;TRAVESSA MISSIONÁRIO OLIVEIRA,301;JANGURUSSU;
2024;1;FORTALEZA;36304;KÁTIA CILENE;114;238;;1;CENTRO DE EDUCAÇÃO COMPLEMENTAR (CEDCE) - ANTIGO SESI;AVENIDA FRANCISCO SÁ 6623;BARRA DO CEARÁ;
2024;1;FORTALEZA;36304;KÁTIA CILENE;115;95;;1;COLEGIO DUQUE DE CAXIAS;RUA  PERU, 1675;SERRINHA;
2024;1;FORTALEZA;36304;KÁTIA CILENE;115;98;;1;EMTI CAROLINO SUCUPIRA;RUA MUNDICA PAULA, 670;PARANGABA;
2024;1;FORTALEZA;36304;KÁTIA CILENE;115;123;;1;COLÉGIO UNIVERSO DO SABER;RUA 10 - NR 70 (CJ CAMPO DOS INGLESES - MARAPONGA);JARDIM CEARENSE;
2024;1;FORTALEZA;36304;KÁTIA CILENE;115;314;;1;EEM  PROFESSORA DIVA CABRAL;RUA HOLANDA, 701;MARAPONGA;
2024;1;FORTALEZA;36304;KÁTIA CILENE;115;468;;1;EEFM PROF. HERMENEGILDO FIRMEZA;RUA GABRIEL FIUZA 360;VILA PERI;
2024;1;FORTALEZA;36304;KÁTIA CILENE;115;469;;1;EEFM PROF. HERMENEGILDO FIRMEZA;RUA GABRIEL FIUZA 360;VILA PERI;
2024;1;FORTALEZA;36304;KÁTIA CILENE;116;289;;1;EM RACHEL VIANA MARTINS;RUA TUCUNDUBA 2703;GRANJA LISBOA;
2024;1;FORTALEZA;36304;KÁTIA CILENE;116;469;;1;CENTRO CULTURAL BOM JARDIM;RUA TRES CORACOES 400;GRANJA LISBOA;
2024;1;FORTALEZA;36304;KÁTIA CILENE;116;472;;1;EM RACHEL VIANA MARTINS;RUA TUCUNDUBA 2703;GRANJA LISBOA;
2024;1;FORTALEZA;36304;KÁTIA CILENE;117;226;;2;EEFM SENADOR OSIRES PONTES;RUA DIVINA 150;SIQUEIRA;
2024;1;FORTALEZA;36304;KÁTIA CILENE;117;375;;1;ESCOLA MUNICIPAL HERBERT DE SOUSA;RUA URUCUTUBA 1599;BOM JARDIM;
2024;1;FORTALEZA;36304;KÁTIA CILENE;117;407;;1;ESCOLA MUNICIPAL PROF JOSE CÍRIO PEREIRA FILHO;RUA QUARTZO ROSA, 100;SIQUEIRA;
2024;1;FORTALEZA;36304;KÁTIA CILENE;117;467;490;1;COLÉGIO CEARENSE TOTAL;AVENIDA D, 85;CONJUNTO ESPERANÇA;
2024;1;FORTALEZA;36304;KÁTIA CILENE;118;597;;1;EMEF PROFESSOR JOAO HIPPÓLYTO DE AZEVEDO E SÁ;RUA 03 N. 88 RESIDENCIAL NAPOLEAO VIANA;DIAS MACEDO;
2024;1;FORTALEZA;36304;KÁTIA CILENE;118;598;;1;EMEF PROFESSOR JOAO HIPPÓLYTO DE AZEVEDO E SÁ;RUA 03 N. 88 RESIDENCIAL NAPOLEAO VIANA;DIAS MACEDO;
TOTAL;;;;;;;;55;
