Ano;Turno;Município;Número;Candidato;Zona;Seção;Seções Agregadas;Votos;Local de Votação;Endereço Local de Votação;Bairro;
2024;1;FORTALEZA;15777;LUISA GONÇALVES;1;637;;1;FACULDADE FARIAS BRITO - CASTRO MONTE;RUA CASTRO MONTE 1364;VARJOTA;
2024;1;FORTALEZA;15777;LUISA GONÇALVES;1;650;;1;ESCOLA ESTADUAL MARIA JOSE MEDEIROS;RUA DESEMBARGADOR LAURO NOGUEIRA 1240;PAPICU;
2024;1;FORTALEZA;15777;LUISA GONÇALVES;1;756;;1;FACULDADE FARIAS BRITO - CASTRO MONTE;RUA CASTRO MONTE 1364;VARJOTA;
2024;1;FORTALEZA;15777;LUISA GONÇALVES;1;797;;1;CRECHE RACHEL GUIMARÃES MARTINS BARBOSA;VIA DE PEDRESTE LESTE OESTE 01;CAIS DO PORTO;
2024;1;FORTALEZA;15777;LUISA GONÇALVES;1;878;;1;FACULDADE FARIAS BRITO - CASTRO MONTE;RUA CASTRO MONTE 1364;VARJOTA;
2024;1;FORTALEZA;15777;LUISA GONÇALVES;1;879;;1;COLEGIO ANTARES - SANTOS DUMONT;AVENIDA SANTOS DUMONT 3777;ALDEOTA;
2024;1;FORTALEZA;15777;LUISA GONÇALVES;1;883;;1;COLEGIO ANTARES - SANTOS DUMONT;AVENIDA SANTOS DUMONT 3777;ALDEOTA;
2024;1;FORTALEZA;15777;LUISA GONÇALVES;1;916;;1;FACULDADE FARIAS BRITO - CASTRO MONTE;RUA CASTRO MONTE 1364;VARJOTA;
2024;1;FORTALEZA;15777;LUISA GONÇALVES;2;128;;1;EM PROFª TELINA BARBOSA DA  COSTA;RUA PERGENTINO MAIA, 811;MESSEJANA;
2024;1;FORTALEZA;15777;LUISA GONÇALVES;2;175;;1;COLÉGIO SERAFICO NOSSA SENHORA DO BRASIL;AVENIDA FREI CIRILO 4454;MESSEJANA;
2024;1;FORTALEZA;15777;LUISA GONÇALVES;2;533;;1;EMEIF DEMOCRITO ROCHA;RUA PADRE PEDRO DE ALENCAR, 2012;MESSEJANA;
2024;1;FORTALEZA;15777;LUISA GONÇALVES;2;552;;1;EM PROFª FERNANDA MARIA DE ALENCAR COLARES;AV PROF. ARTHUR DE CARVALHO, 1540;LAGOA REDONDA;
2024;1;FORTALEZA;15777;LUISA GONÇALVES;2;674;;1;EMEIF DEMOCRITO ROCHA;RUA PADRE PEDRO DE ALENCAR, 2012;MESSEJANA;
2024;1;FORTALEZA;15777;LUISA GONÇALVES;3;119;170;1;SENAI - UNIDADE JACARECANGA;AV. PADRE IBIAPINA, 1280;JACARECANGA;
2024;1;FORTALEZA;15777;LUISA GONÇALVES;3;126;;1;COLÉGIO ESTADUAL LICEU DO CEARÁ;PRAÇA GUSTAVO BARROSO, 01;JACARECANGA;
2024;1;FORTALEZA;15777;LUISA GONÇALVES;3;154;;1;EM MOURA BRASIL / EF;RUA PADRE MORORÓ, 189;MOURA BRASIL;
2024;1;FORTALEZA;15777;LUISA GONÇALVES;3;217;520;1;FAC. CATÓLICA DE FORTALEZA (SEMINÁRIO DA PRAINHA);RUA TENENTE BENÉVOLO, 201;CENTRO;
2024;1;FORTALEZA;15777;LUISA GONÇALVES;3;286;;1;SECRETARIA DA SAÚDE DO ESTADO DO CEARÁ;RUA ITAPIPOCA, 60;PRAIA DE IRACEMA;
2024;1;FORTALEZA;15777;LUISA GONÇALVES;3;303;535;1;EEMTI VISCONDE DO RIO BRANCO;AV. DOM MANUEL, 1803;CENTRO;
2024;1;FORTALEZA;15777;LUISA GONÇALVES;3;380;;1;UNICHRISTUS ALDEOTA;RUA VISCONDE DE MAUÁ, 1940;ALDEOTA;
2024;1;FORTALEZA;15777;LUISA GONÇALVES;3;381;;1;UNICHRISTUS ALDEOTA;RUA VISCONDE DE MAUÁ, 1940;ALDEOTA;
2024;1;FORTALEZA;15777;LUISA GONÇALVES;3;406;;1;EEMTI RENATO BRAGA;AV. RUI BARBOSA, 2000;ALDEOTA;
2024;1;FORTALEZA;15777;LUISA GONÇALVES;3;409;;1;EEMTI RENATO BRAGA;AV. RUI BARBOSA, 2000;ALDEOTA;
2024;1;FORTALEZA;15777;LUISA GONÇALVES;3;410;;2;COLÉGIO DARWIN;RUA ILDEFONSO ALBANO, 1030;ALDEOTA;
2024;1;FORTALEZA;15777;LUISA GONÇALVES;3;411;;1;COLÉGIO DARWIN;RUA ILDEFONSO ALBANO, 1030;ALDEOTA;
2024;1;FORTALEZA;15777;LUISA GONÇALVES;3;412;;1;COLÉGIO DARWIN;RUA ILDEFONSO ALBANO, 1030;ALDEOTA;
2024;1;FORTALEZA;15777;LUISA GONÇALVES;3;413;;1;COLÉGIO DARWIN;RUA ILDEFONSO ALBANO, 1030;ALDEOTA;
2024;1;FORTALEZA;15777;LUISA GONÇALVES;3;414;;1;COLÉGIO DARWIN;RUA ILDEFONSO ALBANO, 1030;ALDEOTA;
2024;1;FORTALEZA;15777;LUISA GONÇALVES;3;429;;1;FACULDADE ARI DE SÁ;AV. HERÁCLITO GRAÇA, 826;CENTRO;
2024;1;FORTALEZA;15777;LUISA GONÇALVES;3;441;;1;INSTITUTO CEARENSE DE EDUCAÇÃO DE SURDOS - ICES;AV. RUI BARBOSA, 1970;ALDEOTA;
2024;1;FORTALEZA;15777;LUISA GONÇALVES;3;485;;1;COLÉGIO ANTARES (PRAIA DE IRACEMA);RUA HISTORIADOR GUARINO ALVES, 95;PRAIA DE IRACEMA;
2024;1;FORTALEZA;15777;LUISA GONÇALVES;3;513;514;1;CENTRO DE PASTORAL MARIA, MÃE DA IGREJA;RUA RODRIGUES JÚNIOR, 300;CENTRO;
2024;1;FORTALEZA;15777;LUISA GONÇALVES;3;515;;1;IDEAL CLUBE;AV. MONSENHOR TABOSA,  1381;MEIRELES;
2024;1;FORTALEZA;15777;LUISA GONÇALVES;3;548;;1;EEFM PARÓQUIA DA PAZ;RUA VISCONDE DE MAUÁ, 905/A;MEIRELES;
2024;1;FORTALEZA;15777;LUISA GONÇALVES;3;600;;1;COLÉGIO SANTA CECÍLIA;AV. SENADOR VIRGÍLIO TÁVORA, 2000;ALDEOTA;
2024;1;FORTALEZA;15777;LUISA GONÇALVES;3;602;;1;COLÉGIO SANTA CECÍLIA;AV. SENADOR VIRGÍLIO TÁVORA, 2000;ALDEOTA;
2024;1;FORTALEZA;15777;LUISA GONÇALVES;3;603;;1;COLÉGIO SANTA CECÍLIA;AV. SENADOR VIRGÍLIO TÁVORA, 2000;ALDEOTA;
2024;1;FORTALEZA;15777;LUISA GONÇALVES;3;640;;1;NÁUTICO ATLÉTICO CEARENSE;AV. DA ABOLIÇÃO, 2727;MEIRELES;
2024;1;FORTALEZA;15777;LUISA GONÇALVES;80;191;;2;COLÉGIO NOSSA SENHORA DAS GRAÇAS;RUA MONSENHOR OTÁVIO DE CASTRO, 535;FÁTIMA;
2024;1;FORTALEZA;15777;LUISA GONÇALVES;80;271;;1;FACULDADE MAURÍCIO DE NASSAU;AVENIDA VISCONDE DO RIO BRANCO, 2078;JOSÉ BONIFÁCIO;
2024;1;FORTALEZA;15777;LUISA GONÇALVES;80;298;;1;ESCOLA MUNICIPAL PAPA JOÃO XXIII;AV TREZE DE ABRIL, 545;VILA UNIÃO;
2024;1;FORTALEZA;15777;LUISA GONÇALVES;80;307;;2;ASSEMBLÉIA LEGISLATIVA - UNIVERSIDADE DO PARLAMENTO CEARENSE;RUA BARBOSA DE FREITAS, 2674;DIONISIO TORRES;
2024;1;FORTALEZA;15777;LUISA GONÇALVES;80;334;;1;COLÉGIO ANTARES IRMÃ MARIA (ANTIGO IRMÃ MARIA MONTENEGRO);RUA PINHO PESSOA 681;JOAQUIM TÁVORA;
2024;1;FORTALEZA;15777;LUISA GONÇALVES;80;340;;1;COLÉGIO ANTARES IRMÃ MARIA (ANTIGO IRMÃ MARIA MONTENEGRO);RUA PINHO PESSOA 681;JOAQUIM TÁVORA;
2024;1;FORTALEZA;15777;LUISA GONÇALVES;80;351;;1;COLÉGIO SALESIANO DOM BOSCO;AV ANTONIO SALES 116;JOAQUIM TÁVORA;
2024;1;FORTALEZA;15777;LUISA GONÇALVES;80;420;;1;COLÉGIO SANTO TOMÁZ DE AQUINO;RUA MÁRIO MAMEDE, 750;FÁTIMA;
2024;1;FORTALEZA;15777;LUISA GONÇALVES;80;426;;1;ESCOLA VILA;RUA DOM SEBASTIAO LEME, 819;FÁTIMA;
2024;1;FORTALEZA;15777;LUISA GONÇALVES;80;433;;1;ASSEMBLÉIA LEGISLATIVA - UNIVERSIDADE DO PARLAMENTO CEARENSE;RUA BARBOSA DE FREITAS, 2674;DIONISIO TORRES;
2024;1;FORTALEZA;15777;LUISA GONÇALVES;82;31;;1;SECRETARIA DE DESENVOLVIMENTO AGRÁRIO DO ESTADO DO CEARÁ;AV. BEZERRA DE MENEZES, 1620;SÃO GERARDO;
2024;1;FORTALEZA;15777;LUISA GONÇALVES;82;61;;1;ESCOLA MUNICIPAL NOSSA SENHORA DO PERPÉTUO SOCORRO - EF;RUA CÔNSUL GOUVEIA, 57;ÁLVARO WEYNE;
2024;1;FORTALEZA;15777;LUISA GONÇALVES;82;117;;1;CENTRO DE CIDADANIA GOV. VIRGÍLIO TÁVORA - CCDH;AV. MONSENHOR HELIO CAMPOS, 178;CRISTO REDENTOR;
2024;1;FORTALEZA;15777;LUISA GONÇALVES;82;182;;1;ESCOLA MUNICIPAL GUSTAVO BARROSO - EI/EF;RUA ERETIDES MARTINS, 26;SÃO GERARDO;
2024;1;FORTALEZA;15777;LUISA GONÇALVES;82;202;;1;ESCOLA MUNICIPAL LENIRA JUREMA DE MAGALHÃES - EI/EF;RUA TEÓFILO GURGEL, 111;MONTE CASTELO;
2024;1;FORTALEZA;15777;LUISA GONÇALVES;82;224;;1;CENTRO EDUCACIONAL MOEMA TÁVORA;RUA MARCÍLIO DIAS, 485;PIRAMBU;
2024;1;FORTALEZA;15777;LUISA GONÇALVES;82;230;;1;CENTRO EDUCACIONAL MOEMA TÁVORA;RUA MARCÍLIO DIAS, 485;PIRAMBU;
2024;1;FORTALEZA;15777;LUISA GONÇALVES;82;245;;1;ESCOLA MUNICIPAL HILBERTO SILVA - EI/EF;AV. PRESIDENTE CASTELO BRANCO, 2973;PIRAMBU;
2024;1;FORTALEZA;15777;LUISA GONÇALVES;82;350;;1;ESCOLA MUNICIPAL GUSTAVO BARROSO - EI/EF;RUA ERETIDES MARTINS, 26;SÃO GERARDO;
2024;1;FORTALEZA;15777;LUISA GONÇALVES;82;376;;1;ESCOLA MUNICIPAL PROFESSOR MARTINZ DE AGUIAR - EI/EF;RUA BERNARDO PORTO, 490;MONTE CASTELO;
2024;1;FORTALEZA;15777;LUISA GONÇALVES;82;383;;1;COLÉGIO MENINO JESUS DE PRAGA;RUA ANA FACÓ, 140;CARLITO PAMPLONA;
2024;1;FORTALEZA;15777;LUISA GONÇALVES;82;409;;1;CENTRO EDUCACIONAL SÃO MATEUS;AV. SARGENTO HERMÍNIO SAMPAIO, 2440;MONTE CASTELO;
2024;1;FORTALEZA;15777;LUISA GONÇALVES;82;427;;2;ESCOLA MUNICIPAL LENIRA JUREMA DE MAGALHÃES - EI/EF;RUA TEÓFILO GURGEL, 111;MONTE CASTELO;
2024;1;FORTALEZA;15777;LUISA GONÇALVES;82;436;;1;INSTITUTO MATER AMABILIS;RUA PADRE ANCHIETA, 438;MONTE CASTELO;
2024;1;FORTALEZA;15777;LUISA GONÇALVES;82;471;;1;CEJA PAULO FREIRE;RUA OLAVO BILAC, 1300;SÃO GERARDO;
2024;1;FORTALEZA;15777;LUISA GONÇALVES;82;540;;2;CEJA PAULO FREIRE;RUA OLAVO BILAC, 1300;SÃO GERARDO;
2024;1;FORTALEZA;15777;LUISA GONÇALVES;82;567;;1;ESCOLA MUNICIPAL PATATIVA DO ASSARÉ - EI/EF;RUA IRINEU DE SOUZA, 197;ÁLVARO WEYNE;
2024;1;FORTALEZA;15777;LUISA GONÇALVES;82;577;;1;COLÉGIO MASTER - BEZERRA DE MENEZES;AV. BEZERRA DE MENEZES, 1802;SÃO GERARDO;
2024;1;FORTALEZA;15777;LUISA GONÇALVES;82;579;;1;ESCOLA MUNICIPAL LENIRA JUREMA DE MAGALHÃES - EI/EF;RUA TEÓFILO GURGEL, 111;MONTE CASTELO;
2024;1;FORTALEZA;15777;LUISA GONÇALVES;82;651;;1;CENTRO EDUCACIONAL SÃO MATEUS;AV. SARGENTO HERMÍNIO SAMPAIO, 2440;MONTE CASTELO;
2024;1;FORTALEZA;15777;LUISA GONÇALVES;82;701;;1;COLÉGIO MANUEL DA SILVA - CARLITO PAMPLONA;AV. FRANCISCO SÁ, 4001;CARLITO PAMPLONA;
2024;1;FORTALEZA;15777;LUISA GONÇALVES;83;17;;1;ESCOLA MUNICIPAL DOM JOSÉ TUPINAMBA DA FROTA;RUA VIRIATO RIBEIRO 1031;BELA VISTA;
2024;1;FORTALEZA;15777;LUISA GONÇALVES;83;122;;1;EEEP JÚLIA GIFFONI;RUA CORONEL MATOS DOURADO 1349;PICI;
2024;1;FORTALEZA;15777;LUISA GONÇALVES;83;438;;1;ESCOLA MUNICIPAL DE TEMPO INTEGRAL PROFESSOR JOSE JULIO DA PONTE;RUA MARIO DE ANDRADE, S/N;BELA VISTA;
2024;1;FORTALEZA;15777;LUISA GONÇALVES;83;472;;1;ESCOLA MUNICIPAL DOM JOSÉ TUPINAMBA DA FROTA;RUA VIRIATO RIBEIRO 1031;BELA VISTA;
2024;1;FORTALEZA;15777;LUISA GONÇALVES;83;638;;1;ESCOLA MUNICIPAL ADROALDO TEIXEIRA CASTELO;RUA ALAGOAS 2267;PICI;
2024;1;FORTALEZA;15777;LUISA GONÇALVES;83;655;794;1;EEFM JOSÉ WALDEMAR DE ALCÂNTARA E SILVA;RUA MACEIÓ, 627;DOM LUSTOSA;
2024;1;FORTALEZA;15777;LUISA GONÇALVES;83;658;;1;EEMTI PROFESSOR PAULO FREIRE;AVENIDA SENADOR FERNANDES TÁVORA 1936;HENRIQUE JORGE;
2024;1;FORTALEZA;15777;LUISA GONÇALVES;83;696;;1;ESCOLA MUNICIPAL MURILO SERPA;RUA MONSENHOR HIPOLITO BRASIL 1400;DOM LUSTOSA;
2024;1;FORTALEZA;15777;LUISA GONÇALVES;83;704;;1;CENTRO EDUCACIONAL BRASILEIRINHO;AVENIDA SENADOR FERNANDES TÁVORA, 1717;HENRIQUE JORGE;
2024;1;FORTALEZA;15777;LUISA GONÇALVES;85;106;;1;CEJA ADELINO DE ALCANTARA FILHO - UV-6;RUA SEISCENTOS E DOZE, 100, 1A ETAPA;CONJUNTO CEARÁ I;
2024;1;FORTALEZA;15777;LUISA GONÇALVES;85;141;;1;EEEP PROFESSOR CESAR CAMPELO;RUA 717, N.164, 3 ETAPA;CONJUNTO CEARÁ I;
2024;1;FORTALEZA;15777;LUISA GONÇALVES;85;149;;1;EEF GOVERNADOR FAUSTINO ALBUQUERQUE - UV1;RUA 143 N 155 - 1 ETAPA;CONJUNTO CEARÁ I;
2024;1;FORTALEZA;15777;LUISA GONÇALVES;85;181;;1;EMTI MARIA DA HORA;RUA RAIMUNDO RIBEIRO, S/N;AUTRAN NUNES;
2024;1;FORTALEZA;15777;LUISA GONÇALVES;85;196;;1;ESCOLA JOÃO PAULO II;AV C N. 1381 2 ETAPA;CONJUNTO CEARÁ I;
2024;1;FORTALEZA;15777;LUISA GONÇALVES;85;329;;1;EEFM DR UBIRAJARA INDIO DO CEARA - UV-7A;RUA SETECENTOS E CINQUENTA E UM, 192, 3A ETAPA;CONJUNTO CEARÁ I;
2024;1;FORTALEZA;15777;LUISA GONÇALVES;85;342;;1;ESCOLA MUNICIPAL DEP JOAO FREDERICO FERREIRA GOMES;RUA JOSE MENDONCA 1160;GENIBAÚ;
2024;1;FORTALEZA;15777;LUISA GONÇALVES;85;344;;1;EMTI PROF PRISCO BEZERRA;AVENIDA F , 174;CONJUNTO CEARÁ I;
2024;1;FORTALEZA;15777;LUISA GONÇALVES;85;363;;1;EEFM AYRTON SENNA DA SILVA;RUA MANAUS, 855;DOM LUSTOSA;
2024;1;FORTALEZA;15777;LUISA GONÇALVES;85;374;;1;EMEIF MANOEL CAETANO DE SOUZA;RUA SANTA LUCIA 170;GENIBAÚ;
2024;1;FORTALEZA;15777;LUISA GONÇALVES;93;79;;1;EM RACHEL DE QUEIROZ;AVENIDA C, S/N - II ETAPA;PREFEITO JOSÉ WALTER;
2024;1;FORTALEZA;15777;LUISA GONÇALVES;93;88;;1;EM RACHEL DE QUEIROZ;AVENIDA C, S/N - II ETAPA;PREFEITO JOSÉ WALTER;
2024;1;FORTALEZA;15777;LUISA GONÇALVES;93;90;;1;EM MINHA VIDA MEUS AMORES;AVENIDA D, 380 - II ETAPA;PREFEITO JOSÉ WALTER;
2024;1;FORTALEZA;15777;LUISA GONÇALVES;93;119;;1;EEFM DEPUTADO JOACI PEREIRA;RUA PROFESSOR PEDRO JORGE, 830;PLANALTO AYRTON SENNA;
2024;1;FORTALEZA;15777;LUISA GONÇALVES;93;128;;1;COLEGIO 21 EDUCAR;AV JOAO DE ARAUJO LIMA, 1240 - II ETAPA;PREFEITO JOSÉ WALTER;
2024;1;FORTALEZA;15777;LUISA GONÇALVES;93;151;;1;EEEP PROFESSOR OTAVIO TERCEIRO DE FARIAS;AVENIDA C, 435;PREFEITO JOSÉ WALTER;
2024;1;FORTALEZA;15777;LUISA GONÇALVES;93;184;;1;EM MARIA ZELIA CORREIA DE SOUSA;RUA ANTONIO PEREIRA,1495;PLANALTO AYRTON SENNA;
2024;1;FORTALEZA;15777;LUISA GONÇALVES;93;193;;2;EM MARIA ZELIA CORREIA DE SOUSA;RUA ANTONIO PEREIRA,1495;PLANALTO AYRTON SENNA;
2024;1;FORTALEZA;15777;LUISA GONÇALVES;93;198;;1;LICEU ESTADUAL DOMINGOS BRASILEIRO;RUA PLANALTINA, S/N;PLANALTO AYRTON SENNA;
2024;1;FORTALEZA;15777;LUISA GONÇALVES;93;210;;1;CEI RACHEL DE QUEIROZ;RUA 41, S/N - II ETAPA;PREFEITO JOSÉ WALTER;
2024;1;FORTALEZA;15777;LUISA GONÇALVES;93;247;;1;EM PROFESSORA IRENE DE SOUZA PEREIRA;RUA PARQUE UMARI, 100;PLANALTO AYRTON SENNA;
2024;1;FORTALEZA;15777;LUISA GONÇALVES;93;280;;1;EM ADALBERTO STUDART FILHO;RUA DO CAMPO, 25;PLANALTO AYRTON SENNA;
2024;1;FORTALEZA;15777;LUISA GONÇALVES;94;28;;1;EEMTI MARIA JOSÉ SANTOS FERREIRA GOMES;RUA DONA LUCIA PINHEIRO, 93;QUINTINO CUNHA;
2024;1;FORTALEZA;15777;LUISA GONÇALVES;94;30;;1;EEFM JOSE BEZERRA DE MENEZES (POLIVALENTE);RUA ANARIO BRAGA SN;ANTÔNIO BEZERRA;
2024;1;FORTALEZA;15777;LUISA GONÇALVES;94;34;;1;EM PADRE JOSEFINO CABRAL;AV SARGENTO HERMINIO SAMPAIO 5598;ANTÔNIO BEZERRA;
2024;1;FORTALEZA;15777;LUISA GONÇALVES;94;35;;1;EMTI JOSÉ CARLOS DE OLIVEIRA NETO;R. SAO VICENTE DE PAULO, 170;ANTÔNIO BEZERRA;
2024;1;FORTALEZA;15777;LUISA GONÇALVES;94;36;;1;EMTI JOSÉ CARLOS DE OLIVEIRA NETO;R. SAO VICENTE DE PAULO, 170;ANTÔNIO BEZERRA;
2024;1;FORTALEZA;15777;LUISA GONÇALVES;94;39;;1;EMTI JOSÉ CARLOS DE OLIVEIRA NETO;R. SAO VICENTE DE PAULO, 170;ANTÔNIO BEZERRA;
2024;1;FORTALEZA;15777;LUISA GONÇALVES;94;335;;1;CMES PROF JOSE REBOUCAS MACAMBIRA;RUA CARIÚS 200;JARDIM GUANABARA;
2024;1;FORTALEZA;15777;LUISA GONÇALVES;94;375;;1;COLÉGIO INDEPENDÊNCIA;AV. DA INDEPENDÊNCIA, 1362;QUINTINO CUNHA;
2024;1;FORTALEZA;15777;LUISA GONÇALVES;94;552;;1;CEJA - EUDES VERAS;AV. DEMÉTRIO MENEZES, 130;ANTÔNIO BEZERRA;
2024;1;FORTALEZA;15777;LUISA GONÇALVES;94;785;;1;COLÉGIO CÍCERO NOGUEIRA (CCN);RUA PARAMBU, 668;VILA VELHA;
2024;1;FORTALEZA;15777;LUISA GONÇALVES;94;867;;1;EEFM HERMINIO BARROSO;RUA PADRE GUILHERME 800;PADRE ANDRADE;
2024;1;FORTALEZA;15777;LUISA GONÇALVES;94;872;;1;EEFM HERMINIO BARROSO;RUA PADRE GUILHERME 800;PADRE ANDRADE;
2024;1;FORTALEZA;15777;LUISA GONÇALVES;94;874;;1;EEFM HERMINIO BARROSO;RUA PADRE GUILHERME 800;PADRE ANDRADE;
2024;1;FORTALEZA;15777;LUISA GONÇALVES;94;888;;1;EEMTI MONSENHOR DOURADO;AVENIDA SARGENTO HERMÍNIO SAMPAIO 4600;PADRE ANDRADE;
2024;1;FORTALEZA;15777;LUISA GONÇALVES;94;891;;1;EEMTI MONSENHOR DOURADO;AVENIDA SARGENTO HERMÍNIO SAMPAIO 4600;PADRE ANDRADE;
2024;1;FORTALEZA;15777;LUISA GONÇALVES;94;893;;2;EEMTI MONSENHOR DOURADO;AVENIDA SARGENTO HERMÍNIO SAMPAIO 4600;PADRE ANDRADE;
2024;1;FORTALEZA;15777;LUISA GONÇALVES;94;901;;2;EEMTI MONSENHOR DOURADO;AVENIDA SARGENTO HERMÍNIO SAMPAIO 4600;PADRE ANDRADE;
2024;1;FORTALEZA;15777;LUISA GONÇALVES;95;190;;1;DNIT;RODOVIA BR-116, KM 06;CAJAZEIRAS;
2024;1;FORTALEZA;15777;LUISA GONÇALVES;95;257;;1;EEFM PROFESSOR  ALOYSIO BARROS LEAL;RUA 10,  LOT. PRQ.VERDE 28 (CJ JOAO PAULO II);BARROSO;
2024;1;FORTALEZA;15777;LUISA GONÇALVES;112;366;;1;COLÉGIO ÁGAPE;AV HERMINIO DE CASTRO, 140;PARQUE MANIBURA;
2024;1;FORTALEZA;15777;LUISA GONÇALVES;112;456;;1;UNIVERSIDADE DE FORTALEZA - UNIFOR;AVENIDA WASHINGTON SOARES, 1321;EDSON QUEIROZ;
2024;1;FORTALEZA;15777;LUISA GONÇALVES;112;467;;1;UNIVERSIDADE DE FORTALEZA - UNIFOR;AVENIDA WASHINGTON SOARES, 1321;EDSON QUEIROZ;
2024;1;FORTALEZA;15777;LUISA GONÇALVES;112;544;;1;ESCOLA ESTADUAL DE EDUCAÇÃO PROFISSIONAL JAIME ALENCAR DE OLIVEIRA;AV ROGACIANO LEITE, 2285;ENGENHEIRO LUCIANO CAVALCANTE;
2024;1;FORTALEZA;15777;LUISA GONÇALVES;113;37;36, 38;1;COLÉGIO FARIAS BRITO PRÉ - VESTIBULAR;AV. BARÃO DO RIO BRANCO, 2424;JOSÉ BONIFÁCIO;
2024;1;FORTALEZA;15777;LUISA GONÇALVES;113;52;;1;COLÉGIO FARIAS BRITO;RUA SENADOR POMPEU, 2607;JOSÉ BONIFÁCIO;
2024;1;FORTALEZA;15777;LUISA GONÇALVES;113;63;;1;COLÉGIO JUVENAL DE CARVALHO;AV. JOÃO PESSOA, 4279;DAMAS;
2024;1;FORTALEZA;15777;LUISA GONÇALVES;113;65;;1;COLÉGIO JUVENAL DE CARVALHO;AV. JOÃO PESSOA, 4279;DAMAS;
2024;1;FORTALEZA;15777;LUISA GONÇALVES;113;73;;1;COLÉGIO LOURENÇO FILHO;RUA BARÃO DO RIO BRANCO, 2101;CENTRO;
2024;1;FORTALEZA;15777;LUISA GONÇALVES;113;77;;1;COLÉGIO LOURENÇO FILHO;RUA BARÃO DO RIO BRANCO, 2101;CENTRO;
2024;1;FORTALEZA;15777;LUISA GONÇALVES;113;79;;1;COLÉGIO LOURENÇO FILHO;RUA BARÃO DO RIO BRANCO, 2101;CENTRO;
2024;1;FORTALEZA;15777;LUISA GONÇALVES;113;141;;1;ESC. EST. DE EDUC. PROFISSIONAL PAULO VI;RUA JORGE DUMMAR, 1841;JARDIM AMÉRICA;
2024;1;FORTALEZA;15777;LUISA GONÇALVES;113;145;;1;ESC. EST. DE EDUC. PROFISSIONAL PAULO VI;RUA JORGE DUMMAR, 1841;JARDIM AMÉRICA;
2024;1;FORTALEZA;15777;LUISA GONÇALVES;113;195;;1;FACULDADE DE PSICOLOGIA DA UFC;AV. DA UNIVERSIDADE, 2762;BENFICA;
2024;1;FORTALEZA;15777;LUISA GONÇALVES;113;200;290;2;CREAS RODOLFO TEÓFILO;RUA DOM LINO, 1001;AMADEU FURTADO;
2024;1;FORTALEZA;15777;LUISA GONÇALVES;113;213;;1;COLÉGIO DEOCLÉCIO FERRO;RUA MINERVINO DE CASTRO, 987;RODOLFO TEÓFILO;
2024;1;FORTALEZA;15777;LUISA GONÇALVES;113;237;;1;EEFM ANTONIO SALES - PARQUELÂNDIA;RUA PROF. ANACLETO, 630;PARQUELÂNDIA;
2024;1;FORTALEZA;15777;LUISA GONÇALVES;113;241;;1;EEFM FÉLIX DE AZEVEDO;RUA MONSENHOR FURTADO, 757;RODOLFO TEÓFILO;
2024;1;FORTALEZA;15777;LUISA GONÇALVES;113;247;;1;EEFM SANTO AFONSO;RUA GAL. BERNARDO FIGUEIREDO, 2670;PARQUELÂNDIA;
2024;1;FORTALEZA;15777;LUISA GONÇALVES;113;281;;1;COLÉGIO MEDALHA MILAGROSA;RUA PADRE JOÃO PIAMARTA,  415;BOM FUTURO;
2024;1;FORTALEZA;15777;LUISA GONÇALVES;113;284;;1;COLÉGIO FARIAS BRITO;RUA SENADOR POMPEU, 2607;JOSÉ BONIFÁCIO;
2024;1;FORTALEZA;15777;LUISA GONÇALVES;113;286;;1;CEI FRANCISCO EURIVÁ MATIAS;RUA FREI MARCELINO, S/N;RODOLFO TEÓFILO;
2024;1;FORTALEZA;15777;LUISA GONÇALVES;113;308;;1;COLÉGIO GUSTAVO BRAGA;AV. JOÃO PESSOA, 4650/80;DAMAS;
2024;1;FORTALEZA;15777;LUISA GONÇALVES;113;309;;1;ESCOLA PROF. PE. JOÃO PIAMARTA (ANEXO JÚNIOR);RUA PE. JOÃO PIAMARTA, 161;BOM FUTURO;
2024;1;FORTALEZA;15777;LUISA GONÇALVES;113;316;;1;EEFM SANTO AFONSO;RUA GAL. BERNARDO FIGUEIREDO, 2670;PARQUELÂNDIA;
2024;1;FORTALEZA;15777;LUISA GONÇALVES;113;348;;1;SECRETARIA EXECUTIVA REGIONAL III - FORTALEZA;AV JOVITA FEITOSA 3090;PARQUELÂNDIA;
2024;1;FORTALEZA;15777;LUISA GONÇALVES;113;351;;1;COLÉGIO AGNUS;RUA TEODORICO BARROSO, 827;MONTESE;
2024;1;FORTALEZA;15777;LUISA GONÇALVES;113;399;;1;COLEGIO CWD-MAXIMUS;RUA DOM LINO, 301;PARQUELÂNDIA;
2024;1;FORTALEZA;15777;LUISA GONÇALVES;114;65;;1;EM DOM HELDER CAMARA;RUA FREI ODILON 623 B;ÁLVARO WEYNE;
2024;1;FORTALEZA;15777;LUISA GONÇALVES;114;67;;4;EM DOM HELDER CAMARA;RUA FREI ODILON 623 B;ÁLVARO WEYNE;
2024;1;FORTALEZA;15777;LUISA GONÇALVES;114;68;;3;EM DOM HELDER CAMARA;RUA FREI ODILON 623 B;ÁLVARO WEYNE;
2024;1;FORTALEZA;15777;LUISA GONÇALVES;114;70;;1;EM DOM HELDER CAMARA;RUA FREI ODILON 623 B;ÁLVARO WEYNE;
2024;1;FORTALEZA;15777;LUISA GONÇALVES;114;71;;2;COLÉGIO INACIO COSTA;QUADRA L 303 CONJUNTO CASTELO BRANCO;PRESIDENTE KENNEDY;
2024;1;FORTALEZA;15777;LUISA GONÇALVES;114;72;;3;COLÉGIO INACIO COSTA;QUADRA L 303 CONJUNTO CASTELO BRANCO;PRESIDENTE KENNEDY;
2024;1;FORTALEZA;15777;LUISA GONÇALVES;114;103;;1;COLÉGIO SANTA ISABEL;AVENIDA BEZERRA DE MENEZES 2840;PRESIDENTE KENNEDY;
2024;1;FORTALEZA;15777;LUISA GONÇALVES;114;106;;1;COLÉGIO SANTA ISABEL;AVENIDA BEZERRA DE MENEZES 2840;PRESIDENTE KENNEDY;
2024;1;FORTALEZA;15777;LUISA GONÇALVES;114;116;;1;EMTI NOSSA SENHORA DE FÁTIMA (ANTIGA APOSTÓLICA/SEMINÁRIO);RUA SÍLVIO ROMERO 370;ÁLVARO WEYNE;
2024;1;FORTALEZA;15777;LUISA GONÇALVES;114;120;;1;EMTI NOSSA SENHORA DE FÁTIMA (ANTIGA APOSTÓLICA/SEMINÁRIO);RUA SÍLVIO ROMERO 370;ÁLVARO WEYNE;
2024;1;FORTALEZA;15777;LUISA GONÇALVES;114;121;;1;EMTI NOSSA SENHORA DE FÁTIMA (ANTIGA APOSTÓLICA/SEMINÁRIO);RUA SÍLVIO ROMERO 370;ÁLVARO WEYNE;
2024;1;FORTALEZA;15777;LUISA GONÇALVES;114;123;;1;EMTI NOSSA SENHORA DE FÁTIMA (ANTIGA APOSTÓLICA/SEMINÁRIO);RUA SÍLVIO ROMERO 370;ÁLVARO WEYNE;
2024;1;FORTALEZA;15777;LUISA GONÇALVES;114;197;;1;EM GABRIEL CAVALCANTE;QUADRA F 167 CONJUNTO CASTELO BRANCO;PRESIDENTE KENNEDY;
2024;1;FORTALEZA;15777;LUISA GONÇALVES;114;198;;3;EM GABRIEL CAVALCANTE;QUADRA F 167 CONJUNTO CASTELO BRANCO;PRESIDENTE KENNEDY;
2024;1;FORTALEZA;15777;LUISA GONÇALVES;114;199;;2;EM GABRIEL CAVALCANTE;QUADRA F 167 CONJUNTO CASTELO BRANCO;PRESIDENTE KENNEDY;
2024;1;FORTALEZA;15777;LUISA GONÇALVES;114;200;;4;EM GABRIEL CAVALCANTE;QUADRA F 167 CONJUNTO CASTELO BRANCO;PRESIDENTE KENNEDY;
2024;1;FORTALEZA;15777;LUISA GONÇALVES;114;201;;8;EM GABRIEL CAVALCANTE;QUADRA F 167 CONJUNTO CASTELO BRANCO;PRESIDENTE KENNEDY;
2024;1;FORTALEZA;15777;LUISA GONÇALVES;114;202;;3;EM GABRIEL CAVALCANTE;QUADRA F 167 CONJUNTO CASTELO BRANCO;PRESIDENTE KENNEDY;
2024;1;FORTALEZA;15777;LUISA GONÇALVES;114;203;;2;EMTI PROFESSOR JOAQUIM FRANCISCO DE SOUSA FILHO;RUA JOAQUIM MARQUES, 13;PRESIDENTE KENNEDY;
2024;1;FORTALEZA;15777;LUISA GONÇALVES;114;204;;4;EMTI PROFESSOR JOAQUIM FRANCISCO DE SOUSA FILHO;RUA JOAQUIM MARQUES, 13;PRESIDENTE KENNEDY;
2024;1;FORTALEZA;15777;LUISA GONÇALVES;114;206;;1;EM FRANCISCO SILVA CAVALCANTE;RUA CONSELHEIRO LAFAYETTE 205;FLORESTA;
2024;1;FORTALEZA;15777;LUISA GONÇALVES;114;217;;4;ESCOLINHA MUNDO INFANTIL;AVENIDA SARGENTO HERMÍNIO SAMPAIO 3787;PRESIDENTE KENNEDY;
2024;1;FORTALEZA;15777;LUISA GONÇALVES;114;218;;2;ESCOLINHA MUNDO INFANTIL;AVENIDA SARGENTO HERMÍNIO SAMPAIO 3787;PRESIDENTE KENNEDY;
2024;1;FORTALEZA;15777;LUISA GONÇALVES;114;252;;6;CENTRO DE REFERÊNCIA DE ASSISTÊNCIA SOCIAL DO PRES. KENNEDY - CRAS;QUADRA F S/N CONJUNTO CASTELO BRANCO;PRESIDENTE KENNEDY;
2024;1;FORTALEZA;15777;LUISA GONÇALVES;114;253;;3;CENTRO DE REFERÊNCIA DE ASSISTÊNCIA SOCIAL DO PRES. KENNEDY - CRAS;QUADRA F S/N CONJUNTO CASTELO BRANCO;PRESIDENTE KENNEDY;
2024;1;FORTALEZA;15777;LUISA GONÇALVES;114;254;;1;EMTI PROFESSOR JOAQUIM FRANCISCO DE SOUSA FILHO;RUA JOAQUIM MARQUES, 13;PRESIDENTE KENNEDY;
2024;1;FORTALEZA;15777;LUISA GONÇALVES;114;256;;1;EEFM SÃO JOSÉ DOS ARPOADORES;RUA FRANCISCO CALAÇA 90;CRISTO REDENTOR;
2024;1;FORTALEZA;15777;LUISA GONÇALVES;114;259;;5;ESCOLINHA MUNDO INFANTIL;AVENIDA SARGENTO HERMÍNIO SAMPAIO 3787;PRESIDENTE KENNEDY;
2024;1;FORTALEZA;15777;LUISA GONÇALVES;114;268;;5;ESCOLINHA MUNDO INFANTIL;AVENIDA SARGENTO HERMÍNIO SAMPAIO 3787;PRESIDENTE KENNEDY;
2024;1;FORTALEZA;15777;LUISA GONÇALVES;114;269;;1;EM SÃO JOSÉ;AVENIDA DOUTOR THEBERGE 2288;PRESIDENTE KENNEDY;
2024;1;FORTALEZA;15777;LUISA GONÇALVES;114;285;;1;EEMTI PROFESSORA BALBINA JUCA ALBUQUERQUE;AVENIDA MAJOR ASSIS 346;JARDIM IRACEMA;
2024;1;FORTALEZA;15777;LUISA GONÇALVES;114;293;;8;EMTI PROFESSOR JOAQUIM FRANCISCO DE SOUSA FILHO;RUA JOAQUIM MARQUES, 13;PRESIDENTE KENNEDY;
2024;1;FORTALEZA;15777;LUISA GONÇALVES;114;326;;1;EM DOM HELDER CAMARA;RUA FREI ODILON 623 B;ÁLVARO WEYNE;
2024;1;FORTALEZA;15777;LUISA GONÇALVES;114;343;;2;CENTRO DE REFERÊNCIA DE ASSISTÊNCIA SOCIAL DO PRES. KENNEDY - CRAS;QUADRA F S/N CONJUNTO CASTELO BRANCO;PRESIDENTE KENNEDY;
2024;1;FORTALEZA;15777;LUISA GONÇALVES;114;352;;1;EMTI PROFESSOR JOAQUIM FRANCISCO DE SOUSA FILHO;RUA JOAQUIM MARQUES, 13;PRESIDENTE KENNEDY;
2024;1;FORTALEZA;15777;LUISA GONÇALVES;114;359;;2;EMTI PROFESSOR JOAQUIM FRANCISCO DE SOUSA FILHO;RUA JOAQUIM MARQUES, 13;PRESIDENTE KENNEDY;
2024;1;FORTALEZA;15777;LUISA GONÇALVES;114;360;;1;EEFM ESTADO DE ALAGOAS;AVENIDA PRESIDENTE CASTELO BRANCO, 5244;BARRA DO CEARÁ;
2024;1;FORTALEZA;15777;LUISA GONÇALVES;115;61;;1;EM PROF. JOSE VALDIVINO DE CARVALHO;RUA GUARA, S/N;PARANGABA;
2024;1;FORTALEZA;15777;LUISA GONÇALVES;115;118;;1;DETRAN;AV GODOFREDO MACIEL, 2900;MARAPONGA;
2024;1;FORTALEZA;15777;LUISA GONÇALVES;115;132;;1;COLEGIO PROVECTO;RUA SUIÇA, 76;MARAPONGA;
2024;1;FORTALEZA;15777;LUISA GONÇALVES;115;292;;1;COLÉGIO UNIVERSO DO SABER;RUA 10 - NR 70 (CJ CAMPO DOS INGLESES - MARAPONGA);JARDIM CEARENSE;
2024;1;FORTALEZA;15777;LUISA GONÇALVES;115;368;;1;EM CATULO DA PAIXAO CEARENSE;RUA LEAO DO NORTE 300;VILA PERI;
2024;1;FORTALEZA;15777;LUISA GONÇALVES;115;481;;2;EM JOÃO ESTANISLAU FAÇANHA;RUA ONZE, S/N - CONJUNTO CAMPO DOS INGLESES;JARDIM CEARENSE;
2024;1;FORTALEZA;15777;LUISA GONÇALVES;116;38;;1;EM PROF ANTONIA MARIA DE LIMA;RUA SARGENTO JOAO PINHEIRO 2601;GRANJA LISBOA;
2024;1;FORTALEZA;15777;LUISA GONÇALVES;116;41;;1;EM PROF ANTONIA MARIA DE LIMA;RUA SARGENTO JOAO PINHEIRO 2601;GRANJA LISBOA;
2024;1;FORTALEZA;15777;LUISA GONÇALVES;116;42;;1;EM PROF ANTONIA MARIA DE LIMA;RUA SARGENTO JOAO PINHEIRO 2601;GRANJA LISBOA;
2024;1;FORTALEZA;15777;LUISA GONÇALVES;116;49;;1;EM SANTOS DUMONT;RUA GERALDO BARBOSA 240;BOM JARDIM;
2024;1;FORTALEZA;15777;LUISA GONÇALVES;116;85;;1;EM CONCEICAO MOURAO;RUA DUAS NACOES 550;GRANJA PORTUGAL;
2024;1;FORTALEZA;15777;LUISA GONÇALVES;116;156;;1;EM SEBASTIAO DE ABREU;RUA GERALDO BARBOSA 1065;BOM JARDIM;
2024;1;FORTALEZA;15777;LUISA GONÇALVES;116;158;;1;EM SEBASTIAO DE ABREU;RUA GERALDO BARBOSA 1065;BOM JARDIM;
2024;1;FORTALEZA;15777;LUISA GONÇALVES;116;203;;1;EM RACHEL VIANA MARTINS;RUA TUCUNDUBA 2703;GRANJA LISBOA;
2024;1;FORTALEZA;15777;LUISA GONÇALVES;116;204;;1;EM RACHEL VIANA MARTINS;RUA TUCUNDUBA 2703;GRANJA LISBOA;
2024;1;FORTALEZA;15777;LUISA GONÇALVES;116;215;;1;PROJETO ABC BOM JARDIM;RUA TRES CORACOES 762;GRANJA LISBOA;
2024;1;FORTALEZA;15777;LUISA GONÇALVES;116;266;;1;EM REITOR ANTONIO MARTINS FILHO;RUA TEODORO DE CASTRO 1175;GRANJA PORTUGAL;
2024;1;FORTALEZA;15777;LUISA GONÇALVES;116;293;;1;CENTRO CULTURAL BOM JARDIM;RUA TRES CORACOES 400;GRANJA LISBOA;
2024;1;FORTALEZA;15777;LUISA GONÇALVES;116;390;;1;EM FRANCISCA FERNANDES MAGALHAES;RUA OLIVEIRA SOBRINHO, 1031;BONSUCESSO;
2024;1;FORTALEZA;15777;LUISA GONÇALVES;116;391;;1;EM FRANCISCA FERNANDES MAGALHAES;RUA OLIVEIRA SOBRINHO, 1031;BONSUCESSO;
2024;1;FORTALEZA;15777;LUISA GONÇALVES;116;490;;1;EM DOM LUSTOSA;RUA GERALDO BARBOSA 3901;GRANJA LISBOA;
2024;1;FORTALEZA;15777;LUISA GONÇALVES;116;496;;1;EM FRANCISCO EDMILSON PINHEIRO;AVENIDA H, 2115, 4A ETAPA;CONJUNTO CEARÁ II;
2024;1;FORTALEZA;15777;LUISA GONÇALVES;116;501;;1;EM FRANCISCO EDMILSON PINHEIRO;AVENIDA H, 2115, 4A ETAPA;CONJUNTO CEARÁ II;
