2024;1;FORTALEZA;12100;MARA ESMERALDO;117;293;;1;EM FLORIVAL ALVES SERAINE;RUA ITATIAIA, 1000;CANINDEZINHO;
2024;1;FORTALEZA;12100;MARA ESMERALDO;117;313;;1;CENTRO CULTURAL CANINDEZINHO;AV. OSÓRIO DE PAIVA, 6297;CANINDEZINHO;
2024;1;FORTALEZA;12100;MARA ESMERALDO;117;415;;1;EM JOSE MARIA MOREIRA CAMPOS;RUA FRANCISCO ALMEIDA, 525 CJ. APOLO XI;PARQUE PRESIDENTE VARGAS;
2024;1;FORTALEZA;12100;MARA ESMERALDO;117;451;;1;EM PADRE ANTONIO MONTEIRO DA CRUZ;RUA DE PEDESTRE XIII, 25 - JARDIM FLUMINENSE II;CANINDEZINHO;
2024;1;FORTALEZA;12100;MARA ESMERALDO;117;472;;1;EM FLORIVAL ALVES SERAINE;RUA ITATIAIA, 1000;CANINDEZINHO;
2024;1;FORTALEZA;12100;MARA ESMERALDO;118;134;;1;EM ZAIRA MONTEIRO GONDIM;RUA PEDRO AGUIAR, 315;ITAPERI;
2024;1;FORTALEZA;12100;MARA ESMERALDO;118;269;;1;COLÉGIO MARIA ESTER I;RUA ANTONIO TEIXEIRA LEITE, 248;SERRINHA;
2024;1;FORTALEZA;12100;MARA ESMERALDO;118;392;;1;EM MARIA DE CARVALHO MARTINS;AVENIDA DOUTOR SILAS MUNGUBA, 4300;SERRINHA;
2024;1;FORTALEZA;12100;MARA ESMERALDO;118;437;;1;EM MARCOS VALENTIM PEREIRA DE SOUSA;RUA FREIRE ALEMÃO,91;SERRINHA;
2024;1;FORTALEZA;12100;MARA ESMERALDO;118;537;;1;COLEGIO MARIA ESTER II;RUA F (CONJUNTO MIRASSOL), 158;PARQUE DOIS IRMÃOS;
2024;1;FORTALEZA;12100;MARA ESMERALDO;118;563;;1;COLÉGIO CONECTIVO;RUA GENERAL ONOFRE, 445;MONDUBIM;
2024;1;FORTALEZA;12100;MARA ESMERALDO;118;612;;1;EM CASIMIRO MONTENEGRO;AV. BERNARDO MANUEL, 11360;MONDUBIM;
2024;1;FORTALEZA;12100;MARA ESMERALDO;118;638;;1;EM FRANCISCO ANDRADE TEOFILO GIRAO;RUA UNIDOS VENCEREMOS, 2040;PASSARÉ;
2024;1;FORTALEZA;12100;MARA ESMERALDO;118;644;;1;EEMTI DEPUTADO PAULINO ROCHA;RUA PROFESSOR JOSE SILVEIRA, 528;PASSARÉ;
2024;1;FORTALEZA;12100;MARA ESMERALDO;118;655;;1;EEMTI DEPUTADO PAULINO ROCHA;RUA PROFESSOR JOSE SILVEIRA, 528;PASSARÉ;
2024;1;FORTALEZA;12100;MARA ESMERALDO;118;657;;1;EEMTI DEPUTADO PAULINO ROCHA;RUA PROFESSOR JOSE SILVEIRA, 528;PASSARÉ;
TOTAL;;;;;;;;256;
