Ano;Turno;Município;Número;Candidato;Zona;Seção;Seções Agregadas;Votos;Local de Votação;Endereço Local de Votação;Bairro;
2024;1;FORTALEZA;12100;MARA ESMERALDO;1;355;;1;ESCOLA ESTADUAL DRAGAO DO MAR;RUA UMARI S/N;MUCURIPE;
2024;1;FORTALEZA;12100;MARA ESMERALDO;1;358;;1;IATE CLUBE;AVENIDA DA ABOLIÇÃO 4813;MUCURIPE;
2024;1;FORTALEZA;12100;MARA ESMERALDO;1;393;;1;CIES AIDA SANTOS;AVENIDA TRAJANO DE MEDEIROS  813;VICENTE PINZON;
2024;1;FORTALEZA;12100;MARA ESMERALDO;1;471;;1;ESCOLA ESTADUAL MARIA JOSE MEDEIROS;RUA DESEMBARGADOR LAURO NOGUEIRA 1240;PAPICU;
2024;1;FORTALEZA;12100;MARA ESMERALDO;1;473;;1;ESCOLA MIGUEL FIALHO - ANTIGO PADRE JOSÉ NILSON ;RUA CORONEL MANUEL JESUÍNO 225;MUCURIPE;
2024;1;FORTALEZA;12100;MARA ESMERALDO;1;475;;3;ESCOLA MIGUEL FIALHO - ANTIGO PADRE JOSÉ NILSON ;RUA CORONEL MANUEL JESUÍNO 225;MUCURIPE;
2024;1;FORTALEZA;12100;MARA ESMERALDO;1;526;;1;ESCOLA MUNICIPAL COLONIA Z-8;RUA MANOEL JESUINO,370;VARJOTA;
2024;1;FORTALEZA;12100;MARA ESMERALDO;1;599;;1;ESCOLA MUNICIPAL JOSE RAMOS TORRES DE MELO;AVENIDA DA ABOLIÇÃO 3984;MUCURIPE;
2024;1;FORTALEZA;12100;MARA ESMERALDO;1;653;;1;ESCOLA DE GASTRONOMIA SOCIAL IVENS DIAS BRANCO;RUA MANUEL DIAS BRANCO,80;CAIS DO PORTO;
2024;1;FORTALEZA;12100;MARA ESMERALDO;1;756;;1;FACULDADE FARIAS BRITO - CASTRO MONTE;RUA CASTRO MONTE 1364;VARJOTA;
2024;1;FORTALEZA;12100;MARA ESMERALDO;1;815;;1;UNINTA - FACULDADE UNINTA FORTALEZA;RUA VILEBALDO AGUIAR,133;COCÓ;
2024;1;FORTALEZA;12100;MARA ESMERALDO;1;859;;1;COLEGIO ANTARES - OCELO PINHEIRO;RUA PROFESSOR OCELO PINHEIRO 101;PAPICU;
2024;1;FORTALEZA;12100;MARA ESMERALDO;1;884;;1;COLEGIO ANTARES - OCELO PINHEIRO;RUA PROFESSOR OCELO PINHEIRO 101;PAPICU;
2024;1;FORTALEZA;12100;MARA ESMERALDO;1;919;;1;FANOR - FACULDADE NORDESTE;AVENIDA SANTOS DUMONT 7800;DE LOURDES;
2024;1;FORTALEZA;12100;MARA ESMERALDO;1;928;;1;UNINTA - FACULDADE UNINTA FORTALEZA;RUA VILEBALDO AGUIAR,133;COCÓ;
2024;1;FORTALEZA;12100;MARA ESMERALDO;2;55;;1;EM PROFª FERNANDA MARIA DE ALENCAR COLARES;AV PROF. ARTHUR DE CARVALHO, 1540;LAGOA REDONDA;
2024;1;FORTALEZA;12100;MARA ESMERALDO;2;80;;1;EEEP COMENDADOR MIGUEL GURGEL;RUA JOSE BAIMA, S/N;GUAJERU;
2024;1;FORTALEZA;12100;MARA ESMERALDO;2;90;;1;CLUBE DA CAIXA;AVENIDA FREI CIRILO 4700;MESSEJANA;
2024;1;FORTALEZA;12100;MARA ESMERALDO;2;119;;1;EEEP COMENDADOR MIGUEL GURGEL;RUA JOSE BAIMA, S/N;GUAJERU;
2024;1;FORTALEZA;12100;MARA ESMERALDO;2;122;;1;EEFM JOSE DE ALENCAR;RUA VENEZA, 84;MESSEJANA;
2024;1;FORTALEZA;12100;MARA ESMERALDO;2;125;;1;EEFM JOSE DE ALENCAR;RUA VENEZA, 84;MESSEJANA;
2024;1;FORTALEZA;12100;MARA ESMERALDO;2;167;;1;PATRONATO PADRE LUIZ BARBOSA MOREIRA;RUA CEL GUILHERME ALENCAR, 121;MESSEJANA;
2024;1;FORTALEZA;12100;MARA ESMERALDO;2;175;;1;COLÉGIO SERAFICO NOSSA SENHORA DO BRASIL;AVENIDA FREI CIRILO 4454;MESSEJANA;
2024;1;FORTALEZA;12100;MARA ESMERALDO;2;378;;1;EMEIF DEMOCRITO ROCHA;RUA PADRE PEDRO DE ALENCAR, 2012;MESSEJANA;
2024;1;FORTALEZA;12100;MARA ESMERALDO;2;417;;1;EEEP COMENDADOR MIGUEL GURGEL;RUA JOSE BAIMA, S/N;GUAJERU;
2024;1;FORTALEZA;12100;MARA ESMERALDO;2;429;;1;EEM LICEU DE MESSEJANA;AVENIDA WASHINGTON SOARES 7702;MESSEJANA;
2024;1;FORTALEZA;12100;MARA ESMERALDO;2;447;;2;EEEP COMENDADOR MIGUEL GURGEL;RUA JOSE BAIMA, S/N;GUAJERU;
2024;1;FORTALEZA;12100;MARA ESMERALDO;2;523;;1;EEFM GOV LUIZ DE GONZAGA FONSECA MOTA;RUA SANTA ROSA, 407;COAÇU;
2024;1;FORTALEZA;12100;MARA ESMERALDO;2;533;;1;EMEIF DEMOCRITO ROCHA;RUA PADRE PEDRO DE ALENCAR, 2012;MESSEJANA;
2024;1;FORTALEZA;12100;MARA ESMERALDO;2;557;;1;EEM LICEU DE MESSEJANA;AVENIDA WASHINGTON SOARES 7702;MESSEJANA;
2024;1;FORTALEZA;12100;MARA ESMERALDO;2;649;;1;EEFM JOSE DE ALENCAR;RUA VENEZA, 84;MESSEJANA;
2024;1;FORTALEZA;12100;MARA ESMERALDO;2;686;;1;CMES PROFª TEREZINHA FERREIRA PARENTE;RUA NELSON COELHO, 209;LAGOA REDONDA;
2024;1;FORTALEZA;12100;MARA ESMERALDO;2;706;;1;EM PROFª FERNANDA MARIA DE ALENCAR COLARES;AV PROF. ARTHUR DE CARVALHO, 1540;LAGOA REDONDA;
2024;1;FORTALEZA;12100;MARA ESMERALDO;2;709;;1;EMEIF ANGELICA GURGEL;RUA DOUTOR PERGENTINO MAIA, 375;MESSEJANA;
2024;1;FORTALEZA;12100;MARA ESMERALDO;2;748;;1;EEFM GOV LUIZ DE GONZAGA FONSECA MOTA;RUA SANTA ROSA, 407;COAÇU;
2024;1;FORTALEZA;12100;MARA ESMERALDO;2;756;;1;COLÉGIO SERAFICO NOSSA SENHORA DO BRASIL;AVENIDA FREI CIRILO 4454;MESSEJANA;
2024;1;FORTALEZA;12100;MARA ESMERALDO;2;764;;1;EMEIF DEMOCRITO ROCHA;RUA PADRE PEDRO DE ALENCAR, 2012;MESSEJANA;
2024;1;FORTALEZA;12100;MARA ESMERALDO;2;769;;1;COLÉGIO CHRISTUS SUL;AV. ENG. LEAL LIMA VERDE, 2265;JOSÉ DE ALENCAR;
2024;1;FORTALEZA;12100;MARA ESMERALDO;2;776;;1;EM PROFª FERNANDA MARIA DE ALENCAR COLARES;AV PROF. ARTHUR DE CARVALHO, 1540;LAGOA REDONDA;
2024;1;FORTALEZA;12100;MARA ESMERALDO;2;819;;1;ESCOLA MUNICIPAL ISABEL FERREIRA;RUA ISABEL FERREIRA, 1000 - CONJ. CURIÓ;LAGOA REDONDA;
2024;1;FORTALEZA;12100;MARA ESMERALDO;2;822;;1;COLÉGIO CHRISTUS SUL;AV. ENG. LEAL LIMA VERDE, 2265;JOSÉ DE ALENCAR;
2024;1;FORTALEZA;12100;MARA ESMERALDO;3;16;534;1;COLÉGIO 7 DE SETEMBRO (SEDE NGS);AV. DO IMPERADOR, 1330;CENTRO;
2024;1;FORTALEZA;12100;MARA ESMERALDO;3;24;185;1;COLÉGIO 7 DE SETEMBRO (SEDE NGS);AV. DO IMPERADOR, 1330;CENTRO;
2024;1;FORTALEZA;12100;MARA ESMERALDO;3;223;;1;FACULDADE ARI DE SÁ;AV. HERÁCLITO GRAÇA, 826;CENTRO;
2024;1;FORTALEZA;12100;MARA ESMERALDO;3;286;;1;SECRETARIA DA SAÚDE DO ESTADO DO CEARÁ;RUA ITAPIPOCA, 60;PRAIA DE IRACEMA;
2024;1;FORTALEZA;12100;MARA ESMERALDO;3;388;;1;CÍRCULO MILITAR DE FORTALEZA;RUA CANUTO DE AGUIAR, 425;MEIRELES;
2024;1;FORTALEZA;12100;MARA ESMERALDO;3;391;;1;CÍRCULO MILITAR DE FORTALEZA;RUA CANUTO DE AGUIAR, 425;MEIRELES;
2024;1;FORTALEZA;12100;MARA ESMERALDO;3;392;;1;CÍRCULO MILITAR DE FORTALEZA;RUA CANUTO DE AGUIAR, 425;MEIRELES;
2024;1;FORTALEZA;12100;MARA ESMERALDO;3;401;;1;COLÉGIO CHRISTUS (AV. BARÃO DE STUDART);RUA JOÃO CARVALHO, 630;ALDEOTA;
2024;1;FORTALEZA;12100;MARA ESMERALDO;3;410;;1;COLÉGIO DARWIN;RUA ILDEFONSO ALBANO, 1030;ALDEOTA;
2024;1;FORTALEZA;12100;MARA ESMERALDO;3;413;;1;COLÉGIO DARWIN;RUA ILDEFONSO ALBANO, 1030;ALDEOTA;
2024;1;FORTALEZA;12100;MARA ESMERALDO;3;414;;1;COLÉGIO DARWIN;RUA ILDEFONSO ALBANO, 1030;ALDEOTA;
2024;1;FORTALEZA;12100;MARA ESMERALDO;3;423;;1;FACULDADE ARI DE SÁ;AV. HERÁCLITO GRAÇA, 826;CENTRO;
2024;1;FORTALEZA;12100;MARA ESMERALDO;3;428;;1;FACULDADE ARI DE SÁ;AV. HERÁCLITO GRAÇA, 826;CENTRO;
2024;1;FORTALEZA;12100;MARA ESMERALDO;3;432;;1;FACULDADE ARI DE SÁ;AV. HERÁCLITO GRAÇA, 826;CENTRO;
2024;1;FORTALEZA;12100;MARA ESMERALDO;3;435;;1;EEFM PARÓQUIA DA PAZ;RUA VISCONDE DE MAUÁ, 905/A;MEIRELES;
2024;1;FORTALEZA;12100;MARA ESMERALDO;3;486;;1;COLÉGIO ANTARES (PRAIA DE IRACEMA);RUA HISTORIADOR GUARINO ALVES, 95;PRAIA DE IRACEMA;
2024;1;FORTALEZA;12100;MARA ESMERALDO;3;500;;1;IDEAL CLUBE;AV. MONSENHOR TABOSA,  1381;MEIRELES;
2024;1;FORTALEZA;12100;MARA ESMERALDO;3;501;;1;IDEAL CLUBE;AV. MONSENHOR TABOSA,  1381;MEIRELES;
2024;1;FORTALEZA;12100;MARA ESMERALDO;3;507;;1;COLÉGIO ANTARES (PRAIA DE IRACEMA);RUA HISTORIADOR GUARINO ALVES, 95;PRAIA DE IRACEMA;
2024;1;FORTALEZA;12100;MARA ESMERALDO;3;573;;1;INSTITUTO CEARENSE DE EDUCAÇÃO DE SURDOS - ICES;AV. RUI BARBOSA, 1970;ALDEOTA;
2024;1;FORTALEZA;12100;MARA ESMERALDO;3;577;;1;EM JOSÉ DIAS MACEDO;RUA NUNES VALENTE, 809;MEIRELES;
2024;1;FORTALEZA;12100;MARA ESMERALDO;3;582;;1;ESCOLA DE SAÚDE PÚBLICA DO CEARÁ;AV. ANTÔNIO JUSTA, 3161;MEIRELES;
2024;1;FORTALEZA;12100;MARA ESMERALDO;3;597;;1;COLÉGIO SANTA CECÍLIA;AV. SENADOR VIRGÍLIO TÁVORA, 2000;ALDEOTA;
2024;1;FORTALEZA;12100;MARA ESMERALDO;3;602;;1;COLÉGIO SANTA CECÍLIA;AV. SENADOR VIRGÍLIO TÁVORA, 2000;ALDEOTA;
2024;1;FORTALEZA;12100;MARA ESMERALDO;3;613;;1;COLÉGIO ESPAÇO ABERTO - DOM LUÍS;AV. DOM LUÍS, 730;ALDEOTA;
2024;1;FORTALEZA;12100;MARA ESMERALDO;3;615;;1;ESCOLA DE SAÚDE PÚBLICA - NEPE (ANEXO);AV. ANTÔNIO JUSTA, 3161;MEIRELES;
2024;1;FORTALEZA;12100;MARA ESMERALDO;3;643;;1;EM JOSÉ DIAS MACEDO;RUA NUNES VALENTE, 809;MEIRELES;
2024;1;FORTALEZA;12100;MARA ESMERALDO;3;644;;1;COLÉGIO SANTA CECÍLIA;AV. SENADOR VIRGÍLIO TÁVORA, 2000;ALDEOTA;
2024;1;FORTALEZA;12100;MARA ESMERALDO;80;127;;1;EEFM ESTADO DO PARÁ;RUA DJALMA PETIT 589;ALTO DA BALANÇA;
2024;1;FORTALEZA;12100;MARA ESMERALDO;80;135;;1;EEFM JOAQUIM ANTÔNIO ALBANO;RUA JULIO SIQUEIRA 390;DIONISIO TORRES;
2024;1;FORTALEZA;12100;MARA ESMERALDO;80;162;;1;AABB - ASSOCIAÇÃO ATLÉTICA BANCO DO BRASIL;AV BARAO DE STUDART, 2917;DIONISIO TORRES;
2024;1;FORTALEZA;12100;MARA ESMERALDO;80;164;;1;AABB - ASSOCIAÇÃO ATLÉTICA BANCO DO BRASIL;AV BARAO DE STUDART, 2917;DIONISIO TORRES;
2024;1;FORTALEZA;12100;MARA ESMERALDO;80;178;;1;CENTRO EDUC. DA JUV. PE. JOÃO PIAMARTA - AGUANAMBI;AV. AGUANAMBI, 2479;FÁTIMA;
2024;1;FORTALEZA;12100;MARA ESMERALDO;80;182;;2;COLÉGIO NOSSA SENHORA DAS GRAÇAS;RUA MONSENHOR OTÁVIO DE CASTRO, 535;FÁTIMA;
2024;1;FORTALEZA;12100;MARA ESMERALDO;80;185;;1;COLÉGIO NOSSA SENHORA DAS GRAÇAS;RUA MONSENHOR OTÁVIO DE CASTRO, 535;FÁTIMA;
2024;1;FORTALEZA;12100;MARA ESMERALDO;80;187;;1;COLÉGIO NOSSA SENHORA DAS GRAÇAS;RUA MONSENHOR OTÁVIO DE CASTRO, 535;FÁTIMA;
2024;1;FORTALEZA;12100;MARA ESMERALDO;80;188;;1;COLÉGIO NOSSA SENHORA DAS GRAÇAS;RUA MONSENHOR OTÁVIO DE CASTRO, 535;FÁTIMA;
2024;1;FORTALEZA;12100;MARA ESMERALDO;80;195;;1;COLÉGIO SANTO TOMÁZ DE AQUINO;RUA MÁRIO MAMEDE, 750;FÁTIMA;
2024;1;FORTALEZA;12100;MARA ESMERALDO;80;218;;1;EM PROFESSORA EDITH BRAGA;RUA CAPITAO VASCONCELOS 1061;ALTO DA BALANÇA;
2024;1;FORTALEZA;12100;MARA ESMERALDO;80;224;;1;EEFM PADRE ROCHA;RUA CEL ALVES TEIXEIRA 525;JOAQUIM TÁVORA;
2024;1;FORTALEZA;12100;MARA ESMERALDO;80;244;;1;EEFM NOEL HUGNEN OLIVEIRA PAIVA;RUA MONSENHOR SALAZAR 279;TAUAPE;
2024;1;FORTALEZA;12100;MARA ESMERALDO;80;245;;1;EEFM NOEL HUGNEN OLIVEIRA PAIVA;RUA MONSENHOR SALAZAR 279;TAUAPE;
2024;1;FORTALEZA;12100;MARA ESMERALDO;80;270;;1;FACULDADE MAURÍCIO DE NASSAU;AVENIDA VISCONDE DO RIO BRANCO, 2078;JOSÉ BONIFÁCIO;
2024;1;FORTALEZA;12100;MARA ESMERALDO;80;271;;1;FACULDADE MAURÍCIO DE NASSAU;AVENIDA VISCONDE DO RIO BRANCO, 2078;JOSÉ BONIFÁCIO;
2024;1;FORTALEZA;12100;MARA ESMERALDO;80;318;;1;COLÉGIO SANTO INACIO;AVENIDA DESEMBARGADOR MOREIRA 2355;DIONISIO TORRES;
2024;1;FORTALEZA;12100;MARA ESMERALDO;80;328;;1;COLÉGIO ANTARES IRMÃ MARIA (ANTIGO IRMÃ MARIA MONTENEGRO);RUA PINHO PESSOA 681;JOAQUIM TÁVORA;
2024;1;FORTALEZA;12100;MARA ESMERALDO;80;341;;1;COLÉGIO ANTARES IRMÃ MARIA (ANTIGO IRMÃ MARIA MONTENEGRO);RUA PINHO PESSOA 681;JOAQUIM TÁVORA;
2024;1;FORTALEZA;12100;MARA ESMERALDO;80;345;;1;COLÉGIO SALESIANO DOM BOSCO;AV ANTONIO SALES 116;JOAQUIM TÁVORA;
2024;1;FORTALEZA;12100;MARA ESMERALDO;80;365;;1;INSTITUTO DE EDUCAÇÃO DO CEARÁ;RUA GRACILIANO RAMOS, 52;FÁTIMA;
2024;1;FORTALEZA;12100;MARA ESMERALDO;80;366;;1;INSTITUTO DE EDUCAÇÃO DO CEARÁ;RUA GRACILIANO RAMOS, 52;FÁTIMA;
2024;1;FORTALEZA;12100;MARA ESMERALDO;80;378;;1;COLÉGIO SHALON;RUA TIBÚRCIO FROTA, 1530 COM OSVALDO CRUZ;TAUAPE;
2024;1;FORTALEZA;12100;MARA ESMERALDO;80;405;;1;COLÉGIO MAURO BEZERRA;RUA BRIGADEIRO VILELA, 221;AEROLÂNDIA;
2024;1;FORTALEZA;12100;MARA ESMERALDO;80;416;;2;EEM GOV. ADAUTO BEZERRA;RUA MONSENHOR LIBERATO, 1850;FÁTIMA;
2024;1;FORTALEZA;12100;MARA ESMERALDO;80;421;;2;COLÉGIO SANTO INACIO;AVENIDA DESEMBARGADOR MOREIRA 2355;DIONISIO TORRES;
2024;1;FORTALEZA;12100;MARA ESMERALDO;80;424;;1;FACULDADE MAURÍCIO DE NASSAU;AVENIDA VISCONDE DO RIO BRANCO, 2078;JOSÉ BONIFÁCIO;
2024;1;FORTALEZA;12100;MARA ESMERALDO;80;434;;1;FACULDADE MAURÍCIO DE NASSAU;AVENIDA VISCONDE DO RIO BRANCO, 2078;JOSÉ BONIFÁCIO;
2024;1;FORTALEZA;12100;MARA ESMERALDO;82;189;;1;EEFM CLÁUDIO MARTINS;RUA DEMÓCRITO ROCHA, 400;MONTE CASTELO;
2024;1;FORTALEZA;12100;MARA ESMERALDO;82;200;;1;ESCOLA MUNICIPAL FAUSTINO DE ALBUQUERQUE - EI/EF;RUA AMARO CAVALCANTE, 221;MONTE CASTELO;
2024;1;FORTALEZA;12100;MARA ESMERALDO;82;210;;1;COLÉGIO PROF. F. EURÍDICE;RUA NATURALISTA FEIJÓ, 736;MONTE CASTELO;
2024;1;FORTALEZA;12100;MARA ESMERALDO;82;224;;1;CENTRO EDUCACIONAL MOEMA TÁVORA;RUA MARCÍLIO DIAS, 485;PIRAMBU;
2024;1;FORTALEZA;12100;MARA ESMERALDO;82;362;;1;COLÉGIO MASTER - BEZERRA DE MENEZES;AV. BEZERRA DE MENEZES, 1802;SÃO GERARDO;
2024;1;FORTALEZA;12100;MARA ESMERALDO;82;382;;1;COLÉGIO MENINO JESUS DE PRAGA;RUA ANA FACÓ, 140;CARLITO PAMPLONA;
2024;1;FORTALEZA;12100;MARA ESMERALDO;82;385;;1;ESCOLA MUNICIPAL FAUSTINO DE ALBUQUERQUE - EI/EF;RUA AMARO CAVALCANTE, 221;MONTE CASTELO;
2024;1;FORTALEZA;12100;MARA ESMERALDO;82;467;;1;ESCOLA MUNICIPAL PATATIVA DO ASSARÉ - EI/EF;RUA IRINEU DE SOUZA, 197;ÁLVARO WEYNE;
2024;1;FORTALEZA;12100;MARA ESMERALDO;82;477;;1;EEFM CLÁUDIO MARTINS;RUA DEMÓCRITO ROCHA, 400;MONTE CASTELO;
2024;1;FORTALEZA;12100;MARA ESMERALDO;82;613;;1;ESCOLA MUNICIPAL PATATIVA DO ASSARÉ - EI/EF;RUA IRINEU DE SOUZA, 197;ÁLVARO WEYNE;
2024;1;FORTALEZA;12100;MARA ESMERALDO;83;32;;1;EEMTI ESTADO DO AMAZONAS;RUA MONSENHOR FURTADO 2327;BELA VISTA;
2024;1;FORTALEZA;12100;MARA ESMERALDO;83;67;;1;EEFM JOAQUIM ALVES;RUA ESTADO DO RIO 955;DEMOCRITO ROCHA;
2024;1;FORTALEZA;12100;MARA ESMERALDO;83;157;;1;CENTRO DE FORMAÇÃO E DESENV. PARA PROFISSIONAIS DA EDUCAÇÃO - FORMACE;RUA PORTO VELHO, 401;JOÃO XXIII;
2024;1;FORTALEZA;12100;MARA ESMERALDO;83;239;;1;ESCOLA MUNICIPAL JOSÉ BATISTA DE OLIVEIRA;RUA GOIÁS 620;PANAMERICANO;
2024;1;FORTALEZA;12100;MARA ESMERALDO;83;244;;1;EEFM ANISIO TEIXEIRA;RUA RIO GRANDE DO SUL 680;PANAMERICANO;
2024;1;FORTALEZA;12100;MARA ESMERALDO;83;475;;1;ESCOLA MUNICIPAL JOSÉ BATISTA DE OLIVEIRA;RUA GOIÁS 620;PANAMERICANO;
2024;1;FORTALEZA;12100;MARA ESMERALDO;83;585;;1;COLÉGIO LUCÊ;RUA CUIABA 155;JÓQUEI CLUBE;
2024;1;FORTALEZA;12100;MARA ESMERALDO;83;685;797;2;CENTRO UNIVERSITÁRIO ESTÁCIO - CAMPUS PARANGABA;AVENIDA SENADOR FERNANDES TÁVORA, 137;JÓQUEI CLUBE;
2024;1;FORTALEZA;12100;MARA ESMERALDO;83;792;;1;COLÉGIO LUCÊ;RUA CUIABA 155;JÓQUEI CLUBE;
2024;1;FORTALEZA;12100;MARA ESMERALDO;85;111;;1;CEJA ADELINO DE ALCANTARA FILHO - UV-6;RUA SEISCENTOS E DOZE, 100, 1A ETAPA;CONJUNTO CEARÁ I;
2024;1;FORTALEZA;12100;MARA ESMERALDO;85;162;;1;EM BERGSON GURJÃO FARIAS;AVENIDA SENADOR FERNANDES TÁVORA, 2500;AUTRAN NUNES;
2024;1;FORTALEZA;12100;MARA ESMERALDO;85;278;;1;EEFM PROF PLACIDO ADERALDO CASTELO - UV 7B;RUA SETECENTOS E VINTE E UM, 100, 3A ETAPA;CONJUNTO CEARÁ I;
2024;1;FORTALEZA;12100;MARA ESMERALDO;85;302;;1;EEFM ANTONIO BEZERRA;RUA PADRE PERDIGAO SAMPAIO 780;ANTÔNIO BEZERRA;
2024;1;FORTALEZA;12100;MARA ESMERALDO;85;320;;1;ESCOLA MUNICIPAL DEP MURILO AGUIAR;RUA 24 DE OUTUBRO 655;GENIBAÚ;
2024;1;FORTALEZA;12100;MARA ESMERALDO;93;159;;1;CUCA JOSÉ WALTER;RUA 69, S/N;PREFEITO JOSÉ WALTER;
2024;1;FORTALEZA;12100;MARA ESMERALDO;93;163;;1;EM JOAO HILDO DE CARVALHO FURTADO;RUA MIGUEL ARAGÃO, S/N ARACAPÉ;MONDUBIM;
2024;1;FORTALEZA;12100;MARA ESMERALDO;93;166;;1;EM JOAO HILDO DE CARVALHO FURTADO;RUA MIGUEL ARAGÃO, S/N ARACAPÉ;MONDUBIM;
2024;1;FORTALEZA;12100;MARA ESMERALDO;93;183;;1;EEFM ESTADO DO MARANHAO;RUA CARLOS PIMENTA,506;MONDUBIM;
2024;1;FORTALEZA;12100;MARA ESMERALDO;93;194;;1;EM ADALBERTO STUDART FILHO;RUA DO CAMPO, 25;PLANALTO AYRTON SENNA;
2024;1;FORTALEZA;12100;MARA ESMERALDO;93;245;;1;COLÉGIO SILVIA HELENA NOGUEIRA;RUA 62, 140 - III ETAPA;PREFEITO JOSÉ WALTER;
2024;1;FORTALEZA;12100;MARA ESMERALDO;94;29;;1;EEFM JOSE BEZERRA DE MENEZES (POLIVALENTE);RUA ANARIO BRAGA SN;ANTÔNIO BEZERRA;
2024;1;FORTALEZA;12100;MARA ESMERALDO;94;599;;1;EM CASTELO DE CASTRO;RUA 43 1531;VILA VELHA;
2024;1;FORTALEZA;12100;MARA ESMERALDO;95;88;;1;EEFM PADRE MARCELINO CHAMPAGNAT;RUA DAURA, 120;BARROSO;
2024;1;FORTALEZA;12100;MARA ESMERALDO;95;92;;1;EEFM PADRE MARCELINO CHAMPAGNAT;RUA DAURA, 120;BARROSO;
2024;1;FORTALEZA;12100;MARA ESMERALDO;95;100;;1;EEFM DOUTORA ALDACI BARBOSA;RUA VALPARAISO, 155;CONJUNTO PALMEIRAS;
2024;1;FORTALEZA;12100;MARA ESMERALDO;95;153;;1;EEFM ALMIRANTE TAMANDARÉ;RUA DO MANDACARU, 1048 CJ ALMIRANTE TAMANDARÉ;JANGURUSSU;
2024;1;FORTALEZA;12100;MARA ESMERALDO;95;173;;1;EEMTI POETA OTACILIO COLARES;RUA JORGE DA VEIGA, 265;PARQUE SANTA MARIA;
2024;1;FORTALEZA;12100;MARA ESMERALDO;95;179;;1;DNIT;RODOVIA BR-116, KM 06;CAJAZEIRAS;
2024;1;FORTALEZA;12100;MARA ESMERALDO;95;180;;1;DNIT;RODOVIA BR-116, KM 06;CAJAZEIRAS;
2024;1;FORTALEZA;12100;MARA ESMERALDO;95;188;;1;DNIT;RODOVIA BR-116, KM 06;CAJAZEIRAS;
2024;1;FORTALEZA;12100;MARA ESMERALDO;95;204;;1;EEEP MÁRIO ALENCAR;RUA VERDE 44, 97 (CJ. SÍTIO SÃO JOÃO);JANGURUSSU;
2024;1;FORTALEZA;12100;MARA ESMERALDO;95;225;;1;EM FRANCISCA ORIA SERPA;RUA JORGE FIGUEIREDO, 3652;PEDRAS;
2024;1;FORTALEZA;12100;MARA ESMERALDO;95;234;;1;CEI MARIA DO SOCORRO FERREIRA VIRINO;RUA VALPARAÍSO, 339;CONJUNTO PALMEIRAS;
2024;1;FORTALEZA;12100;MARA ESMERALDO;95;242;;1;EMEIEF TAÍS MARIA BEZERRA NOGUEIRA;AV. GOVERNADOR LEONEL BRIZOLA, 710;JANGURUSSU;
2024;1;FORTALEZA;12100;MARA ESMERALDO;95;251;;1;EMEIEF OTAVIO DE FARIAS;RUA JOAO FERREIRA, S/N;BARROSO;
2024;1;FORTALEZA;12100;MARA ESMERALDO;95;259;;1;EEFM PROFESSOR  ALOYSIO BARROS LEAL;RUA 10,  LOT. PRQ.VERDE 28 (CJ JOAO PAULO II);BARROSO;
2024;1;FORTALEZA;12100;MARA ESMERALDO;95;262;;1;EEFM PROFESSOR  ALOYSIO BARROS LEAL;RUA 10,  LOT. PRQ.VERDE 28 (CJ JOAO PAULO II);BARROSO;
2024;1;FORTALEZA;12100;MARA ESMERALDO;95;286;;1;EM PROFESSORA MARIA ANTONÉZIA MEIRELES E SÁ;RUA CORONEL VIRGÍLIO TÁVORA, 1340;BARROSO;
2024;1;FORTALEZA;12100;MARA ESMERALDO;95;327;;2;EEFM PROFESSOR  ALOYSIO BARROS LEAL;RUA 10,  LOT. PRQ.VERDE 28 (CJ JOAO PAULO II);BARROSO;
2024;1;FORTALEZA;12100;MARA ESMERALDO;112;32;;1;COLÉGIO ANTARES - SEDE WASHINGTON SOARES;RUA CAETANO XIMENES ARAGÃO,110 - ACESSO PELA RUA ARMANDO DALL'OLIO;ENGENHEIRO LUCIANO CAVALCANTE;
2024;1;FORTALEZA;12100;MARA ESMERALDO;112;76;;1;ESCOLA ESTADUAL DE EDUCAÇÃO PROFISSIONAL JAIME ALENCAR DE OLIVEIRA;AV ROGACIANO LEITE, 2285;ENGENHEIRO LUCIANO CAVALCANTE;
2024;1;FORTALEZA;12100;MARA ESMERALDO;112;347;;1;EM PROF. LUIS COSTA;RUA JAIME LEONEL, 156;ENGENHEIRO LUCIANO CAVALCANTE;
2024;1;FORTALEZA;12100;MARA ESMERALDO;112;383;;1;ESCOLA SOCIOEDUCATIVA;AV. OLIVEIRA PAIVA, 941;CIDADE DOS FUNCIONÁRIOS;
2024;1;FORTALEZA;12100;MARA ESMERALDO;112;388;;1;EEFM DOM ANTONIO DE ALMEIDA LUSTOSA;RUA ADOLFO MOREIRA DE CARVALHO, S/N;EDSON QUEIROZ;
2024;1;FORTALEZA;12100;MARA ESMERALDO;112;392;;1;EEFM DOM ANTONIO DE ALMEIDA LUSTOSA;RUA ADOLFO MOREIRA DE CARVALHO, S/N;EDSON QUEIROZ;
2024;1;FORTALEZA;12100;MARA ESMERALDO;112;410;;1;COLEGIO ARI DE SA CAVALCANTE WS;AV WASHINGTON SOARES, 3737;EDSON QUEIROZ;
2024;1;FORTALEZA;12100;MARA ESMERALDO;112;415;;1;COLEGIO ARI DE SA CAVALCANTE WS;AV WASHINGTON SOARES, 3737;EDSON QUEIROZ;
2024;1;FORTALEZA;12100;MARA ESMERALDO;112;432;;1;COLEGIO ARI DE SA CAVALCANTE WS;AV WASHINGTON SOARES, 3737;EDSON QUEIROZ;
2024;1;FORTALEZA;12100;MARA ESMERALDO;112;434;;1;COLEGIO ARI DE SA CAVALCANTE WS;AV WASHINGTON SOARES, 3737;EDSON QUEIROZ;
2024;1;FORTALEZA;12100;MARA ESMERALDO;112;457;;1;UNIVERSIDADE DE FORTALEZA - UNIFOR;AVENIDA WASHINGTON SOARES, 1321;EDSON QUEIROZ;
2024;1;FORTALEZA;12100;MARA ESMERALDO;112;462;;1;UNIVERSIDADE DE FORTALEZA - UNIFOR;AVENIDA WASHINGTON SOARES, 1321;EDSON QUEIROZ;
2024;1;FORTALEZA;12100;MARA ESMERALDO;112;498;;1;COLEGIO MASTER SUL;RUA BENJAMIM MOURA, 631;CIDADE DOS FUNCIONÁRIOS;
2024;1;FORTALEZA;12100;MARA ESMERALDO;112;503;;2;EM PROF FRANCISCO MAURICIO MATOS DOURADO;RUA  DES FLORIANO BENEVIDES MAGALHÃES, 391;EDSON QUEIROZ;
2024;1;FORTALEZA;12100;MARA ESMERALDO;112;506;;1;EM PROF FRANCISCO MAURICIO MATOS DOURADO;RUA  DES FLORIANO BENEVIDES MAGALHÃES, 391;EDSON QUEIROZ;
2024;1;FORTALEZA;12100;MARA ESMERALDO;112;507;;1;EM PROF FRANCISCO MAURICIO MATOS DOURADO;RUA  DES FLORIANO BENEVIDES MAGALHÃES, 391;EDSON QUEIROZ;
2024;1;FORTALEZA;12100;MARA ESMERALDO;112;522;;1;COLEGIO GLOBOMAX;RUA GENERAL CAIADO DE CASTRO, 156;ENGENHEIRO LUCIANO CAVALCANTE;
2024;1;FORTALEZA;12100;MARA ESMERALDO;112;541;;1;ESCOLA VITAL DIDONET;RUA SERTÃO DOS INHAMUNS 201;CIDADE DOS FUNCIONÁRIOS;
2024;1;FORTALEZA;12100;MARA ESMERALDO;112;545;;1;COLÉGIO BATISTA - UNIDADE SEIS BOCAS;RUA DR. WALDEMAR DE ALCANTARA, 200;CAMBEBA;
2024;1;FORTALEZA;12100;MARA ESMERALDO;112;561;;1;COLÉGIO NOVA DIMENSÃO;AV. EDILSON BRASIL SOARES, 1599;EDSON QUEIROZ;
2024;1;FORTALEZA;12100;MARA ESMERALDO;113;49;;1;COLÉGIO FARIAS BRITO;RUA SENADOR POMPEU, 2607;JOSÉ BONIFÁCIO;
2024;1;FORTALEZA;12100;MARA ESMERALDO;113;50;;1;COLÉGIO FARIAS BRITO;RUA SENADOR POMPEU, 2607;JOSÉ BONIFÁCIO;
2024;1;FORTALEZA;12100;MARA ESMERALDO;113;115;;1;COLÉGIO CHRISTUS BENFICA;RUA LUIS DE MIRANDA, 536;BENFICA;
2024;1;FORTALEZA;12100;MARA ESMERALDO;113;122;121;2;EEFM FREI LAURO SCHWARTE;RUA ANTÔNIO POMPEU, 2005;CENTRO;
2024;1;FORTALEZA;12100;MARA ESMERALDO;113;166;;1;ESC. PROFISSIONAL PE. JOÃO PIAMARTA;RUA PADRE JOÃO PIAMARTA, 161;BOM FUTURO;
2024;1;FORTALEZA;12100;MARA ESMERALDO;113;177;;1;COLÉGIO SÃO MATEUS;RUA JUSTINIANO DE SERPA, 748;FARIAS BRITO;
2024;1;FORTALEZA;12100;MARA ESMERALDO;113;210;;1;COLÉGIO DEOCLÉCIO FERRO;RUA MINERVINO DE CASTRO, 987;RODOLFO TEÓFILO;
2024;1;FORTALEZA;12100;MARA ESMERALDO;113;211;;1;COLÉGIO DEOCLÉCIO FERRO;RUA MINERVINO DE CASTRO, 987;RODOLFO TEÓFILO;
2024;1;FORTALEZA;12100;MARA ESMERALDO;113;212;;1;COLÉGIO DEOCLÉCIO FERRO;RUA MINERVINO DE CASTRO, 987;RODOLFO TEÓFILO;
2024;1;FORTALEZA;12100;MARA ESMERALDO;113;213;;1;COLÉGIO DEOCLÉCIO FERRO;RUA MINERVINO DE CASTRO, 987;RODOLFO TEÓFILO;
2024;1;FORTALEZA;12100;MARA ESMERALDO;113;214;;2;COLÉGIO DEOCLÉCIO FERRO;RUA MINERVINO DE CASTRO, 987;RODOLFO TEÓFILO;
2024;1;FORTALEZA;12100;MARA ESMERALDO;113;215;;5;COLÉGIO DEOCLÉCIO FERRO;RUA MINERVINO DE CASTRO, 987;RODOLFO TEÓFILO;
2024;1;FORTALEZA;12100;MARA ESMERALDO;113;216;;4;COLÉGIO DEOCLÉCIO FERRO;RUA MINERVINO DE CASTRO, 987;RODOLFO TEÓFILO;
2024;1;FORTALEZA;12100;MARA ESMERALDO;113;217;;1;COLÉGIO MANUELITO AZEVEDO;RUA TIRADENTES, 483;RODOLFO TEÓFILO;
2024;1;FORTALEZA;12100;MARA ESMERALDO;113;220;;1;COLÉGIO MANUELITO AZEVEDO;RUA TIRADENTES, 483;RODOLFO TEÓFILO;
2024;1;FORTALEZA;12100;MARA ESMERALDO;113;221;;1;COLÉGIO MANUELITO AZEVEDO;RUA TIRADENTES, 483;RODOLFO TEÓFILO;
2024;1;FORTALEZA;12100;MARA ESMERALDO;113;222;;1;COLÉGIO MANUELITO AZEVEDO;RUA TIRADENTES, 483;RODOLFO TEÓFILO;
2024;1;FORTALEZA;12100;MARA ESMERALDO;113;226;;1;COLÉGIO MANUELITO AZEVEDO;RUA TIRADENTES, 483;RODOLFO TEÓFILO;
2024;1;FORTALEZA;12100;MARA ESMERALDO;113;237;;1;EEFM ANTONIO SALES - PARQUELÂNDIA;RUA PROF. ANACLETO, 630;PARQUELÂNDIA;
2024;1;FORTALEZA;12100;MARA ESMERALDO;113;240;;1;EEFM ANTONIO SALES - PARQUELÂNDIA;RUA PROF. ANACLETO, 630;PARQUELÂNDIA;
2024;1;FORTALEZA;12100;MARA ESMERALDO;113;251;;1;EEFM SANTO AFONSO;RUA GAL. BERNARDO FIGUEIREDO, 2670;PARQUELÂNDIA;
2024;1;FORTALEZA;12100;MARA ESMERALDO;113;263;;1;EEF MONSENHOR LINHARES;RUA PROF. LINO ENCARNAÇÃO, 1130;AMADEU FURTADO;
2024;1;FORTALEZA;12100;MARA ESMERALDO;113;276;;4;COLÉGIO DEOCLÉCIO FERRO;RUA MINERVINO DE CASTRO, 987;RODOLFO TEÓFILO;
2024;1;FORTALEZA;12100;MARA ESMERALDO;113;293;;3;COLÉGIO DEOCLÉCIO FERRO;RUA MINERVINO DE CASTRO, 987;RODOLFO TEÓFILO;
2024;1;FORTALEZA;12100;MARA ESMERALDO;113;313;;1;ESC. PROFISSIONAL PE. JOÃO PIAMARTA;RUA PADRE JOÃO PIAMARTA, 161;BOM FUTURO;
2024;1;FORTALEZA;12100;MARA ESMERALDO;113;346;;1;ESCOLA ESTADUAL DE EDUCAÇÃO PROFISSIONAL JOAQUIM NOGUEIRA;RUA MOREIRA DE SOUSA, 327;PARQUELÂNDIA;
2024;1;FORTALEZA;12100;MARA ESMERALDO;113;349;;1;SECRETARIA EXECUTIVA REGIONAL III - FORTALEZA;AV JOVITA FEITOSA 3090;PARQUELÂNDIA;
2024;1;FORTALEZA;12100;MARA ESMERALDO;114;39;;1;EM FRANCISCO SILVA CAVALCANTE;RUA CONSELHEIRO LAFAYETTE 205;FLORESTA;
2024;1;FORTALEZA;12100;MARA ESMERALDO;114;205;;2;EM DOM HELDER CAMARA;RUA FREI ODILON 623 B;ÁLVARO WEYNE;
2024;1;FORTALEZA;12100;MARA ESMERALDO;114;270;;1;EEEP PAULO PETROLA;RUA SAUDÁRIA, S/N - GOIABEIRAS;BARRA DO CEARÁ;
2024;1;FORTALEZA;12100;MARA ESMERALDO;114;283;;1;EEEP PAULO PETROLA;RUA SAUDÁRIA, S/N - GOIABEIRAS;BARRA DO CEARÁ;
2024;1;FORTALEZA;12100;MARA ESMERALDO;114;299;;1;EM DOM HELDER CAMARA;RUA FREI ODILON 623 B;ÁLVARO WEYNE;
2024;1;FORTALEZA;12100;MARA ESMERALDO;115;31;;1;EM THOMAZ POMPEU SOBRINHO;RUA JOSE MENELEU, 531;PARANGABA;
2024;1;FORTALEZA;12100;MARA ESMERALDO;115;32;;1;EM THOMAZ POMPEU SOBRINHO;RUA JOSE MENELEU, 531;PARANGABA;
2024;1;FORTALEZA;12100;MARA ESMERALDO;115;33;;1;EM THOMAZ POMPEU SOBRINHO;RUA JOSE MENELEU, 531;PARANGABA;
2024;1;FORTALEZA;12100;MARA ESMERALDO;115;34;;1;EM THOMAZ POMPEU SOBRINHO;RUA JOSE MENELEU, 531;PARANGABA;
2024;1;FORTALEZA;12100;MARA ESMERALDO;115;41;;1;UNIVERSIDADE ESTADUAL DO CEARA - UECE;AV DR. SILAS MUNGUBA, 1700;ITAPERI;
2024;1;FORTALEZA;12100;MARA ESMERALDO;115;42;;1;UNIVERSIDADE ESTADUAL DO CEARA - UECE;AV DR. SILAS MUNGUBA, 1700;ITAPERI;
2024;1;FORTALEZA;12100;MARA ESMERALDO;115;303;;1;UNIVERSIDADE ESTADUAL DO CEARA - UECE;AV DR. SILAS MUNGUBA, 1700;ITAPERI;
2024;1;FORTALEZA;12100;MARA ESMERALDO;115;334;;1;SESI - PARANGABA;AVENIDA JOÃO PESSOA, 6754;PARANGABA;
2024;1;FORTALEZA;12100;MARA ESMERALDO;115;412;;1;COLEGIO GURI  SENIOR;RUA CONEGO DE CASTRO 1780;PARANGABA;
2024;1;FORTALEZA;12100;MARA ESMERALDO;115;427;;1;CENTRO DE EDUCAÇÃO PEDAGÓGICO EÇA DE QUEIROZ;RUA DOM XISTO ALBANO 611;VILA PERI;
2024;1;FORTALEZA;12100;MARA ESMERALDO;116;191;;1;EM PROF LIREDA FACO;RUA TRES CORACOES 735;GRANJA LISBOA;
2024;1;FORTALEZA;12100;MARA ESMERALDO;116;195;;1;EM PROF LIREDA FACO;RUA TRES CORACOES 735;GRANJA LISBOA;
2024;1;FORTALEZA;12100;MARA ESMERALDO;116;472;;1;EM RACHEL VIANA MARTINS;RUA TUCUNDUBA 2703;GRANJA LISBOA;
2024;1;FORTALEZA;12100;MARA ESMERALDO;116;496;;1;EM FRANCISCO EDMILSON PINHEIRO;AVENIDA H, 2115, 4A ETAPA;CONJUNTO CEARÁ II;
2024;1;FORTALEZA;12100;MARA ESMERALDO;117;149;;1;CUCA MONDUBIM;RUA PROFESSOR GLAUCO LOBO S/N;NOVO MONDUBIM;
2024;1;FORTALEZA;12100;MARA ESMERALDO;117;162;;1;EEF JOSE AYRTON TEIXEIRA;RUA ALFREDO MAMEDE SN;MANOEL SÁTIRO;
2024;1;FORTALEZA;12100;MARA ESMERALDO;117;182;;1;EEFM IRAPUAN CAVALCANTE PINHEIRO;AV E 305;CONJUNTO ESPERANÇA;
2024;1;FORTALEZA;12100;MARA ESMERALDO;117;200;484;1;EMTI PROFESSORA MARIA JOSÉ FERREIRA GOMES;RUA CÔNEGO DE CASTRO, 8617;PARQUE PRESIDENTE VARGAS;
