Ano;Turno;Município;Número;Candidato;Zona;Seção;Seções Agregadas;Votos;Local de Votação;Endereço Local de Votação;Bairro;
2024;1;FORTALEZA;70040;NARCELIO PATO;1;362;;1;EMTI VEREADOR ALBERTO GOMES DE QUEIROZ;AV. ZEZÉ DIOGO, 782;CAIS DO PORTO;
2024;1;FORTALEZA;70040;NARCELIO PATO;1;578;;1;EMTI VEREADOR ALBERTO GOMES DE QUEIROZ;AV. ZEZÉ DIOGO, 782;CAIS DO PORTO;
2024;1;FORTALEZA;70040;NARCELIO PATO;1;806;;1;EMTI VEREADOR ALBERTO GOMES DE QUEIROZ;AV. ZEZÉ DIOGO, 782;CAIS DO PORTO;
2024;1;FORTALEZA;70040;NARCELIO PATO;3;111;;1;COLÉGIO ESTADUAL LICEU DO CEARÁ;PRAÇA GUSTAVO BARROSO, 01;JACARECANGA;
2024;1;FORTALEZA;70040;NARCELIO PATO;3;113;;1;COLÉGIO ESTADUAL LICEU DO CEARÁ;PRAÇA GUSTAVO BARROSO, 01;JACARECANGA;
2024;1;FORTALEZA;70040;NARCELIO PATO;3;116;26;1;SENAI - UNIDADE JACARECANGA;AV. PADRE IBIAPINA, 1280;JACARECANGA;
2024;1;FORTALEZA;70040;NARCELIO PATO;3;117;27;1;SENAI - UNIDADE JACARECANGA;AV. PADRE IBIAPINA, 1280;JACARECANGA;
2024;1;FORTALEZA;70040;NARCELIO PATO;3;119;170;1;SENAI - UNIDADE JACARECANGA;AV. PADRE IBIAPINA, 1280;JACARECANGA;
2024;1;FORTALEZA;70040;NARCELIO PATO;3;122;;1;COLÉGIO ESTADUAL LICEU DO CEARÁ;PRAÇA GUSTAVO BARROSO, 01;JACARECANGA;
2024;1;FORTALEZA;70040;NARCELIO PATO;3;279;;1;EM SÃO RAFAEL;RUA DOS TABAJARAS, 244;PRAIA DE IRACEMA;
2024;1;FORTALEZA;70040;NARCELIO PATO;3;283;;1;EM SÃO RAFAEL;RUA DOS TABAJARAS, 244;PRAIA DE IRACEMA;
2024;1;FORTALEZA;70040;NARCELIO PATO;3;289;294;1;COLÉGIO ESTADUAL JUSTINIANO DE SERPA;AV. SANTOS DUMONT, 56;CENTRO;
2024;1;FORTALEZA;70040;NARCELIO PATO;3;427;;1;FACULDADE ARI DE SÁ;AV. HERÁCLITO GRAÇA, 826;CENTRO;
2024;1;FORTALEZA;70040;NARCELIO PATO;80;202;;1;UAPS CESAR CALS DE OLIVEIRA;RUA CAPITÃO ARAGÃO 555;ALTO DA BALANÇA;
2024;1;FORTALEZA;70040;NARCELIO PATO;80;279;;1;EEF GAL.  MANUEL CORDEIRO NETO;RUA JORGE ACURCIO, 900;VILA UNIÃO;
2024;1;FORTALEZA;70040;NARCELIO PATO;80;401;;1;COLÉGIO MAURO BEZERRA;RUA BRIGADEIRO VILELA, 221;AEROLÂNDIA;
2024;1;FORTALEZA;70040;NARCELIO PATO;82;57;;1;ESCOLA MUNICIPAL NOSSA SENHORA DO PERPÉTUO SOCORRO - EF;RUA CÔNSUL GOUVEIA, 57;ÁLVARO WEYNE;
2024;1;FORTALEZA;70040;NARCELIO PATO;82;58;;1;ESCOLA MUNICIPAL NOSSA SENHORA DO PERPÉTUO SOCORRO - EF;RUA CÔNSUL GOUVEIA, 57;ÁLVARO WEYNE;
2024;1;FORTALEZA;70040;NARCELIO PATO;82;60;;1;ESCOLA MUNICIPAL NOSSA SENHORA DO PERPÉTUO SOCORRO - EF;RUA CÔNSUL GOUVEIA, 57;ÁLVARO WEYNE;
2024;1;FORTALEZA;70040;NARCELIO PATO;82;61;;1;ESCOLA MUNICIPAL NOSSA SENHORA DO PERPÉTUO SOCORRO - EF;RUA CÔNSUL GOUVEIA, 57;ÁLVARO WEYNE;
2024;1;FORTALEZA;70040;NARCELIO PATO;82;64;;2;COLÉGIO MENINO JESUS DE PRAGA;RUA ANA FACÓ, 140;CARLITO PAMPLONA;
2024;1;FORTALEZA;70040;NARCELIO PATO;82;65;;2;EMEIEF CRISTO REDENTOR;AV. PASTEUR, 372;CRISTO REDENTOR;
2024;1;FORTALEZA;70040;NARCELIO PATO;82;68;;1;COLÉGIO MANUEL DA SILVA - CARLITO PAMPLONA;AV. FRANCISCO SÁ, 4001;CARLITO PAMPLONA;
2024;1;FORTALEZA;70040;NARCELIO PATO;82;69;;1;COLÉGIO MANUEL DA SILVA - CARLITO PAMPLONA;AV. FRANCISCO SÁ, 4001;CARLITO PAMPLONA;
2024;1;FORTALEZA;70040;NARCELIO PATO;82;71;;2;COLÉGIO MANUEL DA SILVA - CARLITO PAMPLONA;AV. FRANCISCO SÁ, 4001;CARLITO PAMPLONA;
2024;1;FORTALEZA;70040;NARCELIO PATO;82;73;;1;COLÉGIO MANUEL DA SILVA - CARLITO PAMPLONA;AV. FRANCISCO SÁ, 4001;CARLITO PAMPLONA;
2024;1;FORTALEZA;70040;NARCELIO PATO;82;75;;2;COLÉGIO MARIA ALICE;AV. PASTEUR, 700;CARLITO PAMPLONA;
2024;1;FORTALEZA;70040;NARCELIO PATO;82;76;702;2;COLÉGIO MARIA ALICE;AV. PASTEUR, 700;CARLITO PAMPLONA;
2024;1;FORTALEZA;70040;NARCELIO PATO;82;86;;2;ESCOLA MUNICIPAL SEBASTIANA ALDIGUERI;AV. DOUTOR THEBERGE, 448;CRISTO REDENTOR;
2024;1;FORTALEZA;70040;NARCELIO PATO;82;90;;3;ESCOLA MUNICIPAL TERTULIANO CAMBRAIA - EI/EF;RUA MONSENHOR ROSA, 946;CARLITO PAMPLONA;
2024;1;FORTALEZA;70040;NARCELIO PATO;82;110;;1;CEJA  MONSENHOR HÉLIO CAMPOS;AV. MONSENHOR HÉLIO CAMPOS, 251;CRISTO REDENTOR;
2024;1;FORTALEZA;70040;NARCELIO PATO;82;119;;1;CENTRO DE CIDADANIA GOV. VIRGÍLIO TÁVORA - CCDH;AV. MONSENHOR HELIO CAMPOS, 178;CRISTO REDENTOR;
2024;1;FORTALEZA;70040;NARCELIO PATO;82;124;;1;EEFM SALES CAMPOS;RUA JACINTO MATOS, 730;JACARECANGA;
2024;1;FORTALEZA;70040;NARCELIO PATO;82;125;;1;EEFM SALES CAMPOS;RUA JACINTO MATOS, 730;JACARECANGA;
2024;1;FORTALEZA;70040;NARCELIO PATO;82;127;;3;EEFM SALES CAMPOS;RUA JACINTO MATOS, 730;JACARECANGA;
2024;1;FORTALEZA;70040;NARCELIO PATO;82;128;;1;EEFM SALES CAMPOS;RUA JACINTO MATOS, 730;JACARECANGA;
2024;1;FORTALEZA;70040;NARCELIO PATO;82;180;;1;EEFM CLÁUDIO MARTINS;RUA DEMÓCRITO ROCHA, 400;MONTE CASTELO;
2024;1;FORTALEZA;70040;NARCELIO PATO;82;186;;1;ESCOLA MUNICIPAL LENIRA JUREMA DE MAGALHÃES - EI/EF;RUA TEÓFILO GURGEL, 111;MONTE CASTELO;
2024;1;FORTALEZA;70040;NARCELIO PATO;82;187;;1;ESCOLA MUNICIPAL LENIRA JUREMA DE MAGALHÃES - EI/EF;RUA TEÓFILO GURGEL, 111;MONTE CASTELO;
2024;1;FORTALEZA;70040;NARCELIO PATO;82;200;;1;ESCOLA MUNICIPAL FAUSTINO DE ALBUQUERQUE - EI/EF;RUA AMARO CAVALCANTE, 221;MONTE CASTELO;
2024;1;FORTALEZA;70040;NARCELIO PATO;82;206;;1;ESCOLA MUNICIPAL PROFESSOR MARTINZ DE AGUIAR - EI/EF;RUA BERNARDO PORTO, 490;MONTE CASTELO;
2024;1;FORTALEZA;70040;NARCELIO PATO;82;207;;1;ESCOLA MUNICIPAL PROFESSOR MARTINZ DE AGUIAR - EI/EF;RUA BERNARDO PORTO, 490;MONTE CASTELO;
2024;1;FORTALEZA;70040;NARCELIO PATO;82;211;;1;COLÉGIO PROF. F. EURÍDICE;RUA NATURALISTA FEIJÓ, 736;MONTE CASTELO;
2024;1;FORTALEZA;70040;NARCELIO PATO;82;226;;2;CENTRO EDUCACIONAL MOEMA TÁVORA;RUA MARCÍLIO DIAS, 485;PIRAMBU;
2024;1;FORTALEZA;70040;NARCELIO PATO;82;228;;2;ESCOLA MUNICIPAL TERTULIANO CAMBRAIA - EI/EF;RUA MONSENHOR ROSA, 946;CARLITO PAMPLONA;
2024;1;FORTALEZA;70040;NARCELIO PATO;82;229;;2;ESCOLA MUNICIPAL TERTULIANO CAMBRAIA - EI/EF;RUA MONSENHOR ROSA, 946;CARLITO PAMPLONA;
2024;1;FORTALEZA;70040;NARCELIO PATO;82;231;;1;COLÉGIO UNIVERSO MENINO JESUS;RUA DOM QUINTINO, 934;JACARECANGA;
2024;1;FORTALEZA;70040;NARCELIO PATO;82;232;;1;EEFM GOVERNADOR FLÁVIO MARCÍLIO;AV. PASTEUR, 575;PIRAMBU;
2024;1;FORTALEZA;70040;NARCELIO PATO;82;237;;2;CENTRO EDUCACIONAL DOM HÉLIO CAMPOS;RUA SÃO RAIMUNDO, 199;PIRAMBU;
2024;1;FORTALEZA;70040;NARCELIO PATO;82;238;;1;CENTRO EDUCACIONAL DOM HÉLIO CAMPOS;RUA SÃO RAIMUNDO, 199;PIRAMBU;
2024;1;FORTALEZA;70040;NARCELIO PATO;82;239;;1;EEFM GOVERNADOR FLÁVIO MARCÍLIO;AV. PASTEUR, 575;PIRAMBU;
2024;1;FORTALEZA;70040;NARCELIO PATO;82;245;;1;ESCOLA MUNICIPAL HILBERTO SILVA - EI/EF;AV. PRESIDENTE CASTELO BRANCO, 2973;PIRAMBU;
2024;1;FORTALEZA;70040;NARCELIO PATO;82;253;;2;CENTRO EDUCACIONAL DOM HÉLIO CAMPOS;RUA SÃO RAIMUNDO, 199;PIRAMBU;
2024;1;FORTALEZA;70040;NARCELIO PATO;82;369;;1;COLÉGIO MASTER - BEZERRA DE MENEZES;AV. BEZERRA DE MENEZES, 1802;SÃO GERARDO;
2024;1;FORTALEZA;70040;NARCELIO PATO;82;372;;1;EMEIEF HONÓRIO BEZERRA;RUA CAPITÃO NESTOR GÓIS, 400;ELLERY;
2024;1;FORTALEZA;70040;NARCELIO PATO;82;374;;1;EMEIEF HONÓRIO BEZERRA;RUA CAPITÃO NESTOR GÓIS, 400;ELLERY;
2024;1;FORTALEZA;70040;NARCELIO PATO;82;388;;1;CEJA  MONSENHOR HÉLIO CAMPOS;AV. MONSENHOR HÉLIO CAMPOS, 251;CRISTO REDENTOR;
2024;1;FORTALEZA;70040;NARCELIO PATO;82;389;;1;EEFM GOVERNADOR FLÁVIO MARCÍLIO;AV. PASTEUR, 575;PIRAMBU;
2024;1;FORTALEZA;70040;NARCELIO PATO;82;409;;1;CENTRO EDUCACIONAL SÃO MATEUS;AV. SARGENTO HERMÍNIO SAMPAIO, 2440;MONTE CASTELO;
2024;1;FORTALEZA;70040;NARCELIO PATO;82;410;;1;COLÉGIO MANUEL DA SILVA - CARLITO PAMPLONA;AV. FRANCISCO SÁ, 4001;CARLITO PAMPLONA;
2024;1;FORTALEZA;70040;NARCELIO PATO;82;416;;1;ESCOLA MUNICIPAL TERTULIANO CAMBRAIA - EI/EF;RUA MONSENHOR ROSA, 946;CARLITO PAMPLONA;
2024;1;FORTALEZA;70040;NARCELIO PATO;82;427;;1;ESCOLA MUNICIPAL LENIRA JUREMA DE MAGALHÃES - EI/EF;RUA TEÓFILO GURGEL, 111;MONTE CASTELO;
2024;1;FORTALEZA;70040;NARCELIO PATO;82;436;;1;INSTITUTO MATER AMABILIS;RUA PADRE ANCHIETA, 438;MONTE CASTELO;
2024;1;FORTALEZA;70040;NARCELIO PATO;82;462;;1;ESCOLA MUNICIPAL PROFESSOR MARTINZ DE AGUIAR - EI/EF;RUA BERNARDO PORTO, 490;MONTE CASTELO;
2024;1;FORTALEZA;70040;NARCELIO PATO;82;467;;2;ESCOLA MUNICIPAL PATATIVA DO ASSARÉ - EI/EF;RUA IRINEU DE SOUZA, 197;ÁLVARO WEYNE;
2024;1;FORTALEZA;70040;NARCELIO PATO;82;472;;1;EEFM SALES CAMPOS;RUA JACINTO MATOS, 730;JACARECANGA;
2024;1;FORTALEZA;70040;NARCELIO PATO;82;492;;1;POSTO DE SAÚDE GUIOMAR ARRUDA;RUA COSTA MATOS, 6;PIRAMBU;
2024;1;FORTALEZA;70040;NARCELIO PATO;82;549;;1;CENTRO EDUCACIONAL DOM HÉLIO CAMPOS;RUA SÃO RAIMUNDO, 199;PIRAMBU;
2024;1;FORTALEZA;70040;NARCELIO PATO;82;567;;1;ESCOLA MUNICIPAL PATATIVA DO ASSARÉ - EI/EF;RUA IRINEU DE SOUZA, 197;ÁLVARO WEYNE;
2024;1;FORTALEZA;70040;NARCELIO PATO;82;571;;1;CEJA  MONSENHOR HÉLIO CAMPOS;AV. MONSENHOR HÉLIO CAMPOS, 251;CRISTO REDENTOR;
2024;1;FORTALEZA;70040;NARCELIO PATO;82;607;;1;POSTO DE SAÚDE GUIOMAR ARRUDA;RUA COSTA MATOS, 6;PIRAMBU;
2024;1;FORTALEZA;70040;NARCELIO PATO;82;609;;1;EMEIEF CRISTO REDENTOR;AV. PASTEUR, 372;CRISTO REDENTOR;
2024;1;FORTALEZA;70040;NARCELIO PATO;82;613;;4;ESCOLA MUNICIPAL PATATIVA DO ASSARÉ - EI/EF;RUA IRINEU DE SOUZA, 197;ÁLVARO WEYNE;
2024;1;FORTALEZA;70040;NARCELIO PATO;82;617;;1;EMEIEF CRISTO REDENTOR;AV. PASTEUR, 372;CRISTO REDENTOR;
2024;1;FORTALEZA;70040;NARCELIO PATO;82;618;;2;POSTO DE SAÚDE CARLOS RIBEIRO;RUA JACINTO MATOS, 944;JACARECANGA;
2024;1;FORTALEZA;70040;NARCELIO PATO;82;624;;1;ESCOLA MUNICIPAL TERTULIANO CAMBRAIA - EI/EF;RUA MONSENHOR ROSA, 946;CARLITO PAMPLONA;
2024;1;FORTALEZA;70040;NARCELIO PATO;82;630;;1;EMEIEF VIRGÍLIO TÁVORA;AV. MONSENHOR HÉLIO CAMPOS, 144;CRISTO REDENTOR;
2024;1;FORTALEZA;70040;NARCELIO PATO;82;633;;1;EMEIEF CRISTO REDENTOR;AV. PASTEUR, 372;CRISTO REDENTOR;
2024;1;FORTALEZA;70040;NARCELIO PATO;82;642;;1;COLÉGIO PROF. F. EURÍDICE;RUA NATURALISTA FEIJÓ, 736;MONTE CASTELO;
2024;1;FORTALEZA;70040;NARCELIO PATO;82;648;;1;ESCOLA MUNICIPAL PATATIVA DO ASSARÉ - EI/EF;RUA IRINEU DE SOUZA, 197;ÁLVARO WEYNE;
2024;1;FORTALEZA;70040;NARCELIO PATO;82;652;;1;EMEIEF SÃO CURA D'ARS;RUA SANTA ELISA, 722;CRISTO REDENTOR;
2024;1;FORTALEZA;70040;NARCELIO PATO;82;653;;1;ESCOLA MUNICIPAL SEBASTIANA ALDIGUERI;AV. DOUTOR THEBERGE, 448;CRISTO REDENTOR;
2024;1;FORTALEZA;70040;NARCELIO PATO;82;654;;2;COLÉGIO MANUEL DA SILVA - CARLITO PAMPLONA;AV. FRANCISCO SÁ, 4001;CARLITO PAMPLONA;
2024;1;FORTALEZA;70040;NARCELIO PATO;82;658;;1;ESCOLA MUNICIPAL PROFESSOR MARTINZ DE AGUIAR - EI/EF;RUA BERNARDO PORTO, 490;MONTE CASTELO;
2024;1;FORTALEZA;70040;NARCELIO PATO;82;660;;1;ESCOLA MUNICIPAL TERTULIANO CAMBRAIA - EI/EF;RUA MONSENHOR ROSA, 946;CARLITO PAMPLONA;
2024;1;FORTALEZA;70040;NARCELIO PATO;82;681;;1;EEFM JOSÉ VALDO RIBEIRO RAMOS - EEMTI;RUA PEDRO AMÉRICO, 100;CARLITO PAMPLONA;
2024;1;FORTALEZA;70040;NARCELIO PATO;82;695;;2;ESCOLA MUNICIPAL LENIRA JUREMA DE MAGALHÃES - EI/EF;RUA TEÓFILO GURGEL, 111;MONTE CASTELO;
2024;1;FORTALEZA;70040;NARCELIO PATO;82;698;;1;EMEIEF SÃO CURA D'ARS;RUA SANTA ELISA, 722;CRISTO REDENTOR;
2024;1;FORTALEZA;70040;NARCELIO PATO;82;701;;1;COLÉGIO MANUEL DA SILVA - CARLITO PAMPLONA;AV. FRANCISCO SÁ, 4001;CARLITO PAMPLONA;
2024;1;FORTALEZA;70040;NARCELIO PATO;83;20;;1;ESCOLA MUNICIPAL DOM JOSÉ TUPINAMBA DA FROTA;RUA VIRIATO RIBEIRO 1031;BELA VISTA;
2024;1;FORTALEZA;70040;NARCELIO PATO;83;130;;1;ESCOLA MUNICIPAL PRESIDENTE KENNEDY;AV. LINEU MACHADO 811;JÓQUEI CLUBE;
2024;1;FORTALEZA;70040;NARCELIO PATO;83;156;;1;CENTRO DE FORMAÇÃO E DESENV. PARA PROFISSIONAIS DA EDUCAÇÃO - FORMACE;RUA PORTO VELHO, 401;JOÃO XXIII;
2024;1;FORTALEZA;70040;NARCELIO PATO;83;287;;1;COLÉGIO ELITE;AVENIDA JOÃO PESSOA, 6302;MONTESE;
2024;1;FORTALEZA;70040;NARCELIO PATO;83;438;;1;ESCOLA MUNICIPAL DE TEMPO INTEGRAL PROFESSOR JOSE JULIO DA PONTE;RUA MARIO DE ANDRADE, S/N;BELA VISTA;
2024;1;FORTALEZA;70040;NARCELIO PATO;83;492;;1;ESCOLA MUNICIPAL DOM JOSÉ TUPINAMBA DA FROTA;RUA VIRIATO RIBEIRO 1031;BELA VISTA;
2024;1;FORTALEZA;70040;NARCELIO PATO;85;112;;1;CEJA ADELINO DE ALCANTARA FILHO - UV-6;RUA SEISCENTOS E DOZE, 100, 1A ETAPA;CONJUNTO CEARÁ I;
2024;1;FORTALEZA;70040;NARCELIO PATO;85;123;;1;CCDH - CENTRO DE CIDADANIA E DIREITOS HUMANOS (ANTIGO LUCIO ALCANTARA);AV. ALANIS MARIA LAURINDO DE OLIVEIRA, 461, 1A ETAPA;CONJUNTO CEARÁ I;
2024;1;FORTALEZA;70040;NARCELIO PATO;85;185;;1;EEFM JOSE LEOPOLDINO DA SILVA FILHO - UV4;RUA QUATROCENTOS E QUARENTA E OITO, 1, 2A ETAPA;CONJUNTO CEARÁ I;
2024;1;FORTALEZA;70040;NARCELIO PATO;85;386;;1;EMEIF IRMÃ MARIA EVANETE;AV D, 1015 2 ETAPA;CONJUNTO CEARÁ I;
2024;1;FORTALEZA;70040;NARCELIO PATO;85;390;;1;EEFM PROF. EDMILSON GUIMARAES DE ALMEIDA UV 10;RUA 1074 S/N (PROX. HOSPITAL), 4 ETAPA;CONJUNTO CEARÁ I;
2024;1;FORTALEZA;70040;NARCELIO PATO;94;199;;1;EEFM DONA HILZA DIOGO DE OLIVEIRA;AV. DOM ALOÍSIO LORSCHEIDER, 1040 - VILA VELHA;VILA VELHA;
2024;1;FORTALEZA;70040;NARCELIO PATO;94;386;;1;EMEF QUINTINO CUNHA;RUA MARIA CLARA 1263;VILA VELHA;
2024;1;FORTALEZA;70040;NARCELIO PATO;94;430;;1;EM CASTELO DE CASTRO;RUA 43 1531;VILA VELHA;
2024;1;FORTALEZA;70040;NARCELIO PATO;94;780;;1;EMTI DEPUTADO ROBERTO MESQUITA;R. BETA,  SN;VILA VELHA;
2024;1;FORTALEZA;70040;NARCELIO PATO;94;786;;1;IGREJA DE SÃO JOSÉ;R. GEN. ALÍPIO DOS SANTOS, 375;QUINTINO CUNHA;
2024;1;FORTALEZA;70040;NARCELIO PATO;94;821;;1;EMEIF HERONDINA LIMA CAVALCANTE;AV. AMBIENTALISTA ARY THIERS, 310;VILA VELHA;
2024;1;FORTALEZA;70040;NARCELIO PATO;94;871;;1;EEFM HERMINIO BARROSO;RUA PADRE GUILHERME 800;PADRE ANDRADE;
2024;1;FORTALEZA;70040;NARCELIO PATO;94;936;;1;EMEIF FRANCISCO EDILSON PINHEIRO;RUA N, 35;VILA VELHA;
2024;1;FORTALEZA;70040;NARCELIO PATO;95;219;;1;EMEIEF BARBARA DE ALENCAR;RUA CAPITAO PORFIRIO, 544;PARQUE SANTA MARIA;
2024;1;FORTALEZA;70040;NARCELIO PATO;112;145;;1;EEFM D. LUIZA TÁVORA - PRÓ MORAR;RUA FREI CANECA, 379;JARDIM DAS OLIVEIRAS;
2024;1;FORTALEZA;70040;NARCELIO PATO;112;565;;1;COLÉGIO DÁULIA BRINGEL;RUA TRAJANO ALVES DE AGUIAR, 55;CIDADE DOS FUNCIONÁRIOS;
2024;1;FORTALEZA;70040;NARCELIO PATO;113;162;;1;EMEIF MOZART PINTO;RUA JORGE DUMMAR, 2078;JARDIM AMÉRICA;
2024;1;FORTALEZA;70040;NARCELIO PATO;113;179;;1;COLÉGIO SÃO MATEUS;RUA JUSTINIANO DE SERPA, 748;FARIAS BRITO;
2024;1;FORTALEZA;70040;NARCELIO PATO;113;219;;1;COLÉGIO MANUELITO AZEVEDO;RUA TIRADENTES, 483;RODOLFO TEÓFILO;
2024;1;FORTALEZA;70040;NARCELIO PATO;113;353;;1;COLÉGIO AGNUS;RUA TEODORICO BARROSO, 827;MONTESE;
2024;1;FORTALEZA;70040;NARCELIO PATO;113;370;;1;COLÉGIO ESTADUAL PRESIDENTE HUMBERTO CASTELO BRANCO;RUA IRMA BAZET, 210;MONTESE;
2024;1;FORTALEZA;70040;NARCELIO PATO;113;386;;1;ASSOCIAÇÃO DE PAIS E AMIGOS DO DEFICIENTE AUDITIVO - APADA;AV. BEZERRA DE MENEZES, 549;SÃO GERARDO;
2024;1;FORTALEZA;70040;NARCELIO PATO;114;14;;1;EM JESUS CRISTO - CEI ANEXO;RUA ALBERTO FERREIRA 564;JARDIM IRACEMA;
2024;1;FORTALEZA;70040;NARCELIO PATO;114;51;;1;EM FRANCISCO DOMINGOS DA SILVA;AVENIDA PRESIDENTE CASTELO BRANCO 4707;BARRA DO CEARÁ;
2024;1;FORTALEZA;70040;NARCELIO PATO;114;52;;1;EM FRANCISCO DOMINGOS DA SILVA;AVENIDA PRESIDENTE CASTELO BRANCO 4707;BARRA DO CEARÁ;
2024;1;FORTALEZA;70040;NARCELIO PATO;114;66;;1;EM DOM HELDER CAMARA;RUA FREI ODILON 623 B;ÁLVARO WEYNE;
2024;1;FORTALEZA;70040;NARCELIO PATO;114;121;;1;EMTI NOSSA SENHORA DE FÁTIMA (ANTIGA APOSTÓLICA/SEMINÁRIO);RUA SÍLVIO ROMERO 370;ÁLVARO WEYNE;
2024;1;FORTALEZA;70040;NARCELIO PATO;114;127;;1;EEFM ESTADO DE ALAGOAS;AVENIDA PRESIDENTE CASTELO BRANCO, 5244;BARRA DO CEARÁ;
2024;1;FORTALEZA;70040;NARCELIO PATO;114;130;;1;EEFM ESTADO DE ALAGOAS;AVENIDA PRESIDENTE CASTELO BRANCO, 5244;BARRA DO CEARÁ;
2024;1;FORTALEZA;70040;NARCELIO PATO;114;173;;1;COLÉGIO MANUEL DA SILVA (ÁLVARO WEYNE);RUA SÃO BERNARDO 181;ÁLVARO WEYNE;
2024;1;FORTALEZA;70040;NARCELIO PATO;114;182;;1;EEMTI WALDEMAR FALCÃO;RUA ANTONIO JOAQUIM DE CARVALHO 19;ÁLVARO WEYNE;
2024;1;FORTALEZA;70040;NARCELIO PATO;114;219;;1;INSTITUTO EDUCACIONAL PRESIDENTE MEDICI;RUA CÉSAR CORREIA 973;FLORESTA;
2024;1;FORTALEZA;70040;NARCELIO PATO;114;220;;1;INSTITUTO EDUCACIONAL PRESIDENTE MEDICI;RUA CÉSAR CORREIA 973;FLORESTA;
2024;1;FORTALEZA;70040;NARCELIO PATO;114;222;;1;INSTITUTO EDUCACIONAL PRESIDENTE MEDICI;RUA CÉSAR CORREIA 973;FLORESTA;
2024;1;FORTALEZA;70040;NARCELIO PATO;114;224;;1;INSTITUTO EDUCACIONAL PRESIDENTE MEDICI;RUA CÉSAR CORREIA 973;FLORESTA;
2024;1;FORTALEZA;70040;NARCELIO PATO;114;230;;1;EM DOM ANTONIO BATISTA DE FRAGOSO;AVENIDA FRANCISCO SÁ 7945;BARRA DO CEARÁ;
2024;1;FORTALEZA;70040;NARCELIO PATO;114;245;;1;CENTRO DE EDUCAÇÃO COMPLEMENTAR (CEDCE) - ANTIGO SESI;AVENIDA FRANCISCO SÁ 6623;BARRA DO CEARÁ;
2024;1;FORTALEZA;70040;NARCELIO PATO;114;254;;1;EMTI PROFESSOR JOAQUIM FRANCISCO DE SOUSA FILHO;RUA JOAQUIM MARQUES, 13;PRESIDENTE KENNEDY;
2024;1;FORTALEZA;70040;NARCELIO PATO;114;269;;1;EM SÃO JOSÉ;AVENIDA DOUTOR THEBERGE 2288;PRESIDENTE KENNEDY;
2024;1;FORTALEZA;70040;NARCELIO PATO;114;293;;1;EMTI PROFESSOR JOAQUIM FRANCISCO DE SOUSA FILHO;RUA JOAQUIM MARQUES, 13;PRESIDENTE KENNEDY;
2024;1;FORTALEZA;70040;NARCELIO PATO;114;298;;1;COLÉGIO MANUEL DA SILVA (ÁLVARO WEYNE);RUA SÃO BERNARDO 181;ÁLVARO WEYNE;
2024;1;FORTALEZA;70040;NARCELIO PATO;114;301;;1;EM AGOSTINHO MOREIRA E SILVA;RUA PERI, 20;BARRA DO CEARÁ;
2024;1;FORTALEZA;70040;NARCELIO PATO;114;304;;1;EMTI ALDEMIR MARTINS;AV. FRANCISCO SÁ, 7460;BARRA DO CEARÁ;
2024;1;FORTALEZA;70040;NARCELIO PATO;114;335;;1;EM DOIS DE DEZEMBRO;RUA ARAKEN, 860;BARRA DO CEARÁ;
2024;1;FORTALEZA;70040;NARCELIO PATO;114;344;;1;CENTRO EDUCACIONAL ALFA;RUA CHICO XAVIER, 181;BARRA DO CEARÁ;
2024;1;FORTALEZA;70040;NARCELIO PATO;114;347;;1;EM DOIS DE DEZEMBRO;RUA ARAKEN, 860;BARRA DO CEARÁ;
2024;1;FORTALEZA;70040;NARCELIO PATO;114;351;;1;EM 11 DE AGOSTO (ALOJAMENTO PROVISÓRIO);RUA ERETIDES DE ALENCAR, S/N, EM FRENTE AO N. 1623;JARDIM IRACEMA;
2024;1;FORTALEZA;70040;NARCELIO PATO;114;357;;1;EM CASIMIRO JOSÉ LIMA FILHO;AVENIDA FRANCISCO SÁ 6449;BARRA DO CEARÁ;
2024;1;FORTALEZA;70040;NARCELIO PATO;115;45;;1;UNIVERSIDADE ESTADUAL DO CEARA - UECE;AV DR. SILAS MUNGUBA, 1700;ITAPERI;
2024;1;FORTALEZA;70040;NARCELIO PATO;115;105;;1;COLEGIO NOSSA SENHORA DO CARMO;RUA ELVIRA PINHO, 400;MONTESE;
2024;1;FORTALEZA;70040;NARCELIO PATO;115;108;;1;COLEGIO NOSSA SENHORA DO CARMO;RUA ELVIRA PINHO, 400;MONTESE;
2024;1;FORTALEZA;70040;NARCELIO PATO;115;295;;1;UNIVERSIDADE ESTADUAL DO CEARA - UECE;AV DR. SILAS MUNGUBA, 1700;ITAPERI;
2024;1;FORTALEZA;70040;NARCELIO PATO;115;337;;1;SESI - PARANGABA;AVENIDA JOÃO PESSOA, 6754;PARANGABA;
2024;1;FORTALEZA;70040;NARCELIO PATO;115;343;350, 361, 355;1;EEEP JOAQUIM MOREIRA DE SOUSA;RUA CAIO PRADO 02;PARANGABA;
2024;1;FORTALEZA;70040;NARCELIO PATO;115;402;;1;EEFM PROFESSOR MARIO SCHENBERG;RUA AMERICO ROCHA LIMA 835;MANOEL SÁTIRO;
2024;1;FORTALEZA;70040;NARCELIO PATO;115;425;;1;CENTRO DE EDUCAÇÃO PEDAGÓGICO EÇA DE QUEIROZ;RUA DOM XISTO ALBANO 611;VILA PERI;
2024;1;FORTALEZA;70040;NARCELIO PATO;116;403;;1;EM XV DE OUTUBRO - TEMPORÁRIO;RUA GUARANI, 2030;BONSUCESSO;
2024;1;FORTALEZA;70040;NARCELIO PATO;116;436;;1;CEI XV DE OUTUBRO;RUA MENINO JESUS DE PRAGA, 192;BONSUCESSO;
2024;1;FORTALEZA;70040;NARCELIO PATO;116;480;;1;EEF SAO JOSE DO PICI DAS PEDREIRAS;RUA MANUEL ANTONIO LEITE 250;BONSUCESSO;
2024;1;FORTALEZA;70040;NARCELIO PATO;117;191;;1;EEFM IRAPUAN CAVALCANTE PINHEIRO;AV E 305;CONJUNTO ESPERANÇA;
2024;1;FORTALEZA;70040;NARCELIO PATO;117;245;;1;EMEIF MARIA BEZERRA QUEVEDO;RUA 103, 28 - CJ. NOVO MONDUBIM;MANOEL SÁTIRO;
2024;1;FORTALEZA;70040;NARCELIO PATO;118;487;;1;EM DELMA HERMÍNIA DA SILVA PEREIRA;AVENIDA PRESIDENTE COSTA E SILVA, 5606;PASSARÉ;
2024;1;FORTALEZA;70040;NARCELIO PATO;118;618;;1;COLEGIO MARIA ESTER II;RUA F (CONJUNTO MIRASSOL), 158;PARQUE DOIS IRMÃOS;
2024;1;FORTALEZA;70040;NARCELIO PATO;118;638;;1;EM FRANCISCO ANDRADE TEOFILO GIRAO;RUA UNIDOS VENCEREMOS, 2040;PASSARÉ;
2024;1;FORTALEZA;70040;NARCELIO PATO;118;674;;1;EM PROFESSORA MARIA STELLA COCHRANE SANTIAGO;RUA ANTONIO FARIAS, 121;BOA VISTA-CASTELÃO;
TOTAL;;;;;;;;182;
