Ano;Turno;Município;Número;Candidato;Zona;Seção;Seções Agregadas;Votos;Local de Votação;Endereço Local de Votação;Bairro;
2024;1;FORTALEZA;44100;PASTORA ERLENIA;2;78;;1;EEEP COMENDADOR MIGUEL GURGEL;RUA JOSE BAIMA, S/N;GUAJERU;
2024;1;FORTALEZA;44100;PASTORA ERLENIA;2;79;;1;EEEP COMENDADOR MIGUEL GURGEL;RUA JOSE BAIMA, S/N;GUAJERU;
2024;1;FORTALEZA;44100;PASTORA ERLENIA;2;174;;1;PAROQUIA NOSSA SENHORA DA CONCEICAO;RUA JOAQUIM BEZERRA 255;MESSEJANA;
2024;1;FORTALEZA;44100;PASTORA ERLENIA;2;391;;1;EEFM IRACEMA;RUA EGIDIO DE OLIVEIRA, 250;JOSÉ DE ALENCAR;
2024;1;FORTALEZA;44100;PASTORA ERLENIA;2;777;;1;EM CÔNEGO FRANCISCO PEREIRA DA SILVA;RUA LUÍS FRANCISCO XAVIER, 256;PAUPINA;
2024;1;FORTALEZA;44100;PASTORA ERLENIA;3;264;263, 265;1;EEMTI VISCONDE DO RIO BRANCO;AV. DOM MANUEL, 1803;CENTRO;
2024;1;FORTALEZA;44100;PASTORA ERLENIA;3;502;;1;IDEAL CLUBE;AV. MONSENHOR TABOSA,  1381;MEIRELES;
2024;1;FORTALEZA;44100;PASTORA ERLENIA;80;149;;1;EEFM CEL PROF JOSÉ AURÉLIO CÂMARA;RUA JORGE ACURCIO, 655;VILA UNIÃO;
2024;1;FORTALEZA;44100;PASTORA ERLENIA;80;164;;1;AABB - ASSOCIAÇÃO ATLÉTICA BANCO DO BRASIL;AV BARAO DE STUDART, 2917;DIONISIO TORRES;
2024;1;FORTALEZA;44100;PASTORA ERLENIA;80;284;;1;EEF GAL.  MANUEL CORDEIRO NETO;RUA JORGE ACURCIO, 900;VILA UNIÃO;
2024;1;FORTALEZA;44100;PASTORA ERLENIA;80;287;;1;ESCOLA MUNICIPAL PAPA JOÃO XXIII;AV TREZE DE ABRIL, 545;VILA UNIÃO;
2024;1;FORTALEZA;44100;PASTORA ERLENIA;80;291;;1;ESCOLA MUNICIPAL PAPA JOÃO XXIII;AV TREZE DE ABRIL, 545;VILA UNIÃO;
2024;1;FORTALEZA;44100;PASTORA ERLENIA;80;356;;1;EMEIF ALMERINDA DE ALBUQUERQUE;RUA ANA GONCALVES 1105;TAUAPE;
2024;1;FORTALEZA;44100;PASTORA ERLENIA;82;671;;1;ESCOLA MUNICIPAL ANTONIO MENDES - EI/EF;RUA DONA MENDINA, 682;CRISTO REDENTOR;
2024;1;FORTALEZA;44100;PASTORA ERLENIA;83;63;;1;EEMTI SENADOR FERNANDES TÁVORA;RUA GOIÁS 141;BELA VISTA;
2024;1;FORTALEZA;44100;PASTORA ERLENIA;83;90;;1;EEM  MARIANO MARTINS;AVENIDA SENADOR FERNANDES TÁVORA 1445;HENRIQUE JORGE;
2024;1;FORTALEZA;44100;PASTORA ERLENIA;83;321;;1;ESCOLA MUNICIPAL JOSÉ BONIFÁCIO DE SOUSA;RUA PERNAMBUCO 600;DEMOCRITO ROCHA;
2024;1;FORTALEZA;44100;PASTORA ERLENIA;83;522;;1;CENTRO DE FORMAÇÃO E DESENV. PARA PROFISSIONAIS DA EDUCAÇÃO - FORMACE;RUA PORTO VELHO, 401;JOÃO XXIII;
2024;1;FORTALEZA;44100;PASTORA ERLENIA;83;700;;1;ESCOLA MUNICIPAL DONA DAGMAR GENTIL;RUA VITORIA 1750;HENRIQUE JORGE;
2024;1;FORTALEZA;44100;PASTORA ERLENIA;83;782;;1;ESCOLA MUNICIPAL ADROALDO TEIXEIRA CASTELO;RUA ALAGOAS 2267;PICI;
2024;1;FORTALEZA;44100;PASTORA ERLENIA;85;227;;1;EEM LICEU DO CONJUNTO CEARA;RUA 1139 A, 10 4 ETAPA;CONJUNTO CEARÁ I;
2024;1;FORTALEZA;44100;PASTORA ERLENIA;85;329;;1;EEFM DR UBIRAJARA INDIO DO CEARA - UV-7A;RUA SETECENTOS E CINQUENTA E UM, 192, 3A ETAPA;CONJUNTO CEARÁ I;
2024;1;FORTALEZA;44100;PASTORA ERLENIA;85;340;;1;ESCOLA MUNICIPAL DEP JOAO FREDERICO FERREIRA GOMES;RUA JOSE MENDONCA 1160;GENIBAÚ;
2024;1;FORTALEZA;44100;PASTORA ERLENIA;93;169;;1;EM JOAO HILDO DE CARVALHO FURTADO;RUA MIGUEL ARAGÃO, S/N ARACAPÉ;MONDUBIM;
2024;1;FORTALEZA;44100;PASTORA ERLENIA;93;186;;1;EM MARIA ZELIA CORREIA DE SOUSA;RUA ANTONIO PEREIRA,1495;PLANALTO AYRTON SENNA;
2024;1;FORTALEZA;44100;PASTORA ERLENIA;93;288;;1;CENTRO EDUCACIONAL BRAGA GUERRA;RUA D, N 414;MONDUBIM;
2024;1;FORTALEZA;44100;PASTORA ERLENIA;93;306;;1;CENTRO DE INCLUSÃO TECNOLÓGICA E SOCIAL - CITS JOSÉ WALTER;AV. K, 330, SEGUNDA ETAPA;PREFEITO JOSÉ WALTER;
2024;1;FORTALEZA;44100;PASTORA ERLENIA;94;760;;1;IGREJA SÃO PEDRO E SÃO PAULO;RUA PADRE TEODORO, 996;QUINTINO CUNHA;
2024;1;FORTALEZA;44100;PASTORA ERLENIA;95;168;;1;EEMTI POETA OTACILIO COLARES;RUA JORGE DA VEIGA, 265;PARQUE SANTA MARIA;
2024;1;FORTALEZA;44100;PASTORA ERLENIA;95;321;;1;EEFM ALMIRANTE TAMANDARÉ;RUA DO MANDACARU, 1048 CJ ALMIRANTE TAMANDARÉ;JANGURUSSU;
2024;1;FORTALEZA;44100;PASTORA ERLENIA;112;146;;1;EEFM D. LUIZA TÁVORA - PRÓ MORAR;RUA FREI CANECA, 379;JARDIM DAS OLIVEIRAS;
2024;1;FORTALEZA;44100;PASTORA ERLENIA;112;347;;1;EM PROF. LUIS COSTA;RUA JAIME LEONEL, 156;ENGENHEIRO LUCIANO CAVALCANTE;
2024;1;FORTALEZA;44100;PASTORA ERLENIA;113;352;;1;COLÉGIO AGNUS;RUA TEODORICO BARROSO, 827;MONTESE;
2024;1;FORTALEZA;44100;PASTORA ERLENIA;113;427;425, 428, 426;1;ESCOLA MUNICIPAL VICENTE FIALHO;RUA IRMA BAZET, 193;MONTESE;
2024;1;FORTALEZA;44100;PASTORA ERLENIA;114;172;;1;COLÉGIO MANUEL DA SILVA (ÁLVARO WEYNE);RUA SÃO BERNARDO 181;ÁLVARO WEYNE;
2024;1;FORTALEZA;44100;PASTORA ERLENIA;115;43;;1;UNIVERSIDADE ESTADUAL DO CEARA - UECE;AV DR. SILAS MUNGUBA, 1700;ITAPERI;
2024;1;FORTALEZA;44100;PASTORA ERLENIA;115;106;;1;COLEGIO NOSSA SENHORA DO CARMO;RUA ELVIRA PINHO, 400;MONTESE;
2024;1;FORTALEZA;44100;PASTORA ERLENIA;115;130;;1;COLEGIO PROVECTO;RUA SUIÇA, 76;MARAPONGA;
2024;1;FORTALEZA;44100;PASTORA ERLENIA;115;300;;1;ESCOLA MARISTA SAGRADO CORAÇÃO;RUA VIDAL DE NEGREIROS, 550;JARDIM CEARENSE;
2024;1;FORTALEZA;44100;PASTORA ERLENIA;115;370;;1;EM CATULO DA PAIXAO CEARENSE;RUA LEAO DO NORTE 300;VILA PERI;
2024;1;FORTALEZA;44100;PASTORA ERLENIA;115;428;;1;CENTRO DE EDUCAÇÃO PEDAGÓGICO EÇA DE QUEIROZ;RUA DOM XISTO ALBANO 611;VILA PERI;
2024;1;FORTALEZA;44100;PASTORA ERLENIA;115;430;;1;CENTRO DE EDUCAÇÃO PEDAGÓGICO EÇA DE QUEIROZ;RUA DOM XISTO ALBANO 611;VILA PERI;
2024;1;FORTALEZA;44100;PASTORA ERLENIA;115;436;;1;EM RAIMUNDO SOARES DE SOUSA;RUA COSTA FREIRE 550;VILA PERI;
2024;1;FORTALEZA;44100;PASTORA ERLENIA;115;450;;1;EM MARIA VIVIANE BENEVIDES GOUVEIA;RUA CREUZA ROQUE 247;MANOEL SÁTIRO;
2024;1;FORTALEZA;44100;PASTORA ERLENIA;115;460;;1;EM HENRIQUETA GALENO;RUA MAJOR MONTENEGRO 917;MANOEL SÁTIRO;
2024;1;FORTALEZA;44100;PASTORA ERLENIA;115;462;;1;EM HENRIQUETA GALENO;RUA MAJOR MONTENEGRO 917;MANOEL SÁTIRO;
2024;1;FORTALEZA;44100;PASTORA ERLENIA;115;464;;1;EM HENRIQUETA GALENO;RUA MAJOR MONTENEGRO 917;MANOEL SÁTIRO;
2024;1;FORTALEZA;44100;PASTORA ERLENIA;116;39;;1;EM PROF ANTONIA MARIA DE LIMA;RUA SARGENTO JOAO PINHEIRO 2601;GRANJA LISBOA;
2024;1;FORTALEZA;44100;PASTORA ERLENIA;116;44;;1;EM SANTOS DUMONT;RUA GERALDO BARBOSA 240;BOM JARDIM;
2024;1;FORTALEZA;44100;PASTORA ERLENIA;116;46;;1;EM SANTOS DUMONT;RUA GERALDO BARBOSA 240;BOM JARDIM;
2024;1;FORTALEZA;44100;PASTORA ERLENIA;116;50;;1;EM SANTOS DUMONT;RUA GERALDO BARBOSA 240;BOM JARDIM;
2024;1;FORTALEZA;44100;PASTORA ERLENIA;116;51;;1;EM SANTOS DUMONT;RUA GERALDO BARBOSA 240;BOM JARDIM;
2024;1;FORTALEZA;44100;PASTORA ERLENIA;116;63;;1;EM CRESCER E APRENDER;RUA EDSON MARTINS, 642;BOM JARDIM;
2024;1;FORTALEZA;44100;PASTORA ERLENIA;116;83;;1;EM CONCEICAO MOURAO;RUA DUAS NACOES 550;GRANJA PORTUGAL;
2024;1;FORTALEZA;44100;PASTORA ERLENIA;116;122;;1;EEFM PROF JOCIE CAMINHA DE MENEZES;RUA ITU 120;GRANJA PORTUGAL;
2024;1;FORTALEZA;44100;PASTORA ERLENIA;116;123;;1;EEFM PROF JOCIE CAMINHA DE MENEZES;RUA ITU 120;GRANJA PORTUGAL;
2024;1;FORTALEZA;44100;PASTORA ERLENIA;116;157;;1;EM SEBASTIAO DE ABREU;RUA GERALDO BARBOSA 1065;BOM JARDIM;
2024;1;FORTALEZA;44100;PASTORA ERLENIA;116;159;;1;EM SEBASTIAO DE ABREU;RUA GERALDO BARBOSA 1065;BOM JARDIM;
2024;1;FORTALEZA;44100;PASTORA ERLENIA;116;163;;1;EM SEBASTIAO DE ABREU;RUA GERALDO BARBOSA 1065;BOM JARDIM;
2024;1;FORTALEZA;44100;PASTORA ERLENIA;116;213;;1;PROJETO ABC BOM JARDIM;RUA TRES CORACOES 762;GRANJA LISBOA;
2024;1;FORTALEZA;44100;PASTORA ERLENIA;116;388;;2;EM FRANCISCA FERNANDES MAGALHAES;RUA OLIVEIRA SOBRINHO, 1031;BONSUCESSO;
2024;1;FORTALEZA;44100;PASTORA ERLENIA;116;401;;1;EM XV DE OUTUBRO - TEMPORÁRIO;RUA GUARANI, 2030;BONSUCESSO;
2024;1;FORTALEZA;44100;PASTORA ERLENIA;116;429;;1;EEF SAO JOSE DO PICI DAS PEDREIRAS;RUA MANUEL ANTONIO LEITE 250;BONSUCESSO;
2024;1;FORTALEZA;44100;PASTORA ERLENIA;116;430;;1;EEF SAO JOSE DO PICI DAS PEDREIRAS;RUA MANUEL ANTONIO LEITE 250;BONSUCESSO;
2024;1;FORTALEZA;44100;PASTORA ERLENIA;116;447;;1;EM XV DE OUTUBRO - TEMPORÁRIO;RUA GUARANI, 2030;BONSUCESSO;
2024;1;FORTALEZA;44100;PASTORA ERLENIA;116;448;;1;EM XV DE OUTUBRO - TEMPORÁRIO;RUA GUARANI, 2030;BONSUCESSO;
2024;1;FORTALEZA;44100;PASTORA ERLENIA;116;480;;2;EEF SAO JOSE DO PICI DAS PEDREIRAS;RUA MANUEL ANTONIO LEITE 250;BONSUCESSO;
2024;1;FORTALEZA;44100;PASTORA ERLENIA;116;489;;1;EM FRANCISCO EDMILSON PINHEIRO;AVENIDA H, 2115, 4A ETAPA;CONJUNTO CEARÁ II;
2024;1;FORTALEZA;44100;PASTORA ERLENIA;116;503;;1;EM FRANCISCO EDMILSON PINHEIRO;AVENIDA H, 2115, 4A ETAPA;CONJUNTO CEARÁ II;
2024;1;FORTALEZA;44100;PASTORA ERLENIA;117;154;;1;EEEP DARCY RIBEIRO;RUA CONEGO DE CASTRO, S/N;CONJUNTO ESPERANÇA;
2024;1;FORTALEZA;44100;PASTORA ERLENIA;117;163;;1;EEFM JULIA ALVES PESSOA;RUA SÃO FRANCISCO SN;BOM JARDIM;
2024;1;FORTALEZA;44100;PASTORA ERLENIA;117;172;;2;COLÉGIO LUMEN;RUA SÃO FRANCISCO DO JARDIM, 396;BOM JARDIM;
2024;1;FORTALEZA;44100;PASTORA ERLENIA;117;181;;1;COLÉGIO LUMEN;RUA SÃO FRANCISCO DO JARDIM, 396;BOM JARDIM;
2024;1;FORTALEZA;44100;PASTORA ERLENIA;117;196;;1;COLÉGIO CASTRO ALVES;RUA TULIPA NEGRA, 2319;PARQUE PRESIDENTE VARGAS;
2024;1;FORTALEZA;44100;PASTORA ERLENIA;117;198;;2;COLÉGIO CASTRO ALVES;RUA TULIPA NEGRA, 2319;PARQUE PRESIDENTE VARGAS;
2024;1;FORTALEZA;44100;PASTORA ERLENIA;117;199;;1;COLÉGIO CASTRO ALVES;RUA TULIPA NEGRA, 2319;PARQUE PRESIDENTE VARGAS;
2024;1;FORTALEZA;44100;PASTORA ERLENIA;117;200;484;1;EMTI PROFESSORA MARIA JOSÉ FERREIRA GOMES;RUA CÔNEGO DE CASTRO, 8617;PARQUE PRESIDENTE VARGAS;
2024;1;FORTALEZA;44100;PASTORA ERLENIA;117;201;;1;COLÉGIO CASTRO ALVES;RUA TULIPA NEGRA, 2319;PARQUE PRESIDENTE VARGAS;
2024;1;FORTALEZA;44100;PASTORA ERLENIA;117;202;;1;COLÉGIO CASTRO ALVES;RUA TULIPA NEGRA, 2319;PARQUE PRESIDENTE VARGAS;
2024;1;FORTALEZA;44100;PASTORA ERLENIA;117;212;;1;EEFM PROFA ADALGISA BONFIM SOARES;AV. DO CANAL, S/N, ESQUINA COM RUA 103 - CONJUNTO ESPERANÇA;CONJUNTO ESPERANÇA;
2024;1;FORTALEZA;44100;PASTORA ERLENIA;117;215;;1;EEFM PROFA ADALGISA BONFIM SOARES;AV. DO CANAL, S/N, ESQUINA COM RUA 103 - CONJUNTO ESPERANÇA;CONJUNTO ESPERANÇA;
2024;1;FORTALEZA;44100;PASTORA ERLENIA;117;216;;1;EEFM PROFA ADELIA BRASIL FEIJO;AV CONTORNO SUL, 1540;CONJUNTO ESPERANÇA;
2024;1;FORTALEZA;44100;PASTORA ERLENIA;117;220;;1;EEFM PROFA ADELIA BRASIL FEIJO;AV CONTORNO SUL, 1540;CONJUNTO ESPERANÇA;
2024;1;FORTALEZA;44100;PASTORA ERLENIA;117;221;;3;EEFM PROFA ADELIA BRASIL FEIJO;AV CONTORNO SUL, 1540;CONJUNTO ESPERANÇA;
2024;1;FORTALEZA;44100;PASTORA ERLENIA;117;222;;1;EEFM PROFA ADELIA BRASIL FEIJO;AV CONTORNO SUL, 1540;CONJUNTO ESPERANÇA;
2024;1;FORTALEZA;44100;PASTORA ERLENIA;117;230;;1;EEFM SENADOR OSIRES PONTES;RUA DIVINA 150;SIQUEIRA;
2024;1;FORTALEZA;44100;PASTORA ERLENIA;117;231;;1;EEFM SENADOR OSIRES PONTES;RUA DIVINA 150;SIQUEIRA;
2024;1;FORTALEZA;44100;PASTORA ERLENIA;117;250;;1;ESCOLA MUNICIPAL MARIETA GUEDES MARTINS;RUA JOSE GUEDES MARTINS 4701;PARQUE SANTA ROSA;
2024;1;FORTALEZA;44100;PASTORA ERLENIA;117;252;;1;EEEP DARCY RIBEIRO;RUA CONEGO DE CASTRO, S/N;CONJUNTO ESPERANÇA;
2024;1;FORTALEZA;44100;PASTORA ERLENIA;117;254;;7;EM PADRE ANTONIO MONTEIRO DA CRUZ;RUA DE PEDESTRE XIII, 25 - JARDIM FLUMINENSE II;CANINDEZINHO;
2024;1;FORTALEZA;44100;PASTORA ERLENIA;117;255;;3;EM PADRE ANTONIO MONTEIRO DA CRUZ;RUA DE PEDESTRE XIII, 25 - JARDIM FLUMINENSE II;CANINDEZINHO;
2024;1;FORTALEZA;44100;PASTORA ERLENIA;117;259;;1;CEI FRANCISCA DE ABREU LIMA;RUA C -  ESQUINA COM A RUA LUIZ MONTENEGRO, S/N;SIQUEIRA;
2024;1;FORTALEZA;44100;PASTORA ERLENIA;117;265;;1;CEI FRANCISCA DE ABREU LIMA;RUA C -  ESQUINA COM A RUA LUIZ MONTENEGRO, S/N;SIQUEIRA;
2024;1;FORTALEZA;44100;PASTORA ERLENIA;117;267;;1;EEEP DARCY RIBEIRO;RUA CONEGO DE CASTRO, S/N;CONJUNTO ESPERANÇA;
2024;1;FORTALEZA;44100;PASTORA ERLENIA;117;268;;5;EM PADRE ANTONIO MONTEIRO DA CRUZ;RUA DE PEDESTRE XIII, 25 - JARDIM FLUMINENSE II;CANINDEZINHO;
2024;1;FORTALEZA;44100;PASTORA ERLENIA;117;289;;8;EM PADRE ANTONIO MONTEIRO DA CRUZ;RUA DE PEDESTRE XIII, 25 - JARDIM FLUMINENSE II;CANINDEZINHO;
2024;1;FORTALEZA;44100;PASTORA ERLENIA;117;291;;1;COLÉGIO CASTRO ALVES;RUA TULIPA NEGRA, 2319;PARQUE PRESIDENTE VARGAS;
2024;1;FORTALEZA;44100;PASTORA ERLENIA;117;300;;1;EM PROFESSOR JOSÉ FERREIRA DE ALENCAR;RUA SÃO FRANCISCO DO JARDIM, 557;BOM JARDIM;
2024;1;FORTALEZA;44100;PASTORA ERLENIA;117;306;;2;EEFM PROFA ADELIA BRASIL FEIJO;AV CONTORNO SUL, 1540;CONJUNTO ESPERANÇA;
2024;1;FORTALEZA;44100;PASTORA ERLENIA;117;310;;1;EM JOAQUIM ALVES;RUA COSTA DO SOL, 1061;SIQUEIRA;
2024;1;FORTALEZA;44100;PASTORA ERLENIA;117;313;;1;CENTRO CULTURAL CANINDEZINHO;AV. OSÓRIO DE PAIVA, 6297;CANINDEZINHO;
2024;1;FORTALEZA;44100;PASTORA ERLENIA;117;322;;2;EEFM PROFESSORA MARIA MARGARIDA DE CASTRO ALMEIDA;AV. CONTORNO SUL, 960;CONJUNTO ESPERANÇA;
2024;1;FORTALEZA;44100;PASTORA ERLENIA;117;326;;1;ESCOLA MUNICIPAL PROF JOSE CÍRIO PEREIRA FILHO;RUA QUARTZO ROSA, 100;SIQUEIRA;
2024;1;FORTALEZA;44100;PASTORA ERLENIA;117;333;;7;EM PADRE ANTONIO MONTEIRO DA CRUZ;RUA DE PEDESTRE XIII, 25 - JARDIM FLUMINENSE II;CANINDEZINHO;
2024;1;FORTALEZA;44100;PASTORA ERLENIA;117;336;;1;COLÉGIO CASTRO ALVES;RUA TULIPA NEGRA, 2319;PARQUE PRESIDENTE VARGAS;
2024;1;FORTALEZA;44100;PASTORA ERLENIA;117;345;;2;EEFM PROFA ADELIA BRASIL FEIJO;AV CONTORNO SUL, 1540;CONJUNTO ESPERANÇA;
2024;1;FORTALEZA;44100;PASTORA ERLENIA;117;360;;1;ESCOLA MUNICIPAL CATARINA LIMA DA SILVA;RUA PEDRO MARTINS, 313;BOM JARDIM;
2024;1;FORTALEZA;44100;PASTORA ERLENIA;117;361;;3;EM PADRE ANTONIO MONTEIRO DA CRUZ;RUA DE PEDESTRE XIII, 25 - JARDIM FLUMINENSE II;CANINDEZINHO;
2024;1;FORTALEZA;44100;PASTORA ERLENIA;117;362;;2;EEFM PROFESSORA MARIA MARGARIDA DE CASTRO ALMEIDA;AV. CONTORNO SUL, 960;CONJUNTO ESPERANÇA;
2024;1;FORTALEZA;44100;PASTORA ERLENIA;117;365;;1;EMEIF PADRE CÍCERO ROMÃO BATISTA;RUA MARIELLE FRANCO, 630;CONJUNTO ESPERANÇA;
2024;1;FORTALEZA;44100;PASTORA ERLENIA;117;366;;1;EM FLORIVAL ALVES SERAINE;RUA ITATIAIA, 1000;CANINDEZINHO;
2024;1;FORTALEZA;44100;PASTORA ERLENIA;117;368;;1;COLÉGIO VIDA VIVA;RUA JOSÉ MARIA, 100;SIQUEIRA;
2024;1;FORTALEZA;44100;PASTORA ERLENIA;117;370;;2;EMTI PROFESSORA MARIA JOSÉ FERREIRA GOMES;RUA CÔNEGO DE CASTRO, 8617;PARQUE PRESIDENTE VARGAS;
2024;1;FORTALEZA;44100;PASTORA ERLENIA;117;375;;1;ESCOLA MUNICIPAL HERBERT DE SOUSA;RUA URUCUTUBA 1599;BOM JARDIM;
2024;1;FORTALEZA;44100;PASTORA ERLENIA;117;382;;1;PROJETO ALIANÇA COM CRISTO;RUA WALDEMAR PAES BRAGANÇA 1208;BOM JARDIM;
2024;1;FORTALEZA;44100;PASTORA ERLENIA;117;383;;6;EM PADRE ANTONIO MONTEIRO DA CRUZ;RUA DE PEDESTRE XIII, 25 - JARDIM FLUMINENSE II;CANINDEZINHO;
2024;1;FORTALEZA;44100;PASTORA ERLENIA;117;387;;1;EM NARCISO PESSOA DE ARAÚJO;AV. OSÓRIO DE PAIVA, 4841;CANINDEZINHO;
2024;1;FORTALEZA;44100;PASTORA ERLENIA;117;391;;1;EM JOSE MARIA MOREIRA CAMPOS;RUA FRANCISCO ALMEIDA, 525 CJ. APOLO XI;PARQUE PRESIDENTE VARGAS;
2024;1;FORTALEZA;44100;PASTORA ERLENIA;117;398;;1;EEFM PROFESSORA MARIA MARGARIDA DE CASTRO ALMEIDA;AV. CONTORNO SUL, 960;CONJUNTO ESPERANÇA;
2024;1;FORTALEZA;44100;PASTORA ERLENIA;117;406;;1;EEFM SÃO FRANCISCO DE ASSIS;RUA SÃO FELIPE, 564;CANINDEZINHO;
2024;1;FORTALEZA;44100;PASTORA ERLENIA;117;410;;2;EM PADRE ANTONIO MONTEIRO DA CRUZ;RUA DE PEDESTRE XIII, 25 - JARDIM FLUMINENSE II;CANINDEZINHO;
2024;1;FORTALEZA;44100;PASTORA ERLENIA;117;411;;1;CENTRO CULTURAL CANINDEZINHO;AV. OSÓRIO DE PAIVA, 6297;CANINDEZINHO;
2024;1;FORTALEZA;44100;PASTORA ERLENIA;117;415;;1;EM JOSE MARIA MOREIRA CAMPOS;RUA FRANCISCO ALMEIDA, 525 CJ. APOLO XI;PARQUE PRESIDENTE VARGAS;
2024;1;FORTALEZA;44100;PASTORA ERLENIA;117;417;;2;COLÉGIO VIDA VIVA;RUA JOSÉ MARIA, 100;SIQUEIRA;
2024;1;FORTALEZA;44100;PASTORA ERLENIA;117;424;;1;PROJETO ALIANÇA COM CRISTO;RUA WALDEMAR PAES BRAGANÇA 1208;BOM JARDIM;
2024;1;FORTALEZA;44100;PASTORA ERLENIA;117;425;;4;EM PADRE ANTONIO MONTEIRO DA CRUZ;RUA DE PEDESTRE XIII, 25 - JARDIM FLUMINENSE II;CANINDEZINHO;
2024;1;FORTALEZA;44100;PASTORA ERLENIA;117;428;;1;EMEIF MARIA BEZERRA QUEVEDO;RUA 103, 28 - CJ. NOVO MONDUBIM;MANOEL SÁTIRO;
2024;1;FORTALEZA;44100;PASTORA ERLENIA;117;430;;1;ESCOLA MUNICIPAL CATARINA LIMA DA SILVA;RUA PEDRO MARTINS, 313;BOM JARDIM;
2024;1;FORTALEZA;44100;PASTORA ERLENIA;117;433;;1;EEFM SANTO AMARO;RUA NOVA CONQUISTA 871;BOM JARDIM;
2024;1;FORTALEZA;44100;PASTORA ERLENIA;117;434;;2;EEFM SANTO AMARO;RUA NOVA CONQUISTA 871;BOM JARDIM;
2024;1;FORTALEZA;44100;PASTORA ERLENIA;117;435;;1;EEFM SANTO AMARO;RUA NOVA CONQUISTA 871;BOM JARDIM;
2024;1;FORTALEZA;44100;PASTORA ERLENIA;117;436;;1;EEFM SANTO AMARO;RUA NOVA CONQUISTA 871;BOM JARDIM;
2024;1;FORTALEZA;44100;PASTORA ERLENIA;117;437;;4;EEFM SANTO AMARO;RUA NOVA CONQUISTA 871;BOM JARDIM;
2024;1;FORTALEZA;44100;PASTORA ERLENIA;117;438;;1;EEFM SANTO AMARO;RUA NOVA CONQUISTA 871;BOM JARDIM;
2024;1;FORTALEZA;44100;PASTORA ERLENIA;117;439;;1;EEFM SANTO AMARO;RUA NOVA CONQUISTA 871;BOM JARDIM;
2024;1;FORTALEZA;44100;PASTORA ERLENIA;117;440;;1;EEFM SANTO AMARO;RUA NOVA CONQUISTA 871;BOM JARDIM;
2024;1;FORTALEZA;44100;PASTORA ERLENIA;117;444;;2;EM PADRE ANTONIO MONTEIRO DA CRUZ;RUA DE PEDESTRE XIII, 25 - JARDIM FLUMINENSE II;CANINDEZINHO;
2024;1;FORTALEZA;44100;PASTORA ERLENIA;117;445;;2;EEFM PROFESSORA MARIA MARGARIDA DE CASTRO ALMEIDA;AV. CONTORNO SUL, 960;CONJUNTO ESPERANÇA;
2024;1;FORTALEZA;44100;PASTORA ERLENIA;117;447;;2;COLÉGIO VIDA VIVA;RUA JOSÉ MARIA, 100;SIQUEIRA;
2024;1;FORTALEZA;44100;PASTORA ERLENIA;117;448;;1;EM FLORIVAL ALVES SERAINE;RUA ITATIAIA, 1000;CANINDEZINHO;
2024;1;FORTALEZA;44100;PASTORA ERLENIA;117;450;;1;EM JOSE MARIA MOREIRA CAMPOS;RUA FRANCISCO ALMEIDA, 525 CJ. APOLO XI;PARQUE PRESIDENTE VARGAS;
2024;1;FORTALEZA;44100;PASTORA ERLENIA;117;451;;3;EM PADRE ANTONIO MONTEIRO DA CRUZ;RUA DE PEDESTRE XIII, 25 - JARDIM FLUMINENSE II;CANINDEZINHO;
2024;1;FORTALEZA;44100;PASTORA ERLENIA;117;459;494;3;ESCOLA MUNICIPAL JORNALISTA DEMÓCRITO DUMMAR;RUA EUCLIDES PAULINO BARROSO, 2505;CANINDEZINHO;
2024;1;FORTALEZA;44100;PASTORA ERLENIA;117;462;;1;EEEP DARCY RIBEIRO;RUA CONEGO DE CASTRO, S/N;CONJUNTO ESPERANÇA;
2024;1;FORTALEZA;44100;PASTORA ERLENIA;117;466;;5;ESCOLA MUNICIPAL JORNALISTA DEMÓCRITO DUMMAR;RUA EUCLIDES PAULINO BARROSO, 2505;CANINDEZINHO;
2024;1;FORTALEZA;44100;PASTORA ERLENIA;117;474;491;1;EMTI PROFESSOR AGERSON TABOSA PINTO;RUA WILCA ALBUQUERQUE, S/N;SIQUEIRA;
2024;1;FORTALEZA;44100;PASTORA ERLENIA;117;477;;1;EM JOSE MARIA MOREIRA CAMPOS;RUA FRANCISCO ALMEIDA, 525 CJ. APOLO XI;PARQUE PRESIDENTE VARGAS;
2024;1;FORTALEZA;44100;PASTORA ERLENIA;117;478;;3;ESCOLA MUNICIPAL JORNALISTA DEMÓCRITO DUMMAR;RUA EUCLIDES PAULINO BARROSO, 2505;CANINDEZINHO;
2024;1;FORTALEZA;44100;PASTORA ERLENIA;117;481;489;1;CENTRO EDUCACIONAL JERUSALÉM;RUA SÃO FELIPE, 1345;CANINDEZINHO;
2024;1;FORTALEZA;44100;PASTORA ERLENIA;117;487;;3;COLÉGIO CASTRO ALVES;RUA TULIPA NEGRA, 2319;PARQUE PRESIDENTE VARGAS;
2024;1;FORTALEZA;44100;PASTORA ERLENIA;117;492;;1;EEM PARQUE PRESIDENTE VARGAS;RUA FRANCISCO ALMEIDA, 940;PARQUE PRESIDENTE VARGAS;
TOTAL;;;;;;;;218;
