Ano;Turno;Município;Número;Candidato;Zona;Seção;Seções Agregadas;Votos;Local de Votação;Endereço Local de Votação;Bairro;
2024;1;FORTALEZA;20777;PASTOR FLÁVIO SANTOS;1;403;939;1;EMTI VEREADOR ALBERTO GOMES DE QUEIROZ;AV. ZEZÉ DIOGO, 782;CAIS DO PORTO;
2024;1;FORTALEZA;20777;PASTOR FLÁVIO SANTOS;1;462;;1;ESCOLA ESTADUAL  BARBARA DE ALENCAR;RUA PEDRO RUFINO 38;VARJOTA;
2024;1;FORTALEZA;20777;PASTOR FLÁVIO SANTOS;1;464;;1;ESCOLA ESTADUAL  BARBARA DE ALENCAR;RUA PEDRO RUFINO 38;VARJOTA;
2024;1;FORTALEZA;20777;PASTOR FLÁVIO SANTOS;1;481;;1;COLEGIO FARIAS BRITO - PRÉ UNIVERSITARIO - JULIO ABREU;AVENIDA JULIO ABREU, 284;VARJOTA;
2024;1;FORTALEZA;20777;PASTOR FLÁVIO SANTOS;1;496;;1;ESCOLA ESTADUAL MATIAS BECK;RUA  PROFESSORA AIDA BALAIO 38;MUCURIPE;
2024;1;FORTALEZA;20777;PASTOR FLÁVIO SANTOS;1;619;;1;UNINTA - FACULDADE UNINTA FORTALEZA;RUA VILEBALDO AGUIAR,133;COCÓ;
2024;1;FORTALEZA;20777;PASTOR FLÁVIO SANTOS;1;639;;1;ESCOLA ESTADUAL MARIA JOSE MEDEIROS;RUA DESEMBARGADOR LAURO NOGUEIRA 1240;PAPICU;
2024;1;FORTALEZA;20777;PASTOR FLÁVIO SANTOS;1;810;;1;ESCOLA MUNICIPAL FREI TITO DE ALENCAR LIMA;AVENIDA DIOGUINHO 5927;VICENTE PINZON;
2024;1;FORTALEZA;20777;PASTOR FLÁVIO SANTOS;1;905;;1;FANOR - FACULDADE NORDESTE;AVENIDA SANTOS DUMONT 7800;DE LOURDES;
2024;1;FORTALEZA;20777;PASTOR FLÁVIO SANTOS;1;908;;1;ESCOLA MUNICIPAL PROF BELARMINA CAMPOS;RUA MANOEL RODRIGUES MONTEIRO, 840;VICENTE PINZON;
2024;1;FORTALEZA;20777;PASTOR FLÁVIO SANTOS;1;916;;1;FACULDADE FARIAS BRITO - CASTRO MONTE;RUA CASTRO MONTE 1364;VARJOTA;
2024;1;FORTALEZA;20777;PASTOR FLÁVIO SANTOS;2;58;;1;EM PROFª FERNANDA MARIA DE ALENCAR COLARES;AV PROF. ARTHUR DE CARVALHO, 1540;LAGOA REDONDA;
2024;1;FORTALEZA;20777;PASTOR FLÁVIO SANTOS;2;79;;1;EEEP COMENDADOR MIGUEL GURGEL;RUA JOSE BAIMA, S/N;GUAJERU;
2024;1;FORTALEZA;20777;PASTOR FLÁVIO SANTOS;2;108;;1;EMEIF DEMOCRITO ROCHA;RUA PADRE PEDRO DE ALENCAR, 2012;MESSEJANA;
2024;1;FORTALEZA;20777;PASTOR FLÁVIO SANTOS;2;137;;1;EEM LICEU DE MESSEJANA;AVENIDA WASHINGTON SOARES 7702;MESSEJANA;
2024;1;FORTALEZA;20777;PASTOR FLÁVIO SANTOS;2;140;;1;EEM LICEU DE MESSEJANA;AVENIDA WASHINGTON SOARES 7702;MESSEJANA;
2024;1;FORTALEZA;20777;PASTOR FLÁVIO SANTOS;2;393;;1;EEFM GOV LUIZ DE GONZAGA FONSECA MOTA;RUA SANTA ROSA, 407;COAÇU;
2024;1;FORTALEZA;20777;PASTOR FLÁVIO SANTOS;2;538;;1;EEM DEPUTADO PAULO BENEVIDES;RUA ANGELICA GURGEL, 186;MESSEJANA;
2024;1;FORTALEZA;20777;PASTOR FLÁVIO SANTOS;2;637;;1;EEFM GOV LUIZ DE GONZAGA FONSECA MOTA;RUA SANTA ROSA, 407;COAÇU;
2024;1;FORTALEZA;20777;PASTOR FLÁVIO SANTOS;2;654;;1;CMES ANISIO TEIXEIRA;TRAVESSA DO GUARANI, 355;PAUPINA;
2024;1;FORTALEZA;20777;PASTOR FLÁVIO SANTOS;2;745;;1;EM PROFª FERNANDA MARIA DE ALENCAR COLARES;AV PROF. ARTHUR DE CARVALHO, 1540;LAGOA REDONDA;
2024;1;FORTALEZA;20777;PASTOR FLÁVIO SANTOS;2;747;;1;CMES ANISIO TEIXEIRA;TRAVESSA DO GUARANI, 355;PAUPINA;
2024;1;FORTALEZA;20777;PASTOR FLÁVIO SANTOS;2;800;;1;FACULDADE ATENEU DO CEARÁ;AV. COLETOR ANTONIO GADELHA, 621;MESSEJANA;
2024;1;FORTALEZA;20777;PASTOR FLÁVIO SANTOS;2;812;;1;EM PROF CLODOMIR TEOFILO GIRAO;TRAVESSA RUTILO, 108;MESSEJANA;
2024;1;FORTALEZA;20777;PASTOR FLÁVIO SANTOS;2;821;;1;ESCOLA MUNICIPAL ISABEL FERREIRA;RUA ISABEL FERREIRA, 1000 - CONJ. CURIÓ;LAGOA REDONDA;
2024;1;FORTALEZA;20777;PASTOR FLÁVIO SANTOS;3;154;;1;EM MOURA BRASIL / EF;RUA PADRE MORORÓ, 189;MOURA BRASIL;
2024;1;FORTALEZA;20777;PASTOR FLÁVIO SANTOS;3;176;;1;IEP - INST. DE EDUCAÇÃO PORTAL - UNIDADE FORTALEZA;AV. PADRE IBIAPINA, 1243;CENTRO;
2024;1;FORTALEZA;20777;PASTOR FLÁVIO SANTOS;3;264;263, 265;1;EEMTI VISCONDE DO RIO BRANCO;AV. DOM MANUEL, 1803;CENTRO;
2024;1;FORTALEZA;20777;PASTOR FLÁVIO SANTOS;3;477;;1;COLÉGIO CHRISTUS (AV. BARÃO DE STUDART);RUA JOÃO CARVALHO, 630;ALDEOTA;
2024;1;FORTALEZA;20777;PASTOR FLÁVIO SANTOS;3;478;;1;COLÉGIO CHRISTUS (AV. BARÃO DE STUDART);RUA JOÃO CARVALHO, 630;ALDEOTA;
2024;1;FORTALEZA;20777;PASTOR FLÁVIO SANTOS;3;579;;1;ESCOLA DE SAÚDE PÚBLICA DO CEARÁ;AV. ANTÔNIO JUSTA, 3161;MEIRELES;
2024;1;FORTALEZA;20777;PASTOR FLÁVIO SANTOS;3;583;;1;ESCOLA DE SAÚDE PÚBLICA DO CEARÁ;AV. ANTÔNIO JUSTA, 3161;MEIRELES;
2024;1;FORTALEZA;20777;PASTOR FLÁVIO SANTOS;3;614;;1;COLÉGIO ESPAÇO ABERTO - DOM LUÍS;AV. DOM LUÍS, 730;ALDEOTA;
2024;1;FORTALEZA;20777;PASTOR FLÁVIO SANTOS;3;646;;1;WIZARD DOM LUÍS;AV. DOM LUÍS, 149;MEIRELES;
2024;1;FORTALEZA;20777;PASTOR FLÁVIO SANTOS;80;117;;1;EEM YOLANDA QUEIROZ;AV. GAL. MURILO BORGES, 864;ALTO DA BALANÇA;
2024;1;FORTALEZA;20777;PASTOR FLÁVIO SANTOS;80;164;;1;AABB - ASSOCIAÇÃO ATLÉTICA BANCO DO BRASIL;AV BARAO DE STUDART, 2917;DIONISIO TORRES;
2024;1;FORTALEZA;20777;PASTOR FLÁVIO SANTOS;80;196;;1;COLÉGIO SANTO TOMÁZ DE AQUINO;RUA MÁRIO MAMEDE, 750;FÁTIMA;
2024;1;FORTALEZA;20777;PASTOR FLÁVIO SANTOS;80;201;;1;UAPS CESAR CALS DE OLIVEIRA;RUA CAPITÃO ARAGÃO 555;ALTO DA BALANÇA;
2024;1;FORTALEZA;20777;PASTOR FLÁVIO SANTOS;80;229;;1;EMEIF PROFª ANTONIETA CALS;RUA MONSENHOR SALAZAR 1480;TAUAPE;
2024;1;FORTALEZA;20777;PASTOR FLÁVIO SANTOS;80;233;;1;EMEIF PROFª ANTONIETA CALS;RUA MONSENHOR SALAZAR 1480;TAUAPE;
2024;1;FORTALEZA;20777;PASTOR FLÁVIO SANTOS;80;243;;1;EEFM NOEL HUGNEN OLIVEIRA PAIVA;RUA MONSENHOR SALAZAR 279;TAUAPE;
2024;1;FORTALEZA;20777;PASTOR FLÁVIO SANTOS;80;418;;1;FACULDADE MAURÍCIO DE NASSAU;AVENIDA VISCONDE DO RIO BRANCO, 2078;JOSÉ BONIFÁCIO;
2024;1;FORTALEZA;20777;PASTOR FLÁVIO SANTOS;82;84;;1;ESCOLA MUNICIPAL TERTULIANO CAMBRAIA - EI/EF;RUA MONSENHOR ROSA, 946;CARLITO PAMPLONA;
2024;1;FORTALEZA;20777;PASTOR FLÁVIO SANTOS;82;117;;1;CENTRO DE CIDADANIA GOV. VIRGÍLIO TÁVORA - CCDH;AV. MONSENHOR HELIO CAMPOS, 178;CRISTO REDENTOR;
2024;1;FORTALEZA;20777;PASTOR FLÁVIO SANTOS;82;226;;1;CENTRO EDUCACIONAL MOEMA TÁVORA;RUA MARCÍLIO DIAS, 485;PIRAMBU;
2024;1;FORTALEZA;20777;PASTOR FLÁVIO SANTOS;82;248;;1;ESCOLA MUNICIPAL HILBERTO SILVA - EI/EF;AV. PRESIDENTE CASTELO BRANCO, 2973;PIRAMBU;
2024;1;FORTALEZA;20777;PASTOR FLÁVIO SANTOS;82;257;;1;CEJA PAULO FREIRE;RUA OLAVO BILAC, 1300;SÃO GERARDO;
2024;1;FORTALEZA;20777;PASTOR FLÁVIO SANTOS;82;348;;1;ESCOLA MUNICIPAL GUSTAVO BARROSO - EI/EF;RUA ERETIDES MARTINS, 26;SÃO GERARDO;
2024;1;FORTALEZA;20777;PASTOR FLÁVIO SANTOS;82;376;;1;ESCOLA MUNICIPAL PROFESSOR MARTINZ DE AGUIAR - EI/EF;RUA BERNARDO PORTO, 490;MONTE CASTELO;
2024;1;FORTALEZA;20777;PASTOR FLÁVIO SANTOS;82;425;;1;ESCOLA MUNICIPAL SANTA TEREZA - EI/EF;RUA MONSENHOR HÉLIO CAMPOS, 90;CRISTO REDENTOR;
2024;1;FORTALEZA;20777;PASTOR FLÁVIO SANTOS;82;450;;1;ESCOLA MUNICIPAL TERTULIANO CAMBRAIA - EI/EF;RUA MONSENHOR ROSA, 946;CARLITO PAMPLONA;
2024;1;FORTALEZA;20777;PASTOR FLÁVIO SANTOS;83;54;;1;ESCOLA MUNICIPAL PAULO SARASATE;RUA PEDRO MUNIZ 250;DEMOCRITO ROCHA;
2024;1;FORTALEZA;20777;PASTOR FLÁVIO SANTOS;83;131;;1;ESCOLA MUNICIPAL PRESIDENTE KENNEDY;AV. LINEU MACHADO 811;JÓQUEI CLUBE;
2024;1;FORTALEZA;20777;PASTOR FLÁVIO SANTOS;83;240;;1;COLEGIO CHRISTUS;AV. ENG. HUMBERTO MONTE, 1355;BELA VISTA;
2024;1;FORTALEZA;20777;PASTOR FLÁVIO SANTOS;83;289;;1;COLÉGIO ELITE;AVENIDA JOÃO PESSOA, 6302;MONTESE;
2024;1;FORTALEZA;20777;PASTOR FLÁVIO SANTOS;83;492;;1;ESCOLA MUNICIPAL DOM JOSÉ TUPINAMBA DA FROTA;RUA VIRIATO RIBEIRO 1031;BELA VISTA;
2024;1;FORTALEZA;20777;PASTOR FLÁVIO SANTOS;83;543;;1;ESCOLA MUNICIPAL JOSÉ BONIFÁCIO DE SOUSA;RUA PERNAMBUCO 600;DEMOCRITO ROCHA;
2024;1;FORTALEZA;20777;PASTOR FLÁVIO SANTOS;83;654;;1;EEMTI PROFESSOR PAULO FREIRE;AVENIDA SENADOR FERNANDES TÁVORA 1936;HENRIQUE JORGE;
2024;1;FORTALEZA;20777;PASTOR FLÁVIO SANTOS;83;722;;1;EEEP JÚLIA GIFFONI;RUA CORONEL MATOS DOURADO 1349;PICI;
2024;1;FORTALEZA;20777;PASTOR FLÁVIO SANTOS;83;739;;1;ESCOLA MUNICIPAL PROFESSORA MARIA LIDUÍNA CORREA LEITE;RUA FERNÃO MAGALHÃES, 120;PICI;
2024;1;FORTALEZA;20777;PASTOR FLÁVIO SANTOS;85;147;;1;EEEP PROFESSOR CESAR CAMPELO;RUA 717, N.164, 3 ETAPA;CONJUNTO CEARÁ I;
2024;1;FORTALEZA;20777;PASTOR FLÁVIO SANTOS;85;185;;1;EEFM JOSE LEOPOLDINO DA SILVA FILHO - UV4;RUA QUATROCENTOS E QUARENTA E OITO, 1, 2A ETAPA;CONJUNTO CEARÁ I;
2024;1;FORTALEZA;20777;PASTOR FLÁVIO SANTOS;85;187;;2;EEFM JOSE LEOPOLDINO DA SILVA FILHO - UV4;RUA QUATROCENTOS E QUARENTA E OITO, 1, 2A ETAPA;CONJUNTO CEARÁ I;
2024;1;FORTALEZA;20777;PASTOR FLÁVIO SANTOS;85;188;;1;EEFM JOSE LEOPOLDINO DA SILVA FILHO - UV4;RUA QUATROCENTOS E QUARENTA E OITO, 1, 2A ETAPA;CONJUNTO CEARÁ I;
2024;1;FORTALEZA;20777;PASTOR FLÁVIO SANTOS;85;208;;1;ESCOLA MUNICIPAL PROF AMERICO BARREIRA;RUA RICARDO PONTES 529;GENIBAÚ;
2024;1;FORTALEZA;20777;PASTOR FLÁVIO SANTOS;85;211;;1;ESCOLA MUNICIPAL PROF AMERICO BARREIRA;RUA RICARDO PONTES 529;GENIBAÚ;
2024;1;FORTALEZA;20777;PASTOR FLÁVIO SANTOS;85;214;;1;ESCOLA MUNICIPAL PROF AMERICO BARREIRA;RUA RICARDO PONTES 529;GENIBAÚ;
2024;1;FORTALEZA;20777;PASTOR FLÁVIO SANTOS;85;250;;1;ESCOLA PE JOSE ARIMATEIA DINIZ;RUA OITOCENTOS E DEZ, S/N, 3A ETAPA (AO LADO DA UPA);CONJUNTO CEARÁ I;
2024;1;FORTALEZA;20777;PASTOR FLÁVIO SANTOS;85;263;;1;EMEIF DOLORES ALCANTARA;RUA CARDEAL ARCOVERDE S/N;AUTRAN NUNES;
2024;1;FORTALEZA;20777;PASTOR FLÁVIO SANTOS;85;265;;1;EMEIF DOLORES ALCANTARA;RUA CARDEAL ARCOVERDE S/N;AUTRAN NUNES;
2024;1;FORTALEZA;20777;PASTOR FLÁVIO SANTOS;85;272;;1;EEFM PROF PLACIDO ADERALDO CASTELO - UV 7B;RUA SETECENTOS E VINTE E UM, 100, 3A ETAPA;CONJUNTO CEARÁ I;
2024;1;FORTALEZA;20777;PASTOR FLÁVIO SANTOS;85;279;;1;EEFM PROF PLACIDO ADERALDO CASTELO - UV 7B;RUA SETECENTOS E VINTE E UM, 100, 3A ETAPA;CONJUNTO CEARÁ I;
2024;1;FORTALEZA;20777;PASTOR FLÁVIO SANTOS;85;303;;1;EEFM ANTONIO BEZERRA;RUA PADRE PERDIGAO SAMPAIO 780;ANTÔNIO BEZERRA;
2024;1;FORTALEZA;20777;PASTOR FLÁVIO SANTOS;85;325;;1;EEFM DR UBIRAJARA INDIO DO CEARA - UV-7A;RUA SETECENTOS E CINQUENTA E UM, 192, 3A ETAPA;CONJUNTO CEARÁ I;
2024;1;FORTALEZA;20777;PASTOR FLÁVIO SANTOS;85;330;;2;EEFM DR UBIRAJARA INDIO DO CEARA - UV-7A;RUA SETECENTOS E CINQUENTA E UM, 192, 3A ETAPA;CONJUNTO CEARÁ I;
2024;1;FORTALEZA;20777;PASTOR FLÁVIO SANTOS;85;356;;1;EEFM AYRTON SENNA DA SILVA;RUA MANAUS, 855;DOM LUSTOSA;
2024;1;FORTALEZA;20777;PASTOR FLÁVIO SANTOS;85;357;;1;EEFM AYRTON SENNA DA SILVA;RUA MANAUS, 855;DOM LUSTOSA;
2024;1;FORTALEZA;20777;PASTOR FLÁVIO SANTOS;85;382;;1;EEFM PROF PLACIDO ADERALDO CASTELO - UV 7B;RUA SETECENTOS E VINTE E UM, 100, 3A ETAPA;CONJUNTO CEARÁ I;
2024;1;FORTALEZA;20777;PASTOR FLÁVIO SANTOS;85;387;;1;EEFM DR UBIRAJARA INDIO DO CEARA - UV-7A;RUA SETECENTOS E CINQUENTA E UM, 192, 3A ETAPA;CONJUNTO CEARÁ I;
2024;1;FORTALEZA;20777;PASTOR FLÁVIO SANTOS;85;393;;1;EMEIF MANOEL CAETANO DE SOUZA;RUA SANTA LUCIA 170;GENIBAÚ;
2024;1;FORTALEZA;20777;PASTOR FLÁVIO SANTOS;93;83;;1;EM RACHEL DE QUEIROZ;AVENIDA C, S/N - II ETAPA;PREFEITO JOSÉ WALTER;
2024;1;FORTALEZA;20777;PASTOR FLÁVIO SANTOS;93;85;;1;EM RACHEL DE QUEIROZ;AVENIDA C, S/N - II ETAPA;PREFEITO JOSÉ WALTER;
2024;1;FORTALEZA;20777;PASTOR FLÁVIO SANTOS;93;130;;1;COLEGIO 21 EDUCAR;AV JOAO DE ARAUJO LIMA, 1240 - II ETAPA;PREFEITO JOSÉ WALTER;
2024;1;FORTALEZA;20777;PASTOR FLÁVIO SANTOS;93;131;;1;COLEGIO 21 EDUCAR;AV JOAO DE ARAUJO LIMA, 1240 - II ETAPA;PREFEITO JOSÉ WALTER;
2024;1;FORTALEZA;20777;PASTOR FLÁVIO SANTOS;93;151;;1;EEEP PROFESSOR OTAVIO TERCEIRO DE FARIAS;AVENIDA C, 435;PREFEITO JOSÉ WALTER;
2024;1;FORTALEZA;20777;PASTOR FLÁVIO SANTOS;93;156;;1;CUCA JOSÉ WALTER;RUA 69, S/N;PREFEITO JOSÉ WALTER;
2024;1;FORTALEZA;20777;PASTOR FLÁVIO SANTOS;93;170;;1;EM JOAO HILDO DE CARVALHO FURTADO;RUA MIGUEL ARAGÃO, S/N ARACAPÉ;MONDUBIM;
2024;1;FORTALEZA;20777;PASTOR FLÁVIO SANTOS;93;234;;1;EEEP PROFESSOR OTAVIO TERCEIRO DE FARIAS;AVENIDA C, 435;PREFEITO JOSÉ WALTER;
2024;1;FORTALEZA;20777;PASTOR FLÁVIO SANTOS;93;241;;1;EM ROGACIANO LEITE;RUA 45, S/N - III ETAPA;PREFEITO JOSÉ WALTER;
2024;1;FORTALEZA;20777;PASTOR FLÁVIO SANTOS;93;250;;1;ESCOLA MUNICIPAL ARI DE SA CAVALCANTE (JOSÉ WALTER);AV. H, 430 III ETAPA;PREFEITO JOSÉ WALTER;
2024;1;FORTALEZA;20777;PASTOR FLÁVIO SANTOS;93;283;;1;EM JONATHAN DA ROCHA ALCOFORADO;RUA MARIA GOMES DE SÁ,1030 ARACAPÉ;MONDUBIM;
2024;1;FORTALEZA;20777;PASTOR FLÁVIO SANTOS;93;315;;1;EM JOAO HILDO DE CARVALHO FURTADO;RUA MIGUEL ARAGÃO, S/N ARACAPÉ;MONDUBIM;
2024;1;FORTALEZA;20777;PASTOR FLÁVIO SANTOS;94;469;;1;EEMTI MARIA JOSÉ SANTOS FERREIRA GOMES;RUA DONA LUCIA PINHEIRO, 93;QUINTINO CUNHA;
2024;1;FORTALEZA;20777;PASTOR FLÁVIO SANTOS;94;574;;1;EEMTI MARIA JOSÉ SANTOS FERREIRA GOMES;RUA DONA LUCIA PINHEIRO, 93;QUINTINO CUNHA;
2024;1;FORTALEZA;20777;PASTOR FLÁVIO SANTOS;94;626;;1;EMEIEF PROF JOSE PARSIFAL BARROSO;AV MAJOR ASSIS 1076;VILA VELHA;
2024;1;FORTALEZA;20777;PASTOR FLÁVIO SANTOS;94;671;;1;EMEIEF PROF JOSE PARSIFAL BARROSO;AV MAJOR ASSIS 1076;VILA VELHA;
2024;1;FORTALEZA;20777;PASTOR FLÁVIO SANTOS;94;764;;1;CEI MARISTELA DA FROTA CAVALCANTE;AV. L, N. 1000;VILA VELHA;
2024;1;FORTALEZA;20777;PASTOR FLÁVIO SANTOS;95;83;;1;EEFM PADRE MARCELINO CHAMPAGNAT;RUA DAURA, 120;BARROSO;
2024;1;FORTALEZA;20777;PASTOR FLÁVIO SANTOS;95;89;;1;EEFM PADRE MARCELINO CHAMPAGNAT;RUA DAURA, 120;BARROSO;
2024;1;FORTALEZA;20777;PASTOR FLÁVIO SANTOS;95;91;;1;EEFM PADRE MARCELINO CHAMPAGNAT;RUA DAURA, 120;BARROSO;
2024;1;FORTALEZA;20777;PASTOR FLÁVIO SANTOS;95;116;;1;EMEIEF PROFESSORA BERNADETE ORIÁ DE OLIVEIRA;RUA DR. CODES SANDOVAL 796;CONJUNTO PALMEIRAS;
2024;1;FORTALEZA;20777;PASTOR FLÁVIO SANTOS;95;117;;1;EMEIEF MARIA HELENICE CAVALCANTE LEITE MARTINS;RUA MAIZA, S/N;CONJUNTO PALMEIRAS;
2024;1;FORTALEZA;20777;PASTOR FLÁVIO SANTOS;95;119;;1;EMEIEF MARIA HELENICE CAVALCANTE LEITE MARTINS;RUA MAIZA, S/N;CONJUNTO PALMEIRAS;
2024;1;FORTALEZA;20777;PASTOR FLÁVIO SANTOS;95;133;;1;EM PROFESSOR FRANCISCO DE MELO JABORANDI;AV. GOVERNADOR LEONEL BRIZOLA, 198;JANGURUSSU;
2024;1;FORTALEZA;20777;PASTOR FLÁVIO SANTOS;95;185;;1;DNIT;RODOVIA BR-116, KM 06;CAJAZEIRAS;
2024;1;FORTALEZA;20777;PASTOR FLÁVIO SANTOS;95;189;;1;DNIT;RODOVIA BR-116, KM 06;CAJAZEIRAS;
2024;1;FORTALEZA;20777;PASTOR FLÁVIO SANTOS;95;222;;1;EMEIEF BARBARA DE ALENCAR;RUA CAPITAO PORFIRIO, 544;PARQUE SANTA MARIA;
2024;1;FORTALEZA;20777;PASTOR FLÁVIO SANTOS;95;235;;1;CEI MARIA DO SOCORRO FERREIRA VIRINO;RUA VALPARAÍSO, 339;CONJUNTO PALMEIRAS;
2024;1;FORTALEZA;20777;PASTOR FLÁVIO SANTOS;95;246;;1;EMEIEF TAÍS MARIA BEZERRA NOGUEIRA;AV. GOVERNADOR LEONEL BRIZOLA, 710;JANGURUSSU;
2024;1;FORTALEZA;20777;PASTOR FLÁVIO SANTOS;95;299;;2;EEEP MÁRIO ALENCAR;RUA VERDE 44, 97 (CJ. SÍTIO SÃO JOÃO);JANGURUSSU;
2024;1;FORTALEZA;20777;PASTOR FLÁVIO SANTOS;112;7;;1;COLÉGIO NOVO HORIZONTE;RUA BEIJA FLOR, 25;JARDIM DAS OLIVEIRAS;
2024;1;FORTALEZA;20777;PASTOR FLÁVIO SANTOS;112;9;;1;COLÉGIO NOVO HORIZONTE;RUA BEIJA FLOR, 25;JARDIM DAS OLIVEIRAS;
2024;1;FORTALEZA;20777;PASTOR FLÁVIO SANTOS;112;19;;1;EM MARIA DE LOURDES RIBEIRO JEREISSATI;RUA REINO UNIDO, 115;JARDIM DAS OLIVEIRAS;
2024;1;FORTALEZA;20777;PASTOR FLÁVIO SANTOS;112;20;;1;EM MARIA DE LOURDES RIBEIRO JEREISSATI;RUA REINO UNIDO, 115;JARDIM DAS OLIVEIRAS;
2024;1;FORTALEZA;20777;PASTOR FLÁVIO SANTOS;112;22;;1;EM MARIA DE LOURDES RIBEIRO JEREISSATI;RUA REINO UNIDO, 115;JARDIM DAS OLIVEIRAS;
2024;1;FORTALEZA;20777;PASTOR FLÁVIO SANTOS;112;44;;1;CENTRO DE EDUCAÇÃO INFANTIL(CEI) MARIA DE LOURDES RIBEIRO JEREISSATI;RUA 1, 930 - CONJ. TANCREDO NEVES;JARDIM DAS OLIVEIRAS;
2024;1;FORTALEZA;20777;PASTOR FLÁVIO SANTOS;112;121;;2;ESCOLA DE ENSINO MÉDIO EM TEMPO INTEGRAL JOHNSON;RUA GONTRAN GIFFONI, 461;ENGENHEIRO LUCIANO CAVALCANTE;
2024;1;FORTALEZA;20777;PASTOR FLÁVIO SANTOS;112;122;;2;ESCOLA DE ENSINO MÉDIO EM TEMPO INTEGRAL JOHNSON;RUA GONTRAN GIFFONI, 461;ENGENHEIRO LUCIANO CAVALCANTE;
2024;1;FORTALEZA;20777;PASTOR FLÁVIO SANTOS;112;123;;1;ESCOLA DE ENSINO MÉDIO EM TEMPO INTEGRAL JOHNSON;RUA GONTRAN GIFFONI, 461;ENGENHEIRO LUCIANO CAVALCANTE;
2024;1;FORTALEZA;20777;PASTOR FLÁVIO SANTOS;112;126;;2;ESCOLA DE ENSINO MÉDIO EM TEMPO INTEGRAL JOHNSON;RUA GONTRAN GIFFONI, 461;ENGENHEIRO LUCIANO CAVALCANTE;
2024;1;FORTALEZA;20777;PASTOR FLÁVIO SANTOS;112;127;;2;ESCOLA DE ENSINO MÉDIO EM TEMPO INTEGRAL JOHNSON;RUA GONTRAN GIFFONI, 461;ENGENHEIRO LUCIANO CAVALCANTE;
2024;1;FORTALEZA;20777;PASTOR FLÁVIO SANTOS;112;128;;2;ESCOLA DE ENSINO MÉDIO EM TEMPO INTEGRAL JOHNSON;RUA GONTRAN GIFFONI, 461;ENGENHEIRO LUCIANO CAVALCANTE;
2024;1;FORTALEZA;20777;PASTOR FLÁVIO SANTOS;112;145;;1;EEFM D. LUIZA TÁVORA - PRÓ MORAR;RUA FREI CANECA, 379;JARDIM DAS OLIVEIRAS;
2024;1;FORTALEZA;20777;PASTOR FLÁVIO SANTOS;112;162;;1;EM JOHNSON;RUA DRA. SOCORRO AZEVEDO, 461;ENGENHEIRO LUCIANO CAVALCANTE;
2024;1;FORTALEZA;20777;PASTOR FLÁVIO SANTOS;112;274;;1;EEMTI MIRIAN PORTO MOTA;RUA DAS CASTANHOLAS, S/N;JARDIM DAS OLIVEIRAS;
2024;1;FORTALEZA;20777;PASTOR FLÁVIO SANTOS;112;275;;1;EEMTI MIRIAN PORTO MOTA;RUA DAS CASTANHOLAS, S/N;JARDIM DAS OLIVEIRAS;
2024;1;FORTALEZA;20777;PASTOR FLÁVIO SANTOS;112;277;;1;EEMTI MIRIAN PORTO MOTA;RUA DAS CASTANHOLAS, S/N;JARDIM DAS OLIVEIRAS;
2024;1;FORTALEZA;20777;PASTOR FLÁVIO SANTOS;112;325;;2;EM PROF. LUIS COSTA;RUA JAIME LEONEL, 156;ENGENHEIRO LUCIANO CAVALCANTE;
2024;1;FORTALEZA;20777;PASTOR FLÁVIO SANTOS;112;340;;1;COLEGIO GLOBOMAX;RUA GENERAL CAIADO DE CASTRO, 156;ENGENHEIRO LUCIANO CAVALCANTE;
2024;1;FORTALEZA;20777;PASTOR FLÁVIO SANTOS;112;356;;2;EM PROF. LUIS COSTA;RUA JAIME LEONEL, 156;ENGENHEIRO LUCIANO CAVALCANTE;
2024;1;FORTALEZA;20777;PASTOR FLÁVIO SANTOS;112;363;;1;COLEGIO GLOBOMAX;RUA GENERAL CAIADO DE CASTRO, 156;ENGENHEIRO LUCIANO CAVALCANTE;
2024;1;FORTALEZA;20777;PASTOR FLÁVIO SANTOS;112;364;;2;EM PROF. LUIS COSTA;RUA JAIME LEONEL, 156;ENGENHEIRO LUCIANO CAVALCANTE;
2024;1;FORTALEZA;20777;PASTOR FLÁVIO SANTOS;112;366;;1;COLÉGIO ÁGAPE;AV HERMINIO DE CASTRO, 140;PARQUE MANIBURA;
2024;1;FORTALEZA;20777;PASTOR FLÁVIO SANTOS;112;442;;1;UNIVERSIDADE DE FORTALEZA - UNIFOR;AVENIDA WASHINGTON SOARES, 1321;EDSON QUEIROZ;
2024;1;FORTALEZA;20777;PASTOR FLÁVIO SANTOS;112;449;;1;UNIVERSIDADE DE FORTALEZA - UNIFOR;AVENIDA WASHINGTON SOARES, 1321;EDSON QUEIROZ;
2024;1;FORTALEZA;20777;PASTOR FLÁVIO SANTOS;112;503;;1;EM PROF FRANCISCO MAURICIO MATOS DOURADO;RUA  DES FLORIANO BENEVIDES MAGALHÃES, 391;EDSON QUEIROZ;
2024;1;FORTALEZA;20777;PASTOR FLÁVIO SANTOS;112;508;;1;EM PROF FRANCISCO MAURICIO MATOS DOURADO;RUA  DES FLORIANO BENEVIDES MAGALHÃES, 391;EDSON QUEIROZ;
2024;1;FORTALEZA;20777;PASTOR FLÁVIO SANTOS;112;514;;1;COLÉGIO ÁGAPE;AV HERMINIO DE CASTRO, 140;PARQUE MANIBURA;
2024;1;FORTALEZA;20777;PASTOR FLÁVIO SANTOS;112;542;;1;COLÉGIO NOVA DIMENSÃO;AV. EDILSON BRASIL SOARES, 1599;EDSON QUEIROZ;
2024;1;FORTALEZA;20777;PASTOR FLÁVIO SANTOS;113;52;;1;COLÉGIO FARIAS BRITO;RUA SENADOR POMPEU, 2607;JOSÉ BONIFÁCIO;
2024;1;FORTALEZA;20777;PASTOR FLÁVIO SANTOS;113;54;;1;COLÉGIO FARIAS BRITO;RUA SENADOR POMPEU, 2607;JOSÉ BONIFÁCIO;
2024;1;FORTALEZA;20777;PASTOR FLÁVIO SANTOS;113;113;;1;COLÉGIO CHRISTUS BENFICA;RUA LUIS DE MIRANDA, 536;BENFICA;
2024;1;FORTALEZA;20777;PASTOR FLÁVIO SANTOS;113;119;120;1;EEFM FREI LAURO SCHWARTE;RUA ANTÔNIO POMPEU, 2005;CENTRO;
2024;1;FORTALEZA;20777;PASTOR FLÁVIO SANTOS;113;123;124;1;EEFM FREI LAURO SCHWARTE;RUA ANTÔNIO POMPEU, 2005;CENTRO;
2024;1;FORTALEZA;20777;PASTOR FLÁVIO SANTOS;113;144;;1;ESC. EST. DE EDUC. PROFISSIONAL PAULO VI;RUA JORGE DUMMAR, 1841;JARDIM AMÉRICA;
2024;1;FORTALEZA;20777;PASTOR FLÁVIO SANTOS;113;152;;1;COLÉGIO MEDALHA MILAGROSA;RUA PADRE JOÃO PIAMARTA,  415;BOM FUTURO;
2024;1;FORTALEZA;20777;PASTOR FLÁVIO SANTOS;113;196;;1;EEFM DR.CÉSAR CALS;AV. DOMINGOS OLIMPIO, 1800;FARIAS BRITO;
2024;1;FORTALEZA;20777;PASTOR FLÁVIO SANTOS;113;316;;1;EEFM SANTO AFONSO;RUA GAL. BERNARDO FIGUEIREDO, 2670;PARQUELÂNDIA;
2024;1;FORTALEZA;20777;PASTOR FLÁVIO SANTOS;113;346;;1;ESCOLA ESTADUAL DE EDUCAÇÃO PROFISSIONAL JOAQUIM NOGUEIRA;RUA MOREIRA DE SOUSA, 327;PARQUELÂNDIA;
2024;1;FORTALEZA;20777;PASTOR FLÁVIO SANTOS;113;366;;1;COLÉGIO ESTADUAL PRESIDENTE HUMBERTO CASTELO BRANCO;RUA IRMA BAZET, 210;MONTESE;
2024;1;FORTALEZA;20777;PASTOR FLÁVIO SANTOS;113;403;;1;COLEGIO CWD-MAXIMUS;RUA DOM LINO, 301;PARQUELÂNDIA;
2024;1;FORTALEZA;20777;PASTOR FLÁVIO SANTOS;114;23;;1;SENAI - CENTRO DE FORMAÇÃO PROFISSIONAL;AVENIDA FRANCISCO SÁ 7221;BARRA DO CEARÁ;
2024;1;FORTALEZA;20777;PASTOR FLÁVIO SANTOS;114;66;;1;EM DOM HELDER CAMARA;RUA FREI ODILON 623 B;ÁLVARO WEYNE;
2024;1;FORTALEZA;20777;PASTOR FLÁVIO SANTOS;114;69;;1;EM DOM HELDER CAMARA;RUA FREI ODILON 623 B;ÁLVARO WEYNE;
2024;1;FORTALEZA;20777;PASTOR FLÁVIO SANTOS;114;154;;1;EEFM FERNANDO CAVALCANTE MOTA;RUA DA SALEMA 85;BARRA DO CEARÁ;
2024;1;FORTALEZA;20777;PASTOR FLÁVIO SANTOS;114;201;;1;EM GABRIEL CAVALCANTE;QUADRA F 167 CONJUNTO CASTELO BRANCO;PRESIDENTE KENNEDY;
2024;1;FORTALEZA;20777;PASTOR FLÁVIO SANTOS;114;227;;1;EM DOM ANTONIO BATISTA DE FRAGOSO;AVENIDA FRANCISCO SÁ 7945;BARRA DO CEARÁ;
2024;1;FORTALEZA;20777;PASTOR FLÁVIO SANTOS;114;232;;1;EM JADER DE FIGUEIREDO CORREIA;RUA TOCANDIRA 61;BARRA DO CEARÁ;
2024;1;FORTALEZA;20777;PASTOR FLÁVIO SANTOS;114;244;;1;CENTRO DE EDUCAÇÃO COMPLEMENTAR (CEDCE) - ANTIGO SESI;AVENIDA FRANCISCO SÁ 6623;BARRA DO CEARÁ;
2024;1;FORTALEZA;20777;PASTOR FLÁVIO SANTOS;114;251;;1;CENTRO DE EDUCAÇÃO COMPLEMENTAR (CEDCE) - ANTIGO SESI;AVENIDA FRANCISCO SÁ 6623;BARRA DO CEARÁ;
2024;1;FORTALEZA;20777;PASTOR FLÁVIO SANTOS;114;270;;1;EEEP PAULO PETROLA;RUA SAUDÁRIA, S/N - GOIABEIRAS;BARRA DO CEARÁ;
2024;1;FORTALEZA;20777;PASTOR FLÁVIO SANTOS;114;293;;2;EMTI PROFESSOR JOAQUIM FRANCISCO DE SOUSA FILHO;RUA JOAQUIM MARQUES, 13;PRESIDENTE KENNEDY;
2024;1;FORTALEZA;20777;PASTOR FLÁVIO SANTOS;115;22;;1;EEM  PROFESSORA DIVA CABRAL;RUA HOLANDA, 701;MARAPONGA;
2024;1;FORTALEZA;20777;PASTOR FLÁVIO SANTOS;115;23;;1;EEM  PROFESSORA DIVA CABRAL;RUA HOLANDA, 701;MARAPONGA;
2024;1;FORTALEZA;20777;PASTOR FLÁVIO SANTOS;115;26;;1;EEM  PROFESSORA DIVA CABRAL;RUA HOLANDA, 701;MARAPONGA;
2024;1;FORTALEZA;20777;PASTOR FLÁVIO SANTOS;115;29;;2;ESCOLA MARISTA SAGRADO CORAÇÃO;RUA VIDAL DE NEGREIROS, 550;JARDIM CEARENSE;
2024;1;FORTALEZA;20777;PASTOR FLÁVIO SANTOS;115;31;;1;EM THOMAZ POMPEU SOBRINHO;RUA JOSE MENELEU, 531;PARANGABA;
2024;1;FORTALEZA;20777;PASTOR FLÁVIO SANTOS;115;35;;2;EM THOMAZ POMPEU SOBRINHO;RUA JOSE MENELEU, 531;PARANGABA;
2024;1;FORTALEZA;20777;PASTOR FLÁVIO SANTOS;115;36;;1;EM THOMAZ POMPEU SOBRINHO;RUA JOSE MENELEU, 531;PARANGABA;
2024;1;FORTALEZA;20777;PASTOR FLÁVIO SANTOS;115;38;;1;UNIVERSIDADE ESTADUAL DO CEARA - UECE;AV DR. SILAS MUNGUBA, 1700;ITAPERI;
2024;1;FORTALEZA;20777;PASTOR FLÁVIO SANTOS;115;50;;1;UNIVERSIDADE ESTADUAL DO CEARA - UECE;AV DR. SILAS MUNGUBA, 1700;ITAPERI;
2024;1;FORTALEZA;20777;PASTOR FLÁVIO SANTOS;115;101;;1;EMTI CAROLINO SUCUPIRA;RUA MUNDICA PAULA, 670;PARANGABA;
2024;1;FORTALEZA;20777;PASTOR FLÁVIO SANTOS;115;117;;2;DETRAN;AV GODOFREDO MACIEL, 2900;MARAPONGA;
2024;1;FORTALEZA;20777;PASTOR FLÁVIO SANTOS;115;121;;1;DETRAN;AV GODOFREDO MACIEL, 2900;MARAPONGA;
2024;1;FORTALEZA;20777;PASTOR FLÁVIO SANTOS;115;130;;1;COLEGIO PROVECTO;RUA SUIÇA, 76;MARAPONGA;
2024;1;FORTALEZA;20777;PASTOR FLÁVIO SANTOS;115;131;;1;COLEGIO PROVECTO;RUA SUIÇA, 76;MARAPONGA;
2024;1;FORTALEZA;20777;PASTOR FLÁVIO SANTOS;115;167;;1;EEMTI JOAO MATTOS;RUA ALMIRANTE RUBIM, 1014;MONTESE;
2024;1;FORTALEZA;20777;PASTOR FLÁVIO SANTOS;115;173;;1;EEMTI JOAO MATTOS;RUA ALMIRANTE RUBIM, 1014;MONTESE;
2024;1;FORTALEZA;20777;PASTOR FLÁVIO SANTOS;115;190;;1;EEMTI MARIA THOMÁSIA;RUA POLONIA, 369;PARANGABA;
2024;1;FORTALEZA;20777;PASTOR FLÁVIO SANTOS;115;263;;2;EM JOÃO ESTANISLAU FAÇANHA;RUA ONZE, S/N - CONJUNTO CAMPO DOS INGLESES;JARDIM CEARENSE;
2024;1;FORTALEZA;20777;PASTOR FLÁVIO SANTOS;115;286;;1;EM JOÃO ESTANISLAU FAÇANHA;RUA ONZE, S/N - CONJUNTO CAMPO DOS INGLESES;JARDIM CEARENSE;
2024;1;FORTALEZA;20777;PASTOR FLÁVIO SANTOS;115;300;;1;ESCOLA MARISTA SAGRADO CORAÇÃO;RUA VIDAL DE NEGREIROS, 550;JARDIM CEARENSE;
2024;1;FORTALEZA;20777;PASTOR FLÁVIO SANTOS;115;306;;2;EM JOÃO ESTANISLAU FAÇANHA;RUA ONZE, S/N - CONJUNTO CAMPO DOS INGLESES;JARDIM CEARENSE;
2024;1;FORTALEZA;20777;PASTOR FLÁVIO SANTOS;115;308;;1;EM THOMAZ POMPEU SOBRINHO;RUA JOSE MENELEU, 531;PARANGABA;
2024;1;FORTALEZA;20777;PASTOR FLÁVIO SANTOS;115;312;;1;UNIVERSIDADE ESTADUAL DO CEARA - UECE;AV DR. SILAS MUNGUBA, 1700;ITAPERI;
2024;1;FORTALEZA;20777;PASTOR FLÁVIO SANTOS;115;313;;1;ESCOLA MARISTA SAGRADO CORAÇÃO;RUA VIDAL DE NEGREIROS, 550;JARDIM CEARENSE;
2024;1;FORTALEZA;20777;PASTOR FLÁVIO SANTOS;115;314;;2;EEM  PROFESSORA DIVA CABRAL;RUA HOLANDA, 701;MARAPONGA;
2024;1;FORTALEZA;20777;PASTOR FLÁVIO SANTOS;115;328;;1;EM JOÃO ESTANISLAU FAÇANHA;RUA ONZE, S/N - CONJUNTO CAMPO DOS INGLESES;JARDIM CEARENSE;
2024;1;FORTALEZA;20777;PASTOR FLÁVIO SANTOS;115;330;;1;COLÉGIO LOURENÇO FILHO - PARANGABA;RUA CÔNEGO DE CASTRO 700;PARANGABA;
2024;1;FORTALEZA;20777;PASTOR FLÁVIO SANTOS;115;363;;1;EM CATULO DA PAIXAO CEARENSE;RUA LEAO DO NORTE 300;VILA PERI;
2024;1;FORTALEZA;20777;PASTOR FLÁVIO SANTOS;115;364;;1;EM CATULO DA PAIXAO CEARENSE;RUA LEAO DO NORTE 300;VILA PERI;
2024;1;FORTALEZA;20777;PASTOR FLÁVIO SANTOS;115;366;;1;EM CATULO DA PAIXAO CEARENSE;RUA LEAO DO NORTE 300;VILA PERI;
2024;1;FORTALEZA;20777;PASTOR FLÁVIO SANTOS;115;374;;1;EEMTI GENERAL EUDORO CORREA;RUA JULIO BRAGA 101;PARANGABA;
2024;1;FORTALEZA;20777;PASTOR FLÁVIO SANTOS;115;396;;1;COLEGIO JIM WILLSON;AV. AUGUSTO DOS ANJOS, 1915;VILA PERI;
2024;1;FORTALEZA;20777;PASTOR FLÁVIO SANTOS;115;397;;1;COLEGIO JIM WILLSON;AV. AUGUSTO DOS ANJOS, 1915;VILA PERI;
2024;1;FORTALEZA;20777;PASTOR FLÁVIO SANTOS;115;413;;1;COLEGIO GURI  SENIOR;RUA CONEGO DE CASTRO 1780;PARANGABA;
2024;1;FORTALEZA;20777;PASTOR FLÁVIO SANTOS;115;422;;1;CENTRO DE EDUCAÇÃO PEDAGÓGICO EÇA DE QUEIROZ;RUA DOM XISTO ALBANO 611;VILA PERI;
2024;1;FORTALEZA;20777;PASTOR FLÁVIO SANTOS;115;425;;1;CENTRO DE EDUCAÇÃO PEDAGÓGICO EÇA DE QUEIROZ;RUA DOM XISTO ALBANO 611;VILA PERI;
2024;1;FORTALEZA;20777;PASTOR FLÁVIO SANTOS;115;431;;1;CENTRO DE EDUCAÇÃO PEDAGÓGICO EÇA DE QUEIROZ;RUA DOM XISTO ALBANO 611;VILA PERI;
