2024;1;FORTALEZA;20777;PASTOR FLÁVIO SANTOS;117;461;;4;COLÉGIO VENCER;RUA JARDIM PARUARA, 1108;SIQUEIRA;
2024;1;FORTALEZA;20777;PASTOR FLÁVIO SANTOS;117;462;;1;EEEP DARCY RIBEIRO;RUA CONEGO DE CASTRO, S/N;CONJUNTO ESPERANÇA;
2024;1;FORTALEZA;20777;PASTOR FLÁVIO SANTOS;117;464;;2;EEFM SÃO FRANCISCO DE ASSIS;RUA SÃO FELIPE, 564;CANINDEZINHO;
2024;1;FORTALEZA;20777;PASTOR FLÁVIO SANTOS;117;465;;1;COLÉGIO VENCER;RUA JARDIM PARUARA, 1108;SIQUEIRA;
2024;1;FORTALEZA;20777;PASTOR FLÁVIO SANTOS;117;468;;7;CEI FRANCISCA DE ABREU LIMA;RUA C -  ESQUINA COM A RUA LUIZ MONTENEGRO, S/N;SIQUEIRA;
2024;1;FORTALEZA;20777;PASTOR FLÁVIO SANTOS;117;469;;7;ESCOLA MUNICIPAL PROF JOSE CÍRIO PEREIRA FILHO;RUA QUARTZO ROSA, 100;SIQUEIRA;
2024;1;FORTALEZA;20777;PASTOR FLÁVIO SANTOS;117;474;491;5;EMTI PROFESSOR AGERSON TABOSA PINTO;RUA WILCA ALBUQUERQUE, S/N;SIQUEIRA;
2024;1;FORTALEZA;20777;PASTOR FLÁVIO SANTOS;117;479;;7;ESCOLA MUNICIPAL PROF JOSE CÍRIO PEREIRA FILHO;RUA QUARTZO ROSA, 100;SIQUEIRA;
2024;1;FORTALEZA;20777;PASTOR FLÁVIO SANTOS;117;480;;3;CEI FRANCISCA DE ABREU LIMA;RUA C -  ESQUINA COM A RUA LUIZ MONTENEGRO, S/N;SIQUEIRA;
2024;1;FORTALEZA;20777;PASTOR FLÁVIO SANTOS;117;481;489;1;CENTRO EDUCACIONAL JERUSALÉM;RUA SÃO FELIPE, 1345;CANINDEZINHO;
2024;1;FORTALEZA;20777;PASTOR FLÁVIO SANTOS;117;482;;3;COLÉGIO VENCER;RUA JARDIM PARUARA, 1108;SIQUEIRA;
2024;1;FORTALEZA;20777;PASTOR FLÁVIO SANTOS;118;14;;1;EM SANTA TEREZINHA;RUA AFONSO LOPES, 1095;PARQUE DOIS IRMÃOS;
2024;1;FORTALEZA;20777;PASTOR FLÁVIO SANTOS;118;16;;1;EM SANTA TEREZINHA;RUA AFONSO LOPES, 1095;PARQUE DOIS IRMÃOS;
2024;1;FORTALEZA;20777;PASTOR FLÁVIO SANTOS;118;235;;1;EM DOUTOR ABDENAGO DA ROCHA LIMA;RUA 114, 75 (CJ TUPAN MIRIM);PARQUE DOIS IRMÃOS;
2024;1;FORTALEZA;20777;PASTOR FLÁVIO SANTOS;118;268;;1;COLÉGIO MARIA ESTER I;RUA ANTONIO TEIXEIRA LEITE, 248;SERRINHA;
2024;1;FORTALEZA;20777;PASTOR FLÁVIO SANTOS;118;271;;1;COLÉGIO MARIA ESTER I;RUA ANTONIO TEIXEIRA LEITE, 248;SERRINHA;
2024;1;FORTALEZA;20777;PASTOR FLÁVIO SANTOS;118;380;;1;EM PAULO SERGIO DE SOUSA LIRA;RUA ITABORAÍ, 264;PASSARÉ;
2024;1;FORTALEZA;20777;PASTOR FLÁVIO SANTOS;118;420;;1;EM PROFESSORA MARIA JOSÉ MACÁRIO COELHO;AVENIDA PASSARÉ, 530;PASSARÉ;
2024;1;FORTALEZA;20777;PASTOR FLÁVIO SANTOS;118;454;;1;EM DELMA HERMÍNIA DA SILVA PEREIRA;AVENIDA PRESIDENTE COSTA E SILVA, 5606;PASSARÉ;
2024;1;FORTALEZA;20777;PASTOR FLÁVIO SANTOS;118;526;;1;EM DELMA HERMÍNIA DA SILVA PEREIRA;AVENIDA PRESIDENTE COSTA E SILVA, 5606;PASSARÉ;
2024;1;FORTALEZA;20777;PASTOR FLÁVIO SANTOS;118;546;;1;EMEF ODILON GONZAGA BRAVEZA;AV. ALBERTO CRAVEIRO, 1480 C;BOA VISTA-CASTELÃO;
2024;1;FORTALEZA;20777;PASTOR FLÁVIO SANTOS;118;551;;1;EM PROFESSOR JACINTO BOTELHO;RUA DR. RODRIGO CODES SANDOVAL, 374;MONDUBIM;
2024;1;FORTALEZA;20777;PASTOR FLÁVIO SANTOS;118;624;;1;EM FRANCISCO ANDRADE TEOFILO GIRAO;RUA UNIDOS VENCEREMOS, 2040;PASSARÉ;
2024;1;FORTALEZA;20777;PASTOR FLÁVIO SANTOS;118;649;;1;EM DOUTOR ABDENAGO DA ROCHA LIMA;RUA 114, 75 (CJ TUPAN MIRIM);PARQUE DOIS IRMÃOS;
2024;1;FORTALEZA;20777;PASTOR FLÁVIO SANTOS;118;651;;1;EM PROFESSORA MARIA STELLA COCHRANE SANTIAGO;RUA ANTONIO FARIAS, 121;BOA VISTA-CASTELÃO;
2024;1;FORTALEZA;20777;PASTOR FLÁVIO SANTOS;118;664;;1;EM DELMA HERMÍNIA DA SILVA PEREIRA;AVENIDA PRESIDENTE COSTA E SILVA, 5606;PASSARÉ;
2024;1;FORTALEZA;20777;PASTOR FLÁVIO SANTOS;118;668;;1;EEMTI DEPUTADO PAULINO ROCHA;RUA PROFESSOR JOSE SILVEIRA, 528;PASSARÉ;
2024;1;FORTALEZA;20777;PASTOR FLÁVIO SANTOS;118;672;;1;COLÉGIO SÃO LUCAS;RUA JOSÉ DA FRANCA CABRAL, 748;BOA VISTA-CASTELÃO;
TOTAL;;;;;;;;626;
