Ano;Turno;Município;Número;Candidato;Zona;Seção;Seções Agregadas;Votos;Local de Votação;Endereço Local de Votação;Bairro;
2024;1;FORTALEZA;50100;PROF FABIANO AUTISTA;1;349;;1;ESCOLA MUNICIPAL JOSE RAMOS TORRES DE MELO;AVENIDA DA ABOLIÇÃO 3984;MUCURIPE;
2024;1;FORTALEZA;50100;PROF FABIANO AUTISTA;1;469;;1;ESCOLA ESTADUAL MARIA JOSE MEDEIROS;RUA DESEMBARGADOR LAURO NOGUEIRA 1240;PAPICU;
2024;1;FORTALEZA;50100;PROF FABIANO AUTISTA;1;878;;1;FACULDADE FARIAS BRITO - CASTRO MONTE;RUA CASTRO MONTE 1364;VARJOTA;
2024;1;FORTALEZA;50100;PROF FABIANO AUTISTA;1;885;;1;FANOR - FACULDADE NORDESTE;AVENIDA SANTOS DUMONT 7800;DE LOURDES;
2024;1;FORTALEZA;50100;PROF FABIANO AUTISTA;1;905;;2;FANOR - FACULDADE NORDESTE;AVENIDA SANTOS DUMONT 7800;DE LOURDES;
2024;1;FORTALEZA;50100;PROF FABIANO AUTISTA;1;926;;1;FANOR - FACULDADE NORDESTE;AVENIDA SANTOS DUMONT 7800;DE LOURDES;
2024;1;FORTALEZA;50100;PROF FABIANO AUTISTA;2;76;;1;EEEP JOSE DE BARCELOS;RUA ANGELICA GURGEL 362;MESSEJANA;
2024;1;FORTALEZA;50100;PROF FABIANO AUTISTA;2;140;;1;EEM LICEU DE MESSEJANA;AVENIDA WASHINGTON SOARES 7702;MESSEJANA;
2024;1;FORTALEZA;50100;PROF FABIANO AUTISTA;2;391;;1;EEFM IRACEMA;RUA EGIDIO DE OLIVEIRA, 250;JOSÉ DE ALENCAR;
2024;1;FORTALEZA;50100;PROF FABIANO AUTISTA;2;499;;1;EM PROFª FERNANDA MARIA DE ALENCAR COLARES;AV PROF. ARTHUR DE CARVALHO, 1540;LAGOA REDONDA;
2024;1;FORTALEZA;50100;PROF FABIANO AUTISTA;2;552;;1;EM PROFª FERNANDA MARIA DE ALENCAR COLARES;AV PROF. ARTHUR DE CARVALHO, 1540;LAGOA REDONDA;
2024;1;FORTALEZA;50100;PROF FABIANO AUTISTA;2;732;;1;CMES PROFª TEREZINHA FERREIRA PARENTE;RUA NELSON COELHO, 209;LAGOA REDONDA;
2024;1;FORTALEZA;50100;PROF FABIANO AUTISTA;2;806;;1;ESCOLA MUNICIPAL ISABEL FERREIRA;RUA ISABEL FERREIRA, 1000 - CONJ. CURIÓ;LAGOA REDONDA;
2024;1;FORTALEZA;50100;PROF FABIANO AUTISTA;3;219;220;1;FAC. ESTÁCIO - UNIDADE CENTRO (ANTIGO COLÉGIO CEARENSE);AV. DUQUE DE CAXIAS, 101;CENTRO;
2024;1;FORTALEZA;50100;PROF FABIANO AUTISTA;3;241;261;2;COLÉGIO ESTADUAL JUSTINIANO DE SERPA;AV. SANTOS DUMONT, 56;CENTRO;
2024;1;FORTALEZA;50100;PROF FABIANO AUTISTA;3;279;;1;EM SÃO RAFAEL;RUA DOS TABAJARAS, 244;PRAIA DE IRACEMA;
2024;1;FORTALEZA;50100;PROF FABIANO AUTISTA;3;283;;1;EM SÃO RAFAEL;RUA DOS TABAJARAS, 244;PRAIA DE IRACEMA;
2024;1;FORTALEZA;50100;PROF FABIANO AUTISTA;3;536;;1;EEFM SANTA LUZIA;RUA JOÃO CORDEIRO, 711;PRAIA DE IRACEMA;
2024;1;FORTALEZA;50100;PROF FABIANO AUTISTA;3;579;;1;ESCOLA DE SAÚDE PÚBLICA DO CEARÁ;AV. ANTÔNIO JUSTA, 3161;MEIRELES;
2024;1;FORTALEZA;50100;PROF FABIANO AUTISTA;3;587;;1;ESCOLA DE SAÚDE PÚBLICA DO CEARÁ;AV. ANTÔNIO JUSTA, 3161;MEIRELES;
2024;1;FORTALEZA;50100;PROF FABIANO AUTISTA;3;617;;2;ESCOLA DE SAÚDE PÚBLICA - NEPE (ANEXO);AV. ANTÔNIO JUSTA, 3161;MEIRELES;
2024;1;FORTALEZA;50100;PROF FABIANO AUTISTA;80;118;;1;EEM YOLANDA QUEIROZ;AV. GAL. MURILO BORGES, 864;ALTO DA BALANÇA;
2024;1;FORTALEZA;50100;PROF FABIANO AUTISTA;80;123;;1;EEFM ESTADO DO PARÁ;RUA DJALMA PETIT 589;ALTO DA BALANÇA;
2024;1;FORTALEZA;50100;PROF FABIANO AUTISTA;80;131;;1;EM PROFESSORA EDITH BRAGA;RUA CAPITAO VASCONCELOS 1061;ALTO DA BALANÇA;
2024;1;FORTALEZA;50100;PROF FABIANO AUTISTA;80;136;;1;EEFM JOAQUIM ANTÔNIO ALBANO;RUA JULIO SIQUEIRA 390;DIONISIO TORRES;
2024;1;FORTALEZA;50100;PROF FABIANO AUTISTA;80;169;;1;COLÉGIO MONSENHOR JOVINIANO BARRETO;RUA FREI VIDAL 1621;TAUAPE;
2024;1;FORTALEZA;50100;PROF FABIANO AUTISTA;80;178;;1;CENTRO EDUC. DA JUV. PE. JOÃO PIAMARTA - AGUANAMBI;AV. AGUANAMBI, 2479;FÁTIMA;
2024;1;FORTALEZA;50100;PROF FABIANO AUTISTA;80;180;;1;CENTRO EDUC. DA JUV. PE. JOÃO PIAMARTA - AGUANAMBI;AV. AGUANAMBI, 2479;FÁTIMA;
2024;1;FORTALEZA;50100;PROF FABIANO AUTISTA;80;191;;1;COLÉGIO NOSSA SENHORA DAS GRAÇAS;RUA MONSENHOR OTÁVIO DE CASTRO, 535;FÁTIMA;
2024;1;FORTALEZA;50100;PROF FABIANO AUTISTA;80;193;;1;COLÉGIO NOSSA SENHORA DAS GRAÇAS;RUA MONSENHOR OTÁVIO DE CASTRO, 535;FÁTIMA;
2024;1;FORTALEZA;50100;PROF FABIANO AUTISTA;80;324;;1;COLÉGIO SANTO INACIO;AVENIDA DESEMBARGADOR MOREIRA 2355;DIONISIO TORRES;
2024;1;FORTALEZA;50100;PROF FABIANO AUTISTA;80;398;;1;EEM GOV. ADAUTO BEZERRA;RUA MONSENHOR LIBERATO, 1850;FÁTIMA;
2024;1;FORTALEZA;50100;PROF FABIANO AUTISTA;82;85;;1;ESCOLA MUNICIPAL SEBASTIANA ALDIGUERI;AV. DOUTOR THEBERGE, 448;CRISTO REDENTOR;
2024;1;FORTALEZA;50100;PROF FABIANO AUTISTA;82;255;;1;CEJA PAULO FREIRE;RUA OLAVO BILAC, 1300;SÃO GERARDO;
2024;1;FORTALEZA;50100;PROF FABIANO AUTISTA;83;3;;1;COLÉGIO DA POLÍCIA MILITAR DO CEARÁ GENERAL EDGARD FACÓ;AVENIDA MISTER HULL,  S/N - KM 1;ANTÔNIO BEZERRA;
2024;1;FORTALEZA;50100;PROF FABIANO AUTISTA;83;16;;1;ESCOLA MUNICIPAL DOM JOSÉ TUPINAMBA DA FROTA;RUA VIRIATO RIBEIRO 1031;BELA VISTA;
2024;1;FORTALEZA;50100;PROF FABIANO AUTISTA;83;28;;1;ESCOLA MUNICIPAL NILSON HOLANDA;RUA VIRIATO RIBEIRO 1355;BELA VISTA;
2024;1;FORTALEZA;50100;PROF FABIANO AUTISTA;83;33;;1;EEMTI ESTADO DO AMAZONAS;RUA MONSENHOR FURTADO 2327;BELA VISTA;
2024;1;FORTALEZA;50100;PROF FABIANO AUTISTA;83;61;;1;EEMTI SENADOR FERNANDES TÁVORA;RUA GOIÁS 141;BELA VISTA;
2024;1;FORTALEZA;50100;PROF FABIANO AUTISTA;83;67;;1;EEFM JOAQUIM ALVES;RUA ESTADO DO RIO 955;DEMOCRITO ROCHA;
2024;1;FORTALEZA;50100;PROF FABIANO AUTISTA;83;124;;1;EEMTI ANTONIETA SIQUEIRA;RUA GUARANI 04;HENRIQUE JORGE;
2024;1;FORTALEZA;50100;PROF FABIANO AUTISTA;83;134;;1;ESCOLA MUNICIPAL PRESIDENTE KENNEDY;AV. LINEU MACHADO 811;JÓQUEI CLUBE;
2024;1;FORTALEZA;50100;PROF FABIANO AUTISTA;83;155;;1;CENTRO DE FORMAÇÃO E DESENV. PARA PROFISSIONAIS DA EDUCAÇÃO - FORMACE;RUA PORTO VELHO, 401;JOÃO XXIII;
2024;1;FORTALEZA;50100;PROF FABIANO AUTISTA;83;165;;2;EEFM HERACLITO DE CASTRO E SILVA;RUA SILVEIRA FILHO, 808;JÓQUEI CLUBE;
2024;1;FORTALEZA;50100;PROF FABIANO AUTISTA;83;239;;1;ESCOLA MUNICIPAL JOSÉ BATISTA DE OLIVEIRA;RUA GOIÁS 620;PANAMERICANO;
2024;1;FORTALEZA;50100;PROF FABIANO AUTISTA;83;243;;1;EEFM ANISIO TEIXEIRA;RUA RIO GRANDE DO SUL 680;PANAMERICANO;
2024;1;FORTALEZA;50100;PROF FABIANO AUTISTA;83;245;;1;EEFM ANISIO TEIXEIRA;RUA RIO GRANDE DO SUL 680;PANAMERICANO;
2024;1;FORTALEZA;50100;PROF FABIANO AUTISTA;83;247;;1;EEFM ANISIO TEIXEIRA;RUA RIO GRANDE DO SUL 680;PANAMERICANO;
2024;1;FORTALEZA;50100;PROF FABIANO AUTISTA;83;320;;1;ESCOLA MUNICIPAL JOSÉ BONIFÁCIO DE SOUSA;RUA PERNAMBUCO 600;DEMOCRITO ROCHA;
2024;1;FORTALEZA;50100;PROF FABIANO AUTISTA;83;324;;1;ESCOLA MUNICIPAL JOSÉ BONIFÁCIO DE SOUSA;RUA PERNAMBUCO 600;DEMOCRITO ROCHA;
2024;1;FORTALEZA;50100;PROF FABIANO AUTISTA;83;436;;1;EEMTI SENADOR FERNANDES TÁVORA;RUA GOIÁS 141;BELA VISTA;
2024;1;FORTALEZA;50100;PROF FABIANO AUTISTA;83;451;;1;ESCOLA MUNICIPAL SANTA MARIA;RUA CUIABÁ 1465;HENRIQUE JORGE;
2024;1;FORTALEZA;50100;PROF FABIANO AUTISTA;83;456;;1;ESCOLA MUNICIPAL PAULO SARASATE;RUA PEDRO MUNIZ 250;DEMOCRITO ROCHA;
2024;1;FORTALEZA;50100;PROF FABIANO AUTISTA;83;462;;1;CENTRO DE FORMAÇÃO E DESENV. PARA PROFISSIONAIS DA EDUCAÇÃO - FORMACE;RUA PORTO VELHO, 401;JOÃO XXIII;
2024;1;FORTALEZA;50100;PROF FABIANO AUTISTA;83;463;;1;ESCOLA MUNICIPAL JOSÉ BATISTA DE OLIVEIRA;RUA GOIÁS 620;PANAMERICANO;
2024;1;FORTALEZA;50100;PROF FABIANO AUTISTA;83;475;;1;ESCOLA MUNICIPAL JOSÉ BATISTA DE OLIVEIRA;RUA GOIÁS 620;PANAMERICANO;
2024;1;FORTALEZA;50100;PROF FABIANO AUTISTA;83;530;;1;CENTRO DE FORMAÇÃO E DESENV. PARA PROFISSIONAIS DA EDUCAÇÃO - FORMACE;RUA PORTO VELHO, 401;JOÃO XXIII;
2024;1;FORTALEZA;50100;PROF FABIANO AUTISTA;83;561;;2;ESCOLA MUNICIPAL JOSÉ BATISTA DE OLIVEIRA;RUA GOIÁS 620;PANAMERICANO;
2024;1;FORTALEZA;50100;PROF FABIANO AUTISTA;83;579;;1;CENTRO DE FORMAÇÃO E DESENV. PARA PROFISSIONAIS DA EDUCAÇÃO - FORMACE;RUA PORTO VELHO, 401;JOÃO XXIII;
2024;1;FORTALEZA;50100;PROF FABIANO AUTISTA;83;583;;3;ESCOLA MUNICIPAL JOSÉ BATISTA DE OLIVEIRA;RUA GOIÁS 620;PANAMERICANO;
2024;1;FORTALEZA;50100;PROF FABIANO AUTISTA;83;588;;1;ESCOLA MUNICIPAL SANTA MARIA;RUA CUIABÁ 1465;HENRIQUE JORGE;
2024;1;FORTALEZA;50100;PROF FABIANO AUTISTA;83;591;;1;CENTRO EDUCACIONAL SÃO SEBASTIÃO;RUA GUANABARA 1003;DEMOCRITO ROCHA;
2024;1;FORTALEZA;50100;PROF FABIANO AUTISTA;83;609;;1;EEEP JÚLIA GIFFONI;RUA CORONEL MATOS DOURADO 1349;PICI;
2024;1;FORTALEZA;50100;PROF FABIANO AUTISTA;83;627;;2;EEMTI ESTADO DO AMAZONAS;RUA MONSENHOR FURTADO 2327;BELA VISTA;
2024;1;FORTALEZA;50100;PROF FABIANO AUTISTA;83;628;;1;COLÉGIO LUCÊ;RUA CUIABA 155;JÓQUEI CLUBE;
2024;1;FORTALEZA;50100;PROF FABIANO AUTISTA;83;638;;1;ESCOLA MUNICIPAL ADROALDO TEIXEIRA CASTELO;RUA ALAGOAS 2267;PICI;
2024;1;FORTALEZA;50100;PROF FABIANO AUTISTA;83;683;;1;ESCOLA MUNICIPAL DONA DAGMAR GENTIL;RUA VITORIA 1750;HENRIQUE JORGE;
2024;1;FORTALEZA;50100;PROF FABIANO AUTISTA;83;689;;1;ESCOLA MUNICIPAL ADROALDO TEIXEIRA CASTELO;RUA ALAGOAS 2267;PICI;
2024;1;FORTALEZA;50100;PROF FABIANO AUTISTA;83;691;;1;CENTRO EDUCACIONAL BRASILEIRINHO;AVENIDA SENADOR FERNANDES TÁVORA, 1717;HENRIQUE JORGE;
2024;1;FORTALEZA;50100;PROF FABIANO AUTISTA;83;699;;1;ESCOLA MUNICIPAL PROFESSORA MARIA LIDUÍNA CORREA LEITE;RUA FERNÃO MAGALHÃES, 120;PICI;
2024;1;FORTALEZA;50100;PROF FABIANO AUTISTA;83;700;;1;ESCOLA MUNICIPAL DONA DAGMAR GENTIL;RUA VITORIA 1750;HENRIQUE JORGE;
2024;1;FORTALEZA;50100;PROF FABIANO AUTISTA;83;707;;2;EEMTI ANTONIETA SIQUEIRA;RUA GUARANI 04;HENRIQUE JORGE;
2024;1;FORTALEZA;50100;PROF FABIANO AUTISTA;83;710;;1;ESCOLA MUNICIPAL ADROALDO TEIXEIRA CASTELO;RUA ALAGOAS 2267;PICI;
2024;1;FORTALEZA;50100;PROF FABIANO AUTISTA;83;728;;1;COLÉGIO PROFESSORA JEMINA GÓIS;RUA GUANABARA, 627;DEMOCRITO ROCHA;
2024;1;FORTALEZA;50100;PROF FABIANO AUTISTA;83;736;;1;EEMTI SENADOR FERNANDES TÁVORA;RUA GOIÁS 141;BELA VISTA;
2024;1;FORTALEZA;50100;PROF FABIANO AUTISTA;83;739;;1;ESCOLA MUNICIPAL PROFESSORA MARIA LIDUÍNA CORREA LEITE;RUA FERNÃO MAGALHÃES, 120;PICI;
2024;1;FORTALEZA;50100;PROF FABIANO AUTISTA;83;752;;1;EEMTI ANTONIETA SIQUEIRA;RUA GUARANI 04;HENRIQUE JORGE;
2024;1;FORTALEZA;50100;PROF FABIANO AUTISTA;85;150;;1;EEF GOVERNADOR FAUSTINO ALBUQUERQUE - UV1;RUA 143 N 155 - 1 ETAPA;CONJUNTO CEARÁ I;
2024;1;FORTALEZA;50100;PROF FABIANO AUTISTA;85;167;;1;INSTITUTO EDUCACIONAL JOSE DE ALENCAR;RUA HUGO VITOR 730;ANTÔNIO BEZERRA;
2024;1;FORTALEZA;50100;PROF FABIANO AUTISTA;85;174;;1;EEFM MARIO HUGO CIDRAK DO VALE;RUA DR. PERIGUARI, 547;ANTÔNIO BEZERRA;
2024;1;FORTALEZA;50100;PROF FABIANO AUTISTA;85;215;;1;ESCOLA MUNICIPAL PROF AMERICO BARREIRA;RUA RICARDO PONTES 529;GENIBAÚ;
2024;1;FORTALEZA;50100;PROF FABIANO AUTISTA;85;290;;1;EMEIF GERARDO MILTON DE SA;RUA VALE COSTA S/N;ANTÔNIO BEZERRA;
2024;1;FORTALEZA;50100;PROF FABIANO AUTISTA;85;299;;1;EEFM ANTONIO BEZERRA;RUA PADRE PERDIGAO SAMPAIO 780;ANTÔNIO BEZERRA;
2024;1;FORTALEZA;50100;PROF FABIANO AUTISTA;85;306;;2;EEFM ANTONIO BEZERRA;RUA PADRE PERDIGAO SAMPAIO 780;ANTÔNIO BEZERRA;
2024;1;FORTALEZA;50100;PROF FABIANO AUTISTA;85;327;;1;EEFM DR UBIRAJARA INDIO DO CEARA - UV-7A;RUA SETECENTOS E CINQUENTA E UM, 192, 3A ETAPA;CONJUNTO CEARÁ I;
2024;1;FORTALEZA;50100;PROF FABIANO AUTISTA;85;331;;1;COLÉGIO ESSENCIAL;RUA PEDRO MELO, 1005;ANTÔNIO BEZERRA;
2024;1;FORTALEZA;50100;PROF FABIANO AUTISTA;85;395;;1;ESCOLA MUNICIPAL DEP JOAO FREDERICO FERREIRA GOMES;RUA JOSE MENDONCA 1160;GENIBAÚ;
2024;1;FORTALEZA;50100;PROF FABIANO AUTISTA;93;81;;1;EM RACHEL DE QUEIROZ;AVENIDA C, S/N - II ETAPA;PREFEITO JOSÉ WALTER;
2024;1;FORTALEZA;50100;PROF FABIANO AUTISTA;93;182;;1;EEFM ESTADO DO MARANHAO;RUA CARLOS PIMENTA,506;MONDUBIM;
2024;1;FORTALEZA;50100;PROF FABIANO AUTISTA;93;261;;1;CENTRO EDUCACIONAL BRAGA GUERRA;RUA D, N 414;MONDUBIM;
2024;1;FORTALEZA;50100;PROF FABIANO AUTISTA;93;282;;2;EEEP PROFESSOR ONELIO PORTO;AVENIDA E, 471 - II ETAPA;PREFEITO JOSÉ WALTER;
2024;1;FORTALEZA;50100;PROF FABIANO AUTISTA;94;7;;1;EEMTI MARIA JOSÉ SANTOS FERREIRA GOMES;RUA DONA LUCIA PINHEIRO, 93;QUINTINO CUNHA;
2024;1;FORTALEZA;50100;PROF FABIANO AUTISTA;94;10;;1;EEMTI MARIA JOSÉ SANTOS FERREIRA GOMES;RUA DONA LUCIA PINHEIRO, 93;QUINTINO CUNHA;
2024;1;FORTALEZA;50100;PROF FABIANO AUTISTA;94;37;;1;EMTI JOSÉ CARLOS DE OLIVEIRA NETO;R. SAO VICENTE DE PAULO, 170;ANTÔNIO BEZERRA;
2024;1;FORTALEZA;50100;PROF FABIANO AUTISTA;94;38;;1;EMTI JOSÉ CARLOS DE OLIVEIRA NETO;R. SAO VICENTE DE PAULO, 170;ANTÔNIO BEZERRA;
2024;1;FORTALEZA;50100;PROF FABIANO AUTISTA;94;445;;1;EEMTI MARIA JOSÉ SANTOS FERREIRA GOMES;RUA DONA LUCIA PINHEIRO, 93;QUINTINO CUNHA;
2024;1;FORTALEZA;50100;PROF FABIANO AUTISTA;94;574;;1;EEMTI MARIA JOSÉ SANTOS FERREIRA GOMES;RUA DONA LUCIA PINHEIRO, 93;QUINTINO CUNHA;
2024;1;FORTALEZA;50100;PROF FABIANO AUTISTA;94;767;;1;CEI MARIA MARIZA MENDES DE CARVALHO;RUA RAIMUNDO CUNHA 1174;VILA VELHA;
2024;1;FORTALEZA;50100;PROF FABIANO AUTISTA;94;804;;1;COLÉGIO CÍCERO NOGUEIRA (CCN);RUA PARAMBU, 668;VILA VELHA;
2024;1;FORTALEZA;50100;PROF FABIANO AUTISTA;94;851;;1;ASSOC DOS MORADORES DO CONJ DOS BANCARIOS;RUA 27 1630;VILA VELHA;
2024;1;FORTALEZA;50100;PROF FABIANO AUTISTA;94;904;;1;COLEGIO DOM FELIPE - JUNIOR;RUA FRANCISCO MENDES DE OLIVEIRA, 183;QUINTINO CUNHA;
2024;1;FORTALEZA;50100;PROF FABIANO AUTISTA;94;933;;1;CEI MARIA MARIZA MENDES DE CARVALHO;RUA RAIMUNDO CUNHA 1174;VILA VELHA;
2024;1;FORTALEZA;50100;PROF FABIANO AUTISTA;95;195;;1;EM TRISTÃO DE ALENCAR;RUA JOSE NOGUEIRA, 69;PEDRAS;
2024;1;FORTALEZA;50100;PROF FABIANO AUTISTA;95;292;;1;EMEIEF MARTHA DOS MARTINS COELHO GUILHERME;RUA 313, 243, CONJUNTO SÃO CRISTÓVÃO;JANGURUSSU;
2024;1;FORTALEZA;50100;PROF FABIANO AUTISTA;112;41;;1;CENTRO DE EDUCAÇÃO INFANTIL(CEI) MARIA DE LOURDES RIBEIRO JEREISSATI;RUA 1, 930 - CONJ. TANCREDO NEVES;JARDIM DAS OLIVEIRAS;
2024;1;FORTALEZA;50100;PROF FABIANO AUTISTA;112;42;;1;CENTRO DE EDUCAÇÃO INFANTIL(CEI) MARIA DE LOURDES RIBEIRO JEREISSATI;RUA 1, 930 - CONJ. TANCREDO NEVES;JARDIM DAS OLIVEIRAS;
2024;1;FORTALEZA;50100;PROF FABIANO AUTISTA;112;44;;1;CENTRO DE EDUCAÇÃO INFANTIL(CEI) MARIA DE LOURDES RIBEIRO JEREISSATI;RUA 1, 930 - CONJ. TANCREDO NEVES;JARDIM DAS OLIVEIRAS;
2024;1;FORTALEZA;50100;PROF FABIANO AUTISTA;112;99;;1;EM ISMAEL PORDEUS;RUA DES FAUSTINO ALBUQUERQUE, 511;JARDIM DAS OLIVEIRAS;
2024;1;FORTALEZA;50100;PROF FABIANO AUTISTA;112;101;;2;EM ISMAEL PORDEUS;RUA DES FAUSTINO ALBUQUERQUE, 511;JARDIM DAS OLIVEIRAS;
2024;1;FORTALEZA;50100;PROF FABIANO AUTISTA;112;165;;2;EM JOHNSON;RUA DRA. SOCORRO AZEVEDO, 461;ENGENHEIRO LUCIANO CAVALCANTE;
2024;1;FORTALEZA;50100;PROF FABIANO AUTISTA;112;278;;1;COLÉGIO ANTARES - SEDE WASHINGTON SOARES;RUA CAETANO XIMENES ARAGÃO,110 - ACESSO PELA RUA ARMANDO DALL'OLIO;ENGENHEIRO LUCIANO CAVALCANTE;
2024;1;FORTALEZA;50100;PROF FABIANO AUTISTA;112;286;;1;IGREJA DA GLÓRIA;AV OLIVEIRA PAIVA, 905;CIDADE DOS FUNCIONÁRIOS;
2024;1;FORTALEZA;50100;PROF FABIANO AUTISTA;112;331;;1;EM JOHNSON;RUA DRA. SOCORRO AZEVEDO, 461;ENGENHEIRO LUCIANO CAVALCANTE;
2024;1;FORTALEZA;50100;PROF FABIANO AUTISTA;112;349;;1;IGREJA DA GLÓRIA;AV OLIVEIRA PAIVA, 905;CIDADE DOS FUNCIONÁRIOS;
2024;1;FORTALEZA;50100;PROF FABIANO AUTISTA;112;409;;1;COLEGIO ARI DE SA CAVALCANTE WS;AV WASHINGTON SOARES, 3737;EDSON QUEIROZ;
2024;1;FORTALEZA;50100;PROF FABIANO AUTISTA;112;410;;1;COLEGIO ARI DE SA CAVALCANTE WS;AV WASHINGTON SOARES, 3737;EDSON QUEIROZ;
2024;1;FORTALEZA;50100;PROF FABIANO AUTISTA;112;456;;1;UNIVERSIDADE DE FORTALEZA - UNIFOR;AVENIDA WASHINGTON SOARES, 1321;EDSON QUEIROZ;
2024;1;FORTALEZA;50100;PROF FABIANO AUTISTA;112;549;;1;COLÉGIO NOVA DIMENSÃO;AV. EDILSON BRASIL SOARES, 1599;EDSON QUEIROZ;
2024;1;FORTALEZA;50100;PROF FABIANO AUTISTA;112;567;;1;CENTRO UNIVERSITÁRIO 7 DE SETEMBRO - UNI 7 (FA7);AV. ALMIRANTE MAXIMINIANO DA FONSECA, 1395;ENGENHEIRO LUCIANO CAVALCANTE;
2024;1;FORTALEZA;50100;PROF FABIANO AUTISTA;112;571;;1;CENTRO UNIVERSITÁRIO 7 DE SETEMBRO - UNI 7 (FA7);AV. ALMIRANTE MAXIMINIANO DA FONSECA, 1395;ENGENHEIRO LUCIANO CAVALCANTE;
2024;1;FORTALEZA;50100;PROF FABIANO AUTISTA;113;6;5;1;FACULDADE DE ARQUITETURA E URBANISMO DA UFC;AV. DA UNIVERSIDADE, 2890;BENFICA;
2024;1;FORTALEZA;50100;PROF FABIANO AUTISTA;113;49;;1;COLÉGIO FARIAS BRITO;RUA SENADOR POMPEU, 2607;JOSÉ BONIFÁCIO;
2024;1;FORTALEZA;50100;PROF FABIANO AUTISTA;113;115;;1;COLÉGIO CHRISTUS BENFICA;RUA LUIS DE MIRANDA, 536;BENFICA;
2024;1;FORTALEZA;50100;PROF FABIANO AUTISTA;113;131;;1;EMEIF DOM MANUEL DA SILVA GOMES;RUA SAMUEL UCHÔA, 550;BOM FUTURO;
2024;1;FORTALEZA;50100;PROF FABIANO AUTISTA;113;157;;1;COLÉGIO MEDALHA MILAGROSA;RUA PADRE JOÃO PIAMARTA,  415;BOM FUTURO;
2024;1;FORTALEZA;50100;PROF FABIANO AUTISTA;113;180;;1;COLÉGIO SÃO MATEUS;RUA JUSTINIANO DE SERPA, 748;FARIAS BRITO;
2024;1;FORTALEZA;50100;PROF FABIANO AUTISTA;113;210;;1;COLÉGIO DEOCLÉCIO FERRO;RUA MINERVINO DE CASTRO, 987;RODOLFO TEÓFILO;
2024;1;FORTALEZA;50100;PROF FABIANO AUTISTA;113;214;;1;COLÉGIO DEOCLÉCIO FERRO;RUA MINERVINO DE CASTRO, 987;RODOLFO TEÓFILO;
2024;1;FORTALEZA;50100;PROF FABIANO AUTISTA;113;256;;1;EEF MONSENHOR LINHARES;RUA PROF. LINO ENCARNAÇÃO, 1130;AMADEU FURTADO;
2024;1;FORTALEZA;50100;PROF FABIANO AUTISTA;113;276;;1;COLÉGIO DEOCLÉCIO FERRO;RUA MINERVINO DE CASTRO, 987;RODOLFO TEÓFILO;
2024;1;FORTALEZA;50100;PROF FABIANO AUTISTA;113;280;;1;COLÉGIO CHRISTUS PRÉ - UNIVERSITÁRIO;RUA CRUZ SALDANHA, 614;PARQUELÂNDIA;
2024;1;FORTALEZA;50100;PROF FABIANO AUTISTA;113;286;;1;CEI FRANCISCO EURIVÁ MATIAS;RUA FREI MARCELINO, S/N;RODOLFO TEÓFILO;
2024;1;FORTALEZA;50100;PROF FABIANO AUTISTA;113;312;;1;EMEIF MOZART PINTO;RUA JORGE DUMMAR, 2078;JARDIM AMÉRICA;
2024;1;FORTALEZA;50100;PROF FABIANO AUTISTA;113;338;;1;COLEGIO GRÃO SABER ( ANTIGO TOPO GIGIO);RUA PROFESSOR LINO DA ENCARNACAO, 490;PARQUELÂNDIA;
2024;1;FORTALEZA;50100;PROF FABIANO AUTISTA;113;361;;1;COLÉGIO ESTADUAL PRESIDENTE HUMBERTO CASTELO BRANCO;RUA IRMA BAZET, 210;MONTESE;
2024;1;FORTALEZA;50100;PROF FABIANO AUTISTA;113;396;;1;IMPARH;AV JOAO PESSOA, 5.609;MONTESE;
2024;1;FORTALEZA;50100;PROF FABIANO AUTISTA;113;397;;1;CENTRO EDUCACIONAL SÃO JOSÉ;RUA BOA NOITE, 149;MONTESE;
2024;1;FORTALEZA;50100;PROF FABIANO AUTISTA;113;415;;1;EEFM MARECHAL HUMBERTO DE ALENCAR C. BRANCO;RUA ALVARO FERNANDES, 913;MONTESE;
2024;1;FORTALEZA;50100;PROF FABIANO AUTISTA;114;40;;1;EM FRANCISCO SILVA CAVALCANTE;RUA CONSELHEIRO LAFAYETTE 205;FLORESTA;
2024;1;FORTALEZA;50100;PROF FABIANO AUTISTA;114;214;;1;EM MARIA ROSELI LIMA MESQUITA;RUA FRANCISCO CALAÇA 1791;ÁLVARO WEYNE;
2024;1;FORTALEZA;50100;PROF FABIANO AUTISTA;114;283;;1;EEEP PAULO PETROLA;RUA SAUDÁRIA, S/N - GOIABEIRAS;BARRA DO CEARÁ;
2024;1;FORTALEZA;50100;PROF FABIANO AUTISTA;114;346;;1;EMTI ALDEMIR MARTINS;AV. FRANCISCO SÁ, 7460;BARRA DO CEARÁ;
2024;1;FORTALEZA;50100;PROF FABIANO AUTISTA;115;121;;1;DETRAN;AV GODOFREDO MACIEL, 2900;MARAPONGA;
2024;1;FORTALEZA;50100;PROF FABIANO AUTISTA;115;122;;1;COLÉGIO UNIVERSO DO SABER;RUA 10 - NR 70 (CJ CAMPO DOS INGLESES - MARAPONGA);JARDIM CEARENSE;
2024;1;FORTALEZA;50100;PROF FABIANO AUTISTA;115;210;;1;EM CLÁUDIO MARTINS;RUA BARÃO DE CANINDÉ, S/N;PARANGABA;
2024;1;FORTALEZA;50100;PROF FABIANO AUTISTA;115;268;;2;EM JOÃO ESTANISLAU FAÇANHA;RUA ONZE, S/N - CONJUNTO CAMPO DOS INGLESES;JARDIM CEARENSE;
2024;1;FORTALEZA;50100;PROF FABIANO AUTISTA;115;293;;1;EM JOÃO ESTANISLAU FAÇANHA;RUA ONZE, S/N - CONJUNTO CAMPO DOS INGLESES;JARDIM CEARENSE;
2024;1;FORTALEZA;50100;PROF FABIANO AUTISTA;115;333;;1;COLÉGIO LOURENÇO FILHO - PARANGABA;RUA CÔNEGO DE CASTRO 700;PARANGABA;
2024;1;FORTALEZA;50100;PROF FABIANO AUTISTA;115;345;347, 354, 351;1;EEEP JOAQUIM MOREIRA DE SOUSA;RUA CAIO PRADO 02;PARANGABA;
2024;1;FORTALEZA;50100;PROF FABIANO AUTISTA;115;417;;1;CEJA - PROFº MOREIRA CAMPOS;RUA JULIO BRAGA, 101 B;PARANGABA;
2024;1;FORTALEZA;50100;PROF FABIANO AUTISTA;115;421;;1;CEJA - PROFº MOREIRA CAMPOS;RUA JULIO BRAGA, 101 B;PARANGABA;
2024;1;FORTALEZA;50100;PROF FABIANO AUTISTA;115;424;;1;CENTRO DE EDUCAÇÃO PEDAGÓGICO EÇA DE QUEIROZ;RUA DOM XISTO ALBANO 611;VILA PERI;
2024;1;FORTALEZA;50100;PROF FABIANO AUTISTA;115;451;;2;EM HENRIQUETA GALENO;RUA MAJOR MONTENEGRO 917;MANOEL SÁTIRO;
2024;1;FORTALEZA;50100;PROF FABIANO AUTISTA;115;459;;1;EM HENRIQUETA GALENO;RUA MAJOR MONTENEGRO 917;MANOEL SÁTIRO;
2024;1;FORTALEZA;50100;PROF FABIANO AUTISTA;116;383;;1;EM FRANCISCA FERNANDES MAGALHAES;RUA OLIVEIRA SOBRINHO, 1031;BONSUCESSO;
2024;1;FORTALEZA;50100;PROF FABIANO AUTISTA;116;402;;1;EM XV DE OUTUBRO - TEMPORÁRIO;RUA GUARANI, 2030;BONSUCESSO;
2024;1;FORTALEZA;50100;PROF FABIANO AUTISTA;116;429;;1;EEF SAO JOSE DO PICI DAS PEDREIRAS;RUA MANUEL ANTONIO LEITE 250;BONSUCESSO;
2024;1;FORTALEZA;50100;PROF FABIANO AUTISTA;116;438;;1;CEI XV DE OUTUBRO;RUA MENINO JESUS DE PRAGA, 192;BONSUCESSO;
2024;1;FORTALEZA;50100;PROF FABIANO AUTISTA;116;442;;1;EM XV DE OUTUBRO - TEMPORÁRIO;RUA GUARANI, 2030;BONSUCESSO;
2024;1;FORTALEZA;50100;PROF FABIANO AUTISTA;116;502;;1;EM JOAO MENDES DE ANDRADE;RUA B, 1366;BOM JARDIM;
2024;1;FORTALEZA;50100;PROF FABIANO AUTISTA;117;154;;1;EEEP DARCY RIBEIRO;RUA CONEGO DE CASTRO, S/N;CONJUNTO ESPERANÇA;
2024;1;FORTALEZA;50100;PROF FABIANO AUTISTA;117;213;;1;EEFM PROFA ADALGISA BONFIM SOARES;AV. DO CANAL, S/N, ESQUINA COM RUA 103 - CONJUNTO ESPERANÇA;CONJUNTO ESPERANÇA;
2024;1;FORTALEZA;50100;PROF FABIANO AUTISTA;117;247;;1;ESCOLA MUNICIPAL MARIETA GUEDES MARTINS;RUA JOSE GUEDES MARTINS 4701;PARQUE SANTA ROSA;
2024;1;FORTALEZA;50100;PROF FABIANO AUTISTA;117;251;;1;ESCOLA MUNICIPAL MARIETA GUEDES MARTINS;RUA JOSE GUEDES MARTINS 4701;PARQUE SANTA ROSA;
2024;1;FORTALEZA;50100;PROF FABIANO AUTISTA;117;357;;1;CITS PARQUE SÃO JOSÉ - CENTRO DE INCLUSÃO TECNOLÓGICA E SOCIAL;RUA CÔNEGO DE CASTRO, 3955;PARQUE SÃO JOSÉ;
2024;1;FORTALEZA;50100;PROF FABIANO AUTISTA;117;406;;1;EEFM SÃO FRANCISCO DE ASSIS;RUA SÃO FELIPE, 564;CANINDEZINHO;
2024;1;FORTALEZA;50100;PROF FABIANO AUTISTA;117;431;;1;CITS PARQUE SÃO JOSÉ - CENTRO DE INCLUSÃO TECNOLÓGICA E SOCIAL;RUA CÔNEGO DE CASTRO, 3955;PARQUE SÃO JOSÉ;
2024;1;FORTALEZA;50100;PROF FABIANO AUTISTA;118;317;;1;EM FRANCISCO ANDRADE TEOFILO GIRAO;RUA UNIDOS VENCEREMOS, 2040;PASSARÉ;
2024;1;FORTALEZA;50100;PROF FABIANO AUTISTA;118;418;;1;EMTI REITOR ROBERTO CLÁUDIO FROTA BEZERRA;AVENIDA 1, S/N;PARQUE DOIS IRMÃOS;
2024;1;FORTALEZA;50100;PROF FABIANO AUTISTA;118;429;;1;EM FRANCISCO ANDRADE TEOFILO GIRAO;RUA UNIDOS VENCEREMOS, 2040;PASSARÉ;
2024;1;FORTALEZA;50100;PROF FABIANO AUTISTA;118;482;;1;COLÉGIO MULTIVERSO (ANTIGO COLÉGIO TELES);AV. JUSCELINO KUBITSCHECK, 3653;PASSARÉ;
2024;1;FORTALEZA;50100;PROF FABIANO AUTISTA;118;537;;1;COLEGIO MARIA ESTER II;RUA F (CONJUNTO MIRASSOL), 158;PARQUE DOIS IRMÃOS;
2024;1;FORTALEZA;50100;PROF FABIANO AUTISTA;118;560;;1;EM PROFESSOR JACINTO BOTELHO;RUA DR. RODRIGO CODES SANDOVAL, 374;MONDUBIM;
2024;1;FORTALEZA;50100;PROF FABIANO AUTISTA;118;562;;1;COLÉGIO CONECTIVO;RUA GENERAL ONOFRE, 445;MONDUBIM;
2024;1;FORTALEZA;50100;PROF FABIANO AUTISTA;118;576;;1;EEFM ANTÔNIO DIAS MACEDO;AV PEDRO DANTAS 340;DIAS MACEDO;
2024;1;FORTALEZA;50100;PROF FABIANO AUTISTA;118;624;;1;EM FRANCISCO ANDRADE TEOFILO GIRAO;RUA UNIDOS VENCEREMOS, 2040;PASSARÉ;
2024;1;FORTALEZA;50100;PROF FABIANO AUTISTA;118;634;;1;EMEF PROFESSOR JOAO HIPPÓLYTO DE AZEVEDO E SÁ;RUA 03 N. 88 RESIDENCIAL NAPOLEAO VIANA;DIAS MACEDO;
TOTAL;;;;;;;;192;
