2024;1;FORTALEZA;43143;PROFESSOR GERSON;115;198;;1;COLÉGIO INVICTUS;RUA ARARIBÓIA, 192;PARANGABA;
2024;1;FORTALEZA;43143;PROFESSOR GERSON;115;200;;1;COLÉGIO INVICTUS;RUA ARARIBÓIA, 192;PARANGABA;
2024;1;FORTALEZA;43143;PROFESSOR GERSON;115;262;;1;COLEGIO PROVECTO;RUA SUIÇA, 76;MARAPONGA;
2024;1;FORTALEZA;43143;PROFESSOR GERSON;115;263;;1;EM JOÃO ESTANISLAU FAÇANHA;RUA ONZE, S/N - CONJUNTO CAMPO DOS INGLESES;JARDIM CEARENSE;
2024;1;FORTALEZA;43143;PROFESSOR GERSON;115;268;;1;EM JOÃO ESTANISLAU FAÇANHA;RUA ONZE, S/N - CONJUNTO CAMPO DOS INGLESES;JARDIM CEARENSE;
2024;1;FORTALEZA;43143;PROFESSOR GERSON;115;273;;1;EM THOMAZ POMPEU SOBRINHO;RUA JOSE MENELEU, 531;PARANGABA;
2024;1;FORTALEZA;43143;PROFESSOR GERSON;115;284;;1;FACULDADE UNINASSAU - PARANGABA;RUA GERMANO FRANCK, 567;PARANGABA;
2024;1;FORTALEZA;43143;PROFESSOR GERSON;115;288;;1;COLEGIO DUQUE DE CAXIAS;RUA  PERU, 1675;SERRINHA;
2024;1;FORTALEZA;43143;PROFESSOR GERSON;115;293;;1;EM JOÃO ESTANISLAU FAÇANHA;RUA ONZE, S/N - CONJUNTO CAMPO DOS INGLESES;JARDIM CEARENSE;
2024;1;FORTALEZA;43143;PROFESSOR GERSON;115;300;;2;ESCOLA MARISTA SAGRADO CORAÇÃO;RUA VIDAL DE NEGREIROS, 550;JARDIM CEARENSE;
2024;1;FORTALEZA;43143;PROFESSOR GERSON;115;307;;1;COLEGIO PROVECTO;RUA SUIÇA, 76;MARAPONGA;
2024;1;FORTALEZA;43143;PROFESSOR GERSON;115;313;;1;ESCOLA MARISTA SAGRADO CORAÇÃO;RUA VIDAL DE NEGREIROS, 550;JARDIM CEARENSE;
2024;1;FORTALEZA;43143;PROFESSOR GERSON;115;314;;1;EEM  PROFESSORA DIVA CABRAL;RUA HOLANDA, 701;MARAPONGA;
2024;1;FORTALEZA;43143;PROFESSOR GERSON;115;333;;2;COLÉGIO LOURENÇO FILHO - PARANGABA;RUA CÔNEGO DE CASTRO 700;PARANGABA;
2024;1;FORTALEZA;43143;PROFESSOR GERSON;115;344;346, 359, 349;1;EEEP JOAQUIM MOREIRA DE SOUSA;RUA CAIO PRADO 02;PARANGABA;
2024;1;FORTALEZA;43143;PROFESSOR GERSON;115;345;347, 354, 351;1;EEEP JOAQUIM MOREIRA DE SOUSA;RUA CAIO PRADO 02;PARANGABA;
2024;1;FORTALEZA;43143;PROFESSOR GERSON;115;348;352, 356, 353;1;EEEP JOAQUIM MOREIRA DE SOUSA;RUA CAIO PRADO 02;PARANGABA;
2024;1;FORTALEZA;43143;PROFESSOR GERSON;115;370;;1;EM CATULO DA PAIXAO CEARENSE;RUA LEAO DO NORTE 300;VILA PERI;
2024;1;FORTALEZA;43143;PROFESSOR GERSON;115;376;;1;EEMTI GENERAL EUDORO CORREA;RUA JULIO BRAGA 101;PARANGABA;
2024;1;FORTALEZA;43143;PROFESSOR GERSON;115;398;;1;EM CLÁUDIO MARTINS;RUA BARÃO DE CANINDÉ, S/N;PARANGABA;
2024;1;FORTALEZA;43143;PROFESSOR GERSON;115;404;;1;EEFM PROFESSOR MARIO SCHENBERG;RUA AMERICO ROCHA LIMA 835;MANOEL SÁTIRO;
2024;1;FORTALEZA;43143;PROFESSOR GERSON;115;422;;1;CENTRO DE EDUCAÇÃO PEDAGÓGICO EÇA DE QUEIROZ;RUA DOM XISTO ALBANO 611;VILA PERI;
2024;1;FORTALEZA;43143;PROFESSOR GERSON;115;486;;1;ESCOLA MARISTA SAGRADO CORAÇÃO;RUA VIDAL DE NEGREIROS, 550;JARDIM CEARENSE;
2024;1;FORTALEZA;43143;PROFESSOR GERSON;115;490;;1;ESCOLA MARISTA SAGRADO CORAÇÃO;RUA VIDAL DE NEGREIROS, 550;JARDIM CEARENSE;
2024;1;FORTALEZA;43143;PROFESSOR GERSON;115;491;;1;EM JOÃO ESTANISLAU FAÇANHA;RUA ONZE, S/N - CONJUNTO CAMPO DOS INGLESES;JARDIM CEARENSE;
2024;1;FORTALEZA;43143;PROFESSOR GERSON;116;56;;1;EM SANTOS DUMONT;RUA GERALDO BARBOSA 240;BOM JARDIM;
2024;1;FORTALEZA;43143;PROFESSOR GERSON;116;205;;1;EM SANTA ISABEL;RUA RAIMUNDO PINHEIRO 798;BOM JARDIM;
2024;1;FORTALEZA;43143;PROFESSOR GERSON;116;482;;1;PROJETO ABC BOM JARDIM;RUA TRES CORACOES 762;GRANJA LISBOA;
2024;1;FORTALEZA;43143;PROFESSOR GERSON;116;496;;1;EM FRANCISCO EDMILSON PINHEIRO;AVENIDA H, 2115, 4A ETAPA;CONJUNTO CEARÁ II;
2024;1;FORTALEZA;43143;PROFESSOR GERSON;117;158;;1;EEF JOSE AYRTON TEIXEIRA;RUA ALFREDO MAMEDE SN;MANOEL SÁTIRO;
2024;1;FORTALEZA;43143;PROFESSOR GERSON;117;184;;1;EEFM IRAPUAN CAVALCANTE PINHEIRO;AV E 305;CONJUNTO ESPERANÇA;
2024;1;FORTALEZA;43143;PROFESSOR GERSON;117;216;;1;EEFM PROFA ADELIA BRASIL FEIJO;AV CONTORNO SUL, 1540;CONJUNTO ESPERANÇA;
2024;1;FORTALEZA;43143;PROFESSOR GERSON;117;311;;1;COLÉGIO CASTRO ALVES;RUA TULIPA NEGRA, 2319;PARQUE PRESIDENTE VARGAS;
2024;1;FORTALEZA;43143;PROFESSOR GERSON;117;320;;1;CUCA MONDUBIM;RUA PROFESSOR GLAUCO LOBO S/N;NOVO MONDUBIM;
2024;1;FORTALEZA;43143;PROFESSOR GERSON;117;340;;1;CEI FRANCISCA DE ABREU LIMA;RUA C -  ESQUINA COM A RUA LUIZ MONTENEGRO, S/N;SIQUEIRA;
2024;1;FORTALEZA;43143;PROFESSOR GERSON;117;434;;1;EEFM SANTO AMARO;RUA NOVA CONQUISTA 871;BOM JARDIM;
2024;1;FORTALEZA;43143;PROFESSOR GERSON;117;442;;2;EM JOSE MARIA MOREIRA CAMPOS;RUA FRANCISCO ALMEIDA, 525 CJ. APOLO XI;PARQUE PRESIDENTE VARGAS;
2024;1;FORTALEZA;43143;PROFESSOR GERSON;117;476;;1;COLÉGIO VENCER;RUA JARDIM PARUARA, 1108;SIQUEIRA;
2024;1;FORTALEZA;43143;PROFESSOR GERSON;118;306;;1;COLEGIO EXODUS;RUA DOUTOR EDUARDO DIAS, 156;PASSARÉ;
2024;1;FORTALEZA;43143;PROFESSOR GERSON;118;370;;1;EM MARIA DE CARVALHO MARTINS;AVENIDA DOUTOR SILAS MUNGUBA, 4300;SERRINHA;
2024;1;FORTALEZA;43143;PROFESSOR GERSON;118;444;;1;EM MARIA DE CARVALHO MARTINS;AVENIDA DOUTOR SILAS MUNGUBA, 4300;SERRINHA;
2024;1;FORTALEZA;43143;PROFESSOR GERSON;118;454;;1;EM DELMA HERMÍNIA DA SILVA PEREIRA;AVENIDA PRESIDENTE COSTA E SILVA, 5606;PASSARÉ;
2024;1;FORTALEZA;43143;PROFESSOR GERSON;118;521;;1;COLEGIO MARIA ESTER II;RUA F (CONJUNTO MIRASSOL), 158;PARQUE DOIS IRMÃOS;
2024;1;FORTALEZA;43143;PROFESSOR GERSON;118;551;;2;EM PROFESSOR JACINTO BOTELHO;RUA DR. RODRIGO CODES SANDOVAL, 374;MONDUBIM;
2024;1;FORTALEZA;43143;PROFESSOR GERSON;118;554;;1;EM PROFESSOR JACINTO BOTELHO;RUA DR. RODRIGO CODES SANDOVAL, 374;MONDUBIM;
2024;1;FORTALEZA;43143;PROFESSOR GERSON;118;555;;2;EM PROFESSOR JACINTO BOTELHO;RUA DR. RODRIGO CODES SANDOVAL, 374;MONDUBIM;
2024;1;FORTALEZA;43143;PROFESSOR GERSON;118;556;;2;EM PROFESSOR JACINTO BOTELHO;RUA DR. RODRIGO CODES SANDOVAL, 374;MONDUBIM;
2024;1;FORTALEZA;43143;PROFESSOR GERSON;118;559;;1;EM PROFESSOR JACINTO BOTELHO;RUA DR. RODRIGO CODES SANDOVAL, 374;MONDUBIM;
2024;1;FORTALEZA;43143;PROFESSOR GERSON;118;560;;2;EM PROFESSOR JACINTO BOTELHO;RUA DR. RODRIGO CODES SANDOVAL, 374;MONDUBIM;
2024;1;FORTALEZA;43143;PROFESSOR GERSON;118;598;;1;EMEF PROFESSOR JOAO HIPPÓLYTO DE AZEVEDO E SÁ;RUA 03 N. 88 RESIDENCIAL NAPOLEAO VIANA;DIAS MACEDO;
2024;1;FORTALEZA;43143;PROFESSOR GERSON;118;599;;1;EMEF PROFESSOR JOAO HIPPÓLYTO DE AZEVEDO E SÁ;RUA 03 N. 88 RESIDENCIAL NAPOLEAO VIANA;DIAS MACEDO;
2024;1;FORTALEZA;43143;PROFESSOR GERSON;118;620;;1;COLÉGIO CONECTIVO;RUA GENERAL ONOFRE, 445;MONDUBIM;
2024;1;FORTALEZA;43143;PROFESSOR GERSON;118;630;;3;ESCOLA EVANGELICA MONTE SINAI;RUA BRUNO VALENTE, 847;SERRINHA;
2024;1;FORTALEZA;43143;PROFESSOR GERSON;118;656;;1;COLÉGIO MARIA ESTER I;RUA ANTONIO TEIXEIRA LEITE, 248;SERRINHA;
2024;1;FORTALEZA;43143;PROFESSOR GERSON;118;658;;1;EM PROFESSOR JACINTO BOTELHO;RUA DR. RODRIGO CODES SANDOVAL, 374;MONDUBIM;
2024;1;FORTALEZA;43143;PROFESSOR GERSON;118;662;;1;COLÉGIO MONTEIRO LOBATO;RUA 112, N 247, TUPÃ MIRIM;PARQUE DOIS IRMÃOS;
TOTAL;;;;;;;;306;
