Ano;Turno;Município;Número;Candidato;Zona;Seção;Seções Agregadas;Votos;Local de Votação;Endereço Local de Votação;Bairro;
2024;1;FORTALEZA;43143;PROFESSOR GERSON;1;86;;1;FACULDADE FARIAS BRITO - CASTRO MONTE;RUA CASTRO MONTE 1364;VARJOTA;
2024;1;FORTALEZA;43143;PROFESSOR GERSON;1;628;;1;ESCOLA MUNICIPAL JOSE RAMOS TORRES DE MELO;AVENIDA DA ABOLIÇÃO 3984;MUCURIPE;
2024;1;FORTALEZA;43143;PROFESSOR GERSON;1;631;;1;FACULDADE FARIAS BRITO - CASTRO MONTE;RUA CASTRO MONTE 1364;VARJOTA;
2024;1;FORTALEZA;43143;PROFESSOR GERSON;1;826;;1;ESCOLA MUNICIPAL DOM ALOISIO LORSCHEIDER;RUA JULIO SILVA, 450;PRAIA DO FUTURO II;
2024;1;FORTALEZA;43143;PROFESSOR GERSON;1;917;;1;UNINTA - FACULDADE UNINTA FORTALEZA;RUA VILEBALDO AGUIAR,133;COCÓ;
2024;1;FORTALEZA;43143;PROFESSOR GERSON;2;74;;2;EEEP JOSE DE BARCELOS;RUA ANGELICA GURGEL 362;MESSEJANA;
2024;1;FORTALEZA;43143;PROFESSOR GERSON;2;88;;1;CLUBE DA CAIXA;AVENIDA FREI CIRILO 4700;MESSEJANA;
2024;1;FORTALEZA;43143;PROFESSOR GERSON;2;109;;1;EMEIF DEMOCRITO ROCHA;RUA PADRE PEDRO DE ALENCAR, 2012;MESSEJANA;
2024;1;FORTALEZA;43143;PROFESSOR GERSON;2;142;;1;EM JOSEFA BARROS DE ALENCAR;RUA DOUTOR JOAQUIM BENTO 590;MESSEJANA;
2024;1;FORTALEZA;43143;PROFESSOR GERSON;2;162;;1;INSTITUTO FREI JOAO PEDRO DE SEXTO;AVENIDA FREI CIRILO, 4241;MESSEJANA;
2024;1;FORTALEZA;43143;PROFESSOR GERSON;2;652;;1;PATRONATO PADRE LUIZ BARBOSA MOREIRA;RUA CEL GUILHERME ALENCAR, 121;MESSEJANA;
2024;1;FORTALEZA;43143;PROFESSOR GERSON;2;746;;1;EMEIF ANGELICA GURGEL;RUA DOUTOR PERGENTINO MAIA, 375;MESSEJANA;
2024;1;FORTALEZA;43143;PROFESSOR GERSON;3;114;;1;COLÉGIO ESTADUAL LICEU DO CEARÁ;PRAÇA GUSTAVO BARROSO, 01;JACARECANGA;
2024;1;FORTALEZA;43143;PROFESSOR GERSON;3;214;215;1;COLÉGIO ARI DE SÁ - PRÉ-VESTIBULAR - SEDE DUQUE DE CAXIAS;AV. DUQUE DE CAXIAS, 519;CENTRO;
2024;1;FORTALEZA;43143;PROFESSOR GERSON;3;217;520;1;FAC. CATÓLICA DE FORTALEZA (SEMINÁRIO DA PRAINHA);RUA TENENTE BENÉVOLO, 201;CENTRO;
2024;1;FORTALEZA;43143;PROFESSOR GERSON;3;240;295;1;COLÉGIO ESTADUAL JUSTINIANO DE SERPA;AV. SANTOS DUMONT, 56;CENTRO;
2024;1;FORTALEZA;43143;PROFESSOR GERSON;3;271;226;1;FAC. CATÓLICA DE FORTALEZA (SEMINÁRIO DA PRAINHA);RUA TENENTE BENÉVOLO, 201;CENTRO;
2024;1;FORTALEZA;43143;PROFESSOR GERSON;3;279;;1;EM SÃO RAFAEL;RUA DOS TABAJARAS, 244;PRAIA DE IRACEMA;
2024;1;FORTALEZA;43143;PROFESSOR GERSON;3;411;;1;COLÉGIO DARWIN;RUA ILDEFONSO ALBANO, 1030;ALDEOTA;
2024;1;FORTALEZA;43143;PROFESSOR GERSON;3;417;;1;UNICHRISTUS ALDEOTA;RUA VISCONDE DE MAUÁ, 1940;ALDEOTA;
2024;1;FORTALEZA;43143;PROFESSOR GERSON;3;484;;1;COLÉGIO ANTARES (PRAIA DE IRACEMA);RUA HISTORIADOR GUARINO ALVES, 95;PRAIA DE IRACEMA;
2024;1;FORTALEZA;43143;PROFESSOR GERSON;3;626;;1;COLÉGIO BATISTA - SANTOS DUMONT;RUA DESEMBARGADOR LEITE ALBUQUERQUE, 1056;ALDEOTA;
2024;1;FORTALEZA;43143;PROFESSOR GERSON;80;113;;1;EEM YOLANDA QUEIROZ;AV. GAL. MURILO BORGES, 864;ALTO DA BALANÇA;
2024;1;FORTALEZA;43143;PROFESSOR GERSON;80;115;;1;EEM YOLANDA QUEIROZ;AV. GAL. MURILO BORGES, 864;ALTO DA BALANÇA;
2024;1;FORTALEZA;43143;PROFESSOR GERSON;80;118;;1;EEM YOLANDA QUEIROZ;AV. GAL. MURILO BORGES, 864;ALTO DA BALANÇA;
2024;1;FORTALEZA;43143;PROFESSOR GERSON;80;123;;1;EEFM ESTADO DO PARÁ;RUA DJALMA PETIT 589;ALTO DA BALANÇA;
2024;1;FORTALEZA;43143;PROFESSOR GERSON;80;128;;1;EEFM ESTADO DO PARÁ;RUA DJALMA PETIT 589;ALTO DA BALANÇA;
2024;1;FORTALEZA;43143;PROFESSOR GERSON;80;130;;1;EM PROFESSORA EDITH BRAGA;RUA CAPITAO VASCONCELOS 1061;ALTO DA BALANÇA;
2024;1;FORTALEZA;43143;PROFESSOR GERSON;80;158;;1;EEFM CEL PROF JOSÉ AURÉLIO CÂMARA;RUA JORGE ACURCIO, 655;VILA UNIÃO;
2024;1;FORTALEZA;43143;PROFESSOR GERSON;80;200;;1;UAPS CESAR CALS DE OLIVEIRA;RUA CAPITÃO ARAGÃO 555;ALTO DA BALANÇA;
2024;1;FORTALEZA;43143;PROFESSOR GERSON;80;205;;1;EEF CIRCULISTA BOM JESUS;RUA JOSE BUSON 101;ALTO DA BALANÇA;
2024;1;FORTALEZA;43143;PROFESSOR GERSON;80;206;;1;EEF CIRCULISTA BOM JESUS;RUA JOSE BUSON 101;ALTO DA BALANÇA;
2024;1;FORTALEZA;43143;PROFESSOR GERSON;80;212;;1;EM PROFESSORA EDITH BRAGA;RUA CAPITAO VASCONCELOS 1061;ALTO DA BALANÇA;
2024;1;FORTALEZA;43143;PROFESSOR GERSON;80;213;;2;EM PROFESSORA EDITH BRAGA;RUA CAPITAO VASCONCELOS 1061;ALTO DA BALANÇA;
2024;1;FORTALEZA;43143;PROFESSOR GERSON;80;221;;1;EM PROFESSORA EDITH BRAGA;RUA CAPITAO VASCONCELOS 1061;ALTO DA BALANÇA;
2024;1;FORTALEZA;43143;PROFESSOR GERSON;80;306;;1;ASSEMBLÉIA LEGISLATIVA - UNIVERSIDADE DO PARLAMENTO CEARENSE;RUA BARBOSA DE FREITAS, 2674;DIONISIO TORRES;
2024;1;FORTALEZA;43143;PROFESSOR GERSON;80;342;;1;COLÉGIO SALESIANO DOM BOSCO;AV ANTONIO SALES 116;JOAQUIM TÁVORA;
2024;1;FORTALEZA;43143;PROFESSOR GERSON;80;343;;2;COLÉGIO SALESIANO DOM BOSCO;AV ANTONIO SALES 116;JOAQUIM TÁVORA;
2024;1;FORTALEZA;43143;PROFESSOR GERSON;80;344;;1;COLÉGIO SALESIANO DOM BOSCO;AV ANTONIO SALES 116;JOAQUIM TÁVORA;
2024;1;FORTALEZA;43143;PROFESSOR GERSON;80;381;;1;COLÉGIO SHALON;RUA TIBÚRCIO FROTA, 1530 COM OSVALDO CRUZ;TAUAPE;
2024;1;FORTALEZA;43143;PROFESSOR GERSON;80;403;;1;COLÉGIO MAURO BEZERRA;RUA BRIGADEIRO VILELA, 221;AEROLÂNDIA;
2024;1;FORTALEZA;43143;PROFESSOR GERSON;80;424;;1;FACULDADE MAURÍCIO DE NASSAU;AVENIDA VISCONDE DO RIO BRANCO, 2078;JOSÉ BONIFÁCIO;
2024;1;FORTALEZA;43143;PROFESSOR GERSON;80;434;;1;FACULDADE MAURÍCIO DE NASSAU;AVENIDA VISCONDE DO RIO BRANCO, 2078;JOSÉ BONIFÁCIO;
2024;1;FORTALEZA;43143;PROFESSOR GERSON;82;187;;1;ESCOLA MUNICIPAL LENIRA JUREMA DE MAGALHÃES - EI/EF;RUA TEÓFILO GURGEL, 111;MONTE CASTELO;
2024;1;FORTALEZA;43143;PROFESSOR GERSON;82;240;;1;EEFM GOVERNADOR FLÁVIO MARCÍLIO;AV. PASTEUR, 575;PIRAMBU;
2024;1;FORTALEZA;43143;PROFESSOR GERSON;82;256;;1;CEJA PAULO FREIRE;RUA OLAVO BILAC, 1300;SÃO GERARDO;
2024;1;FORTALEZA;43143;PROFESSOR GERSON;82;423;;1;EEFM LIONS JANGADA - EEMTI;RUA CAMÉLIA, 352;CRISTO REDENTOR;
2024;1;FORTALEZA;43143;PROFESSOR GERSON;82;431;;1;COLÉGIO MASTER - BEZERRA DE MENEZES;AV. BEZERRA DE MENEZES, 1802;SÃO GERARDO;
2024;1;FORTALEZA;43143;PROFESSOR GERSON;82;477;;1;EEFM CLÁUDIO MARTINS;RUA DEMÓCRITO ROCHA, 400;MONTE CASTELO;
2024;1;FORTALEZA;43143;PROFESSOR GERSON;82;490;;1;COLÉGIO MASTER - BEZERRA DE MENEZES;AV. BEZERRA DE MENEZES, 1802;SÃO GERARDO;
2024;1;FORTALEZA;43143;PROFESSOR GERSON;82;514;;1;ESCOLA MUNICIPAL SANTA TEREZA - EI/EF;RUA MONSENHOR HÉLIO CAMPOS, 90;CRISTO REDENTOR;
2024;1;FORTALEZA;43143;PROFESSOR GERSON;82;619;;1;COLÉGIO MASTER - BEZERRA DE MENEZES;AV. BEZERRA DE MENEZES, 1802;SÃO GERARDO;
2024;1;FORTALEZA;43143;PROFESSOR GERSON;82;696;;1;CENTRO EDUCACIONAL SÃO MATEUS;AV. SARGENTO HERMÍNIO SAMPAIO, 2440;MONTE CASTELO;
2024;1;FORTALEZA;43143;PROFESSOR GERSON;83;134;;1;ESCOLA MUNICIPAL PRESIDENTE KENNEDY;AV. LINEU MACHADO 811;JÓQUEI CLUBE;
2024;1;FORTALEZA;43143;PROFESSOR GERSON;83;155;;1;CENTRO DE FORMAÇÃO E DESENV. PARA PROFISSIONAIS DA EDUCAÇÃO - FORMACE;RUA PORTO VELHO, 401;JOÃO XXIII;
2024;1;FORTALEZA;43143;PROFESSOR GERSON;83;173;;1;ESCOLA PEQUENO PRINCIPE;RUA SILVEIRA FILHO, 825;JÓQUEI CLUBE;
2024;1;FORTALEZA;43143;PROFESSOR GERSON;83;239;;1;ESCOLA MUNICIPAL JOSÉ BATISTA DE OLIVEIRA;RUA GOIÁS 620;PANAMERICANO;
2024;1;FORTALEZA;43143;PROFESSOR GERSON;83;443;;1;EEFM JOAQUIM ALVES;RUA ESTADO DO RIO 955;DEMOCRITO ROCHA;
2024;1;FORTALEZA;43143;PROFESSOR GERSON;83;601;;1;EEMTI ANTONIETA SIQUEIRA;RUA GUARANI 04;HENRIQUE JORGE;
2024;1;FORTALEZA;43143;PROFESSOR GERSON;83;773;;1;CENTRO DE FORMAÇÃO E DESENV. PARA PROFISSIONAIS DA EDUCAÇÃO - FORMACE;RUA PORTO VELHO, 401;JOÃO XXIII;
2024;1;FORTALEZA;43143;PROFESSOR GERSON;85;116;;2;CCDH - CENTRO DE CIDADANIA E DIREITOS HUMANOS (ANTIGO LUCIO ALCANTARA);AV. ALANIS MARIA LAURINDO DE OLIVEIRA, 461, 1A ETAPA;CONJUNTO CEARÁ I;
2024;1;FORTALEZA;43143;PROFESSOR GERSON;85;123;;1;CCDH - CENTRO DE CIDADANIA E DIREITOS HUMANOS (ANTIGO LUCIO ALCANTARA);AV. ALANIS MARIA LAURINDO DE OLIVEIRA, 461, 1A ETAPA;CONJUNTO CEARÁ I;
2024;1;FORTALEZA;43143;PROFESSOR GERSON;85;149;;1;EEF GOVERNADOR FAUSTINO ALBUQUERQUE - UV1;RUA 143 N 155 - 1 ETAPA;CONJUNTO CEARÁ I;
2024;1;FORTALEZA;43143;PROFESSOR GERSON;85;153;;1;EEF GOVERNADOR FAUSTINO ALBUQUERQUE - UV1;RUA 143 N 155 - 1 ETAPA;CONJUNTO CEARÁ I;
2024;1;FORTALEZA;43143;PROFESSOR GERSON;85;154;;1;EEF GOVERNADOR FAUSTINO ALBUQUERQUE - UV1;RUA 143 N 155 - 1 ETAPA;CONJUNTO CEARÁ I;
2024;1;FORTALEZA;43143;PROFESSOR GERSON;85;156;;1;EEF GOVERNADOR FAUSTINO ALBUQUERQUE - UV1;RUA 143 N 155 - 1 ETAPA;CONJUNTO CEARÁ I;
2024;1;FORTALEZA;43143;PROFESSOR GERSON;85;243;;1;EEM PROF JOSE MARIA CAMPOS DE OLIVEIRA - UV 8;RUA 820 S/N - 3 ETAPA;CONJUNTO CEARÁ I;
2024;1;FORTALEZA;43143;PROFESSOR GERSON;85;244;;1;EEM PROF JOSE MARIA CAMPOS DE OLIVEIRA - UV 8;RUA 820 S/N - 3 ETAPA;CONJUNTO CEARÁ I;
2024;1;FORTALEZA;43143;PROFESSOR GERSON;85;253;;1;EEF PATRONATO DA SAGRADA FAMILIA;RUA MARTINS NETO 379;ANTÔNIO BEZERRA;
2024;1;FORTALEZA;43143;PROFESSOR GERSON;85;273;;3;EEFM PROF PLACIDO ADERALDO CASTELO - UV 7B;RUA SETECENTOS E VINTE E UM, 100, 3A ETAPA;CONJUNTO CEARÁ I;
2024;1;FORTALEZA;43143;PROFESSOR GERSON;85;274;;1;EEFM PROF PLACIDO ADERALDO CASTELO - UV 7B;RUA SETECENTOS E VINTE E UM, 100, 3A ETAPA;CONJUNTO CEARÁ I;
2024;1;FORTALEZA;43143;PROFESSOR GERSON;85;275;;1;EEFM PROF PLACIDO ADERALDO CASTELO - UV 7B;RUA SETECENTOS E VINTE E UM, 100, 3A ETAPA;CONJUNTO CEARÁ I;
2024;1;FORTALEZA;43143;PROFESSOR GERSON;85;276;;2;EEFM PROF PLACIDO ADERALDO CASTELO - UV 7B;RUA SETECENTOS E VINTE E UM, 100, 3A ETAPA;CONJUNTO CEARÁ I;
2024;1;FORTALEZA;43143;PROFESSOR GERSON;85;277;;2;EEFM PROF PLACIDO ADERALDO CASTELO - UV 7B;RUA SETECENTOS E VINTE E UM, 100, 3A ETAPA;CONJUNTO CEARÁ I;
2024;1;FORTALEZA;43143;PROFESSOR GERSON;85;278;;3;EEFM PROF PLACIDO ADERALDO CASTELO - UV 7B;RUA SETECENTOS E VINTE E UM, 100, 3A ETAPA;CONJUNTO CEARÁ I;
2024;1;FORTALEZA;43143;PROFESSOR GERSON;85;323;;1;EEFM DR UBIRAJARA INDIO DO CEARA - UV-7A;RUA SETECENTOS E CINQUENTA E UM, 192, 3A ETAPA;CONJUNTO CEARÁ I;
2024;1;FORTALEZA;43143;PROFESSOR GERSON;85;324;;1;EEFM DR UBIRAJARA INDIO DO CEARA - UV-7A;RUA SETECENTOS E CINQUENTA E UM, 192, 3A ETAPA;CONJUNTO CEARÁ I;
2024;1;FORTALEZA;43143;PROFESSOR GERSON;85;328;;2;EEFM DR UBIRAJARA INDIO DO CEARA - UV-7A;RUA SETECENTOS E CINQUENTA E UM, 192, 3A ETAPA;CONJUNTO CEARÁ I;
2024;1;FORTALEZA;43143;PROFESSOR GERSON;85;343;;1;EMTI PROF PRISCO BEZERRA;AVENIDA F , 174;CONJUNTO CEARÁ I;
2024;1;FORTALEZA;43143;PROFESSOR GERSON;85;346;;1;ESCOLA MUNICIPAL JOAO NUNES PINHEIRO;AVENIDA F, 550, 1A ETAPA;CONJUNTO CEARÁ I;
2024;1;FORTALEZA;43143;PROFESSOR GERSON;85;371;;1;EEEP PROFESSOR CESAR CAMPELO;RUA 717, N.164, 3 ETAPA;CONJUNTO CEARÁ I;
2024;1;FORTALEZA;43143;PROFESSOR GERSON;85;375;;2;COLÉGIO LUÍZA TÁVORA;RUA 1050, N 171, 4 ETAPA;CONJUNTO CEARÁ I;
2024;1;FORTALEZA;43143;PROFESSOR GERSON;85;381;;1;EEM PROF JOSE MARIA CAMPOS DE OLIVEIRA - UV 8;RUA 820 S/N - 3 ETAPA;CONJUNTO CEARÁ I;
2024;1;FORTALEZA;43143;PROFESSOR GERSON;85;387;;1;EEFM DR UBIRAJARA INDIO DO CEARA - UV-7A;RUA SETECENTOS E CINQUENTA E UM, 192, 3A ETAPA;CONJUNTO CEARÁ I;
2024;1;FORTALEZA;43143;PROFESSOR GERSON;93;95;;1;CEI ROGACIANO LEITE;AVENIDA J, 1488 - III ETAPA;PREFEITO JOSÉ WALTER;
2024;1;FORTALEZA;43143;PROFESSOR GERSON;93;113;;1;CEI MARIA HERCILIA EVANGELISTA;RUA 3, 300 - PARQUE SANTANA;MONDUBIM;
2024;1;FORTALEZA;43143;PROFESSOR GERSON;93;115;;1;CEI MARIA HERCILIA EVANGELISTA;RUA 3, 300 - PARQUE SANTANA;MONDUBIM;
2024;1;FORTALEZA;43143;PROFESSOR GERSON;93;116;;1;CEI MARIA HERCILIA EVANGELISTA;RUA 3, 300 - PARQUE SANTANA;MONDUBIM;
2024;1;FORTALEZA;43143;PROFESSOR GERSON;93;156;;1;CUCA JOSÉ WALTER;RUA 69, S/N;PREFEITO JOSÉ WALTER;
2024;1;FORTALEZA;43143;PROFESSOR GERSON;93;177;;1;EEFM ESTADO DO MARANHAO;RUA CARLOS PIMENTA,506;MONDUBIM;
2024;1;FORTALEZA;43143;PROFESSOR GERSON;93;179;;1;EEFM ESTADO DO MARANHAO;RUA CARLOS PIMENTA,506;MONDUBIM;
2024;1;FORTALEZA;43143;PROFESSOR GERSON;93;205;;1;LICEU ESTADUAL DOMINGOS BRASILEIRO;RUA PLANALTINA, S/N;PLANALTO AYRTON SENNA;
2024;1;FORTALEZA;43143;PROFESSOR GERSON;93;207;;2;LICEU ESTADUAL DOMINGOS BRASILEIRO;RUA PLANALTINA, S/N;PLANALTO AYRTON SENNA;
2024;1;FORTALEZA;43143;PROFESSOR GERSON;93;209;;1;CEI RACHEL DE QUEIROZ;RUA 41, S/N - II ETAPA;PREFEITO JOSÉ WALTER;
2024;1;FORTALEZA;43143;PROFESSOR GERSON;93;211;;1;CEI RACHEL DE QUEIROZ;RUA 41, S/N - II ETAPA;PREFEITO JOSÉ WALTER;
2024;1;FORTALEZA;43143;PROFESSOR GERSON;93;279;;1;CENTRO DE INCLUSÃO TECNOLÓGICA E SOCIAL - CITS JOSÉ WALTER;AV. K, 330, SEGUNDA ETAPA;PREFEITO JOSÉ WALTER;
2024;1;FORTALEZA;43143;PROFESSOR GERSON;93;281;;1;EM PROFESSORA IRENE DE SOUZA PEREIRA;RUA PARQUE UMARI, 100;PLANALTO AYRTON SENNA;
2024;1;FORTALEZA;43143;PROFESSOR GERSON;93;288;;1;CENTRO EDUCACIONAL BRAGA GUERRA;RUA D, N 414;MONDUBIM;
2024;1;FORTALEZA;43143;PROFESSOR GERSON;94;68;;1;CEI JOAQUIM NOGUEIRA;R. SAO VICENTE DE PAULO, 72-126;ANTÔNIO BEZERRA;
2024;1;FORTALEZA;43143;PROFESSOR GERSON;94;327;;1;COLEGIO SALOME BASTOS;RUA DESEMBARGADOR HERMES PARAHYBA 1120;VILA VELHA;
2024;1;FORTALEZA;43143;PROFESSOR GERSON;94;575;;1;EMEIF HERONDINA LIMA CAVALCANTE;AV. AMBIENTALISTA ARY THIERS, 310;VILA VELHA;
2024;1;FORTALEZA;43143;PROFESSOR GERSON;94;897;;1;EEMTI MONSENHOR DOURADO;AVENIDA SARGENTO HERMÍNIO SAMPAIO 4600;PADRE ANDRADE;
2024;1;FORTALEZA;43143;PROFESSOR GERSON;95;88;;1;EEFM PADRE MARCELINO CHAMPAGNAT;RUA DAURA, 120;BARROSO;
2024;1;FORTALEZA;43143;PROFESSOR GERSON;95;122;;1;EMEIEF LIONS CLUBE FORTALEZA FÁTIMA;TRAVESSA LIONS CLUBE, 141;JANGURUSSU;
2024;1;FORTALEZA;43143;PROFESSOR GERSON;95;126;;1;EMEIEF LIONS CLUBE FORTALEZA FÁTIMA;TRAVESSA LIONS CLUBE, 141;JANGURUSSU;
2024;1;FORTALEZA;43143;PROFESSOR GERSON;95;129;;1;EM PROFESSOR FRANCISCO DE MELO JABORANDI;AV. GOVERNADOR LEONEL BRIZOLA, 198;JANGURUSSU;
2024;1;FORTALEZA;43143;PROFESSOR GERSON;95;130;;2;EM PROFESSOR FRANCISCO DE MELO JABORANDI;AV. GOVERNADOR LEONEL BRIZOLA, 198;JANGURUSSU;
2024;1;FORTALEZA;43143;PROFESSOR GERSON;95;132;;1;EM PROFESSOR FRANCISCO DE MELO JABORANDI;AV. GOVERNADOR LEONEL BRIZOLA, 198;JANGURUSSU;
2024;1;FORTALEZA;43143;PROFESSOR GERSON;95;150;;1;EEFM ALMIRANTE TAMANDARÉ;RUA DO MANDACARU, 1048 CJ ALMIRANTE TAMANDARÉ;JANGURUSSU;
2024;1;FORTALEZA;43143;PROFESSOR GERSON;95;179;;1;DNIT;RODOVIA BR-116, KM 06;CAJAZEIRAS;
2024;1;FORTALEZA;43143;PROFESSOR GERSON;95;185;;1;DNIT;RODOVIA BR-116, KM 06;CAJAZEIRAS;
2024;1;FORTALEZA;43143;PROFESSOR GERSON;95;204;;1;EEEP MÁRIO ALENCAR;RUA VERDE 44, 97 (CJ. SÍTIO SÃO JOÃO);JANGURUSSU;
2024;1;FORTALEZA;43143;PROFESSOR GERSON;95;237;;1;EMEIEF TAÍS MARIA BEZERRA NOGUEIRA;AV. GOVERNADOR LEONEL BRIZOLA, 710;JANGURUSSU;
2024;1;FORTALEZA;43143;PROFESSOR GERSON;95;241;;1;EMEIEF TAÍS MARIA BEZERRA NOGUEIRA;AV. GOVERNADOR LEONEL BRIZOLA, 710;JANGURUSSU;
2024;1;FORTALEZA;43143;PROFESSOR GERSON;95;247;;3;CITS - CENTRO DE INCLUSÃO TECNOLÓGICA E SOCIAL;RUA L, 20, CONJUNTO JOÃO PAULO II;JANGURUSSU;
2024;1;FORTALEZA;43143;PROFESSOR GERSON;95;259;;1;EEFM PROFESSOR  ALOYSIO BARROS LEAL;RUA 10,  LOT. PRQ.VERDE 28 (CJ JOAO PAULO II);BARROSO;
2024;1;FORTALEZA;43143;PROFESSOR GERSON;95;264;;1;EEFM PROFESSOR  ALOYSIO BARROS LEAL;RUA 10,  LOT. PRQ.VERDE 28 (CJ JOAO PAULO II);BARROSO;
2024;1;FORTALEZA;43143;PROFESSOR GERSON;95;275;;1;EMEIF PROFESSORA OLINDINA CARVALHO DE MORAIS;RUA 5, 581 (CJ JOÃO PAULO II);BARROSO;
2024;1;FORTALEZA;43143;PROFESSOR GERSON;95;284;;1;EM PROFESSORA MARIA ANTONÉZIA MEIRELES E SÁ;RUA CORONEL VIRGÍLIO TÁVORA, 1340;BARROSO;
2024;1;FORTALEZA;43143;PROFESSOR GERSON;95;287;;1;EM PROFESSORA MARIA ANTONÉZIA MEIRELES E SÁ;RUA CORONEL VIRGÍLIO TÁVORA, 1340;BARROSO;
2024;1;FORTALEZA;43143;PROFESSOR GERSON;95;293;;1;EMEIEF MARTHA DOS MARTINS COELHO GUILHERME;RUA 313, 243, CONJUNTO SÃO CRISTÓVÃO;JANGURUSSU;
2024;1;FORTALEZA;43143;PROFESSOR GERSON;95;294;;3;EMEIEF MARTHA DOS MARTINS COELHO GUILHERME;RUA 313, 243, CONJUNTO SÃO CRISTÓVÃO;JANGURUSSU;
2024;1;FORTALEZA;43143;PROFESSOR GERSON;95;300;;2;CITS - CENTRO DE INCLUSÃO TECNOLÓGICA E SOCIAL;RUA L, 20, CONJUNTO JOÃO PAULO II;JANGURUSSU;
2024;1;FORTALEZA;43143;PROFESSOR GERSON;95;305;;1;EEFM PROF. PAULO AYRTON ARAUJO;BR 116 KM 05, AO LADO DA EMPRESA GUANABARA;CAJAZEIRAS;
2024;1;FORTALEZA;43143;PROFESSOR GERSON;95;307;;1;EMEIF MARIA DE JESUS ORIÁ ALENCAR;RUA VERDE QUARENTA E TRÊS, S/N, CONJUNTO SÍTIO SÃO JOÃO;JANGURUSSU;
2024;1;FORTALEZA;43143;PROFESSOR GERSON;95;311;;2;EM PROFESSORA MARIA DO SOCORRO FERREIRA VIRINO;RUA MODESTA, 44;CONJUNTO PALMEIRAS;
2024;1;FORTALEZA;43143;PROFESSOR GERSON;95;315;;1;EM PROFESSORA MARIA DO SOCORRO FERREIRA VIRINO;RUA MODESTA, 44;CONJUNTO PALMEIRAS;
2024;1;FORTALEZA;43143;PROFESSOR GERSON;95;323;;1;EM PROFESSORA MARIA ANTONÉZIA MEIRELES E SÁ;RUA CORONEL VIRGÍLIO TÁVORA, 1340;BARROSO;
2024;1;FORTALEZA;43143;PROFESSOR GERSON;95;325;;1;EM PROFESSOR FRANCISCO DE MELO JABORANDI;AV. GOVERNADOR LEONEL BRIZOLA, 198;JANGURUSSU;
2024;1;FORTALEZA;43143;PROFESSOR GERSON;95;342;;1;CEI MARIA DO SOCORRO FERREIRA VIRINO;RUA VALPARAÍSO, 339;CONJUNTO PALMEIRAS;
2024;1;FORTALEZA;43143;PROFESSOR GERSON;95;343;;1;CUCA JANGURUSSU;AV. GOVERNADOR LEONEL BRIZOLA, S/N;JANGURUSSU;
2024;1;FORTALEZA;43143;PROFESSOR GERSON;95;352;;1;CEI MARIA DO SOCORRO FERREIRA VIRINO;RUA VALPARAÍSO, 339;CONJUNTO PALMEIRAS;
2024;1;FORTALEZA;43143;PROFESSOR GERSON;95;353;;1;CUCA JANGURUSSU;AV. GOVERNADOR LEONEL BRIZOLA, S/N;JANGURUSSU;
2024;1;FORTALEZA;43143;PROFESSOR GERSON;95;362;;1;CEI MANOEL PINHEIRO DOS SANTOS;RUA LADISLAU LOURENÇO, S/N;JANGURUSSU;
2024;1;FORTALEZA;43143;PROFESSOR GERSON;112;30;;1;COLÉGIO ANTARES - SEDE WASHINGTON SOARES;RUA CAETANO XIMENES ARAGÃO,110 - ACESSO PELA RUA ARMANDO DALL'OLIO;ENGENHEIRO LUCIANO CAVALCANTE;
2024;1;FORTALEZA;43143;PROFESSOR GERSON;112;95;;1;EM ISMAEL PORDEUS;RUA DES FAUSTINO ALBUQUERQUE, 511;JARDIM DAS OLIVEIRAS;
2024;1;FORTALEZA;43143;PROFESSOR GERSON;112;278;;1;COLÉGIO ANTARES - SEDE WASHINGTON SOARES;RUA CAETANO XIMENES ARAGÃO,110 - ACESSO PELA RUA ARMANDO DALL'OLIO;ENGENHEIRO LUCIANO CAVALCANTE;
2024;1;FORTALEZA;43143;PROFESSOR GERSON;112;358;;1;COLEGIO GLOBOMAX;RUA GENERAL CAIADO DE CASTRO, 156;ENGENHEIRO LUCIANO CAVALCANTE;
2024;1;FORTALEZA;43143;PROFESSOR GERSON;112;438;;1;COLEGIO ARI DE SA CAVALCANTE WS;AV WASHINGTON SOARES, 3737;EDSON QUEIROZ;
2024;1;FORTALEZA;43143;PROFESSOR GERSON;112;555;;1;CENTRO UNIVERSITÁRIO 7 DE SETEMBRO - UNI 7 (FA7);AV. ALMIRANTE MAXIMINIANO DA FONSECA, 1395;ENGENHEIRO LUCIANO CAVALCANTE;
2024;1;FORTALEZA;43143;PROFESSOR GERSON;113;24;;1;IFCE - INST FEDERAL DE CIÊNCIA E TECNOLOGIA (CEFET);AV. 13 DE MAIO, 2081;BENFICA;
2024;1;FORTALEZA;43143;PROFESSOR GERSON;113;65;;1;COLÉGIO JUVENAL DE CARVALHO;AV. JOÃO PESSOA, 4279;DAMAS;
2024;1;FORTALEZA;43143;PROFESSOR GERSON;113;108;;1;COLÉGIO CHRISTUS BENFICA;RUA LUIS DE MIRANDA, 536;BENFICA;
2024;1;FORTALEZA;43143;PROFESSOR GERSON;113;110;;1;COLÉGIO CHRISTUS BENFICA;RUA LUIS DE MIRANDA, 536;BENFICA;
2024;1;FORTALEZA;43143;PROFESSOR GERSON;113;159;;1;COLÉGIO MEDALHA MILAGROSA;RUA PADRE JOÃO PIAMARTA,  415;BOM FUTURO;
2024;1;FORTALEZA;43143;PROFESSOR GERSON;113;201;;1;COLÉGIO CHRISTUS PRÉ - UNIVERSITÁRIO;RUA CRUZ SALDANHA, 614;PARQUELÂNDIA;
2024;1;FORTALEZA;43143;PROFESSOR GERSON;113;204;;1;COLÉGIO CHRISTUS PRÉ - UNIVERSITÁRIO;RUA CRUZ SALDANHA, 614;PARQUELÂNDIA;
2024;1;FORTALEZA;43143;PROFESSOR GERSON;113;232;;1;EEFM ANTONIO SALES - PARQUELÂNDIA;RUA PROF. ANACLETO, 630;PARQUELÂNDIA;
2024;1;FORTALEZA;43143;PROFESSOR GERSON;113;264;;1;ESC. MUNICIPAL ANTONIO SALES RODOLFO TEÓFILO;RUA TAVARES IRACEMA, 675;RODOLFO TEÓFILO;
2024;1;FORTALEZA;43143;PROFESSOR GERSON;113;270;;1;FACULDADE DE ENFERMAGEM DA UFC;RUA ALEXANDRE BARAÚNA, 1115;RODOLFO TEÓFILO;
2024;1;FORTALEZA;43143;PROFESSOR GERSON;113;272;;2;COLÉGIO JUVENAL DE CARVALHO;AV. JOÃO PESSOA, 4279;DAMAS;
2024;1;FORTALEZA;43143;PROFESSOR GERSON;113;296;;1;COLÉGIO GUSTAVO BRAGA;AV. JOÃO PESSOA, 4650/80;DAMAS;
2024;1;FORTALEZA;43143;PROFESSOR GERSON;113;321;;1;FACULDADE DE ENFERMAGEM DA UFC;RUA ALEXANDRE BARAÚNA, 1115;RODOLFO TEÓFILO;
2024;1;FORTALEZA;43143;PROFESSOR GERSON;113;334;;1;ESCOLA ESTADUAL DE EDUCAÇÃO PROFISSIONAL  PRESIDENTE ROOSEVELT;AV BEZERRA DE MENEZES 435;FARIAS BRITO;
2024;1;FORTALEZA;43143;PROFESSOR GERSON;113;418;;1;EEFM MARECHAL HUMBERTO DE ALENCAR C. BRANCO;RUA ALVARO FERNANDES, 913;MONTESE;
2024;1;FORTALEZA;43143;PROFESSOR GERSON;113;439;;1;ESCOLA PROF. PE. JOÃO PIAMARTA (ANEXO JÚNIOR);RUA PE. JOÃO PIAMARTA, 161;BOM FUTURO;
2024;1;FORTALEZA;43143;PROFESSOR GERSON;114;19;;1;SENAI - CENTRO DE FORMAÇÃO PROFISSIONAL;AVENIDA FRANCISCO SÁ 7221;BARRA DO CEARÁ;
2024;1;FORTALEZA;43143;PROFESSOR GERSON;114;42;;1;EM CASIMIRO JOSÉ LIMA FILHO;AVENIDA FRANCISCO SÁ 6449;BARRA DO CEARÁ;
2024;1;FORTALEZA;43143;PROFESSOR GERSON;114;51;;1;EM FRANCISCO DOMINGOS DA SILVA;AVENIDA PRESIDENTE CASTELO BRANCO 4707;BARRA DO CEARÁ;
2024;1;FORTALEZA;43143;PROFESSOR GERSON;114;104;;1;COLÉGIO SANTA ISABEL;AVENIDA BEZERRA DE MENEZES 2840;PRESIDENTE KENNEDY;
2024;1;FORTALEZA;43143;PROFESSOR GERSON;114;105;;1;COLÉGIO SANTA ISABEL;AVENIDA BEZERRA DE MENEZES 2840;PRESIDENTE KENNEDY;
2024;1;FORTALEZA;43143;PROFESSOR GERSON;114;125;;1;EM  RACHEL DE QUEIROZ;AVENIDA PRESIDENTE CASTELO BRANCO 5010;BARRA DO CEARÁ;
2024;1;FORTALEZA;43143;PROFESSOR GERSON;114;134;;1;EEFM ESTADO DE ALAGOAS;AVENIDA PRESIDENTE CASTELO BRANCO, 5244;BARRA DO CEARÁ;
2024;1;FORTALEZA;43143;PROFESSOR GERSON;114;186;;1;EM JADER DE FIGUEIREDO CORREIA;RUA TOCANDIRA 61;BARRA DO CEARÁ;
2024;1;FORTALEZA;43143;PROFESSOR GERSON;114;228;;1;EM DOM ANTONIO BATISTA DE FRAGOSO;AVENIDA FRANCISCO SÁ 7945;BARRA DO CEARÁ;
2024;1;FORTALEZA;43143;PROFESSOR GERSON;114;230;;1;EM DOM ANTONIO BATISTA DE FRAGOSO;AVENIDA FRANCISCO SÁ 7945;BARRA DO CEARÁ;
2024;1;FORTALEZA;43143;PROFESSOR GERSON;114;233;;1;EM JADER DE FIGUEIREDO CORREIA;RUA TOCANDIRA 61;BARRA DO CEARÁ;
2024;1;FORTALEZA;43143;PROFESSOR GERSON;114;248;;1;CENTRO DE EDUCAÇÃO COMPLEMENTAR (CEDCE) - ANTIGO SESI;AVENIDA FRANCISCO SÁ 6623;BARRA DO CEARÁ;
2024;1;FORTALEZA;43143;PROFESSOR GERSON;114;255;;1;EEEP PAULO PETROLA;RUA SAUDÁRIA, S/N - GOIABEIRAS;BARRA DO CEARÁ;
2024;1;FORTALEZA;43143;PROFESSOR GERSON;114;268;;1;ESCOLINHA MUNDO INFANTIL;AVENIDA SARGENTO HERMÍNIO SAMPAIO 3787;PRESIDENTE KENNEDY;
2024;1;FORTALEZA;43143;PROFESSOR GERSON;114;272;;1;EEEP PAULO PETROLA;RUA SAUDÁRIA, S/N - GOIABEIRAS;BARRA DO CEARÁ;
2024;1;FORTALEZA;43143;PROFESSOR GERSON;114;281;;1;EM FRANCISCO DOMINGOS DA SILVA;AVENIDA PRESIDENTE CASTELO BRANCO 4707;BARRA DO CEARÁ;
2024;1;FORTALEZA;43143;PROFESSOR GERSON;114;288;;1;EMTI ALDEMIR MARTINS;AV. FRANCISCO SÁ, 7460;BARRA DO CEARÁ;
2024;1;FORTALEZA;43143;PROFESSOR GERSON;114;301;;4;EM AGOSTINHO MOREIRA E SILVA;RUA PERI, 20;BARRA DO CEARÁ;
2024;1;FORTALEZA;43143;PROFESSOR GERSON;114;302;;2;EM FRANCISCO DOMINGOS DA SILVA;AVENIDA PRESIDENTE CASTELO BRANCO 4707;BARRA DO CEARÁ;
2024;1;FORTALEZA;43143;PROFESSOR GERSON;114;303;;1;CENTRO EDUCACIONAL ALFA;RUA CHICO XAVIER, 181;BARRA DO CEARÁ;
2024;1;FORTALEZA;43143;PROFESSOR GERSON;114;323;;1;EMTI ALDEMIR MARTINS;AV. FRANCISCO SÁ, 7460;BARRA DO CEARÁ;
2024;1;FORTALEZA;43143;PROFESSOR GERSON;114;332;;1;EM AGOSTINHO MOREIRA E SILVA;RUA PERI, 20;BARRA DO CEARÁ;
2024;1;FORTALEZA;43143;PROFESSOR GERSON;114;336;;1;EM AGOSTINHO MOREIRA E SILVA;RUA PERI, 20;BARRA DO CEARÁ;
2024;1;FORTALEZA;43143;PROFESSOR GERSON;114;340;;3;EM AGOSTINHO MOREIRA E SILVA;RUA PERI, 20;BARRA DO CEARÁ;
2024;1;FORTALEZA;43143;PROFESSOR GERSON;114;345;;1;EM AGOSTINHO MOREIRA E SILVA;RUA PERI, 20;BARRA DO CEARÁ;
2024;1;FORTALEZA;43143;PROFESSOR GERSON;114;347;;2;EM DOIS DE DEZEMBRO;RUA ARAKEN, 860;BARRA DO CEARÁ;
2024;1;FORTALEZA;43143;PROFESSOR GERSON;114;348;;1;EMTI ALDEMIR MARTINS;AV. FRANCISCO SÁ, 7460;BARRA DO CEARÁ;
2024;1;FORTALEZA;43143;PROFESSOR GERSON;114;353;;2;EMTI ALDEMIR MARTINS;AV. FRANCISCO SÁ, 7460;BARRA DO CEARÁ;
2024;1;FORTALEZA;43143;PROFESSOR GERSON;114;355;;1;EM AGOSTINHO MOREIRA E SILVA;RUA PERI, 20;BARRA DO CEARÁ;
2024;1;FORTALEZA;43143;PROFESSOR GERSON;115;22;;1;EEM  PROFESSORA DIVA CABRAL;RUA HOLANDA, 701;MARAPONGA;
2024;1;FORTALEZA;43143;PROFESSOR GERSON;115;23;;1;EEM  PROFESSORA DIVA CABRAL;RUA HOLANDA, 701;MARAPONGA;
2024;1;FORTALEZA;43143;PROFESSOR GERSON;115;25;;1;EEM  PROFESSORA DIVA CABRAL;RUA HOLANDA, 701;MARAPONGA;
2024;1;FORTALEZA;43143;PROFESSOR GERSON;115;26;;3;EEM  PROFESSORA DIVA CABRAL;RUA HOLANDA, 701;MARAPONGA;
2024;1;FORTALEZA;43143;PROFESSOR GERSON;115;27;;2;EEM  PROFESSORA DIVA CABRAL;RUA HOLANDA, 701;MARAPONGA;
2024;1;FORTALEZA;43143;PROFESSOR GERSON;115;29;;1;ESCOLA MARISTA SAGRADO CORAÇÃO;RUA VIDAL DE NEGREIROS, 550;JARDIM CEARENSE;
2024;1;FORTALEZA;43143;PROFESSOR GERSON;115;30;;2;ESCOLA MARISTA SAGRADO CORAÇÃO;RUA VIDAL DE NEGREIROS, 550;JARDIM CEARENSE;
2024;1;FORTALEZA;43143;PROFESSOR GERSON;115;32;;2;EM THOMAZ POMPEU SOBRINHO;RUA JOSE MENELEU, 531;PARANGABA;
2024;1;FORTALEZA;43143;PROFESSOR GERSON;115;36;;1;EM THOMAZ POMPEU SOBRINHO;RUA JOSE MENELEU, 531;PARANGABA;
2024;1;FORTALEZA;43143;PROFESSOR GERSON;115;42;;1;UNIVERSIDADE ESTADUAL DO CEARA - UECE;AV DR. SILAS MUNGUBA, 1700;ITAPERI;
2024;1;FORTALEZA;43143;PROFESSOR GERSON;115;45;;1;UNIVERSIDADE ESTADUAL DO CEARA - UECE;AV DR. SILAS MUNGUBA, 1700;ITAPERI;
2024;1;FORTALEZA;43143;PROFESSOR GERSON;115;89;;1;COLEGIO DUQUE DE CAXIAS;RUA  PERU, 1675;SERRINHA;
2024;1;FORTALEZA;43143;PROFESSOR GERSON;115;116;;1;DETRAN;AV GODOFREDO MACIEL, 2900;MARAPONGA;
2024;1;FORTALEZA;43143;PROFESSOR GERSON;115;117;;2;DETRAN;AV GODOFREDO MACIEL, 2900;MARAPONGA;
2024;1;FORTALEZA;43143;PROFESSOR GERSON;115;120;;1;DETRAN;AV GODOFREDO MACIEL, 2900;MARAPONGA;
2024;1;FORTALEZA;43143;PROFESSOR GERSON;115;121;;1;DETRAN;AV GODOFREDO MACIEL, 2900;MARAPONGA;
2024;1;FORTALEZA;43143;PROFESSOR GERSON;115;130;;1;COLEGIO PROVECTO;RUA SUIÇA, 76;MARAPONGA;
2024;1;FORTALEZA;43143;PROFESSOR GERSON;115;133;;2;COLEGIO PROVECTO;RUA SUIÇA, 76;MARAPONGA;
2024;1;FORTALEZA;43143;PROFESSOR GERSON;115;134;;1;COLEGIO PROVECTO;RUA SUIÇA, 76;MARAPONGA;
2024;1;FORTALEZA;43143;PROFESSOR GERSON;115;190;;1;EEMTI MARIA THOMÁSIA;RUA POLONIA, 369;PARANGABA;
