Ano;Turno;Município;Número;Candidato;Zona;Seção;Seções Agregadas;Votos;Local de Votação;Endereço Local de Votação;Bairro;
2024;1;FORTALEZA;11010;ROSA ANDRADE;1;142;;1;ESCOLA ESTADUAL ARQUITETO ROGERIO FROES;AVENIDA DAS GRAVIOLAS 1000;CIDADE 2000;
2024;1;FORTALEZA;11010;ROSA ANDRADE;1;348;;1;ESCOLA MUNICIPAL JOSE RAMOS TORRES DE MELO;AVENIDA DA ABOLIÇÃO 3984;MUCURIPE;
2024;1;FORTALEZA;11010;ROSA ANDRADE;1;350;;1;ESCOLA MUNICIPAL JOSE RAMOS TORRES DE MELO;AVENIDA DA ABOLIÇÃO 3984;MUCURIPE;
2024;1;FORTALEZA;11010;ROSA ANDRADE;1;382;;1;ESCOLA PROFISSIONAL MARIA ANGELA DA SILVEIRA BORGES;RUA PINTOR ANTONIO BANDEIRA, S/N;VICENTE PINZON;
2024;1;FORTALEZA;11010;ROSA ANDRADE;1;496;;1;ESCOLA ESTADUAL MATIAS BECK;RUA  PROFESSORA AIDA BALAIO 38;MUCURIPE;
2024;1;FORTALEZA;11010;ROSA ANDRADE;1;623;;1;ESCOLA DE GASTRONOMIA SOCIAL IVENS DIAS BRANCO;RUA MANUEL DIAS BRANCO,80;CAIS DO PORTO;
2024;1;FORTALEZA;11010;ROSA ANDRADE;1;636;;1;EEFM - HELENITA MOTA;RUA AMANCIO FILOMENO,720;CAIS DO PORTO;
2024;1;FORTALEZA;11010;ROSA ANDRADE;1;757;;1;ESCOLA ESTADUAL MURILO BORGES;RUA DO ENTARDECER 90;VICENTE PINZON;
2024;1;FORTALEZA;11010;ROSA ANDRADE;1;813;;1;UNINTA - FACULDADE UNINTA FORTALEZA;RUA VILEBALDO AGUIAR,133;COCÓ;
2024;1;FORTALEZA;11010;ROSA ANDRADE;1;851;;1;ESCOLA ESTADUAL DRAGAO DO MAR;RUA UMARI S/N;MUCURIPE;
2024;1;FORTALEZA;11010;ROSA ANDRADE;1;922;;1;ESCOLA MUNICIPAL PROF BELARMINA CAMPOS;RUA MANOEL RODRIGUES MONTEIRO, 840;VICENTE PINZON;
2024;1;FORTALEZA;11010;ROSA ANDRADE;2;73;;1;EEEP JOSE DE BARCELOS;RUA ANGELICA GURGEL 362;MESSEJANA;
2024;1;FORTALEZA;11010;ROSA ANDRADE;2;93;;1;CLUBE DA CAIXA;AVENIDA FREI CIRILO 4700;MESSEJANA;
2024;1;FORTALEZA;11010;ROSA ANDRADE;2;454;;1;COLÉGIO SERAFICO NOSSA SENHORA DO BRASIL;AVENIDA FREI CIRILO 4454;MESSEJANA;
2024;1;FORTALEZA;11010;ROSA ANDRADE;2;484;;2;COLÉGIO SERAFICO NOSSA SENHORA DO BRASIL;AVENIDA FREI CIRILO 4454;MESSEJANA;
2024;1;FORTALEZA;11010;ROSA ANDRADE;2;654;;1;CMES ANISIO TEIXEIRA;TRAVESSA DO GUARANI, 355;PAUPINA;
2024;1;FORTALEZA;11010;ROSA ANDRADE;2;704;;1;CMES ANISIO TEIXEIRA;TRAVESSA DO GUARANI, 355;PAUPINA;
2024;1;FORTALEZA;11010;ROSA ANDRADE;2;735;;1;CMES ANISIO TEIXEIRA;TRAVESSA DO GUARANI, 355;PAUPINA;
2024;1;FORTALEZA;11010;ROSA ANDRADE;2;783;;1;FACULDADE ATENEU DO CEARÁ;AV. COLETOR ANTONIO GADELHA, 621;MESSEJANA;
2024;1;FORTALEZA;11010;ROSA ANDRADE;2;794;;1;FACULDADE ATENEU DO CEARÁ;AV. COLETOR ANTONIO GADELHA, 621;MESSEJANA;
2024;1;FORTALEZA;11010;ROSA ANDRADE;3;285;;1;EM SÃO RAFAEL;RUA DOS TABAJARAS, 244;PRAIA DE IRACEMA;
2024;1;FORTALEZA;11010;ROSA ANDRADE;3;446;;1;EEFM SANTA LUZIA;RUA JOÃO CORDEIRO, 711;PRAIA DE IRACEMA;
2024;1;FORTALEZA;11010;ROSA ANDRADE;3;482;;1;COLÉGIO ANTARES (PRAIA DE IRACEMA);RUA HISTORIADOR GUARINO ALVES, 95;PRAIA DE IRACEMA;
2024;1;FORTALEZA;11010;ROSA ANDRADE;3;486;;1;COLÉGIO ANTARES (PRAIA DE IRACEMA);RUA HISTORIADOR GUARINO ALVES, 95;PRAIA DE IRACEMA;
2024;1;FORTALEZA;11010;ROSA ANDRADE;3;621;;1;COLÉGIO BATISTA - SANTOS DUMONT;RUA DESEMBARGADOR LEITE ALBUQUERQUE, 1056;ALDEOTA;
2024;1;FORTALEZA;11010;ROSA ANDRADE;80;281;;1;EEF GAL.  MANUEL CORDEIRO NETO;RUA JORGE ACURCIO, 900;VILA UNIÃO;
2024;1;FORTALEZA;11010;ROSA ANDRADE;80;299;;1;IGREJA MATRIZ DA AEROLÂNDIA - PARÓQUIA N. SRA DO SAGRADO CORAÇÃO;RUA ASPIRANTE MENDES, 540;AEROLÂNDIA;
2024;1;FORTALEZA;11010;ROSA ANDRADE;80;441;;1;COLÉGIO ANTARES FÁTIMA (VILA UNIÃO);RUA ALBERTO MONTEZUMA, 235;VILA UNIÃO;
2024;1;FORTALEZA;11010;ROSA ANDRADE;82;60;;1;ESCOLA MUNICIPAL NOSSA SENHORA DO PERPÉTUO SOCORRO - EF;RUA CÔNSUL GOUVEIA, 57;ÁLVARO WEYNE;
2024;1;FORTALEZA;11010;ROSA ANDRADE;82;63;;2;ESCOLA MUNICIPAL NOSSA SENHORA DO PERPÉTUO SOCORRO - EF;RUA CÔNSUL GOUVEIA, 57;ÁLVARO WEYNE;
2024;1;FORTALEZA;11010;ROSA ANDRADE;82;66;;1;EMEIEF CRISTO REDENTOR;AV. PASTEUR, 372;CRISTO REDENTOR;
2024;1;FORTALEZA;11010;ROSA ANDRADE;82;76;702;2;COLÉGIO MARIA ALICE;AV. PASTEUR, 700;CARLITO PAMPLONA;
2024;1;FORTALEZA;11010;ROSA ANDRADE;82;108;;1;CENTRO DE CIDADANIA GOV. VIRGÍLIO TÁVORA - CCDH;AV. MONSENHOR HELIO CAMPOS, 178;CRISTO REDENTOR;
2024;1;FORTALEZA;11010;ROSA ANDRADE;82;122;;1;EEFM LIONS JANGADA - EEMTI;RUA CAMÉLIA, 352;CRISTO REDENTOR;
2024;1;FORTALEZA;11010;ROSA ANDRADE;82;181;;1;EEFM CLÁUDIO MARTINS;RUA DEMÓCRITO ROCHA, 400;MONTE CASTELO;
2024;1;FORTALEZA;11010;ROSA ANDRADE;82;205;;1;ESCOLA MUNICIPAL PROFESSOR MARTINZ DE AGUIAR - EI/EF;RUA BERNARDO PORTO, 490;MONTE CASTELO;
2024;1;FORTALEZA;11010;ROSA ANDRADE;82;226;;1;CENTRO EDUCACIONAL MOEMA TÁVORA;RUA MARCÍLIO DIAS, 485;PIRAMBU;
2024;1;FORTALEZA;11010;ROSA ANDRADE;82;227;;2;CENTRO EDUCACIONAL MOEMA TÁVORA;RUA MARCÍLIO DIAS, 485;PIRAMBU;
2024;1;FORTALEZA;11010;ROSA ANDRADE;82;233;;1;EEFM GOVERNADOR FLÁVIO MARCÍLIO;AV. PASTEUR, 575;PIRAMBU;
2024;1;FORTALEZA;11010;ROSA ANDRADE;82;240;;1;EEFM GOVERNADOR FLÁVIO MARCÍLIO;AV. PASTEUR, 575;PIRAMBU;
2024;1;FORTALEZA;11010;ROSA ANDRADE;82;243;;1;EEFM GOVERNADOR FLÁVIO MARCÍLIO;AV. PASTEUR, 575;PIRAMBU;
2024;1;FORTALEZA;11010;ROSA ANDRADE;82;244;;1;ESCOLA MUNICIPAL HILBERTO SILVA - EI/EF;AV. PRESIDENTE CASTELO BRANCO, 2973;PIRAMBU;
2024;1;FORTALEZA;11010;ROSA ANDRADE;82;248;;1;ESCOLA MUNICIPAL HILBERTO SILVA - EI/EF;AV. PRESIDENTE CASTELO BRANCO, 2973;PIRAMBU;
2024;1;FORTALEZA;11010;ROSA ANDRADE;82;379;;1;COLÉGIO MENINO JESUS DE PRAGA;RUA ANA FACÓ, 140;CARLITO PAMPLONA;
2024;1;FORTALEZA;11010;ROSA ANDRADE;82;382;;1;COLÉGIO MENINO JESUS DE PRAGA;RUA ANA FACÓ, 140;CARLITO PAMPLONA;
2024;1;FORTALEZA;11010;ROSA ANDRADE;82;423;;1;EEFM LIONS JANGADA - EEMTI;RUA CAMÉLIA, 352;CRISTO REDENTOR;
2024;1;FORTALEZA;11010;ROSA ANDRADE;82;462;;1;ESCOLA MUNICIPAL PROFESSOR MARTINZ DE AGUIAR - EI/EF;RUA BERNARDO PORTO, 490;MONTE CASTELO;
2024;1;FORTALEZA;11010;ROSA ANDRADE;82;477;;1;EEFM CLÁUDIO MARTINS;RUA DEMÓCRITO ROCHA, 400;MONTE CASTELO;
2024;1;FORTALEZA;11010;ROSA ANDRADE;82;485;;1;ESCOLA MUNICIPAL LENIRA JUREMA DE MAGALHÃES - EI/EF;RUA TEÓFILO GURGEL, 111;MONTE CASTELO;
2024;1;FORTALEZA;11010;ROSA ANDRADE;82;492;;1;POSTO DE SAÚDE GUIOMAR ARRUDA;RUA COSTA MATOS, 6;PIRAMBU;
2024;1;FORTALEZA;11010;ROSA ANDRADE;82;498;;1;COLÉGIO UNIVERSO MENINO JESUS;RUA DOM QUINTINO, 934;JACARECANGA;
2024;1;FORTALEZA;11010;ROSA ANDRADE;82;579;;1;ESCOLA MUNICIPAL LENIRA JUREMA DE MAGALHÃES - EI/EF;RUA TEÓFILO GURGEL, 111;MONTE CASTELO;
2024;1;FORTALEZA;11010;ROSA ANDRADE;82;611;;1;INSTITUTO MATER AMABILIS;RUA PADRE ANCHIETA, 438;MONTE CASTELO;
2024;1;FORTALEZA;11010;ROSA ANDRADE;82;617;;1;EMEIEF CRISTO REDENTOR;AV. PASTEUR, 372;CRISTO REDENTOR;
2024;1;FORTALEZA;11010;ROSA ANDRADE;82;644;;1;POSTO DE SAÚDE CARLOS RIBEIRO;RUA JACINTO MATOS, 944;JACARECANGA;
2024;1;FORTALEZA;11010;ROSA ANDRADE;82;665;;1;EMEIEF SÃO CURA D'ARS;RUA SANTA ELISA, 722;CRISTO REDENTOR;
2024;1;FORTALEZA;11010;ROSA ANDRADE;82;666;;1;COLÉGIO MANUEL DA SILVA - CARLITO PAMPLONA;AV. FRANCISCO SÁ, 4001;CARLITO PAMPLONA;
2024;1;FORTALEZA;11010;ROSA ANDRADE;82;680;;1;EEFM JOSÉ VALDO RIBEIRO RAMOS - EEMTI;RUA PEDRO AMÉRICO, 100;CARLITO PAMPLONA;
2024;1;FORTALEZA;11010;ROSA ANDRADE;82;689;;1;EEFM JOSÉ VALDO RIBEIRO RAMOS - EEMTI;RUA PEDRO AMÉRICO, 100;CARLITO PAMPLONA;
2024;1;FORTALEZA;11010;ROSA ANDRADE;82;690;;1;EEFM JOSÉ VALDO RIBEIRO RAMOS - EEMTI;RUA PEDRO AMÉRICO, 100;CARLITO PAMPLONA;
2024;1;FORTALEZA;11010;ROSA ANDRADE;83;1;;1;COLÉGIO DA POLÍCIA MILITAR DO CEARÁ GENERAL EDGARD FACÓ;AVENIDA MISTER HULL,  S/N - KM 1;ANTÔNIO BEZERRA;
2024;1;FORTALEZA;11010;ROSA ANDRADE;83;95;;1;EEM  MARIANO MARTINS;AVENIDA SENADOR FERNANDES TÁVORA 1445;HENRIQUE JORGE;
2024;1;FORTALEZA;11010;ROSA ANDRADE;83;235;;1;ESCOLA MUNICIPAL JOSÉ BATISTA DE OLIVEIRA;RUA GOIÁS 620;PANAMERICANO;
2024;1;FORTALEZA;11010;ROSA ANDRADE;83;633;;1;COLEGIO CHRISTUS;AV. ENG. HUMBERTO MONTE, 1355;BELA VISTA;
2024;1;FORTALEZA;11010;ROSA ANDRADE;83;660;;1;EEMTI PROFESSOR PAULO FREIRE;AVENIDA SENADOR FERNANDES TÁVORA 1936;HENRIQUE JORGE;
2024;1;FORTALEZA;11010;ROSA ANDRADE;83;718;;1;ESCOLA MUNICIPAL PROFESSORA MARIA LIDUÍNA CORREA LEITE;RUA FERNÃO MAGALHÃES, 120;PICI;
2024;1;FORTALEZA;11010;ROSA ANDRADE;85;111;;1;CEJA ADELINO DE ALCANTARA FILHO - UV-6;RUA SEISCENTOS E DOZE, 100, 1A ETAPA;CONJUNTO CEARÁ I;
2024;1;FORTALEZA;11010;ROSA ANDRADE;85;125;;1;EMEIF AUTRAN NUNES;RUA PROFESSOR VIRGILIO MORAIS SN;AUTRAN NUNES;
2024;1;FORTALEZA;11010;ROSA ANDRADE;85;162;;1;EM BERGSON GURJÃO FARIAS;AVENIDA SENADOR FERNANDES TÁVORA, 2500;AUTRAN NUNES;
2024;1;FORTALEZA;11010;ROSA ANDRADE;85;165;;1;EM BERGSON GURJÃO FARIAS;AVENIDA SENADOR FERNANDES TÁVORA, 2500;AUTRAN NUNES;
2024;1;FORTALEZA;11010;ROSA ANDRADE;85;178;;1;EMTI MARIA DA HORA;RUA RAIMUNDO RIBEIRO, S/N;AUTRAN NUNES;
2024;1;FORTALEZA;11010;ROSA ANDRADE;85;267;;1;EMEIF DOLORES ALCANTARA;RUA CARDEAL ARCOVERDE S/N;AUTRAN NUNES;
2024;1;FORTALEZA;11010;ROSA ANDRADE;85;287;;1;EMEIF GERARDO MILTON DE SA;RUA VALE COSTA S/N;ANTÔNIO BEZERRA;
2024;1;FORTALEZA;11010;ROSA ANDRADE;85;290;;1;EMEIF GERARDO MILTON DE SA;RUA VALE COSTA S/N;ANTÔNIO BEZERRA;
2024;1;FORTALEZA;11010;ROSA ANDRADE;93;79;;1;EM RACHEL DE QUEIROZ;AVENIDA C, S/N - II ETAPA;PREFEITO JOSÉ WALTER;
2024;1;FORTALEZA;11010;ROSA ANDRADE;93;84;;1;EM RACHEL DE QUEIROZ;AVENIDA C, S/N - II ETAPA;PREFEITO JOSÉ WALTER;
2024;1;FORTALEZA;11010;ROSA ANDRADE;93;98;;1;CEI ROGACIANO LEITE;AVENIDA J, 1488 - III ETAPA;PREFEITO JOSÉ WALTER;
2024;1;FORTALEZA;11010;ROSA ANDRADE;93;125;;1;EEFM DEPUTADO JOACI PEREIRA;RUA PROFESSOR PEDRO JORGE, 830;PLANALTO AYRTON SENNA;
2024;1;FORTALEZA;11010;ROSA ANDRADE;93;136;;1;COLEGIO VEGA;AVENIDA C, 160;PREFEITO JOSÉ WALTER;
2024;1;FORTALEZA;11010;ROSA ANDRADE;93;214;;1;CEJA - CENTRO DE EDUCAÇÃO DE JOVENS E ADULTOS;AV. L, S/N - II ETAPA;PREFEITO JOSÉ WALTER;
2024;1;FORTALEZA;11010;ROSA ANDRADE;93;256;;1;EM FRANCISCO NUNES CAVALCANTE;RUA POETA MÁRIO LINHARES, 561;PREFEITO JOSÉ WALTER;
2024;1;FORTALEZA;11010;ROSA ANDRADE;93;287;;1;CEI RACHEL DE QUEIROZ;RUA 41, S/N - II ETAPA;PREFEITO JOSÉ WALTER;
2024;1;FORTALEZA;11010;ROSA ANDRADE;93;294;;1;CEI MARIA LETICIA MOTA MOREIRA;RUA 15, S/N, RESIDENCIAL CIDADE JARDIM II;PREFEITO JOSÉ WALTER;
2024;1;FORTALEZA;11010;ROSA ANDRADE;94;200;;1;EEFM DONA HILZA DIOGO DE OLIVEIRA;AV. DOM ALOÍSIO LORSCHEIDER, 1040 - VILA VELHA;VILA VELHA;
2024;1;FORTALEZA;11010;ROSA ANDRADE;94;326;;1;COLEGIO SALOME BASTOS;RUA DESEMBARGADOR HERMES PARAHYBA 1120;VILA VELHA;
2024;1;FORTALEZA;11010;ROSA ANDRADE;94;328;;2;EM ANTONIO CORREIA LIMA;RUA HERMES PARAYBA, 934;VILA VELHA;
2024;1;FORTALEZA;11010;ROSA ANDRADE;94;331;;1;CMES PROF JOSE REBOUCAS MACAMBIRA;RUA CARIÚS 200;JARDIM GUANABARA;
2024;1;FORTALEZA;11010;ROSA ANDRADE;94;332;;1;CMES PROF JOSE REBOUCAS MACAMBIRA;RUA CARIÚS 200;JARDIM GUANABARA;
2024;1;FORTALEZA;11010;ROSA ANDRADE;94;574;;1;EEMTI MARIA JOSÉ SANTOS FERREIRA GOMES;RUA DONA LUCIA PINHEIRO, 93;QUINTINO CUNHA;
2024;1;FORTALEZA;11010;ROSA ANDRADE;94;599;;1;EM CASTELO DE CASTRO;RUA 43 1531;VILA VELHA;
2024;1;FORTALEZA;11010;ROSA ANDRADE;94;645;;1;EEM LICEU VILA VELHA;AV. L, 840;VILA VELHA;
2024;1;FORTALEZA;11010;ROSA ANDRADE;94;649;;1;EMEIEF PROF JOSE PARSIFAL BARROSO;AV MAJOR ASSIS 1076;VILA VELHA;
2024;1;FORTALEZA;11010;ROSA ANDRADE;94;703;;1;EEM LICEU VILA VELHA;AV. L, 840;VILA VELHA;
2024;1;FORTALEZA;11010;ROSA ANDRADE;94;726;;1;EMEIF HERONDINA LIMA CAVALCANTE;AV. AMBIENTALISTA ARY THIERS, 310;VILA VELHA;
2024;1;FORTALEZA;11010;ROSA ANDRADE;94;793;;2;EM ANTONIO CORREIA LIMA;RUA HERMES PARAYBA, 934;VILA VELHA;
2024;1;FORTALEZA;11010;ROSA ANDRADE;94;827;;1;EMEIF LORHAN MARQUES MEDEIROS;RUA CREUZA ROCHA, 255;JARDIM GUANABARA;
2024;1;FORTALEZA;11010;ROSA ANDRADE;94;854;;1;EMEIF FRANCISCO EDILSON PINHEIRO;RUA N, 35;VILA VELHA;
2024;1;FORTALEZA;11010;ROSA ANDRADE;94;929;;1;EMEIF FRANCISCO EDILSON PINHEIRO;RUA N, 35;VILA VELHA;
2024;1;FORTALEZA;11010;ROSA ANDRADE;94;930;;1;EMTI DEPUTADO ROBERTO MESQUITA;R. BETA,  SN;VILA VELHA;
2024;1;FORTALEZA;11010;ROSA ANDRADE;95;124;;1;EMEIEF LIONS CLUBE FORTALEZA FÁTIMA;TRAVESSA LIONS CLUBE, 141;JANGURUSSU;
2024;1;FORTALEZA;11010;ROSA ANDRADE;95;143;;1;EMTI PROFESSOR ANTONIO GIRAO BARROSO;RUA VERDE 37, S/N (CJ SITIO SAO JOAO);JANGURUSSU;
2024;1;FORTALEZA;11010;ROSA ANDRADE;95;185;;1;DNIT;RODOVIA BR-116, KM 06;CAJAZEIRAS;
2024;1;FORTALEZA;11010;ROSA ANDRADE;95;241;;1;EMEIEF TAÍS MARIA BEZERRA NOGUEIRA;AV. GOVERNADOR LEONEL BRIZOLA, 710;JANGURUSSU;
2024;1;FORTALEZA;11010;ROSA ANDRADE;95;243;;1;EMEIEF TAÍS MARIA BEZERRA NOGUEIRA;AV. GOVERNADOR LEONEL BRIZOLA, 710;JANGURUSSU;
2024;1;FORTALEZA;11010;ROSA ANDRADE;95;255;;1;EMEIEF OTAVIO DE FARIAS;RUA JOAO FERREIRA, S/N;BARROSO;
2024;1;FORTALEZA;11010;ROSA ANDRADE;95;268;;1;EEFM PROF. PAULO AYRTON ARAUJO;BR 116 KM 05, AO LADO DA EMPRESA GUANABARA;CAJAZEIRAS;
2024;1;FORTALEZA;11010;ROSA ANDRADE;95;286;;1;EM PROFESSORA MARIA ANTONÉZIA MEIRELES E SÁ;RUA CORONEL VIRGÍLIO TÁVORA, 1340;BARROSO;
2024;1;FORTALEZA;11010;ROSA ANDRADE;95;316;;1;EMEIF MARIA DE JESUS ORIÁ ALENCAR;RUA VERDE QUARENTA E TRÊS, S/N, CONJUNTO SÍTIO SÃO JOÃO;JANGURUSSU;
2024;1;FORTALEZA;11010;ROSA ANDRADE;95;319;;1;EM SINÓ PINHEIRO;RUA 14, 151 (CJ JOAO PAULO II);BARROSO;
2024;1;FORTALEZA;11010;ROSA ANDRADE;95;338;;1;EEFM PROFESSOR  ALOYSIO BARROS LEAL;RUA 10,  LOT. PRQ.VERDE 28 (CJ JOAO PAULO II);BARROSO;
2024;1;FORTALEZA;11010;ROSA ANDRADE;112;391;;1;EEFM DOM ANTONIO DE ALMEIDA LUSTOSA;RUA ADOLFO MOREIRA DE CARVALHO, S/N;EDSON QUEIROZ;
2024;1;FORTALEZA;11010;ROSA ANDRADE;112;513;;1;CENTRO UNIVERSITARIO ESTACIO DO CEARA VIA CORPVS;RUA ELISEU UCHÔA BECO, 600;GUARARAPES;
2024;1;FORTALEZA;11010;ROSA ANDRADE;113;195;;1;FACULDADE DE PSICOLOGIA DA UFC;AV. DA UNIVERSIDADE, 2762;BENFICA;
2024;1;FORTALEZA;11010;ROSA ANDRADE;113;202;;1;COLÉGIO CHRISTUS PRÉ - UNIVERSITÁRIO;RUA CRUZ SALDANHA, 614;PARQUELÂNDIA;
2024;1;FORTALEZA;11010;ROSA ANDRADE;113;238;;1;EEFM ANTONIO SALES - PARQUELÂNDIA;RUA PROF. ANACLETO, 630;PARQUELÂNDIA;
2024;1;FORTALEZA;11010;ROSA ANDRADE;113;303;;1;COLÉGIO GUSTAVO BRAGA;AV. JOÃO PESSOA, 4650/80;DAMAS;
2024;1;FORTALEZA;11010;ROSA ANDRADE;113;309;;1;ESCOLA PROF. PE. JOÃO PIAMARTA (ANEXO JÚNIOR);RUA PE. JOÃO PIAMARTA, 161;BOM FUTURO;
2024;1;FORTALEZA;11010;ROSA ANDRADE;113;408;;1;COLÉGIO ART E MANHA;RUA SÃO MATEUS, 1020;VILA UNIÃO;
2024;1;FORTALEZA;11010;ROSA ANDRADE;113;413;;1;COLÉGIO ART E MANHA;RUA SÃO MATEUS, 1020;VILA UNIÃO;
2024;1;FORTALEZA;11010;ROSA ANDRADE;114;3;;1;COLÉGIO MANUEL DA SILVA (ÁLVARO WEYNE);RUA SÃO BERNARDO 181;ÁLVARO WEYNE;
2024;1;FORTALEZA;11010;ROSA ANDRADE;114;45;;1;EM CASIMIRO JOSÉ LIMA FILHO;AVENIDA FRANCISCO SÁ 6449;BARRA DO CEARÁ;
2024;1;FORTALEZA;11010;ROSA ANDRADE;114;52;;1;EM FRANCISCO DOMINGOS DA SILVA;AVENIDA PRESIDENTE CASTELO BRANCO 4707;BARRA DO CEARÁ;
2024;1;FORTALEZA;11010;ROSA ANDRADE;114;86;;1;CUCA BARRA DO CEARÁ;AV. PRES. CASTELO BRANCO, 6417;BARRA DO CEARÁ;
2024;1;FORTALEZA;11010;ROSA ANDRADE;114;90;;1;CUCA BARRA DO CEARÁ;AV. PRES. CASTELO BRANCO, 6417;BARRA DO CEARÁ;
2024;1;FORTALEZA;11010;ROSA ANDRADE;114;93;;1;CUCA BARRA DO CEARÁ;AV. PRES. CASTELO BRANCO, 6417;BARRA DO CEARÁ;
2024;1;FORTALEZA;11010;ROSA ANDRADE;114;95;;1;CUCA BARRA DO CEARÁ;AV. PRES. CASTELO BRANCO, 6417;BARRA DO CEARÁ;
2024;1;FORTALEZA;11010;ROSA ANDRADE;114;101;;1;EM RAIMUNDO DE SOUSA MANGUEIRA;RUA ALBERTO FERREIRA 624;JARDIM IRACEMA;
2024;1;FORTALEZA;11010;ROSA ANDRADE;114;114;;1;EM SÃO JOSÉ;AVENIDA DOUTOR THEBERGE 2288;PRESIDENTE KENNEDY;
2024;1;FORTALEZA;11010;ROSA ANDRADE;114;136;;1;EM JOSÉ DE ALENCAR;RUA ALBERTO FERREIRA 248;JARDIM IRACEMA;
2024;1;FORTALEZA;11010;ROSA ANDRADE;114;139;;1;EM JOSÉ DE ALENCAR;RUA ALBERTO FERREIRA 248;JARDIM IRACEMA;
2024;1;FORTALEZA;11010;ROSA ANDRADE;114;149;;1;EEMTI PROFESSORA BALBINA JUCA ALBUQUERQUE;AVENIDA MAJOR ASSIS 346;JARDIM IRACEMA;
2024;1;FORTALEZA;11010;ROSA ANDRADE;114;155;;1;EEFM FERNANDO CAVALCANTE MOTA;RUA DA SALEMA 85;BARRA DO CEARÁ;
2024;1;FORTALEZA;11010;ROSA ANDRADE;114;216;;1;EM JESUS CRISTO - CEI ANEXO;RUA ALBERTO FERREIRA 564;JARDIM IRACEMA;
2024;1;FORTALEZA;11010;ROSA ANDRADE;114;223;;1;INSTITUTO EDUCACIONAL PRESIDENTE MEDICI;RUA CÉSAR CORREIA 973;FLORESTA;
2024;1;FORTALEZA;11010;ROSA ANDRADE;114;224;;1;INSTITUTO EDUCACIONAL PRESIDENTE MEDICI;RUA CÉSAR CORREIA 973;FLORESTA;
2024;1;FORTALEZA;11010;ROSA ANDRADE;114;226;;1;EM DOM ANTONIO BATISTA DE FRAGOSO;AVENIDA FRANCISCO SÁ 7945;BARRA DO CEARÁ;
2024;1;FORTALEZA;11010;ROSA ANDRADE;114;227;;1;EM DOM ANTONIO BATISTA DE FRAGOSO;AVENIDA FRANCISCO SÁ 7945;BARRA DO CEARÁ;
2024;1;FORTALEZA;11010;ROSA ANDRADE;114;249;;1;CENTRO DE EDUCAÇÃO COMPLEMENTAR (CEDCE) - ANTIGO SESI;AVENIDA FRANCISCO SÁ 6623;BARRA DO CEARÁ;
2024;1;FORTALEZA;11010;ROSA ANDRADE;114;253;;1;CENTRO DE REFERÊNCIA DE ASSISTÊNCIA SOCIAL DO PRES. KENNEDY - CRAS;QUADRA F S/N CONJUNTO CASTELO BRANCO;PRESIDENTE KENNEDY;
2024;1;FORTALEZA;11010;ROSA ANDRADE;114;311;;1;EM JESUS CRISTO;RUA ALBERTO FERREIRA, 564;JARDIM IRACEMA;
2024;1;FORTALEZA;11010;ROSA ANDRADE;114;316;;1;EM DOIS DE DEZEMBRO;RUA ARAKEN, 860;BARRA DO CEARÁ;
2024;1;FORTALEZA;11010;ROSA ANDRADE;114;338;;1;EM 11 DE AGOSTO (ALOJAMENTO PROVISÓRIO);RUA ERETIDES DE ALENCAR, S/N, EM FRENTE AO N. 1623;JARDIM IRACEMA;
2024;1;FORTALEZA;11010;ROSA ANDRADE;114;344;;1;CENTRO EDUCACIONAL ALFA;RUA CHICO XAVIER, 181;BARRA DO CEARÁ;
2024;1;FORTALEZA;11010;ROSA ANDRADE;114;349;;1;EM 11 DE AGOSTO (ALOJAMENTO PROVISÓRIO);RUA ERETIDES DE ALENCAR, S/N, EM FRENTE AO N. 1623;JARDIM IRACEMA;
2024;1;FORTALEZA;11010;ROSA ANDRADE;114;351;;1;EM 11 DE AGOSTO (ALOJAMENTO PROVISÓRIO);RUA ERETIDES DE ALENCAR, S/N, EM FRENTE AO N. 1623;JARDIM IRACEMA;
2024;1;FORTALEZA;11010;ROSA ANDRADE;115;43;;1;UNIVERSIDADE ESTADUAL DO CEARA - UECE;AV DR. SILAS MUNGUBA, 1700;ITAPERI;
2024;1;FORTALEZA;11010;ROSA ANDRADE;115;330;;1;COLÉGIO LOURENÇO FILHO - PARANGABA;RUA CÔNEGO DE CASTRO 700;PARANGABA;
2024;1;FORTALEZA;11010;ROSA ANDRADE;115;335;;1;SESI - PARANGABA;AVENIDA JOÃO PESSOA, 6754;PARANGABA;
2024;1;FORTALEZA;11010;ROSA ANDRADE;116;123;;1;EEFM PROF JOCIE CAMINHA DE MENEZES;RUA ITU 120;GRANJA PORTUGAL;
2024;1;FORTALEZA;11010;ROSA ANDRADE;116;126;;1;EEFM PROF JOCIE CAMINHA DE MENEZES;RUA ITU 120;GRANJA PORTUGAL;
2024;1;FORTALEZA;11010;ROSA ANDRADE;116;400;;1;EM XV DE OUTUBRO - TEMPORÁRIO;RUA GUARANI, 2030;BONSUCESSO;
2024;1;FORTALEZA;11010;ROSA ANDRADE;116;443;;1;EM XV DE OUTUBRO - TEMPORÁRIO;RUA GUARANI, 2030;BONSUCESSO;
2024;1;FORTALEZA;11010;ROSA ANDRADE;116;448;;1;EM XV DE OUTUBRO - TEMPORÁRIO;RUA GUARANI, 2030;BONSUCESSO;
2024;1;FORTALEZA;11010;ROSA ANDRADE;116;473;;1;EM PROF LUIS RECAMONDE CAPELO;RUA MARIA QUINTELA 901;BONSUCESSO;
2024;1;FORTALEZA;11010;ROSA ANDRADE;117;168;;1;EEFM JULIA ALVES PESSOA;RUA SÃO FRANCISCO SN;BOM JARDIM;
2024;1;FORTALEZA;11010;ROSA ANDRADE;117;352;;1;COLÉGIO CASTRO ALVES;RUA TULIPA NEGRA, 2319;PARQUE PRESIDENTE VARGAS;
2024;1;FORTALEZA;11010;ROSA ANDRADE;117;358;;1;EEFM IRAPUAN CAVALCANTE PINHEIRO;AV E 305;CONJUNTO ESPERANÇA;
2024;1;FORTALEZA;11010;ROSA ANDRADE;118;582;;1;EEFM ANTÔNIO DIAS MACEDO;AV PEDRO DANTAS 340;DIAS MACEDO;
TOTAL;;;;;;;;164;
