2024;1;FORTALEZA;80180;TILDE PRETA SIMOA;94;850;;1;COLEGIO JULIA FIALHO;RUA JOSE ACIOLY 73;ANTÔNIO BEZERRA;
2024;1;FORTALEZA;80180;TILDE PRETA SIMOA;94;854;;1;EMEIF FRANCISCO EDILSON PINHEIRO;RUA N, 35;VILA VELHA;
2024;1;FORTALEZA;80180;TILDE PRETA SIMOA;94;875;;1;EEFM HERMINIO BARROSO;RUA PADRE GUILHERME 800;PADRE ANDRADE;
2024;1;FORTALEZA;80180;TILDE PRETA SIMOA;94;922;;2;EMEIEF PROF DENIZARD MACEDO DE ALCÂNTARA;RUA MATOSO FILHO 450;QUINTINO CUNHA;
2024;1;FORTALEZA;80180;TILDE PRETA SIMOA;94;934;;1;CEI MARISTELA DA FROTA CAVALCANTE;AV. L, N. 1000;VILA VELHA;
2024;1;FORTALEZA;80180;TILDE PRETA SIMOA;94;935;;1;EMEIEF PROF DENIZARD MACEDO DE ALCÂNTARA;RUA MATOSO FILHO 450;QUINTINO CUNHA;
2024;1;FORTALEZA;80180;TILDE PRETA SIMOA;94;937;;1;COLEGIO SALOME BASTOS;RUA DESEMBARGADOR HERMES PARAHYBA 1120;VILA VELHA;
2024;1;FORTALEZA;80180;TILDE PRETA SIMOA;94;939;;1;COLÉGIO UNIVERSO;RUA JOAQUIM ALBANO, N 100;PADRE ANDRADE;
2024;1;FORTALEZA;80180;TILDE PRETA SIMOA;95;134;;1;EM PROFESSOR FRANCISCO DE MELO JABORANDI;AV. GOVERNADOR LEONEL BRIZOLA, 198;JANGURUSSU;
2024;1;FORTALEZA;80180;TILDE PRETA SIMOA;95;151;;1;EEFM ALMIRANTE TAMANDARÉ;RUA DO MANDACARU, 1048 CJ ALMIRANTE TAMANDARÉ;JANGURUSSU;
2024;1;FORTALEZA;80180;TILDE PRETA SIMOA;95;163;;2;EM MARIETA CALS;RUA VALPARAISO, 160;CONJUNTO PALMEIRAS;
2024;1;FORTALEZA;80180;TILDE PRETA SIMOA;95;187;;1;DNIT;RODOVIA BR-116, KM 06;CAJAZEIRAS;
2024;1;FORTALEZA;80180;TILDE PRETA SIMOA;95;192;364;1;EMEIF JORNALISTA JOSÉ BLANCHARD GIRÃO DA SILVA;TRAVESSA MISSIONÁRIO OLIVEIRA,301;JANGURUSSU;
2024;1;FORTALEZA;80180;TILDE PRETA SIMOA;95;209;;1;EEFM ALMIRANTE TAMANDARÉ;RUA DO MANDACARU, 1048 CJ ALMIRANTE TAMANDARÉ;JANGURUSSU;
2024;1;FORTALEZA;80180;TILDE PRETA SIMOA;95;243;;1;EMEIEF TAÍS MARIA BEZERRA NOGUEIRA;AV. GOVERNADOR LEONEL BRIZOLA, 710;JANGURUSSU;
2024;1;FORTALEZA;80180;TILDE PRETA SIMOA;95;244;;1;EMEIEF TAÍS MARIA BEZERRA NOGUEIRA;AV. GOVERNADOR LEONEL BRIZOLA, 710;JANGURUSSU;
2024;1;FORTALEZA;80180;TILDE PRETA SIMOA;95;246;;1;EMEIEF TAÍS MARIA BEZERRA NOGUEIRA;AV. GOVERNADOR LEONEL BRIZOLA, 710;JANGURUSSU;
2024;1;FORTALEZA;80180;TILDE PRETA SIMOA;95;253;;1;EMEIEF OTAVIO DE FARIAS;RUA JOAO FERREIRA, S/N;BARROSO;
2024;1;FORTALEZA;80180;TILDE PRETA SIMOA;95;302;;1;EMEIEF PROFESSORA BERNADETE ORIÁ DE OLIVEIRA;RUA DR. CODES SANDOVAL 796;CONJUNTO PALMEIRAS;
2024;1;FORTALEZA;80180;TILDE PRETA SIMOA;95;313;;1;EMEIF MARIA DE JESUS ORIÁ ALENCAR;RUA VERDE QUARENTA E TRÊS, S/N, CONJUNTO SÍTIO SÃO JOÃO;JANGURUSSU;
2024;1;FORTALEZA;80180;TILDE PRETA SIMOA;95;335;;1;EMEIEF MARIA HELENICE CAVALCANTE LEITE MARTINS;RUA MAIZA, S/N;CONJUNTO PALMEIRAS;
2024;1;FORTALEZA;80180;TILDE PRETA SIMOA;95;354;;1;EEFM PROF. PAULO AYRTON ARAUJO;BR 116 KM 05, AO LADO DA EMPRESA GUANABARA;CAJAZEIRAS;
2024;1;FORTALEZA;80180;TILDE PRETA SIMOA;95;361;;1;EMEIF MARIA DE JESUS ORIÁ ALENCAR;RUA VERDE QUARENTA E TRÊS, S/N, CONJUNTO SÍTIO SÃO JOÃO;JANGURUSSU;
2024;1;FORTALEZA;80180;TILDE PRETA SIMOA;112;28;;2;COLÉGIO DÁULIA BRINGEL;RUA TRAJANO ALVES DE AGUIAR, 55;CIDADE DOS FUNCIONÁRIOS;
2024;1;FORTALEZA;80180;TILDE PRETA SIMOA;112;99;;1;EM ISMAEL PORDEUS;RUA DES FAUSTINO ALBUQUERQUE, 511;JARDIM DAS OLIVEIRAS;
2024;1;FORTALEZA;80180;TILDE PRETA SIMOA;112;160;;1;EM JOHNSON;RUA DRA. SOCORRO AZEVEDO, 461;ENGENHEIRO LUCIANO CAVALCANTE;
2024;1;FORTALEZA;80180;TILDE PRETA SIMOA;112;188;;2;COLÉGIO DÁULIA BRINGEL;RUA TRAJANO ALVES DE AGUIAR, 55;CIDADE DOS FUNCIONÁRIOS;
2024;1;FORTALEZA;80180;TILDE PRETA SIMOA;112;189;;1;COLÉGIO DÁULIA BRINGEL;RUA TRAJANO ALVES DE AGUIAR, 55;CIDADE DOS FUNCIONÁRIOS;
2024;1;FORTALEZA;80180;TILDE PRETA SIMOA;112;319;;1;IGREJA DA GLÓRIA;AV OLIVEIRA PAIVA, 905;CIDADE DOS FUNCIONÁRIOS;
2024;1;FORTALEZA;80180;TILDE PRETA SIMOA;112;359;;1;CENTRO UNIVERSITARIO ESTACIO DO CEARA VIA CORPVS;RUA ELISEU UCHÔA BECO, 600;GUARARAPES;
2024;1;FORTALEZA;80180;TILDE PRETA SIMOA;112;366;;2;COLÉGIO ÁGAPE;AV HERMINIO DE CASTRO, 140;PARQUE MANIBURA;
2024;1;FORTALEZA;80180;TILDE PRETA SIMOA;112;386;;1;EEFM DOM ANTONIO DE ALMEIDA LUSTOSA;RUA ADOLFO MOREIRA DE CARVALHO, S/N;EDSON QUEIROZ;
2024;1;FORTALEZA;80180;TILDE PRETA SIMOA;112;403;;1;EEMTI PROFESSORA TECLA FERREIRA;RUA FRANCISCA BEZERRA, 417;SAPIRANGA-COITÉ;
2024;1;FORTALEZA;80180;TILDE PRETA SIMOA;112;414;;1;COLEGIO ARI DE SA CAVALCANTE WS;AV WASHINGTON SOARES, 3737;EDSON QUEIROZ;
2024;1;FORTALEZA;80180;TILDE PRETA SIMOA;112;427;;1;COLEGIO ARI DE SA CAVALCANTE WS;AV WASHINGTON SOARES, 3737;EDSON QUEIROZ;
2024;1;FORTALEZA;80180;TILDE PRETA SIMOA;112;433;;1;COLEGIO ARI DE SA CAVALCANTE WS;AV WASHINGTON SOARES, 3737;EDSON QUEIROZ;
2024;1;FORTALEZA;80180;TILDE PRETA SIMOA;112;448;;1;UNIVERSIDADE DE FORTALEZA - UNIFOR;AVENIDA WASHINGTON SOARES, 1321;EDSON QUEIROZ;
2024;1;FORTALEZA;80180;TILDE PRETA SIMOA;112;451;;1;UNIVERSIDADE DE FORTALEZA - UNIFOR;AVENIDA WASHINGTON SOARES, 1321;EDSON QUEIROZ;
2024;1;FORTALEZA;80180;TILDE PRETA SIMOA;112;493;;1;COLEGIO MASTER SUL;RUA BENJAMIM MOURA, 631;CIDADE DOS FUNCIONÁRIOS;
2024;1;FORTALEZA;80180;TILDE PRETA SIMOA;112;511;;1;COLÉGIO ÁGAPE;AV HERMINIO DE CASTRO, 140;PARQUE MANIBURA;
2024;1;FORTALEZA;80180;TILDE PRETA SIMOA;112;515;;1;COLÉGIO ÁGAPE;AV HERMINIO DE CASTRO, 140;PARQUE MANIBURA;
2024;1;FORTALEZA;80180;TILDE PRETA SIMOA;112;521;;1;ESCOLA ESTADUAL DE EDUCAÇÃO PROFISSIONAL JAIME ALENCAR DE OLIVEIRA;AV ROGACIANO LEITE, 2285;ENGENHEIRO LUCIANO CAVALCANTE;
2024;1;FORTALEZA;80180;TILDE PRETA SIMOA;112;561;;1;COLÉGIO NOVA DIMENSÃO;AV. EDILSON BRASIL SOARES, 1599;EDSON QUEIROZ;
2024;1;FORTALEZA;80180;TILDE PRETA SIMOA;112;570;;2;COLÉGIO BATISTA - UNIDADE SEIS BOCAS;RUA DR. WALDEMAR DE ALCANTARA, 200;CAMBEBA;
2024;1;FORTALEZA;80180;TILDE PRETA SIMOA;112;573;;1;COLÉGIO NOVA DIMENSÃO;AV. EDILSON BRASIL SOARES, 1599;EDSON QUEIROZ;
2024;1;FORTALEZA;80180;TILDE PRETA SIMOA;112;575;;2;COLÉGIO ÁGAPE;AV HERMINIO DE CASTRO, 140;PARQUE MANIBURA;
2024;1;FORTALEZA;80180;TILDE PRETA SIMOA;112;581;;1;COLÉGIO BATISTA - UNIDADE SEIS BOCAS;RUA DR. WALDEMAR DE ALCANTARA, 200;CAMBEBA;
2024;1;FORTALEZA;80180;TILDE PRETA SIMOA;113;3;4;1;FACULDADE DE ARQUITETURA E URBANISMO DA UFC;AV. DA UNIVERSIDADE, 2890;BENFICA;
2024;1;FORTALEZA;80180;TILDE PRETA SIMOA;113;23;;1;IFCE - INST FEDERAL DE CIÊNCIA E TECNOLOGIA (CEFET);AV. 13 DE MAIO, 2081;BENFICA;
2024;1;FORTALEZA;80180;TILDE PRETA SIMOA;113;52;;1;COLÉGIO FARIAS BRITO;RUA SENADOR POMPEU, 2607;JOSÉ BONIFÁCIO;
2024;1;FORTALEZA;80180;TILDE PRETA SIMOA;113;68;;1;COLÉGIO JUVENAL DE CARVALHO;AV. JOÃO PESSOA, 4279;DAMAS;
2024;1;FORTALEZA;80180;TILDE PRETA SIMOA;113;70;;1;COLÉGIO JUVENAL DE CARVALHO;AV. JOÃO PESSOA, 4279;DAMAS;
2024;1;FORTALEZA;80180;TILDE PRETA SIMOA;113;73;;1;COLÉGIO LOURENÇO FILHO;RUA BARÃO DO RIO BRANCO, 2101;CENTRO;
2024;1;FORTALEZA;80180;TILDE PRETA SIMOA;113;77;;1;COLÉGIO LOURENÇO FILHO;RUA BARÃO DO RIO BRANCO, 2101;CENTRO;
2024;1;FORTALEZA;80180;TILDE PRETA SIMOA;113;79;;2;COLÉGIO LOURENÇO FILHO;RUA BARÃO DO RIO BRANCO, 2101;CENTRO;
2024;1;FORTALEZA;80180;TILDE PRETA SIMOA;113;83;;1;ESCOLA MUNICIPAL PROF. FILGUEIRAS LIMA;AV. DOS EXPEDICIONÁRIOS, 3910;JARDIM AMÉRICA;
2024;1;FORTALEZA;80180;TILDE PRETA SIMOA;113;108;;1;COLÉGIO CHRISTUS BENFICA;RUA LUIS DE MIRANDA, 536;BENFICA;
2024;1;FORTALEZA;80180;TILDE PRETA SIMOA;113;127;;1;EEFM FIGUEIREDO CORREIA;RUA MARECHAL DEODORO, 733;BENFICA;
2024;1;FORTALEZA;80180;TILDE PRETA SIMOA;113;140;;2;EEFM ESTADO DO PARANÁ;RUA ALBERTO MAGNO, 123;JARDIM AMÉRICA;
2024;1;FORTALEZA;80180;TILDE PRETA SIMOA;113;158;;1;COLÉGIO MEDALHA MILAGROSA;RUA PADRE JOÃO PIAMARTA,  415;BOM FUTURO;
2024;1;FORTALEZA;80180;TILDE PRETA SIMOA;113;175;;1;FEAAC - UFC;AV. DA UNIVERSIDADE, 2431;BENFICA;
2024;1;FORTALEZA;80180;TILDE PRETA SIMOA;113;192;;1;FACULDADE DE PSICOLOGIA DA UFC;AV. DA UNIVERSIDADE, 2762;BENFICA;
2024;1;FORTALEZA;80180;TILDE PRETA SIMOA;113;195;;1;FACULDADE DE PSICOLOGIA DA UFC;AV. DA UNIVERSIDADE, 2762;BENFICA;
2024;1;FORTALEZA;80180;TILDE PRETA SIMOA;113;200;290;1;CREAS RODOLFO TEÓFILO;RUA DOM LINO, 1001;AMADEU FURTADO;
2024;1;FORTALEZA;80180;TILDE PRETA SIMOA;113;201;;1;COLÉGIO CHRISTUS PRÉ - UNIVERSITÁRIO;RUA CRUZ SALDANHA, 614;PARQUELÂNDIA;
2024;1;FORTALEZA;80180;TILDE PRETA SIMOA;113;202;;1;COLÉGIO CHRISTUS PRÉ - UNIVERSITÁRIO;RUA CRUZ SALDANHA, 614;PARQUELÂNDIA;
2024;1;FORTALEZA;80180;TILDE PRETA SIMOA;113;203;;1;COLÉGIO CHRISTUS PRÉ - UNIVERSITÁRIO;RUA CRUZ SALDANHA, 614;PARQUELÂNDIA;
2024;1;FORTALEZA;80180;TILDE PRETA SIMOA;113;225;;1;COLÉGIO MANUELITO AZEVEDO;RUA TIRADENTES, 483;RODOLFO TEÓFILO;
2024;1;FORTALEZA;80180;TILDE PRETA SIMOA;113;238;;2;EEFM ANTONIO SALES - PARQUELÂNDIA;RUA PROF. ANACLETO, 630;PARQUELÂNDIA;
2024;1;FORTALEZA;80180;TILDE PRETA SIMOA;113;241;;1;EEFM FÉLIX DE AZEVEDO;RUA MONSENHOR FURTADO, 757;RODOLFO TEÓFILO;
2024;1;FORTALEZA;80180;TILDE PRETA SIMOA;113;244;;2;EEFM FÉLIX DE AZEVEDO;RUA MONSENHOR FURTADO, 757;RODOLFO TEÓFILO;
2024;1;FORTALEZA;80180;TILDE PRETA SIMOA;113;267;;1;ESC. MUNICIPAL ANTONIO SALES RODOLFO TEÓFILO;RUA TAVARES IRACEMA, 675;RODOLFO TEÓFILO;
2024;1;FORTALEZA;80180;TILDE PRETA SIMOA;113;271;;1;FACULDADE DE ENFERMAGEM DA UFC;RUA ALEXANDRE BARAÚNA, 1115;RODOLFO TEÓFILO;
2024;1;FORTALEZA;80180;TILDE PRETA SIMOA;113;280;;1;COLÉGIO CHRISTUS PRÉ - UNIVERSITÁRIO;RUA CRUZ SALDANHA, 614;PARQUELÂNDIA;
2024;1;FORTALEZA;80180;TILDE PRETA SIMOA;113;284;;1;COLÉGIO FARIAS BRITO;RUA SENADOR POMPEU, 2607;JOSÉ BONIFÁCIO;
2024;1;FORTALEZA;80180;TILDE PRETA SIMOA;113;285;;1;EEFM SANTO AFONSO;RUA GAL. BERNARDO FIGUEIREDO, 2670;PARQUELÂNDIA;
2024;1;FORTALEZA;80180;TILDE PRETA SIMOA;113;307;;1;COLÉGIO MEDALHA MILAGROSA;RUA PADRE JOÃO PIAMARTA,  415;BOM FUTURO;
2024;1;FORTALEZA;80180;TILDE PRETA SIMOA;113;314;;1;IFCE - INST FEDERAL DE CIÊNCIA E TECNOLOGIA (CEFET);AV. 13 DE MAIO, 2081;BENFICA;
2024;1;FORTALEZA;80180;TILDE PRETA SIMOA;113;331;;1;ESCOLA ESTADUAL DE EDUCAÇÃO PROFISSIONAL  PRESIDENTE ROOSEVELT;AV BEZERRA DE MENEZES 435;FARIAS BRITO;
2024;1;FORTALEZA;80180;TILDE PRETA SIMOA;113;342;;1;ESCOLA ESTADUAL DE EDUCAÇÃO PROFISSIONAL JOAQUIM NOGUEIRA;RUA MOREIRA DE SOUSA, 327;PARQUELÂNDIA;
2024;1;FORTALEZA;80180;TILDE PRETA SIMOA;113;344;;1;ESCOLA ESTADUAL DE EDUCAÇÃO PROFISSIONAL JOAQUIM NOGUEIRA;RUA MOREIRA DE SOUSA, 327;PARQUELÂNDIA;
2024;1;FORTALEZA;80180;TILDE PRETA SIMOA;113;346;;1;ESCOLA ESTADUAL DE EDUCAÇÃO PROFISSIONAL JOAQUIM NOGUEIRA;RUA MOREIRA DE SOUSA, 327;PARQUELÂNDIA;
2024;1;FORTALEZA;80180;TILDE PRETA SIMOA;113;348;;2;SECRETARIA EXECUTIVA REGIONAL III - FORTALEZA;AV JOVITA FEITOSA 3090;PARQUELÂNDIA;
2024;1;FORTALEZA;80180;TILDE PRETA SIMOA;113;360;;1;COLÉGIO ESTADUAL PRESIDENTE HUMBERTO CASTELO BRANCO;RUA IRMA BAZET, 210;MONTESE;
2024;1;FORTALEZA;80180;TILDE PRETA SIMOA;113;365;;1;COLÉGIO ESTADUAL PRESIDENTE HUMBERTO CASTELO BRANCO;RUA IRMA BAZET, 210;MONTESE;
2024;1;FORTALEZA;80180;TILDE PRETA SIMOA;113;384;;1;ASSOCIAÇÃO DE PAIS E AMIGOS DO DEFICIENTE AUDITIVO - APADA;AV. BEZERRA DE MENEZES, 549;SÃO GERARDO;
2024;1;FORTALEZA;80180;TILDE PRETA SIMOA;113;386;;1;ASSOCIAÇÃO DE PAIS E AMIGOS DO DEFICIENTE AUDITIVO - APADA;AV. BEZERRA DE MENEZES, 549;SÃO GERARDO;
2024;1;FORTALEZA;80180;TILDE PRETA SIMOA;113;392;;1;IMPARH;AV JOAO PESSOA, 5.609;MONTESE;
2024;1;FORTALEZA;80180;TILDE PRETA SIMOA;113;432;429, 431, 430;1;ESCOLA MUNICIPAL VICENTE FIALHO;RUA IRMA BAZET, 193;MONTESE;
2024;1;FORTALEZA;80180;TILDE PRETA SIMOA;113;437;;2;ESC. PROFISSIONAL PE. JOÃO PIAMARTA;RUA PADRE JOÃO PIAMARTA, 161;BOM FUTURO;
2024;1;FORTALEZA;80180;TILDE PRETA SIMOA;113;438;;2;ESC. PROFISSIONAL PE. JOÃO PIAMARTA;RUA PADRE JOÃO PIAMARTA, 161;BOM FUTURO;
2024;1;FORTALEZA;80180;TILDE PRETA SIMOA;114;2;;1;COLÉGIO MANUEL DA SILVA (ÁLVARO WEYNE);RUA SÃO BERNARDO 181;ÁLVARO WEYNE;
2024;1;FORTALEZA;80180;TILDE PRETA SIMOA;114;8;;1;COLÉGIO MANUEL DA SILVA (ÁLVARO WEYNE);RUA SÃO BERNARDO 181;ÁLVARO WEYNE;
2024;1;FORTALEZA;80180;TILDE PRETA SIMOA;114;39;;1;EM FRANCISCO SILVA CAVALCANTE;RUA CONSELHEIRO LAFAYETTE 205;FLORESTA;
2024;1;FORTALEZA;80180;TILDE PRETA SIMOA;114;71;;1;COLÉGIO INACIO COSTA;QUADRA L 303 CONJUNTO CASTELO BRANCO;PRESIDENTE KENNEDY;
2024;1;FORTALEZA;80180;TILDE PRETA SIMOA;114;103;;2;COLÉGIO SANTA ISABEL;AVENIDA BEZERRA DE MENEZES 2840;PRESIDENTE KENNEDY;
2024;1;FORTALEZA;80180;TILDE PRETA SIMOA;114;111;;1;EM SÃO JOSÉ;AVENIDA DOUTOR THEBERGE 2288;PRESIDENTE KENNEDY;
2024;1;FORTALEZA;80180;TILDE PRETA SIMOA;114;118;;1;EMTI NOSSA SENHORA DE FÁTIMA (ANTIGA APOSTÓLICA/SEMINÁRIO);RUA SÍLVIO ROMERO 370;ÁLVARO WEYNE;
2024;1;FORTALEZA;80180;TILDE PRETA SIMOA;114;136;;1;EM JOSÉ DE ALENCAR;RUA ALBERTO FERREIRA 248;JARDIM IRACEMA;
2024;1;FORTALEZA;80180;TILDE PRETA SIMOA;114;149;;1;EEMTI PROFESSORA BALBINA JUCA ALBUQUERQUE;AVENIDA MAJOR ASSIS 346;JARDIM IRACEMA;
2024;1;FORTALEZA;80180;TILDE PRETA SIMOA;114;174;;1;COLÉGIO MANUEL DA SILVA (ÁLVARO WEYNE);RUA SÃO BERNARDO 181;ÁLVARO WEYNE;
2024;1;FORTALEZA;80180;TILDE PRETA SIMOA;114;211;;1;EM FRANCISCO SILVA CAVALCANTE;RUA CONSELHEIRO LAFAYETTE 205;FLORESTA;
2024;1;FORTALEZA;80180;TILDE PRETA SIMOA;114;220;;1;INSTITUTO EDUCACIONAL PRESIDENTE MEDICI;RUA CÉSAR CORREIA 973;FLORESTA;
2024;1;FORTALEZA;80180;TILDE PRETA SIMOA;114;225;;1;INSTITUTO EDUCACIONAL PRESIDENTE MEDICI;RUA CÉSAR CORREIA 973;FLORESTA;
2024;1;FORTALEZA;80180;TILDE PRETA SIMOA;114;237;;1;CENTRO DE EDUCAÇÃO COMPLEMENTAR (CEDCE) - ANTIGO SESI;AVENIDA FRANCISCO SÁ 6623;BARRA DO CEARÁ;
2024;1;FORTALEZA;80180;TILDE PRETA SIMOA;114;247;;1;CENTRO DE EDUCAÇÃO COMPLEMENTAR (CEDCE) - ANTIGO SESI;AVENIDA FRANCISCO SÁ 6623;BARRA DO CEARÁ;
2024;1;FORTALEZA;80180;TILDE PRETA SIMOA;114;251;;1;CENTRO DE EDUCAÇÃO COMPLEMENTAR (CEDCE) - ANTIGO SESI;AVENIDA FRANCISCO SÁ 6623;BARRA DO CEARÁ;
2024;1;FORTALEZA;80180;TILDE PRETA SIMOA;114;259;;1;ESCOLINHA MUNDO INFANTIL;AVENIDA SARGENTO HERMÍNIO SAMPAIO 3787;PRESIDENTE KENNEDY;
2024;1;FORTALEZA;80180;TILDE PRETA SIMOA;114;269;;1;EM SÃO JOSÉ;AVENIDA DOUTOR THEBERGE 2288;PRESIDENTE KENNEDY;
2024;1;FORTALEZA;80180;TILDE PRETA SIMOA;114;293;;1;EMTI PROFESSOR JOAQUIM FRANCISCO DE SOUSA FILHO;RUA JOAQUIM MARQUES, 13;PRESIDENTE KENNEDY;
2024;1;FORTALEZA;80180;TILDE PRETA SIMOA;114;342;;1;EM MARIA DALVA SEVERINO MARREIRO;RUA RIO PARAGUAI 782;JARDIM IRACEMA;
2024;1;FORTALEZA;80180;TILDE PRETA SIMOA;114;359;;3;EMTI PROFESSOR JOAQUIM FRANCISCO DE SOUSA FILHO;RUA JOAQUIM MARQUES, 13;PRESIDENTE KENNEDY;
2024;1;FORTALEZA;80180;TILDE PRETA SIMOA;115;50;;1;UNIVERSIDADE ESTADUAL DO CEARA - UECE;AV DR. SILAS MUNGUBA, 1700;ITAPERI;
2024;1;FORTALEZA;80180;TILDE PRETA SIMOA;115;89;;1;COLEGIO DUQUE DE CAXIAS;RUA  PERU, 1675;SERRINHA;
2024;1;FORTALEZA;80180;TILDE PRETA SIMOA;115;95;;1;COLEGIO DUQUE DE CAXIAS;RUA  PERU, 1675;SERRINHA;
2024;1;FORTALEZA;80180;TILDE PRETA SIMOA;115;107;;1;COLEGIO NOSSA SENHORA DO CARMO;RUA ELVIRA PINHO, 400;MONTESE;
2024;1;FORTALEZA;80180;TILDE PRETA SIMOA;115;115;;1;COLEGIO NOSSA SENHORA DO CARMO;RUA ELVIRA PINHO, 400;MONTESE;
2024;1;FORTALEZA;80180;TILDE PRETA SIMOA;115;120;;1;DETRAN;AV GODOFREDO MACIEL, 2900;MARAPONGA;
2024;1;FORTALEZA;80180;TILDE PRETA SIMOA;115;130;;1;COLEGIO PROVECTO;RUA SUIÇA, 76;MARAPONGA;
2024;1;FORTALEZA;80180;TILDE PRETA SIMOA;115;132;;1;COLEGIO PROVECTO;RUA SUIÇA, 76;MARAPONGA;
2024;1;FORTALEZA;80180;TILDE PRETA SIMOA;115;133;;1;COLEGIO PROVECTO;RUA SUIÇA, 76;MARAPONGA;
2024;1;FORTALEZA;80180;TILDE PRETA SIMOA;115;134;;1;COLEGIO PROVECTO;RUA SUIÇA, 76;MARAPONGA;
2024;1;FORTALEZA;80180;TILDE PRETA SIMOA;115;135;;1;COLÉGIO INVICTUS;RUA ARARIBÓIA, 192;PARANGABA;
2024;1;FORTALEZA;80180;TILDE PRETA SIMOA;115;257;;1;EMTI CAROLINO SUCUPIRA;RUA MUNDICA PAULA, 670;PARANGABA;
2024;1;FORTALEZA;80180;TILDE PRETA SIMOA;115;271;;1;COLÉGIO UNIVERSO DO SABER;RUA 10 - NR 70 (CJ CAMPO DOS INGLESES - MARAPONGA);JARDIM CEARENSE;
2024;1;FORTALEZA;80180;TILDE PRETA SIMOA;115;280;;1;EMTI CAROLINO SUCUPIRA;RUA MUNDICA PAULA, 670;PARANGABA;
2024;1;FORTALEZA;80180;TILDE PRETA SIMOA;115;285;;1;FACULDADE UNINASSAU - PARANGABA;RUA GERMANO FRANCK, 567;PARANGABA;
2024;1;FORTALEZA;80180;TILDE PRETA SIMOA;115;300;;1;ESCOLA MARISTA SAGRADO CORAÇÃO;RUA VIDAL DE NEGREIROS, 550;JARDIM CEARENSE;
2024;1;FORTALEZA;80180;TILDE PRETA SIMOA;115;330;;1;COLÉGIO LOURENÇO FILHO - PARANGABA;RUA CÔNEGO DE CASTRO 700;PARANGABA;
2024;1;FORTALEZA;80180;TILDE PRETA SIMOA;115;337;;1;SESI - PARANGABA;AVENIDA JOÃO PESSOA, 6754;PARANGABA;
2024;1;FORTALEZA;80180;TILDE PRETA SIMOA;115;370;;1;EM CATULO DA PAIXAO CEARENSE;RUA LEAO DO NORTE 300;VILA PERI;
2024;1;FORTALEZA;80180;TILDE PRETA SIMOA;115;373;;1;EEMTI GENERAL EUDORO CORREA;RUA JULIO BRAGA 101;PARANGABA;
2024;1;FORTALEZA;80180;TILDE PRETA SIMOA;115;380;;1;EEMTI GENERAL EUDORO CORREA;RUA JULIO BRAGA 101;PARANGABA;
2024;1;FORTALEZA;80180;TILDE PRETA SIMOA;115;390;;1;COLEGIO JIM WILLSON;AV. AUGUSTO DOS ANJOS, 1915;VILA PERI;
2024;1;FORTALEZA;80180;TILDE PRETA SIMOA;115;415;;1;COLEGIO GURI  SENIOR;RUA CONEGO DE CASTRO 1780;PARANGABA;
2024;1;FORTALEZA;80180;TILDE PRETA SIMOA;115;423;;1;CENTRO DE EDUCAÇÃO PEDAGÓGICO EÇA DE QUEIROZ;RUA DOM XISTO ALBANO 611;VILA PERI;
2024;1;FORTALEZA;80180;TILDE PRETA SIMOA;115;428;;1;CENTRO DE EDUCAÇÃO PEDAGÓGICO EÇA DE QUEIROZ;RUA DOM XISTO ALBANO 611;VILA PERI;
2024;1;FORTALEZA;80180;TILDE PRETA SIMOA;115;433;;1;CENTRO DE EDUCAÇÃO PEDAGÓGICO EÇA DE QUEIROZ;RUA DOM XISTO ALBANO 611;VILA PERI;
2024;1;FORTALEZA;80180;TILDE PRETA SIMOA;115;436;;1;EM RAIMUNDO SOARES DE SOUSA;RUA COSTA FREIRE 550;VILA PERI;
2024;1;FORTALEZA;80180;TILDE PRETA SIMOA;115;469;;1;EEFM PROF. HERMENEGILDO FIRMEZA;RUA GABRIEL FIUZA 360;VILA PERI;
2024;1;FORTALEZA;80180;TILDE PRETA SIMOA;115;481;;1;EM JOÃO ESTANISLAU FAÇANHA;RUA ONZE, S/N - CONJUNTO CAMPO DOS INGLESES;JARDIM CEARENSE;
2024;1;FORTALEZA;80180;TILDE PRETA SIMOA;115;482;;1;COLEGIO GURI  SENIOR;RUA CONEGO DE CASTRO 1780;PARANGABA;
2024;1;FORTALEZA;80180;TILDE PRETA SIMOA;115;486;;1;ESCOLA MARISTA SAGRADO CORAÇÃO;RUA VIDAL DE NEGREIROS, 550;JARDIM CEARENSE;
2024;1;FORTALEZA;80180;TILDE PRETA SIMOA;115;492;;1;COLÉGIO LOURENÇO FILHO - PARANGABA;RUA CÔNEGO DE CASTRO 700;PARANGABA;
2024;1;FORTALEZA;80180;TILDE PRETA SIMOA;116;32;;1;EM SERVULO MENDES BARROSO;RUA JOSE MARTINS 2239;GRANJA LISBOA;
2024;1;FORTALEZA;80180;TILDE PRETA SIMOA;116;62;;1;EM CRESCER E APRENDER;RUA EDSON MARTINS, 642;BOM JARDIM;
2024;1;FORTALEZA;80180;TILDE PRETA SIMOA;116;197;;1;EM PROF LIREDA FACO;RUA TRES CORACOES 735;GRANJA LISBOA;
2024;1;FORTALEZA;80180;TILDE PRETA SIMOA;116;212;;1;POSTO DE SAUDE DR JURANDIR PICANCO;RUA DUAS NACOES 605;GRANJA PORTUGAL;
2024;1;FORTALEZA;80180;TILDE PRETA SIMOA;116;266;;1;EM REITOR ANTONIO MARTINS FILHO;RUA TEODORO DE CASTRO 1175;GRANJA PORTUGAL;
2024;1;FORTALEZA;80180;TILDE PRETA SIMOA;116;290;;1;EM SANTA ISABEL;RUA RAIMUNDO PINHEIRO 798;BOM JARDIM;
2024;1;FORTALEZA;80180;TILDE PRETA SIMOA;116;340;;1;EM ULYSSES GUIMARAES;RUA TENENTE FRANCISCO PAIVA 1350;GRANJA LISBOA;
2024;1;FORTALEZA;80180;TILDE PRETA SIMOA;116;387;;1;EM FRANCISCA FERNANDES MAGALHAES;RUA OLIVEIRA SOBRINHO, 1031;BONSUCESSO;
2024;1;FORTALEZA;80180;TILDE PRETA SIMOA;116;405;;1;EM JOAO PAULO I;RUA LUIZ DE CASTRO 254;BONSUCESSO;
2024;1;FORTALEZA;80180;TILDE PRETA SIMOA;116;433;;1;COMPLEXO SOCIAL MAIS INFÂNCIA MARIA DE LOURDES MOREIRA LEITE LIMA;RUA ARAGUAIANA, 77;JOÃO XXIII;
2024;1;FORTALEZA;80180;TILDE PRETA SIMOA;116;438;;1;CEI XV DE OUTUBRO;RUA MENINO JESUS DE PRAGA, 192;BONSUCESSO;
2024;1;FORTALEZA;80180;TILDE PRETA SIMOA;116;440;;1;CEI XV DE OUTUBRO;RUA MENINO JESUS DE PRAGA, 192;BONSUCESSO;
2024;1;FORTALEZA;80180;TILDE PRETA SIMOA;116;451;;1;EM ANTONIO DIOGO DE SIQUEIRA;RUA ANSELMO NOGUEIRA 655;BONSUCESSO;
2024;1;FORTALEZA;80180;TILDE PRETA SIMOA;116;456;;1;EM ANTONIO DIOGO DE SIQUEIRA;RUA ANSELMO NOGUEIRA 655;BONSUCESSO;
2024;1;FORTALEZA;80180;TILDE PRETA SIMOA;116;458;;1;COLEGIO LIMA NOGUEIRA;RUA JULIO BRAGA, 1117;JOÃO XXIII;
2024;1;FORTALEZA;80180;TILDE PRETA SIMOA;116;464;;1;EM ULYSSES GUIMARAES;RUA TENENTE FRANCISCO PAIVA 1350;GRANJA LISBOA;
2024;1;FORTALEZA;80180;TILDE PRETA SIMOA;116;492;;1;EM ANTONIO DIOGO DE SIQUEIRA;RUA ANSELMO NOGUEIRA 655;BONSUCESSO;
2024;1;FORTALEZA;80180;TILDE PRETA SIMOA;117;168;;1;EEFM JULIA ALVES PESSOA;RUA SÃO FRANCISCO SN;BOM JARDIM;
2024;1;FORTALEZA;80180;TILDE PRETA SIMOA;117;177;;1;COLÉGIO LUMEN;RUA SÃO FRANCISCO DO JARDIM, 396;BOM JARDIM;
2024;1;FORTALEZA;80180;TILDE PRETA SIMOA;117;179;;1;COLÉGIO VENCER;RUA JARDIM PARUARA, 1108;SIQUEIRA;
2024;1;FORTALEZA;80180;TILDE PRETA SIMOA;117;197;;1;COLÉGIO CASTRO ALVES;RUA TULIPA NEGRA, 2319;PARQUE PRESIDENTE VARGAS;
2024;1;FORTALEZA;80180;TILDE PRETA SIMOA;117;207;;1;EEFM PROFA ADALGISA BONFIM SOARES;AV. DO CANAL, S/N, ESQUINA COM RUA 103 - CONJUNTO ESPERANÇA;CONJUNTO ESPERANÇA;
2024;1;FORTALEZA;80180;TILDE PRETA SIMOA;117;243;;1;EMEIF MARIA BEZERRA QUEVEDO;RUA 103, 28 - CJ. NOVO MONDUBIM;MANOEL SÁTIRO;
2024;1;FORTALEZA;80180;TILDE PRETA SIMOA;117;244;;1;EMEIF MARIA BEZERRA QUEVEDO;RUA 103, 28 - CJ. NOVO MONDUBIM;MANOEL SÁTIRO;
2024;1;FORTALEZA;80180;TILDE PRETA SIMOA;117;337;;1;EM JOSE MARIA MOREIRA CAMPOS;RUA FRANCISCO ALMEIDA, 525 CJ. APOLO XI;PARQUE PRESIDENTE VARGAS;
2024;1;FORTALEZA;80180;TILDE PRETA SIMOA;117;363;;1;PROJETO ALIANÇA COM CRISTO;RUA WALDEMAR PAES BRAGANÇA 1208;BOM JARDIM;
2024;1;FORTALEZA;80180;TILDE PRETA SIMOA;117;372;;1;EEFM SAO JOSE;RUA COMENDADOR GARCIA, 2066;PARQUE SÃO JOSÉ;
2024;1;FORTALEZA;80180;TILDE PRETA SIMOA;117;376;;1;EMEIF MARIA BEZERRA QUEVEDO;RUA 103, 28 - CJ. NOVO MONDUBIM;MANOEL SÁTIRO;
2024;1;FORTALEZA;80180;TILDE PRETA SIMOA;117;392;;1;ESCOLA MUNICIPAL PROF JOSE CÍRIO PEREIRA FILHO;RUA QUARTZO ROSA, 100;SIQUEIRA;
2024;1;FORTALEZA;80180;TILDE PRETA SIMOA;117;447;;1;COLÉGIO VIDA VIVA;RUA JOSÉ MARIA, 100;SIQUEIRA;
2024;1;FORTALEZA;80180;TILDE PRETA SIMOA;118;54;;2;COLEGIO CONEXÃO SABER;RUA DOUTOR PEDRO SAMPAIO, 550;PASSARÉ;
2024;1;FORTALEZA;80180;TILDE PRETA SIMOA;118;55;;1;COLEGIO CONEXÃO SABER;RUA DOUTOR PEDRO SAMPAIO, 550;PASSARÉ;
2024;1;FORTALEZA;80180;TILDE PRETA SIMOA;118;118;;1;COLÉGIO MULTIVERSO (ANTIGO COLÉGIO TELES);AV. JUSCELINO KUBITSCHECK, 3653;PASSARÉ;
2024;1;FORTALEZA;80180;TILDE PRETA SIMOA;118;134;;1;EM ZAIRA MONTEIRO GONDIM;RUA PEDRO AGUIAR, 315;ITAPERI;
2024;1;FORTALEZA;80180;TILDE PRETA SIMOA;118;328;;1;EM DOUTOR ABDENAGO DA ROCHA LIMA;RUA 114, 75 (CJ TUPAN MIRIM);PARQUE DOIS IRMÃOS;
2024;1;FORTALEZA;80180;TILDE PRETA SIMOA;118;330;;1;EM MARIA DE CARVALHO MARTINS;AVENIDA DOUTOR SILAS MUNGUBA, 4300;SERRINHA;
2024;1;FORTALEZA;80180;TILDE PRETA SIMOA;118;370;;2;EM MARIA DE CARVALHO MARTINS;AVENIDA DOUTOR SILAS MUNGUBA, 4300;SERRINHA;
2024;1;FORTALEZA;80180;TILDE PRETA SIMOA;118;406;;1;EEFM PROFESSOR JADER MOREIRA DE CARVALHO;RUA PROFESSORA HELOISA FERREIRA LIMA, 420;SERRINHA;
2024;1;FORTALEZA;80180;TILDE PRETA SIMOA;118;423;;1;EM MARIA DE CARVALHO MARTINS;AVENIDA DOUTOR SILAS MUNGUBA, 4300;SERRINHA;
2024;1;FORTALEZA;80180;TILDE PRETA SIMOA;118;459;;1;COLÉGIO MULTIVERSO (ANTIGO COLÉGIO TELES);AV. JUSCELINO KUBITSCHECK, 3653;PASSARÉ;
2024;1;FORTALEZA;80180;TILDE PRETA SIMOA;118;460;;1;EM MARIA DE CARVALHO MARTINS;AVENIDA DOUTOR SILAS MUNGUBA, 4300;SERRINHA;
2024;1;FORTALEZA;80180;TILDE PRETA SIMOA;118;557;;1;EM PROFESSOR JACINTO BOTELHO;RUA DR. RODRIGO CODES SANDOVAL, 374;MONDUBIM;
2024;1;FORTALEZA;80180;TILDE PRETA SIMOA;118;561;;1;COLÉGIO CONECTIVO;RUA GENERAL ONOFRE, 445;MONDUBIM;
2024;1;FORTALEZA;80180;TILDE PRETA SIMOA;118;568;;1;EEFM PROFESSORA MARIA GONCALVES;RUA N S DO MONTE CARMELO S/N;BOA VISTA-CASTELÃO;
2024;1;FORTALEZA;80180;TILDE PRETA SIMOA;118;584;;1;EEFM ANTÔNIO DIAS MACEDO;AV PEDRO DANTAS 340;DIAS MACEDO;
2024;1;FORTALEZA;80180;TILDE PRETA SIMOA;118;612;;1;EM CASIMIRO MONTENEGRO;AV. BERNARDO MANUEL, 11360;MONDUBIM;
2024;1;FORTALEZA;80180;TILDE PRETA SIMOA;118;615;;1;EM PROFESSORA MARIA JOSÉ MACÁRIO COELHO;AVENIDA PASSARÉ, 530;PASSARÉ;
2024;1;FORTALEZA;80180;TILDE PRETA SIMOA;118;618;;1;COLEGIO MARIA ESTER II;RUA F (CONJUNTO MIRASSOL), 158;PARQUE DOIS IRMÃOS;
2024;1;FORTALEZA;80180;TILDE PRETA SIMOA;118;629;;1;COLEGIO CONEXÃO SABER;RUA DOUTOR PEDRO SAMPAIO, 550;PASSARÉ;
2024;1;FORTALEZA;80180;TILDE PRETA SIMOA;118;650;;2;EEMTI DEPUTADO PAULINO ROCHA;RUA PROFESSOR JOSE SILVEIRA, 528;PASSARÉ;
2024;1;FORTALEZA;80180;TILDE PRETA SIMOA;118;654;;3;COLÉGIO MONTEIRO LOBATO;RUA 112, N 247, TUPÃ MIRIM;PARQUE DOIS IRMÃOS;
2024;1;FORTALEZA;80180;TILDE PRETA SIMOA;118;662;;1;COLÉGIO MONTEIRO LOBATO;RUA 112, N 247, TUPÃ MIRIM;PARQUE DOIS IRMÃOS;
2024;1;FORTALEZA;80180;TILDE PRETA SIMOA;118;667;;1;EM PROFESSORA MARIA STELLA COCHRANE SANTIAGO;RUA ANTONIO FARIAS, 121;BOA VISTA-CASTELÃO;
2024;1;FORTALEZA;80180;TILDE PRETA SIMOA;118;668;;1;EEMTI DEPUTADO PAULINO ROCHA;RUA PROFESSOR JOSE SILVEIRA, 528;PASSARÉ;
2024;1;FORTALEZA;80180;TILDE PRETA SIMOA;118;678;;1;COLEGIO EXODUS;RUA DOUTOR EDUARDO DIAS, 156;PASSARÉ;
TOTAL;;;;;;;;449;
