Ano;Turno;Município;Número;Candidato;Zona;Seção;Seções Agregadas;Votos;Local de Votação;Endereço Local de Votação;Bairro;
2024;1;FORTALEZA;80180;TILDE PRETA SIMOA;1;38;;1;UNINTA - FACULDADE UNINTA FORTALEZA;RUA VILEBALDO AGUIAR,133;COCÓ;
2024;1;FORTALEZA;80180;TILDE PRETA SIMOA;1;85;;1;FACULDADE FARIAS BRITO - CASTRO MONTE;RUA CASTRO MONTE 1364;VARJOTA;
2024;1;FORTALEZA;80180;TILDE PRETA SIMOA;1;146;;1;ESCOLA ESTADUAL ARQUITETO ROGERIO FROES;AVENIDA DAS GRAVIOLAS 1000;CIDADE 2000;
2024;1;FORTALEZA;80180;TILDE PRETA SIMOA;1;344;;1;ESCOLA ESTADUAL MATIAS BECK;RUA  PROFESSORA AIDA BALAIO 38;MUCURIPE;
2024;1;FORTALEZA;80180;TILDE PRETA SIMOA;1;349;;2;ESCOLA MUNICIPAL JOSE RAMOS TORRES DE MELO;AVENIDA DA ABOLIÇÃO 3984;MUCURIPE;
2024;1;FORTALEZA;80180;TILDE PRETA SIMOA;1;460;;1;ESCOLA ESTADUAL MARIA JOSE MEDEIROS;RUA DESEMBARGADOR LAURO NOGUEIRA 1240;PAPICU;
2024;1;FORTALEZA;80180;TILDE PRETA SIMOA;1;461;;1;ESCOLA ESTADUAL  BARBARA DE ALENCAR;RUA PEDRO RUFINO 38;VARJOTA;
2024;1;FORTALEZA;80180;TILDE PRETA SIMOA;1;477;;1;ESCOLA MIGUEL FIALHO - ANTIGO PADRE JOSÉ NILSON ;RUA CORONEL MANUEL JESUÍNO 225;MUCURIPE;
2024;1;FORTALEZA;80180;TILDE PRETA SIMOA;1;478;;1;ESCOLA MIGUEL FIALHO - ANTIGO PADRE JOSÉ NILSON ;RUA CORONEL MANUEL JESUÍNO 225;MUCURIPE;
2024;1;FORTALEZA;80180;TILDE PRETA SIMOA;1;480;;1;COLEGIO FARIAS BRITO - PRÉ UNIVERSITARIO - JULIO ABREU;AVENIDA JULIO ABREU, 284;VARJOTA;
2024;1;FORTALEZA;80180;TILDE PRETA SIMOA;1;481;;1;COLEGIO FARIAS BRITO - PRÉ UNIVERSITARIO - JULIO ABREU;AVENIDA JULIO ABREU, 284;VARJOTA;
2024;1;FORTALEZA;80180;TILDE PRETA SIMOA;1;486;;1;COLEGIO ANTARES - OCELO PINHEIRO;RUA PROFESSOR OCELO PINHEIRO 101;PAPICU;
2024;1;FORTALEZA;80180;TILDE PRETA SIMOA;1;552;;1;FACULDADE FARIAS BRITO - CASTRO MONTE;RUA CASTRO MONTE 1364;VARJOTA;
2024;1;FORTALEZA;80180;TILDE PRETA SIMOA;1;631;;1;FACULDADE FARIAS BRITO - CASTRO MONTE;RUA CASTRO MONTE 1364;VARJOTA;
2024;1;FORTALEZA;80180;TILDE PRETA SIMOA;1;644;;1;FACULDADE FARIAS BRITO - CASTRO MONTE;RUA CASTRO MONTE 1364;VARJOTA;
2024;1;FORTALEZA;80180;TILDE PRETA SIMOA;1;680;;1;FANOR - FACULDADE NORDESTE;AVENIDA SANTOS DUMONT 7800;DE LOURDES;
2024;1;FORTALEZA;80180;TILDE PRETA SIMOA;1;768;;1;COLEGIO ANTARES - SANTOS DUMONT;AVENIDA SANTOS DUMONT 3777;ALDEOTA;
2024;1;FORTALEZA;80180;TILDE PRETA SIMOA;1;770;;1;ESCOLA ESTADUAL ARQUITETO ROGERIO FROES;AVENIDA DAS GRAVIOLAS 1000;CIDADE 2000;
2024;1;FORTALEZA;80180;TILDE PRETA SIMOA;1;800;;1;COLEGIO ANTARES - SANTOS DUMONT;AVENIDA SANTOS DUMONT 3777;ALDEOTA;
2024;1;FORTALEZA;80180;TILDE PRETA SIMOA;1;833;;1;ESCOLA MUNICIPAL DOM ALOISIO LORSCHEIDER;RUA JULIO SILVA, 450;PRAIA DO FUTURO II;
2024;1;FORTALEZA;80180;TILDE PRETA SIMOA;1;845;;1;COLEGIO ANTARES - SANTOS DUMONT;AVENIDA SANTOS DUMONT 3777;ALDEOTA;
2024;1;FORTALEZA;80180;TILDE PRETA SIMOA;1;853;;1;COLEGIO ESPACO ABERTO - BENTO ALBUQUERQUE;RUA BENTO ALBUQUERQUE 1671;PAPICU;
2024;1;FORTALEZA;80180;TILDE PRETA SIMOA;1;888;;1;ESCOLA MUNICIPAL ODNILRA CRUZ MOREIRA;AVENIDA DAS ADENANTERAS 800;CIDADE 2000;
2024;1;FORTALEZA;80180;TILDE PRETA SIMOA;1;895;;3;COLEGIO ARI DE SA - MONSENHOR CATAO;RUA MONSENHOR CATAO, 1655;ALDEOTA;
2024;1;FORTALEZA;80180;TILDE PRETA SIMOA;1;899;;1;ESCOLA ESTADUAL MATIAS BECK;RUA  PROFESSORA AIDA BALAIO 38;MUCURIPE;
2024;1;FORTALEZA;80180;TILDE PRETA SIMOA;1;910;;1;UNINTA - FACULDADE UNINTA FORTALEZA;RUA VILEBALDO AGUIAR,133;COCÓ;
2024;1;FORTALEZA;80180;TILDE PRETA SIMOA;1;911;;1;ESCOLA MUNICIPAL ODNILRA CRUZ MOREIRA;AVENIDA DAS ADENANTERAS 800;CIDADE 2000;
2024;1;FORTALEZA;80180;TILDE PRETA SIMOA;1;915;;1;FANOR - FACULDADE NORDESTE;AVENIDA SANTOS DUMONT 7800;DE LOURDES;
2024;1;FORTALEZA;80180;TILDE PRETA SIMOA;1;919;;1;FANOR - FACULDADE NORDESTE;AVENIDA SANTOS DUMONT 7800;DE LOURDES;
2024;1;FORTALEZA;80180;TILDE PRETA SIMOA;2;71;;1;EEEP JOSE DE BARCELOS;RUA ANGELICA GURGEL 362;MESSEJANA;
2024;1;FORTALEZA;80180;TILDE PRETA SIMOA;2;100;;1;EM PROFª TELINA BARBOSA DA  COSTA;RUA PERGENTINO MAIA, 811;MESSEJANA;
2024;1;FORTALEZA;80180;TILDE PRETA SIMOA;2;111;;1;EMEIF DEMOCRITO ROCHA;RUA PADRE PEDRO DE ALENCAR, 2012;MESSEJANA;
2024;1;FORTALEZA;80180;TILDE PRETA SIMOA;2;112;;1;EMEIF DEMOCRITO ROCHA;RUA PADRE PEDRO DE ALENCAR, 2012;MESSEJANA;
2024;1;FORTALEZA;80180;TILDE PRETA SIMOA;2;167;;1;PATRONATO PADRE LUIZ BARBOSA MOREIRA;RUA CEL GUILHERME ALENCAR, 121;MESSEJANA;
2024;1;FORTALEZA;80180;TILDE PRETA SIMOA;2;400;;1;CLUBE DA CAIXA;AVENIDA FREI CIRILO 4700;MESSEJANA;
2024;1;FORTALEZA;80180;TILDE PRETA SIMOA;2;417;;1;EEEP COMENDADOR MIGUEL GURGEL;RUA JOSE BAIMA, S/N;GUAJERU;
2024;1;FORTALEZA;80180;TILDE PRETA SIMOA;2;501;;1;CLUBE DA CAIXA;AVENIDA FREI CIRILO 4700;MESSEJANA;
2024;1;FORTALEZA;80180;TILDE PRETA SIMOA;2;649;;1;EEFM JOSE DE ALENCAR;RUA VENEZA, 84;MESSEJANA;
2024;1;FORTALEZA;80180;TILDE PRETA SIMOA;2;650;;1;INSTITUTO FREI JOAO PEDRO DE SEXTO;AVENIDA FREI CIRILO, 4241;MESSEJANA;
2024;1;FORTALEZA;80180;TILDE PRETA SIMOA;2;686;;1;CMES PROFª TEREZINHA FERREIRA PARENTE;RUA NELSON COELHO, 209;LAGOA REDONDA;
2024;1;FORTALEZA;80180;TILDE PRETA SIMOA;2;721;;1;CMES PROFª TEREZINHA FERREIRA PARENTE;RUA NELSON COELHO, 209;LAGOA REDONDA;
2024;1;FORTALEZA;80180;TILDE PRETA SIMOA;2;728;;1;EEEP COMENDADOR MIGUEL GURGEL;RUA JOSE BAIMA, S/N;GUAJERU;
2024;1;FORTALEZA;80180;TILDE PRETA SIMOA;2;729;;1;SECRETARIA DA EDUCACAO - CAMBEBA;AVENIDA MINISTRO JOSE AMERICO, SN;CAMBEBA;
2024;1;FORTALEZA;80180;TILDE PRETA SIMOA;2;732;;1;CMES PROFª TEREZINHA FERREIRA PARENTE;RUA NELSON COELHO, 209;LAGOA REDONDA;
2024;1;FORTALEZA;80180;TILDE PRETA SIMOA;2;734;;1;EEFM JOSE DE ALENCAR;RUA VENEZA, 84;MESSEJANA;
2024;1;FORTALEZA;80180;TILDE PRETA SIMOA;2;743;;1;CMES PROFª TEREZINHA FERREIRA PARENTE;RUA NELSON COELHO, 209;LAGOA REDONDA;
2024;1;FORTALEZA;80180;TILDE PRETA SIMOA;2;744;;1;CMES PROFª TEREZINHA FERREIRA PARENTE;RUA NELSON COELHO, 209;LAGOA REDONDA;
2024;1;FORTALEZA;80180;TILDE PRETA SIMOA;2;793;;1;EMEIF GUIOMAR DA SILVA ALMEIDA;RUA PEROLINA DE MORAIS, 449;PAUPINA;
2024;1;FORTALEZA;80180;TILDE PRETA SIMOA;2;801;;1;EEFM IRACEMA;RUA EGIDIO DE OLIVEIRA, 250;JOSÉ DE ALENCAR;
2024;1;FORTALEZA;80180;TILDE PRETA SIMOA;2;820;;1;ETI MARIA ODETE DA SILVA COLARES;RUA CEL JOÃO DE OLIVEIRA, 687;MESSEJANA;
2024;1;FORTALEZA;80180;TILDE PRETA SIMOA;3;16;534;1;COLÉGIO 7 DE SETEMBRO (SEDE NGS);AV. DO IMPERADOR, 1330;CENTRO;
2024;1;FORTALEZA;80180;TILDE PRETA SIMOA;3;111;;1;COLÉGIO ESTADUAL LICEU DO CEARÁ;PRAÇA GUSTAVO BARROSO, 01;JACARECANGA;
2024;1;FORTALEZA;80180;TILDE PRETA SIMOA;3;114;;1;COLÉGIO ESTADUAL LICEU DO CEARÁ;PRAÇA GUSTAVO BARROSO, 01;JACARECANGA;
2024;1;FORTALEZA;80180;TILDE PRETA SIMOA;3;221;222;1;FAC. ESTÁCIO - UNIDADE CENTRO (ANTIGO COLÉGIO CEARENSE);AV. DUQUE DE CAXIAS, 101;CENTRO;
2024;1;FORTALEZA;80180;TILDE PRETA SIMOA;3;242;243;1;COLÉGIO ARI DE SÁ - PRÉ-VESTIBULAR - SEDE DUQUE DE CAXIAS;AV. DUQUE DE CAXIAS, 519;CENTRO;
2024;1;FORTALEZA;80180;TILDE PRETA SIMOA;3;297;;1;ACADEMIA DO PROFESSOR DARCY RIBEIRO;RUA DONA LEOPOLDINA, 907;CENTRO;
2024;1;FORTALEZA;80180;TILDE PRETA SIMOA;3;300;;1;ACADEMIA DO PROFESSOR DARCY RIBEIRO;RUA DONA LEOPOLDINA, 907;CENTRO;
2024;1;FORTALEZA;80180;TILDE PRETA SIMOA;3;386;;1;CÍRCULO MILITAR DE FORTALEZA;RUA CANUTO DE AGUIAR, 425;MEIRELES;
2024;1;FORTALEZA;80180;TILDE PRETA SIMOA;3;391;;1;CÍRCULO MILITAR DE FORTALEZA;RUA CANUTO DE AGUIAR, 425;MEIRELES;
2024;1;FORTALEZA;80180;TILDE PRETA SIMOA;3;397;;1;RECEITA FEDERAL (SUPER. DE ADM. DO MIN. DA ECON. NO CEARÁ);RUA BARÃO DE ARACATI, 909;ALDEOTA;
2024;1;FORTALEZA;80180;TILDE PRETA SIMOA;3;406;;1;EEMTI RENATO BRAGA;AV. RUI BARBOSA, 2000;ALDEOTA;
2024;1;FORTALEZA;80180;TILDE PRETA SIMOA;3;407;;1;EEMTI RENATO BRAGA;AV. RUI BARBOSA, 2000;ALDEOTA;
2024;1;FORTALEZA;80180;TILDE PRETA SIMOA;3;414;;1;COLÉGIO DARWIN;RUA ILDEFONSO ALBANO, 1030;ALDEOTA;
2024;1;FORTALEZA;80180;TILDE PRETA SIMOA;3;429;;1;FACULDADE ARI DE SÁ;AV. HERÁCLITO GRAÇA, 826;CENTRO;
2024;1;FORTALEZA;80180;TILDE PRETA SIMOA;3;434;;1;EEFM PARÓQUIA DA PAZ;RUA VISCONDE DE MAUÁ, 905/A;MEIRELES;
2024;1;FORTALEZA;80180;TILDE PRETA SIMOA;3;443;;1;INSTITUTO CEARENSE DE EDUCAÇÃO DE SURDOS - ICES;AV. RUI BARBOSA, 1970;ALDEOTA;
2024;1;FORTALEZA;80180;TILDE PRETA SIMOA;3;445;;1;EEFM SANTA LUZIA;RUA JOÃO CORDEIRO, 711;PRAIA DE IRACEMA;
2024;1;FORTALEZA;80180;TILDE PRETA SIMOA;3;451;;1;COLÉGIO DARWIN;RUA ILDEFONSO ALBANO, 1030;ALDEOTA;
2024;1;FORTALEZA;80180;TILDE PRETA SIMOA;3;478;;1;COLÉGIO CHRISTUS (AV. BARÃO DE STUDART);RUA JOÃO CARVALHO, 630;ALDEOTA;
2024;1;FORTALEZA;80180;TILDE PRETA SIMOA;3;515;;1;IDEAL CLUBE;AV. MONSENHOR TABOSA,  1381;MEIRELES;
2024;1;FORTALEZA;80180;TILDE PRETA SIMOA;3;533;;1;UNICHRISTUS ALDEOTA;RUA VISCONDE DE MAUÁ, 1940;ALDEOTA;
2024;1;FORTALEZA;80180;TILDE PRETA SIMOA;3;549;;1;SECRETARIA DA SAÚDE DO ESTADO DO CEARÁ;RUA ITAPIPOCA, 60;PRAIA DE IRACEMA;
2024;1;FORTALEZA;80180;TILDE PRETA SIMOA;3;565;;1;EM JOSÉ DIAS MACEDO;RUA NUNES VALENTE, 809;MEIRELES;
2024;1;FORTALEZA;80180;TILDE PRETA SIMOA;3;585;;1;ESCOLA DE SAÚDE PÚBLICA DO CEARÁ;AV. ANTÔNIO JUSTA, 3161;MEIRELES;
2024;1;FORTALEZA;80180;TILDE PRETA SIMOA;3;611;;1;COLÉGIO ESPAÇO ABERTO - DOM LUÍS;AV. DOM LUÍS, 730;ALDEOTA;
2024;1;FORTALEZA;80180;TILDE PRETA SIMOA;3;620;;1;COLÉGIO BATISTA - SANTOS DUMONT;RUA DESEMBARGADOR LEITE ALBUQUERQUE, 1056;ALDEOTA;
2024;1;FORTALEZA;80180;TILDE PRETA SIMOA;3;623;;1;COLÉGIO BATISTA - SANTOS DUMONT;RUA DESEMBARGADOR LEITE ALBUQUERQUE, 1056;ALDEOTA;
2024;1;FORTALEZA;80180;TILDE PRETA SIMOA;80;137;;1;EEFM JOAQUIM ANTÔNIO ALBANO;RUA JULIO SIQUEIRA 390;DIONISIO TORRES;
2024;1;FORTALEZA;80180;TILDE PRETA SIMOA;80;141;;1;EEFM JOAQUIM ANTÔNIO ALBANO;RUA JULIO SIQUEIRA 390;DIONISIO TORRES;
2024;1;FORTALEZA;80180;TILDE PRETA SIMOA;80;145;;1;COLÉGIO MONSENHOR JOVINIANO BARRETO - INFANTIL;RUA FREI VIDAL, 1680;TAUAPE;
2024;1;FORTALEZA;80180;TILDE PRETA SIMOA;80;172;;1;COLÉGIO MONSENHOR JOVINIANO BARRETO - INFANTIL;RUA FREI VIDAL, 1680;TAUAPE;
2024;1;FORTALEZA;80180;TILDE PRETA SIMOA;80;177;;1;CENTRO EDUC. DA JUV. PE. JOÃO PIAMARTA - AGUANAMBI;AV. AGUANAMBI, 2479;FÁTIMA;
2024;1;FORTALEZA;80180;TILDE PRETA SIMOA;80;188;;1;COLÉGIO NOSSA SENHORA DAS GRAÇAS;RUA MONSENHOR OTÁVIO DE CASTRO, 535;FÁTIMA;
2024;1;FORTALEZA;80180;TILDE PRETA SIMOA;80;189;;1;COLÉGIO NOSSA SENHORA DAS GRAÇAS;RUA MONSENHOR OTÁVIO DE CASTRO, 535;FÁTIMA;
2024;1;FORTALEZA;80180;TILDE PRETA SIMOA;80;194;;1;COLÉGIO SANTO TOMÁZ DE AQUINO;RUA MÁRIO MAMEDE, 750;FÁTIMA;
2024;1;FORTALEZA;80180;TILDE PRETA SIMOA;80;222;;1;EEFM PADRE ROCHA;RUA CEL ALVES TEIXEIRA 525;JOAQUIM TÁVORA;
2024;1;FORTALEZA;80180;TILDE PRETA SIMOA;80;225;;1;EEFM PADRE ROCHA;RUA CEL ALVES TEIXEIRA 525;JOAQUIM TÁVORA;
2024;1;FORTALEZA;80180;TILDE PRETA SIMOA;80;227;;2;EEFM PADRE ROCHA;RUA CEL ALVES TEIXEIRA 525;JOAQUIM TÁVORA;
2024;1;FORTALEZA;80180;TILDE PRETA SIMOA;80;228;;1;EEFM PADRE ROCHA;RUA CEL ALVES TEIXEIRA 525;JOAQUIM TÁVORA;
2024;1;FORTALEZA;80180;TILDE PRETA SIMOA;80;244;;1;EEFM NOEL HUGNEN OLIVEIRA PAIVA;RUA MONSENHOR SALAZAR 279;TAUAPE;
2024;1;FORTALEZA;80180;TILDE PRETA SIMOA;80;250;;1;EMEIF PROFª ANTONIETA CALS;RUA MONSENHOR SALAZAR 1480;TAUAPE;
2024;1;FORTALEZA;80180;TILDE PRETA SIMOA;80;266;;1;COLÉGIO JENNY GOMES;AV. BORGES DE MELO, 210;AEROPORTO;
2024;1;FORTALEZA;80180;TILDE PRETA SIMOA;80;306;;1;ASSEMBLÉIA LEGISLATIVA - UNIVERSIDADE DO PARLAMENTO CEARENSE;RUA BARBOSA DE FREITAS, 2674;DIONISIO TORRES;
2024;1;FORTALEZA;80180;TILDE PRETA SIMOA;80;310;;1;COLÉGIO CHRISTUS - DIONÍSIO TORRES;RUA ISRAEL BEZERRA 630;DIONISIO TORRES;
2024;1;FORTALEZA;80180;TILDE PRETA SIMOA;80;321;;1;COLÉGIO SANTO INACIO;AVENIDA DESEMBARGADOR MOREIRA 2355;DIONISIO TORRES;
2024;1;FORTALEZA;80180;TILDE PRETA SIMOA;80;324;;1;COLÉGIO SANTO INACIO;AVENIDA DESEMBARGADOR MOREIRA 2355;DIONISIO TORRES;
2024;1;FORTALEZA;80180;TILDE PRETA SIMOA;80;325;;1;COLÉGIO SANTO INACIO;AVENIDA DESEMBARGADOR MOREIRA 2355;DIONISIO TORRES;
2024;1;FORTALEZA;80180;TILDE PRETA SIMOA;80;337;;2;COLÉGIO ANTARES IRMÃ MARIA (ANTIGO IRMÃ MARIA MONTENEGRO);RUA PINHO PESSOA 681;JOAQUIM TÁVORA;
2024;1;FORTALEZA;80180;TILDE PRETA SIMOA;80;345;;1;COLÉGIO SALESIANO DOM BOSCO;AV ANTONIO SALES 116;JOAQUIM TÁVORA;
2024;1;FORTALEZA;80180;TILDE PRETA SIMOA;80;359;;1;EMEIF ALMERINDA DE ALBUQUERQUE;RUA ANA GONCALVES 1105;TAUAPE;
2024;1;FORTALEZA;80180;TILDE PRETA SIMOA;80;361;;1;EMEIF ALMERINDA DE ALBUQUERQUE;RUA ANA GONCALVES 1105;TAUAPE;
2024;1;FORTALEZA;80180;TILDE PRETA SIMOA;80;389;;1;EEM GOV. ADAUTO BEZERRA;RUA MONSENHOR LIBERATO, 1850;FÁTIMA;
2024;1;FORTALEZA;80180;TILDE PRETA SIMOA;80;391;;1;EEM GOV. ADAUTO BEZERRA;RUA MONSENHOR LIBERATO, 1850;FÁTIMA;
2024;1;FORTALEZA;80180;TILDE PRETA SIMOA;80;392;;1;EEM GOV. ADAUTO BEZERRA;RUA MONSENHOR LIBERATO, 1850;FÁTIMA;
2024;1;FORTALEZA;80180;TILDE PRETA SIMOA;80;393;;2;EEM GOV. ADAUTO BEZERRA;RUA MONSENHOR LIBERATO, 1850;FÁTIMA;
2024;1;FORTALEZA;80180;TILDE PRETA SIMOA;80;397;;1;EEM GOV. ADAUTO BEZERRA;RUA MONSENHOR LIBERATO, 1850;FÁTIMA;
2024;1;FORTALEZA;80180;TILDE PRETA SIMOA;80;418;;1;FACULDADE MAURÍCIO DE NASSAU;AVENIDA VISCONDE DO RIO BRANCO, 2078;JOSÉ BONIFÁCIO;
2024;1;FORTALEZA;80180;TILDE PRETA SIMOA;80;421;;1;COLÉGIO SANTO INACIO;AVENIDA DESEMBARGADOR MOREIRA 2355;DIONISIO TORRES;
2024;1;FORTALEZA;80180;TILDE PRETA SIMOA;80;436;443;1;ESCOLA VILA;RUA DOM SEBASTIAO LEME, 819;FÁTIMA;
2024;1;FORTALEZA;80180;TILDE PRETA SIMOA;80;440;;2;FACULDADE MAURÍCIO DE NASSAU;AVENIDA VISCONDE DO RIO BRANCO, 2078;JOSÉ BONIFÁCIO;
2024;1;FORTALEZA;80180;TILDE PRETA SIMOA;80;441;;1;COLÉGIO ANTARES FÁTIMA (VILA UNIÃO);RUA ALBERTO MONTEZUMA, 235;VILA UNIÃO;
2024;1;FORTALEZA;80180;TILDE PRETA SIMOA;82;31;;2;SECRETARIA DE DESENVOLVIMENTO AGRÁRIO DO ESTADO DO CEARÁ;AV. BEZERRA DE MENEZES, 1620;SÃO GERARDO;
2024;1;FORTALEZA;80180;TILDE PRETA SIMOA;82;68;;1;COLÉGIO MANUEL DA SILVA - CARLITO PAMPLONA;AV. FRANCISCO SÁ, 4001;CARLITO PAMPLONA;
2024;1;FORTALEZA;80180;TILDE PRETA SIMOA;82;73;;1;COLÉGIO MANUEL DA SILVA - CARLITO PAMPLONA;AV. FRANCISCO SÁ, 4001;CARLITO PAMPLONA;
2024;1;FORTALEZA;80180;TILDE PRETA SIMOA;82;104;;1;EEFM LIONS JANGADA - EEMTI;RUA CAMÉLIA, 352;CRISTO REDENTOR;
2024;1;FORTALEZA;80180;TILDE PRETA SIMOA;82;191;;1;CENTRO EDUCACIONAL SÃO MATEUS;AV. SARGENTO HERMÍNIO SAMPAIO, 2440;MONTE CASTELO;
2024;1;FORTALEZA;80180;TILDE PRETA SIMOA;82;212;;1;INSTITUTO MATER AMABILIS;RUA PADRE ANCHIETA, 438;MONTE CASTELO;
2024;1;FORTALEZA;80180;TILDE PRETA SIMOA;82;225;;1;CENTRO EDUCACIONAL MOEMA TÁVORA;RUA MARCÍLIO DIAS, 485;PIRAMBU;
2024;1;FORTALEZA;80180;TILDE PRETA SIMOA;82;369;;1;COLÉGIO MASTER - BEZERRA DE MENEZES;AV. BEZERRA DE MENEZES, 1802;SÃO GERARDO;
2024;1;FORTALEZA;80180;TILDE PRETA SIMOA;82;376;;1;ESCOLA MUNICIPAL PROFESSOR MARTINZ DE AGUIAR - EI/EF;RUA BERNARDO PORTO, 490;MONTE CASTELO;
2024;1;FORTALEZA;80180;TILDE PRETA SIMOA;82;431;;1;COLÉGIO MASTER - BEZERRA DE MENEZES;AV. BEZERRA DE MENEZES, 1802;SÃO GERARDO;
2024;1;FORTALEZA;80180;TILDE PRETA SIMOA;82;461;;1;COLÉGIO MASTER - BEZERRA DE MENEZES;AV. BEZERRA DE MENEZES, 1802;SÃO GERARDO;
2024;1;FORTALEZA;80180;TILDE PRETA SIMOA;82;475;;1;CEJA PAULO FREIRE;RUA OLAVO BILAC, 1300;SÃO GERARDO;
2024;1;FORTALEZA;80180;TILDE PRETA SIMOA;82;540;;1;CEJA PAULO FREIRE;RUA OLAVO BILAC, 1300;SÃO GERARDO;
2024;1;FORTALEZA;80180;TILDE PRETA SIMOA;82;611;;1;INSTITUTO MATER AMABILIS;RUA PADRE ANCHIETA, 438;MONTE CASTELO;
2024;1;FORTALEZA;80180;TILDE PRETA SIMOA;82;620;;1;CENTRO EDUCACIONAL SÃO MATEUS;AV. SARGENTO HERMÍNIO SAMPAIO, 2440;MONTE CASTELO;
2024;1;FORTALEZA;80180;TILDE PRETA SIMOA;82;640;;1;CENTRO EDUCACIONAL SÃO MATEUS;AV. SARGENTO HERMÍNIO SAMPAIO, 2440;MONTE CASTELO;
2024;1;FORTALEZA;80180;TILDE PRETA SIMOA;82;641;;1;ESCOLA MUNICIPAL PATATIVA DO ASSARÉ - EI/EF;RUA IRINEU DE SOUZA, 197;ÁLVARO WEYNE;
2024;1;FORTALEZA;80180;TILDE PRETA SIMOA;82;643;;1;SECRETARIA DE DESENVOLVIMENTO AGRÁRIO DO ESTADO DO CEARÁ;AV. BEZERRA DE MENEZES, 1620;SÃO GERARDO;
2024;1;FORTALEZA;80180;TILDE PRETA SIMOA;82;650;;1;ESCOLA MUNICIPAL SEBASTIANA ALDIGUERI;AV. DOUTOR THEBERGE, 448;CRISTO REDENTOR;
2024;1;FORTALEZA;80180;TILDE PRETA SIMOA;82;670;;1;ESCOLA MUNICIPAL ANTONIO MENDES - EI/EF;RUA DONA MENDINA, 682;CRISTO REDENTOR;
2024;1;FORTALEZA;80180;TILDE PRETA SIMOA;82;695;;2;ESCOLA MUNICIPAL LENIRA JUREMA DE MAGALHÃES - EI/EF;RUA TEÓFILO GURGEL, 111;MONTE CASTELO;
2024;1;FORTALEZA;80180;TILDE PRETA SIMOA;83;58;;1;EEMTI SENADOR FERNANDES TÁVORA;RUA GOIÁS 141;BELA VISTA;
2024;1;FORTALEZA;80180;TILDE PRETA SIMOA;83;66;;2;EEFM JOAQUIM ALVES;RUA ESTADO DO RIO 955;DEMOCRITO ROCHA;
2024;1;FORTALEZA;80180;TILDE PRETA SIMOA;83;97;;1;EEM  MARIANO MARTINS;AVENIDA SENADOR FERNANDES TÁVORA 1445;HENRIQUE JORGE;
2024;1;FORTALEZA;80180;TILDE PRETA SIMOA;83;98;;1;EEM  MARIANO MARTINS;AVENIDA SENADOR FERNANDES TÁVORA 1445;HENRIQUE JORGE;
2024;1;FORTALEZA;80180;TILDE PRETA SIMOA;83;99;;2;EEM  MARIANO MARTINS;AVENIDA SENADOR FERNANDES TÁVORA 1445;HENRIQUE JORGE;
2024;1;FORTALEZA;80180;TILDE PRETA SIMOA;83;171;;1;EEFM HERACLITO DE CASTRO E SILVA;RUA SILVEIRA FILHO, 808;JÓQUEI CLUBE;
2024;1;FORTALEZA;80180;TILDE PRETA SIMOA;83;236;;1;ESCOLA MUNICIPAL JOSÉ BATISTA DE OLIVEIRA;RUA GOIÁS 620;PANAMERICANO;
2024;1;FORTALEZA;80180;TILDE PRETA SIMOA;83;238;;2;ESCOLA MUNICIPAL JOSÉ BATISTA DE OLIVEIRA;RUA GOIÁS 620;PANAMERICANO;
2024;1;FORTALEZA;80180;TILDE PRETA SIMOA;83;239;;1;ESCOLA MUNICIPAL JOSÉ BATISTA DE OLIVEIRA;RUA GOIÁS 620;PANAMERICANO;
2024;1;FORTALEZA;80180;TILDE PRETA SIMOA;83;416;;1;EEMTI ESTADO DO AMAZONAS;RUA MONSENHOR FURTADO 2327;BELA VISTA;
2024;1;FORTALEZA;80180;TILDE PRETA SIMOA;83;419;;1;CENTRO EDUCACIONAL SÃO SEBASTIÃO;RUA GUANABARA 1003;DEMOCRITO ROCHA;
2024;1;FORTALEZA;80180;TILDE PRETA SIMOA;83;441;;1;ESCOLA PEQUENO PRINCIPE;RUA SILVEIRA FILHO, 825;JÓQUEI CLUBE;
2024;1;FORTALEZA;80180;TILDE PRETA SIMOA;83;463;;1;ESCOLA MUNICIPAL JOSÉ BATISTA DE OLIVEIRA;RUA GOIÁS 620;PANAMERICANO;
2024;1;FORTALEZA;80180;TILDE PRETA SIMOA;83;472;;1;ESCOLA MUNICIPAL DOM JOSÉ TUPINAMBA DA FROTA;RUA VIRIATO RIBEIRO 1031;BELA VISTA;
2024;1;FORTALEZA;80180;TILDE PRETA SIMOA;83;603;;1;ESCOLA MUNICIPAL SANTA MARIA;RUA CUIABÁ 1465;HENRIQUE JORGE;
2024;1;FORTALEZA;80180;TILDE PRETA SIMOA;83;622;;1;EEM  MARIANO MARTINS;AVENIDA SENADOR FERNANDES TÁVORA 1445;HENRIQUE JORGE;
2024;1;FORTALEZA;80180;TILDE PRETA SIMOA;83;688;;1;EEMTI ESTADO DO AMAZONAS;RUA MONSENHOR FURTADO 2327;BELA VISTA;
2024;1;FORTALEZA;80180;TILDE PRETA SIMOA;83;692;;1;CENTRO DE FORMAÇÃO E DESENV. PARA PROFISSIONAIS DA EDUCAÇÃO - FORMACE;RUA PORTO VELHO, 401;JOÃO XXIII;
2024;1;FORTALEZA;80180;TILDE PRETA SIMOA;83;693;;2;EDUCANDARIO FELIPE DOS SANTOS;RUA TERESINA 313;HENRIQUE JORGE;
2024;1;FORTALEZA;80180;TILDE PRETA SIMOA;83;696;;1;ESCOLA MUNICIPAL MURILO SERPA;RUA MONSENHOR HIPOLITO BRASIL 1400;DOM LUSTOSA;
2024;1;FORTALEZA;80180;TILDE PRETA SIMOA;83;702;;1;EEEP JÚLIA GIFFONI;RUA CORONEL MATOS DOURADO 1349;PICI;
2024;1;FORTALEZA;80180;TILDE PRETA SIMOA;83;704;;1;CENTRO EDUCACIONAL BRASILEIRINHO;AVENIDA SENADOR FERNANDES TÁVORA, 1717;HENRIQUE JORGE;
2024;1;FORTALEZA;80180;TILDE PRETA SIMOA;83;714;;1;COLÉGIO LUNA RANGEL;RUA EURICO MEDINA, 959;HENRIQUE JORGE;
2024;1;FORTALEZA;80180;TILDE PRETA SIMOA;83;723;;1;COLEGIO CHRISTUS;AV. ENG. HUMBERTO MONTE, 1355;BELA VISTA;
2024;1;FORTALEZA;80180;TILDE PRETA SIMOA;83;727;;2;EEMTI SENADOR FERNANDES TÁVORA;RUA GOIÁS 141;BELA VISTA;
2024;1;FORTALEZA;80180;TILDE PRETA SIMOA;83;743;;1;COLÉGIO LUNA RANGEL;RUA EURICO MEDINA, 959;HENRIQUE JORGE;
2024;1;FORTALEZA;80180;TILDE PRETA SIMOA;83;767;;1;CENTRO EDUCACIONAL BRASILEIRINHO;AVENIDA SENADOR FERNANDES TÁVORA, 1717;HENRIQUE JORGE;
2024;1;FORTALEZA;80180;TILDE PRETA SIMOA;83;770;;1;ESCOLA ESPAÇO VIVÊNCIA;RUA MONSENHOR HIPÓLITO BRASIL, 1367;DOM LUSTOSA;
2024;1;FORTALEZA;80180;TILDE PRETA SIMOA;83;771;;1;CENTRO DE FORMAÇÃO E DESENV. PARA PROFISSIONAIS DA EDUCAÇÃO - FORMACE;RUA PORTO VELHO, 401;JOÃO XXIII;
2024;1;FORTALEZA;80180;TILDE PRETA SIMOA;83;792;;1;COLÉGIO LUCÊ;RUA CUIABA 155;JÓQUEI CLUBE;
2024;1;FORTALEZA;80180;TILDE PRETA SIMOA;85;111;;1;CEJA ADELINO DE ALCANTARA FILHO - UV-6;RUA SEISCENTOS E DOZE, 100, 1A ETAPA;CONJUNTO CEARÁ I;
2024;1;FORTALEZA;80180;TILDE PRETA SIMOA;85;119;;1;CCDH - CENTRO DE CIDADANIA E DIREITOS HUMANOS (ANTIGO LUCIO ALCANTARA);AV. ALANIS MARIA LAURINDO DE OLIVEIRA, 461, 1A ETAPA;CONJUNTO CEARÁ I;
2024;1;FORTALEZA;80180;TILDE PRETA SIMOA;85;143;;1;EEEP PROFESSOR CESAR CAMPELO;RUA 717, N.164, 3 ETAPA;CONJUNTO CEARÁ I;
2024;1;FORTALEZA;80180;TILDE PRETA SIMOA;85;152;;1;EEF GOVERNADOR FAUSTINO ALBUQUERQUE - UV1;RUA 143 N 155 - 1 ETAPA;CONJUNTO CEARÁ I;
2024;1;FORTALEZA;80180;TILDE PRETA SIMOA;85;174;;1;EEFM MARIO HUGO CIDRAK DO VALE;RUA DR. PERIGUARI, 547;ANTÔNIO BEZERRA;
2024;1;FORTALEZA;80180;TILDE PRETA SIMOA;85;178;;1;EMTI MARIA DA HORA;RUA RAIMUNDO RIBEIRO, S/N;AUTRAN NUNES;
2024;1;FORTALEZA;80180;TILDE PRETA SIMOA;85;205;;2;ESCOLA MUNICIPAL PROF AMERICO BARREIRA;RUA RICARDO PONTES 529;GENIBAÚ;
2024;1;FORTALEZA;80180;TILDE PRETA SIMOA;85;254;;1;EEF PATRONATO DA SAGRADA FAMILIA;RUA MARTINS NETO 379;ANTÔNIO BEZERRA;
2024;1;FORTALEZA;80180;TILDE PRETA SIMOA;85;257;;1;EEF PATRONATO DA SAGRADA FAMILIA;RUA MARTINS NETO 379;ANTÔNIO BEZERRA;
2024;1;FORTALEZA;80180;TILDE PRETA SIMOA;85;266;;1;EMEIF DOLORES ALCANTARA;RUA CARDEAL ARCOVERDE S/N;AUTRAN NUNES;
2024;1;FORTALEZA;80180;TILDE PRETA SIMOA;85;318;;1;ESCOLA MUNICIPAL DEP MURILO AGUIAR;RUA 24 DE OUTUBRO 655;GENIBAÚ;
2024;1;FORTALEZA;80180;TILDE PRETA SIMOA;85;321;;1;ESCOLA MUNICIPAL DEP MURILO AGUIAR;RUA 24 DE OUTUBRO 655;GENIBAÚ;
2024;1;FORTALEZA;80180;TILDE PRETA SIMOA;85;332;;1;COLÉGIO ESSENCIAL;RUA PEDRO MELO, 1005;ANTÔNIO BEZERRA;
2024;1;FORTALEZA;80180;TILDE PRETA SIMOA;85;335;;1;COLÉGIO ESSENCIAL;RUA PEDRO MELO, 1005;ANTÔNIO BEZERRA;
2024;1;FORTALEZA;80180;TILDE PRETA SIMOA;85;361;;1;EEFM AYRTON SENNA DA SILVA;RUA MANAUS, 855;DOM LUSTOSA;
2024;1;FORTALEZA;80180;TILDE PRETA SIMOA;85;373;;1;EEFM DOUTOR GENTIL BARREIRA;RUA 202-D, S/N - CONJUNTO CEARÁ I;CONJUNTO CEARÁ I;
2024;1;FORTALEZA;80180;TILDE PRETA SIMOA;85;394;;1;CENTRO DE EDUCAÇÃO INFANTIL MURILO AGUIAR;RUA 24 DE OUTUBRO N 1063;GENIBAÚ;
2024;1;FORTALEZA;80180;TILDE PRETA SIMOA;85;395;;1;ESCOLA MUNICIPAL DEP JOAO FREDERICO FERREIRA GOMES;RUA JOSE MENDONCA 1160;GENIBAÚ;
2024;1;FORTALEZA;80180;TILDE PRETA SIMOA;93;101;;1;ESCOLA MUNICIPAL ARI DE SA CAVALCANTE (JOSÉ WALTER);AV. H, 430 III ETAPA;PREFEITO JOSÉ WALTER;
2024;1;FORTALEZA;80180;TILDE PRETA SIMOA;93;136;;1;COLEGIO VEGA;AVENIDA C, 160;PREFEITO JOSÉ WALTER;
2024;1;FORTALEZA;80180;TILDE PRETA SIMOA;93;170;;1;EM JOAO HILDO DE CARVALHO FURTADO;RUA MIGUEL ARAGÃO, S/N ARACAPÉ;MONDUBIM;
2024;1;FORTALEZA;80180;TILDE PRETA SIMOA;93;172;;1;EEFM ESTADO DO MARANHAO;RUA CARLOS PIMENTA,506;MONDUBIM;
2024;1;FORTALEZA;80180;TILDE PRETA SIMOA;93;180;;1;EEFM ESTADO DO MARANHAO;RUA CARLOS PIMENTA,506;MONDUBIM;
2024;1;FORTALEZA;80180;TILDE PRETA SIMOA;93;182;;1;EEFM ESTADO DO MARANHAO;RUA CARLOS PIMENTA,506;MONDUBIM;
2024;1;FORTALEZA;80180;TILDE PRETA SIMOA;93;201;;1;LICEU ESTADUAL DOMINGOS BRASILEIRO;RUA PLANALTINA, S/N;PLANALTO AYRTON SENNA;
2024;1;FORTALEZA;80180;TILDE PRETA SIMOA;93;206;;2;LICEU ESTADUAL DOMINGOS BRASILEIRO;RUA PLANALTINA, S/N;PLANALTO AYRTON SENNA;
2024;1;FORTALEZA;80180;TILDE PRETA SIMOA;93;221;;1;EEFM POLIVALENTE MODELO DE FORTALEZA;AV A (ARAQUÉM AGUIAR), 482 - I ETAPA;PREFEITO JOSÉ WALTER;
2024;1;FORTALEZA;80180;TILDE PRETA SIMOA;93;271;;1;LICEU ESTADUAL DOMINGOS BRASILEIRO;RUA PLANALTINA, S/N;PLANALTO AYRTON SENNA;
2024;1;FORTALEZA;80180;TILDE PRETA SIMOA;93;298;;1;CEJA - CENTRO DE EDUCAÇÃO DE JOVENS E ADULTOS;AV. L, S/N - II ETAPA;PREFEITO JOSÉ WALTER;
2024;1;FORTALEZA;80180;TILDE PRETA SIMOA;93;301;;1;EM ADALBERTO STUDART FILHO;RUA DO CAMPO, 25;PLANALTO AYRTON SENNA;
2024;1;FORTALEZA;80180;TILDE PRETA SIMOA;93;305;;2;ESCOLA SANTANA;RUA 10, 1305;MONDUBIM;
2024;1;FORTALEZA;80180;TILDE PRETA SIMOA;94;6;;1;CENTRO COMUNITARIO CONJUNTO SAO FRANCISCO;RUA ILHA DO BOTE 367;QUINTINO CUNHA;
2024;1;FORTALEZA;80180;TILDE PRETA SIMOA;94;191;;1;EEFM DONA HILZA DIOGO DE OLIVEIRA;AV. DOM ALOÍSIO LORSCHEIDER, 1040 - VILA VELHA;VILA VELHA;
2024;1;FORTALEZA;80180;TILDE PRETA SIMOA;94;193;;1;EEFM DONA HILZA DIOGO DE OLIVEIRA;AV. DOM ALOÍSIO LORSCHEIDER, 1040 - VILA VELHA;VILA VELHA;
2024;1;FORTALEZA;80180;TILDE PRETA SIMOA;94;194;;1;EEFM DONA HILZA DIOGO DE OLIVEIRA;AV. DOM ALOÍSIO LORSCHEIDER, 1040 - VILA VELHA;VILA VELHA;
2024;1;FORTALEZA;80180;TILDE PRETA SIMOA;94;197;;1;EEFM DONA HILZA DIOGO DE OLIVEIRA;AV. DOM ALOÍSIO LORSCHEIDER, 1040 - VILA VELHA;VILA VELHA;
2024;1;FORTALEZA;80180;TILDE PRETA SIMOA;94;203;;1;EMTI DEPUTADO ROBERTO MESQUITA;R. BETA,  SN;VILA VELHA;
2024;1;FORTALEZA;80180;TILDE PRETA SIMOA;94;322;;1;COLEGIO SALOME BASTOS;RUA DESEMBARGADOR HERMES PARAHYBA 1120;VILA VELHA;
2024;1;FORTALEZA;80180;TILDE PRETA SIMOA;94;327;;1;COLEGIO SALOME BASTOS;RUA DESEMBARGADOR HERMES PARAHYBA 1120;VILA VELHA;
2024;1;FORTALEZA;80180;TILDE PRETA SIMOA;94;443;;1;EMEIF HERONDINA LIMA CAVALCANTE;AV. AMBIENTALISTA ARY THIERS, 310;VILA VELHA;
2024;1;FORTALEZA;80180;TILDE PRETA SIMOA;94;532;;1;EMEF QUINTINO CUNHA;RUA MARIA CLARA 1263;VILA VELHA;
2024;1;FORTALEZA;80180;TILDE PRETA SIMOA;94;688;;1;CEJA - EUDES VERAS;AV. DEMÉTRIO MENEZES, 130;ANTÔNIO BEZERRA;
2024;1;FORTALEZA;80180;TILDE PRETA SIMOA;94;748;;1;EEMTI MARIA JOSÉ SANTOS FERREIRA GOMES;RUA DONA LUCIA PINHEIRO, 93;QUINTINO CUNHA;
2024;1;FORTALEZA;80180;TILDE PRETA SIMOA;94;796;;1;IGREJA SÃO PEDRO E SÃO PAULO;RUA PADRE TEODORO, 996;QUINTINO CUNHA;
2024;1;FORTALEZA;80180;TILDE PRETA SIMOA;94;819;;1;EEMTI MARIA JOSÉ SANTOS FERREIRA GOMES;RUA DONA LUCIA PINHEIRO, 93;QUINTINO CUNHA;
2024;1;FORTALEZA;80180;TILDE PRETA SIMOA;94;824;;1;COLÉGIO CIENTISTA;RUA 31, 330 - CONJUNTO POLAR;VILA VELHA;
2024;1;FORTALEZA;80180;TILDE PRETA SIMOA;94;834;;2;COLÉGIO DOM QUINTINO;RUA CECIL SALGADO, 53;JARDIM GUANABARA;
2024;1;FORTALEZA;80180;TILDE PRETA SIMOA;94;837;;1;COLÉGIO DOM FELIPE;AV INDEPENDÊNCIA. 1652;QUINTINO CUNHA;
