Ano;Turno;Município;Número;Candidato;Zona;Seção;Seções Agregadas;Votos;Local de Votação;Endereço Local de Votação;Bairro;
2024;1;FORTALEZA;22007;VILACIO ;1;463;;1;ESCOLA ESTADUAL  BARBARA DE ALENCAR;RUA PEDRO RUFINO 38;VARJOTA;
2024;1;FORTALEZA;22007;VILACIO ;1;466;;1;ESCOLA ESTADUAL  BARBARA DE ALENCAR;RUA PEDRO RUFINO 38;VARJOTA;
2024;1;FORTALEZA;22007;VILACIO ;1;641;;1;ESCOLA ESTADUAL  BARBARA DE ALENCAR;RUA PEDRO RUFINO 38;VARJOTA;
2024;1;FORTALEZA;22007;VILACIO ;1;650;;1;ESCOLA ESTADUAL MARIA JOSE MEDEIROS;RUA DESEMBARGADOR LAURO NOGUEIRA 1240;PAPICU;
2024;1;FORTALEZA;22007;VILACIO ;1;740;;1;ESCOLA ESTADUAL MATIAS BECK;RUA  PROFESSORA AIDA BALAIO 38;MUCURIPE;
2024;1;FORTALEZA;22007;VILACIO ;1;853;;1;COLEGIO ESPACO ABERTO - BENTO ALBUQUERQUE;RUA BENTO ALBUQUERQUE 1671;PAPICU;
2024;1;FORTALEZA;22007;VILACIO ;1;889;;1;UNINTA - FACULDADE UNINTA FORTALEZA;RUA VILEBALDO AGUIAR,133;COCÓ;
2024;1;FORTALEZA;22007;VILACIO ;1;908;;1;ESCOLA MUNICIPAL PROF BELARMINA CAMPOS;RUA MANOEL RODRIGUES MONTEIRO, 840;VICENTE PINZON;
2024;1;FORTALEZA;22007;VILACIO ;2;79;;1;EEEP COMENDADOR MIGUEL GURGEL;RUA JOSE BAIMA, S/N;GUAJERU;
2024;1;FORTALEZA;22007;VILACIO ;2;83;;1;EEEP COMENDADOR MIGUEL GURGEL;RUA JOSE BAIMA, S/N;GUAJERU;
2024;1;FORTALEZA;22007;VILACIO ;2;100;;1;EM PROFª TELINA BARBOSA DA  COSTA;RUA PERGENTINO MAIA, 811;MESSEJANA;
2024;1;FORTALEZA;22007;VILACIO ;2;108;;1;EMEIF DEMOCRITO ROCHA;RUA PADRE PEDRO DE ALENCAR, 2012;MESSEJANA;
2024;1;FORTALEZA;22007;VILACIO ;2;124;;2;EEFM JOSE DE ALENCAR;RUA VENEZA, 84;MESSEJANA;
2024;1;FORTALEZA;22007;VILACIO ;2;128;;1;EM PROFª TELINA BARBOSA DA  COSTA;RUA PERGENTINO MAIA, 811;MESSEJANA;
2024;1;FORTALEZA;22007;VILACIO ;2;153;;1;EMEIF ANGELICA GURGEL;RUA DOUTOR PERGENTINO MAIA, 375;MESSEJANA;
2024;1;FORTALEZA;22007;VILACIO ;2;166;;1;PATRONATO PADRE LUIZ BARBOSA MOREIRA;RUA CEL GUILHERME ALENCAR, 121;MESSEJANA;
2024;1;FORTALEZA;22007;VILACIO ;2;172;;1;PAROQUIA NOSSA SENHORA DA CONCEICAO;RUA JOAQUIM BEZERRA 255;MESSEJANA;
2024;1;FORTALEZA;22007;VILACIO ;2;396;;1;EEEP COMENDADOR MIGUEL GURGEL;RUA JOSE BAIMA, S/N;GUAJERU;
2024;1;FORTALEZA;22007;VILACIO ;2;401;;1;EEFM JOSE DE ALENCAR;RUA VENEZA, 84;MESSEJANA;
2024;1;FORTALEZA;22007;VILACIO ;2;425;;1;EEM DEPUTADO PAULO BENEVIDES;RUA ANGELICA GURGEL, 186;MESSEJANA;
2024;1;FORTALEZA;22007;VILACIO ;2;552;;1;EM PROFª FERNANDA MARIA DE ALENCAR COLARES;AV PROF. ARTHUR DE CARVALHO, 1540;LAGOA REDONDA;
2024;1;FORTALEZA;22007;VILACIO ;2;640;;3;EEM LICEU DE MESSEJANA;AVENIDA WASHINGTON SOARES 7702;MESSEJANA;
2024;1;FORTALEZA;22007;VILACIO ;2;673;;1;EEM DEPUTADO PAULO BENEVIDES;RUA ANGELICA GURGEL, 186;MESSEJANA;
2024;1;FORTALEZA;22007;VILACIO ;2;762;;1;EEEP COMENDADOR MIGUEL GURGEL;RUA JOSE BAIMA, S/N;GUAJERU;
2024;1;FORTALEZA;22007;VILACIO ;2;772;;1;EEFM JOSE DE ALENCAR;RUA VENEZA, 84;MESSEJANA;
2024;1;FORTALEZA;22007;VILACIO ;2;818;;1;COLÉGIO CHRISTUS SUL;AV. ENG. LEAL LIMA VERDE, 2265;JOSÉ DE ALENCAR;
2024;1;FORTALEZA;22007;VILACIO ;2;826;;1;FACULDADE ATENEU DO CEARÁ;AV. COLETOR ANTONIO GADELHA, 621;MESSEJANA;
2024;1;FORTALEZA;22007;VILACIO ;2;828;;1;ESCOLA MUNICIPAL ISABEL FERREIRA;RUA ISABEL FERREIRA, 1000 - CONJ. CURIÓ;LAGOA REDONDA;
2024;1;FORTALEZA;22007;VILACIO ;2;832;;1;COLÉGIO PAIVA ANDRADE;RUA INÁCIO MOREIRA, 133;MESSEJANA;
2024;1;FORTALEZA;22007;VILACIO ;3;183;;1;IEP - INST. DE EDUCAÇÃO PORTAL - UNIDADE FORTALEZA;AV. PADRE IBIAPINA, 1243;CENTRO;
2024;1;FORTALEZA;22007;VILACIO ;3;643;;1;EM JOSÉ DIAS MACEDO;RUA NUNES VALENTE, 809;MEIRELES;
2024;1;FORTALEZA;22007;VILACIO ;3;645;;1;WIZARD DOM LUÍS;AV. DOM LUÍS, 149;MEIRELES;
2024;1;FORTALEZA;22007;VILACIO ;80;223;;1;EEFM PADRE ROCHA;RUA CEL ALVES TEIXEIRA 525;JOAQUIM TÁVORA;
2024;1;FORTALEZA;22007;VILACIO ;83;251;;1;EEFM ANISIO TEIXEIRA;RUA RIO GRANDE DO SUL 680;PANAMERICANO;
2024;1;FORTALEZA;22007;VILACIO ;83;656;;1;EEFM JOSÉ WALDEMAR DE ALCÂNTARA E SILVA;RUA MACEIÓ, 627;DOM LUSTOSA;
2024;1;FORTALEZA;22007;VILACIO ;83;690;;1;ESCOLA MUNICIPAL DE TEMPO INTEGRAL PROFESSOR JOSE JULIO DA PONTE;RUA MARIO DE ANDRADE, S/N;BELA VISTA;
2024;1;FORTALEZA;22007;VILACIO ;85;122;;1;CCDH - CENTRO DE CIDADANIA E DIREITOS HUMANOS (ANTIGO LUCIO ALCANTARA);AV. ALANIS MARIA LAURINDO DE OLIVEIRA, 461, 1A ETAPA;CONJUNTO CEARÁ I;
2024;1;FORTALEZA;22007;VILACIO ;85;123;;1;CCDH - CENTRO DE CIDADANIA E DIREITOS HUMANOS (ANTIGO LUCIO ALCANTARA);AV. ALANIS MARIA LAURINDO DE OLIVEIRA, 461, 1A ETAPA;CONJUNTO CEARÁ I;
2024;1;FORTALEZA;22007;VILACIO ;85;132;;1;COLÉGIO LUÍZA TÁVORA;RUA 1050, N 171, 4 ETAPA;CONJUNTO CEARÁ I;
2024;1;FORTALEZA;22007;VILACIO ;85;137;;1;COLÉGIO LUÍZA TÁVORA;RUA 1050, N 171, 4 ETAPA;CONJUNTO CEARÁ I;
2024;1;FORTALEZA;22007;VILACIO ;85;138;;2;COLÉGIO LUÍZA TÁVORA;RUA 1050, N 171, 4 ETAPA;CONJUNTO CEARÁ I;
2024;1;FORTALEZA;22007;VILACIO ;85;148;;1;EEF GOVERNADOR FAUSTINO ALBUQUERQUE - UV1;RUA 143 N 155 - 1 ETAPA;CONJUNTO CEARÁ I;
2024;1;FORTALEZA;22007;VILACIO ;85;175;;1;EEFM MARIO HUGO CIDRAK DO VALE;RUA DR. PERIGUARI, 547;ANTÔNIO BEZERRA;
2024;1;FORTALEZA;22007;VILACIO ;85;195;;1;ESCOLA JOÃO PAULO II;AV C N. 1381 2 ETAPA;CONJUNTO CEARÁ I;
2024;1;FORTALEZA;22007;VILACIO ;85;198;;1;ESCOLA JOÃO PAULO II;AV C N. 1381 2 ETAPA;CONJUNTO CEARÁ I;
2024;1;FORTALEZA;22007;VILACIO ;85;199;;1;ESCOLA JOÃO PAULO II;AV C N. 1381 2 ETAPA;CONJUNTO CEARÁ I;
2024;1;FORTALEZA;22007;VILACIO ;85;233;;1;EEFM DOUTOR GENTIL BARREIRA;RUA 202-D, S/N - CONJUNTO CEARÁ I;CONJUNTO CEARÁ I;
2024;1;FORTALEZA;22007;VILACIO ;85;269;;1;EMEIF DOLORES ALCANTARA;RUA CARDEAL ARCOVERDE S/N;AUTRAN NUNES;
2024;1;FORTALEZA;22007;VILACIO ;85;281;;1;EEFM PROF PLACIDO ADERALDO CASTELO - UV 7B;RUA SETECENTOS E VINTE E UM, 100, 3A ETAPA;CONJUNTO CEARÁ I;
2024;1;FORTALEZA;22007;VILACIO ;85;332;;1;COLÉGIO ESSENCIAL;RUA PEDRO MELO, 1005;ANTÔNIO BEZERRA;
2024;1;FORTALEZA;22007;VILACIO ;93;136;;1;COLEGIO VEGA;AVENIDA C, 160;PREFEITO JOSÉ WALTER;
2024;1;FORTALEZA;22007;VILACIO ;93;227;;1;EEFM POLIVALENTE MODELO DE FORTALEZA;AV A (ARAQUÉM AGUIAR), 482 - I ETAPA;PREFEITO JOSÉ WALTER;
2024;1;FORTALEZA;22007;VILACIO ;94;48;;1;EMTI JOSÉ CARLOS DE OLIVEIRA NETO;R. SAO VICENTE DE PAULO, 170;ANTÔNIO BEZERRA;
2024;1;FORTALEZA;22007;VILACIO ;94;50;;1;EMTI JOSÉ CARLOS DE OLIVEIRA NETO;R. SAO VICENTE DE PAULO, 170;ANTÔNIO BEZERRA;
2024;1;FORTALEZA;22007;VILACIO ;94;323;;1;COLEGIO SALOME BASTOS;RUA DESEMBARGADOR HERMES PARAHYBA 1120;VILA VELHA;
2024;1;FORTALEZA;22007;VILACIO ;94;891;;1;EEMTI MONSENHOR DOURADO;AVENIDA SARGENTO HERMÍNIO SAMPAIO 4600;PADRE ANDRADE;
2024;1;FORTALEZA;22007;VILACIO ;94;892;;1;EEMTI MONSENHOR DOURADO;AVENIDA SARGENTO HERMÍNIO SAMPAIO 4600;PADRE ANDRADE;
2024;1;FORTALEZA;22007;VILACIO ;94;926;;1;EMEIRF JOSÉ CARLOS DA COSTA RIBEIRO;RUA PIO SARAIVA, 335;QUINTINO CUNHA;
2024;1;FORTALEZA;22007;VILACIO ;95;87;;1;EEFM PADRE MARCELINO CHAMPAGNAT;RUA DAURA, 120;BARROSO;
2024;1;FORTALEZA;22007;VILACIO ;95;94;;1;EEFM PADRE MARCELINO CHAMPAGNAT;RUA DAURA, 120;BARROSO;
2024;1;FORTALEZA;22007;VILACIO ;95;126;;1;EMEIEF LIONS CLUBE FORTALEZA FÁTIMA;TRAVESSA LIONS CLUBE, 141;JANGURUSSU;
2024;1;FORTALEZA;22007;VILACIO ;95;164;;1;EM PROFESSORA MARIA DO SOCORRO FERREIRA VIRINO;RUA MODESTA, 44;CONJUNTO PALMEIRAS;
2024;1;FORTALEZA;22007;VILACIO ;95;191;;1;EMEIF JORNALISTA JOSÉ BLANCHARD GIRÃO DA SILVA;TRAVESSA MISSIONÁRIO OLIVEIRA,301;JANGURUSSU;
2024;1;FORTALEZA;22007;VILACIO ;95;210;;1;EEFM ALMIRANTE TAMANDARÉ;RUA DO MANDACARU, 1048 CJ ALMIRANTE TAMANDARÉ;JANGURUSSU;
2024;1;FORTALEZA;22007;VILACIO ;95;215;;1;EMEIEF BARBARA DE ALENCAR;RUA CAPITAO PORFIRIO, 544;PARQUE SANTA MARIA;
2024;1;FORTALEZA;22007;VILACIO ;95;218;;1;EMEIEF BARBARA DE ALENCAR;RUA CAPITAO PORFIRIO, 544;PARQUE SANTA MARIA;
2024;1;FORTALEZA;22007;VILACIO ;95;238;;1;EMEIEF TAÍS MARIA BEZERRA NOGUEIRA;AV. GOVERNADOR LEONEL BRIZOLA, 710;JANGURUSSU;
2024;1;FORTALEZA;22007;VILACIO ;95;261;;1;EEFM PROFESSOR  ALOYSIO BARROS LEAL;RUA 10,  LOT. PRQ.VERDE 28 (CJ JOAO PAULO II);BARROSO;
2024;1;FORTALEZA;22007;VILACIO ;95;288;;1;EMEIEF MARTHA DOS MARTINS COELHO GUILHERME;RUA 313, 243, CONJUNTO SÃO CRISTÓVÃO;JANGURUSSU;
2024;1;FORTALEZA;22007;VILACIO ;95;294;;1;EMEIEF MARTHA DOS MARTINS COELHO GUILHERME;RUA 313, 243, CONJUNTO SÃO CRISTÓVÃO;JANGURUSSU;
2024;1;FORTALEZA;22007;VILACIO ;95;310;;1;EMEIF MARIA DE JESUS ORIÁ ALENCAR;RUA VERDE QUARENTA E TRÊS, S/N, CONJUNTO SÍTIO SÃO JOÃO;JANGURUSSU;
2024;1;FORTALEZA;22007;VILACIO ;95;337;;2;EMEIEF CÉSAR CALS DE OLIVEIRA NETO;RUA OLIMPIO RIBEIRO, 20;CONJUNTO PALMEIRAS;
2024;1;FORTALEZA;22007;VILACIO ;95;339;;1;EMEIF JORNALISTA JOSÉ BLANCHARD GIRÃO DA SILVA;TRAVESSA MISSIONÁRIO OLIVEIRA,301;JANGURUSSU;
2024;1;FORTALEZA;22007;VILACIO ;112;96;;1;EM ISMAEL PORDEUS;RUA DES FAUSTINO ALBUQUERQUE, 511;JARDIM DAS OLIVEIRAS;
2024;1;FORTALEZA;22007;VILACIO ;112;99;;1;EM ISMAEL PORDEUS;RUA DES FAUSTINO ALBUQUERQUE, 511;JARDIM DAS OLIVEIRAS;
2024;1;FORTALEZA;22007;VILACIO ;112;394;;1;EEFM DOM ANTONIO DE ALMEIDA LUSTOSA;RUA ADOLFO MOREIRA DE CARVALHO, S/N;EDSON QUEIROZ;
2024;1;FORTALEZA;22007;VILACIO ;112;415;;1;COLEGIO ARI DE SA CAVALCANTE WS;AV WASHINGTON SOARES, 3737;EDSON QUEIROZ;
2024;1;FORTALEZA;22007;VILACIO ;113;201;;1;COLÉGIO CHRISTUS PRÉ - UNIVERSITÁRIO;RUA CRUZ SALDANHA, 614;PARQUELÂNDIA;
2024;1;FORTALEZA;22007;VILACIO ;113;213;;1;COLÉGIO DEOCLÉCIO FERRO;RUA MINERVINO DE CASTRO, 987;RODOLFO TEÓFILO;
2024;1;FORTALEZA;22007;VILACIO ;113;218;;1;COLÉGIO MANUELITO AZEVEDO;RUA TIRADENTES, 483;RODOLFO TEÓFILO;
2024;1;FORTALEZA;22007;VILACIO ;113;234;;1;EEFM ANTONIO SALES - PARQUELÂNDIA;RUA PROF. ANACLETO, 630;PARQUELÂNDIA;
2024;1;FORTALEZA;22007;VILACIO ;113;245;;1;EEFM FÉLIX DE AZEVEDO;RUA MONSENHOR FURTADO, 757;RODOLFO TEÓFILO;
2024;1;FORTALEZA;22007;VILACIO ;113;280;;1;COLÉGIO CHRISTUS PRÉ - UNIVERSITÁRIO;RUA CRUZ SALDANHA, 614;PARQUELÂNDIA;
2024;1;FORTALEZA;22007;VILACIO ;113;293;;1;COLÉGIO DEOCLÉCIO FERRO;RUA MINERVINO DE CASTRO, 987;RODOLFO TEÓFILO;
2024;1;FORTALEZA;22007;VILACIO ;113;313;;1;ESC. PROFISSIONAL PE. JOÃO PIAMARTA;RUA PADRE JOÃO PIAMARTA, 161;BOM FUTURO;
2024;1;FORTALEZA;22007;VILACIO ;113;320;;1;EEFM DR.CÉSAR CALS;AV. DOMINGOS OLIMPIO, 1800;FARIAS BRITO;
2024;1;FORTALEZA;22007;VILACIO ;113;340;;2;ESCOLA ESTADUAL DE EDUCAÇÃO PROFISSIONAL JOAQUIM NOGUEIRA;RUA MOREIRA DE SOUSA, 327;PARQUELÂNDIA;
2024;1;FORTALEZA;22007;VILACIO ;113;342;;1;ESCOLA ESTADUAL DE EDUCAÇÃO PROFISSIONAL JOAQUIM NOGUEIRA;RUA MOREIRA DE SOUSA, 327;PARQUELÂNDIA;
2024;1;FORTALEZA;22007;VILACIO ;113;343;;1;ESCOLA ESTADUAL DE EDUCAÇÃO PROFISSIONAL JOAQUIM NOGUEIRA;RUA MOREIRA DE SOUSA, 327;PARQUELÂNDIA;
2024;1;FORTALEZA;22007;VILACIO ;113;444;;1;ESC. MUNICIPAL ANTONIO SALES RODOLFO TEÓFILO;RUA TAVARES IRACEMA, 675;RODOLFO TEÓFILO;
2024;1;FORTALEZA;22007;VILACIO ;114;43;;1;EM CASIMIRO JOSÉ LIMA FILHO;AVENIDA FRANCISCO SÁ 6449;BARRA DO CEARÁ;
2024;1;FORTALEZA;22007;VILACIO ;114;87;;1;CUCA BARRA DO CEARÁ;AV. PRES. CASTELO BRANCO, 6417;BARRA DO CEARÁ;
2024;1;FORTALEZA;22007;VILACIO ;114;112;;1;EM SÃO JOSÉ;AVENIDA DOUTOR THEBERGE 2288;PRESIDENTE KENNEDY;
2024;1;FORTALEZA;22007;VILACIO ;114;354;;1;INSTITUTO EDUCACIONAL HUMANISTA;RUA CAUBI, 478;BARRA DO CEARÁ;
2024;1;FORTALEZA;22007;VILACIO ;115;443;;1;EM MARIA VIVIANE BENEVIDES GOUVEIA;RUA CREUZA ROQUE 247;MANOEL SÁTIRO;
2024;1;FORTALEZA;22007;VILACIO ;115;475;;1;EEFM PROF. HERMENEGILDO FIRMEZA;RUA GABRIEL FIUZA 360;VILA PERI;
2024;1;FORTALEZA;22007;VILACIO ;116;32;;1;EM SERVULO MENDES BARROSO;RUA JOSE MARTINS 2239;GRANJA LISBOA;
2024;1;FORTALEZA;22007;VILACIO ;116;289;;1;EM RACHEL VIANA MARTINS;RUA TUCUNDUBA 2703;GRANJA LISBOA;
2024;1;FORTALEZA;22007;VILACIO ;117;160;;1;EEF JOSE AYRTON TEIXEIRA;RUA ALFREDO MAMEDE SN;MANOEL SÁTIRO;
2024;1;FORTALEZA;22007;VILACIO ;117;253;;1;EEEP DARCY RIBEIRO;RUA CONEGO DE CASTRO, S/N;CONJUNTO ESPERANÇA;
2024;1;FORTALEZA;22007;VILACIO ;117;339;;1;EMEIF PROF. EDILSON BRASIL SOAREZ;RUA LOCAL 11 - CJ. TATUMUNDE;BOM JARDIM;
2024;1;FORTALEZA;22007;VILACIO ;117;447;;1;COLÉGIO VIDA VIVA;RUA JOSÉ MARIA, 100;SIQUEIRA;
2024;1;FORTALEZA;22007;VILACIO ;118;56;;1;COLEGIO CONEXÃO SABER;RUA DOUTOR PEDRO SAMPAIO, 550;PASSARÉ;
2024;1;FORTALEZA;22007;VILACIO ;118;576;;1;EEFM ANTÔNIO DIAS MACEDO;AV PEDRO DANTAS 340;DIAS MACEDO;
TOTAL;;;;;;;;110;
