Ano;Turno;Município;Número;Candidato;Zona;Seção;Seções Agregadas;Votos;Local de Votação;Endereço Local de Votação;Bairro;
2024;1;FORTALEZA;30444;VÂNIA GUSMÃO;1;461;;1;ESCOLA ESTADUAL  BARBARA DE ALENCAR;RUA PEDRO RUFINO 38;VARJOTA;
2024;1;FORTALEZA;30444;VÂNIA GUSMÃO;1;889;;1;UNINTA - FACULDADE UNINTA FORTALEZA;RUA VILEBALDO AGUIAR,133;COCÓ;
2024;1;FORTALEZA;30444;VÂNIA GUSMÃO;2;127;;1;EM PROFª TELINA BARBOSA DA  COSTA;RUA PERGENTINO MAIA, 811;MESSEJANA;
2024;1;FORTALEZA;30444;VÂNIA GUSMÃO;3;382;;1;UNICHRISTUS ALDEOTA;RUA VISCONDE DE MAUÁ, 1940;ALDEOTA;
2024;1;FORTALEZA;30444;VÂNIA GUSMÃO;3;392;;1;CÍRCULO MILITAR DE FORTALEZA;RUA CANUTO DE AGUIAR, 425;MEIRELES;
2024;1;FORTALEZA;30444;VÂNIA GUSMÃO;3;418;;1;UNICHRISTUS ALDEOTA;RUA VISCONDE DE MAUÁ, 1940;ALDEOTA;
2024;1;FORTALEZA;30444;VÂNIA GUSMÃO;3;439;;1;COLÉGIO CHRISTUS (AV. BARÃO DE STUDART);RUA JOÃO CARVALHO, 630;ALDEOTA;
2024;1;FORTALEZA;30444;VÂNIA GUSMÃO;3;503;;1;IDEAL CLUBE;AV. MONSENHOR TABOSA,  1381;MEIRELES;
2024;1;FORTALEZA;30444;VÂNIA GUSMÃO;80;169;;1;COLÉGIO MONSENHOR JOVINIANO BARRETO;RUA FREI VIDAL 1621;TAUAPE;
2024;1;FORTALEZA;30444;VÂNIA GUSMÃO;80;182;;1;COLÉGIO NOSSA SENHORA DAS GRAÇAS;RUA MONSENHOR OTÁVIO DE CASTRO, 535;FÁTIMA;
2024;1;FORTALEZA;30444;VÂNIA GUSMÃO;80;192;;1;COLÉGIO NOSSA SENHORA DAS GRAÇAS;RUA MONSENHOR OTÁVIO DE CASTRO, 535;FÁTIMA;
2024;1;FORTALEZA;30444;VÂNIA GUSMÃO;80;194;;1;COLÉGIO SANTO TOMÁZ DE AQUINO;RUA MÁRIO MAMEDE, 750;FÁTIMA;
2024;1;FORTALEZA;30444;VÂNIA GUSMÃO;80;274;;1;ESCOLA MUNICIPAL HAROLDO JORGE BRAUN VIEIRA;AV LAURO VIEIRA CHAVES, 2001;VILA UNIÃO;
2024;1;FORTALEZA;30444;VÂNIA GUSMÃO;80;326;;2;ASSEMBLÉIA LEGISLATIVA - UNIVERSIDADE DO PARLAMENTO CEARENSE;RUA BARBOSA DE FREITAS, 2674;DIONISIO TORRES;
2024;1;FORTALEZA;30444;VÂNIA GUSMÃO;80;393;;1;EEM GOV. ADAUTO BEZERRA;RUA MONSENHOR LIBERATO, 1850;FÁTIMA;
2024;1;FORTALEZA;30444;VÂNIA GUSMÃO;80;396;;1;EEM GOV. ADAUTO BEZERRA;RUA MONSENHOR LIBERATO, 1850;FÁTIMA;
2024;1;FORTALEZA;30444;VÂNIA GUSMÃO;80;420;;1;COLÉGIO SANTO TOMÁZ DE AQUINO;RUA MÁRIO MAMEDE, 750;FÁTIMA;
2024;1;FORTALEZA;30444;VÂNIA GUSMÃO;83;63;;1;EEMTI SENADOR FERNANDES TÁVORA;RUA GOIÁS 141;BELA VISTA;
2024;1;FORTALEZA;30444;VÂNIA GUSMÃO;83;233;;1;ESCOLA MUNICIPAL JOSÉ BATISTA DE OLIVEIRA;RUA GOIÁS 620;PANAMERICANO;
2024;1;FORTALEZA;30444;VÂNIA GUSMÃO;83;234;;1;ESCOLA MUNICIPAL JOSÉ BATISTA DE OLIVEIRA;RUA GOIÁS 620;PANAMERICANO;
2024;1;FORTALEZA;30444;VÂNIA GUSMÃO;83;477;;1;EEFM ANISIO TEIXEIRA;RUA RIO GRANDE DO SUL 680;PANAMERICANO;
2024;1;FORTALEZA;30444;VÂNIA GUSMÃO;83;727;;1;EEMTI SENADOR FERNANDES TÁVORA;RUA GOIÁS 141;BELA VISTA;
2024;1;FORTALEZA;30444;VÂNIA GUSMÃO;85;281;;1;EEFM PROF PLACIDO ADERALDO CASTELO - UV 7B;RUA SETECENTOS E VINTE E UM, 100, 3A ETAPA;CONJUNTO CEARÁ I;
2024;1;FORTALEZA;30444;VÂNIA GUSMÃO;94;772;;1;EMEIF FRANCISCO EDILSON PINHEIRO;RUA N, 35;VILA VELHA;
2024;1;FORTALEZA;30444;VÂNIA GUSMÃO;94;817;;1;EMEIF FRANCISCO EDILSON PINHEIRO;RUA N, 35;VILA VELHA;
2024;1;FORTALEZA;30444;VÂNIA GUSMÃO;112;161;;1;EM JOHNSON;RUA DRA. SOCORRO AZEVEDO, 461;ENGENHEIRO LUCIANO CAVALCANTE;
2024;1;FORTALEZA;30444;VÂNIA GUSMÃO;113;133;;1;EMEIF DOM MANUEL DA SILVA GOMES;RUA SAMUEL UCHÔA, 550;BOM FUTURO;
2024;1;FORTALEZA;30444;VÂNIA GUSMÃO;113;153;;2;COLÉGIO MEDALHA MILAGROSA;RUA PADRE JOÃO PIAMARTA,  415;BOM FUTURO;
2024;1;FORTALEZA;30444;VÂNIA GUSMÃO;113;170;;1;ESCOLA PROF. PE. JOÃO PIAMARTA (ANEXO JÚNIOR);RUA PE. JOÃO PIAMARTA, 161;BOM FUTURO;
2024;1;FORTALEZA;30444;VÂNIA GUSMÃO;113;195;;1;FACULDADE DE PSICOLOGIA DA UFC;AV. DA UNIVERSIDADE, 2762;BENFICA;
2024;1;FORTALEZA;30444;VÂNIA GUSMÃO;113;308;;1;COLÉGIO GUSTAVO BRAGA;AV. JOÃO PESSOA, 4650/80;DAMAS;
2024;1;FORTALEZA;30444;VÂNIA GUSMÃO;113;313;;1;ESC. PROFISSIONAL PE. JOÃO PIAMARTA;RUA PADRE JOÃO PIAMARTA, 161;BOM FUTURO;
2024;1;FORTALEZA;30444;VÂNIA GUSMÃO;113;323;;2;COLÉGIO MEDALHA MILAGROSA;RUA PADRE JOÃO PIAMARTA,  415;BOM FUTURO;
2024;1;FORTALEZA;30444;VÂNIA GUSMÃO;113;351;;1;COLÉGIO AGNUS;RUA TEODORICO BARROSO, 827;MONTESE;
2024;1;FORTALEZA;30444;VÂNIA GUSMÃO;113;352;;1;COLÉGIO AGNUS;RUA TEODORICO BARROSO, 827;MONTESE;
2024;1;FORTALEZA;30444;VÂNIA GUSMÃO;113;354;;1;COLÉGIO AGNUS;RUA TEODORICO BARROSO, 827;MONTESE;
2024;1;FORTALEZA;30444;VÂNIA GUSMÃO;113;366;;1;COLÉGIO ESTADUAL PRESIDENTE HUMBERTO CASTELO BRANCO;RUA IRMA BAZET, 210;MONTESE;
2024;1;FORTALEZA;30444;VÂNIA GUSMÃO;113;378;;1;COLÉGIO NOSSA SENHORA APARECIDA;RUA AQUILES BORIS, 342;MONTESE;
2024;1;FORTALEZA;30444;VÂNIA GUSMÃO;113;386;;2;ASSOCIAÇÃO DE PAIS E AMIGOS DO DEFICIENTE AUDITIVO - APADA;AV. BEZERRA DE MENEZES, 549;SÃO GERARDO;
2024;1;FORTALEZA;30444;VÂNIA GUSMÃO;113;389;;1;IMPARH;AV JOAO PESSOA, 5.609;MONTESE;
2024;1;FORTALEZA;30444;VÂNIA GUSMÃO;113;391;;1;IMPARH;AV JOAO PESSOA, 5.609;MONTESE;
2024;1;FORTALEZA;30444;VÂNIA GUSMÃO;113;420;;1;EEFM MARECHAL HUMBERTO DE ALENCAR C. BRANCO;RUA ALVARO FERNANDES, 913;MONTESE;
2024;1;FORTALEZA;30444;VÂNIA GUSMÃO;113;437;;1;ESC. PROFISSIONAL PE. JOÃO PIAMARTA;RUA PADRE JOÃO PIAMARTA, 161;BOM FUTURO;
2024;1;FORTALEZA;30444;VÂNIA GUSMÃO;113;441;;1;ESC. PROFISSIONAL PE. JOÃO PIAMARTA;RUA PADRE JOÃO PIAMARTA, 161;BOM FUTURO;
2024;1;FORTALEZA;30444;VÂNIA GUSMÃO;115;36;;1;EM THOMAZ POMPEU SOBRINHO;RUA JOSE MENELEU, 531;PARANGABA;
2024;1;FORTALEZA;30444;VÂNIA GUSMÃO;115;44;;1;UNIVERSIDADE ESTADUAL DO CEARA - UECE;AV DR. SILAS MUNGUBA, 1700;ITAPERI;
2024;1;FORTALEZA;30444;VÂNIA GUSMÃO;115;212;;1;PROJETO ABC DA SERRINHA;RUA CONEGO LIMA SUCUPIRA, 1.487;SERRINHA;
2024;1;FORTALEZA;30444;VÂNIA GUSMÃO;115;224;;1;EM WALDEMAR BARROSO;RUA CÔNEGO LIMA SUCUPIRA,  1651;SERRINHA;
2024;1;FORTALEZA;30444;VÂNIA GUSMÃO;115;391;;1;COLEGIO JIM WILLSON;AV. AUGUSTO DOS ANJOS, 1915;VILA PERI;
2024;1;FORTALEZA;30444;VÂNIA GUSMÃO;115;463;;1;EM HENRIQUETA GALENO;RUA MAJOR MONTENEGRO 917;MANOEL SÁTIRO;
2024;1;FORTALEZA;30444;VÂNIA GUSMÃO;117;159;;1;EEF JOSE AYRTON TEIXEIRA;RUA ALFREDO MAMEDE SN;MANOEL SÁTIRO;
2024;1;FORTALEZA;30444;VÂNIA GUSMÃO;118;321;;1;ESCOLA EVANGELICA MONTE SINAI;RUA BRUNO VALENTE, 847;SERRINHA;
2024;1;FORTALEZA;30444;VÂNIA GUSMÃO;118;423;;1;EM MARIA DE CARVALHO MARTINS;AVENIDA DOUTOR SILAS MUNGUBA, 4300;SERRINHA;
TOTAL;;;;;;;;57;
