Ano;Turno;Município;Número;Candidato;Zona;Seção;Seções Agregadas;Votos;Local de Votação;Endereço Local de Votação;Bairro;
2024;1;FORTALEZA;22112;WERUSKA AGUIAR;1;364;;1;LABOMAR - UFC;AV. ABOLIÇÃO, 3207;MEIRELES;
2024;1;FORTALEZA;22112;WERUSKA AGUIAR;1;840;;1;FANOR - FACULDADE NORDESTE;AVENIDA SANTOS DUMONT 7800;DE LOURDES;
2024;1;FORTALEZA;22112;WERUSKA AGUIAR;1;859;;1;COLEGIO ANTARES - OCELO PINHEIRO;RUA PROFESSOR OCELO PINHEIRO 101;PAPICU;
2024;1;FORTALEZA;22112;WERUSKA AGUIAR;1;887;;1;COLEGIO ARI DE SA - MONSENHOR CATAO;RUA MONSENHOR CATAO, 1655;ALDEOTA;
2024;1;FORTALEZA;22112;WERUSKA AGUIAR;1;924;;1;UNINTA - FACULDADE UNINTA FORTALEZA;RUA VILEBALDO AGUIAR,133;COCÓ;
2024;1;FORTALEZA;22112;WERUSKA AGUIAR;2;99;;1;EM PROFª TELINA BARBOSA DA  COSTA;RUA PERGENTINO MAIA, 811;MESSEJANA;
2024;1;FORTALEZA;22112;WERUSKA AGUIAR;2;142;;1;EM JOSEFA BARROS DE ALENCAR;RUA DOUTOR JOAQUIM BENTO 590;MESSEJANA;
2024;1;FORTALEZA;22112;WERUSKA AGUIAR;2;654;;1;CMES ANISIO TEIXEIRA;TRAVESSA DO GUARANI, 355;PAUPINA;
2024;1;FORTALEZA;22112;WERUSKA AGUIAR;2;676;;1;CMES ANISIO TEIXEIRA;TRAVESSA DO GUARANI, 355;PAUPINA;
2024;1;FORTALEZA;22112;WERUSKA AGUIAR;2;681;;1;EM PROF CLODOMIR TEOFILO GIRAO;TRAVESSA RUTILO, 108;MESSEJANA;
2024;1;FORTALEZA;22112;WERUSKA AGUIAR;2;761;;1;EM PROFª TELINA BARBOSA DA  COSTA;RUA PERGENTINO MAIA, 811;MESSEJANA;
2024;1;FORTALEZA;22112;WERUSKA AGUIAR;2;764;;1;EMEIF DEMOCRITO ROCHA;RUA PADRE PEDRO DE ALENCAR, 2012;MESSEJANA;
2024;1;FORTALEZA;22112;WERUSKA AGUIAR;2;773;;1;CMES ANISIO TEIXEIRA;TRAVESSA DO GUARANI, 355;PAUPINA;
2024;1;FORTALEZA;22112;WERUSKA AGUIAR;2;784;;1;COLÉGIO CHRISTUS SUL;AV. ENG. LEAL LIMA VERDE, 2265;JOSÉ DE ALENCAR;
2024;1;FORTALEZA;22112;WERUSKA AGUIAR;2;798;;1;CLUBE DA CAIXA;AVENIDA FREI CIRILO 4700;MESSEJANA;
2024;1;FORTALEZA;22112;WERUSKA AGUIAR;3;11;;1;COLÉGIO TIRADENTES VESTIBULARES;RUA PEDRO I, 1106;CENTRO;
2024;1;FORTALEZA;22112;WERUSKA AGUIAR;3;17;19;1;COLÉGIO 7 DE SETEMBRO (SEDE NGS);AV. DO IMPERADOR, 1330;CENTRO;
2024;1;FORTALEZA;22112;WERUSKA AGUIAR;3;24;185;1;COLÉGIO 7 DE SETEMBRO (SEDE NGS);AV. DO IMPERADOR, 1330;CENTRO;
2024;1;FORTALEZA;22112;WERUSKA AGUIAR;3;58;189;1;COLÉGIO 7 DE SETEMBRO (SEDE NGS);AV. DO IMPERADOR, 1330;CENTRO;
2024;1;FORTALEZA;22112;WERUSKA AGUIAR;3;110;;1;COLÉGIO ESTADUAL LICEU DO CEARÁ;PRAÇA GUSTAVO BARROSO, 01;JACARECANGA;
2024;1;FORTALEZA;22112;WERUSKA AGUIAR;3;180;;1;IEP - INST. DE EDUCAÇÃO PORTAL - UNIDADE FORTALEZA;AV. PADRE IBIAPINA, 1243;CENTRO;
2024;1;FORTALEZA;22112;WERUSKA AGUIAR;3;205;;1;COLÉGIO MILITAR DO CORPO DE BOMBEIROS;RUA ADRIANO MARTINS, 436;JACARECANGA;
2024;1;FORTALEZA;22112;WERUSKA AGUIAR;3;214;215;1;COLÉGIO ARI DE SÁ - PRÉ-VESTIBULAR - SEDE DUQUE DE CAXIAS;AV. DUQUE DE CAXIAS, 519;CENTRO;
2024;1;FORTALEZA;22112;WERUSKA AGUIAR;3;223;;1;FACULDADE ARI DE SÁ;AV. HERÁCLITO GRAÇA, 826;CENTRO;
2024;1;FORTALEZA;22112;WERUSKA AGUIAR;3;268;269;2;COLÉGIO ARI DE SÁ - PRÉ-VESTIBULAR - SEDE DUQUE DE CAXIAS;AV. DUQUE DE CAXIAS, 519;CENTRO;
2024;1;FORTALEZA;22112;WERUSKA AGUIAR;3;287;;1;SECRETARIA DA SAÚDE DO ESTADO DO CEARÁ;RUA ITAPIPOCA, 60;PRAIA DE IRACEMA;
2024;1;FORTALEZA;22112;WERUSKA AGUIAR;3;381;;1;UNICHRISTUS ALDEOTA;RUA VISCONDE DE MAUÁ, 1940;ALDEOTA;
2024;1;FORTALEZA;22112;WERUSKA AGUIAR;3;407;;1;EEMTI RENATO BRAGA;AV. RUI BARBOSA, 2000;ALDEOTA;
2024;1;FORTALEZA;22112;WERUSKA AGUIAR;3;416;;1;UNICHRISTUS ALDEOTA;RUA VISCONDE DE MAUÁ, 1940;ALDEOTA;
2024;1;FORTALEZA;22112;WERUSKA AGUIAR;3;432;;1;FACULDADE ARI DE SÁ;AV. HERÁCLITO GRAÇA, 826;CENTRO;
2024;1;FORTALEZA;22112;WERUSKA AGUIAR;3;481;;1;COLÉGIO ANTARES (PRAIA DE IRACEMA);RUA HISTORIADOR GUARINO ALVES, 95;PRAIA DE IRACEMA;
2024;1;FORTALEZA;22112;WERUSKA AGUIAR;3;485;;1;COLÉGIO ANTARES (PRAIA DE IRACEMA);RUA HISTORIADOR GUARINO ALVES, 95;PRAIA DE IRACEMA;
2024;1;FORTALEZA;22112;WERUSKA AGUIAR;3;511;517;2;CENTRO DE PASTORAL MARIA, MÃE DA IGREJA;RUA RODRIGUES JÚNIOR, 300;CENTRO;
2024;1;FORTALEZA;22112;WERUSKA AGUIAR;3;513;514;1;CENTRO DE PASTORAL MARIA, MÃE DA IGREJA;RUA RODRIGUES JÚNIOR, 300;CENTRO;
2024;1;FORTALEZA;22112;WERUSKA AGUIAR;3;575;;1;EM JOSÉ DIAS MACEDO;RUA NUNES VALENTE, 809;MEIRELES;
2024;1;FORTALEZA;22112;WERUSKA AGUIAR;3;611;;1;COLÉGIO ESPAÇO ABERTO - DOM LUÍS;AV. DOM LUÍS, 730;ALDEOTA;
2024;1;FORTALEZA;22112;WERUSKA AGUIAR;3;643;;1;EM JOSÉ DIAS MACEDO;RUA NUNES VALENTE, 809;MEIRELES;
2024;1;FORTALEZA;22112;WERUSKA AGUIAR;80;120;;1;EEFM ESTADO DO PARÁ;RUA DJALMA PETIT 589;ALTO DA BALANÇA;
2024;1;FORTALEZA;22112;WERUSKA AGUIAR;80;126;;1;EEFM ESTADO DO PARÁ;RUA DJALMA PETIT 589;ALTO DA BALANÇA;
2024;1;FORTALEZA;22112;WERUSKA AGUIAR;80;127;;1;EEFM ESTADO DO PARÁ;RUA DJALMA PETIT 589;ALTO DA BALANÇA;
2024;1;FORTALEZA;22112;WERUSKA AGUIAR;80;322;;1;COLÉGIO SANTO INACIO;AVENIDA DESEMBARGADOR MOREIRA 2355;DIONISIO TORRES;
2024;1;FORTALEZA;22112;WERUSKA AGUIAR;82;28;;1;SECRETARIA DE DESENVOLVIMENTO AGRÁRIO DO ESTADO DO CEARÁ;AV. BEZERRA DE MENEZES, 1620;SÃO GERARDO;
2024;1;FORTALEZA;22112;WERUSKA AGUIAR;82;32;;1;SECRETARIA DE DESENVOLVIMENTO AGRÁRIO DO ESTADO DO CEARÁ;AV. BEZERRA DE MENEZES, 1620;SÃO GERARDO;
2024;1;FORTALEZA;22112;WERUSKA AGUIAR;82;234;;1;EEFM GOVERNADOR FLÁVIO MARCÍLIO;AV. PASTEUR, 575;PIRAMBU;
2024;1;FORTALEZA;22112;WERUSKA AGUIAR;82;579;;1;ESCOLA MUNICIPAL LENIRA JUREMA DE MAGALHÃES - EI/EF;RUA TEÓFILO GURGEL, 111;MONTE CASTELO;
2024;1;FORTALEZA;22112;WERUSKA AGUIAR;82;664;;1;FEDERAÇÃO DO MOVIMENTO COMUNITÁRIO DO PIRAMBU - FEMOCOPI;AV. PRES. CASTELO BRANCO, 2709;CARLITO PAMPLONA;
2024;1;FORTALEZA;22112;WERUSKA AGUIAR;82;673;;1;ESCOLA MUNICIPAL ANTONIO MENDES - EI/EF;RUA DONA MENDINA, 682;CRISTO REDENTOR;
2024;1;FORTALEZA;22112;WERUSKA AGUIAR;83;26;;1;ESCOLA MUNICIPAL NILSON HOLANDA;RUA VIRIATO RIBEIRO 1355;BELA VISTA;
2024;1;FORTALEZA;22112;WERUSKA AGUIAR;83;30;;1;ESCOLA MUNICIPAL DE TEMPO INTEGRAL PROFESSOR JOSE JULIO DA PONTE;RUA MARIO DE ANDRADE, S/N;BELA VISTA;
2024;1;FORTALEZA;22112;WERUSKA AGUIAR;83;248;;1;EEFM ANISIO TEIXEIRA;RUA RIO GRANDE DO SUL 680;PANAMERICANO;
2024;1;FORTALEZA;22112;WERUSKA AGUIAR;83;251;;1;EEFM ANISIO TEIXEIRA;RUA RIO GRANDE DO SUL 680;PANAMERICANO;
2024;1;FORTALEZA;22112;WERUSKA AGUIAR;83;438;;2;ESCOLA MUNICIPAL DE TEMPO INTEGRAL PROFESSOR JOSE JULIO DA PONTE;RUA MARIO DE ANDRADE, S/N;BELA VISTA;
2024;1;FORTALEZA;22112;WERUSKA AGUIAR;83;583;;1;ESCOLA MUNICIPAL JOSÉ BATISTA DE OLIVEIRA;RUA GOIÁS 620;PANAMERICANO;
2024;1;FORTALEZA;22112;WERUSKA AGUIAR;83;601;;1;EEMTI ANTONIETA SIQUEIRA;RUA GUARANI 04;HENRIQUE JORGE;
2024;1;FORTALEZA;22112;WERUSKA AGUIAR;83;633;;1;COLEGIO CHRISTUS;AV. ENG. HUMBERTO MONTE, 1355;BELA VISTA;
2024;1;FORTALEZA;22112;WERUSKA AGUIAR;83;654;;1;EEMTI PROFESSOR PAULO FREIRE;AVENIDA SENADOR FERNANDES TÁVORA 1936;HENRIQUE JORGE;
2024;1;FORTALEZA;22112;WERUSKA AGUIAR;85;199;;1;ESCOLA JOÃO PAULO II;AV C N. 1381 2 ETAPA;CONJUNTO CEARÁ I;
2024;1;FORTALEZA;22112;WERUSKA AGUIAR;85;286;;1;EMEIF GERARDO MILTON DE SA;RUA VALE COSTA S/N;ANTÔNIO BEZERRA;
2024;1;FORTALEZA;22112;WERUSKA AGUIAR;93;83;;1;EM RACHEL DE QUEIROZ;AVENIDA C, S/N - II ETAPA;PREFEITO JOSÉ WALTER;
2024;1;FORTALEZA;22112;WERUSKA AGUIAR;93;85;;1;EM RACHEL DE QUEIROZ;AVENIDA C, S/N - II ETAPA;PREFEITO JOSÉ WALTER;
2024;1;FORTALEZA;22112;WERUSKA AGUIAR;93;271;;1;LICEU ESTADUAL DOMINGOS BRASILEIRO;RUA PLANALTINA, S/N;PLANALTO AYRTON SENNA;
2024;1;FORTALEZA;22112;WERUSKA AGUIAR;93;301;;1;EM ADALBERTO STUDART FILHO;RUA DO CAMPO, 25;PLANALTO AYRTON SENNA;
2024;1;FORTALEZA;22112;WERUSKA AGUIAR;94;194;;1;EEFM DONA HILZA DIOGO DE OLIVEIRA;AV. DOM ALOÍSIO LORSCHEIDER, 1040 - VILA VELHA;VILA VELHA;
2024;1;FORTALEZA;22112;WERUSKA AGUIAR;94;200;;1;EEFM DONA HILZA DIOGO DE OLIVEIRA;AV. DOM ALOÍSIO LORSCHEIDER, 1040 - VILA VELHA;VILA VELHA;
2024;1;FORTALEZA;22112;WERUSKA AGUIAR;94;330;;1;EM ANTONIO CORREIA LIMA;RUA HERMES PARAYBA, 934;VILA VELHA;
2024;1;FORTALEZA;22112;WERUSKA AGUIAR;94;873;;1;EEFM HERMINIO BARROSO;RUA PADRE GUILHERME 800;PADRE ANDRADE;
2024;1;FORTALEZA;22112;WERUSKA AGUIAR;95;118;;1;EMEIEF MARIA HELENICE CAVALCANTE LEITE MARTINS;RUA MAIZA, S/N;CONJUNTO PALMEIRAS;
2024;1;FORTALEZA;22112;WERUSKA AGUIAR;95;312;;1;CEI CESAR CALS DE OLIVEIRA NETO;RUA CAMPINENSE, 54;CONJUNTO PALMEIRAS;
2024;1;FORTALEZA;22112;WERUSKA AGUIAR;112;95;;1;EM ISMAEL PORDEUS;RUA DES FAUSTINO ALBUQUERQUE, 511;JARDIM DAS OLIVEIRAS;
2024;1;FORTALEZA;22112;WERUSKA AGUIAR;112;188;;1;COLÉGIO DÁULIA BRINGEL;RUA TRAJANO ALVES DE AGUIAR, 55;CIDADE DOS FUNCIONÁRIOS;
2024;1;FORTALEZA;22112;WERUSKA AGUIAR;112;284;;2;COLÉGIO ÁGAPE;AV HERMINIO DE CASTRO, 140;PARQUE MANIBURA;
2024;1;FORTALEZA;22112;WERUSKA AGUIAR;112;301;;1;EM JOHNSON;RUA DRA. SOCORRO AZEVEDO, 461;ENGENHEIRO LUCIANO CAVALCANTE;
2024;1;FORTALEZA;22112;WERUSKA AGUIAR;112;319;;1;IGREJA DA GLÓRIA;AV OLIVEIRA PAIVA, 905;CIDADE DOS FUNCIONÁRIOS;
2024;1;FORTALEZA;22112;WERUSKA AGUIAR;112;332;;1;IGREJA DA GLÓRIA;AV OLIVEIRA PAIVA, 905;CIDADE DOS FUNCIONÁRIOS;
2024;1;FORTALEZA;22112;WERUSKA AGUIAR;112;358;;1;COLEGIO GLOBOMAX;RUA GENERAL CAIADO DE CASTRO, 156;ENGENHEIRO LUCIANO CAVALCANTE;
2024;1;FORTALEZA;22112;WERUSKA AGUIAR;112;360;;1;COLÉGIO ÁGAPE;AV HERMINIO DE CASTRO, 140;PARQUE MANIBURA;
2024;1;FORTALEZA;22112;WERUSKA AGUIAR;112;517;;1;EM PROF. LUIS COSTA;RUA JAIME LEONEL, 156;ENGENHEIRO LUCIANO CAVALCANTE;
2024;1;FORTALEZA;22112;WERUSKA AGUIAR;112;532;582;1;COLÉGIO NOVA DIMENSÃO;AV. EDILSON BRASIL SOARES, 1599;EDSON QUEIROZ;
2024;1;FORTALEZA;22112;WERUSKA AGUIAR;112;565;;1;COLÉGIO DÁULIA BRINGEL;RUA TRAJANO ALVES DE AGUIAR, 55;CIDADE DOS FUNCIONÁRIOS;
2024;1;FORTALEZA;22112;WERUSKA AGUIAR;113;26;;1;IFCE - INST FEDERAL DE CIÊNCIA E TECNOLOGIA (CEFET);AV. 13 DE MAIO, 2081;BENFICA;
2024;1;FORTALEZA;22112;WERUSKA AGUIAR;113;57;;1;COLÉGIO FARIAS BRITO;RUA SENADOR POMPEU, 2607;JOSÉ BONIFÁCIO;
2024;1;FORTALEZA;22112;WERUSKA AGUIAR;113;155;;1;COLÉGIO MEDALHA MILAGROSA;RUA PADRE JOÃO PIAMARTA,  415;BOM FUTURO;
2024;1;FORTALEZA;22112;WERUSKA AGUIAR;113;194;;2;FACULDADE DE PSICOLOGIA DA UFC;AV. DA UNIVERSIDADE, 2762;BENFICA;
2024;1;FORTALEZA;22112;WERUSKA AGUIAR;113;203;;1;COLÉGIO CHRISTUS PRÉ - UNIVERSITÁRIO;RUA CRUZ SALDANHA, 614;PARQUELÂNDIA;
2024;1;FORTALEZA;22112;WERUSKA AGUIAR;113;207;;1;COLÉGIO CHRISTUS PRÉ - UNIVERSITÁRIO;RUA CRUZ SALDANHA, 614;PARQUELÂNDIA;
2024;1;FORTALEZA;22112;WERUSKA AGUIAR;113;216;;1;COLÉGIO DEOCLÉCIO FERRO;RUA MINERVINO DE CASTRO, 987;RODOLFO TEÓFILO;
2024;1;FORTALEZA;22112;WERUSKA AGUIAR;113;224;;1;COLÉGIO MANUELITO AZEVEDO;RUA TIRADENTES, 483;RODOLFO TEÓFILO;
2024;1;FORTALEZA;22112;WERUSKA AGUIAR;113;229;;1;CEI FRANCISCO EURIVÁ MATIAS;RUA FREI MARCELINO, S/N;RODOLFO TEÓFILO;
2024;1;FORTALEZA;22112;WERUSKA AGUIAR;113;247;;1;EEFM SANTO AFONSO;RUA GAL. BERNARDO FIGUEIREDO, 2670;PARQUELÂNDIA;
2024;1;FORTALEZA;22112;WERUSKA AGUIAR;113;254;;1;EEFM SANTO AFONSO;RUA GAL. BERNARDO FIGUEIREDO, 2670;PARQUELÂNDIA;
2024;1;FORTALEZA;22112;WERUSKA AGUIAR;113;255;;2;EEF MONSENHOR LINHARES;RUA PROF. LINO ENCARNAÇÃO, 1130;AMADEU FURTADO;
2024;1;FORTALEZA;22112;WERUSKA AGUIAR;113;258;;2;EEF MONSENHOR LINHARES;RUA PROF. LINO ENCARNAÇÃO, 1130;AMADEU FURTADO;
2024;1;FORTALEZA;22112;WERUSKA AGUIAR;113;262;;1;EEF MONSENHOR LINHARES;RUA PROF. LINO ENCARNAÇÃO, 1130;AMADEU FURTADO;
2024;1;FORTALEZA;22112;WERUSKA AGUIAR;113;263;;1;EEF MONSENHOR LINHARES;RUA PROF. LINO ENCARNAÇÃO, 1130;AMADEU FURTADO;
2024;1;FORTALEZA;22112;WERUSKA AGUIAR;113;267;;1;ESC. MUNICIPAL ANTONIO SALES RODOLFO TEÓFILO;RUA TAVARES IRACEMA, 675;RODOLFO TEÓFILO;
2024;1;FORTALEZA;22112;WERUSKA AGUIAR;113;280;;1;COLÉGIO CHRISTUS PRÉ - UNIVERSITÁRIO;RUA CRUZ SALDANHA, 614;PARQUELÂNDIA;
2024;1;FORTALEZA;22112;WERUSKA AGUIAR;113;317;;1;EEF MONSENHOR LINHARES;RUA PROF. LINO ENCARNAÇÃO, 1130;AMADEU FURTADO;
2024;1;FORTALEZA;22112;WERUSKA AGUIAR;113;330;;1;ESCOLA ESTADUAL DE EDUCAÇÃO PROFISSIONAL  PRESIDENTE ROOSEVELT;AV BEZERRA DE MENEZES 435;FARIAS BRITO;
2024;1;FORTALEZA;22112;WERUSKA AGUIAR;113;345;;1;ESCOLA ESTADUAL DE EDUCAÇÃO PROFISSIONAL JOAQUIM NOGUEIRA;RUA MOREIRA DE SOUSA, 327;PARQUELÂNDIA;
2024;1;FORTALEZA;22112;WERUSKA AGUIAR;113;348;;1;SECRETARIA EXECUTIVA REGIONAL III - FORTALEZA;AV JOVITA FEITOSA 3090;PARQUELÂNDIA;
2024;1;FORTALEZA;22112;WERUSKA AGUIAR;113;350;;1;SECRETARIA EXECUTIVA REGIONAL III - FORTALEZA;AV JOVITA FEITOSA 3090;PARQUELÂNDIA;
2024;1;FORTALEZA;22112;WERUSKA AGUIAR;113;401;;1;COLEGIO CWD-MAXIMUS;RUA DOM LINO, 301;PARQUELÂNDIA;
2024;1;FORTALEZA;22112;WERUSKA AGUIAR;113;405;;1;COLEGIO CWD-MAXIMUS;RUA DOM LINO, 301;PARQUELÂNDIA;
2024;1;FORTALEZA;22112;WERUSKA AGUIAR;113;440;;1;COLEGIO CWD-MAXIMUS;RUA DOM LINO, 301;PARQUELÂNDIA;
2024;1;FORTALEZA;22112;WERUSKA AGUIAR;114;134;;1;EEFM ESTADO DE ALAGOAS;AVENIDA PRESIDENTE CASTELO BRANCO, 5244;BARRA DO CEARÁ;
2024;1;FORTALEZA;22112;WERUSKA AGUIAR;114;145;;1;EEMTI PROFESSORA BALBINA JUCA ALBUQUERQUE;AVENIDA MAJOR ASSIS 346;JARDIM IRACEMA;
2024;1;FORTALEZA;22112;WERUSKA AGUIAR;114;182;;1;EEMTI WALDEMAR FALCÃO;RUA ANTONIO JOAQUIM DE CARVALHO 19;ÁLVARO WEYNE;
2024;1;FORTALEZA;22112;WERUSKA AGUIAR;114;234;;1;CAPELA NOSSA SENHORA DE FÁTIMA;RUA RIO ARAGUAIA 1669;JARDIM IRACEMA;
2024;1;FORTALEZA;22112;WERUSKA AGUIAR;114;235;;1;CAPELA NOSSA SENHORA DE FÁTIMA;RUA RIO ARAGUAIA 1669;JARDIM IRACEMA;
2024;1;FORTALEZA;22112;WERUSKA AGUIAR;114;236;;1;CAPELA NOSSA SENHORA DE FÁTIMA;RUA RIO ARAGUAIA 1669;JARDIM IRACEMA;
2024;1;FORTALEZA;22112;WERUSKA AGUIAR;114;243;;1;CENTRO DE EDUCAÇÃO COMPLEMENTAR (CEDCE) - ANTIGO SESI;AVENIDA FRANCISCO SÁ 6623;BARRA DO CEARÁ;
2024;1;FORTALEZA;22112;WERUSKA AGUIAR;115;61;;1;EM PROF. JOSE VALDIVINO DE CARVALHO;RUA GUARA, S/N;PARANGABA;
2024;1;FORTALEZA;22112;WERUSKA AGUIAR;115;101;;1;EMTI CAROLINO SUCUPIRA;RUA MUNDICA PAULA, 670;PARANGABA;
2024;1;FORTALEZA;22112;WERUSKA AGUIAR;115;463;;1;EM HENRIQUETA GALENO;RUA MAJOR MONTENEGRO 917;MANOEL SÁTIRO;
2024;1;FORTALEZA;22112;WERUSKA AGUIAR;116;23;;1;CEI REITOR ANTONIO MARTINS FILHO - UNIDADE 2;RUA HUMBERTO LOMEU 1220;GRANJA PORTUGAL;
2024;1;FORTALEZA;22112;WERUSKA AGUIAR;116;123;;1;EEFM PROF JOCIE CAMINHA DE MENEZES;RUA ITU 120;GRANJA PORTUGAL;
2024;1;FORTALEZA;22112;WERUSKA AGUIAR;117;156;;1;EEEP DARCY RIBEIRO;RUA CONEGO DE CASTRO, S/N;CONJUNTO ESPERANÇA;
2024;1;FORTALEZA;22112;WERUSKA AGUIAR;117;292;;1;EEEP DARCY RIBEIRO;RUA CONEGO DE CASTRO, S/N;CONJUNTO ESPERANÇA;
2024;1;FORTALEZA;22112;WERUSKA AGUIAR;117;313;;1;CENTRO CULTURAL CANINDEZINHO;AV. OSÓRIO DE PAIVA, 6297;CANINDEZINHO;
2024;1;FORTALEZA;22112;WERUSKA AGUIAR;117;423;;1;EEEP DARCY RIBEIRO;RUA CONEGO DE CASTRO, S/N;CONJUNTO ESPERANÇA;
2024;1;FORTALEZA;22112;WERUSKA AGUIAR;118;212;;1;EEMTI INTEGRADA 2 DE MAIO;AVENIDA DA SAUDADE, S/N;PASSARÉ;
2024;1;FORTALEZA;22112;WERUSKA AGUIAR;118;382;;1;EM MANUEL LIMA SOARES;RUA 130, 60 (CJ TUPAN MIRIM);PARQUE DOIS IRMÃOS;
2024;1;FORTALEZA;22112;WERUSKA AGUIAR;118;596;;1;EEMTI PADRE GUILHERME WAESSEN;RUA BOA VENTURA 916;DIAS MACEDO;
2024;1;FORTALEZA;22112;WERUSKA AGUIAR;118;603;;1;EM CASIMIRO MONTENEGRO;AV. BERNARDO MANUEL, 11360;MONDUBIM;
2024;1;FORTALEZA;22112;WERUSKA AGUIAR;118;604;;1;EM CASIMIRO MONTENEGRO;AV. BERNARDO MANUEL, 11360;MONDUBIM;
TOTAL;;;;;;;;132;
